user_input,retrieved_contexts,response,reference,faithfulness,answer_relevancy,context_precision,context_recall
What is the prerequisite for 'Advanced Calculus'?,"['calculation communication and information technology adeptness Course 1 2 3 4 5 1 2 3 4 5 1 2 3 4 5 1 2 3 4 5 1 2 3 4 5 CORE COURSE 01006710 Introduction to Calculus 01006711 Advanced Calculus 01006723 General Physics 1 01006724 General Physics Laboratory 1 01006725 General Physics 2 01006726 General Physics Laboratory 2 01006803 Engineering Mechanics 01416310 Strength of Materials FUNDAMENTAL COURSE', 'Mathematical induction Introduction to derivative Differentiation Applications of derivative Definite integrals Antiderivative integration Application of definite integral Indeterminate forms Improper integrals Numerical integration Sequences and series of numbers Taylor series expansions of elementary functions vector analysis 01006711 ADVANCED CALCULUS 3 306 PREREQUISITE 01006710 INTRODUCTION TO CALCULUS', 'and correct word forms word order spelling and punctuation Students will also develop the ability to write varied complex sentences and effective paragraphs in standard written English 01006003 INTERPRETATION AND ARGUMENTS 3 306 PREREQUISITE NONE This course provides the study of interpreting and analyzing written and visual arguments Students will learn to identify the underlying values definitions and', 'graduates to attain the program educational objectives which adhere to ABET student outcomes for the engineering program 1 an ability to apply knowledge of mathematics science and engineering 2 an ability to design and conduct experiments as well as to analyze and interpret data 3 an ability to design an innovative system component or process to meet desired needs within realistic constraints such as', '4 an ability to function on multidisciplinary teams 6 an understanding of professional and ethical responsibility 5 Skills for Mathematical Calculation 7 an ability to communicate effectively Communication and Information 8 an ability to use the techniques skills and modern engineering tools necessary for engineering practice Technology Adeptness 50 3 Curriculum Mapping Illustrating the Distribution of', 'in threedimensional space Calculus of real valued functions in threedimensional space Principal theory for applications such as Greens theorem divergence theorem Gauss theorem Stokes theorem etc 01006723 GENERAL PHYSICS 1 3 306 PREREQUISITE NONE This course covers basic physics and mechanics including a study of motion space and time kinematics Newtons law of motion forces energy and momentum work power', 'relation skills and responsibility 5 Skills for mathematical calculation communication and information technology adeptness Course 1 2 3 4 5 1 2 3 4 5 1 2 3 4 5 1 2 3 4 5 1 2 3 4 5 GENED MATH AND SCIENCE 01006719 PROBABILITY AND STATISTICS 1 01006720 PROBABILITY AND STATISTICS 2 01006721 NUMERICAL METHODS 01006727 GENERAL CHEMISTRY 01006728 GENERAL CHEMISTRY LABORATORY 01006729 INTRODUCTION TO OPERATIONS', 'CALCULUS 3 306 01006725 GENERAL PHYSICS 2 3 306 01006726 GENERAL PHYSICS LABORATORY 2 1 032 01416318 MICROPROCESSOR AND INTERFACE 3 225 01416514 ROBOTICS LABORATORY 1 1 036 01416001 ESL ACADEMIC READING AND WRITING 3 306 TOTAL CREDITS 20 32 2nd YEAR 1st SEMESTER CODE SUBJECT CREDITS LES 01416312 ELECTRIC CIRCUIT AND ELECTRONICS 3 306 01416301 DIFFERENTIAL EQUATIONS AND MATRIX ALGEBRA 3 306 01416515 ROBOTICS', 'occupational or professional skill and life skills 3 Criteria for Graduation According to the Program Students must complete at least 131 credits to graduate with at least 30 credits from general education courses at least 95 credits from Robotics and AI concentration and at least 6 credits of free electives and English proficiency level prior to the graduation Students must also complete the internship', '1 102 PREREQUISITE NONE This course consists of a series of lectures given by different faculty members and distinguished speakers from the academic and industries The lectures are designed to provide students a good understanding of each curriculum structure and the courses in each subject areas Students will be introduced to emerging trends in Engineering and the relevance of our courses New courses and', '5 Skills for mathematical calculation communication and information technology adeptness Course 1 01416617 Pneumatic and Hydraulic System Design and Control 01416618 Advanced Artificial Intelligent Technology 01416619 User Experience and User Interface Design 01416620 Blockchain Technology and Application 01416621 Lean Management 01416522 Big Data 01416523 IT Project Management 01416628 Experience and', '2 1 032 PREREQUISITE 01006723 GENERAL PHYSICS 1 The experiments that correspond to the subject in 01006725 General Physics 2 01006803 ENGINEERING MECHANICS 3 306 PREREQUISITE NONE Force systems resultant equilibrium fluid statics kinematics and kinetics of particles and rigid bodies Newtons second law of motion work and energy impulse and momentum 01006310 STRENGTH OF MATERIALS 3 306 PREREQUISITE NONE', 'PROGRAM Only students in UoB 22 Dual Degree program may choose the courses in this course 01416802 ADVANCED ENGINEERING MATHEMATICS B ROBOTICS AND AI COURSE SPECIFIC COURSES B1 CORE COURSE 01006710 01006711 01006723 01006724 01006725 01006726 01006803 01416310 4 408 95 CREDITS LECTURELABSELF STUDY INTRODUCTION TO CALCULUS ADVANCED CALCULUS GENERAL PHYSICS 1 GENERAL PHYSICS LABORATORY 1 GENERAL PHYSICS 2', '1 GENERAL PHYSICS LABORATORY 1 GENERAL PHYSICS 2 GENERAL PHYSICS LABORATORY 2 ENGINEERING MECHANICS STRENGTH OF MATERIALS B2 MAJOR COMPULSORY COURSE B21 FUNDAMENTAL SUBJECTS 01416301 DIFFERENTIAL EQUATIONS AND MATRIX ALGEBRA 01416304 FEEDBACK CONTROL 01416305 ARTIFICIAL INTELLIGENCE TECHNOLOGY 01416306 SAFETY AND STANDARDIZATION IN RAI 3 01416308 KINEMATICS AND DYNAMICS 01416309 ENGIEERING 3D DRAWING', 'MATHEMATICS ELECTIVE 3 306 01416310 STRENGTH OF MATERIALS 3 306 01416308 KINEMATICS AND DYNAMICS 3 306 01416305 ARTIFICIAL INTELLIGENCE TECHNOLOGY 3 306 01416516 ROBOTICS LABORATORY 3 1 036 01416500 Computer vision RAI Elective mandatory Subject 3 306 XXXXXXX GENED ELECTIVE 3 306 TOTAL CREDITS 19 33 3rd YEAR 1st SEMESTER CODE SUBJECT CREDITS LES 01416801 MATHEMATICS OF DATA SCIENCE AND DATA ANALYTIC GENED', 'TECHNOLOGY 3 306 PREREQUISITE NONE This course will help students improve their critical thinkinganalytical skills through a combination of reading articles listening to lectures and watching audiovisual programs on current hot topics in science and technology Students will have directed practice in various areas of pronunciation such as stress intonation reductions ie informal speech linking consonant and', '2 Have acquired knowledge and understandings of important principles and theories of the subjects in the engineering field 3 Be able to integrate the knowledge in their field of study with the knowledge in other fields 4 Be able to analyze problems understand and explain computing requirements as well as be able to apply knowledge skills and the usage of suitable tools for solving problems 5 Be able to use', 'practice The outcomes can be presented progressively by following yearly basis as articulately shown in Table below Year Expected Learning Outcomes 1 2 ability to learn and apply knowledge of mathematics science and engineering ability to read draw apply engineering drawing ability to create algorithm understand and write codes using computer languages for engineering problem solving ability to design and', 'as to analyze and interpret data 5 an ability to identify formulate and solve engineering problems 9 a recognition of the need for and an ability to engage in lifelong learning 10 a knowledge of contemporary issues 11 an ability to use the techniques skills and modern engineering tools necessary for engineering practice 4 Human Relation Skills and Responsibility 4 an ability to function on multidisciplinary', 'skillsets and characteristics streamlined to institutional engineering set Strategies EvidenceIndicator 1 Adjusting engineering to an Outcomebased curriculum by ABET guidelines for undergraduate graduate and doctoral degrees 2 Organize Student Centric teachinglearning environments to facilitate and maximize active learning 3 Facilitate authentic learning or work integrated teachinglearning environments 4']",The prerequisite for 'Advanced Calculus' is 'Introduction to Calculus'.,01006710 Introduction to Calculus.,1.0,0.9999999999999998,0.7435897435649573,1.0
What topics are covered in 'General Physics 1'?,"['2 1 032 PREREQUISITE 01006723 GENERAL PHYSICS 1 The experiments that correspond to the subject in 01006725 General Physics 2 01006803 ENGINEERING MECHANICS 3 306 PREREQUISITE NONE Force systems resultant equilibrium fluid statics kinematics and kinetics of particles and rigid bodies Newtons second law of motion work and energy impulse and momentum 01006310 STRENGTH OF MATERIALS 3 306 PREREQUISITE NONE', 'GENERAL PHYSICS 1 3 306 103 This course provides the physical science required to analyze electrical and electronic devices Covered topics include electrostatics and electromagnetics electric field and potential conductors insulators capacitors dielectrics electric current electric circuits magnetic fields and electromagnetism 01006726 GENERAL PHYSICS LABORATORY 2 1 032 PREREQUISITE 01006723 GENERAL PHYSICS', '1 GENERAL PHYSICS LABORATORY 1 GENERAL PHYSICS 2 GENERAL PHYSICS LABORATORY 2 ENGINEERING MECHANICS STRENGTH OF MATERIALS B2 MAJOR COMPULSORY COURSE B21 FUNDAMENTAL SUBJECTS 01416301 DIFFERENTIAL EQUATIONS AND MATRIX ALGEBRA 01416304 FEEDBACK CONTROL 01416305 ARTIFICIAL INTELLIGENCE TECHNOLOGY 01416306 SAFETY AND STANDARDIZATION IN RAI 3 01416308 KINEMATICS AND DYNAMICS 01416309 ENGIEERING 3D DRAWING', 'of motion forces energy and momentum work power conservation laws systems of particles linear momentum circular motion rotation torques harmonic oscillation and gravitation 01006724 GENERAL PHYSICS LABORATORY 1 1 032 PREREQUISITE NONE The experiments that correspond to the subject in 01006723 General Physics 1 01006725 GENERAL PHYSICS 2 PREREQUISITE 01006723 GENERAL PHYSICS 1 3 306 103 This course provides', 'in threedimensional space Calculus of real valued functions in threedimensional space Principal theory for applications such as Greens theorem divergence theorem Gauss theorem Stokes theorem etc 01006723 GENERAL PHYSICS 1 3 306 PREREQUISITE NONE This course covers basic physics and mechanics including a study of motion space and time kinematics Newtons law of motion forces energy and momentum work power', '3 306 01006723 GENERAL PHYSICS 1 3 306 01006724 GENERAL PHYSICS LABORATORY 1 1 032 01416309 ENGINEERING 3D DRAWING 3 225 XXXXXXX GENED ELECTIVE 3 306 01416000 ESL ACADEMIC LISTENING AND SPEAKING 3 306 TOTAL CREDITS 19 1st YEAR 2nd SEMESTER CODE SUBJECT CREDITS LES 01416320 INTRODUCTION TO ROBOTICS AND AI 3 306 01006803 ENGINEERING MECHANICS 3 306 01006711 ADVANCED CALCULUS 3 306 01006725 GENERAL PHYSICS 2 3', '1 102 PREREQUISITE NONE This course consists of a series of lectures given by different faculty members and distinguished speakers from the academic and industries The lectures are designed to provide students a good understanding of each curriculum structure and the courses in each subject areas Students will be introduced to emerging trends in Engineering and the relevance of our courses New courses and', 'CALCULUS 3 306 01006725 GENERAL PHYSICS 2 3 306 01006726 GENERAL PHYSICS LABORATORY 2 1 032 01416318 MICROPROCESSOR AND INTERFACE 3 225 01416514 ROBOTICS LABORATORY 1 1 036 01416001 ESL ACADEMIC READING AND WRITING 3 306 TOTAL CREDITS 20 32 2nd YEAR 1st SEMESTER CODE SUBJECT CREDITS LES 01416312 ELECTRIC CIRCUIT AND ELECTRONICS 3 306 01416301 DIFFERENTIAL EQUATIONS AND MATRIX ALGEBRA 3 306 01416515 ROBOTICS', 'Course 1 01416630 Information System Security and IT Law 01416631 Robotics and AI Experience 01416632 Space Science 01416633 REINFORCEMENT LEARNING 01416634 INTRODUCTION TO PROMPT ENGINERRING 01416635 ADVANCED TECHNIQUES IN ChatGPT CUSTOMIZATION AND APPLICATION 01006006 Industrial Experience for Engineers 09106400 Materials Investigation 09106401 Photonics 09106402 Smart Material for Energy Storage 09106403', 'calculation communication and information technology adeptness Course 1 2 3 4 5 1 2 3 4 5 1 2 3 4 5 1 2 3 4 5 1 2 3 4 5 CORE COURSE 01006710 Introduction to Calculus 01006711 Advanced Calculus 01006723 General Physics 1 01006724 General Physics Laboratory 1 01006725 General Physics 2 01006726 General Physics Laboratory 2 01006803 Engineering Mechanics 01416310 Strength of Materials FUNDAMENTAL COURSE', 'Topics in microeconomics studied include demand and supply price elasticities consumer behavior theory production and cost theory and perfect and imperfect competitions Macroeconomics topics studied include aggregate demand and supply macroeconomic data eg gross domestic product national income etc management of economic growth inflation problems unemployment problems money and banking systems fiscal and', 'provides a study of the thing we call science together with its nature and methodology The topics cover the meaning of science reality the nature of scientific observations scientific theories and their discovery and formation scientific explanations and predictions the problem of induction scientific rationality the nature of scientific knowledge concepts of truth hypothesis testing hypothesis confirmation', 'PROGRAM Only students in UoB 22 Dual Degree program may choose the courses in this course 01416802 ADVANCED ENGINEERING MATHEMATICS B ROBOTICS AND AI COURSE SPECIFIC COURSES B1 CORE COURSE 01006710 01006711 01006723 01006724 01006725 01006726 01006803 01416310 4 408 95 CREDITS LECTURELABSELF STUDY INTRODUCTION TO CALCULUS ADVANCED CALCULUS GENERAL PHYSICS 1 GENERAL PHYSICS LABORATORY 1 GENERAL PHYSICS 2', 'an overview of network theory and research in applied 116 mathematics physics and engineering The second part of the course examines a wide range of CPR applications and presents open problems calling for innovative solutions that take into account network complexity Students will become familiar with ongoing research in the field and will get a chance to apply their knowledge of theoretical concepts to', 'will be drawn from such areas as environmental materials and biological chemistry 101 01006728 GENERAL CHEMISTRY LABORATORY 1 032 PREREQUISITE NONE The experiments that correspond to the subject in 01006726 General Chemistry 01006729 INTRODUCTION TO OPERATIONS RESEARCH 3 306 PREREQUISITE NONE Analysis and planning of complex systems Mathematical modelling to model formulation Linear and Integer Programming', 'FOR MECHATRONICS 3 306 COMPUTER AID MECHANICAL DESIGN 3 306 FLUID MECHANICS 3 306 INTRODUCTION TO NANOTECHNOLOGY AND NANOSCIENCE 3 306 INTRODUCTION TO MEMS 3 306 INTRODUCTION TO DATA SCIENCE 3 306 INFORMATION SYSTEMS DATABASES AND APPLICATION 3 306 DEEP LEARNING APPLICATION 3 306 COMPUTER VISIONS 3 306 DESIGNING COMPUTER VISION APPLICATIONS 3 306 MACHINE LEARNING IN PRACTICE 3 306 INTERNET OF THINGS AND', 'also learn the use of equivalent circuit models that describe the operation of these devices and how they can be used to design circuits that provide important electronic functions 01416315 INDUSTRIAL ELECTRONICS 3 306 PREREQUISITE NONE Topics covered include modeling analysis and control techniques design of power circuits including inverters rectifiers and DCDC converters analysis and design of magnetic', 'and appreciate the linkage between curriculum and practice Students will develop specific skills both on engineering and professionals including handson experience or research experience required to their professional careers 01416632 SPACE SCIENCE 4408 PREREQUISITE NONE This course provides a study of the Solar system such as the planets and minor members of the system Telescopes the Sun the birth life and', 'MATHEMATICS ELECTIVE 3 306 01416310 STRENGTH OF MATERIALS 3 306 01416308 KINEMATICS AND DYNAMICS 3 306 01416305 ARTIFICIAL INTELLIGENCE TECHNOLOGY 3 306 01416516 ROBOTICS LABORATORY 3 1 036 01416500 Computer vision RAI Elective mandatory Subject 3 306 XXXXXXX GENED ELECTIVE 3 306 TOTAL CREDITS 19 33 3rd YEAR 1st SEMESTER CODE SUBJECT CREDITS LES 01416801 MATHEMATICS OF DATA SCIENCE AND DATA ANALYTIC GENED', 'areas Each semester will include a project based theme which helps students practice and design innovative solutions in the respective areas In the first year the students study basic courses in mathematics and science and improve their communication skills Students will also be introduced to fundamental programming concepts and the foundation of robotics systems The firstyear projects will give students']","The course 'General Physics 1' covers basic physics and mechanics, including a study of motion, space and time, kinematics, Newton's law of motion, forces, energy and momentum, work, and power.","Motion, kinematics, Newton's laws, energy, and momentum.",1.0,0.9708059465862859,0.6999999999766667,1.0
What is the credit structure (L-E-S) for 'Computer Programming for RAI'?,"['Capstone Projects 6 6 B23 RAI Elective Mandatory Subjects 18 15 B24 RAI Elective Subjects 12 9 B25 Alternative Study 6 C Free Electives 6 6 D Internship 0 0 131 131 Course Group A General Education B Robotics and AI Specific Courses TOTAL Credits For Regular Students 24 313 Subjects One academic credit is given to a course offered in a single semester which Meets in class for lecture or discussion for 1', 'CREDITS LES XXXXXXX GENED ELECTIVE 3 306 01416315 INDUSTRIAL ELECTRONICS 3 306 0141XXXX RAI Elective mandatory subject 3 306 XXXXXXX FREE ELECTIVE 3 XXX 01416701 RAI ENGINEERING CAPSTONE DESIGN PREPARATION 3 095 TOTAL CREDITS 15 3rd YEAR 3rd SEMESTER SUMMER CODE 01006805 SUBJECT INDUSTRIAL INTERNSHIP TOTAL CREDITS CREDITS LES 0 0450 0 34 FOR REGULAR STUDENTS 4th YEAR 1st SEMESTER CODE SUBJECT CREDITS LES', '3 095 TOTAL CREDITS 9 35 FOR COOPSTUDY ABROAD STUDENTS 4th YEAR 1st SEMESTER CODE 01006301 or 01006302 SUBJECT CREDITS LES COOPERATIVE EDUCATION or STUDY ABROAD 6 0450 or 6 6012 TOTAL CREDITS 6 4th YEAR 2nd SEMESTER CODE SUBJECT CREDITS LES XXXXXXX GENED ELECTIVE 3 306 XXXXXXX FREE ELECTIVE 3 XXX 0141XXXX RAI Elective subject 3 306 0141XXXX RAI Elective subject 3 306 01416702 RAI ENGINEERING CAPSTONE DESIGN', 'hours S Selfstudy hours This study plan shows courses with credits equivalent to 3 However students can register 4 credit courses as well The total number of credits in each subject category will be counted toward the graduation 31 1st YEAR 1st SEMESTER CODE SUBJECT CREDITS LES 01416316 COMPUTER PROGRAMMING FOR RAI 3 225 01006710 INTRODUCATION TO CALCULUS 3 306 01006723 GENERAL PHYSICS 1 3 306 01006724', '4th YEAR 1st SEMESTER CODE SUBJECT CREDITS LES XXXXXXX FREE ELECTIVE 3 XXX XXXXXXX GENED ELECTIVE 3 306 0141XXXX RAI Elective mandatory subject 3 306 0141XXXX RAI Elective subject 3 306 TOTAL CREDITS 12 4th YEAR 2nd SEMESTER CODE SUBJECT CREDITS LES 0141XXXX RAI Elective subject 3 306 0141XXXX RAI Elective subject 3 306 01416702 RAI ENGINEERING CAPSTONE DESIGN 3 095 TOTAL CREDITS 9 35 FOR COOPSTUDY ABROAD', '3 306 01416702 RAI ENGINEERING CAPSTONE DESIGN 3 095 TOTAL CREDITS 15 Total credits required for graduation at least 315 Details of Each Subject Course description Appendix C 131 credits 36 32 Name Surname ID Number Position and Qualification of Instructors 321 Executive Program Committees NameSurname Academic Position ID Number Assoc Prof Dr Pitikhate Sooraksa Electrical Engineering Assoc Prof Dr Chutimet', 'OF DATA SCIENCE AND DATA ANALYTIC GENED SCIENCE MATHEMATICS ELECTIVE 3 306 01416306 SAFTY AND STANDARDIZATION IN RAI 3 306 01416319 MANUFACTURING PROCESS 3 306 01006718 DISCRETE MATHEMATICS RAI Elective mandatory Subject 3 306 0141XXXX RAI Elective mandatory subject 3 306 0141XXXX RAI Elective subject 3 306 TOTAL CREDITS 18 3rd YEAR 2nd SEMESTER CODE SUBJECT CREDITS LES XXXXXXX GENED ELECTIVE 3 306 01416315', 'MATHEMATICS ELECTIVE 3 306 01416310 STRENGTH OF MATERIALS 3 306 01416308 KINEMATICS AND DYNAMICS 3 306 01416305 ARTIFICIAL INTELLIGENCE TECHNOLOGY 3 306 01416516 ROBOTICS LABORATORY 3 1 036 01416500 Computer vision RAI Elective mandatory Subject 3 306 XXXXXXX GENED ELECTIVE 3 306 TOTAL CREDITS 19 33 3rd YEAR 1st SEMESTER CODE SUBJECT CREDITS LES 01416801 MATHEMATICS OF DATA SCIENCE AND DATA ANALYTIC GENED', '01006304 COOPERATIVE EDUCATION STUDY ABROAD OVERSEA TRAINING 6 0450 6 6012 6 0450 C FREE ELECTIVES 6 CREDITS Students must complete at least 6 additional credits from any courses offered by the institution D RAI INTERNSHIP 01006805 0 CREDITS INDUSTRIAL INTERNSHIPS 314 Recommended Study Plan 0 0450 Credit Notation L E S L Lecture Learning hours E Laboratory hours S Selfstudy hours This study plan shows', '3 306 01006723 GENERAL PHYSICS 1 3 306 01006724 GENERAL PHYSICS LABORATORY 1 1 032 01416309 ENGINEERING 3D DRAWING 3 225 XXXXXXX GENED ELECTIVE 3 306 01416000 ESL ACADEMIC LISTENING AND SPEAKING 3 306 TOTAL CREDITS 19 1st YEAR 2nd SEMESTER CODE SUBJECT CREDITS LES 01416320 INTRODUCTION TO ROBOTICS AND AI 3 306 01006803 ENGINEERING MECHANICS 3 306 01006711 ADVANCED CALCULUS 3 306 01006725 GENERAL PHYSICS 2 3', 'AND CONTROL SYSTEMS DIGITAL ELECTRONICS AND ELECTRICAL MACHINES 4 408 4 408 4 408 B24 RAI ELECTIVE SUBJECTS For Regular Students For UoB 22 Program Students For Coop Study Aboard Students 12 CREDITS 12 CREDITS 9 CREDITS 01416601 01416602 01416604 01416607 01416608 01416609 01416610 01416611 01416612 01416613 01416614 01416615 01416616 01416617 01416618 01416619 01416620 01416621 01416522 3 236 3 306 3 306 3', 'need 13 System Transfer of Credits in TwoSemester System Credits can be transferred upon the consent of executive program committee according to the Regulation of King Mongkuts Institute of Technology Ladkrabang regarding bachelor degree education year 2016 Appendix A and the Announcement of King Mongkuts Institute of Technology Ladkrabang regarding the crossinstitute registration of higher education', 'Design of UoB B22 CAPSTONE PROJECTS 01416701 RAI ENGINEERING CAPSTONE DESIGN PREPARATION 4 01416702 RAI ENGINEERING CAPSTONE DESIGN 5 4 compare to Module 04 29646 Integrated Design Project 3 of UoB 5 compare to Module 04 02279 Individual Project of UoB B23 RAI ELECTIVE MANDATORY SUBJECTS For Regular Students For UoB 22 Program Students For Coop Study Aboard Students 01416401 01416403 01416404 01416406', '01416310 Strength of Materials FUNDAMENTAL COURSE 01416301 Differential Equations and Matrix Algebra 53 1 Moral and ethics 2 Knowledge 3 Intellectual skills 4 Human relation skills and responsibility 5 Skills for mathematical calculation communication and information technology adeptness Course 1 01416304 Feedback Control 01416305 Artificial Intelligent Technology 01416306 Safety and Standardization in RAI', '1 Name of the Program Name of the program Thai Name of the program English 2 Degree and Major Full name Thai Full name English Abbreviation Thai Abbreviation English Bachelor of Engineering in Robotics and Artificial Intelligence Engineering International Program Bachelor of Engineering Robotics and AI Engineering BEng Robotics and AI Engineering 3 Major Field None 4 Total Credits At least 131 credits 5', 'for Graduation 312 Curriculum Structure Minimum Credits 131 credits For UoB 22 Program Students Credits For Coop Study Aboard Students 30 30 A1 English Proficiency Requirement ESL 9 9 A2 Communication Humanity and Social Skills 15 15 A3 Math and Science 6 6 95 95 B1 Core Courses 20 20 B2 Major Compulsory Courses 75 75 B21 Fundamental Subjects 39 39 B22 Capstone Projects 6 6 B23 RAI Elective Mandatory', '5th digit th th th 6 7 8 digit 01 41 00 6 means Faculty of Engineering means Robotics and AI program means shared courses means bachelor degree means Order of the subject 25 A GENERAL EDUCATION 30 CREDITS LECTURELABSELF STUDY A1 ENGLISH PROFICIENCY REQUIREMENT ESL 01416000 ACADEMIC LISTENING AND SPEAKING 01416001 ACADEMIC READING AND WRITING 01416003 INTERPRETATION AND ARGUMENTS 9 CREDITS 3 306 3 306 3 306', 'AND MATRIX ALGEBRA 3 306 01416515 ROBOTICS LABORATORY 2 1 036 01416304 FEEDBACK CONTROL 3 306 01416521 INTRODUCTION TO ALGORITHMS RAI Elective Mandatory Subject 3 306 XXXXXXX GENED ELECTIVE 3 306 01416003 ESL INTERPRETATION AND ARGUMENTS 3 306 TOTAL CREDITS 19 2nd YEAR 2nd SEMESTER CODE SUBJECT CREDITS LES 01006719 PROBABILITY AND STATISTICS 1 GENED SCIENCE MATHEMATICS ELECTIVE 3 306 01416310 STRENGTH OF', 'Field None 4 Total Credits At least 131 credits 5 Type of the Program 51 Level 4Year Bachelor Program 52 Program Category Academic bachelors degree program Academic bachelors degree program Advanced academic bachelors degree program 5 53 Medium of Instruction English 54 Admission Thai andor Foreign students 55 Collaboration with Other Institutes The program is in collaboration with many universities', 'CHEMISTRY LABORATORY 01006729 INTRODUCTION TO OPERATIONS RESEARCH 01416801 MATHEMATICS OF DATA SCIENCE AND DATA ANALYTIC 6 CREDITS 3 306 3 306 3 306 3 306 1 032 3 306 3 306 26 01006713 01006714 01006701 MATHEMATICAL CRYPTOGRAPHY 4 408 MATHEMATICS FOR 3D GAME AND COMPUTER GRAPHICS 4 408 MATHEMATICS OF DATA SCIENCE 4 408 TRACK UNIVERSITY OF BIRMINGHAM 22 DUAL DEGREE PROGRAM Only students in UoB 22 Dual Degree']",The credit structure (L-E-S) for 'Computer Programming for RAI' is 3-2-2.5.,3 (2-2-5).,0.5,0.9232416404916864,0.22407407406660496,0.0
