user_input,retrieved_contexts,response,reference,faithfulness,answer_relevancy,context_precision,context_recall
What is the English name of the program?,"['Groups in the Program Open by Other FacultiesDepartments Programs General Education subjects Free electives 132 Subjects Subject Groups in the Program Open and Required to be Studied by Other FacultiesDepartmentsPrograms Free electives 133 Management The executive program committee is primarily responsible for the program are the representatives to coordinate with the faculty institution instructors and', 'Other FacultiesDepartments 10 PART 2 SPECIFIC INFORMATION OF THE PROGRAM 11 1 Philosophy Importance and Objectives of the Program 11 2 Development Plan 14 3 Student Outcomes16 PART 3 SYSTEM FOR EDUCATIONAL PROVISION MANAGEMENT AND STRUCTURE OF THE PROGRAM 18 1 System for Educational Provision 18 2 Management of the Program18 3 Curriculum and Instructors22 2 4 Component Regarding Field Experience Internship', '21st August 2020 This program has started on 1st semester of academic year 2018 August 20118 7 Readiness for Publication as Qualified and Standardized Program This program is ready for announcement as qualified and standard program according to the qualification standard of higher education in engineering in 2010 in 2022 as well as the ABET Accreditation in 2022 8 Possible Career Path after Graduation', 'Responsible for The Program 139 4 BACHELOR OF ENGINEERING PROGRAM IN ROBOTICS and ARTIFICIAL INTELLIGENCE ENGINEERING INTERNATIONAL PROGRAM Revised 2020 Name of Educational Institute King Mongkuts Institute of Technology Ladkrabang FacultyDepartment Faculty of Engineering School of International Multidisciplinary Engineering Programs PART 1 GENERAL INFORMATION 1 Name of the Program Name of the program Thai', 'or academic training programs knowledge of contemporary issues via and ability to use the techniques skills and modern engineering tools necessary for engineering practice via RAI senior capstone projects 18 PART 3 SYSTEM FOR EDUCATIONAL PROVISION MANAGEMENT AND STRUCTURE OF THE PROGRAM 1 System for Educational Provision 11 System An academic year has two semesters each of which covers not less than 15', 'design or cooperative education internship program for Robotics and AI Arranging for knowledge exchange activity in the program for both theory and practice between instructors and students as well as collaboration projects between institutes for internships Arranging for an education that promotes students selflearning Arranging for subjects that allow group works and assign a leader for each group as well', 'Indicators Academic Year Indicator and Objective 1 At least 80 of the executive program committee of the program participate in the meeting for planning following and revising the operation of the program 2 Having the details of the program consistent with the national or international standard of qualification for the program 3 Having the course syllabus and details of each offered subject and planned', '1 Name of the Program Name of the program Thai Name of the program English 2 Degree and Major Full name Thai Full name English Abbreviation Thai Abbreviation English Bachelor of Engineering in Robotics and Artificial Intelligence Engineering International Program Bachelor of Engineering Robotics and AI Engineering BEng Robotics and AI Engineering 3 Major Field None 4 Total Credits At least 131 credits 5', '01416628 01416629 01416630 01416631 01416632 01416633 01416634 01416635 01006006 IT PROJECT MANAGEMENT EXPERIENCE AND EXERCISE FOR INTELLIGENT CONTROL SYSTEM INFORMATION AND CYBER SECURITY INFORMATION SYSTEM SECURITY AND IT LAW ROBOTICS AND AI EXPERIENCE SPACE SCIENCE REINFORCEMENT LEARNING INTRODUCTION TO PROMPT ENGINERRING ADVANCED TECHNIQUES IN ChatGPT CUSTOMIZATION AND APPLICATION INDUSTRIAL EXPERIENCE', 'Given to the Graduates Bachelor of Engineering from King Mongkuts Institute of Technology Ladkrabang 6 Status of the Program and Consideration for the AuthorizationAgreement The program has been endorsed by the Academic Committee of KMITL in its meeting on 23 June 2020 62020 This program has been approved by the University Council in the 72020 meeting no 21st August 2020 This program has started on 1st', 'Plan The executive program committees utilize the results of analysis and revision to create an improvement plan for the program so that its quality archives the required standards and discuss with the instructor 94 APPENDIX C Course Description 95 COURSE DESCRIPTION 1 GENERAL EDUCATION 11 ENGLISH PROFICIENCY REQUIREMENT ESL 01416000 ACADEMIC LISTENING AND SPEAKING 3 306 PREREQUISITE NONE The course', 'of the Operation According to the Details of the Program Having quality assurance system and provision of education according to the standard framework of qualification for higher education as well as ABET Accreditation by having key performance indicators and assessment criteria assigned by the Internal QA committee 4 Revision of the Evaluation and Improvement Plan The executive program committees utilize', 'a faculty member who is regarded as the student s supervisor The student must report progress to the supervisor regularly Upon completion the student must prepare and deliver oral presentations describing the work from the program 01006302 STUDY ABROAD 6 6012 PREREQUISITE NONE This course is reserved for students who participate in the study abroad program Upon the completion of the program the students', '3 306 PREREQUISITE NONE This course bridges the gap between academic and production software engineering The course provides fastpaced introduction to key tools and techniques used in successful startups and largescale projects command line dotfiles text editor distributed version control debugging testing documentation reading code deployments Students will learn to build a command line application expose', 'aforementioned skills of instructors 2 Evaluation of the Program as a Whole Picture The executive program committees evaluate the program as a whole picture when the teaching ends in each academic year by collecting information from students and graduates employers and or stakeholders experts industrial advisory boards or external evaluators 3 Evaluation of the Operation According to the Details of the', 'program and retain their fulltime student status 41 Standard for Learning Outcome from Field Experience 411 Possessing the skills to solve problems related to Robotics and AI 412 To be able to work with others as a team with responsibility 413 To be able to lead the member of the team appropriately 414 To be able to Integrate their knowledge to business solutions that apply the appropriate technology and', 'course to ensure that students are ready for their studies and to be able to complete theireducation for the duration of the program 32 The activities are organized to develop students knowledge abilities and potential in various ways to support 21stcentury learning skills 33 A consultant who is appointed for academic counseling and guidance to all students must schedule an appointment Office Hours for the', 'in each course have the knowledge ability and expertise in the course Moreoverthere is a system to monitor the preparation of learning plans and teaching and learning management 6 Educational Resources 61 Budget management a Surveying the need and sufficiency of educational resources b Instigating a plan for educational resources management c Allowing budget for durable articles equipment and learning', 'or Development Needed to be Considered for the Planning of the Program 9 12 Effects from 111 and 112 on the Development of the Program and the Relation to the Mission of the Institute 9 13 Relation if any with Other Programs Open in the FacultyOther Departments of the Institute ie Subjects Open for the Service of Other FacultiesDepartments or to Be Studied with Other FacultiesDepartments 10 PART 2 SPECIFIC', 'of the Teaching 65 2 Evaluation of the Program as a Whole Picture 65 3 3 Evaluation of the Operation According to the Details of the Program 65 4 Revision of the Evaluation and Improvement Plan 65 Appendix A The Regulation of King Mongkut s Institute of Technology Ladkrabang Regarding Bachelor Degree Education Year 2016 67 B The Announcement King Mongkuts Institute of Technology Ladkrabang Regarding the']","The English name of the program is ""Bachelor of Engineering in Robotics and Artificial Intelligence Engineering International Program.""",Bachelor of Engineering Program in Robotics and AI Engineering (International Program).,1.0,0.9999999999999999,0.2499999999875,1.0
What is the abbreviation for the degree in English?,"['5th digit th th th 6 7 8 digit 01 41 00 6 means Faculty of Engineering means Robotics and AI program means shared courses means bachelor degree means Order of the subject 25 A GENERAL EDUCATION 30 CREDITS LECTURELABSELF STUDY A1 ENGLISH PROFICIENCY REQUIREMENT ESL 01416000 ACADEMIC LISTENING AND SPEAKING 01416001 ACADEMIC READING AND WRITING 01416003 INTERPRETATION AND ARGUMENTS 9 CREDITS 3 306 3 306 3 306', 'is in collaboration with many universities according to the memorandum of understanding MOU such as College of Engineering Carnegie Mellon University the University of South Florida Imperial College Chubu University Kumamoto University BK Birla Institute of Engineering and Technology National Formosa University and South Eastern Regional College etc 56 Degree Given to the Graduates Bachelor of Engineering', '1 Name of the Program Name of the program Thai Name of the program English 2 Degree and Major Full name Thai Full name English Abbreviation Thai Abbreviation English Bachelor of Engineering in Robotics and Artificial Intelligence Engineering International Program Bachelor of Engineering Robotics and AI Engineering BEng Robotics and AI Engineering 3 Major Field None 4 Total Credits At least 131 credits 5', 's Institute of Technology Ladkrabang regarding bachelor degree education year 2016 Appendix A 210 Integrated MasterBachelor Program If a student is in the 2nd semester of their third year of study or has completed at least 81 credits with the overall GPA of at least 3 00 the student is guaranteed admission into the integrated master bachelor program in the department The student must also complete the', 'Field None 4 Total Credits At least 131 credits 5 Type of the Program 51 Level 4Year Bachelor Program 52 Program Category Academic bachelors degree program Academic bachelors degree program Advanced academic bachelors degree program 5 53 Medium of Instruction English 54 Admission Thai andor Foreign students 55 Collaboration with Other Institutes The program is in collaboration with many universities', 'or Criteria for Grading Regulations or criteria for grading are in accordance with the Regulations of King Mongkut s Institute of Technology Ladkrabang regarding Bachelors Degree Education 2016 Appendix A 2 Verification of Learning Achievement 21 Verification of Learning Achievement before Graduation Program committee assigned a responsible figure for the verification of learning achievement according to', 'diploma or a certificate of completion from their highschool education or equivalent study before their enrollment b Standardized test Students must obtain the standardized test scores as specified in the admission announcement c English Language Proficiency If prospective students are nonnative English speakers they must obtain the results of the Test of English as a Foreign Language TOEFL or the', 'other professions c Arranging for an exchange of instructors with both domestic and international institutes to increase the capability of instructors in both teaching and researching 63 PART 7 QUALITY ASSURANCE OF THE PROGRAM 1 Standardization The curriculum management is by the qualified and standardized program according to the qualification standard of higher education as well as the ABET Accreditation', 'Institute of Technology Ladkrabang Regarding the Cross Institute Registration of Higher Education 87 C Course Description 92 D Curriculum Mapping for General Education Course 117 E Facilities Supported Teaching and Learning 121 F Reason for Requesting to Revise Curriculum 129 G List of Program Development Committees 137 H The Academic Publication of Instructors Responsible for The Program 139 4 BACHELOR OF', 'It is in line with the announcement of the Higher Education Commission on English Proficiency Standards of Faculty Members 42 There is a management system for promoting and developing teachers appropriate and consistent with the universitys vision and policy 43 There is a system of teacher quality development to have professors in the field of teaching 5 Curriculum Teaching and Assessment of Learners 51', 'of English as a Foreign Language TOEFL or the International English Language Testing System IELTS in addition to the other required standardized test scores Other types of the accepted score will be specified in the admission announcement 19 d Personal Statement Students must obtain their personal statements along with the application as specified in the admission announcement e Teacher Recommendation', 'B Eng in Robotics and AI program is a four year full time undergraduate program In order to graduate the students must complete at least 131 credits Students must achieve the required English proficiency level prior to the graduation and satisfy the graduation requirements The program is designed to drive innovations and entrepreneurship in robotics and AI technologyrelated areas Each semester will include', 'Surname ID Number Position and Qualification of Instructors Responsible for the Program Executive Program Committee NameSurname Academic Position ID Number Qualification Department University Year of Graduation Academic Achievements Dr Poom Konghuayrob DEng Electrical Engineering King Mongkuts Institute of Technology Ladkrabang 2017 MEng Electrical Engineering King Mongkuts Institute of Technology', '4th YEAR 1st SEMESTER CODE SUBJECT CREDITS LES XXXXXXX FREE ELECTIVE 3 XXX XXXXXXX GENED ELECTIVE 3 306 0141XXXX RAI Elective mandatory subject 3 306 0141XXXX RAI Elective subject 3 306 TOTAL CREDITS 12 4th YEAR 2nd SEMESTER CODE SUBJECT CREDITS LES 0141XXXX RAI Elective subject 3 306 0141XXXX RAI Elective subject 3 306 01416702 RAI ENGINEERING CAPSTONE DESIGN 3 095 TOTAL CREDITS 9 35 FOR COOPSTUDY ABROAD', 'OF DATA SCIENCE AND DATA ANALYTIC GENED SCIENCE MATHEMATICS ELECTIVE 3 306 01416306 SAFTY AND STANDARDIZATION IN RAI 3 306 01416319 MANUFACTURING PROCESS 3 306 01006718 DISCRETE MATHEMATICS RAI Elective mandatory Subject 3 306 0141XXXX RAI Elective mandatory subject 3 306 0141XXXX RAI Elective subject 3 306 TOTAL CREDITS 18 3rd YEAR 2nd SEMESTER CODE SUBJECT CREDITS LES XXXXXXX GENED ELECTIVE 3 306 01416315', 'of the Operation According to the Details of the Program Having quality assurance system and provision of education according to the standard framework of qualification for higher education as well as ABET Accreditation by having key performance indicators and assessment criteria assigned by the Internal QA committee 4 Revision of the Evaluation and Improvement Plan The executive program committees utilize', 'crossinstitute registration of higher education Appendix B 2 Management of the Program 21 DateTime of the Course 1st semester August December 2nd semester January May Summer course June July The actual start and end dates for each academic year will be announced by the office of the registrar 22 Qualification of Applicants The general admission process starts from October RAI classes will begin in August of', '3 095 TOTAL CREDITS 9 35 FOR COOPSTUDY ABROAD STUDENTS 4th YEAR 1st SEMESTER CODE 01006301 or 01006302 SUBJECT CREDITS LES COOPERATIVE EDUCATION or STUDY ABROAD 6 0450 or 6 6012 TOTAL CREDITS 6 4th YEAR 2nd SEMESTER CODE SUBJECT CREDITS LES XXXXXXX GENED ELECTIVE 3 306 XXXXXXX FREE ELECTIVE 3 XXX 0141XXXX RAI Elective subject 3 306 0141XXXX RAI Elective subject 3 306 01416702 RAI ENGINEERING CAPSTONE DESIGN', 'to the Regulation of King Mongkuts Institute of Technology Ladkrabang regarding bachelor degree education year 2016 Appendix A and the Announcement of King Mongkuts Institute of Technology Ladkrabang regarding the crossinstitute registration of higher education Appendix C 29 Registration The registration system is according to the Regulation of King Mongkut s Institute of Technology Ladkrabang regarding', 'ie informal speech linking consonant and vowel production rhythm and pitch This course will help participants improve their oral presentation skills through an intercultural scientifictechnological research project This course is designed to inspire students to realize the power of R D ie research and development in science and technology through studying distinguished entrepreneurs 13 MATH AND SCIENCE']",The abbreviation for the degree in English is BEng Robotics and AI Engineering.,B.Eng. (Robotics and AI Engineering).,1.0,1.0000000000000002,0.0,1.0
How many credits are required for graduation?,"['occupational or professional skill and life skills 3 Criteria for Graduation According to the Program Students must complete at least 131 credits to graduate with at least 30 credits from general education courses at least 95 credits from Robotics and AI concentration and at least 6 credits of free electives and English proficiency level prior to the graduation Students must also complete the internship', 'for Graduation 312 Curriculum Structure Minimum Credits 131 credits For UoB 22 Program Students Credits For Coop Study Aboard Students 30 30 A1 English Proficiency Requirement ESL 9 9 A2 Communication Humanity and Social Skills 15 15 A3 Math and Science 6 6 95 95 B1 Core Courses 20 20 B2 Major Compulsory Courses 75 75 B21 Fundamental Subjects 39 39 B22 Capstone Projects 6 6 B23 RAI Elective Mandatory', 'Field None 4 Total Credits At least 131 credits 5 Type of the Program 51 Level 4Year Bachelor Program 52 Program Category Academic bachelors degree program Academic bachelors degree program Advanced academic bachelors degree program 5 53 Medium of Instruction English 54 Admission Thai andor Foreign students 55 Collaboration with Other Institutes The program is in collaboration with many universities', 'hours S Selfstudy hours This study plan shows courses with credits equivalent to 3 However students can register 4 credit courses as well The total number of credits in each subject category will be counted toward the graduation 31 1st YEAR 1st SEMESTER CODE SUBJECT CREDITS LES 01416316 COMPUTER PROGRAMMING FOR RAI 3 225 01006710 INTRODUCATION TO CALCULUS 3 306 01006723 GENERAL PHYSICS 1 3 306 01006724', '3 095 TOTAL CREDITS 9 35 FOR COOPSTUDY ABROAD STUDENTS 4th YEAR 1st SEMESTER CODE 01006301 or 01006302 SUBJECT CREDITS LES COOPERATIVE EDUCATION or STUDY ABROAD 6 0450 or 6 6012 TOTAL CREDITS 6 4th YEAR 2nd SEMESTER CODE SUBJECT CREDITS LES XXXXXXX GENED ELECTIVE 3 306 XXXXXXX FREE ELECTIVE 3 XXX 0141XXXX RAI Elective subject 3 306 0141XXXX RAI Elective subject 3 306 01416702 RAI ENGINEERING CAPSTONE DESIGN', '4th YEAR 1st SEMESTER CODE SUBJECT CREDITS LES XXXXXXX FREE ELECTIVE 3 XXX XXXXXXX GENED ELECTIVE 3 306 0141XXXX RAI Elective mandatory subject 3 306 0141XXXX RAI Elective subject 3 306 TOTAL CREDITS 12 4th YEAR 2nd SEMESTER CODE SUBJECT CREDITS LES 0141XXXX RAI Elective subject 3 306 0141XXXX RAI Elective subject 3 306 01416702 RAI ENGINEERING CAPSTONE DESIGN 3 095 TOTAL CREDITS 9 35 FOR COOPSTUDY ABROAD', 'Capstone Projects 6 6 B23 RAI Elective Mandatory Subjects 18 15 B24 RAI Elective Subjects 12 9 B25 Alternative Study 6 C Free Electives 6 6 D Internship 0 0 131 131 Course Group A General Education B Robotics and AI Specific Courses TOTAL Credits For Regular Students 24 313 Subjects One academic credit is given to a course offered in a single semester which Meets in class for lecture or discussion for 1', 'CREDITS LES XXXXXXX GENED ELECTIVE 3 306 01416315 INDUSTRIAL ELECTRONICS 3 306 0141XXXX RAI Elective mandatory subject 3 306 XXXXXXX FREE ELECTIVE 3 XXX 01416701 RAI ENGINEERING CAPSTONE DESIGN PREPARATION 3 095 TOTAL CREDITS 15 3rd YEAR 3rd SEMESTER SUMMER CODE 01006805 SUBJECT INDUSTRIAL INTERNSHIP TOTAL CREDITS CREDITS LES 0 0450 0 34 FOR REGULAR STUDENTS 4th YEAR 1st SEMESTER CODE SUBJECT CREDITS LES', '60 90 120 150 120 Estimated expenditure per person for producing a scholar according to the program equals to an average of 194613 bahtpersonyear 27 Educational System Class room 28 Transfer of Credits Subjects and Cross Institute Registration of Higher Education if any Credits can be transferred upon the consent of executive program committee according to the Regulation of King Mongkuts Institute of', 'Meets in class for lecture or discussion for 1 hour per week or Contains at least 3 laboratory hours per week Most courses are given 3 or more credits For 4 credit courses these courses usually contain 3 hours of lecture or discussion per week The courses are also accompanied with 1 additional hour of recitation or 3 hours of laboratory work per week Students enrolled in the courses are also expected to', 'and Estimated Graduation in 5 Years Academic Year Number of Students 1st year 2020 2021 2022 2023 2024 60 30 30 30 30 60 30 30 30 60 30 30 60 30 2nd year 3rd year 4th year Total 60 90 120 150 120 Estimated to Graduate 60 30 26 Planned Budget Academic Year 2020 2021 2022 2023 2024 1 Personnel 2157500 2912917 3879250 4119250 4119250 Teaching Personnel 1017500 1606250 2191250 2431250 2431250 Administrative', '3 306 01416702 RAI ENGINEERING CAPSTONE DESIGN 3 095 TOTAL CREDITS 15 Total credits required for graduation at least 315 Details of Each Subject Course description Appendix C 131 credits 36 32 Name Surname ID Number Position and Qualification of Instructors 321 Executive Program Committees NameSurname Academic Position ID Number Assoc Prof Dr Pitikhate Sooraksa Electrical Engineering Assoc Prof Dr Chutimet', 's Institute of Technology Ladkrabang regarding bachelor degree education year 2016 Appendix A 210 Integrated MasterBachelor Program If a student is in the 2nd semester of their third year of study or has completed at least 81 credits with the overall GPA of at least 3 00 the student is guaranteed admission into the integrated master bachelor program in the department The student must also complete the', '01006304 COOPERATIVE EDUCATION STUDY ABROAD OVERSEA TRAINING 6 0450 6 6012 6 0450 C FREE ELECTIVES 6 CREDITS Students must complete at least 6 additional credits from any courses offered by the institution D RAI INTERNSHIP 01006805 0 CREDITS INDUSTRIAL INTERNSHIPS 314 Recommended Study Plan 0 0450 Credit Notation L E S L Lecture Learning hours E Laboratory hours S Selfstudy hours This study plan shows', 'education as well as the ABET Accreditation throughout the duration of administration of the program 11 Executive program committee there are no fewer than 5 persons who have either a direct qualification or a related field of study Their qualification is minimum as Master Degree or equivalent or academic positions no lower than Assistant Professor Moreover they have at least one academic results published', 'semesters each of which covers not less than 15 weeks excluding the examination weeks The summer semester is optional Most courses are offered on the main campus during the day Some courses or laboratory hours may be offered in the evening or weekend 12 Provision of Summer Course Summer courses will be offered based on instructors availability and students need 13 System Transfer of Credits in TwoSemester', 'need 13 System Transfer of Credits in TwoSemester System Credits can be transferred upon the consent of executive program committee according to the Regulation of King Mongkuts Institute of Technology Ladkrabang regarding bachelor degree education year 2016 Appendix A and the Announcement of King Mongkuts Institute of Technology Ladkrabang regarding the crossinstitute registration of higher education', '5th digit th th th 6 7 8 digit 01 41 00 6 means Faculty of Engineering means Robotics and AI program means shared courses means bachelor degree means Order of the subject 25 A GENERAL EDUCATION 30 CREDITS LECTURELABSELF STUDY A1 ENGLISH PROFICIENCY REQUIREMENT ESL 01416000 ACADEMIC LISTENING AND SPEAKING 01416001 ACADEMIC READING AND WRITING 01416003 INTERPRETATION AND ARGUMENTS 9 CREDITS 3 306 3 306 3 306', 'the Distribution of Program Standard Learning Outcomes to Course Level Specialized Course 49 PART5 CRITERIA FOR STUDENT EVALUATION59 1 Regulations or Criteria for Grading 59 2 Verification of Learning Achievement 59 3 Criteria for Graduation According to the Program 59 PART 6 DEVELOPMENT OF INSTRUCTORS 60 1 Preparation for New Instructors 60 2 Development of Knowledge and Skills for Instructors60 PART 7', 'the department The student must also complete the admission form through the meeting with their academic advisor for their master program If a student does not meet the GPA criteria of 300 he or she is eligible to hisher petition into the program during his or her fourth year with the permission of their academic advisor 22 3 Curriculum and Instructors The B Eng in Robotics and AI program is a four year']",At least 131 credits are required for graduation.,At least 131 credits.,1.0,0.9999999999999998,0.8928571428348213,1.0
What is the medium of instruction?,"['ask the recitation leader questions to clarify concepts facts or problem sets from the lecture The laboratory hours give students the opportunity to learn from handson experience using specialized equipment or software related to the courses contents Meaning of the Subject Codes Subject Codes are assigned with 8 digits as follows 1st 2nd digit 3rd 4th digit 5th digit th th th 6 7 8 digit 01 41 00 6 means', 'calculation communication and information technology adeptness Course 1 2 3 4 5 1 2 3 4 5 1 2 3 4 5 1 2 3 4 5 1 2 3 4 5 CORE COURSE 01006710 Introduction to Calculus 01006711 Advanced Calculus 01006723 General Physics 1 01006724 General Physics Laboratory 1 01006725 General Physics 2 01006726 General Physics Laboratory 2 01006803 Engineering Mechanics 01416310 Strength of Materials FUNDAMENTAL COURSE', 'COMMUNICATION 4 408 PREREQUISITE NONE This course provides the study and practice of different communication skills including technical professional and creative writing infographics design and delivering presentation The students will study relevant techniques and learn to combine a range of skillsin order to effectively communicating technical or specialized concepts They will be able to explore and', 'AND SPEAKING 3 306 PREREQUISITE NONE The course provides ESL students guidance and extensive practice in listening and speaking in academic and professional settings Listening focuses on understanding spoken English in formats such as college lectures and news broadcasts Note taking tasks are also included to reinforce aural comprehension Students learn to recognize organizational patterns Students also', 'and correct word forms word order spelling and punctuation Students will also develop the ability to write varied complex sentences and effective paragraphs in standard written English 01006003 INTERPRETATION AND ARGUMENTS 3 306 PREREQUISITE NONE This course provides the study of interpreting and analyzing written and visual arguments Students will learn to identify the underlying values definitions and', 'enrolled in the courses are also expected to spend at least 8 hours outside the class lab for studying and completing the coursework The instructorled lecture could be delivered as a traditional lecture or include learning activities in which the students can actively participate The recitation is a compliment to a lecture where students can discuss and ask the recitation leader questions to clarify', '01416310 Strength of Materials FUNDAMENTAL COURSE 01416301 Differential Equations and Matrix Algebra 53 1 Moral and ethics 2 Knowledge 3 Intellectual skills 4 Human relation skills and responsibility 5 Skills for mathematical calculation communication and information technology adeptness Course 1 01416304 Feedback Control 01416305 Artificial Intelligent Technology 01416306 Safety and Standardization in RAI', '4 an ability to function on multidisciplinary teams 6 an understanding of professional and ethical responsibility 5 Skills for Mathematical Calculation 7 an ability to communicate effectively Communication and Information 8 an ability to use the techniques skills and modern engineering tools necessary for engineering practice Technology Adeptness 50 3 Curriculum Mapping Illustrating the Distribution of', 'statements conditionals and iterations Students learn routines or methods as fundamental concepts and practice using strings arrays lists maps or dictionaries pre defined libraries and classes abstraction mechanisms and basic object oriented programming concepts Students will practice related activities of software development life cycle such as system requirement analysis debugging testing and validation', 'skillsets and characteristics streamlined to institutional engineering set Strategies EvidenceIndicator 1 Adjusting engineering to an Outcomebased curriculum by ABET guidelines for undergraduate graduate and doctoral degrees 2 Organize Student Centric teachinglearning environments to facilitate and maximize active learning 3 Facilitate authentic learning or work integrated teachinglearning environments 4', 'relation skills and responsibility 5 Skills for mathematical calculation communication and information technology adeptness Course 1 2 3 4 5 1 2 3 4 5 1 2 3 4 5 1 2 3 4 5 1 2 3 4 5 GENED MATH AND SCIENCE 01006719 PROBABILITY AND STATISTICS 1 01006720 PROBABILITY AND STATISTICS 2 01006721 NUMERICAL METHODS 01006727 GENERAL CHEMISTRY 01006728 GENERAL CHEMISTRY LABORATORY 01006729 INTRODUCTION TO OPERATIONS', 'Plan The executive program committees utilize the results of analysis and revision to create an improvement plan for the program so that its quality archives the required standards and discuss with the instructor 94 APPENDIX C Course Description 95 COURSE DESCRIPTION 1 GENERAL EDUCATION 11 ENGLISH PROFICIENCY REQUIREMENT ESL 01416000 ACADEMIC LISTENING AND SPEAKING 3 306 PREREQUISITE NONE The course', '5th digit th th th 6 7 8 digit 01 41 00 6 means Faculty of Engineering means Robotics and AI program means shared courses means bachelor degree means Order of the subject 25 A GENERAL EDUCATION 30 CREDITS LECTURELABSELF STUDY A1 ENGLISH PROFICIENCY REQUIREMENT ESL 01416000 ACADEMIC LISTENING AND SPEAKING 01416001 ACADEMIC READING AND WRITING 01416003 INTERPRETATION AND ARGUMENTS 9 CREDITS 3 306 3 306 3 306', '3 306 PREREQUISITE NONE This course bridges the gap between academic and production software engineering The course provides fastpaced introduction to key tools and techniques used in successful startups and largescale projects command line dotfiles text editor distributed version control debugging testing documentation reading code deployments Students will learn to build a command line application expose', '5 Skills for mathematical calculation communication and information technology adeptness Course 1 01416617 Pneumatic and Hydraulic System Design and Control 01416618 Advanced Artificial Intelligent Technology 01416619 User Experience and User Interface Design 01416620 Blockchain Technology and Application 01416621 Lean Management 01416522 Big Data 01416523 IT Project Management 01416628 Experience and', 'course to ensure that students are ready for their studies and to be able to complete theireducation for the duration of the program 32 The activities are organized to develop students knowledge abilities and potential in various ways to support 21stcentury learning skills 33 A consultant who is appointed for academic counseling and guidance to all students must schedule an appointment Office Hours for the', 'Mapping Illustrating the Distribution of Program Standard Learning Outcomes to Course Level Specialized Course Course Major Responsibility Minor Responsibility 1 Moral and ethics 2 Knowledge 3 Intellectual skills 4 Human relation skills and responsibility 5 Skills for mathematical calculation communication and information technology adeptness 1 Perceive the importance of values morals ethics selfsacrifice', 'recognize organizational patterns Students also practice outlining main ideas and supporting details through audiotaped videotaped and live presentations Speaking focuses on increased fluency and communicative strategies used by native speakers in academic and professional settings 01416001 ACADEMIC READING AND WRITING 3 306 PREREQUISITE NONE This course is designed to improve the reading and writing skills', 'Curriculum Teaching and Assessment of Learners 51 There is a process of designing updating curriculums and courses for advanced content to meet academicprofessional standards In line with the needs of the labor market and the National Economic and Social Development Plan 52 There is an integrated teaching and learning approach to research 53 Instructors are assigned in each course have the knowledge ability', 'relation skills and responsibility 5 Skills for mathematical calculation communication and information technology adeptness Course 1 2 3 01416602 Embedded System Development 01416604 Mechanical Vibrations 01416607 Startup Engineering 01416608 Data Visualization 01416609 Cognitive Computing Applications 01416610 Softwaredefined Data Center 01416611 Wireless Sensor Network 01416612 Information Security']","Sorry, My knowledge base does not contain the answer to this question.",English.,0.0,0.0,0.0,0.0
Which institute gives the degree to graduates?,"['s Institute of Technology Ladkrabang regarding bachelor degree education year 2016 Appendix A 210 Integrated MasterBachelor Program If a student is in the 2nd semester of their third year of study or has completed at least 81 credits with the overall GPA of at least 3 00 the student is guaranteed admission into the integrated master bachelor program in the department The student must also complete the', 'is in collaboration with many universities according to the memorandum of understanding MOU such as College of Engineering Carnegie Mellon University the University of South Florida Imperial College Chubu University Kumamoto University BK Birla Institute of Engineering and Technology National Formosa University and South Eastern Regional College etc 56 Degree Given to the Graduates Bachelor of Engineering', 'Field None 4 Total Credits At least 131 credits 5 Type of the Program 51 Level 4Year Bachelor Program 52 Program Category Academic bachelors degree program Academic bachelors degree program Advanced academic bachelors degree program 5 53 Medium of Instruction English 54 Admission Thai andor Foreign students 55 Collaboration with Other Institutes The program is in collaboration with many universities', 'Other FacultiesDepartments 10 PART 2 SPECIFIC INFORMATION OF THE PROGRAM 11 1 Philosophy Importance and Objectives of the Program 11 2 Development Plan 14 3 Student Outcomes16 PART 3 SYSTEM FOR EDUCATIONAL PROVISION MANAGEMENT AND STRUCTURE OF THE PROGRAM 18 1 System for Educational Provision 18 2 Management of the Program18 3 Curriculum and Instructors22 2 4 Component Regarding Field Experience Internship', 'Institute of Technology Ladkrabang Regarding the Cross Institute Registration of Higher Education 87 C Course Description 92 D Curriculum Mapping for General Education Course 117 E Facilities Supported Teaching and Learning 121 F Reason for Requesting to Revise Curriculum 129 G List of Program Development Committees 137 H The Academic Publication of Instructors Responsible for The Program 139 4 BACHELOR OF', 'occupational or professional skill and life skills 3 Criteria for Graduation According to the Program Students must complete at least 131 credits to graduate with at least 30 credits from general education courses at least 95 credits from Robotics and AI concentration and at least 6 credits of free electives and English proficiency level prior to the graduation Students must also complete the internship', 'for an academic position in the past 5 years 13 The curriculum is updated at least every 5 years by considering the opinions of new graduates alumni industrial advisory board employer and other stakeholders 2 Graduate 21 There is an assessment of the quality of graduates according to the framework of national qualifications as well as the ABET Accreditation 22 There is a survey of graduates who get a job or', 'they have at least one academic results published by the criteria established for the academic position in the past 5 years 12 Course Instructor they have direct or indirect qualification Minimum Master Degree or equivalent or academic position no lower than Assistant Professor Moreover they have at least one academic results published by the criteria established for an academic position in the past 5 years', 'Students must also complete the internship requirement during their courses of study Also graduation according to the program is accordance with the Regulations of King Mongkuts Institute of Technology Ladkrabang regarding Bachelor Degree Education 2016 Appendix A 62 PART 6 DEVELOPMENT OF INSTRUCTORS 1 Preparation for New Instructors 11 Orientation for new instructors regarding roles and responsibilities of', 'crossinstitute registration of higher education Appendix B 2 Management of the Program 21 DateTime of the Course 1st semester August December 2nd semester January May Summer course June July The actual start and end dates for each academic year will be announced by the office of the registrar 22 Qualification of Applicants The general admission process starts from October RAI classes will begin in August of', '3 306 01416702 RAI ENGINEERING CAPSTONE DESIGN 3 095 TOTAL CREDITS 15 Total credits required for graduation at least 315 Details of Each Subject Course description Appendix C 131 credits 36 32 Name Surname ID Number Position and Qualification of Instructors 321 Executive Program Committees NameSurname Academic Position ID Number Assoc Prof Dr Pitikhate Sooraksa Electrical Engineering Assoc Prof Dr Chutimet', 'AND APPLICATION INDUSTRIAL EXPERIENCE FOR ENGINEERS 3 306 3 225 3 306 3 306 9 21412 4 408 3 306 3 225 3 225 3 0160 FOR UNIVERSITY OF BIRMINGHAM 22 DUAL DEGREE PROGRAM Only students in UoB 22 Dual Degree program may choose these courses 01416622 01416623 01416624 01416625 01416626 01416627 INTEGRATED DESIGN PROJECT 2 4 2410 ENGINEERING MATHEMATICS 3 4 408 POWER ELECTRONICS AND POWER SYSTEMS 4 408 THE', 'education as well as the ABET Accreditation throughout the duration of administration of the program 11 Executive program committee there are no fewer than 5 persons who have either a direct qualification or a related field of study Their qualification is minimum as Master Degree or equivalent or academic positions no lower than Assistant Professor Moreover they have at least one academic results published', 'or Criteria for Grading Regulations or criteria for grading are in accordance with the Regulations of King Mongkut s Institute of Technology Ladkrabang regarding Bachelors Degree Education 2016 Appendix A 2 Verification of Learning Achievement 21 Verification of Learning Achievement before Graduation Program committee assigned a responsible figure for the verification of learning achievement according to', 'the department The student must also complete the admission form through the meeting with their academic advisor for their master program If a student does not meet the GPA criteria of 300 he or she is eligible to hisher petition into the program during his or her fourth year with the permission of their academic advisor 22 3 Curriculum and Instructors The B Eng in Robotics and AI program is a four year', '5th digit th th th 6 7 8 digit 01 41 00 6 means Faculty of Engineering means Robotics and AI program means shared courses means bachelor degree means Order of the subject 25 A GENERAL EDUCATION 30 CREDITS LECTURELABSELF STUDY A1 ENGLISH PROFICIENCY REQUIREMENT ESL 01416000 ACADEMIC LISTENING AND SPEAKING 01416001 ACADEMIC READING AND WRITING 01416003 INTERPRETATION AND ARGUMENTS 9 CREDITS 3 306 3 306 3 306', 'MSTU Moscow Russia 1994 BS Civil Engineering Yonsei University Seoul South Korea 1991 44 4 Component Regarding Field Experience Internship or CoOperative Education Students must participate in the internship or entrepreneurship experience for at least 8 weeks while working toward the degree usually during the summer This requirement could be satisfied by completing internships with an innovative company in', 'Surname ID Number Position and Qualification of Instructors Responsible for the Program Executive Program Committee NameSurname Academic Position ID Number Qualification Department University Year of Graduation Academic Achievements Dr Poom Konghuayrob DEng Electrical Engineering King Mongkuts Institute of Technology Ladkrabang 2017 MEng Electrical Engineering King Mongkuts Institute of Technology', 'hours S Selfstudy hours This study plan shows courses with credits equivalent to 3 However students can register 4 credit courses as well The total number of credits in each subject category will be counted toward the graduation 31 1st YEAR 1st SEMESTER CODE SUBJECT CREDITS LES 01416316 COMPUTER PROGRAMMING FOR RAI 3 225 01006710 INTRODUCATION TO CALCULUS 3 306 01006723 GENERAL PHYSICS 1 3 306 01006724', '3 095 TOTAL CREDITS 9 35 FOR COOPSTUDY ABROAD STUDENTS 4th YEAR 1st SEMESTER CODE 01006301 or 01006302 SUBJECT CREDITS LES COOPERATIVE EDUCATION or STUDY ABROAD 6 0450 or 6 6012 TOTAL CREDITS 6 4th YEAR 2nd SEMESTER CODE SUBJECT CREDITS LES XXXXXXX GENED ELECTIVE 3 306 XXXXXXX FREE ELECTIVE 3 XXX 0141XXXX RAI Elective subject 3 306 0141XXXX RAI Elective subject 3 306 01416702 RAI ENGINEERING CAPSTONE DESIGN']",The degree is given by King Mongkut's Institute of Technology Ladkrabang.,King Mongkut's Institute of Technology Ladkrabang.,1.0,0.5977412163403445,0.4146825396721726,1.0
When did the program start its first semester?,"['21st August 2020 This program has started on 1st semester of academic year 2018 August 20118 7 Readiness for Publication as Qualified and Standardized Program This program is ready for announcement as qualified and standard program according to the qualification standard of higher education in engineering in 2010 in 2022 as well as the ABET Accreditation in 2022 8 Possible Career Path after Graduation', 'and details of each offered subject and planned activities if any at least before the opening of each semester for all subjects 4 Filing program review and report for the operation of each subject and field experience if any within 30 days after the end of the semester for all subjects 5 Filing report of the operation of the program according to SSRwithin 6 0 days after the end of the academic year 6 Having', 'crossinstitute registration of higher education Appendix B 2 Management of the Program 21 DateTime of the Course 1st semester August December 2nd semester January May Summer course June July The actual start and end dates for each academic year will be announced by the office of the registrar 22 Qualification of Applicants The general admission process starts from October RAI classes will begin in August of', 'hours S Selfstudy hours This study plan shows courses with credits equivalent to 3 However students can register 4 credit courses as well The total number of credits in each subject category will be counted toward the graduation 31 1st YEAR 1st SEMESTER CODE SUBJECT CREDITS LES 01416316 COMPUTER PROGRAMMING FOR RAI 3 225 01006710 INTRODUCATION TO CALCULUS 3 306 01006723 GENERAL PHYSICS 1 3 306 01006724', 'semesters each of which covers not less than 15 weeks excluding the examination weeks The summer semester is optional Most courses are offered on the main campus during the day Some courses or laboratory hours may be offered in the evening or weekend 12 Provision of Summer Course Summer courses will be offered based on instructors availability and students need 13 System Transfer of Credits in TwoSemester', 'Other FacultiesDepartments 10 PART 2 SPECIFIC INFORMATION OF THE PROGRAM 11 1 Philosophy Importance and Objectives of the Program 11 2 Development Plan 14 3 Student Outcomes16 PART 3 SYSTEM FOR EDUCATIONAL PROVISION MANAGEMENT AND STRUCTURE OF THE PROGRAM 18 1 System for Educational Provision 18 2 Management of the Program18 3 Curriculum and Instructors22 2 4 Component Regarding Field Experience Internship', 'Groups in the Program Open by Other FacultiesDepartments Programs General Education subjects Free electives 132 Subjects Subject Groups in the Program Open and Required to be Studied by Other FacultiesDepartmentsPrograms Free electives 133 Management The executive program committee is primarily responsible for the program are the representatives to coordinate with the faculty institution instructors and', 'course to ensure that students are ready for their studies and to be able to complete theireducation for the duration of the program 32 The activities are organized to develop students knowledge abilities and potential in various ways to support 21stcentury learning skills 33 A consultant who is appointed for academic counseling and guidance to all students must schedule an appointment Office Hours for the', 'Indicators Academic Year Indicator and Objective 1 At least 80 of the executive program committee of the program participate in the meeting for planning following and revising the operation of the program 2 Having the details of the program consistent with the national or international standard of qualification for the program 3 Having the course syllabus and details of each offered subject and planned', 'level of the final year students fresh graduates for the quality of the program is used to improve the program 12 The average satisfaction level of the stakeholders is used to improve the program 2020 2021 2022 2023 2024 Total indicators affecting the operation no15 for each year 5 5 5 5 5 Total indicators unit for each year 9 10 10 11 12 Evaluation Criteria The program achieving standards according to the', 'from October RAI classes will begin in August of the following year Prospective students are required to satisfy the following requirements a Complete highschool education or equivalent study record Students must also provide the latest official transcript for their highest level of education Students must provide the proof of completion an official diploma or a certificate of completion from their', 'that apply the appropriate technology and information systems to solutions 42 Time Period Internship Summer Course of the 1st 2nd or 3rd academic year CoOperative Education the 1st Semester of the 4th academic year 43 Time Management and Scheduling 8 weeks for Internship or fulltime for one semester for CoOperative Education 5 Regulations for Special Project or CoOperative Education Students are able to', 'Upon the completion of the program the students must prepare and deliver oral presentations describing their experience from the program 3 INTERNSHIP 01006805 INDUSTRIAL INTERNSHIP 0 0450 PREREQUISITE NONE During their fouryear selected studies students are required to complete a shortterm industrial placement within professional selected environments It takes place during a summer period This course allows', 'areas Each semester will include a project based theme which helps students practice and design innovative solutions in the respective areas In the first year the students study basic courses in mathematics and science and improve their communication skills Students will also be introduced to fundamental programming concepts and the foundation of robotics systems The firstyear projects will give students', 'the department The student must also complete the admission form through the meeting with their academic advisor for their master program If a student does not meet the GPA criteria of 300 he or she is eligible to hisher petition into the program during his or her fourth year with the permission of their academic advisor 22 3 Curriculum and Instructors The B Eng in Robotics and AI program is a four year', '4th YEAR 1st SEMESTER CODE SUBJECT CREDITS LES XXXXXXX FREE ELECTIVE 3 XXX XXXXXXX GENED ELECTIVE 3 306 0141XXXX RAI Elective mandatory subject 3 306 0141XXXX RAI Elective subject 3 306 TOTAL CREDITS 12 4th YEAR 2nd SEMESTER CODE SUBJECT CREDITS LES 0141XXXX RAI Elective subject 3 306 0141XXXX RAI Elective subject 3 306 01416702 RAI ENGINEERING CAPSTONE DESIGN 3 095 TOTAL CREDITS 9 35 FOR COOPSTUDY ABROAD', '3 306 PREREQUISITE NONE This course bridges the gap between academic and production software engineering The course provides fastpaced introduction to key tools and techniques used in successful startups and largescale projects command line dotfiles text editor distributed version control debugging testing documentation reading code deployments Students will learn to build a command line application expose', 'Field None 4 Total Credits At least 131 credits 5 Type of the Program 51 Level 4Year Bachelor Program 52 Program Category Academic bachelors degree program Academic bachelors degree program Advanced academic bachelors degree program 5 53 Medium of Instruction English 54 Admission Thai andor Foreign students 55 Collaboration with Other Institutes The program is in collaboration with many universities', 'in each year Academic Year Program Achieving Standard According to the Quality Framework 2021 Achieving mandatory indicators no15 total indicators of 10 total indicators of 10 2022 total indicators of 10 2023 total indicators of 11 2024 total indicators of 12 2020 67 PART 8 EVALUATION AND IMPROVEMENT OF THE OPERATION OF THE PROGRAM 1 Assessment of the Effectiveness of the Teaching 11 Evaluation of Teaching', 'and Estimated Graduation in 5 Years Academic Year Number of Students 1st year 2020 2021 2022 2023 2024 60 30 30 30 30 60 30 30 30 60 30 30 60 30 2nd year 3rd year 4th year Total 60 90 120 150 120 Estimated to Graduate 60 30 26 Planned Budget Academic Year 2020 2021 2022 2023 2024 1 Personnel 2157500 2912917 3879250 4119250 4119250 Teaching Personnel 1017500 1606250 2191250 2431250 2431250 Administrative']",The program started its first semester in August 2018.,Semester 1 of academic year 2018.,1.0,1.0,0.9999999999,1.0
Is the program an academic or advanced academic bachelor's degree?,"['Field None 4 Total Credits At least 131 credits 5 Type of the Program 51 Level 4Year Bachelor Program 52 Program Category Academic bachelors degree program Academic bachelors degree program Advanced academic bachelors degree program 5 53 Medium of Instruction English 54 Admission Thai andor Foreign students 55 Collaboration with Other Institutes The program is in collaboration with many universities', 'education as well as the ABET Accreditation throughout the duration of administration of the program 11 Executive program committee there are no fewer than 5 persons who have either a direct qualification or a related field of study Their qualification is minimum as Master Degree or equivalent or academic positions no lower than Assistant Professor Moreover they have at least one academic results published', 's Institute of Technology Ladkrabang regarding bachelor degree education year 2016 Appendix A 210 Integrated MasterBachelor Program If a student is in the 2nd semester of their third year of study or has completed at least 81 credits with the overall GPA of at least 3 00 the student is guaranteed admission into the integrated master bachelor program in the department The student must also complete the', 'of the Operation According to the Details of the Program Having quality assurance system and provision of education according to the standard framework of qualification for higher education as well as ABET Accreditation by having key performance indicators and assessment criteria assigned by the Internal QA committee 4 Revision of the Evaluation and Improvement Plan The executive program committees utilize', '21st August 2020 This program has started on 1st semester of academic year 2018 August 20118 7 Readiness for Publication as Qualified and Standardized Program This program is ready for announcement as qualified and standard program according to the qualification standard of higher education in engineering in 2010 in 2022 as well as the ABET Accreditation in 2022 8 Possible Career Path after Graduation', 'Other FacultiesDepartments 10 PART 2 SPECIFIC INFORMATION OF THE PROGRAM 11 1 Philosophy Importance and Objectives of the Program 11 2 Development Plan 14 3 Student Outcomes16 PART 3 SYSTEM FOR EDUCATIONAL PROVISION MANAGEMENT AND STRUCTURE OF THE PROGRAM 18 1 System for Educational Provision 18 2 Management of the Program18 3 Curriculum and Instructors22 2 4 Component Regarding Field Experience Internship', 'aforementioned skills of instructors 2 Evaluation of the Program as a Whole Picture The executive program committees evaluate the program as a whole picture when the teaching ends in each academic year by collecting information from students and graduates employers and or stakeholders experts industrial advisory boards or external evaluators 3 Evaluation of the Operation According to the Details of the', 'is in collaboration with many universities according to the memorandum of understanding MOU such as College of Engineering Carnegie Mellon University the University of South Florida Imperial College Chubu University Kumamoto University BK Birla Institute of Engineering and Technology National Formosa University and South Eastern Regional College etc 56 Degree Given to the Graduates Bachelor of Engineering', 'Indicators Academic Year Indicator and Objective 1 At least 80 of the executive program committee of the program participate in the meeting for planning following and revising the operation of the program 2 Having the details of the program consistent with the national or international standard of qualification for the program 3 Having the course syllabus and details of each offered subject and planned', 'the department The student must also complete the admission form through the meeting with their academic advisor for their master program If a student does not meet the GPA criteria of 300 he or she is eligible to hisher petition into the program during his or her fourth year with the permission of their academic advisor 22 3 Curriculum and Instructors The B Eng in Robotics and AI program is a four year', 'Groups in the Program Open by Other FacultiesDepartments Programs General Education subjects Free electives 132 Subjects Subject Groups in the Program Open and Required to be Studied by Other FacultiesDepartmentsPrograms Free electives 133 Management The executive program committee is primarily responsible for the program are the representatives to coordinate with the faculty institution instructors and', 'for Graduation 312 Curriculum Structure Minimum Credits 131 credits For UoB 22 Program Students Credits For Coop Study Aboard Students 30 30 A1 English Proficiency Requirement ESL 9 9 A2 Communication Humanity and Social Skills 15 15 A3 Math and Science 6 6 95 95 B1 Core Courses 20 20 B2 Major Compulsory Courses 75 75 B21 Fundamental Subjects 39 39 B22 Capstone Projects 6 6 B23 RAI Elective Mandatory', 'for an academic position in the past 5 years 13 The curriculum is updated at least every 5 years by considering the opinions of new graduates alumni industrial advisory board employer and other stakeholders 2 Graduate 21 There is an assessment of the quality of graduates according to the framework of national qualifications as well as the ABET Accreditation 22 There is a survey of graduates who get a job or', 'hours S Selfstudy hours This study plan shows courses with credits equivalent to 3 However students can register 4 credit courses as well The total number of credits in each subject category will be counted toward the graduation 31 1st YEAR 1st SEMESTER CODE SUBJECT CREDITS LES 01416316 COMPUTER PROGRAMMING FOR RAI 3 225 01006710 INTRODUCATION TO CALCULUS 3 306 01006723 GENERAL PHYSICS 1 3 306 01006724', '6 Status of the Program and Consideration for the AuthorizationAgreement 5 7 Readiness for Publicization as Qualified and Standardized Program 5 8 Possible Career Path after Graduation 5 9 Name Surname ID Number Position and Qualification of Instructors Responsible for the Program Executive Program Committee 6 10 Location of Study 9 11 External Situation or Development Needed to be Considered for the', 'B Eng in Robotics and AI program is a four year full time undergraduate program In order to graduate the students must complete at least 131 credits Students must achieve the required English proficiency level prior to the graduation and satisfy the graduation requirements The program is designed to drive innovations and entrepreneurship in robotics and AI technologyrelated areas Each semester will include', 'or academic training programs knowledge of contemporary issues via and ability to use the techniques skills and modern engineering tools necessary for engineering practice via RAI senior capstone projects 18 PART 3 SYSTEM FOR EDUCATIONAL PROVISION MANAGEMENT AND STRUCTURE OF THE PROGRAM 1 System for Educational Provision 11 System An academic year has two semesters each of which covers not less than 15', '1 Name of the Program Name of the program Thai Name of the program English 2 Degree and Major Full name Thai Full name English Abbreviation Thai Abbreviation English Bachelor of Engineering in Robotics and Artificial Intelligence Engineering International Program Bachelor of Engineering Robotics and AI Engineering BEng Robotics and AI Engineering 3 Major Field None 4 Total Credits At least 131 credits 5', 'Curriculum Teaching and Assessment of Learners 51 There is a process of designing updating curriculums and courses for advanced content to meet academicprofessional standards In line with the needs of the labor market and the National Economic and Social Development Plan 52 There is an integrated teaching and learning approach to research 53 Instructors are assigned in each course have the knowledge ability', 'Institute of Technology Ladkrabang Regarding the Cross Institute Registration of Higher Education 87 C Course Description 92 D Curriculum Mapping for General Education Course 117 E Facilities Supported Teaching and Learning 121 F Reason for Requesting to Revise Curriculum 129 G List of Program Development Committees 137 H The Academic Publication of Instructors Responsible for The Program 139 4 BACHELOR OF']",The program is an academic bachelor's degree program and also referred to as an advanced academic bachelor's degree program.,Academic bachelor's degree program.,1.0,0.44942962582996443,0.7383680555463259,1.0
What is a possible career path regarding AI?,"['in 2022 8 Possible Career Path after Graduation Roboticist or Robotic Engineer Startup Entrepreneur in High Tech Software Engineer for Mechatronics and Machines System Engineer Machine Vision Engineer Robotic Security Analyst Expert Systems Analyst Machine Designer Software Architect for AI Technology Manager for Robotics and AI Solution Engineer 6 9 Name Surname ID Number Position and Qualification of', 'and AI will be the major driving force of the transformation using their technical experts and understanding of the economic ecosystem and related processes 13 Program Educational Objectives Bachelor of Engineering Program in Robotics and AI emphasizes on the production of graduates with the following qualifications a Engineering Quality Our graduates will apply engineering practice combined with the', 'and AI Students will learn to build innovation identify the opportunities propose ideas design and implement innovative solutions while being able to apply standards and realistic engineering constraints Students also further specialize in their areas of interest and prepare for the next step in their careers 23 31 Curriculum 311 Minimum Credits Required for Graduation 312 Curriculum Structure Minimum', 'for the Planning of the Program 111 Economic SituationDevelopment The planning of bachelors degree program in Robotics and AI Engineering has been operated according to National Economic and Social Development Plan 2017 2021 which emphasizes on the development of science technology research and innovation in order to reinforce the sustainable growth of the industrial part The program also serves Thailand 4', 'Coupling with the ongoing innovations in global computing technology landscape there is a significant demand for highquality graduates who are skillful in computing and innovation for all industries on the verge of digital disruption Existing businesses will have to adapt and innovatively transform itself in order to stay competitive Graduates from Robotics and AI will be the major driving force of the', 'in oral form and in written form as well as be able to choose appropriate forms of presentation media 4 Be able to utilize information and communications technology appropriately 5 Be able to use engineering tools in order to pursue a profession in robotics and artificial intelligence engineering 51 1 Moral and ethics 2 Knowledge 3 Intellectual skills 4 Human relation skills and responsibility 5 Skills for', 'B Eng in Robotics and AI program is a four year full time undergraduate program In order to graduate the students must complete at least 131 credits Students must achieve the required English proficiency level prior to the graduation and satisfy the graduation requirements The program is designed to drive innovations and entrepreneurship in robotics and AI technologyrelated areas Each semester will include', 'design and kinematics and dynamics Third year students will learn about the latest technologies and AI which happen in the area In each semester the students will study new concepts and apply creativity in completing projects in trending areas such as machine perception application development cognition and reasoning and IoT Students will also learn about AI engineering along with the process and tools to', 'for innovation 122 Relation to the Mission of the Institute The development of the Robotics and AI Engineering program is related to the strategic advancement of scholar production to create next generation scholars with capabilities and flexibility to adapt to the change in the economy society and culture It also directly reflects the mission of the Institute to be the Master of Innovation and the Corner', 'andor International Research Experience IRE andor taking courses related to research topic provides an opportunity to gain variable handson training and experience in real world situations andor study andor conduct research concerning Robotics and Artificial Intelligence engineering Additionally through exposure to current practice student can reflect on and appreciate the linkage between curriculum and', 'For AI students can explore the concepts and algorithms at the foundation of artificial intelligence diving into the ideas that give rise to technologies like basic machine learning image recognition and neural networks Through handson 106 projects students gain exposure to the theory behind graph search algorithms classification optimization and other topics in principle robotics artificial intelligence', '306 PREREQUISITE NONE Materials on AI programming logic search game playing machine learning natural language understanding and robotics introduce the student to AI methods tools and techniques their application to computational problems and their contribution to understanding intelligence 01416306 SAFETY AND STANDARDIZATION IN RAI 3 306 PREREQUISITE NONE Law and standardization Safety requirement and', 'program and retain their fulltime student status 41 Standard for Learning Outcome from Field Experience 411 Possessing the skills to solve problems related to Robotics and AI 412 To be able to work with others as a team with responsibility 413 To be able to lead the member of the team appropriately 414 To be able to Integrate their knowledge to business solutions that apply the appropriate technology and', '56 1 Moral and ethics 2 Knowledge 3 Intellectual skills 4 Human relation skills and responsibility 5 Skills for mathematical calculation communication and information technology adeptness Course 1 2 3 5 1 2 3 4 5 1 2 3 4 5 01416511 Mobile Robots 01416512 Planning Technique in Robotics 01416518 Industrial Automation 01416519 Modern Control 01416520 Vision System for Mobile Robotics 01416521 Introduction to', 'design or cooperative education internship program for Robotics and AI Arranging for knowledge exchange activity in the program for both theory and practice between instructors and students as well as collaboration projects between institutes for internships Arranging for an education that promotes students selflearning Arranging for subjects that allow group works and assign a leader for each group as well', 'manufacturability and 17 Year Expected Learning Outcomes 3 4 sustainability using knowledge of kinematics kinetics and dynamics as well as material engineering for Robotics and AI ability to function on multidisciplinary teams via project based learning from RAI core courses ability to identify formulate and solve RAI engineering problems understanding of professional and ethical responsibility ability to', 'Sensor Network 01416612 Information Security Management 01416613 Fundamentals of AR VR and Mixed Reality 01416614 Advanced Computer Programming for RAI 01416615 Cyber Physical Robotics 01416616 Mobile Application Development 4 5 1 2 3 4 3 4 5 1 2 3 4 5 1 2 3 4 5 1 2 5 58 1 Moral and ethics 2 Knowledge 3 Intellectual skills 4 Human relation skills and responsibility 5 Skills for mathematical calculation', 'occupational or professional skill and life skills 3 Criteria for Graduation According to the Program Students must complete at least 131 credits to graduate with at least 30 credits from general education courses at least 95 credits from Robotics and AI concentration and at least 6 credits of free electives and English proficiency level prior to the graduation Students must also complete the internship', 'Development of the Program and the Relation to the Mission of the Institute 121 Development of the Program The effects of external factors on the development of the Robotics and AI Engineering program Bachelor of Engineering call for the revision of the program so that it can support the needs according to enhancing and improving human capital as well as developing science technology research and innovation', 'the department The student must also complete the admission form through the meeting with their academic advisor for their master program If a student does not meet the GPA criteria of 300 he or she is eligible to hisher petition into the program during his or her fourth year with the permission of their academic advisor 22 3 Curriculum and Instructors The B Eng in Robotics and AI program is a four year']",A possible career path regarding AI is becoming a Software Architect for AI.,Software Architect for AI.,1.0,0.9999999999999998,0.5666666666477778,1.0
What is a possible career path regarding mechanical systems?,"['in 2022 8 Possible Career Path after Graduation Roboticist or Robotic Engineer Startup Entrepreneur in High Tech Software Engineer for Mechatronics and Machines System Engineer Machine Vision Engineer Robotic Security Analyst Expert Systems Analyst Machine Designer Software Architect for AI Technology Manager for Robotics and AI Solution Engineer 6 9 Name Surname ID Number Position and Qualification of', 'systems The firstyear projects will give students handson experience introduction and basic development of robotics technologies In the second year the students will learn advanced robotics concepts which serve as the foundation of robotics technologies The students also learn to apply design methods for solutions in technical areas such as control systems design and kinematics and dynamics Third year', 'manufacturability and 17 Year Expected Learning Outcomes 3 4 sustainability using knowledge of kinematics kinetics and dynamics as well as material engineering for Robotics and AI ability to function on multidisciplinary teams via project based learning from RAI core courses ability to identify formulate and solve RAI engineering problems understanding of professional and ethical responsibility ability to', 'Mechanical Engineering MSTU Moscow Russia 1998 MS Mechanical Engineering MSTU Moscow Russia 1994 BS Civil Engineering Yonsei University Seoul South Korea 1991 1 Research Appendix H Nonlinear System AI 2 Teaching obligations 15 hoursweekly 39 322 Course instructors NameSurname Academic Position ID Number Qualification Department University Year of Graduation Academic Achievements Assoc Prof Dr Somyot', '2 Have acquired knowledge and understandings of important principles and theories of the subjects in the engineering field 3 Be able to integrate the knowledge in their field of study with the knowledge in other fields 4 Be able to analyze problems understand and explain computing requirements as well as be able to apply knowledge skills and the usage of suitable tools for solving problems 5 Be able to use', 'and AI will be the major driving force of the transformation using their technical experts and understanding of the economic ecosystem and related processes 13 Program Educational Objectives Bachelor of Engineering Program in Robotics and AI emphasizes on the production of graduates with the following qualifications a Engineering Quality Our graduates will apply engineering practice combined with the', 'engineering problem solving ability to design and conduct experiments on feedback control system as well as to analyze and interpret data using advanced mathematics and engineering tools ability to design a system component or process to meet desired needs within realistic constraints such as economic environmental social political ethical health and safety manufacturability and 17 Year Expected Learning', 'tools for solving problems 5 Be able to use their knowledge and skills in the field to solve the problem in the actual work 1 Have a good critical thinking 2 Be able to gather study analyze and summarize issues and requirements 3 Be able to analyze and solve engineering problems systematically Use decisionmaking information to work effectively 4 Have the imagination and flexibility to adapt the relevant', 'in oral form and in written form as well as be able to choose appropriate forms of presentation media 4 Be able to utilize information and communications technology appropriately 5 Be able to use engineering tools in order to pursue a profession in robotics and artificial intelligence engineering 51 1 Moral and ethics 2 Knowledge 3 Intellectual skills 4 Human relation skills and responsibility 5 Skills for', 'Ladkrabang Thailand 2011 MEng Electrical Engineering Naresuan University 2007 BEng Computer Engineering Naresuan University 2005 7 DrWeon Keun Song PhD Mechanical Engineering MSTU Moscow Russia 1998 1 Research Appendix H Nonlinear System MS Mechanical Engineering MSTU Moscow Russia 1994 AI BS Civil Engineering Yonsei University Seoul South Korea 1991 2 Teaching obligations 15 hoursweekly Dr Jutarut', 'Coupling with the ongoing innovations in global computing technology landscape there is a significant demand for highquality graduates who are skillful in computing and innovation for all industries on the verge of digital disruption Existing businesses will have to adapt and innovatively transform itself in order to stay competitive Graduates from Robotics and AI will be the major driving force of the', '01416515 Robotics Laboratory 2 2 3 4 5 1 2 3 4 5 1 2 3 4 5 1 2 3 4 5 1 2 3 4 5 54 1 Moral and ethics 2 Knowledge 3 Intellectual skills 4 Human relation skills and responsibility 5 Skills for mathematical calculation communication and information technology adeptness Course 1 2 01416401 Thermodynamics 01416403 Dynamic of Machinery 01416404 Mechanical Design and Modeling 01416406 Measurement and', 'Skills To be able to apply knowledge of industrial to situations with precision and appropriateness Group discussion and participation for scientific problem Individual assignments To be able to think and Providing a case study for experimental design analyze systematically and and analyze information leading to integration reasonably according to with related field scientific principles Evaluation of the', 'design and kinematics and dynamics Third year students will learn about the latest technologies and AI which happen in the area In each semester the students will study new concepts and apply creativity in completing projects in trending areas such as machine perception application development cognition and reasoning and IoT Students will also learn about AI engineering along with the process and tools to', 'workforce who understands the technological foundation as well as the surrounding economic ecosystem Our new economy will require a highly skilled engineer who can adapt and transform innovative engineering into a working solution that can be applied and enhance economic productivity in order to be competitive and keep our economy sustainable 112 Social and Culture SituationDevelopment At present the social', 'Engineering King Mongkuts Institute of Technology Ladkrabang 2013 BS Electrical Engineering Hons King Mongkuts Institute of Technology Ladkrabang 2012 1 Research Appendix H Industrial Robot Automation System Manufacturing Process 2 Teaching obligations 15 hoursweekly 38 Dr Kanoknuch Songsuwankit Electrical Engineering PhD Electrical Engineering King Mongkuts Institute of Technology Ladkrabang 2018 MS', 'graduates to attain the program educational objectives which adhere to ABET student outcomes for the engineering program 1 an ability to apply knowledge of mathematics science and engineering 2 an ability to design and conduct experiments as well as to analyze and interpret data 3 an ability to design an innovative system component or process to meet desired needs within realistic constraints such as', 'for the Planning of the Program 111 Economic SituationDevelopment The planning of bachelors degree program in Robotics and AI Engineering has been operated according to National Economic and Social Development Plan 2017 2021 which emphasizes on the development of science technology research and innovation in order to reinforce the sustainable growth of the industrial part The program also serves Thailand 4', '1 Research Appendix H IT Automation Industrial Informatics 2 Textbook Matrix Analysis Differential equation Control System Engineering Chaos Robotic 3 Teaching obligations 12 hoursweekly Assoc Prof Dr Chutimet Srinilta Computer Engineering PhD Computer Engineering Syracuse University USA 1998 MS Computer Engineering Syracuse University USA 1996 BEng Electrical Engineering Kasetsart University 1990 1', 'to support the growing worldwide digital economy Modern engineering programs must recognize stateoftheart technologies and practices while inspiring students to generate innovations We want our graduate to be ready for the everchanging technological landscape The curriculum is designed to drive innovations By combining theoretical foundations with handson experience and project based learning the students']",A possible career path regarding mechanical systems is becoming a Machine Designer.,Software Engineer for Mechatronics and Machines.,1.0,1.0,0.9999999999,1.0
What is a possible career path regarding management?,"['in 2022 8 Possible Career Path after Graduation Roboticist or Robotic Engineer Startup Entrepreneur in High Tech Software Engineer for Mechatronics and Machines System Engineer Machine Vision Engineer Robotic Security Analyst Expert Systems Analyst Machine Designer Software Architect for AI Technology Manager for Robotics and AI Solution Engineer 6 9 Name Surname ID Number Position and Qualification of', 'skills for success in careers and team environments The course will cover topics such as goal setting career Skills leadership skills teamwork effective communication and public speaking Learning methods will consist of hands on activities and projects group work lecture discussion reading writing and presenting 01006521 MEDITATION FOR LIFE DEVELOPMENT 3 306 PREREQUISITE NONE This course introduces theory', 'IT Project Management 01416628 Experience and Exercise for Intelligent Control System 01416629 Infromation and Cyber Security 2 3 4 5 1 2 3 4 5 1 2 3 4 5 1 2 3 4 5 1 2 3 4 5 59 1 Moral and ethics 2 Knowledge 3 Intellectual skills 4 Human relation skills and responsibility 5 Skills for mathematical calculation communication and information technology adeptness Course 1 01416630 Information System Security', 'NONE The concept of IT Project Management and the perspective of a manager Introduce tools and templates available to a Project Manager Discuss in the demands on the Project Manager and how to solve problems occur during the project period Cover case studies of project management in business 01416628 EXPERIMENT AND EXERCISE FOR INTELLIGENT CONTROL SYSTEM PREREQUISITE NONE 3 306 118 Understand each stage of', 'such as global direction public opinions technology business society and economic learn how to extract context of interested area to find opportunities study the processes used to gather behaviors generate intense understanding about areas that lead to innovative concepts produce innovative solutions and finally offering innovative products and services 01006516 INNOVATION MANAGEMENT 4 408 PREREQUISITE NONE', 'INNOVATION MANAGEMENT 4 408 PREREQUISITE NONE This course introduces students to the concepts of innovative thinking and innovation management practices This course prepares students with the insights and instruction necessary to successfully lead worldwide enterprises or local ventures Covered topics include organization strategy planning policy development communities research and development and product', 'from student to student regarding culture social and academic upbringing all of which influences social bonding and communication effectiveness learning and selfdevelopment 24 Strategies for Solving the IssuesLimitation of the Students in 23 a Arrange an orientation day and counseling session for first year students to advise on available career paths best action plans in line with set objectives and time', 'that meet the demands and establish marketplace advantage Lifelong Learning RAI students will learn new technologies methodologies and tools and adapt them to respond to the challenges of a changing environment Leadership RAI students will apply their technical and innovative leadership to establish successful careers in their business profession and community Economic Impact RAI students will apply their', 'and project based learning the students will learn the skills required for today s workforce We embrace the 21st century learning environment to cultivate the students creativity criticalthinking communication and collaboration skills Our students will be introduced to innovative mindsets able to work with multidisciplinary teams and be leaders in their field of study Our graduates will be lifelong learners', 'imagination and flexibility to adapt the relevant knowledge appropriately to create innovation 5 Be able to search interpret and evaluate information for use in solving problems creatively 1 Be able to communicate in English with various groups of people effectively 2 Be able to assist and support in resolving problematic situations both in the role of a leader and in the role of a team member 3 Be able to', 'marketplace advantage 12 c Leadership Our graduates will apply their technical and innovative leadership to establish successful careers in their business profession and community d Economic Impact Our graduates will apply their technical expertise leadership and innovative mindset to support and strengthen the societys economic wellbeing e Lifelong Learning Our graduates will learn new technologies', 'program and retain their fulltime student status 41 Standard for Learning Outcome from Field Experience 411 Possessing the skills to solve problems related to Robotics and AI 412 To be able to work with others as a team with responsibility 413 To be able to lead the member of the team appropriately 414 To be able to Integrate their knowledge to business solutions that apply the appropriate technology and', 'manufacturability and 17 Year Expected Learning Outcomes 3 4 sustainability using knowledge of kinematics kinetics and dynamics as well as material engineering for Robotics and AI ability to function on multidisciplinary teams via project based learning from RAI core courses ability to identify formulate and solve RAI engineering problems understanding of professional and ethical responsibility ability to', 'tools for solving problems 5 Be able to use their knowledge and skills in the field to solve the problem in the actual work 1 Have a good critical thinking 2 Be able to gather study analyze and summarize issues and requirements 3 Be able to analyze and solve engineering problems systematically Use decisionmaking information to work effectively 4 Have the imagination and flexibility to adapt the relevant', 'timetomarket learn tactics for improvement and measure customers needs such as experimenting landing pages A B tests MVPs on real customers study how to implement an agile culture in business environments and learn how to develop business structures in order to keep the business functioning on constantlymoving units 01006518 EMERGING TRENDS IN ENGINEERING 1 102 PREREQUISITE NONE This course consists of a', 'handson projects and case studies in a variety of business engineering social sciences or life sciences domains Issues of ethics leadership and teamwork are highlighted 01416416 INFORMATION SYSTEMS DATABASES AND APPLICATION 3 306 PREREQUISITE NONE This course studies basic concepts of information systems and database systems with emphasis on the study of relational database systems Topics include basic', 'in oral form and in written form as well as be able to choose appropriate forms of presentation media 4 Be able to utilize information and communications technology appropriately 5 Be able to use engineering tools in order to pursue a profession in robotics and artificial intelligence engineering 51 1 Moral and ethics 2 Knowledge 3 Intellectual skills 4 Human relation skills and responsibility 5 Skills for', 'to the concept of personal economics Students will learn to apply the economic way of thinking to manage their scarce resources Employs economic concepts to understand financial planning and income management saving and investing stocks bonds and mutual funds riskreturn tradeoff and diversification interest rates and credit 01006508 DIGITAL ECONOMY 3 306 PREREQUISITE NONE This course will develop and', 'in each course have the knowledge ability and expertise in the course Moreoverthere is a system to monitor the preparation of learning plans and teaching and learning management 6 Educational Resources 61 Budget management a Surveying the need and sufficiency of educational resources b Instigating a plan for educational resources management c Allowing budget for durable articles equipment and learning', 'real life case studies drawn from a 96 variety of professional contexts This course helps students develop skills and knowledge to manage and engage with ethical issues in their working lives 01006503 INTRODUCTION TO PSYCHOLOGY 3 306 PREREQUISITE NONE This course introduces a broad survey of psychological science including sensation and perception learning memory intelligence language and cognition emotions']",A possible career path regarding management mentioned in the provided information is becoming a Technology Manager for Robotics and AI.,Technology Manager for Robotics and AI.,1.0,0.6990761524689308,0.9999999999,1.0
Who is an instructor responsible for the program with a focus on Electrical Engineering?,"['Surname ID Number Position and Qualification of Instructors Responsible for the Program Executive Program Committee NameSurname Academic Position ID Number Qualification Department University Year of Graduation Academic Achievements Dr Poom Konghuayrob DEng Electrical Engineering King Mongkuts Institute of Technology Ladkrabang 2017 MEng Electrical Engineering King Mongkuts Institute of Technology', '2013 BS Electrical Engineering King Mongkuts Institute of Technology Ladkrabang 2009 1 Research Appendix H Analog Circuit Instrumentation and Measurement 3 Teaching obligations 15 hoursweekly DrWeon Keun Song PhD Mechanical Engineering MSTU Moscow Russia 1998 1 Research Appendix H Nonlinear System AI 2 Teaching obligations 15 hoursweekly MS Mechanical Engineering MSTU Moscow Russia 1994 BS Civil Engineering', '1 102 PREREQUISITE NONE This course consists of a series of lectures given by different faculty members and distinguished speakers from the academic and industries The lectures are designed to provide students a good understanding of each curriculum structure and the courses in each subject areas Students will be introduced to emerging trends in Engineering and the relevance of our courses New courses and', 'Institute of Technology Ladkrabang 2018 MS Electrical Engineering King Mongkuts Institute of Technology Ladkrabang 2013 BS Electrical Engineering King Mongkuts Institute of Technology Ladkrabang 2009 1 Research Appendix H Analog Circuit Instrumentation and Measurement 3 Teaching obligations 15 hoursweekly DrWeon Keun Song Mechanical Engineering PhD Mechanical Engineering MSTU Moscow Russia 1998 MS', 'Ladkrabang Thailand 2011 MEng Electrical Engineering Naresuan University 2007 BEng Computer Engineering Naresuan University 2005 7 DrWeon Keun Song PhD Mechanical Engineering MSTU Moscow Russia 1998 1 Research Appendix H Nonlinear System MS Mechanical Engineering MSTU Moscow Russia 1994 AI BS Civil Engineering Yonsei University Seoul South Korea 1991 2 Teaching obligations 15 hoursweekly Dr Jutarut', 'introduction to electrochemistry B25 ALTERNATIVE STUDY 01006301 COOPERATIVE EDUCATION 6 0450 PREREQUISITE NONE This course demands the student to work in an innovative company or a governmentprivate organization which is approved by the program committee for working on an innovative project for at least 16 weeks The work of the student is under supervision of a faculty member who is regarded as the student', 'aforementioned skills of instructors 2 Evaluation of the Program as a Whole Picture The executive program committees evaluate the program as a whole picture when the teaching ends in each academic year by collecting information from students and graduates employers and or stakeholders experts industrial advisory boards or external evaluators 3 Evaluation of the Operation According to the Details of the', 'skillsets and characteristics streamlined to institutional engineering set Strategies EvidenceIndicator 1 Adjusting engineering to an Outcomebased curriculum by ABET guidelines for undergraduate graduate and doctoral degrees 2 Organize Student Centric teachinglearning environments to facilitate and maximize active learning 3 Facilitate authentic learning or work integrated teachinglearning environments 4', '2 Teaching obligations 15 hoursweekly Dr Jutarut Chaoraingern D Eng Electrical Engineering KMITL Thailand 2021 M Eng Instrumentation Engineering KMITL Thailand 2006 B Eng Instrumentation Engineering KMITL Thailand 2000 9 10 Location of Study King Mongkuts Institute of Technology Ladkrabang 11 External Situation or Development Needed to be Considered for the Planning of the Program 111 Economic', 'with the faculty institution instructors and other programs in order to assign the teaching strategies and contents along with the assessment of the program according to the key performance indicator to achieve the objectives of the program and to successfully produce innovative graduates The program committee will consult with members of the programs industrial advisory board The board will be able to', 'or academic training programs knowledge of contemporary issues via and ability to use the techniques skills and modern engineering tools necessary for engineering practice via RAI senior capstone projects 18 PART 3 SYSTEM FOR EDUCATIONAL PROVISION MANAGEMENT AND STRUCTURE OF THE PROGRAM 1 System for Educational Provision 11 System An academic year has two semesters each of which covers not less than 15', '12 COMMUNICATION HUMANITY AND SOCIAL SKILLS 01006502 PROFESSIONAL ETHICS 3 306 PREREQUISITE NONE This course introduces the theory and the practice of professional and engineering ethics including code of conducts and regulations in academic professional and technical fields Students also learn about different approaches to ethical problems and examine real life case studies drawn from a 96 variety of', 'Electrical Engineering Assoc Prof Dr Chutimet Srinilta Computer Engineering Qualification Department University Year of Graduation Academic Achievements PhD Electrical Engineering University of Houston USA 1996 1 Research Appendix H MS Electrical Engineering George Washington University USA Entertainment Robots 1993 2 Textbook MS Physics Srinakharinwirot University 1991 Matrix Analysis BEd Physics Hons', 'Mechanical Engineering MSTU Moscow Russia 1998 MS Mechanical Engineering MSTU Moscow Russia 1994 BS Civil Engineering Yonsei University Seoul South Korea 1991 1 Research Appendix H Nonlinear System AI 2 Teaching obligations 15 hoursweekly 39 322 Course instructors NameSurname Academic Position ID Number Qualification Department University Year of Graduation Academic Achievements Assoc Prof Dr Somyot', 'through PBL ProblemProject Based Learning 5 The total number of Service Learning projects 6 The engineering graduates satisfaction rate regarding curriculum teachinglearning administration 1 Adopt New Staff Workshops to learn about existing educational systems 2 Education development and lecturer and faculty evaluation 1 The percentage of new lecturers trained 2 The percentage of lecturers trained 3', 'Groups in the Program Open by Other FacultiesDepartments Programs General Education subjects Free electives 132 Subjects Subject Groups in the Program Open and Required to be Studied by Other FacultiesDepartmentsPrograms Free electives 133 Management The executive program committee is primarily responsible for the program are the representatives to coordinate with the faculty institution instructors and', 'AND CONTROL SYSTEMS DIGITAL ELECTRONICS AND ELECTRICAL MACHINES 4 408 4 408 4 408 B24 RAI ELECTIVE SUBJECTS For Regular Students For UoB 22 Program Students For Coop Study Aboard Students 12 CREDITS 12 CREDITS 9 CREDITS 01416601 01416602 01416604 01416607 01416608 01416609 01416610 01416611 01416612 01416613 01416614 01416615 01416616 01416617 01416618 01416619 01416620 01416621 01416522 3 236 3 306 3 306 3', 'work integrated teachinglearning environments 4 Incorporate PBL Problem Based LearningProject Based Learning techniques into educational systems 5 Organize community and service learning projects for students 6 Streamline evaluation procedures to that of Outcomebased 1 Bachelor of Engineering Program is designed to qualification standard of higher education by Ministry of Education MoE and Accreditation', 'a committee which consists of instructors in the program by arranging an examination in each semester 6 Additional Costs Students will be responsible for the additional costs apart from tuition fees for all subjects in the program 46 PART 4 LEARNING OUTCOME TEACHING STRATEGY AND EVALUATION 1 Development of Special Characteristics of Students Characteristics Engineering Quality RAI students will apply', 'GENERAL PHYSICS 1 3 306 103 This course provides the physical science required to analyze electrical and electronic devices Covered topics include electrostatics and electromagnetics electric field and potential conductors insulators capacitors dielectrics electric current electric circuits magnetic fields and electromagnetism 01006726 GENERAL PHYSICS LABORATORY 2 1 032 PREREQUISITE 01006723 GENERAL PHYSICS']",Dr. Poom Konghuayrob is an instructor responsible for the program with a focus on Electrical Engineering.,Dr. Poom Konghuayrob.,0.6666666666666666,0.8518619406087218,0.9999999999,1.0
Where is the location of study?,"['enrolled in the courses are also expected to spend at least 8 hours outside the class lab for studying and completing the coursework The instructorled lecture could be delivered as a traditional lecture or include learning activities in which the students can actively participate The recitation is a compliment to a lecture where students can discuss and ask the recitation leader questions to clarify', 'course to ensure that students are ready for their studies and to be able to complete theireducation for the duration of the program 32 The activities are organized to develop students knowledge abilities and potential in various ways to support 21stcentury learning skills 33 A consultant who is appointed for academic counseling and guidance to all students must schedule an appointment Office Hours for the', 'place during a summer period This course allows students to put into practice under conditions reflecting their future activities and responsibilities The work carried out under the responsibility of the firm involved is presented in a written report 124 APPENDIX D Curriculum Mapping for General Education Course 125 Curriculum Mapping General Education 01416000 Academic Listening and Speaking 01416001', 'and research regarding teaching techniques assessment and evaluation and so on 22 Development of Academic and Other Professions a Arranging an academic and professional meeting for instructors b Supporting both domesticallyand internationally for instructors to participate in academic conferences lectures andseminars regarding the development of academic and other professions c Arranging for an exchange of', 'a faculty member who is regarded as the student s supervisor The student must report progress to the supervisor regularly Upon completion the student must prepare and deliver oral presentations describing the work from the program 01006302 STUDY ABROAD 6 6012 PREREQUISITE NONE This course is reserved for students who participate in the study abroad program Upon the completion of the program the students', 'to be the Master of Innovation and the Corner Stone of Fundamental in the aspects of education research academic service and preservation of art and culture The program also serves the mission of Faculty of Engineering in producing scholars with academic excellence according to the needs of the country and society developing research to build up the body of knowledge for the development of the country', 'in each course have the knowledge ability and expertise in the course Moreoverthere is a system to monitor the preparation of learning plans and teaching and learning management 6 Educational Resources 61 Budget management a Surveying the need and sufficiency of educational resources b Instigating a plan for educational resources management c Allowing budget for durable articles equipment and learning', 'd Have tracking systems in place to monitor and evaluate students with academic behavioral and other problems e Have teaching assistant programs to aid students towards the specified learning outcomes f Have available scholarships for students with potential g Available student activities and clubs that promote personal development 20 25 Admission Plan and Estimated Graduation in 5 Years Academic Year', 'andor International Research Experience IRE andor taking courses related to research topic provides an opportunity to gain variable handson training and experience in real world situations andor study andor conduct research concerning Robotics and Artificial Intelligence engineering Additionally through exposure to current practice student can reflect on and appreciate the linkage between curriculum and', 'crossinstitute registration of higher education Appendix B 2 Management of the Program 21 DateTime of the Course 1st semester August December 2nd semester January May Summer course June July The actual start and end dates for each academic year will be announced by the office of the registrar 22 Qualification of Applicants The general admission process starts from October RAI classes will begin in August of', 'of adequate education and teaching For the institutional level there is the central library of the institute that provides services for books textbooks journals printing articles and visual media as well as being a member for journals and specific information sources so that students and instructors can effectively search for academic works Details for supporting educational resources can be found in', '01006304 COOPERATIVE EDUCATION STUDY ABROAD OVERSEA TRAINING 6 0450 6 6012 6 0450 C FREE ELECTIVES 6 CREDITS Students must complete at least 6 additional credits from any courses offered by the institution D RAI INTERNSHIP 01006805 0 CREDITS INDUSTRIAL INTERNSHIPS 314 Recommended Study Plan 0 0450 Credit Notation L E S L Lecture Learning hours E Laboratory hours S Selfstudy hours This study plan shows', 'they have at least one academic results published by the criteria established for the academic position in the past 5 years 12 Course Instructor they have direct or indirect qualification Minimum Master Degree or equivalent or academic position no lower than Assistant Professor Moreover they have at least one academic results published by the criteria established for an academic position in the past 5 years', 'for durable articles equipment and learning resources as well as creating educational media d Following and evaluating educational resources management and using the evaluation results for improvement and development of effective educational resources 62 Existing Educational Resources The Faculty has the readiness of location classrooms and laboratories in support of adequate education and teaching For the', 'Groups in the Program Open by Other FacultiesDepartments Programs General Education subjects Free electives 132 Subjects Subject Groups in the Program Open and Required to be Studied by Other FacultiesDepartmentsPrograms Free electives 133 Management The executive program committee is primarily responsible for the program are the representatives to coordinate with the faculty institution instructors and', 'such as global direction public opinions technology business society and economic learn how to extract context of interested area to find opportunities study the processes used to gather behaviors generate intense understanding about areas that lead to innovative concepts produce innovative solutions and finally offering innovative products and services 01006516 INNOVATION MANAGEMENT 4 408 PREREQUISITE NONE', 'education assessment and evaluation b Supporting instructors to participate in academic conferences lectures and seminars regarding teaching and education assessment and evaluation c Arranging a venue for instructors to exchange knowledge regarding teaching techniques assessment and evaluation d Supporting the budget for the development of professional education and research regarding teaching techniques', 'Curriculum Teaching and Assessment of Learners 51 There is a process of designing updating curriculums and courses for advanced content to meet academicprofessional standards In line with the needs of the labor market and the National Economic and Social Development Plan 52 There is an integrated teaching and learning approach to research 53 Instructors are assigned in each course have the knowledge ability', 'and appreciate the linkage between curriculum and practice Students will develop specific skills both on engineering and professionals including handson experience or research experience required to their professional careers 01416632 SPACE SCIENCE 4408 PREREQUISITE NONE This course provides a study of the Solar system such as the planets and minor members of the system Telescopes the Sun the birth life and', 'of King Mongkut s Institute of Technology Ladkrabang to exploit knowledge for the sustainable development of the country and society 13 Relation if any with Other Programs Open in the FacultyOther Departments of the Institute ie Subjects Open for the Service of Other Faculties Departments or to Be Studied with Other FacultiesDepartments 131 SubjectsSubject Groups in the Program Open by Other']","Sorry, My knowledge base does not contain the answer to this question.",King Mongkut's Institute of Technology Ladkrabang.,0.0,0.0,0.049999999995,1.0
What national plan does the program align with?,"['Indicators Academic Year Indicator and Objective 1 At least 80 of the executive program committee of the program participate in the meeting for planning following and revising the operation of the program 2 Having the details of the program consistent with the national or international standard of qualification for the program 3 Having the course syllabus and details of each offered subject and planned', 'Plan The executive program committees utilize the results of analysis and revision to create an improvement plan for the program so that its quality archives the required standards and discuss with the instructor 94 APPENDIX C Course Description 95 COURSE DESCRIPTION 1 GENERAL EDUCATION 11 ENGLISH PROFICIENCY REQUIREMENT ESL 01416000 ACADEMIC LISTENING AND SPEAKING 3 306 PREREQUISITE NONE The course', 'or Development Needed to be Considered for the Planning of the Program 9 12 Effects from 111 and 112 on the Development of the Program and the Relation to the Mission of the Institute 9 13 Relation if any with Other Programs Open in the FacultyOther Departments of the Institute ie Subjects Open for the Service of Other FacultiesDepartments or to Be Studied with Other FacultiesDepartments 10 PART 2 SPECIFIC', '6 Status of the Program and Consideration for the AuthorizationAgreement 5 7 Readiness for Publicization as Qualified and Standardized Program 5 8 Possible Career Path after Graduation 5 9 Name Surname ID Number Position and Qualification of Instructors Responsible for the Program Executive Program Committee 6 10 Location of Study 9 11 External Situation or Development Needed to be Considered for the', 'Groups in the Program Open by Other FacultiesDepartments Programs General Education subjects Free electives 132 Subjects Subject Groups in the Program Open and Required to be Studied by Other FacultiesDepartmentsPrograms Free electives 133 Management The executive program committee is primarily responsible for the program are the representatives to coordinate with the faculty institution instructors and', 'level of the final year students fresh graduates for the quality of the program is used to improve the program 12 The average satisfaction level of the stakeholders is used to improve the program 2020 2021 2022 2023 2024 Total indicators affecting the operation no15 for each year 5 5 5 5 5 Total indicators unit for each year 9 10 10 11 12 Evaluation Criteria The program achieving standards according to the', 'for the Planning of the Program 111 Economic SituationDevelopment The planning of bachelors degree program in Robotics and AI Engineering has been operated according to National Economic and Social Development Plan 2017 2021 which emphasizes on the development of science technology research and innovation in order to reinforce the sustainable growth of the industrial part The program also serves Thailand 4', 'development plan 1 The arrangement of support agencies for engineering education and research and development 1 The total number of engineering education research 2 Budgetary and resource support for engineering projects education and research and development 16 3 Student Outcomes The program in Robotics and AI must have documented student outcomes that prepare graduates to attain the program educational', '21st August 2020 This program has started on 1st semester of academic year 2018 August 20118 7 Readiness for Publication as Qualified and Standardized Program This program is ready for announcement as qualified and standard program according to the qualification standard of higher education in engineering in 2010 in 2022 as well as the ABET Accreditation in 2022 8 Possible Career Path after Graduation', 'Other FacultiesDepartments 10 PART 2 SPECIFIC INFORMATION OF THE PROGRAM 11 1 Philosophy Importance and Objectives of the Program 11 2 Development Plan 14 3 Student Outcomes16 PART 3 SYSTEM FOR EDUCATIONAL PROVISION MANAGEMENT AND STRUCTURE OF THE PROGRAM 18 1 System for Educational Provision 18 2 Management of the Program18 3 Curriculum and Instructors22 2 4 Component Regarding Field Experience Internship', 'of the Operation According to the Details of the Program Having quality assurance system and provision of education according to the standard framework of qualification for higher education as well as ABET Accreditation by having key performance indicators and assessment criteria assigned by the Internal QA committee 4 Revision of the Evaluation and Improvement Plan The executive program committees utilize', 'aforementioned skills of instructors 2 Evaluation of the Program as a Whole Picture The executive program committees evaluate the program as a whole picture when the teaching ends in each academic year by collecting information from students and graduates employers and or stakeholders experts industrial advisory boards or external evaluators 3 Evaluation of the Operation According to the Details of the', 'in each year Academic Year Program Achieving Standard According to the Quality Framework 2021 Achieving mandatory indicators no15 total indicators of 10 total indicators of 10 2022 total indicators of 10 2023 total indicators of 11 2024 total indicators of 12 2020 67 PART 8 EVALUATION AND IMPROVEMENT OF THE OPERATION OF THE PROGRAM 1 Assessment of the Effectiveness of the Teaching 11 Evaluation of Teaching', 'and details of each offered subject and planned activities if any at least before the opening of each semester for all subjects 4 Filing program review and report for the operation of each subject and field experience if any within 30 days after the end of the semester for all subjects 5 Filing report of the operation of the program according to SSRwithin 6 0 days after the end of the academic year 6 Having', 'internships with an innovative company in public or private sectors including Cooperative Education participating in research projects with research labs or academic institutions or working toward the entrepreneurship with incubators The program committee will annually release the policies regarding the eligibility and the conditions required to complete the requirement Students who participate in an', 'education as well as the ABET Accreditation throughout the duration of administration of the program 11 Executive program committee there are no fewer than 5 persons who have either a direct qualification or a related field of study Their qualification is minimum as Master Degree or equivalent or academic positions no lower than Assistant Professor Moreover they have at least one academic results published', 'with the faculty institution instructors and other programs in order to assign the teaching strategies and contents along with the assessment of the program according to the key performance indicator to achieve the objectives of the program and to successfully produce innovative graduates The program committee will consult with members of the programs industrial advisory board The board will be able to', 'according to the program objectives and outcomes Report the verification of the learning achievement to the program committee Program committee takes theresponsible figure for the verification of learning achievement at the curriculum level with the following roles Verify employment status of graduates working directly in the field Have verification from the stakeholders Have verification from another', 'Curriculum Teaching and Assessment of Learners 51 There is a process of designing updating curriculums and courses for advanced content to meet academicprofessional standards In line with the needs of the labor market and the National Economic and Social Development Plan 52 There is an integrated teaching and learning approach to research 53 Instructors are assigned in each course have the knowledge ability', 'advisory board The board will be able to provide general guidelines industrialtrends and demands which will help to keep the content of the program relevant to the current state of the art in the industry 40 11 PART 2 SPECIFIC INFORMATION OF THE PROGRAM 1 Philosophy Importance and Objectives of the Program 11 Philosophy Our economy needs highly skilled engineers to support the growing worldwide digital']",The program aligns with the National Economic and Social Development Plan 2017-2021.,National Economic and Social Development Plan (2017-2021).,1.0,0.7683935203306153,0.12406015036973683,1.0
What is the mission of the Institute mentioned in the document?,"['for innovation 122 Relation to the Mission of the Institute The development of the Robotics and AI Engineering program is related to the strategic advancement of scholar production to create next generation scholars with capabilities and flexibility to adapt to the change in the economy society and culture It also directly reflects the mission of the Institute to be the Master of Innovation and the Corner', 'or Development Needed to be Considered for the Planning of the Program 9 12 Effects from 111 and 112 on the Development of the Program and the Relation to the Mission of the Institute 9 13 Relation if any with Other Programs Open in the FacultyOther Departments of the Institute ie Subjects Open for the Service of Other FacultiesDepartments or to Be Studied with Other FacultiesDepartments 10 PART 2 SPECIFIC', 'Other FacultiesDepartments 10 PART 2 SPECIFIC INFORMATION OF THE PROGRAM 11 1 Philosophy Importance and Objectives of the Program 11 2 Development Plan 14 3 Student Outcomes16 PART 3 SYSTEM FOR EDUCATIONAL PROVISION MANAGEMENT AND STRUCTURE OF THE PROGRAM 18 1 System for Educational Provision 18 2 Management of the Program18 3 Curriculum and Instructors22 2 4 Component Regarding Field Experience Internship', 'to be the Master of Innovation and the Corner Stone of Fundamental in the aspects of education research academic service and preservation of art and culture The program also serves the mission of Faculty of Engineering in producing scholars with academic excellence according to the needs of the country and society developing research to build up the body of knowledge for the development of the country', 'Indicators Academic Year Indicator and Objective 1 At least 80 of the executive program committee of the program participate in the meeting for planning following and revising the operation of the program 2 Having the details of the program consistent with the national or international standard of qualification for the program 3 Having the course syllabus and details of each offered subject and planned', 'Institute of Technology Ladkrabang Regarding the Cross Institute Registration of Higher Education 87 C Course Description 92 D Curriculum Mapping for General Education Course 117 E Facilities Supported Teaching and Learning 121 F Reason for Requesting to Revise Curriculum 129 G List of Program Development Committees 137 H The Academic Publication of Instructors Responsible for The Program 139 4 BACHELOR OF', 'internships with an innovative company in public or private sectors including Cooperative Education participating in research projects with research labs or academic institutions or working toward the entrepreneurship with incubators The program committee will annually release the policies regarding the eligibility and the conditions required to complete the requirement Students who participate in an', '6 Status of the Program and Consideration for the AuthorizationAgreement 5 7 Readiness for Publicization as Qualified and Standardized Program 5 8 Possible Career Path after Graduation 5 9 Name Surname ID Number Position and Qualification of Instructors Responsible for the Program Executive Program Committee 6 10 Location of Study 9 11 External Situation or Development Needed to be Considered for the', 'of the Operation According to the Details of the Program Having quality assurance system and provision of education according to the standard framework of qualification for higher education as well as ABET Accreditation by having key performance indicators and assessment criteria assigned by the Internal QA committee 4 Revision of the Evaluation and Improvement Plan The executive program committees utilize', '21st August 2020 This program has started on 1st semester of academic year 2018 August 20118 7 Readiness for Publication as Qualified and Standardized Program This program is ready for announcement as qualified and standard program according to the qualification standard of higher education in engineering in 2010 in 2022 as well as the ABET Accreditation in 2022 8 Possible Career Path after Graduation', 'Development of the Program and the Relation to the Mission of the Institute 121 Development of the Program The effects of external factors on the development of the Robotics and AI Engineering program Bachelor of Engineering call for the revision of the program so that it can support the needs according to enhancing and improving human capital as well as developing science technology research and innovation', 'is in collaboration with many universities according to the memorandum of understanding MOU such as College of Engineering Carnegie Mellon University the University of South Florida Imperial College Chubu University Kumamoto University BK Birla Institute of Engineering and Technology National Formosa University and South Eastern Regional College etc 56 Degree Given to the Graduates Bachelor of Engineering', 's Institute of Technology Ladkrabang regarding bachelor degree education year 2016 Appendix A 210 Integrated MasterBachelor Program If a student is in the 2nd semester of their third year of study or has completed at least 81 credits with the overall GPA of at least 3 00 the student is guaranteed admission into the integrated master bachelor program in the department The student must also complete the', 'Curriculum Teaching and Assessment of Learners 51 There is a process of designing updating curriculums and courses for advanced content to meet academicprofessional standards In line with the needs of the labor market and the National Economic and Social Development Plan 52 There is an integrated teaching and learning approach to research 53 Instructors are assigned in each course have the knowledge ability', 'Capstone Projects 6 6 B23 RAI Elective Mandatory Subjects 18 15 B24 RAI Elective Subjects 12 9 B25 Alternative Study 6 C Free Electives 6 6 D Internship 0 0 131 131 Course Group A General Education B Robotics and AI Specific Courses TOTAL Credits For Regular Students 24 313 Subjects One academic credit is given to a course offered in a single semester which Meets in class for lecture or discussion for 1', 'a faculty member who is regarded as the student s supervisor The student must report progress to the supervisor regularly Upon completion the student must prepare and deliver oral presentations describing the work from the program 01006302 STUDY ABROAD 6 6012 PREREQUISITE NONE This course is reserved for students who participate in the study abroad program Upon the completion of the program the students', 'crossinstitute registration of higher education Appendix B 2 Management of the Program 21 DateTime of the Course 1st semester August December 2nd semester January May Summer course June July The actual start and end dates for each academic year will be announced by the office of the registrar 22 Qualification of Applicants The general admission process starts from October RAI classes will begin in August of', 'of King Mongkut s Institute of Technology Ladkrabang to exploit knowledge for the sustainable development of the country and society 13 Relation if any with Other Programs Open in the FacultyOther Departments of the Institute ie Subjects Open for the Service of Other Faculties Departments or to Be Studied with Other FacultiesDepartments 131 SubjectsSubject Groups in the Program Open by Other', 'place during a summer period This course allows students to put into practice under conditions reflecting their future activities and responsibilities The work carried out under the responsibility of the firm involved is presented in a written report 124 APPENDIX D Curriculum Mapping for General Education Course 125 Curriculum Mapping General Education 01416000 Academic Listening and Speaking 01416001', 'Scholarship 350000 550000 750000 800000 800000 21 Academic Year 2020 2021 2022 2023 2024 4 Facilities 135333 252000 392000 490000 536667 Facilities Utilities 135333 252000 392000 490000 536667 5 Capital 403600 171600 171600 838267 171600 Equipments Accreditation 1210800 514800 514800 2514800 514800 Total Expense 3962533 5158950 7170733 8619400 8172733 Enrollments 60 90 120 150 120 Estimated expenditure per']","The mission of the Institute mentioned in the document is to be the Master of Innovation and the Corner Stone of Fundamental in the aspects of education, research, academic service, and preservation of art and culture.",Master of Innovation and the Corner Stone of Fundamental.,1.0,0.9999999999999999,0.7499999999625,1.0
What are the 21st-century skills the curriculum aims to cultivate?,"['Our graduates will learn new technologies methodologies and tools and adapt them to respond to the challenges of a changing environment 14 2 Development Plan Development Plan Enhance the quality of the curriculum and teachinglearning activities to that of international standards The development plan for engineering education active learning 21stcentury skillsets and characteristics streamlined to', 'Curriculum Teaching and Assessment of Learners 51 There is a process of designing updating curriculums and courses for advanced content to meet academicprofessional standards In line with the needs of the labor market and the National Economic and Social Development Plan 52 There is an integrated teaching and learning approach to research 53 Instructors are assigned in each course have the knowledge ability', 'and project based learning the students will learn the skills required for today s workforce We embrace the 21st century learning environment to cultivate the students creativity criticalthinking communication and collaboration skills Our students will be introduced to innovative mindsets able to work with multidisciplinary teams and be leaders in their field of study Our graduates will be lifelong learners', '4 an ability to function on multidisciplinary teams 6 an understanding of professional and ethical responsibility 5 Skills for Mathematical Calculation 7 an ability to communicate effectively Communication and Information 8 an ability to use the techniques skills and modern engineering tools necessary for engineering practice Technology Adeptness 50 3 Curriculum Mapping Illustrating the Distribution of', 'skillsets and characteristics streamlined to institutional engineering set Strategies EvidenceIndicator 1 Adjusting engineering to an Outcomebased curriculum by ABET guidelines for undergraduate graduate and doctoral degrees 2 Organize Student Centric teachinglearning environments to facilitate and maximize active learning 3 Facilitate authentic learning or work integrated teachinglearning environments 4', 'skills for success in careers and team environments The course will cover topics such as goal setting career Skills leadership skills teamwork effective communication and public speaking Learning methods will consist of hands on activities and projects group work lecture discussion reading writing and presenting 01006521 MEDITATION FOR LIFE DEVELOPMENT 3 306 PREREQUISITE NONE This course introduces theory', 'Mapping Illustrating the Distribution of Program Standard Learning Outcomes to Course Level Specialized Course Course Major Responsibility Minor Responsibility 1 Moral and ethics 2 Knowledge 3 Intellectual skills 4 Human relation skills and responsibility 5 Skills for mathematical calculation communication and information technology adeptness 1 Perceive the importance of values morals ethics selfsacrifice', 'to support the growing worldwide digital economy Modern engineering programs must recognize stateoftheart technologies and practices while inspiring students to generate innovations We want our graduate to be ready for the everchanging technological landscape The curriculum is designed to drive innovations By combining theoretical foundations with handson experience and project based learning the students', 'other professions c Arranging for an exchange of instructors with both domestic and international institutes to increase the capability of instructors in both teaching and researching 63 PART 7 QUALITY ASSURANCE OF THE PROGRAM 1 Standardization The curriculum management is by the qualified and standardized program according to the qualification standard of higher education as well as the ABET Accreditation', 'as to analyze and interpret data 5 an ability to identify formulate and solve engineering problems 9 a recognition of the need for and an ability to engage in lifelong learning 10 a knowledge of contemporary issues 11 an ability to use the techniques skills and modern engineering tools necessary for engineering practice 4 Human Relation Skills and Responsibility 4 an ability to function on multidisciplinary', 'and AI Students will learn to build innovation identify the opportunities propose ideas design and implement innovative solutions while being able to apply standards and realistic engineering constraints Students also further specialize in their areas of interest and prepare for the next step in their careers 23 31 Curriculum 311 Minimum Credits Required for Graduation 312 Curriculum Structure Minimum', 'for an academic position in the past 5 years 13 The curriculum is updated at least every 5 years by considering the opinions of new graduates alumni industrial advisory board employer and other stakeholders 2 Graduate 21 There is an assessment of the quality of graduates according to the framework of national qualifications as well as the ABET Accreditation 22 There is a survey of graduates who get a job or', 'or academic training programs knowledge of contemporary issues via and ability to use the techniques skills and modern engineering tools necessary for engineering practice via RAI senior capstone projects 18 PART 3 SYSTEM FOR EDUCATIONAL PROVISION MANAGEMENT AND STRUCTURE OF THE PROGRAM 1 System for Educational Provision 11 System An academic year has two semesters each of which covers not less than 15', 'It is in line with the announcement of the Higher Education Commission on English Proficiency Standards of Faculty Members 42 There is a management system for promoting and developing teachers appropriate and consistent with the universitys vision and policy 43 There is a system of teacher quality development to have professors in the field of teaching 5 Curriculum Teaching and Assessment of Learners 51', 'course to ensure that students are ready for their studies and to be able to complete theireducation for the duration of the program 32 The activities are organized to develop students knowledge abilities and potential in various ways to support 21stcentury learning skills 33 A consultant who is appointed for academic counseling and guidance to all students must schedule an appointment Office Hours for the', 'opportunity to gain valuable handson training and experience in real world situations Additionally through exposure to current practice students can reflect on and appreciate the linkage between curriculum and practice This is an advance to the Internship and Coop Education Students will develop specific skills both on engineering and professionals in actual working environment not less than 2 days a week', 'from student to student regarding culture social and academic upbringing all of which influences social bonding and communication effectiveness learning and selfdevelopment 24 Strategies for Solving the IssuesLimitation of the Students in 23 a Arrange an orientation day and counseling session for first year students to advise on available career paths best action plans in line with set objectives and time', 'marketplace advantage 12 c Leadership Our graduates will apply their technical and innovative leadership to establish successful careers in their business profession and community d Economic Impact Our graduates will apply their technical expertise leadership and innovative mindset to support and strengthen the societys economic wellbeing e Lifelong Learning Our graduates will learn new technologies', 'effectively 8 the broad education necessary to understand the impact of engineering solutions in a global economic environmental and societal context 9 a recognition of the need for and an ability to engage in lifelong learning 10 a knowledge of contemporary issues 11 an ability to use the techniques skills and modern engineering tools necessary for engineering practice The outcomes can be presented', '56 1 Moral and ethics 2 Knowledge 3 Intellectual skills 4 Human relation skills and responsibility 5 Skills for mathematical calculation communication and information technology adeptness Course 1 2 3 5 1 2 3 4 5 1 2 3 4 5 01416511 Mobile Robots 01416512 Planning Technique in Robotics 01416518 Industrial Automation 01416519 Modern Control 01416520 Vision System for Mobile Robotics 01416521 Introduction to']","The curriculum aims to cultivate the following 21st-century skills: creativity, critical thinking, communication, and collaboration skills.","Creativity, critical-thinking, communication, and collaboration.",1.0,0.8640402883829098,0.23333333332166667,1.0
What is the 'next S-curve' industry mentioned in the importance of the program?,"['of study Our graduates will be lifelong learners who are aware of technical and societal issues They will be able to create engineering innovations with economics impact and benefit our society 12 Importance The existence of the program is critical to the development of the country In order to accelerate innovation and digitally transform Thai economy for next generation startups and innovation driven', 'to support the growing worldwide digital economy Modern engineering programs must recognize stateoftheart technologies and practices while inspiring students to generate innovations We want our graduate to be ready for the everchanging technological landscape The curriculum is designed to drive innovations By combining theoretical foundations with handson experience and project based learning the students', 'study programs Each team of 1 to 4 students must design and implement a prototype of the proposed innovation Measurements simulations and or characterization of the proposed solution is performed so as to demonstrate that the design objectives and specifications have been met The final design reports must address issues as appropriate that are related to engineering economics commercialization', 'marketplace advantage 12 c Leadership Our graduates will apply their technical and innovative leadership to establish successful careers in their business profession and community d Economic Impact Our graduates will apply their technical expertise leadership and innovative mindset to support and strengthen the societys economic wellbeing e Lifelong Learning Our graduates will learn new technologies', 'for the Planning of the Program 111 Economic SituationDevelopment The planning of bachelors degree program in Robotics and AI Engineering has been operated according to National Economic and Social Development Plan 2017 2021 which emphasizes on the development of science technology research and innovation in order to reinforce the sustainable growth of the industrial part The program also serves Thailand 4', 'part The program also serves Thailand 4 0 policy which emphasizes on integrating emerging technology with current economy to enhance Thailand development and industrially transform Thai economy which will improve economic efficiency and generate new innovation Therefore it is necessary to increase the capacity of digitallyliterate innovative computer engineering workforce who understands the technological', 'Coupling with the ongoing innovations in global computing technology landscape there is a significant demand for highquality graduates who are skillful in computing and innovation for all industries on the verge of digital disruption Existing businesses will have to adapt and innovatively transform itself in order to stay competitive Graduates from Robotics and AI will be the major driving force of the', '21st August 2020 This program has started on 1st semester of academic year 2018 August 20118 7 Readiness for Publication as Qualified and Standardized Program This program is ready for announcement as qualified and standard program according to the qualification standard of higher education in engineering in 2010 in 2022 as well as the ABET Accreditation in 2022 8 Possible Career Path after Graduation', 'level of the final year students fresh graduates for the quality of the program is used to improve the program 12 The average satisfaction level of the stakeholders is used to improve the program 2020 2021 2022 2023 2024 Total indicators affecting the operation no15 for each year 5 5 5 5 5 Total indicators unit for each year 9 10 10 11 12 Evaluation Criteria The program achieving standards according to the', 'PREREQUISITE NONE This course will develop and utilize economic principles to better understand and explain the expansion and integration of information and communications technologies into the global economies It will provide an introduction to concepts and theories useful in analyzing economic aspects of the digital and information technology revolutions 01006509 ENGINEERING AND PUBLIC POLICY 3 306', 'for innovation 122 Relation to the Mission of the Institute The development of the Robotics and AI Engineering program is related to the strategic advancement of scholar production to create next generation scholars with capabilities and flexibility to adapt to the change in the economy society and culture It also directly reflects the mission of the Institute to be the Master of Innovation and the Corner', 'will apply engineering practice combined with the innovative process to identify and solve significant problems across a broad range of applications b Innovation Our graduates will adapt the process by which technological ideas are generated developed and transformed into new business products processes services and solutions that meet the demands and establish marketplace advantage 12 c Leadership Our', 'advisory board The board will be able to provide general guidelines industrialtrends and demands which will help to keep the content of the program relevant to the current state of the art in the industry 40 11 PART 2 SPECIFIC INFORMATION OF THE PROGRAM 1 Philosophy Importance and Objectives of the Program 11 Philosophy Our economy needs highly skilled engineers to support the growing worldwide digital', 'Indicators Academic Year Indicator and Objective 1 At least 80 of the executive program committee of the program participate in the meeting for planning following and revising the operation of the program 2 Having the details of the program consistent with the national or international standard of qualification for the program 3 Having the course syllabus and details of each offered subject and planned', 'next generation startups and innovation driven economy Thai government has established several initiatives relating to startups Startup Thailand innovation Thailand 40 and digital economy Digital Thailand Digital industry including the field of IoT Cloud Embedded device Robotics AI has also been established as the next Scurve in developing a new economy Coupling with the ongoing innovations in global', 'and AI Students will learn to build innovation identify the opportunities propose ideas design and implement innovative solutions while being able to apply standards and realistic engineering constraints Students also further specialize in their areas of interest and prepare for the next step in their careers 23 31 Curriculum 311 Minimum Credits Required for Graduation 312 Curriculum Structure Minimum', 'or Development Needed to be Considered for the Planning of the Program 9 12 Effects from 111 and 112 on the Development of the Program and the Relation to the Mission of the Institute 9 13 Relation if any with Other Programs Open in the FacultyOther Departments of the Institute ie Subjects Open for the Service of Other FacultiesDepartments or to Be Studied with Other FacultiesDepartments 10 PART 2 SPECIFIC', 'Development of the Program and the Relation to the Mission of the Institute 121 Development of the Program The effects of external factors on the development of the Robotics and AI Engineering program Bachelor of Engineering call for the revision of the program so that it can support the needs according to enhancing and improving human capital as well as developing science technology research and innovation', 'OF DATA SCIENCE AND DATA ANALYTIC GENED SCIENCE MATHEMATICS ELECTIVE 3 306 01416306 SAFTY AND STANDARDIZATION IN RAI 3 306 01416319 MANUFACTURING PROCESS 3 306 01006718 DISCRETE MATHEMATICS RAI Elective mandatory Subject 3 306 0141XXXX RAI Elective mandatory subject 3 306 0141XXXX RAI Elective subject 3 306 TOTAL CREDITS 18 3rd YEAR 2nd SEMESTER CODE SUBJECT CREDITS LES XXXXXXX GENED ELECTIVE 3 306 01416315', 'with the faculty institution instructors and other programs in order to assign the teaching strategies and contents along with the assessment of the program according to the key performance indicator to achieve the objectives of the program and to successfully produce innovative graduates The program committee will consult with members of the programs industrial advisory board The board will be able to']","The 'next S-curve' industry mentioned in the importance of the program includes the field of IoT, Cloud, Embedded device, Robotics, and AI.","Digital industry (IoT, Cloud, Robotics, AI).",1.0,0.902199603726402,0.06666666666,1.0
What does 'PEO' stand for in the context of the program?,"['aforementioned skills of instructors 2 Evaluation of the Program as a Whole Picture The executive program committees evaluate the program as a whole picture when the teaching ends in each academic year by collecting information from students and graduates employers and or stakeholders experts industrial advisory boards or external evaluators 3 Evaluation of the Operation According to the Details of the', 'Indicators Academic Year Indicator and Objective 1 At least 80 of the executive program committee of the program participate in the meeting for planning following and revising the operation of the program 2 Having the details of the program consistent with the national or international standard of qualification for the program 3 Having the course syllabus and details of each offered subject and planned', '01416628 01416629 01416630 01416631 01416632 01416633 01416634 01416635 01006006 IT PROJECT MANAGEMENT EXPERIENCE AND EXERCISE FOR INTELLIGENT CONTROL SYSTEM INFORMATION AND CYBER SECURITY INFORMATION SYSTEM SECURITY AND IT LAW ROBOTICS AND AI EXPERIENCE SPACE SCIENCE REINFORCEMENT LEARNING INTRODUCTION TO PROMPT ENGINERRING ADVANCED TECHNIQUES IN ChatGPT CUSTOMIZATION AND APPLICATION INDUSTRIAL EXPERIENCE', 'of the Operation According to the Details of the Program Having quality assurance system and provision of education according to the standard framework of qualification for higher education as well as ABET Accreditation by having key performance indicators and assessment criteria assigned by the Internal QA committee 4 Revision of the Evaluation and Improvement Plan The executive program committees utilize', 'level of the final year students fresh graduates for the quality of the program is used to improve the program 12 The average satisfaction level of the stakeholders is used to improve the program 2020 2021 2022 2023 2024 Total indicators affecting the operation no15 for each year 5 5 5 5 5 Total indicators unit for each year 9 10 10 11 12 Evaluation Criteria The program achieving standards according to the', 'Groups in the Program Open by Other FacultiesDepartments Programs General Education subjects Free electives 132 Subjects Subject Groups in the Program Open and Required to be Studied by Other FacultiesDepartmentsPrograms Free electives 133 Management The executive program committee is primarily responsible for the program are the representatives to coordinate with the faculty institution instructors and', '5th digit th th th 6 7 8 digit 01 41 00 6 means Faculty of Engineering means Robotics and AI program means shared courses means bachelor degree means Order of the subject 25 A GENERAL EDUCATION 30 CREDITS LECTURELABSELF STUDY A1 ENGLISH PROFICIENCY REQUIREMENT ESL 01416000 ACADEMIC LISTENING AND SPEAKING 01416001 ACADEMIC READING AND WRITING 01416003 INTERPRETATION AND ARGUMENTS 9 CREDITS 3 306 3 306 3 306', 'Other FacultiesDepartments 10 PART 2 SPECIFIC INFORMATION OF THE PROGRAM 11 1 Philosophy Importance and Objectives of the Program 11 2 Development Plan 14 3 Student Outcomes16 PART 3 SYSTEM FOR EDUCATIONAL PROVISION MANAGEMENT AND STRUCTURE OF THE PROGRAM 18 1 System for Educational Provision 18 2 Management of the Program18 3 Curriculum and Instructors22 2 4 Component Regarding Field Experience Internship', 'part The program also serves Thailand 4 0 policy which emphasizes on integrating emerging technology with current economy to enhance Thailand development and industrially transform Thai economy which will improve economic efficiency and generate new innovation Therefore it is necessary to increase the capacity of digitallyliterate innovative computer engineering workforce who understands the technological', 'according to the program objectives and outcomes Report the verification of the learning achievement to the program committee Program committee takes theresponsible figure for the verification of learning achievement at the curriculum level with the following roles Verify employment status of graduates working directly in the field Have verification from the stakeholders Have verification from another', 'AND CONTROL SYSTEMS DIGITAL ELECTRONICS AND ELECTRICAL MACHINES 4 408 4 408 4 408 B24 RAI ELECTIVE SUBJECTS For Regular Students For UoB 22 Program Students For Coop Study Aboard Students 12 CREDITS 12 CREDITS 9 CREDITS 01416601 01416602 01416604 01416607 01416608 01416609 01416610 01416611 01416612 01416613 01416614 01416615 01416616 01416617 01416618 01416619 01416620 01416621 01416522 3 236 3 306 3 306 3', 'MATHEMATICS ELECTIVE 3 306 01416310 STRENGTH OF MATERIALS 3 306 01416308 KINEMATICS AND DYNAMICS 3 306 01416305 ARTIFICIAL INTELLIGENCE TECHNOLOGY 3 306 01416516 ROBOTICS LABORATORY 3 1 036 01416500 Computer vision RAI Elective mandatory Subject 3 306 XXXXXXX GENED ELECTIVE 3 306 TOTAL CREDITS 19 33 3rd YEAR 1st SEMESTER CODE SUBJECT CREDITS LES 01416801 MATHEMATICS OF DATA SCIENCE AND DATA ANALYTIC GENED', 'Surname ID Number Position and Qualification of Instructors Responsible for the Program Executive Program Committee NameSurname Academic Position ID Number Qualification Department University Year of Graduation Academic Achievements Dr Poom Konghuayrob DEng Electrical Engineering King Mongkuts Institute of Technology Ladkrabang 2017 MEng Electrical Engineering King Mongkuts Institute of Technology', 'Plan The executive program committees utilize the results of analysis and revision to create an improvement plan for the program so that its quality archives the required standards and discuss with the instructor 94 APPENDIX C Course Description 95 COURSE DESCRIPTION 1 GENERAL EDUCATION 11 ENGLISH PROFICIENCY REQUIREMENT ESL 01416000 ACADEMIC LISTENING AND SPEAKING 3 306 PREREQUISITE NONE The course', 'advisory board The board will be able to provide general guidelines industrialtrends and demands which will help to keep the content of the program relevant to the current state of the art in the industry 40 11 PART 2 SPECIFIC INFORMATION OF THE PROGRAM 1 Philosophy Importance and Objectives of the Program 11 Philosophy Our economy needs highly skilled engineers to support the growing worldwide digital', 'program and retain their fulltime student status 41 Standard for Learning Outcome from Field Experience 411 Possessing the skills to solve problems related to Robotics and AI 412 To be able to work with others as a team with responsibility 413 To be able to lead the member of the team appropriately 414 To be able to Integrate their knowledge to business solutions that apply the appropriate technology and', '6 Status of the Program and Consideration for the AuthorizationAgreement 5 7 Readiness for Publicization as Qualified and Standardized Program 5 8 Possible Career Path after Graduation 5 9 Name Surname ID Number Position and Qualification of Instructors Responsible for the Program Executive Program Committee 6 10 Location of Study 9 11 External Situation or Development Needed to be Considered for the', 'internships with an innovative company in public or private sectors including Cooperative Education participating in research projects with research labs or academic institutions or working toward the entrepreneurship with incubators The program committee will annually release the policies regarding the eligibility and the conditions required to complete the requirement Students who participate in an', 'statements conditionals and iterations Students learn routines or methods as fundamental concepts and practice using strings arrays lists maps or dictionaries pre defined libraries and classes abstraction mechanisms and basic object oriented programming concepts Students will practice related activities of software development life cycle such as system requirement analysis debugging testing and validation', 'Development of the Program and the Relation to the Mission of the Institute 121 Development of the Program The effects of external factors on the development of the Robotics and AI Engineering program Bachelor of Engineering call for the revision of the program so that it can support the needs according to enhancing and improving human capital as well as developing science technology research and innovation']","Sorry, My knowledge base does not contain the answer to this question.",Program Educational Objectives.,1.0,0.0,0.0,1.0
What is Program Educational Objective (a)?,"['Other FacultiesDepartments 10 PART 2 SPECIFIC INFORMATION OF THE PROGRAM 11 1 Philosophy Importance and Objectives of the Program 11 2 Development Plan 14 3 Student Outcomes16 PART 3 SYSTEM FOR EDUCATIONAL PROVISION MANAGEMENT AND STRUCTURE OF THE PROGRAM 18 1 System for Educational Provision 18 2 Management of the Program18 3 Curriculum and Instructors22 2 4 Component Regarding Field Experience Internship', 'of the Operation According to the Details of the Program Having quality assurance system and provision of education according to the standard framework of qualification for higher education as well as ABET Accreditation by having key performance indicators and assessment criteria assigned by the Internal QA committee 4 Revision of the Evaluation and Improvement Plan The executive program committees utilize', 'aforementioned skills of instructors 2 Evaluation of the Program as a Whole Picture The executive program committees evaluate the program as a whole picture when the teaching ends in each academic year by collecting information from students and graduates employers and or stakeholders experts industrial advisory boards or external evaluators 3 Evaluation of the Operation According to the Details of the', 'expert to contribute to research experience and societal impact as well as relating laws and infringements Arranging for extracurricular activities ie community service 47 2 Development of Learning Results in Each Aspect As the RAI programs developmental objective is to meet ABET stipulated standards a learning outcome is designed by the ABET Criterion for Student Outcomes ak of which aim to prepare', 'Indicators Academic Year Indicator and Objective 1 At least 80 of the executive program committee of the program participate in the meeting for planning following and revising the operation of the program 2 Having the details of the program consistent with the national or international standard of qualification for the program 3 Having the course syllabus and details of each offered subject and planned', 'graduates to attain the program educational objectives which adhere to ABET student outcomes for the engineering program 1 an ability to apply knowledge of mathematics science and engineering 2 an ability to design and conduct experiments as well as to analyze and interpret data 3 an ability to design an innovative system component or process to meet desired needs within realistic constraints such as', 'level of the final year students fresh graduates for the quality of the program is used to improve the program 12 The average satisfaction level of the stakeholders is used to improve the program 2020 2021 2022 2023 2024 Total indicators affecting the operation no15 for each year 5 5 5 5 5 Total indicators unit for each year 9 10 10 11 12 Evaluation Criteria The program achieving standards according to the', 'according to the program objectives and outcomes Report the verification of the learning achievement to the program committee Program committee takes theresponsible figure for the verification of learning achievement at the curriculum level with the following roles Verify employment status of graduates working directly in the field Have verification from the stakeholders Have verification from another', 'with the faculty institution instructors and other programs in order to assign the teaching strategies and contents along with the assessment of the program according to the key performance indicator to achieve the objectives of the program and to successfully produce innovative graduates The program committee will consult with members of the programs industrial advisory board The board will be able to', 'education as well as the ABET Accreditation throughout the duration of administration of the program 11 Executive program committee there are no fewer than 5 persons who have either a direct qualification or a related field of study Their qualification is minimum as Master Degree or equivalent or academic positions no lower than Assistant Professor Moreover they have at least one academic results published', 'in each year Academic Year Program Achieving Standard According to the Quality Framework 2021 Achieving mandatory indicators no15 total indicators of 10 total indicators of 10 2022 total indicators of 10 2023 total indicators of 11 2024 total indicators of 12 2020 67 PART 8 EVALUATION AND IMPROVEMENT OF THE OPERATION OF THE PROGRAM 1 Assessment of the Effectiveness of the Teaching 11 Evaluation of Teaching', 'for Student Outcomes ak of which aim to prepare graduates to attain program educational objectives Domains Learning Results Teaching Strategies Honesty Integrating moral and ethics into subject topics or teaching and providing a case study topic for discussion ie news from newspaper television other media or simulation Moral and Ethics Strategies for Evaluation Evaluation of work assignment Evaluation from', 'or academic training programs knowledge of contemporary issues via and ability to use the techniques skills and modern engineering tools necessary for engineering practice via RAI senior capstone projects 18 PART 3 SYSTEM FOR EDUCATIONAL PROVISION MANAGEMENT AND STRUCTURE OF THE PROGRAM 1 System for Educational Provision 11 System An academic year has two semesters each of which covers not less than 15', 'a committee which consists of instructors in the program by arranging an examination in each semester 6 Additional Costs Students will be responsible for the additional costs apart from tuition fees for all subjects in the program 46 PART 4 LEARNING OUTCOME TEACHING STRATEGY AND EVALUATION 1 Development of Special Characteristics of Students Characteristics Engineering Quality RAI students will apply', 'and ethical responsibility ability to communicate effectively by presenting RAI miniprojects the broad education necessary to understand the impact of engineering solutions in a global economic environmental and societal context via RAI industrial prototyping projects recognition of the need for and an ability to engage in lifelong learning from cooperation or academic training programs knowledge of', '4 Component Regarding Field Experience Internship or CoOperative Education43 5 Regulations for Special Project or CoOperative Education 43 6 Additional Costs44 PART 4 LEARNING OUTCOME TEACHING STRATEGY AND EVALUATION45 1 Development of Special Characteristics of Students 45 2 Development of Learning Results in Each Aspect 46 3 Curriculum Mapping Illustrating the Distribution of Program Standard Learning', 'statements conditionals and iterations Students learn routines or methods as fundamental concepts and practice using strings arrays lists maps or dictionaries pre defined libraries and classes abstraction mechanisms and basic object oriented programming concepts Students will practice related activities of software development life cycle such as system requirement analysis debugging testing and validation', 'in each course have the knowledge ability and expertise in the course Moreoverthere is a system to monitor the preparation of learning plans and teaching and learning management 6 Educational Resources 61 Budget management a Surveying the need and sufficiency of educational resources b Instigating a plan for educational resources management c Allowing budget for durable articles equipment and learning', 'The program achieving standards according to the quality framework must pass the following criteria key performance indicators no 1 5 having the results of achieving objectives and having indicators that include the results of archiving objectives no less than 80 of the entire indicators by considering the number of mandatory indicators and total indicators in each year Academic Year Program Achieving', 'and realistic engineering constraints 52 Standard for Learning Outcome Students are able to analyze design and develop a project related to Robotics and AI 45 53 Time Period The 4th academic year 54 Credits 6 Credits 55 Preparation The proposal must be proposed with the approval of the program committee 56 Evaluation Process An evaluation is provided by a committee which consists of instructors in the']","Sorry, My knowledge base does not contain the answer to this question.",Apply engineering practice to solve significant problems.,0.0,0.0,0.0,0.0
What is Program Educational Objective (e)?,"['Other FacultiesDepartments 10 PART 2 SPECIFIC INFORMATION OF THE PROGRAM 11 1 Philosophy Importance and Objectives of the Program 11 2 Development Plan 14 3 Student Outcomes16 PART 3 SYSTEM FOR EDUCATIONAL PROVISION MANAGEMENT AND STRUCTURE OF THE PROGRAM 18 1 System for Educational Provision 18 2 Management of the Program18 3 Curriculum and Instructors22 2 4 Component Regarding Field Experience Internship', 'of the Operation According to the Details of the Program Having quality assurance system and provision of education according to the standard framework of qualification for higher education as well as ABET Accreditation by having key performance indicators and assessment criteria assigned by the Internal QA committee 4 Revision of the Evaluation and Improvement Plan The executive program committees utilize', 'aforementioned skills of instructors 2 Evaluation of the Program as a Whole Picture The executive program committees evaluate the program as a whole picture when the teaching ends in each academic year by collecting information from students and graduates employers and or stakeholders experts industrial advisory boards or external evaluators 3 Evaluation of the Operation According to the Details of the', 'Indicators Academic Year Indicator and Objective 1 At least 80 of the executive program committee of the program participate in the meeting for planning following and revising the operation of the program 2 Having the details of the program consistent with the national or international standard of qualification for the program 3 Having the course syllabus and details of each offered subject and planned', 'education as well as the ABET Accreditation throughout the duration of administration of the program 11 Executive program committee there are no fewer than 5 persons who have either a direct qualification or a related field of study Their qualification is minimum as Master Degree or equivalent or academic positions no lower than Assistant Professor Moreover they have at least one academic results published', 'level of the final year students fresh graduates for the quality of the program is used to improve the program 12 The average satisfaction level of the stakeholders is used to improve the program 2020 2021 2022 2023 2024 Total indicators affecting the operation no15 for each year 5 5 5 5 5 Total indicators unit for each year 9 10 10 11 12 Evaluation Criteria The program achieving standards according to the', 'in each year Academic Year Program Achieving Standard According to the Quality Framework 2021 Achieving mandatory indicators no15 total indicators of 10 total indicators of 10 2022 total indicators of 10 2023 total indicators of 11 2024 total indicators of 12 2020 67 PART 8 EVALUATION AND IMPROVEMENT OF THE OPERATION OF THE PROGRAM 1 Assessment of the Effectiveness of the Teaching 11 Evaluation of Teaching', 'expert to contribute to research experience and societal impact as well as relating laws and infringements Arranging for extracurricular activities ie community service 47 2 Development of Learning Results in Each Aspect As the RAI programs developmental objective is to meet ABET stipulated standards a learning outcome is designed by the ABET Criterion for Student Outcomes ak of which aim to prepare', 'Groups in the Program Open by Other FacultiesDepartments Programs General Education subjects Free electives 132 Subjects Subject Groups in the Program Open and Required to be Studied by Other FacultiesDepartmentsPrograms Free electives 133 Management The executive program committee is primarily responsible for the program are the representatives to coordinate with the faculty institution instructors and', 'graduates to attain the program educational objectives which adhere to ABET student outcomes for the engineering program 1 an ability to apply knowledge of mathematics science and engineering 2 an ability to design and conduct experiments as well as to analyze and interpret data 3 an ability to design an innovative system component or process to meet desired needs within realistic constraints such as', 'Plan The executive program committees utilize the results of analysis and revision to create an improvement plan for the program so that its quality archives the required standards and discuss with the instructor 94 APPENDIX C Course Description 95 COURSE DESCRIPTION 1 GENERAL EDUCATION 11 ENGLISH PROFICIENCY REQUIREMENT ESL 01416000 ACADEMIC LISTENING AND SPEAKING 3 306 PREREQUISITE NONE The course', 'and ethical responsibility ability to communicate effectively by presenting RAI miniprojects the broad education necessary to understand the impact of engineering solutions in a global economic environmental and societal context via RAI industrial prototyping projects recognition of the need for and an ability to engage in lifelong learning from cooperation or academic training programs knowledge of', 'or academic training programs knowledge of contemporary issues via and ability to use the techniques skills and modern engineering tools necessary for engineering practice via RAI senior capstone projects 18 PART 3 SYSTEM FOR EDUCATIONAL PROVISION MANAGEMENT AND STRUCTURE OF THE PROGRAM 1 System for Educational Provision 11 System An academic year has two semesters each of which covers not less than 15', '4 Component Regarding Field Experience Internship or CoOperative Education43 5 Regulations for Special Project or CoOperative Education 43 6 Additional Costs44 PART 4 LEARNING OUTCOME TEACHING STRATEGY AND EVALUATION45 1 Development of Special Characteristics of Students 45 2 Development of Learning Results in Each Aspect 46 3 Curriculum Mapping Illustrating the Distribution of Program Standard Learning', 'in each course have the knowledge ability and expertise in the course Moreoverthere is a system to monitor the preparation of learning plans and teaching and learning management 6 Educational Resources 61 Budget management a Surveying the need and sufficiency of educational resources b Instigating a plan for educational resources management c Allowing budget for durable articles equipment and learning', 'for Student Outcomes ak of which aim to prepare graduates to attain program educational objectives Domains Learning Results Teaching Strategies Honesty Integrating moral and ethics into subject topics or teaching and providing a case study topic for discussion ie news from newspaper television other media or simulation Moral and Ethics Strategies for Evaluation Evaluation of work assignment Evaluation from', 'a committee which consists of instructors in the program by arranging an examination in each semester 6 Additional Costs Students will be responsible for the additional costs apart from tuition fees for all subjects in the program 46 PART 4 LEARNING OUTCOME TEACHING STRATEGY AND EVALUATION 1 Development of Special Characteristics of Students Characteristics Engineering Quality RAI students will apply', 'with the faculty institution instructors and other programs in order to assign the teaching strategies and contents along with the assessment of the program according to the key performance indicator to achieve the objectives of the program and to successfully produce innovative graduates The program committee will consult with members of the programs industrial advisory board The board will be able to', 'according to the program objectives and outcomes Report the verification of the learning achievement to the program committee Program committee takes theresponsible figure for the verification of learning achievement at the curriculum level with the following roles Verify employment status of graduates working directly in the field Have verification from the stakeholders Have verification from another', '21st August 2020 This program has started on 1st semester of academic year 2018 August 20118 7 Readiness for Publication as Qualified and Standardized Program This program is ready for announcement as qualified and standard program according to the qualification standard of higher education in engineering in 2010 in 2022 as well as the ABET Accreditation in 2022 8 Possible Career Path after Graduation']","Sorry, My knowledge base does not contain the answer to this question.",Learn new technologies to respond to a changing environment.,0.0,0.0,0.0,0.0
How many weeks are in a standard academic semester?,"['semesters each of which covers not less than 15 weeks excluding the examination weeks The summer semester is optional Most courses are offered on the main campus during the day Some courses or laboratory hours may be offered in the evening or weekend 12 Provision of Summer Course Summer courses will be offered based on instructors availability and students need 13 System Transfer of Credits in TwoSemester', 'Meets in class for lecture or discussion for 1 hour per week or Contains at least 3 laboratory hours per week Most courses are given 3 or more credits For 4 credit courses these courses usually contain 3 hours of lecture or discussion per week The courses are also accompanied with 1 additional hour of recitation or 3 hours of laboratory work per week Students enrolled in the courses are also expected to', 'hours S Selfstudy hours This study plan shows courses with credits equivalent to 3 However students can register 4 credit courses as well The total number of credits in each subject category will be counted toward the graduation 31 1st YEAR 1st SEMESTER CODE SUBJECT CREDITS LES 01416316 COMPUTER PROGRAMMING FOR RAI 3 225 01006710 INTRODUCATION TO CALCULUS 3 306 01006723 GENERAL PHYSICS 1 3 306 01006724', 'and details of each offered subject and planned activities if any at least before the opening of each semester for all subjects 4 Filing program review and report for the operation of each subject and field experience if any within 30 days after the end of the semester for all subjects 5 Filing report of the operation of the program according to SSRwithin 6 0 days after the end of the academic year 6 Having', 'crossinstitute registration of higher education Appendix B 2 Management of the Program 21 DateTime of the Course 1st semester August December 2nd semester January May Summer course June July The actual start and end dates for each academic year will be announced by the office of the registrar 22 Qualification of Applicants The general admission process starts from October RAI classes will begin in August of', 'enrolled in the courses are also expected to spend at least 8 hours outside the class lab for studying and completing the coursework The instructorled lecture could be delivered as a traditional lecture or include learning activities in which the students can actively participate The recitation is a compliment to a lecture where students can discuss and ask the recitation leader questions to clarify', 'that apply the appropriate technology and information systems to solutions 42 Time Period Internship Summer Course of the 1st 2nd or 3rd academic year CoOperative Education the 1st Semester of the 4th academic year 43 Time Management and Scheduling 8 weeks for Internship or fulltime for one semester for CoOperative Education 5 Regulations for Special Project or CoOperative Education Students are able to', '4th YEAR 1st SEMESTER CODE SUBJECT CREDITS LES XXXXXXX FREE ELECTIVE 3 XXX XXXXXXX GENED ELECTIVE 3 306 0141XXXX RAI Elective mandatory subject 3 306 0141XXXX RAI Elective subject 3 306 TOTAL CREDITS 12 4th YEAR 2nd SEMESTER CODE SUBJECT CREDITS LES 0141XXXX RAI Elective subject 3 306 0141XXXX RAI Elective subject 3 306 01416702 RAI ENGINEERING CAPSTONE DESIGN 3 095 TOTAL CREDITS 9 35 FOR COOPSTUDY ABROAD', 'and Estimated Graduation in 5 Years Academic Year Number of Students 1st year 2020 2021 2022 2023 2024 60 30 30 30 30 60 30 30 30 60 30 30 60 30 2nd year 3rd year 4th year Total 60 90 120 150 120 Estimated to Graduate 60 30 26 Planned Budget Academic Year 2020 2021 2022 2023 2024 1 Personnel 2157500 2912917 3879250 4119250 4119250 Teaching Personnel 1017500 1606250 2191250 2431250 2431250 Administrative', 'for Graduation 312 Curriculum Structure Minimum Credits 131 credits For UoB 22 Program Students Credits For Coop Study Aboard Students 30 30 A1 English Proficiency Requirement ESL 9 9 A2 Communication Humanity and Social Skills 15 15 A3 Math and Science 6 6 95 95 B1 Core Courses 20 20 B2 Major Compulsory Courses 75 75 B21 Fundamental Subjects 39 39 B22 Capstone Projects 6 6 B23 RAI Elective Mandatory', '3 095 TOTAL CREDITS 9 35 FOR COOPSTUDY ABROAD STUDENTS 4th YEAR 1st SEMESTER CODE 01006301 or 01006302 SUBJECT CREDITS LES COOPERATIVE EDUCATION or STUDY ABROAD 6 0450 or 6 6012 TOTAL CREDITS 6 4th YEAR 2nd SEMESTER CODE SUBJECT CREDITS LES XXXXXXX GENED ELECTIVE 3 306 XXXXXXX FREE ELECTIVE 3 XXX 0141XXXX RAI Elective subject 3 306 0141XXXX RAI Elective subject 3 306 01416702 RAI ENGINEERING CAPSTONE DESIGN', 'the Distribution of Program Standard Learning Outcomes to Course Level Specialized Course 49 PART5 CRITERIA FOR STUDENT EVALUATION59 1 Regulations or Criteria for Grading 59 2 Verification of Learning Achievement 59 3 Criteria for Graduation According to the Program 59 PART 6 DEVELOPMENT OF INSTRUCTORS 60 1 Preparation for New Instructors 60 2 Development of Knowledge and Skills for Instructors60 PART 7', 'the department The student must also complete the admission form through the meeting with their academic advisor for their master program If a student does not meet the GPA criteria of 300 he or she is eligible to hisher petition into the program during his or her fourth year with the permission of their academic advisor 22 3 Curriculum and Instructors The B Eng in Robotics and AI program is a four year', 'days after the end of the academic year 6 Having verification of learning achievement at least 2 5 of the subjects open in each academic year 7 Having development revision of the education teaching strategies or evaluation of learning from the result of the assessment of operation reported in the SSR of the previous year 2020 2021 2022 2023 2024 66 Academic Year Indicator and Objective 8 All new instructors', '01006304 COOPERATIVE EDUCATION STUDY ABROAD OVERSEA TRAINING 6 0450 6 6012 6 0450 C FREE ELECTIVES 6 CREDITS Students must complete at least 6 additional credits from any courses offered by the institution D RAI INTERNSHIP 01006805 0 CREDITS INDUSTRIAL INTERNSHIPS 314 Recommended Study Plan 0 0450 Credit Notation L E S L Lecture Learning hours E Laboratory hours S Selfstudy hours This study plan shows', 'in each year Academic Year Program Achieving Standard According to the Quality Framework 2021 Achieving mandatory indicators no15 total indicators of 10 total indicators of 10 2022 total indicators of 10 2023 total indicators of 11 2024 total indicators of 12 2020 67 PART 8 EVALUATION AND IMPROVEMENT OF THE OPERATION OF THE PROGRAM 1 Assessment of the Effectiveness of the Teaching 11 Evaluation of Teaching', 'a faculty member who is regarded as the student s supervisor The student must report progress to the supervisor regularly Upon completion the student must prepare and deliver oral presentations describing the work from the program 01006302 STUDY ABROAD 6 6012 PREREQUISITE NONE This course is reserved for students who participate in the study abroad program Upon the completion of the program the students', 'the requirement Students who participate in an alternative study program as Co Operative Education can do a 16 week extended internship experience Interested students should contact the department or the program committee regarding the current policies and the requirements While on the Co Op assignment the students are participating in a recognized educational program and retain their fulltime student', 'course to ensure that students are ready for their studies and to be able to complete theireducation for the duration of the program 32 The activities are organized to develop students knowledge abilities and potential in various ways to support 21stcentury learning skills 33 A consultant who is appointed for academic counseling and guidance to all students must schedule an appointment Office Hours for the', 'Field None 4 Total Credits At least 131 credits 5 Type of the Program 51 Level 4Year Bachelor Program 52 Program Category Academic bachelors degree program Academic bachelors degree program Advanced academic bachelors degree program 5 53 Medium of Instruction English 54 Admission Thai andor Foreign students 55 Collaboration with Other Institutes The program is in collaboration with many universities']","A standard academic semester covers not less than 15 weeks, excluding the examination weeks.",Not less than 15 weeks.,1.0,0.8758665367504425,0.9999999999,1.0
When is the summer course typically held?,"['semesters each of which covers not less than 15 weeks excluding the examination weeks The summer semester is optional Most courses are offered on the main campus during the day Some courses or laboratory hours may be offered in the evening or weekend 12 Provision of Summer Course Summer courses will be offered based on instructors availability and students need 13 System Transfer of Credits in TwoSemester', 'crossinstitute registration of higher education Appendix B 2 Management of the Program 21 DateTime of the Course 1st semester August December 2nd semester January May Summer course June July The actual start and end dates for each academic year will be announced by the office of the registrar 22 Qualification of Applicants The general admission process starts from October RAI classes will begin in August of', 'that apply the appropriate technology and information systems to solutions 42 Time Period Internship Summer Course of the 1st 2nd or 3rd academic year CoOperative Education the 1st Semester of the 4th academic year 43 Time Management and Scheduling 8 weeks for Internship or fulltime for one semester for CoOperative Education 5 Regulations for Special Project or CoOperative Education Students are able to', 'place during a summer period This course allows students to put into practice under conditions reflecting their future activities and responsibilities The work carried out under the responsibility of the firm involved is presented in a written report 124 APPENDIX D Curriculum Mapping for General Education Course 125 Curriculum Mapping General Education 01416000 Academic Listening and Speaking 01416001', 'from October RAI classes will begin in August of the following year Prospective students are required to satisfy the following requirements a Complete highschool education or equivalent study record Students must also provide the latest official transcript for their highest level of education Students must provide the proof of completion an official diploma or a certificate of completion from their', 'enrolled in the courses are also expected to spend at least 8 hours outside the class lab for studying and completing the coursework The instructorled lecture could be delivered as a traditional lecture or include learning activities in which the students can actively participate The recitation is a compliment to a lecture where students can discuss and ask the recitation leader questions to clarify', '21st August 2020 This program has started on 1st semester of academic year 2018 August 20118 7 Readiness for Publication as Qualified and Standardized Program This program is ready for announcement as qualified and standard program according to the qualification standard of higher education in engineering in 2010 in 2022 as well as the ABET Accreditation in 2022 8 Possible Career Path after Graduation', 'Upon the completion of the program the students must prepare and deliver oral presentations describing their experience from the program 3 INTERNSHIP 01006805 INDUSTRIAL INTERNSHIP 0 0450 PREREQUISITE NONE During their fouryear selected studies students are required to complete a shortterm industrial placement within professional selected environments It takes place during a summer period This course allows', 'Meets in class for lecture or discussion for 1 hour per week or Contains at least 3 laboratory hours per week Most courses are given 3 or more credits For 4 credit courses these courses usually contain 3 hours of lecture or discussion per week The courses are also accompanied with 1 additional hour of recitation or 3 hours of laboratory work per week Students enrolled in the courses are also expected to', 'course to ensure that students are ready for their studies and to be able to complete theireducation for the duration of the program 32 The activities are organized to develop students knowledge abilities and potential in various ways to support 21stcentury learning skills 33 A consultant who is appointed for academic counseling and guidance to all students must schedule an appointment Office Hours for the', 'the requirement Students who participate in an alternative study program as Co Operative Education can do a 16 week extended internship experience Interested students should contact the department or the program committee regarding the current policies and the requirements While on the Co Op assignment the students are participating in a recognized educational program and retain their fulltime student', 'days after the end of the academic year 6 Having verification of learning achievement at least 2 5 of the subjects open in each academic year 7 Having development revision of the education teaching strategies or evaluation of learning from the result of the assessment of operation reported in the SSR of the previous year 2020 2021 2022 2023 2024 66 Academic Year Indicator and Objective 8 All new instructors', '01006304 COOPERATIVE EDUCATION STUDY ABROAD OVERSEA TRAINING 6 0450 6 6012 6 0450 C FREE ELECTIVES 6 CREDITS Students must complete at least 6 additional credits from any courses offered by the institution D RAI INTERNSHIP 01006805 0 CREDITS INDUSTRIAL INTERNSHIPS 314 Recommended Study Plan 0 0450 Credit Notation L E S L Lecture Learning hours E Laboratory hours S Selfstudy hours This study plan shows', 'and details of each offered subject and planned activities if any at least before the opening of each semester for all subjects 4 Filing program review and report for the operation of each subject and field experience if any within 30 days after the end of the semester for all subjects 5 Filing report of the operation of the program according to SSRwithin 6 0 days after the end of the academic year 6 Having', 'must schedule an appointment Office Hours for the student to consult 34 There is student complaints management system and the satisfaction rating of complaint management result are evaluated 64 4 Instructor 41 There is a system for accepting new Instructors by university regulations The English proficiency test is required according to the university criteria It is in line with the announcement of the', 'Indicators Academic Year Indicator and Objective 1 At least 80 of the executive program committee of the program participate in the meeting for planning following and revising the operation of the program 2 Having the details of the program consistent with the national or international standard of qualification for the program 3 Having the course syllabus and details of each offered subject and planned', 'the department The student must also complete the admission form through the meeting with their academic advisor for their master program If a student does not meet the GPA criteria of 300 he or she is eligible to hisher petition into the program during his or her fourth year with the permission of their academic advisor 22 3 Curriculum and Instructors The B Eng in Robotics and AI program is a four year', 'internships with an innovative company in public or private sectors including Cooperative Education participating in research projects with research labs or academic institutions or working toward the entrepreneurship with incubators The program committee will annually release the policies regarding the eligibility and the conditions required to complete the requirement Students who participate in an', 'in each course have the knowledge ability and expertise in the course Moreoverthere is a system to monitor the preparation of learning plans and teaching and learning management 6 Educational Resources 61 Budget management a Surveying the need and sufficiency of educational resources b Instigating a plan for educational resources management c Allowing budget for durable articles equipment and learning', 'Groups in the Program Open by Other FacultiesDepartments Programs General Education subjects Free electives 132 Subjects Subject Groups in the Program Open and Required to be Studied by Other FacultiesDepartmentsPrograms Free electives 133 Management The executive program committee is primarily responsible for the program are the representatives to coordinate with the faculty institution instructors and']",The summer course is typically held in June and July.,June - July.,0.0,1.0,0.7916666666402777,1.0
What is the minimum high-school requirement for applicants?,"['Field None 4 Total Credits At least 131 credits 5 Type of the Program 51 Level 4Year Bachelor Program 52 Program Category Academic bachelors degree program Academic bachelors degree program Advanced academic bachelors degree program 5 53 Medium of Instruction English 54 Admission Thai andor Foreign students 55 Collaboration with Other Institutes The program is in collaboration with many universities', 'education as well as the ABET Accreditation throughout the duration of administration of the program 11 Executive program committee there are no fewer than 5 persons who have either a direct qualification or a related field of study Their qualification is minimum as Master Degree or equivalent or academic positions no lower than Assistant Professor Moreover they have at least one academic results published', 'occupational or professional skill and life skills 3 Criteria for Graduation According to the Program Students must complete at least 131 credits to graduate with at least 30 credits from general education courses at least 95 credits from Robotics and AI concentration and at least 6 credits of free electives and English proficiency level prior to the graduation Students must also complete the internship', 'for Graduation 312 Curriculum Structure Minimum Credits 131 credits For UoB 22 Program Students Credits For Coop Study Aboard Students 30 30 A1 English Proficiency Requirement ESL 9 9 A2 Communication Humanity and Social Skills 15 15 A3 Math and Science 6 6 95 95 B1 Core Courses 20 20 B2 Major Compulsory Courses 75 75 B21 Fundamental Subjects 39 39 B22 Capstone Projects 6 6 B23 RAI Elective Mandatory', 'the department The student must also complete the admission form through the meeting with their academic advisor for their master program If a student does not meet the GPA criteria of 300 he or she is eligible to hisher petition into the program during his or her fourth year with the permission of their academic advisor 22 3 Curriculum and Instructors The B Eng in Robotics and AI program is a four year', 'from October RAI classes will begin in August of the following year Prospective students are required to satisfy the following requirements a Complete highschool education or equivalent study record Students must also provide the latest official transcript for their highest level of education Students must provide the proof of completion an official diploma or a certificate of completion from their', 'diploma or a certificate of completion from their highschool education or equivalent study before their enrollment b Standardized test Students must obtain the standardized test scores as specified in the admission announcement c English Language Proficiency If prospective students are nonnative English speakers they must obtain the results of the Test of English as a Foreign Language TOEFL or the', '6 Status of the Program and Consideration for the AuthorizationAgreement 5 7 Readiness for Publicization as Qualified and Standardized Program 5 8 Possible Career Path after Graduation 5 9 Name Surname ID Number Position and Qualification of Instructors Responsible for the Program Executive Program Committee 6 10 Location of Study 9 11 External Situation or Development Needed to be Considered for the', '60 90 120 150 120 Estimated expenditure per person for producing a scholar according to the program equals to an average of 194613 bahtpersonyear 27 Educational System Class room 28 Transfer of Credits Subjects and Cross Institute Registration of Higher Education if any Credits can be transferred upon the consent of executive program committee according to the Regulation of King Mongkuts Institute of', 'Upon the completion of the program the students must prepare and deliver oral presentations describing their experience from the program 3 INTERNSHIP 01006805 INDUSTRIAL INTERNSHIP 0 0450 PREREQUISITE NONE During their fouryear selected studies students are required to complete a shortterm industrial placement within professional selected environments It takes place during a summer period This course allows', 's Institute of Technology Ladkrabang regarding bachelor degree education year 2016 Appendix A 210 Integrated MasterBachelor Program If a student is in the 2nd semester of their third year of study or has completed at least 81 credits with the overall GPA of at least 3 00 the student is guaranteed admission into the integrated master bachelor program in the department The student must also complete the', 'semesters each of which covers not less than 15 weeks excluding the examination weeks The summer semester is optional Most courses are offered on the main campus during the day Some courses or laboratory hours may be offered in the evening or weekend 12 Provision of Summer Course Summer courses will be offered based on instructors availability and students need 13 System Transfer of Credits in TwoSemester', 'expert to contribute to research experience and societal impact as well as relating laws and infringements Arranging for extracurricular activities ie community service 47 2 Development of Learning Results in Each Aspect As the RAI programs developmental objective is to meet ABET stipulated standards a learning outcome is designed by the ABET Criterion for Student Outcomes ak of which aim to prepare', 'graduates to attain the program educational objectives which adhere to ABET student outcomes for the engineering program 1 an ability to apply knowledge of mathematics science and engineering 2 an ability to design and conduct experiments as well as to analyze and interpret data 3 an ability to design an innovative system component or process to meet desired needs within realistic constraints such as', 'the Distribution of Program Standard Learning Outcomes to Course Level Specialized Course 49 PART5 CRITERIA FOR STUDENT EVALUATION59 1 Regulations or Criteria for Grading 59 2 Verification of Learning Achievement 59 3 Criteria for Graduation According to the Program 59 PART 6 DEVELOPMENT OF INSTRUCTORS 60 1 Preparation for New Instructors 60 2 Development of Knowledge and Skills for Instructors60 PART 7', 'or Criteria for Grading Regulations or criteria for grading are in accordance with the Regulations of King Mongkut s Institute of Technology Ladkrabang regarding Bachelors Degree Education 2016 Appendix A 2 Verification of Learning Achievement 21 Verification of Learning Achievement before Graduation Program committee assigned a responsible figure for the verification of learning achievement according to', 'of English as a Foreign Language TOEFL or the International English Language Testing System IELTS in addition to the other required standardized test scores Other types of the accepted score will be specified in the admission announcement 19 d Personal Statement Students must obtain their personal statements along with the application as specified in the admission announcement e Teacher Recommendation', 'Meets in class for lecture or discussion for 1 hour per week or Contains at least 3 laboratory hours per week Most courses are given 3 or more credits For 4 credit courses these courses usually contain 3 hours of lecture or discussion per week The courses are also accompanied with 1 additional hour of recitation or 3 hours of laboratory work per week Students enrolled in the courses are also expected to', '3 306 01416702 RAI ENGINEERING CAPSTONE DESIGN 3 095 TOTAL CREDITS 15 Total credits required for graduation at least 315 Details of Each Subject Course description Appendix C 131 credits 36 32 Name Surname ID Number Position and Qualification of Instructors 321 Executive Program Committees NameSurname Academic Position ID Number Assoc Prof Dr Pitikhate Sooraksa Electrical Engineering Assoc Prof Dr Chutimet', 'The program achieving standards according to the quality framework must pass the following criteria key performance indicators no 1 5 having the results of achieving objectives and having indicators that include the results of archiving objectives no less than 80 of the entire indicators by considering the number of mandatory indicators and total indicators in each year Academic Year Program Achieving']","Applicants must complete high school education or have an equivalent study record. They must also provide the latest official transcript for their highest level of education and proof of completion, such as an official diploma or a certificate of completion from their high school education or equivalent study before their enrollment.",Complete high-school education or equivalent.,1.0,0.7760400358644639,0.22619047617916663,1.0
What English proficiency tests are accepted for non-native speakers?,"['diploma or a certificate of completion from their highschool education or equivalent study before their enrollment b Standardized test Students must obtain the standardized test scores as specified in the admission announcement c English Language Proficiency If prospective students are nonnative English speakers they must obtain the results of the Test of English as a Foreign Language TOEFL or the', 'of English as a Foreign Language TOEFL or the International English Language Testing System IELTS in addition to the other required standardized test scores Other types of the accepted score will be specified in the admission announcement 19 d Personal Statement Students must obtain their personal statements along with the application as specified in the admission announcement e Teacher Recommendation', 'AND SPEAKING 3 306 PREREQUISITE NONE The course provides ESL students guidance and extensive practice in listening and speaking in academic and professional settings Listening focuses on understanding spoken English in formats such as college lectures and news broadcasts Note taking tasks are also included to reinforce aural comprehension Students learn to recognize organizational patterns Students also', 'must schedule an appointment Office Hours for the student to consult 34 There is student complaints management system and the satisfaction rating of complaint management result are evaluated 64 4 Instructor 41 There is a system for accepting new Instructors by university regulations The English proficiency test is required according to the university criteria It is in line with the announcement of the', 'to improve the reading and writing skills of ESL students Students receive practice on reading and vocabulary development Reading practice will emphasize paraphrasing summarizing and the simple analysis of texts to identify main ideas and distinguish fact from opinion Writing practice includes writing of simple and compound sentences using compound tenses and correct word forms word order spelling and', 'and correct word forms word order spelling and punctuation Students will also develop the ability to write varied complex sentences and effective paragraphs in standard written English 01006003 INTERPRETATION AND ARGUMENTS 3 306 PREREQUISITE NONE This course provides the study of interpreting and analyzing written and visual arguments Students will learn to identify the underlying values definitions and', 'TECHNOLOGY 3 306 PREREQUISITE NONE This course will help students improve their critical thinkinganalytical skills through a combination of reading articles listening to lectures and watching audiovisual programs on current hot topics in science and technology Students will have directed practice in various areas of pronunciation such as stress intonation reductions ie informal speech linking consonant and', 'ie informal speech linking consonant and vowel production rhythm and pitch This course will help participants improve their oral presentation skills through an intercultural scientifictechnological research project This course is designed to inspire students to realize the power of R D ie research and development in science and technology through studying distinguished entrepreneurs 13 MATH AND SCIENCE', 'recognize organizational patterns Students also practice outlining main ideas and supporting details through audiotaped videotaped and live presentations Speaking focuses on increased fluency and communicative strategies used by native speakers in academic and professional settings 01416001 ACADEMIC READING AND WRITING 3 306 PREREQUISITE NONE This course is designed to improve the reading and writing skills', 'It is in line with the announcement of the Higher Education Commission on English Proficiency Standards of Faculty Members 42 There is a management system for promoting and developing teachers appropriate and consistent with the universitys vision and policy 43 There is a system of teacher quality development to have professors in the field of teaching 5 Curriculum Teaching and Assessment of Learners 51', 'for Graduation 312 Curriculum Structure Minimum Credits 131 credits For UoB 22 Program Students Credits For Coop Study Aboard Students 30 30 A1 English Proficiency Requirement ESL 9 9 A2 Communication Humanity and Social Skills 15 15 A3 Math and Science 6 6 95 95 B1 Core Courses 20 20 B2 Major Compulsory Courses 75 75 B21 Fundamental Subjects 39 39 B22 Capstone Projects 6 6 B23 RAI Elective Mandatory', 'Plan The executive program committees utilize the results of analysis and revision to create an improvement plan for the program so that its quality archives the required standards and discuss with the instructor 94 APPENDIX C Course Description 95 COURSE DESCRIPTION 1 GENERAL EDUCATION 11 ENGLISH PROFICIENCY REQUIREMENT ESL 01416000 ACADEMIC LISTENING AND SPEAKING 3 306 PREREQUISITE NONE The course', 'verification of learning achievement according to the standard for every subject Instructors of the program are obligated to verify the learning achievement of students with the following roles Verify teaching learning procedure i e lesson plan evaluation exam test evaluation report evaluation and student behavior evaluation Verify the learning achievement according to the program objectives and outcomes', 'the Distribution of Program Standard Learning Outcomes to Course Level Specialized Course 49 PART5 CRITERIA FOR STUDENT EVALUATION59 1 Regulations or Criteria for Grading 59 2 Verification of Learning Achievement 59 3 Criteria for Graduation According to the Program 59 PART 6 DEVELOPMENT OF INSTRUCTORS 60 1 Preparation for New Instructors 60 2 Development of Knowledge and Skills for Instructors60 PART 7', 'Field None 4 Total Credits At least 131 credits 5 Type of the Program 51 Level 4Year Bachelor Program 52 Program Category Academic bachelors degree program Academic bachelors degree program Advanced academic bachelors degree program 5 53 Medium of Instruction English 54 Admission Thai andor Foreign students 55 Collaboration with Other Institutes The program is in collaboration with many universities', 'ask the recitation leader questions to clarify concepts facts or problem sets from the lecture The laboratory hours give students the opportunity to learn from handson experience using specialized equipment or software related to the courses contents Meaning of the Subject Codes Subject Codes are assigned with 8 digits as follows 1st 2nd digit 3rd 4th digit 5th digit th th th 6 7 8 digit 01 41 00 6 means', 'and education and augmentation of knowledge 14 Academic support provisions through workshops and training both domestically and abroad in the fields of responsibility 2 Development of Knowledge and Skills for Instructors 21 Development of Skills for Teaching and Education Assessment and Evaluation a Arranging an academic meeting regarding teaching and education assessment and evaluation b Supporting', 'they have at least one academic results published by the criteria established for the academic position in the past 5 years 12 Course Instructor they have direct or indirect qualification Minimum Master Degree or equivalent or academic position no lower than Assistant Professor Moreover they have at least one academic results published by the criteria established for an academic position in the past 5 years', '01006304 COOPERATIVE EDUCATION STUDY ABROAD OVERSEA TRAINING 6 0450 6 6012 6 0450 C FREE ELECTIVES 6 CREDITS Students must complete at least 6 additional credits from any courses offered by the institution D RAI INTERNSHIP 01006805 0 CREDITS INDUSTRIAL INTERNSHIPS 314 Recommended Study Plan 0 0450 Credit Notation L E S L Lecture Learning hours E Laboratory hours S Selfstudy hours This study plan shows', 'the stakeholders Have verification from another university 22 Verification of Learning Achievement after Graduation To the purpose of improving educational and curricular development the following assessments are in place Survey stakeholder satisfaction Assessed by the graduate user Award or commendation the graduates receive in the aspects of ethics knowledge occupational or professional skill and life']",The Test of English as a Foreign Language (TOEFL) and the International English Language Testing System (IELTS) are accepted for non-native speakers. Other types of accepted scores will be specified in the admission announcement.,TOEFL or IELTS.,1.0,1.0000000000000002,0.49999999995,1.0
What is a common issue for new students mentioned in the doc?,"['course to ensure that students are ready for their studies and to be able to complete theireducation for the duration of the program 32 The activities are organized to develop students knowledge abilities and potential in various ways to support 21stcentury learning skills 33 A consultant who is appointed for academic counseling and guidance to all students must schedule an appointment Office Hours for the', 'must schedule an appointment Office Hours for the student to consult 34 There is student complaints management system and the satisfaction rating of complaint management result are evaluated 64 4 Instructor 41 There is a system for accepting new Instructors by university regulations The English proficiency test is required according to the university criteria It is in line with the announcement of the', 'from student to student regarding culture social and academic upbringing all of which influences social bonding and communication effectiveness learning and selfdevelopment 24 Strategies for Solving the IssuesLimitation of the Students in 23 a Arrange an orientation day and counseling session for first year students to advise on available career paths best action plans in line with set objectives and time', 'a faculty member who is regarded as the student s supervisor The student must report progress to the supervisor regularly Upon completion the student must prepare and deliver oral presentations describing the work from the program 01006302 STUDY ABROAD 6 6012 PREREQUISITE NONE This course is reserved for students who participate in the study abroad program Upon the completion of the program the students', 'to identify the underlying values definitions and assumptions in those arguments The students also learn how to synthesize a multiplicity of competing perspectives and to articulate fundamental disagreements between those perspectives Ultimately students will advance their contributions to discussions in engineering business innovations and technology studies 12 COMMUNICATION HUMANITY AND SOCIAL SKILLS', 'and correct word forms word order spelling and punctuation Students will also develop the ability to write varied complex sentences and effective paragraphs in standard written English 01006003 INTERPRETATION AND ARGUMENTS 3 306 PREREQUISITE NONE This course provides the study of interpreting and analyzing written and visual arguments Students will learn to identify the underlying values definitions and', 'ask the recitation leader questions to clarify concepts facts or problem sets from the lecture The laboratory hours give students the opportunity to learn from handson experience using specialized equipment or software related to the courses contents Meaning of the Subject Codes Subject Codes are assigned with 8 digits as follows 1st 2nd digit 3rd 4th digit 5th digit th th th 6 7 8 digit 01 41 00 6 means', 'enrolled in the courses are also expected to spend at least 8 hours outside the class lab for studying and completing the coursework The instructorled lecture could be delivered as a traditional lecture or include learning activities in which the students can actively participate The recitation is a compliment to a lecture where students can discuss and ask the recitation leader questions to clarify', 'admission announcement e Teacher Recommendation Students must obtain recommendations from their teachers or supervisors 23 Issues of New Students a Adjusting to social settings and lifestyles on campus which allow greater independence and freedom compared to high schools b Tuition fees and other financial requirements c Diverse ethnicity as backgrounds varies from student to student regarding culture social', 'statements conditionals and iterations Students learn routines or methods as fundamental concepts and practice using strings arrays lists maps or dictionaries pre defined libraries and classes abstraction mechanisms and basic object oriented programming concepts Students will practice related activities of software development life cycle such as system requirement analysis debugging testing and validation', 'action plans in line with set objectives and time management b Arrange advisor system to overlook care and provide counseling for students about all aspects of life on and off campus particularly students facing academic difficulties and or domestic and other issues c Arrange activities that promote relationship forming bonding and caring among students d Have tracking systems in place to monitor and', 'opportunity to gain valuable handson training and experience in real world situations Additionally through exposure to current practice students can reflect on and appreciate the linkage between curriculum and practice This is an advance to the Internship and Coop Education Students will develop specific skills both on engineering and professionals in actual working environment not less than 2 days a week', 'from October RAI classes will begin in August of the following year Prospective students are required to satisfy the following requirements a Complete highschool education or equivalent study record Students must also provide the latest official transcript for their highest level of education Students must provide the proof of completion an official diploma or a certificate of completion from their', 'expert to contribute to research experience and societal impact as well as relating laws and infringements Arranging for extracurricular activities ie community service 47 2 Development of Learning Results in Each Aspect As the RAI programs developmental objective is to meet ABET stipulated standards a learning outcome is designed by the ABET Criterion for Student Outcomes ak of which aim to prepare', 'they have at least one academic results published by the criteria established for the academic position in the past 5 years 12 Course Instructor they have direct or indirect qualification Minimum Master Degree or equivalent or academic position no lower than Assistant Professor Moreover they have at least one academic results published by the criteria established for an academic position in the past 5 years', 'Meets in class for lecture or discussion for 1 hour per week or Contains at least 3 laboratory hours per week Most courses are given 3 or more credits For 4 credit courses these courses usually contain 3 hours of lecture or discussion per week The courses are also accompanied with 1 additional hour of recitation or 3 hours of laboratory work per week Students enrolled in the courses are also expected to', 'for individual development Work assignment for participation with others in appropriate ways Work assignment to practice the student for systematically comparative relation regulation such as rubric score 49 Mapping TQF Learning Outcomes and ABET Student Outcomes TQF Learning Outcomes ABET Student Outcomes 1 Moral and Ethics 8 an understanding of professional and ethical responsibility 6 the broad education', 'education as well as the ABET Accreditation throughout the duration of administration of the program 11 Executive program committee there are no fewer than 5 persons who have either a direct qualification or a related field of study Their qualification is minimum as Master Degree or equivalent or academic positions no lower than Assistant Professor Moreover they have at least one academic results published', 'areas Each semester will include a project based theme which helps students practice and design innovative solutions in the respective areas In the first year the students study basic courses in mathematics and science and improve their communication skills Students will also be introduced to fundamental programming concepts and the foundation of robotics systems The firstyear projects will give students', 'works and assign a leader for each group as well as having every member participate in a presentation to train students for leadership moreover how to be a good team member Instigating rules for discipline ie punctuality for class attendance and participation in the classroom to foster courage in expressing opinions Arranging for a special lecture by an expert to contribute to research experience and']","A common issue for new students mentioned in the document is adjusting to social settings and lifestyles on campus, which allow greater independence and freedom compared to high schools.",Adjusting to social settings and campus lifestyles.,1.0,0.8662705568840519,0.2777777777638889,1.0
How many 1st year students were planned for the 2020 academic year?,"['and Estimated Graduation in 5 Years Academic Year Number of Students 1st year 2020 2021 2022 2023 2024 60 30 30 30 30 60 30 30 30 60 30 30 60 30 2nd year 3rd year 4th year Total 60 90 120 150 120 Estimated to Graduate 60 30 26 Planned Budget Academic Year 2020 2021 2022 2023 2024 1 Personnel 2157500 2912917 3879250 4119250 4119250 Teaching Personnel 1017500 1606250 2191250 2431250 2431250 Administrative', '21st August 2020 This program has started on 1st semester of academic year 2018 August 20118 7 Readiness for Publication as Qualified and Standardized Program This program is ready for announcement as qualified and standard program according to the qualification standard of higher education in engineering in 2010 in 2022 as well as the ABET Accreditation in 2022 8 Possible Career Path after Graduation', 'Indicators Academic Year Indicator and Objective 1 At least 80 of the executive program committee of the program participate in the meeting for planning following and revising the operation of the program 2 Having the details of the program consistent with the national or international standard of qualification for the program 3 Having the course syllabus and details of each offered subject and planned', 'level of the final year students fresh graduates for the quality of the program is used to improve the program 12 The average satisfaction level of the stakeholders is used to improve the program 2020 2021 2022 2023 2024 Total indicators affecting the operation no15 for each year 5 5 5 5 5 Total indicators unit for each year 9 10 10 11 12 Evaluation Criteria The program achieving standards according to the', 'in each year Academic Year Program Achieving Standard According to the Quality Framework 2021 Achieving mandatory indicators no15 total indicators of 10 total indicators of 10 2022 total indicators of 10 2023 total indicators of 11 2024 total indicators of 12 2020 67 PART 8 EVALUATION AND IMPROVEMENT OF THE OPERATION OF THE PROGRAM 1 Assessment of the Effectiveness of the Teaching 11 Evaluation of Teaching', 'areas Each semester will include a project based theme which helps students practice and design innovative solutions in the respective areas In the first year the students study basic courses in mathematics and science and improve their communication skills Students will also be introduced to fundamental programming concepts and the foundation of robotics systems The firstyear projects will give students', 'for Graduation 312 Curriculum Structure Minimum Credits 131 credits For UoB 22 Program Students Credits For Coop Study Aboard Students 30 30 A1 English Proficiency Requirement ESL 9 9 A2 Communication Humanity and Social Skills 15 15 A3 Math and Science 6 6 95 95 B1 Core Courses 20 20 B2 Major Compulsory Courses 75 75 B21 Fundamental Subjects 39 39 B22 Capstone Projects 6 6 B23 RAI Elective Mandatory', 'hours S Selfstudy hours This study plan shows courses with credits equivalent to 3 However students can register 4 credit courses as well The total number of credits in each subject category will be counted toward the graduation 31 1st YEAR 1st SEMESTER CODE SUBJECT CREDITS LES 01416316 COMPUTER PROGRAMMING FOR RAI 3 225 01006710 INTRODUCATION TO CALCULUS 3 306 01006723 GENERAL PHYSICS 1 3 306 01006724', 'days after the end of the academic year 6 Having verification of learning achievement at least 2 5 of the subjects open in each academic year 7 Having development revision of the education teaching strategies or evaluation of learning from the result of the assessment of operation reported in the SSR of the previous year 2020 2021 2022 2023 2024 66 Academic Year Indicator and Objective 8 All new instructors', 'from October RAI classes will begin in August of the following year Prospective students are required to satisfy the following requirements a Complete highschool education or equivalent study record Students must also provide the latest official transcript for their highest level of education Students must provide the proof of completion an official diploma or a certificate of completion from their', 'Scholarship 350000 550000 750000 800000 800000 21 Academic Year 2020 2021 2022 2023 2024 4 Facilities 135333 252000 392000 490000 536667 Facilities Utilities 135333 252000 392000 490000 536667 5 Capital 403600 171600 171600 838267 171600 Equipments Accreditation 1210800 514800 514800 2514800 514800 Total Expense 3962533 5158950 7170733 8619400 8172733 Enrollments 60 90 120 150 120 Estimated expenditure per', 'development plan 1 The arrangement of support agencies for engineering education and research and development 1 The total number of engineering education research 2 Budgetary and resource support for engineering projects education and research and development 16 3 Student Outcomes The program in Robotics and AI must have documented student outcomes that prepare graduates to attain the program educational', '4th YEAR 1st SEMESTER CODE SUBJECT CREDITS LES XXXXXXX FREE ELECTIVE 3 XXX XXXXXXX GENED ELECTIVE 3 306 0141XXXX RAI Elective mandatory subject 3 306 0141XXXX RAI Elective subject 3 306 TOTAL CREDITS 12 4th YEAR 2nd SEMESTER CODE SUBJECT CREDITS LES 0141XXXX RAI Elective subject 3 306 0141XXXX RAI Elective subject 3 306 01416702 RAI ENGINEERING CAPSTONE DESIGN 3 095 TOTAL CREDITS 9 35 FOR COOPSTUDY ABROAD', '6 Status of the Program and Consideration for the AuthorizationAgreement 5 7 Readiness for Publicization as Qualified and Standardized Program 5 8 Possible Career Path after Graduation 5 9 Name Surname ID Number Position and Qualification of Instructors Responsible for the Program Executive Program Committee 6 10 Location of Study 9 11 External Situation or Development Needed to be Considered for the', '3 095 TOTAL CREDITS 9 35 FOR COOPSTUDY ABROAD STUDENTS 4th YEAR 1st SEMESTER CODE 01006301 or 01006302 SUBJECT CREDITS LES COOPERATIVE EDUCATION or STUDY ABROAD 6 0450 or 6 6012 TOTAL CREDITS 6 4th YEAR 2nd SEMESTER CODE SUBJECT CREDITS LES XXXXXXX GENED ELECTIVE 3 306 XXXXXXX FREE ELECTIVE 3 XXX 0141XXXX RAI Elective subject 3 306 0141XXXX RAI Elective subject 3 306 01416702 RAI ENGINEERING CAPSTONE DESIGN', 'crossinstitute registration of higher education Appendix B 2 Management of the Program 21 DateTime of the Course 1st semester August December 2nd semester January May Summer course June July The actual start and end dates for each academic year will be announced by the office of the registrar 22 Qualification of Applicants The general admission process starts from October RAI classes will begin in August of', 'd Have tracking systems in place to monitor and evaluate students with academic behavioral and other problems e Have teaching assistant programs to aid students towards the specified learning outcomes f Have available scholarships for students with potential g Available student activities and clubs that promote personal development 20 25 Admission Plan and Estimated Graduation in 5 Years Academic Year', 'or academic training programs knowledge of contemporary issues via and ability to use the techniques skills and modern engineering tools necessary for engineering practice via RAI senior capstone projects 18 PART 3 SYSTEM FOR EDUCATIONAL PROVISION MANAGEMENT AND STRUCTURE OF THE PROGRAM 1 System for Educational Provision 11 System An academic year has two semesters each of which covers not less than 15', 'course to ensure that students are ready for their studies and to be able to complete theireducation for the duration of the program 32 The activities are organized to develop students knowledge abilities and potential in various ways to support 21stcentury learning skills 33 A consultant who is appointed for academic counseling and guidance to all students must schedule an appointment Office Hours for the', 'and AI Students will learn to build innovation identify the opportunities propose ideas design and implement innovative solutions while being able to apply standards and realistic engineering constraints Students also further specialize in their areas of interest and prepare for the next step in their careers 23 31 Curriculum 311 Minimum Credits Required for Graduation 312 Curriculum Structure Minimum']",60 1st year students were planned for the 2020 academic year.,60 students.,1.0,1.0000000000000002,0.5909090908795455,1.0
What is the estimated expenditure per person for producing a scholar per year?,"['60 90 120 150 120 Estimated expenditure per person for producing a scholar according to the program equals to an average of 194613 bahtpersonyear 27 Educational System Class room 28 Transfer of Credits Subjects and Cross Institute Registration of Higher Education if any Credits can be transferred upon the consent of executive program committee according to the Regulation of King Mongkuts Institute of', 'Scholarship 350000 550000 750000 800000 800000 21 Academic Year 2020 2021 2022 2023 2024 4 Facilities 135333 252000 392000 490000 536667 Facilities Utilities 135333 252000 392000 490000 536667 5 Capital 403600 171600 171600 838267 171600 Equipments Accreditation 1210800 514800 514800 2514800 514800 Total Expense 3962533 5158950 7170733 8619400 8172733 Enrollments 60 90 120 150 120 Estimated expenditure per', 'and Estimated Graduation in 5 Years Academic Year Number of Students 1st year 2020 2021 2022 2023 2024 60 30 30 30 30 60 30 30 30 60 30 30 60 30 2nd year 3rd year 4th year Total 60 90 120 150 120 Estimated to Graduate 60 30 26 Planned Budget Academic Year 2020 2021 2022 2023 2024 1 Personnel 2157500 2912917 3879250 4119250 4119250 Teaching Personnel 1017500 1606250 2191250 2431250 2431250 Administrative', '1606250 2191250 2431250 2431250 Administrative Staffs 544000 544000 725333 725333 725333 Professional Dev 596000 762667 962667 962667 962667 2 Operating Expense 916100 1272433 1977883 2371883 2545217 Subscriptions Consumables 583433 831433 1266217 1534217 1647550 Activities 332667 441000 711667 837667 897667 3 Scholarship 350000 550000 750000 800000 800000 Full Scholarship 350000 550000 750000 800000 800000', 'the needs 2 The Faculty provides an annual budget for the provision of textbooks educational media audiovisual equipment durable articles computersetc 3 Procuring educational resources to satisfy the need as proper to each program Evaluation of sufficiency for durable articles equipment books and educational document by students and instructors 7 Key Performance Indicators Academic Year Indicator and', 'supporting educational resources can be found in Appendix E 63 Additional Provision of Educational Resources Supply department purchases additional resources according to purchasing plan 65 64 Evaluation of Resource Sufficiency Objective Operation Evaluation 1 The Faculty surveys the needs for educational resources Having educational resources sufficient to the needs 2 The Faculty provides an annual budget', 'entrepreneurs to countries that offer a better reward This consequently facilitates the flow of tradition and culture The production of scholars in computer innovation engineer is therefore to create a workforce with the academic knowledge and applicable innovation as well as good moral and ethics so that they are ready to face the challenge happening in both regional and national parts By being able to', 'Indicators Academic Year Indicator and Objective 1 At least 80 of the executive program committee of the program participate in the meeting for planning following and revising the operation of the program 2 Having the details of the program consistent with the national or international standard of qualification for the program 3 Having the course syllabus and details of each offered subject and planned', 'Field None 4 Total Credits At least 131 credits 5 Type of the Program 51 Level 4Year Bachelor Program 52 Program Category Academic bachelors degree program Academic bachelors degree program Advanced academic bachelors degree program 5 53 Medium of Instruction English 54 Admission Thai andor Foreign students 55 Collaboration with Other Institutes The program is in collaboration with many universities', 'for an academic position in the past 5 years 13 The curriculum is updated at least every 5 years by considering the opinions of new graduates alumni industrial advisory board employer and other stakeholders 2 Graduate 21 There is an assessment of the quality of graduates according to the framework of national qualifications as well as the ABET Accreditation 22 There is a survey of graduates who get a job or', 'occupational or professional skill and life skills 3 Criteria for Graduation According to the Program Students must complete at least 131 credits to graduate with at least 30 credits from general education courses at least 95 credits from Robotics and AI concentration and at least 6 credits of free electives and English proficiency level prior to the graduation Students must also complete the internship', 'd Have tracking systems in place to monitor and evaluate students with academic behavioral and other problems e Have teaching assistant programs to aid students towards the specified learning outcomes f Have available scholarships for students with potential g Available student activities and clubs that promote personal development 20 25 Admission Plan and Estimated Graduation in 5 Years Academic Year', 'Economic Impact RAI students will apply their technical expertise leadership and innovative mindset to support and strengthen the societys economic wellbeing Strategy or Activity of Students Arranging for an educating activity to develop learners skills by assigning operational practices in every Robotics and AI subjects Arranging for a seminar subject capstone design or cooperative education internship', 'in each year Academic Year Program Achieving Standard According to the Quality Framework 2021 Achieving mandatory indicators no15 total indicators of 10 total indicators of 10 2022 total indicators of 10 2023 total indicators of 11 2024 total indicators of 12 2020 67 PART 8 EVALUATION AND IMPROVEMENT OF THE OPERATION OF THE PROGRAM 1 Assessment of the Effectiveness of the Teaching 11 Evaluation of Teaching', '01006304 COOPERATIVE EDUCATION STUDY ABROAD OVERSEA TRAINING 6 0450 6 6012 6 0450 C FREE ELECTIVES 6 CREDITS Students must complete at least 6 additional credits from any courses offered by the institution D RAI INTERNSHIP 01006805 0 CREDITS INDUSTRIAL INTERNSHIPS 314 Recommended Study Plan 0 0450 Credit Notation L E S L Lecture Learning hours E Laboratory hours S Selfstudy hours This study plan shows', 'Meets in class for lecture or discussion for 1 hour per week or Contains at least 3 laboratory hours per week Most courses are given 3 or more credits For 4 credit courses these courses usually contain 3 hours of lecture or discussion per week The courses are also accompanied with 1 additional hour of recitation or 3 hours of laboratory work per week Students enrolled in the courses are also expected to', 'they have at least one academic results published by the criteria established for the academic position in the past 5 years 12 Course Instructor they have direct or indirect qualification Minimum Master Degree or equivalent or academic position no lower than Assistant Professor Moreover they have at least one academic results published by the criteria established for an academic position in the past 5 years', 'a faculty member who is regarded as the student s supervisor The student must report progress to the supervisor regularly Upon completion the student must prepare and deliver oral presentations describing the work from the program 01006302 STUDY ABROAD 6 6012 PREREQUISITE NONE This course is reserved for students who participate in the study abroad program Upon the completion of the program the students', 'of knowledge for the development of the country developing national and international collaboration of academic network building up scientific and technological body of knowledge and giving academic service to the society supporting the preservation of art and culture along with developing curricula according to the standard of the educational quality assurance of King Mongkut s Institute of Technology', 'for innovation 122 Relation to the Mission of the Institute The development of the Robotics and AI Engineering program is related to the strategic advancement of scholar production to create next generation scholars with capabilities and flexibility to adapt to the change in the economy society and culture It also directly reflects the mission of the Institute to be the Master of Innovation and the Corner']","The estimated expenditure per person for producing a scholar according to the program is an average of 194,613 baht per person per year.","194,613 baht/person/year.",1.0,0.9370872620314814,0.99999999995,1.0
Can credits be transferred from other institutions?,"['need 13 System Transfer of Credits in TwoSemester System Credits can be transferred upon the consent of executive program committee according to the Regulation of King Mongkuts Institute of Technology Ladkrabang regarding bachelor degree education year 2016 Appendix A and the Announcement of King Mongkuts Institute of Technology Ladkrabang regarding the crossinstitute registration of higher education', '60 90 120 150 120 Estimated expenditure per person for producing a scholar according to the program equals to an average of 194613 bahtpersonyear 27 Educational System Class room 28 Transfer of Credits Subjects and Cross Institute Registration of Higher Education if any Credits can be transferred upon the consent of executive program committee according to the Regulation of King Mongkuts Institute of', '3 095 TOTAL CREDITS 9 35 FOR COOPSTUDY ABROAD STUDENTS 4th YEAR 1st SEMESTER CODE 01006301 or 01006302 SUBJECT CREDITS LES COOPERATIVE EDUCATION or STUDY ABROAD 6 0450 or 6 6012 TOTAL CREDITS 6 4th YEAR 2nd SEMESTER CODE SUBJECT CREDITS LES XXXXXXX GENED ELECTIVE 3 306 XXXXXXX FREE ELECTIVE 3 XXX 0141XXXX RAI Elective subject 3 306 0141XXXX RAI Elective subject 3 306 01416702 RAI ENGINEERING CAPSTONE DESIGN', '4th YEAR 1st SEMESTER CODE SUBJECT CREDITS LES XXXXXXX FREE ELECTIVE 3 XXX XXXXXXX GENED ELECTIVE 3 306 0141XXXX RAI Elective mandatory subject 3 306 0141XXXX RAI Elective subject 3 306 TOTAL CREDITS 12 4th YEAR 2nd SEMESTER CODE SUBJECT CREDITS LES 0141XXXX RAI Elective subject 3 306 0141XXXX RAI Elective subject 3 306 01416702 RAI ENGINEERING CAPSTONE DESIGN 3 095 TOTAL CREDITS 9 35 FOR COOPSTUDY ABROAD', 'for Graduation 312 Curriculum Structure Minimum Credits 131 credits For UoB 22 Program Students Credits For Coop Study Aboard Students 30 30 A1 English Proficiency Requirement ESL 9 9 A2 Communication Humanity and Social Skills 15 15 A3 Math and Science 6 6 95 95 B1 Core Courses 20 20 B2 Major Compulsory Courses 75 75 B21 Fundamental Subjects 39 39 B22 Capstone Projects 6 6 B23 RAI Elective Mandatory', 'hours S Selfstudy hours This study plan shows courses with credits equivalent to 3 However students can register 4 credit courses as well The total number of credits in each subject category will be counted toward the graduation 31 1st YEAR 1st SEMESTER CODE SUBJECT CREDITS LES 01416316 COMPUTER PROGRAMMING FOR RAI 3 225 01006710 INTRODUCATION TO CALCULUS 3 306 01006723 GENERAL PHYSICS 1 3 306 01006724', 'Field None 4 Total Credits At least 131 credits 5 Type of the Program 51 Level 4Year Bachelor Program 52 Program Category Academic bachelors degree program Academic bachelors degree program Advanced academic bachelors degree program 5 53 Medium of Instruction English 54 Admission Thai andor Foreign students 55 Collaboration with Other Institutes The program is in collaboration with many universities', 'Scholarship 350000 550000 750000 800000 800000 21 Academic Year 2020 2021 2022 2023 2024 4 Facilities 135333 252000 392000 490000 536667 Facilities Utilities 135333 252000 392000 490000 536667 5 Capital 403600 171600 171600 838267 171600 Equipments Accreditation 1210800 514800 514800 2514800 514800 Total Expense 3962533 5158950 7170733 8619400 8172733 Enrollments 60 90 120 150 120 Estimated expenditure per', 'semesters each of which covers not less than 15 weeks excluding the examination weeks The summer semester is optional Most courses are offered on the main campus during the day Some courses or laboratory hours may be offered in the evening or weekend 12 Provision of Summer Course Summer courses will be offered based on instructors availability and students need 13 System Transfer of Credits in TwoSemester', '01006304 COOPERATIVE EDUCATION STUDY ABROAD OVERSEA TRAINING 6 0450 6 6012 6 0450 C FREE ELECTIVES 6 CREDITS Students must complete at least 6 additional credits from any courses offered by the institution D RAI INTERNSHIP 01006805 0 CREDITS INDUSTRIAL INTERNSHIPS 314 Recommended Study Plan 0 0450 Credit Notation L E S L Lecture Learning hours E Laboratory hours S Selfstudy hours This study plan shows', 'is in collaboration with many universities according to the memorandum of understanding MOU such as College of Engineering Carnegie Mellon University the University of South Florida Imperial College Chubu University Kumamoto University BK Birla Institute of Engineering and Technology National Formosa University and South Eastern Regional College etc 56 Degree Given to the Graduates Bachelor of Engineering', 'Capstone Projects 6 6 B23 RAI Elective Mandatory Subjects 18 15 B24 RAI Elective Subjects 12 9 B25 Alternative Study 6 C Free Electives 6 6 D Internship 0 0 131 131 Course Group A General Education B Robotics and AI Specific Courses TOTAL Credits For Regular Students 24 313 Subjects One academic credit is given to a course offered in a single semester which Meets in class for lecture or discussion for 1', 'CREDITS LES XXXXXXX GENED ELECTIVE 3 306 01416315 INDUSTRIAL ELECTRONICS 3 306 0141XXXX RAI Elective mandatory subject 3 306 XXXXXXX FREE ELECTIVE 3 XXX 01416701 RAI ENGINEERING CAPSTONE DESIGN PREPARATION 3 095 TOTAL CREDITS 15 3rd YEAR 3rd SEMESTER SUMMER CODE 01006805 SUBJECT INDUSTRIAL INTERNSHIP TOTAL CREDITS CREDITS LES 0 0450 0 34 FOR REGULAR STUDENTS 4th YEAR 1st SEMESTER CODE SUBJECT CREDITS LES', 's Institute of Technology Ladkrabang regarding bachelor degree education year 2016 Appendix A 210 Integrated MasterBachelor Program If a student is in the 2nd semester of their third year of study or has completed at least 81 credits with the overall GPA of at least 3 00 the student is guaranteed admission into the integrated master bachelor program in the department The student must also complete the', '3 306 01416702 RAI ENGINEERING CAPSTONE DESIGN 3 095 TOTAL CREDITS 15 Total credits required for graduation at least 315 Details of Each Subject Course description Appendix C 131 credits 36 32 Name Surname ID Number Position and Qualification of Instructors 321 Executive Program Committees NameSurname Academic Position ID Number Assoc Prof Dr Pitikhate Sooraksa Electrical Engineering Assoc Prof Dr Chutimet', 'to the Regulation of King Mongkuts Institute of Technology Ladkrabang regarding bachelor degree education year 2016 Appendix A and the Announcement of King Mongkuts Institute of Technology Ladkrabang regarding the crossinstitute registration of higher education Appendix C 29 Registration The registration system is according to the Regulation of King Mongkut s Institute of Technology Ladkrabang regarding', 'other professions c Arranging for an exchange of instructors with both domestic and international institutes to increase the capability of instructors in both teaching and researching 63 PART 7 QUALITY ASSURANCE OF THE PROGRAM 1 Standardization The curriculum management is by the qualified and standardized program according to the qualification standard of higher education as well as the ABET Accreditation', 'crossinstitute registration of higher education Appendix B 2 Management of the Program 21 DateTime of the Course 1st semester August December 2nd semester January May Summer course June July The actual start and end dates for each academic year will be announced by the office of the registrar 22 Qualification of Applicants The general admission process starts from October RAI classes will begin in August of', 'Meets in class for lecture or discussion for 1 hour per week or Contains at least 3 laboratory hours per week Most courses are given 3 or more credits For 4 credit courses these courses usually contain 3 hours of lecture or discussion per week The courses are also accompanied with 1 additional hour of recitation or 3 hours of laboratory work per week Students enrolled in the courses are also expected to', 'Groups in the Program Open by Other FacultiesDepartments Programs General Education subjects Free electives 132 Subjects Subject Groups in the Program Open and Required to be Studied by Other FacultiesDepartmentsPrograms Free electives 133 Management The executive program committee is primarily responsible for the program are the representatives to coordinate with the faculty institution instructors and']","Yes, credits can be transferred from other institutions upon the consent of the executive program committee according to the Regulation of King Mongkut's Institute of Technology Ladkrabang regarding bachelor degree education year 2016 Appendix A and the Announcement of King Mongkut's Institute of Technology Ladkrabang regarding the cross-institute registration of higher education.","Yes, with consent of the committee.",0.75,1.0000000000000002,0.99999999995,1.0
What is the GPA requirement for guaranteed admission to the integrated Master program?,"['s Institute of Technology Ladkrabang regarding bachelor degree education year 2016 Appendix A 210 Integrated MasterBachelor Program If a student is in the 2nd semester of their third year of study or has completed at least 81 credits with the overall GPA of at least 3 00 the student is guaranteed admission into the integrated master bachelor program in the department The student must also complete the', 'the department The student must also complete the admission form through the meeting with their academic advisor for their master program If a student does not meet the GPA criteria of 300 he or she is eligible to hisher petition into the program during his or her fourth year with the permission of their academic advisor 22 3 Curriculum and Instructors The B Eng in Robotics and AI program is a four year', 'Field None 4 Total Credits At least 131 credits 5 Type of the Program 51 Level 4Year Bachelor Program 52 Program Category Academic bachelors degree program Academic bachelors degree program Advanced academic bachelors degree program 5 53 Medium of Instruction English 54 Admission Thai andor Foreign students 55 Collaboration with Other Institutes The program is in collaboration with many universities', 'occupational or professional skill and life skills 3 Criteria for Graduation According to the Program Students must complete at least 131 credits to graduate with at least 30 credits from general education courses at least 95 credits from Robotics and AI concentration and at least 6 credits of free electives and English proficiency level prior to the graduation Students must also complete the internship', 'education as well as the ABET Accreditation throughout the duration of administration of the program 11 Executive program committee there are no fewer than 5 persons who have either a direct qualification or a related field of study Their qualification is minimum as Master Degree or equivalent or academic positions no lower than Assistant Professor Moreover they have at least one academic results published', 'for Graduation 312 Curriculum Structure Minimum Credits 131 credits For UoB 22 Program Students Credits For Coop Study Aboard Students 30 30 A1 English Proficiency Requirement ESL 9 9 A2 Communication Humanity and Social Skills 15 15 A3 Math and Science 6 6 95 95 B1 Core Courses 20 20 B2 Major Compulsory Courses 75 75 B21 Fundamental Subjects 39 39 B22 Capstone Projects 6 6 B23 RAI Elective Mandatory', 'crossinstitute registration of higher education Appendix B 2 Management of the Program 21 DateTime of the Course 1st semester August December 2nd semester January May Summer course June July The actual start and end dates for each academic year will be announced by the office of the registrar 22 Qualification of Applicants The general admission process starts from October RAI classes will begin in August of', 'hours S Selfstudy hours This study plan shows courses with credits equivalent to 3 However students can register 4 credit courses as well The total number of credits in each subject category will be counted toward the graduation 31 1st YEAR 1st SEMESTER CODE SUBJECT CREDITS LES 01416316 COMPUTER PROGRAMMING FOR RAI 3 225 01006710 INTRODUCATION TO CALCULUS 3 306 01006723 GENERAL PHYSICS 1 3 306 01006724', 'of the Operation According to the Details of the Program Having quality assurance system and provision of education according to the standard framework of qualification for higher education as well as ABET Accreditation by having key performance indicators and assessment criteria assigned by the Internal QA committee 4 Revision of the Evaluation and Improvement Plan The executive program committees utilize', '3 306 01416702 RAI ENGINEERING CAPSTONE DESIGN 3 095 TOTAL CREDITS 15 Total credits required for graduation at least 315 Details of Each Subject Course description Appendix C 131 credits 36 32 Name Surname ID Number Position and Qualification of Instructors 321 Executive Program Committees NameSurname Academic Position ID Number Assoc Prof Dr Pitikhate Sooraksa Electrical Engineering Assoc Prof Dr Chutimet', '6 Status of the Program and Consideration for the AuthorizationAgreement 5 7 Readiness for Publicization as Qualified and Standardized Program 5 8 Possible Career Path after Graduation 5 9 Name Surname ID Number Position and Qualification of Instructors Responsible for the Program Executive Program Committee 6 10 Location of Study 9 11 External Situation or Development Needed to be Considered for the', 'Students must also complete the internship requirement during their courses of study Also graduation according to the program is accordance with the Regulations of King Mongkuts Institute of Technology Ladkrabang regarding Bachelor Degree Education 2016 Appendix A 62 PART 6 DEVELOPMENT OF INSTRUCTORS 1 Preparation for New Instructors 11 Orientation for new instructors regarding roles and responsibilities of', 'or Criteria for Grading Regulations or criteria for grading are in accordance with the Regulations of King Mongkut s Institute of Technology Ladkrabang regarding Bachelors Degree Education 2016 Appendix A 2 Verification of Learning Achievement 21 Verification of Learning Achievement before Graduation Program committee assigned a responsible figure for the verification of learning achievement according to', 'is in collaboration with many universities according to the memorandum of understanding MOU such as College of Engineering Carnegie Mellon University the University of South Florida Imperial College Chubu University Kumamoto University BK Birla Institute of Engineering and Technology National Formosa University and South Eastern Regional College etc 56 Degree Given to the Graduates Bachelor of Engineering', 'Indicators Academic Year Indicator and Objective 1 At least 80 of the executive program committee of the program participate in the meeting for planning following and revising the operation of the program 2 Having the details of the program consistent with the national or international standard of qualification for the program 3 Having the course syllabus and details of each offered subject and planned', 'from October RAI classes will begin in August of the following year Prospective students are required to satisfy the following requirements a Complete highschool education or equivalent study record Students must also provide the latest official transcript for their highest level of education Students must provide the proof of completion an official diploma or a certificate of completion from their', 'The program achieving standards according to the quality framework must pass the following criteria key performance indicators no 1 5 having the results of achieving objectives and having indicators that include the results of archiving objectives no less than 80 of the entire indicators by considering the number of mandatory indicators and total indicators in each year Academic Year Program Achieving', 'MSTU Moscow Russia 1994 BS Civil Engineering Yonsei University Seoul South Korea 1991 44 4 Component Regarding Field Experience Internship or CoOperative Education Students must participate in the internship or entrepreneurship experience for at least 8 weeks while working toward the degree usually during the summer This requirement could be satisfied by completing internships with an innovative company in', '60 90 120 150 120 Estimated expenditure per person for producing a scholar according to the program equals to an average of 194613 bahtpersonyear 27 Educational System Class room 28 Transfer of Credits Subjects and Cross Institute Registration of Higher Education if any Credits can be transferred upon the consent of executive program committee according to the Regulation of King Mongkuts Institute of', 'Institute of Technology Ladkrabang Regarding the Cross Institute Registration of Higher Education 87 C Course Description 92 D Curriculum Mapping for General Education Course 117 E Facilities Supported Teaching and Learning 121 F Reason for Requesting to Revise Curriculum 129 G List of Program Development Committees 137 H The Academic Publication of Instructors Responsible for The Program 139 4 BACHELOR OF']",The GPA requirement for guaranteed admission to the integrated Master program is at least 3.00.,At least 3.00.,1.0,0.9999999999999999,0.99999999995,1.0
What is the focus of the first-year projects?,"['areas Each semester will include a project based theme which helps students practice and design innovative solutions in the respective areas In the first year the students study basic courses in mathematics and science and improve their communication skills Students will also be introduced to fundamental programming concepts and the foundation of robotics systems The firstyear projects will give students', 'systems The firstyear projects will give students handson experience introduction and basic development of robotics technologies In the second year the students will learn advanced robotics concepts which serve as the foundation of robotics technologies The students also learn to apply design methods for solutions in technical areas such as control systems design and kinematics and dynamics Third year', 'to support the growing worldwide digital economy Modern engineering programs must recognize stateoftheart technologies and practices while inspiring students to generate innovations We want our graduate to be ready for the everchanging technological landscape The curriculum is designed to drive innovations By combining theoretical foundations with handson experience and project based learning the students', 'working environment not less than 2 days a week including handson experience required to their professional careers TRANSFEERED COURSES FROM UNIVERSITY OF BIRMINGHAM 22 DUAL DEGREE PROGRAM 01416622 INTEGRATED DESIGN PROJECT 2 4 2410 PREREQUISITE NONE The project design aspects of the work enhancing students awareness regarding key issues such as globalisation climate change sustainability and inequality and', 'and ethical responsibility ability to communicate effectively by presenting RAI miniprojects the broad education necessary to understand the impact of engineering solutions in a global economic environmental and societal context via RAI industrial prototyping projects recognition of the need for and an ability to engage in lifelong learning from cooperation or academic training programs knowledge of', 'engineering along with the process and tools to facilitate new innovations Fourthyear students undertake significant RAI engineering capstone design projects Students will apply their skills and knowledge to create sustainable innovations practice openended engineering design andor research that incorporates fundamental and advanced concepts in Robotics and AI Students will learn to build innovation', 'concepts They will be able to explore and translate the benefit the uniqueness and the credibility of innovative ideas to a target audience 01006515 DESIGN METHODS FOR INNOVATIONS 4 408 PREREQUISITE NONE This course consists of structural design process to create innovative products or services The students will study the process to gather trends and information such as global direction public opinions', 'and AI Students will learn to build innovation identify the opportunities propose ideas design and implement innovative solutions while being able to apply standards and realistic engineering constraints Students also further specialize in their areas of interest and prepare for the next step in their careers 23 31 Curriculum 311 Minimum Credits Required for Graduation 312 Curriculum Structure Minimum', 'As preparation and research for the capstone design students must develop topics identify a supervisor and prepare a proposal for an oral presentation The design must incorporate fundamental and advanced concepts in Robotics and AI Each team of 2 to 4 students will propose innovative design projects which require application of standards and realistic engineering constraints such as economic environmental', '21st August 2020 This program has started on 1st semester of academic year 2018 August 20118 7 Readiness for Publication as Qualified and Standardized Program This program is ready for announcement as qualified and standard program according to the qualification standard of higher education in engineering in 2010 in 2022 as well as the ABET Accreditation in 2022 8 Possible Career Path after Graduation', 'for the Planning of the Program 111 Economic SituationDevelopment The planning of bachelors degree program in Robotics and AI Engineering has been operated according to National Economic and Social Development Plan 2017 2021 which emphasizes on the development of science technology research and innovation in order to reinforce the sustainable growth of the industrial part The program also serves Thailand 4', '3 306 PREREQUISITE NONE This course bridges the gap between academic and production software engineering The course provides fastpaced introduction to key tools and techniques used in successful startups and largescale projects command line dotfiles text editor distributed version control debugging testing documentation reading code deployments Students will learn to build a command line application expose', 'or Development Needed to be Considered for the Planning of the Program 9 12 Effects from 111 and 112 on the Development of the Program and the Relation to the Mission of the Institute 9 13 Relation if any with Other Programs Open in the FacultyOther Departments of the Institute ie Subjects Open for the Service of Other FacultiesDepartments or to Be Studied with Other FacultiesDepartments 10 PART 2 SPECIFIC', 'or from the preparation course for their capstone design projects 51 Brief Description Students will practice openended engineering design that incorporates fundamental and advanced concepts in Robotics and AI Students will learn to build innovation identify the opportunities propose ideas design and implement innovative solutions while being able to apply standards and realistic engineering constraints 52', 'Capstone Projects 6 6 B23 RAI Elective Mandatory Subjects 18 15 B24 RAI Elective Subjects 12 9 B25 Alternative Study 6 C Free Electives 6 6 D Internship 0 0 131 131 Course Group A General Education B Robotics and AI Specific Courses TOTAL Credits For Regular Students 24 313 Subjects One academic credit is given to a course offered in a single semester which Meets in class for lecture or discussion for 1', 'such as global direction public opinions technology business society and economic learn how to extract context of interested area to find opportunities study the processes used to gather behaviors generate intense understanding about areas that lead to innovative concepts produce innovative solutions and finally offering innovative products and services 01006516 INNOVATION MANAGEMENT 4 408 PREREQUISITE NONE', 'design and kinematics and dynamics Third year students will learn about the latest technologies and AI which happen in the area In each semester the students will study new concepts and apply creativity in completing projects in trending areas such as machine perception application development cognition and reasoning and IoT Students will also learn about AI engineering along with the process and tools to', 'skills for success in careers and team environments The course will cover topics such as goal setting career Skills leadership skills teamwork effective communication and public speaking Learning methods will consist of hands on activities and projects group work lecture discussion reading writing and presenting 01006521 MEDITATION FOR LIFE DEVELOPMENT 3 306 PREREQUISITE NONE This course introduces theory', 'and project based learning the students will learn the skills required for today s workforce We embrace the 21st century learning environment to cultivate the students creativity criticalthinking communication and collaboration skills Our students will be introduced to innovative mindsets able to work with multidisciplinary teams and be leaders in their field of study Our graduates will be lifelong learners', 'Indicators Academic Year Indicator and Objective 1 At least 80 of the executive program committee of the program participate in the meeting for planning following and revising the operation of the program 2 Having the details of the program consistent with the national or international standard of qualification for the program 3 Having the course syllabus and details of each offered subject and planned']",The focus of the first-year projects is to give students hands-on experience with the introduction and basic development of robotics technologies.,Hands-on experience and basic robotics development.,1.0,0.8217134457437252,0.9999999999666667,1.0
What do students learn in the third year regarding trending areas?,"['Economic Impact RAI students will apply their technical expertise leadership and innovative mindset to support and strengthen the societys economic wellbeing Strategy or Activity of Students Arranging for an educating activity to develop learners skills by assigning operational practices in every Robotics and AI subjects Arranging for a seminar subject capstone design or cooperative education internship', 'design and kinematics and dynamics Third year students will learn about the latest technologies and AI which happen in the area In each semester the students will study new concepts and apply creativity in completing projects in trending areas such as machine perception application development cognition and reasoning and IoT Students will also learn about AI engineering along with the process and tools to', 'areas Each semester will include a project based theme which helps students practice and design innovative solutions in the respective areas In the first year the students study basic courses in mathematics and science and improve their communication skills Students will also be introduced to fundamental programming concepts and the foundation of robotics systems The firstyear projects will give students', 'such as global direction public opinions technology business society and economic learn how to extract context of interested area to find opportunities study the processes used to gather behaviors generate intense understanding about areas that lead to innovative concepts produce innovative solutions and finally offering innovative products and services 01006516 INNOVATION MANAGEMENT 4 408 PREREQUISITE NONE', 'to identify the underlying values definitions and assumptions in those arguments The students also learn how to synthesize a multiplicity of competing perspectives and to articulate fundamental disagreements between those perspectives Ultimately students will advance their contributions to discussions in engineering business innovations and technology studies 12 COMMUNICATION HUMANITY AND SOCIAL SKILLS', 'from student to student regarding culture social and academic upbringing all of which influences social bonding and communication effectiveness learning and selfdevelopment 24 Strategies for Solving the IssuesLimitation of the Students in 23 a Arrange an orientation day and counseling session for first year students to advise on available career paths best action plans in line with set objectives and time', 'marketplace advantage 12 c Leadership Our graduates will apply their technical and innovative leadership to establish successful careers in their business profession and community d Economic Impact Our graduates will apply their technical expertise leadership and innovative mindset to support and strengthen the societys economic wellbeing e Lifelong Learning Our graduates will learn new technologies', 'both regional and national parts By being able to analyze the social and cultural situation to create new innovation which improves the way of living of people in the societyThis in turn causes the strategic drive for self development of citizens as well as the Thai society toward the society of wisdom and lifelong learning 12 Effects from 11 1 and 11 2 on the Development of the Program and the Relation to', 'technology and its related policies Students will discuss the technological and institutional issues their interaction the possible need for public policy and the factors that govern the policy 01006510 INTRODUCTION TO ECONOMICS 3 306 PREREQUISITE NONE This course gives an overview of economics covering basic concepts and theories of microeconomics and macroeconomics Topics in microeconomics studied include', 'to support the growing worldwide digital economy Modern engineering programs must recognize stateoftheart technologies and practices while inspiring students to generate innovations We want our graduate to be ready for the everchanging technological landscape The curriculum is designed to drive innovations By combining theoretical foundations with handson experience and project based learning the students', 'of study Our graduates will be lifelong learners who are aware of technical and societal issues They will be able to create engineering innovations with economics impact and benefit our society 12 Importance The existence of the program is critical to the development of the country In order to accelerate innovation and digitally transform Thai economy for next generation startups and innovation driven', 'concepts They will be able to explore and translate the benefit the uniqueness and the credibility of innovative ideas to a target audience 01006515 DESIGN METHODS FOR INNOVATIONS 4 408 PREREQUISITE NONE This course consists of structural design process to create innovative products or services The students will study the process to gather trends and information such as global direction public opinions', 'admission announcement e Teacher Recommendation Students must obtain recommendations from their teachers or supervisors 23 Issues of New Students a Adjusting to social settings and lifestyles on campus which allow greater independence and freedom compared to high schools b Tuition fees and other financial requirements c Diverse ethnicity as backgrounds varies from student to student regarding culture social', 'communities research and development and product management Students are exposed to issues that challenged real world organizations Students will learn best practices used by engineering leaders who successfully develop commercially viable products and services create efficient operating processes manage profitable organizations and transform companies into industry leaders 01006517 LEAN STARTUP AND AGILE', 'timetomarket learn tactics for improvement and measure customers needs such as experimenting landing pages A B tests MVPs on real customers study how to implement an agile culture in business environments and learn how to develop business structures in order to keep the business functioning on constantlymoving units 01006518 EMERGING TRENDS IN ENGINEERING 1 102 PREREQUISITE NONE This course consists of a', 'that meet the demands and establish marketplace advantage Lifelong Learning RAI students will learn new technologies methodologies and tools and adapt them to respond to the challenges of a changing environment Leadership RAI students will apply their technical and innovative leadership to establish successful careers in their business profession and community Economic Impact RAI students will apply their', 'level of the final year students fresh graduates for the quality of the program is used to improve the program 12 The average satisfaction level of the stakeholders is used to improve the program 2020 2021 2022 2023 2024 Total indicators affecting the operation no15 for each year 5 5 5 5 5 Total indicators unit for each year 9 10 10 11 12 Evaluation Criteria The program achieving standards according to the', 'or academic training programs knowledge of contemporary issues via and ability to use the techniques skills and modern engineering tools necessary for engineering practice via RAI senior capstone projects 18 PART 3 SYSTEM FOR EDUCATIONAL PROVISION MANAGEMENT AND STRUCTURE OF THE PROGRAM 1 System for Educational Provision 11 System An academic year has two semesters each of which covers not less than 15', 'ie informal speech linking consonant and vowel production rhythm and pitch This course will help participants improve their oral presentation skills through an intercultural scientifictechnological research project This course is designed to inspire students to realize the power of R D ie research and development in science and technology through studying distinguished entrepreneurs 13 MATH AND SCIENCE', 'and project based learning the students will learn the skills required for today s workforce We embrace the 21st century learning environment to cultivate the students creativity criticalthinking communication and collaboration skills Our students will be introduced to innovative mindsets able to work with multidisciplinary teams and be leaders in their field of study Our graduates will be lifelong learners']","In the third year, students learn about the latest technologies and AI in trending areas. They study new concepts and apply creativity in completing projects in areas such as machine perception, application development, cognition and reasoning, and IoT.","Machine perception, cognition, reasoning, and IoT.",1.0,0.7315891081058321,0.49999999995,1.0
What is the credit weight for General Education?,"['60 90 120 150 120 Estimated expenditure per person for producing a scholar according to the program equals to an average of 194613 bahtpersonyear 27 Educational System Class room 28 Transfer of Credits Subjects and Cross Institute Registration of Higher Education if any Credits can be transferred upon the consent of executive program committee according to the Regulation of King Mongkuts Institute of', 'Capstone Projects 6 6 B23 RAI Elective Mandatory Subjects 18 15 B24 RAI Elective Subjects 12 9 B25 Alternative Study 6 C Free Electives 6 6 D Internship 0 0 131 131 Course Group A General Education B Robotics and AI Specific Courses TOTAL Credits For Regular Students 24 313 Subjects One academic credit is given to a course offered in a single semester which Meets in class for lecture or discussion for 1', 'Field None 4 Total Credits At least 131 credits 5 Type of the Program 51 Level 4Year Bachelor Program 52 Program Category Academic bachelors degree program Academic bachelors degree program Advanced academic bachelors degree program 5 53 Medium of Instruction English 54 Admission Thai andor Foreign students 55 Collaboration with Other Institutes The program is in collaboration with many universities', '3 095 TOTAL CREDITS 9 35 FOR COOPSTUDY ABROAD STUDENTS 4th YEAR 1st SEMESTER CODE 01006301 or 01006302 SUBJECT CREDITS LES COOPERATIVE EDUCATION or STUDY ABROAD 6 0450 or 6 6012 TOTAL CREDITS 6 4th YEAR 2nd SEMESTER CODE SUBJECT CREDITS LES XXXXXXX GENED ELECTIVE 3 306 XXXXXXX FREE ELECTIVE 3 XXX 0141XXXX RAI Elective subject 3 306 0141XXXX RAI Elective subject 3 306 01416702 RAI ENGINEERING CAPSTONE DESIGN', 'for Graduation 312 Curriculum Structure Minimum Credits 131 credits For UoB 22 Program Students Credits For Coop Study Aboard Students 30 30 A1 English Proficiency Requirement ESL 9 9 A2 Communication Humanity and Social Skills 15 15 A3 Math and Science 6 6 95 95 B1 Core Courses 20 20 B2 Major Compulsory Courses 75 75 B21 Fundamental Subjects 39 39 B22 Capstone Projects 6 6 B23 RAI Elective Mandatory', 'hours S Selfstudy hours This study plan shows courses with credits equivalent to 3 However students can register 4 credit courses as well The total number of credits in each subject category will be counted toward the graduation 31 1st YEAR 1st SEMESTER CODE SUBJECT CREDITS LES 01416316 COMPUTER PROGRAMMING FOR RAI 3 225 01006710 INTRODUCATION TO CALCULUS 3 306 01006723 GENERAL PHYSICS 1 3 306 01006724', 'occupational or professional skill and life skills 3 Criteria for Graduation According to the Program Students must complete at least 131 credits to graduate with at least 30 credits from general education courses at least 95 credits from Robotics and AI concentration and at least 6 credits of free electives and English proficiency level prior to the graduation Students must also complete the internship', 'education as well as the ABET Accreditation throughout the duration of administration of the program 11 Executive program committee there are no fewer than 5 persons who have either a direct qualification or a related field of study Their qualification is minimum as Master Degree or equivalent or academic positions no lower than Assistant Professor Moreover they have at least one academic results published', 'the Distribution of Program Standard Learning Outcomes to Course Level Specialized Course 49 PART5 CRITERIA FOR STUDENT EVALUATION59 1 Regulations or Criteria for Grading 59 2 Verification of Learning Achievement 59 3 Criteria for Graduation According to the Program 59 PART 6 DEVELOPMENT OF INSTRUCTORS 60 1 Preparation for New Instructors 60 2 Development of Knowledge and Skills for Instructors60 PART 7', '01006304 COOPERATIVE EDUCATION STUDY ABROAD OVERSEA TRAINING 6 0450 6 6012 6 0450 C FREE ELECTIVES 6 CREDITS Students must complete at least 6 additional credits from any courses offered by the institution D RAI INTERNSHIP 01006805 0 CREDITS INDUSTRIAL INTERNSHIPS 314 Recommended Study Plan 0 0450 Credit Notation L E S L Lecture Learning hours E Laboratory hours S Selfstudy hours This study plan shows', '4th YEAR 1st SEMESTER CODE SUBJECT CREDITS LES XXXXXXX FREE ELECTIVE 3 XXX XXXXXXX GENED ELECTIVE 3 306 0141XXXX RAI Elective mandatory subject 3 306 0141XXXX RAI Elective subject 3 306 TOTAL CREDITS 12 4th YEAR 2nd SEMESTER CODE SUBJECT CREDITS LES 0141XXXX RAI Elective subject 3 306 0141XXXX RAI Elective subject 3 306 01416702 RAI ENGINEERING CAPSTONE DESIGN 3 095 TOTAL CREDITS 9 35 FOR COOPSTUDY ABROAD', 'Meets in class for lecture or discussion for 1 hour per week or Contains at least 3 laboratory hours per week Most courses are given 3 or more credits For 4 credit courses these courses usually contain 3 hours of lecture or discussion per week The courses are also accompanied with 1 additional hour of recitation or 3 hours of laboratory work per week Students enrolled in the courses are also expected to', 'Scholarship 350000 550000 750000 800000 800000 21 Academic Year 2020 2021 2022 2023 2024 4 Facilities 135333 252000 392000 490000 536667 Facilities Utilities 135333 252000 392000 490000 536667 5 Capital 403600 171600 171600 838267 171600 Equipments Accreditation 1210800 514800 514800 2514800 514800 Total Expense 3962533 5158950 7170733 8619400 8172733 Enrollments 60 90 120 150 120 Estimated expenditure per', 'need 13 System Transfer of Credits in TwoSemester System Credits can be transferred upon the consent of executive program committee according to the Regulation of King Mongkuts Institute of Technology Ladkrabang regarding bachelor degree education year 2016 Appendix A and the Announcement of King Mongkuts Institute of Technology Ladkrabang regarding the crossinstitute registration of higher education', '3 306 01416702 RAI ENGINEERING CAPSTONE DESIGN 3 095 TOTAL CREDITS 15 Total credits required for graduation at least 315 Details of Each Subject Course description Appendix C 131 credits 36 32 Name Surname ID Number Position and Qualification of Instructors 321 Executive Program Committees NameSurname Academic Position ID Number Assoc Prof Dr Pitikhate Sooraksa Electrical Engineering Assoc Prof Dr Chutimet', 'Mapping Illustrating the Distribution of Program Standard Learning Outcomes to Course Level Specialized Course Course Major Responsibility Minor Responsibility 1 Moral and ethics 2 Knowledge 3 Intellectual skills 4 Human relation skills and responsibility 5 Skills for mathematical calculation communication and information technology adeptness 1 Perceive the importance of values morals ethics selfsacrifice', 'CREDITS LES XXXXXXX GENED ELECTIVE 3 306 01416315 INDUSTRIAL ELECTRONICS 3 306 0141XXXX RAI Elective mandatory subject 3 306 XXXXXXX FREE ELECTIVE 3 XXX 01416701 RAI ENGINEERING CAPSTONE DESIGN PREPARATION 3 095 TOTAL CREDITS 15 3rd YEAR 3rd SEMESTER SUMMER CODE 01006805 SUBJECT INDUSTRIAL INTERNSHIP TOTAL CREDITS CREDITS LES 0 0450 0 34 FOR REGULAR STUDENTS 4th YEAR 1st SEMESTER CODE SUBJECT CREDITS LES', 'they have at least one academic results published by the criteria established for the academic position in the past 5 years 12 Course Instructor they have direct or indirect qualification Minimum Master Degree or equivalent or academic position no lower than Assistant Professor Moreover they have at least one academic results published by the criteria established for an academic position in the past 5 years', 'expert to contribute to research experience and societal impact as well as relating laws and infringements Arranging for extracurricular activities ie community service 47 2 Development of Learning Results in Each Aspect As the RAI programs developmental objective is to meet ABET stipulated standards a learning outcome is designed by the ABET Criterion for Student Outcomes ak of which aim to prepare', '3 306 01006723 GENERAL PHYSICS 1 3 306 01006724 GENERAL PHYSICS LABORATORY 1 1 032 01416309 ENGINEERING 3D DRAWING 3 225 XXXXXXX GENED ELECTIVE 3 306 01416000 ESL ACADEMIC LISTENING AND SPEAKING 3 306 TOTAL CREDITS 19 1st YEAR 2nd SEMESTER CODE SUBJECT CREDITS LES 01416320 INTRODUCTION TO ROBOTICS AND AI 3 306 01006803 ENGINEERING MECHANICS 3 306 01006711 ADVANCED CALCULUS 3 306 01006725 GENERAL PHYSICS 2 3']",The credit weight for General Education is 24 credits for regular students.,30 credits.,0.5,0.9698082495459865,0.14285714284285714,1.0
How many credits are assigned to the RAI Engineering Capstone Design?,"['3 306 01416702 RAI ENGINEERING CAPSTONE DESIGN 3 095 TOTAL CREDITS 15 Total credits required for graduation at least 315 Details of Each Subject Course description Appendix C 131 credits 36 32 Name Surname ID Number Position and Qualification of Instructors 321 Executive Program Committees NameSurname Academic Position ID Number Assoc Prof Dr Pitikhate Sooraksa Electrical Engineering Assoc Prof Dr Chutimet', 'Capstone Projects 6 6 B23 RAI Elective Mandatory Subjects 18 15 B24 RAI Elective Subjects 12 9 B25 Alternative Study 6 C Free Electives 6 6 D Internship 0 0 131 131 Course Group A General Education B Robotics and AI Specific Courses TOTAL Credits For Regular Students 24 313 Subjects One academic credit is given to a course offered in a single semester which Meets in class for lecture or discussion for 1', 'constraints such as economic environmental social political ethical health and safety manufacturability and sustainability Each team must prepare and deliver oral presentations describing their analysis of the problems the proposed innovation and the design process 107 01416702 RAI ENGINEERING CAPSTONE DESIGN 3 095 PREREQUISITE 01416701 RAI ENGINEERING CAPSTONE DESIGN PREPARATION This course consists of', 'Design of UoB B22 CAPSTONE PROJECTS 01416701 RAI ENGINEERING CAPSTONE DESIGN PREPARATION 4 01416702 RAI ENGINEERING CAPSTONE DESIGN 5 4 compare to Module 04 29646 Integrated Design Project 3 of UoB 5 compare to Module 04 02279 Individual Project of UoB B23 RAI ELECTIVE MANDATORY SUBJECTS For Regular Students For UoB 22 Program Students For Coop Study Aboard Students 01416401 01416403 01416404 01416406', 'or CoOperative Education Students are able to choose between completing preliminary project in Capstone Design Preparation course or participate in one of the studyabroad program or cooperative education All Students must also complete RAI capstone design course prior to graduation Students may extend their works from the cooperative education assignment or from the preparation course for their capstone', '3 095 TOTAL CREDITS 9 35 FOR COOPSTUDY ABROAD STUDENTS 4th YEAR 1st SEMESTER CODE 01006301 or 01006302 SUBJECT CREDITS LES COOPERATIVE EDUCATION or STUDY ABROAD 6 0450 or 6 6012 TOTAL CREDITS 6 4th YEAR 2nd SEMESTER CODE SUBJECT CREDITS LES XXXXXXX GENED ELECTIVE 3 306 XXXXXXX FREE ELECTIVE 3 XXX 0141XXXX RAI Elective subject 3 306 0141XXXX RAI Elective subject 3 306 01416702 RAI ENGINEERING CAPSTONE DESIGN', 'CREDITS LES XXXXXXX GENED ELECTIVE 3 306 01416315 INDUSTRIAL ELECTRONICS 3 306 0141XXXX RAI Elective mandatory subject 3 306 XXXXXXX FREE ELECTIVE 3 XXX 01416701 RAI ENGINEERING CAPSTONE DESIGN PREPARATION 3 095 TOTAL CREDITS 15 3rd YEAR 3rd SEMESTER SUMMER CODE 01006805 SUBJECT INDUSTRIAL INTERNSHIP TOTAL CREDITS CREDITS LES 0 0450 0 34 FOR REGULAR STUDENTS 4th YEAR 1st SEMESTER CODE SUBJECT CREDITS LES', '4th YEAR 1st SEMESTER CODE SUBJECT CREDITS LES XXXXXXX FREE ELECTIVE 3 XXX XXXXXXX GENED ELECTIVE 3 306 0141XXXX RAI Elective mandatory subject 3 306 0141XXXX RAI Elective subject 3 306 TOTAL CREDITS 12 4th YEAR 2nd SEMESTER CODE SUBJECT CREDITS LES 0141XXXX RAI Elective subject 3 306 0141XXXX RAI Elective subject 3 306 01416702 RAI ENGINEERING CAPSTONE DESIGN 3 095 TOTAL CREDITS 9 35 FOR COOPSTUDY ABROAD', 'Moreover the aim of this training is to train the ability to report and summarize the experimental work B22 CAPSTONE PROJECTS 01416701 RAI ENGINEERING CAPSTONE DESIGN PREPARATION 3 095 PREREQUISITE NONE This course instructs and prepare students in aspects of effective technical oral presentations through exposure to different workplace communication skills As preparation and research for the capstone', 'As preparation and research for the capstone design students must develop topics identify a supervisor and prepare a proposal for an oral presentation The design must incorporate fundamental and advanced concepts in Robotics and AI Each team of 2 to 4 students will propose innovative design projects which require application of standards and realistic engineering constraints such as economic environmental', 'or from the preparation course for their capstone design projects 51 Brief Description Students will practice openended engineering design that incorporates fundamental and advanced concepts in Robotics and AI Students will learn to build innovation identify the opportunities propose ideas design and implement innovative solutions while being able to apply standards and realistic engineering constraints 52', 'or academic training programs knowledge of contemporary issues via and ability to use the techniques skills and modern engineering tools necessary for engineering practice via RAI senior capstone projects 18 PART 3 SYSTEM FOR EDUCATIONAL PROVISION MANAGEMENT AND STRUCTURE OF THE PROGRAM 1 System for Educational Provision 11 System An academic year has two semesters each of which covers not less than 15', 'Design and Modeling 01416406 Measurement and Instrumentation for Mechatronics 01416408 Computer Aid Mechanical Design 01416409 Fluid Mechanics 4 5 01416516 Robotics Laboratory 3 CAPSTONE PROJECTS 01416701 RAI Engineering Capstone Design Preparation 01416702 RAI Engineering Capstone Design RAI Elective Mandatory Subjects 3 1 2 3 4 5 1 2 3 4 5 1 2 3 4 5 1 2 3 4 5 55 1 Moral and ethics 2 Knowledge 3', 'hours S Selfstudy hours This study plan shows courses with credits equivalent to 3 However students can register 4 credit courses as well The total number of credits in each subject category will be counted toward the graduation 31 1st YEAR 1st SEMESTER CODE SUBJECT CREDITS LES 01416316 COMPUTER PROGRAMMING FOR RAI 3 225 01006710 INTRODUCATION TO CALCULUS 3 306 01006723 GENERAL PHYSICS 1 3 306 01006724', '01416310 Strength of Materials FUNDAMENTAL COURSE 01416301 Differential Equations and Matrix Algebra 53 1 Moral and ethics 2 Knowledge 3 Intellectual skills 4 Human relation skills and responsibility 5 Skills for mathematical calculation communication and information technology adeptness Course 1 01416304 Feedback Control 01416305 Artificial Intelligent Technology 01416306 Safety and Standardization in RAI', 'engineering along with the process and tools to facilitate new innovations Fourthyear students undertake significant RAI engineering capstone design projects Students will apply their skills and knowledge to create sustainable innovations practice openended engineering design andor research that incorporates fundamental and advanced concepts in Robotics and AI Students will learn to build innovation', 'and ethical responsibility ability to communicate effectively by presenting RAI miniprojects the broad education necessary to understand the impact of engineering solutions in a global economic environmental and societal context via RAI industrial prototyping projects recognition of the need for and an ability to engage in lifelong learning from cooperation or academic training programs knowledge of', 'for Graduation 312 Curriculum Structure Minimum Credits 131 credits For UoB 22 Program Students Credits For Coop Study Aboard Students 30 30 A1 English Proficiency Requirement ESL 9 9 A2 Communication Humanity and Social Skills 15 15 A3 Math and Science 6 6 95 95 B1 Core Courses 20 20 B2 Major Compulsory Courses 75 75 B21 Fundamental Subjects 39 39 B22 Capstone Projects 6 6 B23 RAI Elective Mandatory', '75 CREDITS 39 CREDITS 3 306 3 306 3 306 3 306 3 306 3 225 3 306 3 306 3 225 3 225 3 306 3 306 1 036 27 01416515 ROBOTICS LABORATORY 2 01416516 ROBOTICS LABORATORY 3 1 compare to Module 04 32798 Mechatronic Design of UoB 1 036 1 036 2 compare to Module 04 19505 Electronic Circuits and Devices and Electromagnetics of UoB 3 compare to Module 04 32798 Mechatronic Design of UoB B22 CAPSTONE PROJECTS 01416701 RAI', 'and AI Students will learn to build innovation identify the opportunities propose ideas design and implement innovative solutions while being able to apply standards and realistic engineering constraints Students also further specialize in their areas of interest and prepare for the next step in their careers 23 31 Curriculum 311 Minimum Credits Required for Graduation 312 Curriculum Structure Minimum']",The RAI Engineering Capstone Design is assigned 3 credits.,3 credits.,1.0,0.9943902025637029,0.6424565018234711,1.0
What does the first and second digit of the subject code '01' mean?,"['5th digit th th th 6 7 8 digit 01 41 00 6 means Faculty of Engineering means Robotics and AI program means shared courses means bachelor degree means Order of the subject 25 A GENERAL EDUCATION 30 CREDITS LECTURELABSELF STUDY A1 ENGLISH PROFICIENCY REQUIREMENT ESL 01416000 ACADEMIC LISTENING AND SPEAKING 01416001 ACADEMIC READING AND WRITING 01416003 INTERPRETATION AND ARGUMENTS 9 CREDITS 3 306 3 306 3 306', 'ask the recitation leader questions to clarify concepts facts or problem sets from the lecture The laboratory hours give students the opportunity to learn from handson experience using specialized equipment or software related to the courses contents Meaning of the Subject Codes Subject Codes are assigned with 8 digits as follows 1st 2nd digit 3rd 4th digit 5th digit th th th 6 7 8 digit 01 41 00 6 means', '4th YEAR 1st SEMESTER CODE SUBJECT CREDITS LES XXXXXXX FREE ELECTIVE 3 XXX XXXXXXX GENED ELECTIVE 3 306 0141XXXX RAI Elective mandatory subject 3 306 0141XXXX RAI Elective subject 3 306 TOTAL CREDITS 12 4th YEAR 2nd SEMESTER CODE SUBJECT CREDITS LES 0141XXXX RAI Elective subject 3 306 0141XXXX RAI Elective subject 3 306 01416702 RAI ENGINEERING CAPSTONE DESIGN 3 095 TOTAL CREDITS 9 35 FOR COOPSTUDY ABROAD', '01416628 01416629 01416630 01416631 01416632 01416633 01416634 01416635 01006006 IT PROJECT MANAGEMENT EXPERIENCE AND EXERCISE FOR INTELLIGENT CONTROL SYSTEM INFORMATION AND CYBER SECURITY INFORMATION SYSTEM SECURITY AND IT LAW ROBOTICS AND AI EXPERIENCE SPACE SCIENCE REINFORCEMENT LEARNING INTRODUCTION TO PROMPT ENGINERRING ADVANCED TECHNIQUES IN ChatGPT CUSTOMIZATION AND APPLICATION INDUSTRIAL EXPERIENCE', '01416000 Academic Listening and Speaking 01416001 Academic Reading and Writing 01416003 Interpretation and Arguments 01006502 Professional Ethics 01006503 Introduction to Psychology 01006504 Philosophy of Science 01006505 Creative Thinking 01006506 Critical Thinking 01006507 Personal Economics 01006508 Digital Economy 01006509 Engineering and Public Policy 01006510 Introduction to Economics 01006511 Thai', '01416306 Safety and Standardization in RAI 01416308 Kinematics and Dynamics 01416309 Engineering 3D Drawing 01416312 Electric Circuit and Electronics 01416315 Industrial Electronics 01416316 Computer Programming for RAI 01416318 Microprocessor and Interface 01416319 Manufacturing Process 01416320 Introduction to Robotics and AI 01416514 Robotics Laboratory 1 01416515 Robotics Laboratory 2 2 3 4 5 1 2 3 4 5', '3 095 TOTAL CREDITS 9 35 FOR COOPSTUDY ABROAD STUDENTS 4th YEAR 1st SEMESTER CODE 01006301 or 01006302 SUBJECT CREDITS LES COOPERATIVE EDUCATION or STUDY ABROAD 6 0450 or 6 6012 TOTAL CREDITS 6 4th YEAR 2nd SEMESTER CODE SUBJECT CREDITS LES XXXXXXX GENED ELECTIVE 3 306 XXXXXXX FREE ELECTIVE 3 XXX 0141XXXX RAI Elective subject 3 306 0141XXXX RAI Elective subject 3 306 01416702 RAI ENGINEERING CAPSTONE DESIGN', 'MATHEMATICS ELECTIVE 3 306 01416310 STRENGTH OF MATERIALS 3 306 01416308 KINEMATICS AND DYNAMICS 3 306 01416305 ARTIFICIAL INTELLIGENCE TECHNOLOGY 3 306 01416516 ROBOTICS LABORATORY 3 1 036 01416500 Computer vision RAI Elective mandatory Subject 3 306 XXXXXXX GENED ELECTIVE 3 306 TOTAL CREDITS 19 33 3rd YEAR 1st SEMESTER CODE SUBJECT CREDITS LES 01416801 MATHEMATICS OF DATA SCIENCE AND DATA ANALYTIC GENED', '01416310 Strength of Materials FUNDAMENTAL COURSE 01416301 Differential Equations and Matrix Algebra 53 1 Moral and ethics 2 Knowledge 3 Intellectual skills 4 Human relation skills and responsibility 5 Skills for mathematical calculation communication and information technology adeptness Course 1 01416304 Feedback Control 01416305 Artificial Intelligent Technology 01416306 Safety and Standardization in RAI', 'CREDITS LES XXXXXXX GENED ELECTIVE 3 306 01416315 INDUSTRIAL ELECTRONICS 3 306 0141XXXX RAI Elective mandatory subject 3 306 XXXXXXX FREE ELECTIVE 3 XXX 01416701 RAI ENGINEERING CAPSTONE DESIGN PREPARATION 3 095 TOTAL CREDITS 15 3rd YEAR 3rd SEMESTER SUMMER CODE 01006805 SUBJECT INDUSTRIAL INTERNSHIP TOTAL CREDITS CREDITS LES 0 0450 0 34 FOR REGULAR STUDENTS 4th YEAR 1st SEMESTER CODE SUBJECT CREDITS LES', '3 306 01006723 GENERAL PHYSICS 1 3 306 01006724 GENERAL PHYSICS LABORATORY 1 1 032 01416309 ENGINEERING 3D DRAWING 3 225 XXXXXXX GENED ELECTIVE 3 306 01416000 ESL ACADEMIC LISTENING AND SPEAKING 3 306 TOTAL CREDITS 19 1st YEAR 2nd SEMESTER CODE SUBJECT CREDITS LES 01416320 INTRODUCTION TO ROBOTICS AND AI 3 306 01006803 ENGINEERING MECHANICS 3 306 01006711 ADVANCED CALCULUS 3 306 01006725 GENERAL PHYSICS 2 3', 'AND CONTROL SYSTEMS DIGITAL ELECTRONICS AND ELECTRICAL MACHINES 4 408 4 408 4 408 B24 RAI ELECTIVE SUBJECTS For Regular Students For UoB 22 Program Students For Coop Study Aboard Students 12 CREDITS 12 CREDITS 9 CREDITS 01416601 01416602 01416604 01416607 01416608 01416609 01416610 01416611 01416612 01416613 01416614 01416615 01416616 01416617 01416618 01416619 01416620 01416621 01416522 3 236 3 306 3 306 3', 'hours S Selfstudy hours This study plan shows courses with credits equivalent to 3 However students can register 4 credit courses as well The total number of credits in each subject category will be counted toward the graduation 31 1st YEAR 1st SEMESTER CODE SUBJECT CREDITS LES 01416316 COMPUTER PROGRAMMING FOR RAI 3 225 01006710 INTRODUCATION TO CALCULUS 3 306 01006723 GENERAL PHYSICS 1 3 306 01006724', 'LABORATORY 01006729 INTRODUCTION TO OPERATIONS RESEARCH 01416801 MATHEMATICS OF DATA SCIENCE AND DATA ANALYTIC 01006713 Mathematical Cryptography 01006714 Mathematics for 3D Game and Computer Graphics 01006701 Mathematics of Data Science 52 1 Moral and ethics 2 Knowledge 3 Intellectual skills 4 Human relation skills and responsibility 5 Skills for mathematical calculation communication and information', 'OF DATA SCIENCE AND DATA ANALYTIC GENED SCIENCE MATHEMATICS ELECTIVE 3 306 01416306 SAFTY AND STANDARDIZATION IN RAI 3 306 01416319 MANUFACTURING PROCESS 3 306 01006718 DISCRETE MATHEMATICS RAI Elective mandatory Subject 3 306 0141XXXX RAI Elective mandatory subject 3 306 0141XXXX RAI Elective subject 3 306 TOTAL CREDITS 18 3rd YEAR 2nd SEMESTER CODE SUBJECT CREDITS LES XXXXXXX GENED ELECTIVE 3 306 01416315', '01416515 Robotics Laboratory 2 2 3 4 5 1 2 3 4 5 1 2 3 4 5 1 2 3 4 5 1 2 3 4 5 54 1 Moral and ethics 2 Knowledge 3 Intellectual skills 4 Human relation skills and responsibility 5 Skills for mathematical calculation communication and information technology adeptness Course 1 2 01416401 Thermodynamics 01416403 Dynamic of Machinery 01416404 Mechanical Design and Modeling 01416406 Measurement and', '306 PREREQUISITE NONE Materials on AI programming logic search game playing machine learning natural language understanding and robotics introduce the student to AI methods tools and techniques their application to computational problems and their contribution to understanding intelligence 01416306 SAFETY AND STANDARDIZATION IN RAI 3 306 PREREQUISITE NONE Law and standardization Safety requirement and', '2 1 032 PREREQUISITE 01006723 GENERAL PHYSICS 1 The experiments that correspond to the subject in 01006725 General Physics 2 01006803 ENGINEERING MECHANICS 3 306 PREREQUISITE NONE Force systems resultant equilibrium fluid statics kinematics and kinetics of particles and rigid bodies Newtons second law of motion work and energy impulse and momentum 01006310 STRENGTH OF MATERIALS 3 306 PREREQUISITE NONE', 'Course 1 01416630 Information System Security and IT Law 01416631 Robotics and AI Experience 01416632 Space Science 01416633 REINFORCEMENT LEARNING 01416634 INTRODUCTION TO PROMPT ENGINERRING 01416635 ADVANCED TECHNIQUES IN ChatGPT CUSTOMIZATION AND APPLICATION 01006006 Industrial Experience for Engineers 09106400 Materials Investigation 09106401 Photonics 09106402 Smart Material for Energy Storage 09106403', '01416620 01416621 01416522 3 236 3 306 3 306 3 306 3 306 3 306 3 306 3 306 3 306 3 306 3 225 3 306 3 306 3 306 3 306 3 225 3 306 3 306 3 306 MECHANICAL SYSTEM AND LABORATORY EMBEDDED SYSTEM DEVELOPMENT MECHANICAL VIBRATIONS STARTUP ENGINEERING DATA VISUALIZATION COGNITIVE COMPUTING APPLICATIONS SOFTWAREDEFINED DATA CENTER WIRELESS SENSOR NETWORK INFORMATION SECURITY MANAGEMENT FUNDAMENTALS OF AR VR AND']","Sorry, My knowledge base does not contain the answer to this question.",Faculty of Engineering.,0.0,0.0,0.0,1.0
What does the third and fourth digit '41' mean in the subject code?,"['ask the recitation leader questions to clarify concepts facts or problem sets from the lecture The laboratory hours give students the opportunity to learn from handson experience using specialized equipment or software related to the courses contents Meaning of the Subject Codes Subject Codes are assigned with 8 digits as follows 1st 2nd digit 3rd 4th digit 5th digit th th th 6 7 8 digit 01 41 00 6 means', '5th digit th th th 6 7 8 digit 01 41 00 6 means Faculty of Engineering means Robotics and AI program means shared courses means bachelor degree means Order of the subject 25 A GENERAL EDUCATION 30 CREDITS LECTURELABSELF STUDY A1 ENGLISH PROFICIENCY REQUIREMENT ESL 01416000 ACADEMIC LISTENING AND SPEAKING 01416001 ACADEMIC READING AND WRITING 01416003 INTERPRETATION AND ARGUMENTS 9 CREDITS 3 306 3 306 3 306', 'program and retain their fulltime student status 41 Standard for Learning Outcome from Field Experience 411 Possessing the skills to solve problems related to Robotics and AI 412 To be able to work with others as a team with responsibility 413 To be able to lead the member of the team appropriately 414 To be able to Integrate their knowledge to business solutions that apply the appropriate technology and', '4th YEAR 1st SEMESTER CODE SUBJECT CREDITS LES XXXXXXX FREE ELECTIVE 3 XXX XXXXXXX GENED ELECTIVE 3 306 0141XXXX RAI Elective mandatory subject 3 306 0141XXXX RAI Elective subject 3 306 TOTAL CREDITS 12 4th YEAR 2nd SEMESTER CODE SUBJECT CREDITS LES 0141XXXX RAI Elective subject 3 306 0141XXXX RAI Elective subject 3 306 01416702 RAI ENGINEERING CAPSTONE DESIGN 3 095 TOTAL CREDITS 9 35 FOR COOPSTUDY ABROAD', '01416628 01416629 01416630 01416631 01416632 01416633 01416634 01416635 01006006 IT PROJECT MANAGEMENT EXPERIENCE AND EXERCISE FOR INTELLIGENT CONTROL SYSTEM INFORMATION AND CYBER SECURITY INFORMATION SYSTEM SECURITY AND IT LAW ROBOTICS AND AI EXPERIENCE SPACE SCIENCE REINFORCEMENT LEARNING INTRODUCTION TO PROMPT ENGINERRING ADVANCED TECHNIQUES IN ChatGPT CUSTOMIZATION AND APPLICATION INDUSTRIAL EXPERIENCE', 'MATHEMATICS ELECTIVE 3 306 01416310 STRENGTH OF MATERIALS 3 306 01416308 KINEMATICS AND DYNAMICS 3 306 01416305 ARTIFICIAL INTELLIGENCE TECHNOLOGY 3 306 01416516 ROBOTICS LABORATORY 3 1 036 01416500 Computer vision RAI Elective mandatory Subject 3 306 XXXXXXX GENED ELECTIVE 3 306 TOTAL CREDITS 19 33 3rd YEAR 1st SEMESTER CODE SUBJECT CREDITS LES 01416801 MATHEMATICS OF DATA SCIENCE AND DATA ANALYTIC GENED', 'hours S Selfstudy hours This study plan shows courses with credits equivalent to 3 However students can register 4 credit courses as well The total number of credits in each subject category will be counted toward the graduation 31 1st YEAR 1st SEMESTER CODE SUBJECT CREDITS LES 01416316 COMPUTER PROGRAMMING FOR RAI 3 225 01006710 INTRODUCATION TO CALCULUS 3 306 01006723 GENERAL PHYSICS 1 3 306 01006724', 'LABORATORY 01006729 INTRODUCTION TO OPERATIONS RESEARCH 01416801 MATHEMATICS OF DATA SCIENCE AND DATA ANALYTIC 01006713 Mathematical Cryptography 01006714 Mathematics for 3D Game and Computer Graphics 01006701 Mathematics of Data Science 52 1 Moral and ethics 2 Knowledge 3 Intellectual skills 4 Human relation skills and responsibility 5 Skills for mathematical calculation communication and information', '3 306 01006723 GENERAL PHYSICS 1 3 306 01006724 GENERAL PHYSICS LABORATORY 1 1 032 01416309 ENGINEERING 3D DRAWING 3 225 XXXXXXX GENED ELECTIVE 3 306 01416000 ESL ACADEMIC LISTENING AND SPEAKING 3 306 TOTAL CREDITS 19 1st YEAR 2nd SEMESTER CODE SUBJECT CREDITS LES 01416320 INTRODUCTION TO ROBOTICS AND AI 3 306 01006803 ENGINEERING MECHANICS 3 306 01006711 ADVANCED CALCULUS 3 306 01006725 GENERAL PHYSICS 2 3', '01416000 Academic Listening and Speaking 01416001 Academic Reading and Writing 01416003 Interpretation and Arguments 01006502 Professional Ethics 01006503 Introduction to Psychology 01006504 Philosophy of Science 01006505 Creative Thinking 01006506 Critical Thinking 01006507 Personal Economics 01006508 Digital Economy 01006509 Engineering and Public Policy 01006510 Introduction to Economics 01006511 Thai', 'AND CONTROL SYSTEMS DIGITAL ELECTRONICS AND ELECTRICAL MACHINES 4 408 4 408 4 408 B24 RAI ELECTIVE SUBJECTS For Regular Students For UoB 22 Program Students For Coop Study Aboard Students 12 CREDITS 12 CREDITS 9 CREDITS 01416601 01416602 01416604 01416607 01416608 01416609 01416610 01416611 01416612 01416613 01416614 01416615 01416616 01416617 01416618 01416619 01416620 01416621 01416522 3 236 3 306 3 306 3', '408 POWER ELECTRONICS AND POWER SYSTEMS 4 408 THE INTERNET OF THINGS 4 408 TELEROBOTICS TELEPRESENCE AND AUGMENTED REALITY 4 408 ELECTRONIC ENGINEERING 4 408 TRACK SMART MATERIALS TECHNOLOGY Only students in Smart Materials Technology and Robotics and AI Dualdegree program may choose these courses 09106400 09106401 09106402 09106403 09106404 09106405 09106406 09106407 MATERIALS INVESTIGATION PHOTONICS SMART', '01416310 Strength of Materials FUNDAMENTAL COURSE 01416301 Differential Equations and Matrix Algebra 53 1 Moral and ethics 2 Knowledge 3 Intellectual skills 4 Human relation skills and responsibility 5 Skills for mathematical calculation communication and information technology adeptness Course 1 01416304 Feedback Control 01416305 Artificial Intelligent Technology 01416306 Safety and Standardization in RAI', '3 095 TOTAL CREDITS 9 35 FOR COOPSTUDY ABROAD STUDENTS 4th YEAR 1st SEMESTER CODE 01006301 or 01006302 SUBJECT CREDITS LES COOPERATIVE EDUCATION or STUDY ABROAD 6 0450 or 6 6012 TOTAL CREDITS 6 4th YEAR 2nd SEMESTER CODE SUBJECT CREDITS LES XXXXXXX GENED ELECTIVE 3 306 XXXXXXX FREE ELECTIVE 3 XXX 0141XXXX RAI Elective subject 3 306 0141XXXX RAI Elective subject 3 306 01416702 RAI ENGINEERING CAPSTONE DESIGN', 'OF DATA SCIENCE AND DATA ANALYTIC GENED SCIENCE MATHEMATICS ELECTIVE 3 306 01416306 SAFTY AND STANDARDIZATION IN RAI 3 306 01416319 MANUFACTURING PROCESS 3 306 01006718 DISCRETE MATHEMATICS RAI Elective mandatory Subject 3 306 0141XXXX RAI Elective mandatory subject 3 306 0141XXXX RAI Elective subject 3 306 TOTAL CREDITS 18 3rd YEAR 2nd SEMESTER CODE SUBJECT CREDITS LES XXXXXXX GENED ELECTIVE 3 306 01416315', '01416306 Safety and Standardization in RAI 01416308 Kinematics and Dynamics 01416309 Engineering 3D Drawing 01416312 Electric Circuit and Electronics 01416315 Industrial Electronics 01416316 Computer Programming for RAI 01416318 Microprocessor and Interface 01416319 Manufacturing Process 01416320 Introduction to Robotics and AI 01416514 Robotics Laboratory 1 01416515 Robotics Laboratory 2 2 3 4 5 1 2 3 4 5', '01416515 Robotics Laboratory 2 2 3 4 5 1 2 3 4 5 1 2 3 4 5 1 2 3 4 5 1 2 3 4 5 54 1 Moral and ethics 2 Knowledge 3 Intellectual skills 4 Human relation skills and responsibility 5 Skills for mathematical calculation communication and information technology adeptness Course 1 2 01416401 Thermodynamics 01416403 Dynamic of Machinery 01416404 Mechanical Design and Modeling 01416406 Measurement and', 'COMMUNICATION 4 408 PREREQUISITE NONE This course provides the study and practice of different communication skills including technical professional and creative writing infographics design and delivering presentation The students will study relevant techniques and learn to combine a range of skillsin order to effectively communicating technical or specialized concepts They will be able to explore and', 'CREDITS LES XXXXXXX GENED ELECTIVE 3 306 01416315 INDUSTRIAL ELECTRONICS 3 306 0141XXXX RAI Elective mandatory subject 3 306 XXXXXXX FREE ELECTIVE 3 XXX 01416701 RAI ENGINEERING CAPSTONE DESIGN PREPARATION 3 095 TOTAL CREDITS 15 3rd YEAR 3rd SEMESTER SUMMER CODE 01006805 SUBJECT INDUSTRIAL INTERNSHIP TOTAL CREDITS CREDITS LES 0 0450 0 34 FOR REGULAR STUDENTS 4th YEAR 1st SEMESTER CODE SUBJECT CREDITS LES', 'Students 01416401 01416403 01416404 01416406 01416408 01416409 01416413 01416414 01416415 01416416 01416417 01416500 01416503 01416504 01416505 01416507 01416509 01416510 01416511 01416512 01416518 THERMODYNAMICS DYNAMICS OF MACHINERY MECHANICAL DESIGN AND MODELING 6 CREDITS 3 095 3 095 18 CREDITS 18 CREDITS 15 CREDITS 3 306 3 306 3 306 MEASUREMENTS AND INTRUMENTATION FOR MECHATRONICS 3 306 COMPUTER AID']",The third and fourth digit '41' in the subject code means the Robotics and AI program.,Robotics and AI program.,1.0,0.9766235465464385,0.5833333333041666,1.0
What is the course code for 'Professional Ethics'?,"['12 COMMUNICATION HUMANITY AND SOCIAL SKILLS 01006502 PROFESSIONAL ETHICS 3 306 PREREQUISITE NONE This course introduces the theory and the practice of professional and engineering ethics including code of conducts and regulations in academic professional and technical fields Students also learn about different approaches to ethical problems and examine real life case studies drawn from a 96 variety of', 'Mapping Illustrating the Distribution of Program Standard Learning Outcomes to Course Level Specialized Course Course Major Responsibility Minor Responsibility 1 Moral and ethics 2 Knowledge 3 Intellectual skills 4 Human relation skills and responsibility 5 Skills for mathematical calculation communication and information technology adeptness 1 Perceive the importance of values morals ethics selfsacrifice', 'for individual development Work assignment for participation with others in appropriate ways Work assignment to practice the student for systematically comparative relation regulation such as rubric score 49 Mapping TQF Learning Outcomes and ABET Student Outcomes TQF Learning Outcomes ABET Student Outcomes 1 Moral and Ethics 8 an understanding of professional and ethical responsibility 6 the broad education', 'for Student Outcomes ak of which aim to prepare graduates to attain program educational objectives Domains Learning Results Teaching Strategies Honesty Integrating moral and ethics into subject topics or teaching and providing a case study topic for discussion ie news from newspaper television other media or simulation Moral and Ethics Strategies for Evaluation Evaluation of work assignment Evaluation from', 'real life case studies drawn from a 96 variety of professional contexts This course helps students develop skills and knowledge to manage and engage with ethical issues in their working lives 01006503 INTRODUCTION TO PSYCHOLOGY 3 306 PREREQUISITE NONE This course introduces a broad survey of psychological science including sensation and perception learning memory intelligence language and cognition emotions', 'course to ensure that students are ready for their studies and to be able to complete theireducation for the duration of the program 32 The activities are organized to develop students knowledge abilities and potential in various ways to support 21stcentury learning skills 33 A consultant who is appointed for academic counseling and guidance to all students must schedule an appointment Office Hours for the', 'and the relevance of our courses New courses and research opportunities will be presented including the facultys research fields The course also discusses basic learning and working ethics and prepares students careermaking skills PassFail required to graduate 01006519 INTRODUCTION TO ENVIRONMENTAL PRINCIPLES 3 306 PREREQUISITE NONE This course provides students general principles of environmental', 'place during a summer period This course allows students to put into practice under conditions reflecting their future activities and responsibilities The work carried out under the responsibility of the firm involved is presented in a written report 124 APPENDIX D Curriculum Mapping for General Education Course 125 Curriculum Mapping General Education 01416000 Academic Listening and Speaking 01416001', 'trained 2 The percentage of lecturers trained 3 Lecturer evaluation by students 15 Development Plan Strategies EvidenceIndicator objectives for undergraduate degrees Student development plan 1 The total number of activities in place to promote 1 The promotion of integrity ethics service mind and integrity and ethics amongst students 2 The total number of courses in place to promote volunteerism as well as', 'AND ARGUMENTS 9 CREDITS 3 306 3 306 3 306 A2 COMMUNICATION HUMANITY AND SOCIAL SKILLS 01006502 PROFESSIONAL ETHICS 01006503 INTRODUCTION TO PSYCHOLOGY 01006504 PHILOSOPHY OF SCIENCE 01006505 CREATIVE THINKING 01006506 CRITICAL THINKING 01006507 PERSONAL ECONOMICS 01006508 DIGITAL ECONOMY 01006509 ENGINEERING AND PUBLIC POLICY 01006510 INTRODUCTION TO ECONOMICS 01006511 THAI SOCIETY AND CULTURE 01006512', '01416310 Strength of Materials FUNDAMENTAL COURSE 01416301 Differential Equations and Matrix Algebra 53 1 Moral and ethics 2 Knowledge 3 Intellectual skills 4 Human relation skills and responsibility 5 Skills for mathematical calculation communication and information technology adeptness Course 1 01416304 Feedback Control 01416305 Artificial Intelligent Technology 01416306 Safety and Standardization in RAI', 'handson projects and case studies in a variety of business engineering social sciences or life sciences domains Issues of ethics leadership and teamwork are highlighted 01416416 INFORMATION SYSTEMS DATABASES AND APPLICATION 3 306 PREREQUISITE NONE This course studies basic concepts of information systems and database systems with emphasis on the study of relational database systems Topics include basic', '4th YEAR 1st SEMESTER CODE SUBJECT CREDITS LES XXXXXXX FREE ELECTIVE 3 XXX XXXXXXX GENED ELECTIVE 3 306 0141XXXX RAI Elective mandatory subject 3 306 0141XXXX RAI Elective subject 3 306 TOTAL CREDITS 12 4th YEAR 2nd SEMESTER CODE SUBJECT CREDITS LES 0141XXXX RAI Elective subject 3 306 0141XXXX RAI Elective subject 3 306 01416702 RAI ENGINEERING CAPSTONE DESIGN 3 095 TOTAL CREDITS 9 35 FOR COOPSTUDY ABROAD', '01416000 Academic Listening and Speaking 01416001 Academic Reading and Writing 01416003 Interpretation and Arguments 01006502 Professional Ethics 01006503 Introduction to Psychology 01006504 Philosophy of Science 01006505 Creative Thinking 01006506 Critical Thinking 01006507 Personal Economics 01006508 Digital Economy 01006509 Engineering and Public Policy 01006510 Introduction to Economics 01006511 Thai', 'hours S Selfstudy hours This study plan shows courses with credits equivalent to 3 However students can register 4 credit courses as well The total number of credits in each subject category will be counted toward the graduation 31 1st YEAR 1st SEMESTER CODE SUBJECT CREDITS LES 01416316 COMPUTER PROGRAMMING FOR RAI 3 225 01006710 INTRODUCATION TO CALCULUS 3 306 01006723 GENERAL PHYSICS 1 3 306 01006724', '3 306 PREREQUISITE NONE This course bridges the gap between academic and production software engineering The course provides fastpaced introduction to key tools and techniques used in successful startups and largescale projects command line dotfiles text editor distributed version control debugging testing documentation reading code deployments Students will learn to build a command line application expose', '01006304 COOPERATIVE EDUCATION STUDY ABROAD OVERSEA TRAINING 6 0450 6 6012 6 0450 C FREE ELECTIVES 6 CREDITS Students must complete at least 6 additional credits from any courses offered by the institution D RAI INTERNSHIP 01006805 0 CREDITS INDUSTRIAL INTERNSHIPS 314 Recommended Study Plan 0 0450 Credit Notation L E S L Lecture Learning hours E Laboratory hours S Selfstudy hours This study plan shows', '4 Component Regarding Field Experience Internship or CoOperative Education43 5 Regulations for Special Project or CoOperative Education 43 6 Additional Costs44 PART 4 LEARNING OUTCOME TEACHING STRATEGY AND EVALUATION45 1 Development of Special Characteristics of Students 45 2 Development of Learning Results in Each Aspect 46 3 Curriculum Mapping Illustrating the Distribution of Program Standard Learning', 'the stakeholders Have verification from another university 22 Verification of Learning Achievement after Graduation To the purpose of improving educational and curricular development the following assessments are in place Survey stakeholder satisfaction Assessed by the graduate user Award or commendation the graduates receive in the aspects of ethics knowledge occupational or professional skill and life', '3 095 TOTAL CREDITS 9 35 FOR COOPSTUDY ABROAD STUDENTS 4th YEAR 1st SEMESTER CODE 01006301 or 01006302 SUBJECT CREDITS LES COOPERATIVE EDUCATION or STUDY ABROAD 6 0450 or 6 6012 TOTAL CREDITS 6 4th YEAR 2nd SEMESTER CODE SUBJECT CREDITS LES XXXXXXX GENED ELECTIVE 3 306 XXXXXXX FREE ELECTIVE 3 XXX 0141XXXX RAI Elective subject 3 306 0141XXXX RAI Elective subject 3 306 01416702 RAI ENGINEERING CAPSTONE DESIGN']",The course code for 'Professional Ethics' is 01006502.,01006502.,1.0,1.0,0.47142857141285716,1.0
How many credits is the 'Academic Listening and Speaking' course?,"['Meets in class for lecture or discussion for 1 hour per week or Contains at least 3 laboratory hours per week Most courses are given 3 or more credits For 4 credit courses these courses usually contain 3 hours of lecture or discussion per week The courses are also accompanied with 1 additional hour of recitation or 3 hours of laboratory work per week Students enrolled in the courses are also expected to', 'AND SPEAKING 3 306 PREREQUISITE NONE The course provides ESL students guidance and extensive practice in listening and speaking in academic and professional settings Listening focuses on understanding spoken English in formats such as college lectures and news broadcasts Note taking tasks are also included to reinforce aural comprehension Students learn to recognize organizational patterns Students also', 'hours S Selfstudy hours This study plan shows courses with credits equivalent to 3 However students can register 4 credit courses as well The total number of credits in each subject category will be counted toward the graduation 31 1st YEAR 1st SEMESTER CODE SUBJECT CREDITS LES 01416316 COMPUTER PROGRAMMING FOR RAI 3 225 01006710 INTRODUCATION TO CALCULUS 3 306 01006723 GENERAL PHYSICS 1 3 306 01006724', 'enrolled in the courses are also expected to spend at least 8 hours outside the class lab for studying and completing the coursework The instructorled lecture could be delivered as a traditional lecture or include learning activities in which the students can actively participate The recitation is a compliment to a lecture where students can discuss and ask the recitation leader questions to clarify', 'for Graduation 312 Curriculum Structure Minimum Credits 131 credits For UoB 22 Program Students Credits For Coop Study Aboard Students 30 30 A1 English Proficiency Requirement ESL 9 9 A2 Communication Humanity and Social Skills 15 15 A3 Math and Science 6 6 95 95 B1 Core Courses 20 20 B2 Major Compulsory Courses 75 75 B21 Fundamental Subjects 39 39 B22 Capstone Projects 6 6 B23 RAI Elective Mandatory', 'Capstone Projects 6 6 B23 RAI Elective Mandatory Subjects 18 15 B24 RAI Elective Subjects 12 9 B25 Alternative Study 6 C Free Electives 6 6 D Internship 0 0 131 131 Course Group A General Education B Robotics and AI Specific Courses TOTAL Credits For Regular Students 24 313 Subjects One academic credit is given to a course offered in a single semester which Meets in class for lecture or discussion for 1', 'Field None 4 Total Credits At least 131 credits 5 Type of the Program 51 Level 4Year Bachelor Program 52 Program Category Academic bachelors degree program Academic bachelors degree program Advanced academic bachelors degree program 5 53 Medium of Instruction English 54 Admission Thai andor Foreign students 55 Collaboration with Other Institutes The program is in collaboration with many universities', 'semesters each of which covers not less than 15 weeks excluding the examination weeks The summer semester is optional Most courses are offered on the main campus during the day Some courses or laboratory hours may be offered in the evening or weekend 12 Provision of Summer Course Summer courses will be offered based on instructors availability and students need 13 System Transfer of Credits in TwoSemester', '3 095 TOTAL CREDITS 9 35 FOR COOPSTUDY ABROAD STUDENTS 4th YEAR 1st SEMESTER CODE 01006301 or 01006302 SUBJECT CREDITS LES COOPERATIVE EDUCATION or STUDY ABROAD 6 0450 or 6 6012 TOTAL CREDITS 6 4th YEAR 2nd SEMESTER CODE SUBJECT CREDITS LES XXXXXXX GENED ELECTIVE 3 306 XXXXXXX FREE ELECTIVE 3 XXX 0141XXXX RAI Elective subject 3 306 0141XXXX RAI Elective subject 3 306 01416702 RAI ENGINEERING CAPSTONE DESIGN', 'occupational or professional skill and life skills 3 Criteria for Graduation According to the Program Students must complete at least 131 credits to graduate with at least 30 credits from general education courses at least 95 credits from Robotics and AI concentration and at least 6 credits of free electives and English proficiency level prior to the graduation Students must also complete the internship', '01006304 COOPERATIVE EDUCATION STUDY ABROAD OVERSEA TRAINING 6 0450 6 6012 6 0450 C FREE ELECTIVES 6 CREDITS Students must complete at least 6 additional credits from any courses offered by the institution D RAI INTERNSHIP 01006805 0 CREDITS INDUSTRIAL INTERNSHIPS 314 Recommended Study Plan 0 0450 Credit Notation L E S L Lecture Learning hours E Laboratory hours S Selfstudy hours This study plan shows', 'course to ensure that students are ready for their studies and to be able to complete theireducation for the duration of the program 32 The activities are organized to develop students knowledge abilities and potential in various ways to support 21stcentury learning skills 33 A consultant who is appointed for academic counseling and guidance to all students must schedule an appointment Office Hours for the', 'TECHNOLOGY 3 306 PREREQUISITE NONE This course will help students improve their critical thinkinganalytical skills through a combination of reading articles listening to lectures and watching audiovisual programs on current hot topics in science and technology Students will have directed practice in various areas of pronunciation such as stress intonation reductions ie informal speech linking consonant and', '4th YEAR 1st SEMESTER CODE SUBJECT CREDITS LES XXXXXXX FREE ELECTIVE 3 XXX XXXXXXX GENED ELECTIVE 3 306 0141XXXX RAI Elective mandatory subject 3 306 0141XXXX RAI Elective subject 3 306 TOTAL CREDITS 12 4th YEAR 2nd SEMESTER CODE SUBJECT CREDITS LES 0141XXXX RAI Elective subject 3 306 0141XXXX RAI Elective subject 3 306 01416702 RAI ENGINEERING CAPSTONE DESIGN 3 095 TOTAL CREDITS 9 35 FOR COOPSTUDY ABROAD', '3 306 01006723 GENERAL PHYSICS 1 3 306 01006724 GENERAL PHYSICS LABORATORY 1 1 032 01416309 ENGINEERING 3D DRAWING 3 225 XXXXXXX GENED ELECTIVE 3 306 01416000 ESL ACADEMIC LISTENING AND SPEAKING 3 306 TOTAL CREDITS 19 1st YEAR 2nd SEMESTER CODE SUBJECT CREDITS LES 01416320 INTRODUCTION TO ROBOTICS AND AI 3 306 01006803 ENGINEERING MECHANICS 3 306 01006711 ADVANCED CALCULUS 3 306 01006725 GENERAL PHYSICS 2 3', '5th digit th th th 6 7 8 digit 01 41 00 6 means Faculty of Engineering means Robotics and AI program means shared courses means bachelor degree means Order of the subject 25 A GENERAL EDUCATION 30 CREDITS LECTURELABSELF STUDY A1 ENGLISH PROFICIENCY REQUIREMENT ESL 01416000 ACADEMIC LISTENING AND SPEAKING 01416001 ACADEMIC READING AND WRITING 01416003 INTERPRETATION AND ARGUMENTS 9 CREDITS 3 306 3 306 3 306', '1 102 PREREQUISITE NONE This course consists of a series of lectures given by different faculty members and distinguished speakers from the academic and industries The lectures are designed to provide students a good understanding of each curriculum structure and the courses in each subject areas Students will be introduced to emerging trends in Engineering and the relevance of our courses New courses and', 'ie informal speech linking consonant and vowel production rhythm and pitch This course will help participants improve their oral presentation skills through an intercultural scientifictechnological research project This course is designed to inspire students to realize the power of R D ie research and development in science and technology through studying distinguished entrepreneurs 13 MATH AND SCIENCE', '60 90 120 150 120 Estimated expenditure per person for producing a scholar according to the program equals to an average of 194613 bahtpersonyear 27 Educational System Class room 28 Transfer of Credits Subjects and Cross Institute Registration of Higher Education if any Credits can be transferred upon the consent of executive program committee according to the Regulation of King Mongkuts Institute of', 'by Ministry of Education MoE and Accreditation Board for Engineering and Technology ABET 2 The total number of courses where at least 50 percent or more of class time is carried out through active learning 3 The total number of courses with an integrated education system 4 The total number of courses where at least 50 percent or more of class time takes place through PBL ProblemProject Based Learning 5 The']",The 'Academic Listening and Speaking' course is 3 credits.,3 (3-0-6) credits.,1.0,0.9429094856548212,0.39202380951596905,1.0
What is the prerequisite for 'Advanced Calculus'?,"['calculation communication and information technology adeptness Course 1 2 3 4 5 1 2 3 4 5 1 2 3 4 5 1 2 3 4 5 1 2 3 4 5 CORE COURSE 01006710 Introduction to Calculus 01006711 Advanced Calculus 01006723 General Physics 1 01006724 General Physics Laboratory 1 01006725 General Physics 2 01006726 General Physics Laboratory 2 01006803 Engineering Mechanics 01416310 Strength of Materials FUNDAMENTAL COURSE', 'Mathematical induction Introduction to derivative Differentiation Applications of derivative Definite integrals Antiderivative integration Application of definite integral Indeterminate forms Improper integrals Numerical integration Sequences and series of numbers Taylor series expansions of elementary functions vector analysis 01006711 ADVANCED CALCULUS 3 306 PREREQUISITE 01006710 INTRODUCTION TO CALCULUS', 'and correct word forms word order spelling and punctuation Students will also develop the ability to write varied complex sentences and effective paragraphs in standard written English 01006003 INTERPRETATION AND ARGUMENTS 3 306 PREREQUISITE NONE This course provides the study of interpreting and analyzing written and visual arguments Students will learn to identify the underlying values definitions and', 'graduates to attain the program educational objectives which adhere to ABET student outcomes for the engineering program 1 an ability to apply knowledge of mathematics science and engineering 2 an ability to design and conduct experiments as well as to analyze and interpret data 3 an ability to design an innovative system component or process to meet desired needs within realistic constraints such as', '4 an ability to function on multidisciplinary teams 6 an understanding of professional and ethical responsibility 5 Skills for Mathematical Calculation 7 an ability to communicate effectively Communication and Information 8 an ability to use the techniques skills and modern engineering tools necessary for engineering practice Technology Adeptness 50 3 Curriculum Mapping Illustrating the Distribution of', 'in threedimensional space Calculus of real valued functions in threedimensional space Principal theory for applications such as Greens theorem divergence theorem Gauss theorem Stokes theorem etc 01006723 GENERAL PHYSICS 1 3 306 PREREQUISITE NONE This course covers basic physics and mechanics including a study of motion space and time kinematics Newtons law of motion forces energy and momentum work power', 'relation skills and responsibility 5 Skills for mathematical calculation communication and information technology adeptness Course 1 2 3 4 5 1 2 3 4 5 1 2 3 4 5 1 2 3 4 5 1 2 3 4 5 GENED MATH AND SCIENCE 01006719 PROBABILITY AND STATISTICS 1 01006720 PROBABILITY AND STATISTICS 2 01006721 NUMERICAL METHODS 01006727 GENERAL CHEMISTRY 01006728 GENERAL CHEMISTRY LABORATORY 01006729 INTRODUCTION TO OPERATIONS', 'CALCULUS 3 306 01006725 GENERAL PHYSICS 2 3 306 01006726 GENERAL PHYSICS LABORATORY 2 1 032 01416318 MICROPROCESSOR AND INTERFACE 3 225 01416514 ROBOTICS LABORATORY 1 1 036 01416001 ESL ACADEMIC READING AND WRITING 3 306 TOTAL CREDITS 20 32 2nd YEAR 1st SEMESTER CODE SUBJECT CREDITS LES 01416312 ELECTRIC CIRCUIT AND ELECTRONICS 3 306 01416301 DIFFERENTIAL EQUATIONS AND MATRIX ALGEBRA 3 306 01416515 ROBOTICS', 'occupational or professional skill and life skills 3 Criteria for Graduation According to the Program Students must complete at least 131 credits to graduate with at least 30 credits from general education courses at least 95 credits from Robotics and AI concentration and at least 6 credits of free electives and English proficiency level prior to the graduation Students must also complete the internship', '1 102 PREREQUISITE NONE This course consists of a series of lectures given by different faculty members and distinguished speakers from the academic and industries The lectures are designed to provide students a good understanding of each curriculum structure and the courses in each subject areas Students will be introduced to emerging trends in Engineering and the relevance of our courses New courses and', '5 Skills for mathematical calculation communication and information technology adeptness Course 1 01416617 Pneumatic and Hydraulic System Design and Control 01416618 Advanced Artificial Intelligent Technology 01416619 User Experience and User Interface Design 01416620 Blockchain Technology and Application 01416621 Lean Management 01416522 Big Data 01416523 IT Project Management 01416628 Experience and', '2 1 032 PREREQUISITE 01006723 GENERAL PHYSICS 1 The experiments that correspond to the subject in 01006725 General Physics 2 01006803 ENGINEERING MECHANICS 3 306 PREREQUISITE NONE Force systems resultant equilibrium fluid statics kinematics and kinetics of particles and rigid bodies Newtons second law of motion work and energy impulse and momentum 01006310 STRENGTH OF MATERIALS 3 306 PREREQUISITE NONE', 'PROGRAM Only students in UoB 22 Dual Degree program may choose the courses in this course 01416802 ADVANCED ENGINEERING MATHEMATICS B ROBOTICS AND AI COURSE SPECIFIC COURSES B1 CORE COURSE 01006710 01006711 01006723 01006724 01006725 01006726 01006803 01416310 4 408 95 CREDITS LECTURELABSELF STUDY INTRODUCTION TO CALCULUS ADVANCED CALCULUS GENERAL PHYSICS 1 GENERAL PHYSICS LABORATORY 1 GENERAL PHYSICS 2', '1 GENERAL PHYSICS LABORATORY 1 GENERAL PHYSICS 2 GENERAL PHYSICS LABORATORY 2 ENGINEERING MECHANICS STRENGTH OF MATERIALS B2 MAJOR COMPULSORY COURSE B21 FUNDAMENTAL SUBJECTS 01416301 DIFFERENTIAL EQUATIONS AND MATRIX ALGEBRA 01416304 FEEDBACK CONTROL 01416305 ARTIFICIAL INTELLIGENCE TECHNOLOGY 01416306 SAFETY AND STANDARDIZATION IN RAI 3 01416308 KINEMATICS AND DYNAMICS 01416309 ENGIEERING 3D DRAWING', 'MATHEMATICS ELECTIVE 3 306 01416310 STRENGTH OF MATERIALS 3 306 01416308 KINEMATICS AND DYNAMICS 3 306 01416305 ARTIFICIAL INTELLIGENCE TECHNOLOGY 3 306 01416516 ROBOTICS LABORATORY 3 1 036 01416500 Computer vision RAI Elective mandatory Subject 3 306 XXXXXXX GENED ELECTIVE 3 306 TOTAL CREDITS 19 33 3rd YEAR 1st SEMESTER CODE SUBJECT CREDITS LES 01416801 MATHEMATICS OF DATA SCIENCE AND DATA ANALYTIC GENED', 'TECHNOLOGY 3 306 PREREQUISITE NONE This course will help students improve their critical thinkinganalytical skills through a combination of reading articles listening to lectures and watching audiovisual programs on current hot topics in science and technology Students will have directed practice in various areas of pronunciation such as stress intonation reductions ie informal speech linking consonant and', '2 Have acquired knowledge and understandings of important principles and theories of the subjects in the engineering field 3 Be able to integrate the knowledge in their field of study with the knowledge in other fields 4 Be able to analyze problems understand and explain computing requirements as well as be able to apply knowledge skills and the usage of suitable tools for solving problems 5 Be able to use', 'practice The outcomes can be presented progressively by following yearly basis as articulately shown in Table below Year Expected Learning Outcomes 1 2 ability to learn and apply knowledge of mathematics science and engineering ability to read draw apply engineering drawing ability to create algorithm understand and write codes using computer languages for engineering problem solving ability to design and', 'as to analyze and interpret data 5 an ability to identify formulate and solve engineering problems 9 a recognition of the need for and an ability to engage in lifelong learning 10 a knowledge of contemporary issues 11 an ability to use the techniques skills and modern engineering tools necessary for engineering practice 4 Human Relation Skills and Responsibility 4 an ability to function on multidisciplinary', 'skillsets and characteristics streamlined to institutional engineering set Strategies EvidenceIndicator 1 Adjusting engineering to an Outcomebased curriculum by ABET guidelines for undergraduate graduate and doctoral degrees 2 Organize Student Centric teachinglearning environments to facilitate and maximize active learning 3 Facilitate authentic learning or work integrated teachinglearning environments 4']",The prerequisite for 'Advanced Calculus' is 'Introduction to Calculus'.,01006710 Introduction to Calculus.,1.0,0.9999999999999998,0.7435897435649573,1.0
What topics are covered in 'General Physics 1'?,"['2 1 032 PREREQUISITE 01006723 GENERAL PHYSICS 1 The experiments that correspond to the subject in 01006725 General Physics 2 01006803 ENGINEERING MECHANICS 3 306 PREREQUISITE NONE Force systems resultant equilibrium fluid statics kinematics and kinetics of particles and rigid bodies Newtons second law of motion work and energy impulse and momentum 01006310 STRENGTH OF MATERIALS 3 306 PREREQUISITE NONE', 'GENERAL PHYSICS 1 3 306 103 This course provides the physical science required to analyze electrical and electronic devices Covered topics include electrostatics and electromagnetics electric field and potential conductors insulators capacitors dielectrics electric current electric circuits magnetic fields and electromagnetism 01006726 GENERAL PHYSICS LABORATORY 2 1 032 PREREQUISITE 01006723 GENERAL PHYSICS', '1 GENERAL PHYSICS LABORATORY 1 GENERAL PHYSICS 2 GENERAL PHYSICS LABORATORY 2 ENGINEERING MECHANICS STRENGTH OF MATERIALS B2 MAJOR COMPULSORY COURSE B21 FUNDAMENTAL SUBJECTS 01416301 DIFFERENTIAL EQUATIONS AND MATRIX ALGEBRA 01416304 FEEDBACK CONTROL 01416305 ARTIFICIAL INTELLIGENCE TECHNOLOGY 01416306 SAFETY AND STANDARDIZATION IN RAI 3 01416308 KINEMATICS AND DYNAMICS 01416309 ENGIEERING 3D DRAWING', 'of motion forces energy and momentum work power conservation laws systems of particles linear momentum circular motion rotation torques harmonic oscillation and gravitation 01006724 GENERAL PHYSICS LABORATORY 1 1 032 PREREQUISITE NONE The experiments that correspond to the subject in 01006723 General Physics 1 01006725 GENERAL PHYSICS 2 PREREQUISITE 01006723 GENERAL PHYSICS 1 3 306 103 This course provides', 'in threedimensional space Calculus of real valued functions in threedimensional space Principal theory for applications such as Greens theorem divergence theorem Gauss theorem Stokes theorem etc 01006723 GENERAL PHYSICS 1 3 306 PREREQUISITE NONE This course covers basic physics and mechanics including a study of motion space and time kinematics Newtons law of motion forces energy and momentum work power', '3 306 01006723 GENERAL PHYSICS 1 3 306 01006724 GENERAL PHYSICS LABORATORY 1 1 032 01416309 ENGINEERING 3D DRAWING 3 225 XXXXXXX GENED ELECTIVE 3 306 01416000 ESL ACADEMIC LISTENING AND SPEAKING 3 306 TOTAL CREDITS 19 1st YEAR 2nd SEMESTER CODE SUBJECT CREDITS LES 01416320 INTRODUCTION TO ROBOTICS AND AI 3 306 01006803 ENGINEERING MECHANICS 3 306 01006711 ADVANCED CALCULUS 3 306 01006725 GENERAL PHYSICS 2 3', '1 102 PREREQUISITE NONE This course consists of a series of lectures given by different faculty members and distinguished speakers from the academic and industries The lectures are designed to provide students a good understanding of each curriculum structure and the courses in each subject areas Students will be introduced to emerging trends in Engineering and the relevance of our courses New courses and', 'CALCULUS 3 306 01006725 GENERAL PHYSICS 2 3 306 01006726 GENERAL PHYSICS LABORATORY 2 1 032 01416318 MICROPROCESSOR AND INTERFACE 3 225 01416514 ROBOTICS LABORATORY 1 1 036 01416001 ESL ACADEMIC READING AND WRITING 3 306 TOTAL CREDITS 20 32 2nd YEAR 1st SEMESTER CODE SUBJECT CREDITS LES 01416312 ELECTRIC CIRCUIT AND ELECTRONICS 3 306 01416301 DIFFERENTIAL EQUATIONS AND MATRIX ALGEBRA 3 306 01416515 ROBOTICS', 'Course 1 01416630 Information System Security and IT Law 01416631 Robotics and AI Experience 01416632 Space Science 01416633 REINFORCEMENT LEARNING 01416634 INTRODUCTION TO PROMPT ENGINERRING 01416635 ADVANCED TECHNIQUES IN ChatGPT CUSTOMIZATION AND APPLICATION 01006006 Industrial Experience for Engineers 09106400 Materials Investigation 09106401 Photonics 09106402 Smart Material for Energy Storage 09106403', 'calculation communication and information technology adeptness Course 1 2 3 4 5 1 2 3 4 5 1 2 3 4 5 1 2 3 4 5 1 2 3 4 5 CORE COURSE 01006710 Introduction to Calculus 01006711 Advanced Calculus 01006723 General Physics 1 01006724 General Physics Laboratory 1 01006725 General Physics 2 01006726 General Physics Laboratory 2 01006803 Engineering Mechanics 01416310 Strength of Materials FUNDAMENTAL COURSE', 'Topics in microeconomics studied include demand and supply price elasticities consumer behavior theory production and cost theory and perfect and imperfect competitions Macroeconomics topics studied include aggregate demand and supply macroeconomic data eg gross domestic product national income etc management of economic growth inflation problems unemployment problems money and banking systems fiscal and', 'provides a study of the thing we call science together with its nature and methodology The topics cover the meaning of science reality the nature of scientific observations scientific theories and their discovery and formation scientific explanations and predictions the problem of induction scientific rationality the nature of scientific knowledge concepts of truth hypothesis testing hypothesis confirmation', 'PROGRAM Only students in UoB 22 Dual Degree program may choose the courses in this course 01416802 ADVANCED ENGINEERING MATHEMATICS B ROBOTICS AND AI COURSE SPECIFIC COURSES B1 CORE COURSE 01006710 01006711 01006723 01006724 01006725 01006726 01006803 01416310 4 408 95 CREDITS LECTURELABSELF STUDY INTRODUCTION TO CALCULUS ADVANCED CALCULUS GENERAL PHYSICS 1 GENERAL PHYSICS LABORATORY 1 GENERAL PHYSICS 2', 'an overview of network theory and research in applied 116 mathematics physics and engineering The second part of the course examines a wide range of CPR applications and presents open problems calling for innovative solutions that take into account network complexity Students will become familiar with ongoing research in the field and will get a chance to apply their knowledge of theoretical concepts to', 'will be drawn from such areas as environmental materials and biological chemistry 101 01006728 GENERAL CHEMISTRY LABORATORY 1 032 PREREQUISITE NONE The experiments that correspond to the subject in 01006726 General Chemistry 01006729 INTRODUCTION TO OPERATIONS RESEARCH 3 306 PREREQUISITE NONE Analysis and planning of complex systems Mathematical modelling to model formulation Linear and Integer Programming', 'FOR MECHATRONICS 3 306 COMPUTER AID MECHANICAL DESIGN 3 306 FLUID MECHANICS 3 306 INTRODUCTION TO NANOTECHNOLOGY AND NANOSCIENCE 3 306 INTRODUCTION TO MEMS 3 306 INTRODUCTION TO DATA SCIENCE 3 306 INFORMATION SYSTEMS DATABASES AND APPLICATION 3 306 DEEP LEARNING APPLICATION 3 306 COMPUTER VISIONS 3 306 DESIGNING COMPUTER VISION APPLICATIONS 3 306 MACHINE LEARNING IN PRACTICE 3 306 INTERNET OF THINGS AND', 'also learn the use of equivalent circuit models that describe the operation of these devices and how they can be used to design circuits that provide important electronic functions 01416315 INDUSTRIAL ELECTRONICS 3 306 PREREQUISITE NONE Topics covered include modeling analysis and control techniques design of power circuits including inverters rectifiers and DCDC converters analysis and design of magnetic', 'and appreciate the linkage between curriculum and practice Students will develop specific skills both on engineering and professionals including handson experience or research experience required to their professional careers 01416632 SPACE SCIENCE 4408 PREREQUISITE NONE This course provides a study of the Solar system such as the planets and minor members of the system Telescopes the Sun the birth life and', 'MATHEMATICS ELECTIVE 3 306 01416310 STRENGTH OF MATERIALS 3 306 01416308 KINEMATICS AND DYNAMICS 3 306 01416305 ARTIFICIAL INTELLIGENCE TECHNOLOGY 3 306 01416516 ROBOTICS LABORATORY 3 1 036 01416500 Computer vision RAI Elective mandatory Subject 3 306 XXXXXXX GENED ELECTIVE 3 306 TOTAL CREDITS 19 33 3rd YEAR 1st SEMESTER CODE SUBJECT CREDITS LES 01416801 MATHEMATICS OF DATA SCIENCE AND DATA ANALYTIC GENED', 'areas Each semester will include a project based theme which helps students practice and design innovative solutions in the respective areas In the first year the students study basic courses in mathematics and science and improve their communication skills Students will also be introduced to fundamental programming concepts and the foundation of robotics systems The firstyear projects will give students']","The course 'General Physics 1' covers basic physics and mechanics, including a study of motion, space and time, kinematics, Newton's law of motion, forces, energy and momentum, work, and power.","Motion, kinematics, Newton's laws, energy, and momentum.",1.0,0.9708059465862859,0.6999999999766667,1.0
What is the credit structure (L-E-S) for 'Computer Programming for RAI'?,"['Capstone Projects 6 6 B23 RAI Elective Mandatory Subjects 18 15 B24 RAI Elective Subjects 12 9 B25 Alternative Study 6 C Free Electives 6 6 D Internship 0 0 131 131 Course Group A General Education B Robotics and AI Specific Courses TOTAL Credits For Regular Students 24 313 Subjects One academic credit is given to a course offered in a single semester which Meets in class for lecture or discussion for 1', 'CREDITS LES XXXXXXX GENED ELECTIVE 3 306 01416315 INDUSTRIAL ELECTRONICS 3 306 0141XXXX RAI Elective mandatory subject 3 306 XXXXXXX FREE ELECTIVE 3 XXX 01416701 RAI ENGINEERING CAPSTONE DESIGN PREPARATION 3 095 TOTAL CREDITS 15 3rd YEAR 3rd SEMESTER SUMMER CODE 01006805 SUBJECT INDUSTRIAL INTERNSHIP TOTAL CREDITS CREDITS LES 0 0450 0 34 FOR REGULAR STUDENTS 4th YEAR 1st SEMESTER CODE SUBJECT CREDITS LES', '3 095 TOTAL CREDITS 9 35 FOR COOPSTUDY ABROAD STUDENTS 4th YEAR 1st SEMESTER CODE 01006301 or 01006302 SUBJECT CREDITS LES COOPERATIVE EDUCATION or STUDY ABROAD 6 0450 or 6 6012 TOTAL CREDITS 6 4th YEAR 2nd SEMESTER CODE SUBJECT CREDITS LES XXXXXXX GENED ELECTIVE 3 306 XXXXXXX FREE ELECTIVE 3 XXX 0141XXXX RAI Elective subject 3 306 0141XXXX RAI Elective subject 3 306 01416702 RAI ENGINEERING CAPSTONE DESIGN', 'hours S Selfstudy hours This study plan shows courses with credits equivalent to 3 However students can register 4 credit courses as well The total number of credits in each subject category will be counted toward the graduation 31 1st YEAR 1st SEMESTER CODE SUBJECT CREDITS LES 01416316 COMPUTER PROGRAMMING FOR RAI 3 225 01006710 INTRODUCATION TO CALCULUS 3 306 01006723 GENERAL PHYSICS 1 3 306 01006724', '4th YEAR 1st SEMESTER CODE SUBJECT CREDITS LES XXXXXXX FREE ELECTIVE 3 XXX XXXXXXX GENED ELECTIVE 3 306 0141XXXX RAI Elective mandatory subject 3 306 0141XXXX RAI Elective subject 3 306 TOTAL CREDITS 12 4th YEAR 2nd SEMESTER CODE SUBJECT CREDITS LES 0141XXXX RAI Elective subject 3 306 0141XXXX RAI Elective subject 3 306 01416702 RAI ENGINEERING CAPSTONE DESIGN 3 095 TOTAL CREDITS 9 35 FOR COOPSTUDY ABROAD', '3 306 01416702 RAI ENGINEERING CAPSTONE DESIGN 3 095 TOTAL CREDITS 15 Total credits required for graduation at least 315 Details of Each Subject Course description Appendix C 131 credits 36 32 Name Surname ID Number Position and Qualification of Instructors 321 Executive Program Committees NameSurname Academic Position ID Number Assoc Prof Dr Pitikhate Sooraksa Electrical Engineering Assoc Prof Dr Chutimet', 'OF DATA SCIENCE AND DATA ANALYTIC GENED SCIENCE MATHEMATICS ELECTIVE 3 306 01416306 SAFTY AND STANDARDIZATION IN RAI 3 306 01416319 MANUFACTURING PROCESS 3 306 01006718 DISCRETE MATHEMATICS RAI Elective mandatory Subject 3 306 0141XXXX RAI Elective mandatory subject 3 306 0141XXXX RAI Elective subject 3 306 TOTAL CREDITS 18 3rd YEAR 2nd SEMESTER CODE SUBJECT CREDITS LES XXXXXXX GENED ELECTIVE 3 306 01416315', 'MATHEMATICS ELECTIVE 3 306 01416310 STRENGTH OF MATERIALS 3 306 01416308 KINEMATICS AND DYNAMICS 3 306 01416305 ARTIFICIAL INTELLIGENCE TECHNOLOGY 3 306 01416516 ROBOTICS LABORATORY 3 1 036 01416500 Computer vision RAI Elective mandatory Subject 3 306 XXXXXXX GENED ELECTIVE 3 306 TOTAL CREDITS 19 33 3rd YEAR 1st SEMESTER CODE SUBJECT CREDITS LES 01416801 MATHEMATICS OF DATA SCIENCE AND DATA ANALYTIC GENED', '01006304 COOPERATIVE EDUCATION STUDY ABROAD OVERSEA TRAINING 6 0450 6 6012 6 0450 C FREE ELECTIVES 6 CREDITS Students must complete at least 6 additional credits from any courses offered by the institution D RAI INTERNSHIP 01006805 0 CREDITS INDUSTRIAL INTERNSHIPS 314 Recommended Study Plan 0 0450 Credit Notation L E S L Lecture Learning hours E Laboratory hours S Selfstudy hours This study plan shows', '3 306 01006723 GENERAL PHYSICS 1 3 306 01006724 GENERAL PHYSICS LABORATORY 1 1 032 01416309 ENGINEERING 3D DRAWING 3 225 XXXXXXX GENED ELECTIVE 3 306 01416000 ESL ACADEMIC LISTENING AND SPEAKING 3 306 TOTAL CREDITS 19 1st YEAR 2nd SEMESTER CODE SUBJECT CREDITS LES 01416320 INTRODUCTION TO ROBOTICS AND AI 3 306 01006803 ENGINEERING MECHANICS 3 306 01006711 ADVANCED CALCULUS 3 306 01006725 GENERAL PHYSICS 2 3', 'AND CONTROL SYSTEMS DIGITAL ELECTRONICS AND ELECTRICAL MACHINES 4 408 4 408 4 408 B24 RAI ELECTIVE SUBJECTS For Regular Students For UoB 22 Program Students For Coop Study Aboard Students 12 CREDITS 12 CREDITS 9 CREDITS 01416601 01416602 01416604 01416607 01416608 01416609 01416610 01416611 01416612 01416613 01416614 01416615 01416616 01416617 01416618 01416619 01416620 01416621 01416522 3 236 3 306 3 306 3', 'need 13 System Transfer of Credits in TwoSemester System Credits can be transferred upon the consent of executive program committee according to the Regulation of King Mongkuts Institute of Technology Ladkrabang regarding bachelor degree education year 2016 Appendix A and the Announcement of King Mongkuts Institute of Technology Ladkrabang regarding the crossinstitute registration of higher education', 'Design of UoB B22 CAPSTONE PROJECTS 01416701 RAI ENGINEERING CAPSTONE DESIGN PREPARATION 4 01416702 RAI ENGINEERING CAPSTONE DESIGN 5 4 compare to Module 04 29646 Integrated Design Project 3 of UoB 5 compare to Module 04 02279 Individual Project of UoB B23 RAI ELECTIVE MANDATORY SUBJECTS For Regular Students For UoB 22 Program Students For Coop Study Aboard Students 01416401 01416403 01416404 01416406', '01416310 Strength of Materials FUNDAMENTAL COURSE 01416301 Differential Equations and Matrix Algebra 53 1 Moral and ethics 2 Knowledge 3 Intellectual skills 4 Human relation skills and responsibility 5 Skills for mathematical calculation communication and information technology adeptness Course 1 01416304 Feedback Control 01416305 Artificial Intelligent Technology 01416306 Safety and Standardization in RAI', '1 Name of the Program Name of the program Thai Name of the program English 2 Degree and Major Full name Thai Full name English Abbreviation Thai Abbreviation English Bachelor of Engineering in Robotics and Artificial Intelligence Engineering International Program Bachelor of Engineering Robotics and AI Engineering BEng Robotics and AI Engineering 3 Major Field None 4 Total Credits At least 131 credits 5', 'for Graduation 312 Curriculum Structure Minimum Credits 131 credits For UoB 22 Program Students Credits For Coop Study Aboard Students 30 30 A1 English Proficiency Requirement ESL 9 9 A2 Communication Humanity and Social Skills 15 15 A3 Math and Science 6 6 95 95 B1 Core Courses 20 20 B2 Major Compulsory Courses 75 75 B21 Fundamental Subjects 39 39 B22 Capstone Projects 6 6 B23 RAI Elective Mandatory', '5th digit th th th 6 7 8 digit 01 41 00 6 means Faculty of Engineering means Robotics and AI program means shared courses means bachelor degree means Order of the subject 25 A GENERAL EDUCATION 30 CREDITS LECTURELABSELF STUDY A1 ENGLISH PROFICIENCY REQUIREMENT ESL 01416000 ACADEMIC LISTENING AND SPEAKING 01416001 ACADEMIC READING AND WRITING 01416003 INTERPRETATION AND ARGUMENTS 9 CREDITS 3 306 3 306 3 306', 'AND MATRIX ALGEBRA 3 306 01416515 ROBOTICS LABORATORY 2 1 036 01416304 FEEDBACK CONTROL 3 306 01416521 INTRODUCTION TO ALGORITHMS RAI Elective Mandatory Subject 3 306 XXXXXXX GENED ELECTIVE 3 306 01416003 ESL INTERPRETATION AND ARGUMENTS 3 306 TOTAL CREDITS 19 2nd YEAR 2nd SEMESTER CODE SUBJECT CREDITS LES 01006719 PROBABILITY AND STATISTICS 1 GENED SCIENCE MATHEMATICS ELECTIVE 3 306 01416310 STRENGTH OF', 'Field None 4 Total Credits At least 131 credits 5 Type of the Program 51 Level 4Year Bachelor Program 52 Program Category Academic bachelors degree program Academic bachelors degree program Advanced academic bachelors degree program 5 53 Medium of Instruction English 54 Admission Thai andor Foreign students 55 Collaboration with Other Institutes The program is in collaboration with many universities', 'CHEMISTRY LABORATORY 01006729 INTRODUCTION TO OPERATIONS RESEARCH 01416801 MATHEMATICS OF DATA SCIENCE AND DATA ANALYTIC 6 CREDITS 3 306 3 306 3 306 3 306 1 032 3 306 3 306 26 01006713 01006714 01006701 MATHEMATICAL CRYPTOGRAPHY 4 408 MATHEMATICS FOR 3D GAME AND COMPUTER GRAPHICS 4 408 MATHEMATICS OF DATA SCIENCE 4 408 TRACK UNIVERSITY OF BIRMINGHAM 22 DUAL DEGREE PROGRAM Only students in UoB 22 Dual Degree']",The credit structure (L-E-S) for 'Computer Programming for RAI' is 3-2-2.5.,3 (2-2-5).,0.5,0.9232416404916864,0.22407407406660496,0.0
Which course covers 'Kinematics and Dynamics'?,"['1 GENERAL PHYSICS LABORATORY 1 GENERAL PHYSICS 2 GENERAL PHYSICS LABORATORY 2 ENGINEERING MECHANICS STRENGTH OF MATERIALS B2 MAJOR COMPULSORY COURSE B21 FUNDAMENTAL SUBJECTS 01416301 DIFFERENTIAL EQUATIONS AND MATRIX ALGEBRA 01416304 FEEDBACK CONTROL 01416305 ARTIFICIAL INTELLIGENCE TECHNOLOGY 01416306 SAFETY AND STANDARDIZATION IN RAI 3 01416308 KINEMATICS AND DYNAMICS 01416309 ENGIEERING 3D DRAWING', 'metrology and examination techniques 01416320 INTRODUCTION TO ROBOTICS AND AI 3 306 PREREQUISITE NONE The course includes an overview of robotics and AI technology introduction to the configuration space concept rigid transformation and manipulator kinematics sensing and control robot programming robot motion planning and applications robot manipulation For AI students can explore the concepts and', 'in threedimensional space Calculus of real valued functions in threedimensional space Principal theory for applications such as Greens theorem divergence theorem Gauss theorem Stokes theorem etc 01006723 GENERAL PHYSICS 1 3 306 PREREQUISITE NONE This course covers basic physics and mechanics including a study of motion space and time kinematics Newtons law of motion forces energy and momentum work power', 'design and kinematics and dynamics Third year students will learn about the latest technologies and AI which happen in the area In each semester the students will study new concepts and apply creativity in completing projects in trending areas such as machine perception application development cognition and reasoning and IoT Students will also learn about AI engineering along with the process and tools to', 'PROGRAM Only students in UoB 22 Dual Degree program may choose the courses in this course 01416802 ADVANCED ENGINEERING MATHEMATICS B ROBOTICS AND AI COURSE SPECIFIC COURSES B1 CORE COURSE 01006710 01006711 01006723 01006724 01006725 01006726 01006803 01416310 4 408 95 CREDITS LECTURELABSELF STUDY INTRODUCTION TO CALCULUS ADVANCED CALCULUS GENERAL PHYSICS 1 GENERAL PHYSICS LABORATORY 1 GENERAL PHYSICS 2', '2 1 032 PREREQUISITE 01006723 GENERAL PHYSICS 1 The experiments that correspond to the subject in 01006725 General Physics 2 01006803 ENGINEERING MECHANICS 3 306 PREREQUISITE NONE Force systems resultant equilibrium fluid statics kinematics and kinetics of particles and rigid bodies Newtons second law of motion work and energy impulse and momentum 01006310 STRENGTH OF MATERIALS 3 306 PREREQUISITE NONE', 'University 1991 Matrix Analysis BEd Physics Hons Srinakharinwirot University 1988 Differential equation Control System Engineering Chaos Robotic 3 Teaching obligations 12 hoursweekly PhD Computer Engineering Syracuse University USA 1998 MS Computer Engineering Syracuse University USA 1996 BEng Electrical Engineering Kasetsart University 1990 1 Research Appendix H GIS Data Mining Multimedia Systems 2', 'systems The firstyear projects will give students handson experience introduction and basic development of robotics technologies In the second year the students will learn advanced robotics concepts which serve as the foundation of robotics technologies The students also learn to apply design methods for solutions in technical areas such as control systems design and kinematics and dynamics Third year', 'of motion forces energy and momentum work power conservation laws systems of particles linear momentum circular motion rotation torques harmonic oscillation and gravitation 01006724 GENERAL PHYSICS LABORATORY 1 1 032 PREREQUISITE NONE The experiments that correspond to the subject in 01006723 General Physics 1 01006725 GENERAL PHYSICS 2 PREREQUISITE 01006723 GENERAL PHYSICS 1 3 306 103 This course provides', 'DESIGN PREPARATION This course consists of open ended design projects that incorporate fundamental and advanced concepts in Robotics and AI Students will analyze design and implement innovative prototypes which require application of standards and realistic engineering constraints Students from alternative study programs can extend their work from the alternative study programs Each team of 1 to 4 students', 'of interaction with robotic technologies HRI techniques and programming related artificial intelligence humancomputer interaction human factors interaction design for psychology anthropology education drama and other fields theory to practice using stateoftheart interactive robots 01416511 MOBILE ROBOTS PREREQUISITE NONE 3 225 111 Introduction to mobile robot robot kinematics robot dynamics localization and', '1 Research Appendix H IT Automation Industrial Informatics 2 Textbook Matrix Analysis Differential equation Control System Engineering Chaos Robotic 3 Teaching obligations 12 hoursweekly Assoc Prof Dr Chutimet Srinilta Computer Engineering PhD Computer Engineering Syracuse University USA 1998 MS Computer Engineering Syracuse University USA 1996 BEng Electrical Engineering Kasetsart University 1990 1', '1 102 PREREQUISITE NONE This course consists of a series of lectures given by different faculty members and distinguished speakers from the academic and industries The lectures are designed to provide students a good understanding of each curriculum structure and the courses in each subject areas Students will be introduced to emerging trends in Engineering and the relevance of our courses New courses and', 'MATHEMATICS ELECTIVE 3 306 01416310 STRENGTH OF MATERIALS 3 306 01416308 KINEMATICS AND DYNAMICS 3 306 01416305 ARTIFICIAL INTELLIGENCE TECHNOLOGY 3 306 01416516 ROBOTICS LABORATORY 3 1 036 01416500 Computer vision RAI Elective mandatory Subject 3 306 XXXXXXX GENED ELECTIVE 3 306 TOTAL CREDITS 19 33 3rd YEAR 1st SEMESTER CODE SUBJECT CREDITS LES 01416801 MATHEMATICS OF DATA SCIENCE AND DATA ANALYTIC GENED', 'Mechanical Engineering MSTU Moscow Russia 1998 MS Mechanical Engineering MSTU Moscow Russia 1994 BS Civil Engineering Yonsei University Seoul South Korea 1991 1 Research Appendix H Nonlinear System AI 2 Teaching obligations 15 hoursweekly 39 322 Course instructors NameSurname Academic Position ID Number Qualification Department University Year of Graduation Academic Achievements Assoc Prof Dr Somyot', 'CALCULUS 3 306 01006725 GENERAL PHYSICS 2 3 306 01006726 GENERAL PHYSICS LABORATORY 2 1 032 01416318 MICROPROCESSOR AND INTERFACE 3 225 01416514 ROBOTICS LABORATORY 1 1 036 01416001 ESL ACADEMIC READING AND WRITING 3 306 TOTAL CREDITS 20 32 2nd YEAR 1st SEMESTER CODE SUBJECT CREDITS LES 01416312 ELECTRIC CIRCUIT AND ELECTRONICS 3 306 01416301 DIFFERENTIAL EQUATIONS AND MATRIX ALGEBRA 3 306 01416515 ROBOTICS', 'manufacturability and 17 Year Expected Learning Outcomes 3 4 sustainability using knowledge of kinematics kinetics and dynamics as well as material engineering for Robotics and AI ability to function on multidisciplinary teams via project based learning from RAI core courses ability to identify formulate and solve RAI engineering problems understanding of professional and ethical responsibility ability to', 'andor International Research Experience IRE andor taking courses related to research topic provides an opportunity to gain variable handson training and experience in real world situations andor study andor conduct research concerning Robotics and Artificial Intelligence engineering Additionally through exposure to current practice student can reflect on and appreciate the linkage between curriculum and', 'with an emphasis on recognition tasks and deep learning The course will examine data sources features and learning algorithms useful for understanding and manipulating visual data Several topics will straddle the boundary between computer vision and computer graphics Class topics will be pursued through independent reading class discussion and presentations and stateoftheart projects 01416504 MACHINE', 'and corresponding analysis tasks including multivariate data networks text and cartography Students will learn to evaluate and use visualization in their own work as well as build better visualization tools and systems thru handson labs programming and data analysis assignments 01416609 COGNITIVE COMPUTING APPLICATIONS 3 306 PREREQUISITE NONE This course provides an introduction to computational modeling of']",The course that covers 'Kinematics and Dynamics' is 01416308 KINEMATICS AND DYNAMICS.,01416308.,1.0,0.8757852816245394,0.5714285713999999,1.0
What is the minimum duration for the internship requirement?,"['Upon the completion of the program the students must prepare and deliver oral presentations describing their experience from the program 3 INTERNSHIP 01006805 INDUSTRIAL INTERNSHIP 0 0450 PREREQUISITE NONE During their fouryear selected studies students are required to complete a shortterm industrial placement within professional selected environments It takes place during a summer period This course allows', 'MSTU Moscow Russia 1994 BS Civil Engineering Yonsei University Seoul South Korea 1991 44 4 Component Regarding Field Experience Internship or CoOperative Education Students must participate in the internship or entrepreneurship experience for at least 8 weeks while working toward the degree usually during the summer This requirement could be satisfied by completing internships with an innovative company in', 'that apply the appropriate technology and information systems to solutions 42 Time Period Internship Summer Course of the 1st 2nd or 3rd academic year CoOperative Education the 1st Semester of the 4th academic year 43 Time Management and Scheduling 8 weeks for Internship or fulltime for one semester for CoOperative Education 5 Regulations for Special Project or CoOperative Education Students are able to', 'internships with an innovative company in public or private sectors including Cooperative Education participating in research projects with research labs or academic institutions or working toward the entrepreneurship with incubators The program committee will annually release the policies regarding the eligibility and the conditions required to complete the requirement Students who participate in an', 'the requirement Students who participate in an alternative study program as Co Operative Education can do a 16 week extended internship experience Interested students should contact the department or the program committee regarding the current policies and the requirements While on the Co Op assignment the students are participating in a recognized educational program and retain their fulltime student', 'occupational or professional skill and life skills 3 Criteria for Graduation According to the Program Students must complete at least 131 credits to graduate with at least 30 credits from general education courses at least 95 credits from Robotics and AI concentration and at least 6 credits of free electives and English proficiency level prior to the graduation Students must also complete the internship', 'the department The student must also complete the admission form through the meeting with their academic advisor for their master program If a student does not meet the GPA criteria of 300 he or she is eligible to hisher petition into the program during his or her fourth year with the permission of their academic advisor 22 3 Curriculum and Instructors The B Eng in Robotics and AI program is a four year', 'Students must also complete the internship requirement during their courses of study Also graduation according to the program is accordance with the Regulations of King Mongkuts Institute of Technology Ladkrabang regarding Bachelor Degree Education 2016 Appendix A 62 PART 6 DEVELOPMENT OF INSTRUCTORS 1 Preparation for New Instructors 11 Orientation for new instructors regarding roles and responsibilities of', 'There is a survey of graduates who get a job or freelance job within 1 year from the date of graduation 23 There is a survey of alumni who get a job or freelance job after graduation at least 5 years 3 Student 31 There is appropriate student admissions process by defining the criteria and qualifications for the students by the curriculum Moreoverthere is preparation course to ensure that students are ready', 'semesters each of which covers not less than 15 weeks excluding the examination weeks The summer semester is optional Most courses are offered on the main campus during the day Some courses or laboratory hours may be offered in the evening or weekend 12 Provision of Summer Course Summer courses will be offered based on instructors availability and students need 13 System Transfer of Credits in TwoSemester', 'education as well as the ABET Accreditation throughout the duration of administration of the program 11 Executive program committee there are no fewer than 5 persons who have either a direct qualification or a related field of study Their qualification is minimum as Master Degree or equivalent or academic positions no lower than Assistant Professor Moreover they have at least one academic results published', 'Meets in class for lecture or discussion for 1 hour per week or Contains at least 3 laboratory hours per week Most courses are given 3 or more credits For 4 credit courses these courses usually contain 3 hours of lecture or discussion per week The courses are also accompanied with 1 additional hour of recitation or 3 hours of laboratory work per week Students enrolled in the courses are also expected to', 'and details of each offered subject and planned activities if any at least before the opening of each semester for all subjects 4 Filing program review and report for the operation of each subject and field experience if any within 30 days after the end of the semester for all subjects 5 Filing report of the operation of the program according to SSRwithin 6 0 days after the end of the academic year 6 Having', '01006304 COOPERATIVE EDUCATION STUDY ABROAD OVERSEA TRAINING 6 0450 6 6012 6 0450 C FREE ELECTIVES 6 CREDITS Students must complete at least 6 additional credits from any courses offered by the institution D RAI INTERNSHIP 01006805 0 CREDITS INDUSTRIAL INTERNSHIPS 314 Recommended Study Plan 0 0450 Credit Notation L E S L Lecture Learning hours E Laboratory hours S Selfstudy hours This study plan shows', 'opportunity to gain valuable handson training and experience in real world situations Additionally through exposure to current practice students can reflect on and appreciate the linkage between curriculum and practice This is an advance to the Internship and Coop Education Students will develop specific skills both on engineering and professionals in actual working environment not less than 2 days a week', 'and Nanostructure Photovoltaic 09106405 LABONCHIP Technology 09106406 Microelectromechanical System 09106407 Chemistry Alternative Study Courses 01006301 Cooperative Education 01006302 Study Abroad Industrial Internship 01006805 Industrial Internship Total 2 3 4 5 1 2 3 4 5 1 2 3 4 5 1 2 3 4 5 1 2 3 4 5 61 PART5 CRITERIA FOR STUDENT EVALUATION 1 Regulations or Criteria for Grading Regulations or criteria', 'hours S Selfstudy hours This study plan shows courses with credits equivalent to 3 However students can register 4 credit courses as well The total number of credits in each subject category will be counted toward the graduation 31 1st YEAR 1st SEMESTER CODE SUBJECT CREDITS LES 01416316 COMPUTER PROGRAMMING FOR RAI 3 225 01006710 INTRODUCATION TO CALCULUS 3 306 01006723 GENERAL PHYSICS 1 3 306 01006724', 'Field None 4 Total Credits At least 131 credits 5 Type of the Program 51 Level 4Year Bachelor Program 52 Program Category Academic bachelors degree program Academic bachelors degree program Advanced academic bachelors degree program 5 53 Medium of Instruction English 54 Admission Thai andor Foreign students 55 Collaboration with Other Institutes The program is in collaboration with many universities', 'CREDITS LES XXXXXXX GENED ELECTIVE 3 306 01416315 INDUSTRIAL ELECTRONICS 3 306 0141XXXX RAI Elective mandatory subject 3 306 XXXXXXX FREE ELECTIVE 3 XXX 01416701 RAI ENGINEERING CAPSTONE DESIGN PREPARATION 3 095 TOTAL CREDITS 15 3rd YEAR 3rd SEMESTER SUMMER CODE 01006805 SUBJECT INDUSTRIAL INTERNSHIP TOTAL CREDITS CREDITS LES 0 0450 0 34 FOR REGULAR STUDENTS 4th YEAR 1st SEMESTER CODE SUBJECT CREDITS LES', 'B Eng in Robotics and AI program is a four year full time undergraduate program In order to graduate the students must complete at least 131 credits Students must achieve the required English proficiency level prior to the graduation and satisfy the graduation requirements The program is designed to drive innovations and entrepreneurship in robotics and AI technologyrelated areas Each semester will include']",The minimum duration for the internship requirement is 8 weeks.,At least 8 weeks.,1.0,1.0,0.5833333333041666,1.0
What alternative study option allows a 16-week internship?,"['the requirement Students who participate in an alternative study program as Co Operative Education can do a 16 week extended internship experience Interested students should contact the department or the program committee regarding the current policies and the requirements While on the Co Op assignment the students are participating in a recognized educational program and retain their fulltime student', 'opportunity to gain valuable handson training and experience in real world situations Additionally through exposure to current practice students can reflect on and appreciate the linkage between curriculum and practice This is an advance to the Internship and Coop Education Students will develop specific skills both on engineering and professionals in actual working environment not less than 2 days a week', 'internships with an innovative company in public or private sectors including Cooperative Education participating in research projects with research labs or academic institutions or working toward the entrepreneurship with incubators The program committee will annually release the policies regarding the eligibility and the conditions required to complete the requirement Students who participate in an', 'that apply the appropriate technology and information systems to solutions 42 Time Period Internship Summer Course of the 1st 2nd or 3rd academic year CoOperative Education the 1st Semester of the 4th academic year 43 Time Management and Scheduling 8 weeks for Internship or fulltime for one semester for CoOperative Education 5 Regulations for Special Project or CoOperative Education Students are able to', 'MSTU Moscow Russia 1994 BS Civil Engineering Yonsei University Seoul South Korea 1991 44 4 Component Regarding Field Experience Internship or CoOperative Education Students must participate in the internship or entrepreneurship experience for at least 8 weeks while working toward the degree usually during the summer This requirement could be satisfied by completing internships with an innovative company in', 'Upon the completion of the program the students must prepare and deliver oral presentations describing their experience from the program 3 INTERNSHIP 01006805 INDUSTRIAL INTERNSHIP 0 0450 PREREQUISITE NONE During their fouryear selected studies students are required to complete a shortterm industrial placement within professional selected environments It takes place during a summer period This course allows', 'design or cooperative education internship program for Robotics and AI Arranging for knowledge exchange activity in the program for both theory and practice between instructors and students as well as collaboration projects between institutes for internships Arranging for an education that promotes students selflearning Arranging for subjects that allow group works and assign a leader for each group as well', '01006304 COOPERATIVE EDUCATION STUDY ABROAD OVERSEA TRAINING 6 0450 6 6012 6 0450 C FREE ELECTIVES 6 CREDITS Students must complete at least 6 additional credits from any courses offered by the institution D RAI INTERNSHIP 01006805 0 CREDITS INDUSTRIAL INTERNSHIPS 314 Recommended Study Plan 0 0450 Credit Notation L E S L Lecture Learning hours E Laboratory hours S Selfstudy hours This study plan shows', 'semesters each of which covers not less than 15 weeks excluding the examination weeks The summer semester is optional Most courses are offered on the main campus during the day Some courses or laboratory hours may be offered in the evening or weekend 12 Provision of Summer Course Summer courses will be offered based on instructors availability and students need 13 System Transfer of Credits in TwoSemester', 'and Nanostructure Photovoltaic 09106405 LABONCHIP Technology 09106406 Microelectromechanical System 09106407 Chemistry Alternative Study Courses 01006301 Cooperative Education 01006302 Study Abroad Industrial Internship 01006805 Industrial Internship Total 2 3 4 5 1 2 3 4 5 1 2 3 4 5 1 2 3 4 5 1 2 3 4 5 61 PART5 CRITERIA FOR STUDENT EVALUATION 1 Regulations or Criteria for Grading Regulations or criteria', 'introduction to electrochemistry B25 ALTERNATIVE STUDY 01006301 COOPERATIVE EDUCATION 6 0450 PREREQUISITE NONE This course demands the student to work in an innovative company or a governmentprivate organization which is approved by the program committee for working on an innovative project for at least 16 weeks The work of the student is under supervision of a faculty member who is regarded as the student', 'hours S Selfstudy hours This study plan shows courses with credits equivalent to 3 However students can register 4 credit courses as well The total number of credits in each subject category will be counted toward the graduation 31 1st YEAR 1st SEMESTER CODE SUBJECT CREDITS LES 01416316 COMPUTER PROGRAMMING FOR RAI 3 225 01006710 INTRODUCATION TO CALCULUS 3 306 01006723 GENERAL PHYSICS 1 3 306 01006724', 'd Have tracking systems in place to monitor and evaluate students with academic behavioral and other problems e Have teaching assistant programs to aid students towards the specified learning outcomes f Have available scholarships for students with potential g Available student activities and clubs that promote personal development 20 25 Admission Plan and Estimated Graduation in 5 Years Academic Year', 'Capstone Projects 6 6 B23 RAI Elective Mandatory Subjects 18 15 B24 RAI Elective Subjects 12 9 B25 Alternative Study 6 C Free Electives 6 6 D Internship 0 0 131 131 Course Group A General Education B Robotics and AI Specific Courses TOTAL Credits For Regular Students 24 313 Subjects One academic credit is given to a course offered in a single semester which Meets in class for lecture or discussion for 1', 'Other FacultiesDepartments 10 PART 2 SPECIFIC INFORMATION OF THE PROGRAM 11 1 Philosophy Importance and Objectives of the Program 11 2 Development Plan 14 3 Student Outcomes16 PART 3 SYSTEM FOR EDUCATIONAL PROVISION MANAGEMENT AND STRUCTURE OF THE PROGRAM 18 1 System for Educational Provision 18 2 Management of the Program18 3 Curriculum and Instructors22 2 4 Component Regarding Field Experience Internship', 'Meets in class for lecture or discussion for 1 hour per week or Contains at least 3 laboratory hours per week Most courses are given 3 or more credits For 4 credit courses these courses usually contain 3 hours of lecture or discussion per week The courses are also accompanied with 1 additional hour of recitation or 3 hours of laboratory work per week Students enrolled in the courses are also expected to', 'Students must also complete the internship requirement during their courses of study Also graduation according to the program is accordance with the Regulations of King Mongkuts Institute of Technology Ladkrabang regarding Bachelor Degree Education 2016 Appendix A 62 PART 6 DEVELOPMENT OF INSTRUCTORS 1 Preparation for New Instructors 11 Orientation for new instructors regarding roles and responsibilities of', 'course to ensure that students are ready for their studies and to be able to complete theireducation for the duration of the program 32 The activities are organized to develop students knowledge abilities and potential in various ways to support 21stcentury learning skills 33 A consultant who is appointed for academic counseling and guidance to all students must schedule an appointment Office Hours for the', 'occupational or professional skill and life skills 3 Criteria for Graduation According to the Program Students must complete at least 131 credits to graduate with at least 30 credits from general education courses at least 95 credits from Robotics and AI concentration and at least 6 credits of free electives and English proficiency level prior to the graduation Students must also complete the internship', '4 Component Regarding Field Experience Internship or CoOperative Education43 5 Regulations for Special Project or CoOperative Education 43 6 Additional Costs44 PART 4 LEARNING OUTCOME TEACHING STRATEGY AND EVALUATION45 1 Development of Special Characteristics of Students 45 2 Development of Learning Results in Each Aspect 46 3 Curriculum Mapping Illustrating the Distribution of Program Standard Learning']",The alternative study option that allows a 16-week internship is the Cooperative Education program.,Co-Operative Education.,1.0,0.9955817217889783,0.7635281385185944,1.0
What is the objective of the 'RAI Engineering Capstone Design Preparation'?,"['constraints such as economic environmental social political ethical health and safety manufacturability and sustainability Each team must prepare and deliver oral presentations describing their analysis of the problems the proposed innovation and the design process 107 01416702 RAI ENGINEERING CAPSTONE DESIGN 3 095 PREREQUISITE 01416701 RAI ENGINEERING CAPSTONE DESIGN PREPARATION This course consists of', 'Design of UoB B22 CAPSTONE PROJECTS 01416701 RAI ENGINEERING CAPSTONE DESIGN PREPARATION 4 01416702 RAI ENGINEERING CAPSTONE DESIGN 5 4 compare to Module 04 29646 Integrated Design Project 3 of UoB 5 compare to Module 04 02279 Individual Project of UoB B23 RAI ELECTIVE MANDATORY SUBJECTS For Regular Students For UoB 22 Program Students For Coop Study Aboard Students 01416401 01416403 01416404 01416406', 'Moreover the aim of this training is to train the ability to report and summarize the experimental work B22 CAPSTONE PROJECTS 01416701 RAI ENGINEERING CAPSTONE DESIGN PREPARATION 3 095 PREREQUISITE NONE This course instructs and prepare students in aspects of effective technical oral presentations through exposure to different workplace communication skills As preparation and research for the capstone', 'or CoOperative Education Students are able to choose between completing preliminary project in Capstone Design Preparation course or participate in one of the studyabroad program or cooperative education All Students must also complete RAI capstone design course prior to graduation Students may extend their works from the cooperative education assignment or from the preparation course for their capstone', 'As preparation and research for the capstone design students must develop topics identify a supervisor and prepare a proposal for an oral presentation The design must incorporate fundamental and advanced concepts in Robotics and AI Each team of 2 to 4 students will propose innovative design projects which require application of standards and realistic engineering constraints such as economic environmental', '3 306 01416702 RAI ENGINEERING CAPSTONE DESIGN 3 095 TOTAL CREDITS 15 Total credits required for graduation at least 315 Details of Each Subject Course description Appendix C 131 credits 36 32 Name Surname ID Number Position and Qualification of Instructors 321 Executive Program Committees NameSurname Academic Position ID Number Assoc Prof Dr Pitikhate Sooraksa Electrical Engineering Assoc Prof Dr Chutimet', 'Engineering Quality RAI students will apply engineering practice combined with the innovative process to identify and solve significant problems across a broad range of applications Innovation RAI students will adapt the process by which technological ideas are generated developed and transformed into new business products processes services and solutions that meet the demands and establish marketplace', 'and ethical responsibility ability to communicate effectively by presenting RAI miniprojects the broad education necessary to understand the impact of engineering solutions in a global economic environmental and societal context via RAI industrial prototyping projects recognition of the need for and an ability to engage in lifelong learning from cooperation or academic training programs knowledge of', 'engineering along with the process and tools to facilitate new innovations Fourthyear students undertake significant RAI engineering capstone design projects Students will apply their skills and knowledge to create sustainable innovations practice openended engineering design andor research that incorporates fundamental and advanced concepts in Robotics and AI Students will learn to build innovation', 'or from the preparation course for their capstone design projects 51 Brief Description Students will practice openended engineering design that incorporates fundamental and advanced concepts in Robotics and AI Students will learn to build innovation identify the opportunities propose ideas design and implement innovative solutions while being able to apply standards and realistic engineering constraints 52', 'or academic training programs knowledge of contemporary issues via and ability to use the techniques skills and modern engineering tools necessary for engineering practice via RAI senior capstone projects 18 PART 3 SYSTEM FOR EDUCATIONAL PROVISION MANAGEMENT AND STRUCTURE OF THE PROGRAM 1 System for Educational Provision 11 System An academic year has two semesters each of which covers not less than 15', 'Capstone Projects 6 6 B23 RAI Elective Mandatory Subjects 18 15 B24 RAI Elective Subjects 12 9 B25 Alternative Study 6 C Free Electives 6 6 D Internship 0 0 131 131 Course Group A General Education B Robotics and AI Specific Courses TOTAL Credits For Regular Students 24 313 Subjects One academic credit is given to a course offered in a single semester which Meets in class for lecture or discussion for 1', 'concepts They will be able to explore and translate the benefit the uniqueness and the credibility of innovative ideas to a target audience 01006515 DESIGN METHODS FOR INNOVATIONS 4 408 PREREQUISITE NONE This course consists of structural design process to create innovative products or services The students will study the process to gather trends and information such as global direction public opinions', 'that meet the demands and establish marketplace advantage Lifelong Learning RAI students will learn new technologies methodologies and tools and adapt them to respond to the challenges of a changing environment Leadership RAI students will apply their technical and innovative leadership to establish successful careers in their business profession and community Economic Impact RAI students will apply their', 'Design and Modeling 01416406 Measurement and Instrumentation for Mechatronics 01416408 Computer Aid Mechanical Design 01416409 Fluid Mechanics 4 5 01416516 Robotics Laboratory 3 CAPSTONE PROJECTS 01416701 RAI Engineering Capstone Design Preparation 01416702 RAI Engineering Capstone Design RAI Elective Mandatory Subjects 3 1 2 3 4 5 1 2 3 4 5 1 2 3 4 5 1 2 3 4 5 55 1 Moral and ethics 2 Knowledge 3', 'Economic Impact RAI students will apply their technical expertise leadership and innovative mindset to support and strengthen the societys economic wellbeing Strategy or Activity of Students Arranging for an educating activity to develop learners skills by assigning operational practices in every Robotics and AI subjects Arranging for a seminar subject capstone design or cooperative education internship', 'manufacturability and 17 Year Expected Learning Outcomes 3 4 sustainability using knowledge of kinematics kinetics and dynamics as well as material engineering for Robotics and AI ability to function on multidisciplinary teams via project based learning from RAI core courses ability to identify formulate and solve RAI engineering problems understanding of professional and ethical responsibility ability to', 'to engineering economics commercialization manufacturability environmental social issues ethics and health and safety Each team must prepare and deliver oral presentations and demonstrations of their design prototype B23 RAI ELECTIVE MANDATORY SUBJECTS 01416401 THERMODYNAMICS 3 306 PREREQUISITE NONE Definitions and concepts properties of pure substances and ideal gases work and heat first law of', 'FOR MOBILE ROBOTICS INTRODUCTION TO ALGORITHMS COMMUNICATION NETWORK CAPSTONE DESIGN PREPARATION FOR SMART MATERIALS DISCRETE MATHEMATICS 3 306 3 306 3 306 3 306 3 095 3 306 FOR UNIVERSITY OF BIRMINGHAM 22 DUAL DEGREE PROGRAM Only students in UoB 22 Dual Degree program may choose these courses 01416525 01416526 01416527 ENGINEERING MECHANICS 2 MICROPROCESSOR AND CONTROL SYSTEMS DIGITAL ELECTRONICS AND', '01416310 Strength of Materials FUNDAMENTAL COURSE 01416301 Differential Equations and Matrix Algebra 53 1 Moral and ethics 2 Knowledge 3 Intellectual skills 4 Human relation skills and responsibility 5 Skills for mathematical calculation communication and information technology adeptness Course 1 01416304 Feedback Control 01416305 Artificial Intelligent Technology 01416306 Safety and Standardization in RAI']","The objective of the 'RAI Engineering Capstone Design Preparation' course is to instruct and prepare students in aspects of effective technical oral presentations through exposure to different workplace communication skills. It involves preparation and research for the capstone design, where students must develop topics, identify a supervisor, and prepare a proposal for an oral presentation. The course aims to prepare students for their capstone design projects by incorporating fundamental and advanced concepts in Robotics and AI.",Prepare students in effective technical oral presentations.,1.0,0.9185019460116508,0.3333333333,1.0
Which course introduces 'Artificial Intelligence Technology'?,"['design and kinematics and dynamics Third year students will learn about the latest technologies and AI which happen in the area In each semester the students will study new concepts and apply creativity in completing projects in trending areas such as machine perception application development cognition and reasoning and IoT Students will also learn about AI engineering along with the process and tools to', 'and AI Students will learn to build innovation identify the opportunities propose ideas design and implement innovative solutions while being able to apply standards and realistic engineering constraints Students also further specialize in their areas of interest and prepare for the next step in their careers 23 31 Curriculum 311 Minimum Credits Required for Graduation 312 Curriculum Structure Minimum', '306 PREREQUISITE NONE Materials on AI programming logic search game playing machine learning natural language understanding and robotics introduce the student to AI methods tools and techniques their application to computational problems and their contribution to understanding intelligence 01416306 SAFETY AND STANDARDIZATION IN RAI 3 306 PREREQUISITE NONE Law and standardization Safety requirement and', 'Course 1 01416630 Information System Security and IT Law 01416631 Robotics and AI Experience 01416632 Space Science 01416633 REINFORCEMENT LEARNING 01416634 INTRODUCTION TO PROMPT ENGINERRING 01416635 ADVANCED TECHNIQUES IN ChatGPT CUSTOMIZATION AND APPLICATION 01006006 Industrial Experience for Engineers 09106400 Materials Investigation 09106401 Photonics 09106402 Smart Material for Energy Storage 09106403', 'for the Planning of the Program 111 Economic SituationDevelopment The planning of bachelors degree program in Robotics and AI Engineering has been operated according to National Economic and Social Development Plan 2017 2021 which emphasizes on the development of science technology research and innovation in order to reinforce the sustainable growth of the industrial part The program also serves Thailand 4', 'such as analogical reasoning visual reasoning and meta reasoning The course will focus on cognitive computing application in several key areas including visual perception and attention object and face recognition learning and memory as well as decisionmaking and reasoning Students will learn to train and use existing cognitive computing platform in order to solve real world applications 01416610', 'PROGRAM Only students in UoB 22 Dual Degree program may choose the courses in this course 01416802 ADVANCED ENGINEERING MATHEMATICS B ROBOTICS AND AI COURSE SPECIFIC COURSES B1 CORE COURSE 01006710 01006711 01006723 01006724 01006725 01006726 01006803 01416310 4 408 95 CREDITS LECTURELABSELF STUDY INTRODUCTION TO CALCULUS ADVANCED CALCULUS GENERAL PHYSICS 1 GENERAL PHYSICS LABORATORY 1 GENERAL PHYSICS 2', 'and AI will be the major driving force of the transformation using their technical experts and understanding of the economic ecosystem and related processes 13 Program Educational Objectives Bachelor of Engineering Program in Robotics and AI emphasizes on the production of graduates with the following qualifications a Engineering Quality Our graduates will apply engineering practice combined with the', '408 POWER ELECTRONICS AND POWER SYSTEMS 4 408 THE INTERNET OF THINGS 4 408 TELEROBOTICS TELEPRESENCE AND AUGMENTED REALITY 4 408 ELECTRONIC ENGINEERING 4 408 TRACK SMART MATERIALS TECHNOLOGY Only students in Smart Materials Technology and Robotics and AI Dualdegree program may choose these courses 09106400 09106401 09106402 09106403 09106404 09106405 09106406 09106407 MATERIALS INVESTIGATION PHOTONICS SMART', 'training is to train the ability to report and summarize the experimental work 01416516 ROBOTICS LABORATORY 3 1 036 PREREQUISITE NONE The aim of this course is understanding the artificial intelligent technology by performing instructive experiments that reveal fundamental robotic principles and to attain a level of dexterity with experimental devices Moreover the aim of this training is to train the', 'Development of the Program and the Relation to the Mission of the Institute 121 Development of the Program The effects of external factors on the development of the Robotics and AI Engineering program Bachelor of Engineering call for the revision of the program so that it can support the needs according to enhancing and improving human capital as well as developing science technology research and innovation', 'andor International Research Experience IRE andor taking courses related to research topic provides an opportunity to gain variable handson training and experience in real world situations andor study andor conduct research concerning Robotics and Artificial Intelligence engineering Additionally through exposure to current practice student can reflect on and appreciate the linkage between curriculum and', 'FOR MECHATRONICS 3 306 COMPUTER AID MECHANICAL DESIGN 3 306 FLUID MECHANICS 3 306 INTRODUCTION TO NANOTECHNOLOGY AND NANOSCIENCE 3 306 INTRODUCTION TO MEMS 3 306 INTRODUCTION TO DATA SCIENCE 3 306 INFORMATION SYSTEMS DATABASES AND APPLICATION 3 306 DEEP LEARNING APPLICATION 3 306 COMPUTER VISIONS 3 306 DESIGNING COMPUTER VISION APPLICATIONS 3 306 MACHINE LEARNING IN PRACTICE 3 306 INTERNET OF THINGS AND', 'Mobile Robotics Artificial Intelligent Control 2 Teaching obligations 12 hoursweekly 40 Assoc Prof Dr Pitikhate Sooraksa Electrical Engineering PhD Electrical Engineering University of Houston USA 1996 MS Electrical Engineering George Washington University USA 1993 BS Physics Srinakharinwirot University 1991 BEd Physics Hons Srinakharinwirot University 1988 1 Research Appendix H IT Automation Industrial', 'B Eng in Robotics and AI program is a four year full time undergraduate program In order to graduate the students must complete at least 131 credits Students must achieve the required English proficiency level prior to the graduation and satisfy the graduation requirements The program is designed to drive innovations and entrepreneurship in robotics and AI technologyrelated areas Each semester will include', 'such as perception attention anticipation planning memory learning and reasoning social capabilities such as communication collaborative task execution and reasoning about the mental states of other agents Artificial intelligence techniques as well as insights from cognitive science 01416509 SYSTEM ENGINEERING 3 306 PREREQUISITE NONE Introduction to general concepts of SYSTEM ENGINEERING comprehensive', 'and realistic engineering constraints 52 Standard for Learning Outcome Students are able to analyze design and develop a project related to Robotics and AI 45 53 Time Period The 4th academic year 54 Credits 6 Credits 55 Preparation The proposal must be proposed with the approval of the program committee 56 Evaluation Process An evaluation is provided by a committee which consists of instructors in the', 'DESIGN PREPARATION This course consists of open ended design projects that incorporate fundamental and advanced concepts in Robotics and AI Students will analyze design and implement innovative prototypes which require application of standards and realistic engineering constraints Students from alternative study programs can extend their work from the alternative study programs Each team of 1 to 4 students', 'For AI students can explore the concepts and algorithms at the foundation of artificial intelligence diving into the ideas that give rise to technologies like basic machine learning image recognition and neural networks Through handson 106 projects students gain exposure to the theory behind graph search algorithms classification optimization and other topics in principle robotics artificial intelligence', '1 Name of the Program Name of the program Thai Name of the program English 2 Degree and Major Full name Thai Full name English Abbreviation Thai Abbreviation English Bachelor of Engineering in Robotics and Artificial Intelligence Engineering International Program Bachelor of Engineering Robotics and AI Engineering BEng Robotics and AI Engineering 3 Major Field None 4 Total Credits At least 131 credits 5']","The course ""01416516 ROBOTICS LABORATORY"" introduces artificial intelligence technology by performing instructive experiments that reveal fundamental robotic principles.",01416305.,1.0,0.5307685895947516,0.0,0.0
What is the focus of 'Robotics Laboratory 2'?,"['AND DYNAMICS 01416309 ENGIEERING 3D DRAWING 01416312 ELECTRIC CIRCUIT AND ELECTRONICS 01416315 INDUSTRIAL ELECTRONICS 2 01416316 COMPUTER PROGRAMMING FOR RAI 01416318 MICROPROCESSOR AND INTERFACE 01416319 MANUFACTURING PROCESS 1 01416320 INTRODUCTION TO ROBOTICS AND AI 01416514 ROBOTICS LABORATORY 1 20 CREDITS 3 306 3 306 3 306 1 032 3 306 1 032 3 306 3 306 75 CREDITS 39 CREDITS 3 306 3 306 3 306 3 306 3', 'training is to train the ability to report and summarize the experimental work 01416516 ROBOTICS LABORATORY 3 1 036 PREREQUISITE NONE The aim of this course is understanding the artificial intelligent technology by performing instructive experiments that reveal fundamental robotic principles and to attain a level of dexterity with experimental devices Moreover the aim of this training is to train the', 'systems The firstyear projects will give students handson experience introduction and basic development of robotics technologies In the second year the students will learn advanced robotics concepts which serve as the foundation of robotics technologies The students also learn to apply design methods for solutions in technical areas such as control systems design and kinematics and dynamics Third year', 'training is to train the ability to report and summarize the experimental work 01416515 ROBOTICS LABORATORY 2 1 036 PREREQUISITE NONE The aim of this course is understanding the mobile robot by performing instructive experiments that reveal fundamental robotic principles and to attain a level of dexterity with experimental devices Moreover the aim of this training is to train the ability to report and', 'andor International Research Experience IRE andor taking courses related to research topic provides an opportunity to gain variable handson training and experience in real world situations andor study andor conduct research concerning Robotics and Artificial Intelligence engineering Additionally through exposure to current practice student can reflect on and appreciate the linkage between curriculum and', '01416515 Robotics Laboratory 2 2 3 4 5 1 2 3 4 5 1 2 3 4 5 1 2 3 4 5 1 2 3 4 5 54 1 Moral and ethics 2 Knowledge 3 Intellectual skills 4 Human relation skills and responsibility 5 Skills for mathematical calculation communication and information technology adeptness Course 1 2 01416401 Thermodynamics 01416403 Dynamic of Machinery 01416404 Mechanical Design and Modeling 01416406 Measurement and', '1 GENERAL PHYSICS LABORATORY 1 GENERAL PHYSICS 2 GENERAL PHYSICS LABORATORY 2 ENGINEERING MECHANICS STRENGTH OF MATERIALS B2 MAJOR COMPULSORY COURSE B21 FUNDAMENTAL SUBJECTS 01416301 DIFFERENTIAL EQUATIONS AND MATRIX ALGEBRA 01416304 FEEDBACK CONTROL 01416305 ARTIFICIAL INTELLIGENCE TECHNOLOGY 01416306 SAFETY AND STANDARDIZATION IN RAI 3 01416308 KINEMATICS AND DYNAMICS 01416309 ENGIEERING 3D DRAWING', 'for innovation 122 Relation to the Mission of the Institute The development of the Robotics and AI Engineering program is related to the strategic advancement of scholar production to create next generation scholars with capabilities and flexibility to adapt to the change in the economy society and culture It also directly reflects the mission of the Institute to be the Master of Innovation and the Corner', 'for the Planning of the Program 111 Economic SituationDevelopment The planning of bachelors degree program in Robotics and AI Engineering has been operated according to National Economic and Social Development Plan 2017 2021 which emphasizes on the development of science technology research and innovation in order to reinforce the sustainable growth of the industrial part The program also serves Thailand 4', '75 CREDITS 39 CREDITS 3 306 3 306 3 306 3 306 3 306 3 225 3 306 3 306 3 225 3 225 3 306 3 306 1 036 27 01416515 ROBOTICS LABORATORY 2 01416516 ROBOTICS LABORATORY 3 1 compare to Module 04 32798 Mechatronic Design of UoB 1 036 1 036 2 compare to Module 04 19505 Electronic Circuits and Devices and Electromagnetics of UoB 3 compare to Module 04 32798 Mechatronic Design of UoB B22 CAPSTONE PROJECTS 01416701 RAI', 'Mobile Robotics Artificial Intelligent Control 2 Teaching obligations 12 hoursweekly 40 Assoc Prof Dr Pitikhate Sooraksa Electrical Engineering PhD Electrical Engineering University of Houston USA 1996 MS Electrical Engineering George Washington University USA 1993 BS Physics Srinakharinwirot University 1991 BEd Physics Hons Srinakharinwirot University 1988 1 Research Appendix H IT Automation Industrial', 'Coupling with the ongoing innovations in global computing technology landscape there is a significant demand for highquality graduates who are skillful in computing and innovation for all industries on the verge of digital disruption Existing businesses will have to adapt and innovatively transform itself in order to stay competitive Graduates from Robotics and AI will be the major driving force of the', 'Responsible for The Program 139 4 BACHELOR OF ENGINEERING PROGRAM IN ROBOTICS and ARTIFICIAL INTELLIGENCE ENGINEERING INTERNATIONAL PROGRAM Revised 2020 Name of Educational Institute King Mongkuts Institute of Technology Ladkrabang FacultyDepartment Faculty of Engineering School of International Multidisciplinary Engineering Programs PART 1 GENERAL INFORMATION 1 Name of the Program Name of the program Thai', 'Development of the Program and the Relation to the Mission of the Institute 121 Development of the Program The effects of external factors on the development of the Robotics and AI Engineering program Bachelor of Engineering call for the revision of the program so that it can support the needs according to enhancing and improving human capital as well as developing science technology research and innovation', 'of interaction with robotic technologies HRI techniques and programming related artificial intelligence humancomputer interaction human factors interaction design for psychology anthropology education drama and other fields theory to practice using stateoftheart interactive robots 01416511 MOBILE ROBOTS PREREQUISITE NONE 3 225 111 Introduction to mobile robot robot kinematics robot dynamics localization and', 'design or cooperative education internship program for Robotics and AI Arranging for knowledge exchange activity in the program for both theory and practice between instructors and students as well as collaboration projects between institutes for internships Arranging for an education that promotes students selflearning Arranging for subjects that allow group works and assign a leader for each group as well', 'Design and Modeling 01416406 Measurement and Instrumentation for Mechatronics 01416408 Computer Aid Mechanical Design 01416409 Fluid Mechanics 4 5 01416516 Robotics Laboratory 3 CAPSTONE PROJECTS 01416701 RAI Engineering Capstone Design Preparation 01416702 RAI Engineering Capstone Design RAI Elective Mandatory Subjects 3 1 2 3 4 5 1 2 3 4 5 1 2 3 4 5 1 2 3 4 5 55 1 Moral and ethics 2 Knowledge 3', 'in principle robotics artificial intelligence and machine learning applications 01416514 ROBOTICS LABORATORY 1 1 036 PREREQUISITE NONE The aim of this course is understanding the stationary robot by performing instructive experiments that reveal fundamental robotic principles and to attain a level of dexterity with experimental devices Moreover the aim of this training is to train the ability to report and', '01416306 Safety and Standardization in RAI 01416308 Kinematics and Dynamics 01416309 Engineering 3D Drawing 01416312 Electric Circuit and Electronics 01416315 Industrial Electronics 01416316 Computer Programming for RAI 01416318 Microprocessor and Interface 01416319 Manufacturing Process 01416320 Introduction to Robotics and AI 01416514 Robotics Laboratory 1 01416515 Robotics Laboratory 2 2 3 4 5 1 2 3 4 5', 'programming collection framework concurrent programming socket programming and or frameworks of contemporary interest hands on practice in developing application software through the application of development frameworks 01416615 CYBER PHYSICAL ROBOTICS 3 306 PREREQUISITE NONE Robots 4 0 involves computation communication and control which have become increasingly interwoven to produce highly functional']","The focus of 'Robotics Laboratory 2' is understanding the mobile robot by performing instructive experiments that reveal fundamental robotic principles and to attain a level of dexterity with experimental devices. Moreover, the aim of this training is to train the ability to report and summarize the experimental work.",Understanding mobile robots through experiments.,1.0,1.0,0.249999999975,1.0
What does 'L' stand for in the credit notation (L-E-S)?,"['CREDITS LES XXXXXXX GENED ELECTIVE 3 306 01416315 INDUSTRIAL ELECTRONICS 3 306 0141XXXX RAI Elective mandatory subject 3 306 XXXXXXX FREE ELECTIVE 3 XXX 01416701 RAI ENGINEERING CAPSTONE DESIGN PREPARATION 3 095 TOTAL CREDITS 15 3rd YEAR 3rd SEMESTER SUMMER CODE 01006805 SUBJECT INDUSTRIAL INTERNSHIP TOTAL CREDITS CREDITS LES 0 0450 0 34 FOR REGULAR STUDENTS 4th YEAR 1st SEMESTER CODE SUBJECT CREDITS LES', '4th YEAR 1st SEMESTER CODE SUBJECT CREDITS LES XXXXXXX FREE ELECTIVE 3 XXX XXXXXXX GENED ELECTIVE 3 306 0141XXXX RAI Elective mandatory subject 3 306 0141XXXX RAI Elective subject 3 306 TOTAL CREDITS 12 4th YEAR 2nd SEMESTER CODE SUBJECT CREDITS LES 0141XXXX RAI Elective subject 3 306 0141XXXX RAI Elective subject 3 306 01416702 RAI ENGINEERING CAPSTONE DESIGN 3 095 TOTAL CREDITS 9 35 FOR COOPSTUDY ABROAD', '3 095 TOTAL CREDITS 9 35 FOR COOPSTUDY ABROAD STUDENTS 4th YEAR 1st SEMESTER CODE 01006301 or 01006302 SUBJECT CREDITS LES COOPERATIVE EDUCATION or STUDY ABROAD 6 0450 or 6 6012 TOTAL CREDITS 6 4th YEAR 2nd SEMESTER CODE SUBJECT CREDITS LES XXXXXXX GENED ELECTIVE 3 306 XXXXXXX FREE ELECTIVE 3 XXX 0141XXXX RAI Elective subject 3 306 0141XXXX RAI Elective subject 3 306 01416702 RAI ENGINEERING CAPSTONE DESIGN', '5th digit th th th 6 7 8 digit 01 41 00 6 means Faculty of Engineering means Robotics and AI program means shared courses means bachelor degree means Order of the subject 25 A GENERAL EDUCATION 30 CREDITS LECTURELABSELF STUDY A1 ENGLISH PROFICIENCY REQUIREMENT ESL 01416000 ACADEMIC LISTENING AND SPEAKING 01416001 ACADEMIC READING AND WRITING 01416003 INTERPRETATION AND ARGUMENTS 9 CREDITS 3 306 3 306 3 306', '3 306 01006723 GENERAL PHYSICS 1 3 306 01006724 GENERAL PHYSICS LABORATORY 1 1 032 01416309 ENGINEERING 3D DRAWING 3 225 XXXXXXX GENED ELECTIVE 3 306 01416000 ESL ACADEMIC LISTENING AND SPEAKING 3 306 TOTAL CREDITS 19 1st YEAR 2nd SEMESTER CODE SUBJECT CREDITS LES 01416320 INTRODUCTION TO ROBOTICS AND AI 3 306 01006803 ENGINEERING MECHANICS 3 306 01006711 ADVANCED CALCULUS 3 306 01006725 GENERAL PHYSICS 2 3', 'hours S Selfstudy hours This study plan shows courses with credits equivalent to 3 However students can register 4 credit courses as well The total number of credits in each subject category will be counted toward the graduation 31 1st YEAR 1st SEMESTER CODE SUBJECT CREDITS LES 01416316 COMPUTER PROGRAMMING FOR RAI 3 225 01006710 INTRODUCATION TO CALCULUS 3 306 01006723 GENERAL PHYSICS 1 3 306 01006724', 'CALCULUS 3 306 01006725 GENERAL PHYSICS 2 3 306 01006726 GENERAL PHYSICS LABORATORY 2 1 032 01416318 MICROPROCESSOR AND INTERFACE 3 225 01416514 ROBOTICS LABORATORY 1 1 036 01416001 ESL ACADEMIC READING AND WRITING 3 306 TOTAL CREDITS 20 32 2nd YEAR 1st SEMESTER CODE SUBJECT CREDITS LES 01416312 ELECTRIC CIRCUIT AND ELECTRONICS 3 306 01416301 DIFFERENTIAL EQUATIONS AND MATRIX ALGEBRA 3 306 01416515 ROBOTICS', '1 Name of the Program Name of the program Thai Name of the program English 2 Degree and Major Full name Thai Full name English Abbreviation Thai Abbreviation English Bachelor of Engineering in Robotics and Artificial Intelligence Engineering International Program Bachelor of Engineering Robotics and AI Engineering BEng Robotics and AI Engineering 3 Major Field None 4 Total Credits At least 131 credits 5', '01006304 COOPERATIVE EDUCATION STUDY ABROAD OVERSEA TRAINING 6 0450 6 6012 6 0450 C FREE ELECTIVES 6 CREDITS Students must complete at least 6 additional credits from any courses offered by the institution D RAI INTERNSHIP 01006805 0 CREDITS INDUSTRIAL INTERNSHIPS 314 Recommended Study Plan 0 0450 Credit Notation L E S L Lecture Learning hours E Laboratory hours S Selfstudy hours This study plan shows', 'MATHEMATICS ELECTIVE 3 306 01416310 STRENGTH OF MATERIALS 3 306 01416308 KINEMATICS AND DYNAMICS 3 306 01416305 ARTIFICIAL INTELLIGENCE TECHNOLOGY 3 306 01416516 ROBOTICS LABORATORY 3 1 036 01416500 Computer vision RAI Elective mandatory Subject 3 306 XXXXXXX GENED ELECTIVE 3 306 TOTAL CREDITS 19 33 3rd YEAR 1st SEMESTER CODE SUBJECT CREDITS LES 01416801 MATHEMATICS OF DATA SCIENCE AND DATA ANALYTIC GENED', 'OF DATA SCIENCE AND DATA ANALYTIC GENED SCIENCE MATHEMATICS ELECTIVE 3 306 01416306 SAFTY AND STANDARDIZATION IN RAI 3 306 01416319 MANUFACTURING PROCESS 3 306 01006718 DISCRETE MATHEMATICS RAI Elective mandatory Subject 3 306 0141XXXX RAI Elective mandatory subject 3 306 0141XXXX RAI Elective subject 3 306 TOTAL CREDITS 18 3rd YEAR 2nd SEMESTER CODE SUBJECT CREDITS LES XXXXXXX GENED ELECTIVE 3 306 01416315', '1606250 2191250 2431250 2431250 Administrative Staffs 544000 544000 725333 725333 725333 Professional Dev 596000 762667 962667 962667 962667 2 Operating Expense 916100 1272433 1977883 2371883 2545217 Subscriptions Consumables 583433 831433 1266217 1534217 1647550 Activities 332667 441000 711667 837667 897667 3 Scholarship 350000 550000 750000 800000 800000 Full Scholarship 350000 550000 750000 800000 800000', 'Capstone Projects 6 6 B23 RAI Elective Mandatory Subjects 18 15 B24 RAI Elective Subjects 12 9 B25 Alternative Study 6 C Free Electives 6 6 D Internship 0 0 131 131 Course Group A General Education B Robotics and AI Specific Courses TOTAL Credits For Regular Students 24 313 Subjects One academic credit is given to a course offered in a single semester which Meets in class for lecture or discussion for 1', 'Scholarship 350000 550000 750000 800000 800000 21 Academic Year 2020 2021 2022 2023 2024 4 Facilities 135333 252000 392000 490000 536667 Facilities Utilities 135333 252000 392000 490000 536667 5 Capital 403600 171600 171600 838267 171600 Equipments Accreditation 1210800 514800 514800 2514800 514800 Total Expense 3962533 5158950 7170733 8619400 8172733 Enrollments 60 90 120 150 120 Estimated expenditure per', 'AND ARGUMENTS 9 CREDITS 3 306 3 306 3 306 A2 COMMUNICATION HUMANITY AND SOCIAL SKILLS 01006502 PROFESSIONAL ETHICS 01006503 INTRODUCTION TO PSYCHOLOGY 01006504 PHILOSOPHY OF SCIENCE 01006505 CREATIVE THINKING 01006506 CRITICAL THINKING 01006507 PERSONAL ECONOMICS 01006508 DIGITAL ECONOMY 01006509 ENGINEERING AND PUBLIC POLICY 01006510 INTRODUCTION TO ECONOMICS 01006511 THAI SOCIETY AND CULTURE 01006512', 'need 13 System Transfer of Credits in TwoSemester System Credits can be transferred upon the consent of executive program committee according to the Regulation of King Mongkuts Institute of Technology Ladkrabang regarding bachelor degree education year 2016 Appendix A and the Announcement of King Mongkuts Institute of Technology Ladkrabang regarding the crossinstitute registration of higher education', 'Field None 4 Total Credits At least 131 credits 5 Type of the Program 51 Level 4Year Bachelor Program 52 Program Category Academic bachelors degree program Academic bachelors degree program Advanced academic bachelors degree program 5 53 Medium of Instruction English 54 Admission Thai andor Foreign students 55 Collaboration with Other Institutes The program is in collaboration with many universities', 'for Graduation 312 Curriculum Structure Minimum Credits 131 credits For UoB 22 Program Students Credits For Coop Study Aboard Students 30 30 A1 English Proficiency Requirement ESL 9 9 A2 Communication Humanity and Social Skills 15 15 A3 Math and Science 6 6 95 95 B1 Core Courses 20 20 B2 Major Compulsory Courses 75 75 B21 Fundamental Subjects 39 39 B22 Capstone Projects 6 6 B23 RAI Elective Mandatory', 'CHEMISTRY LABORATORY 01006729 INTRODUCTION TO OPERATIONS RESEARCH 01416801 MATHEMATICS OF DATA SCIENCE AND DATA ANALYTIC 6 CREDITS 3 306 3 306 3 306 3 306 1 032 3 306 3 306 26 01006713 01006714 01006701 MATHEMATICAL CRYPTOGRAPHY 4 408 MATHEMATICS FOR 3D GAME AND COMPUTER GRAPHICS 4 408 MATHEMATICS OF DATA SCIENCE 4 408 TRACK UNIVERSITY OF BIRMINGHAM 22 DUAL DEGREE PROGRAM Only students in UoB 22 Dual Degree', 'AND MATRIX ALGEBRA 3 306 01416515 ROBOTICS LABORATORY 2 1 036 01416304 FEEDBACK CONTROL 3 306 01416521 INTRODUCTION TO ALGORITHMS RAI Elective Mandatory Subject 3 306 XXXXXXX GENED ELECTIVE 3 306 01416003 ESL INTERPRETATION AND ARGUMENTS 3 306 TOTAL CREDITS 19 2nd YEAR 2nd SEMESTER CODE SUBJECT CREDITS LES 01006719 PROBABILITY AND STATISTICS 1 GENED SCIENCE MATHEMATICS ELECTIVE 3 306 01416310 STRENGTH OF']",'L' stands for Lecture Learning hours in the credit notation (L-E-S).,Lecture or Learning hours.,1.0,0.9494687968581877,0.11111111109999999,1.0
What does 'E' stand for in the credit notation (L-E-S)?,"['CREDITS LES XXXXXXX GENED ELECTIVE 3 306 01416315 INDUSTRIAL ELECTRONICS 3 306 0141XXXX RAI Elective mandatory subject 3 306 XXXXXXX FREE ELECTIVE 3 XXX 01416701 RAI ENGINEERING CAPSTONE DESIGN PREPARATION 3 095 TOTAL CREDITS 15 3rd YEAR 3rd SEMESTER SUMMER CODE 01006805 SUBJECT INDUSTRIAL INTERNSHIP TOTAL CREDITS CREDITS LES 0 0450 0 34 FOR REGULAR STUDENTS 4th YEAR 1st SEMESTER CODE SUBJECT CREDITS LES', '4th YEAR 1st SEMESTER CODE SUBJECT CREDITS LES XXXXXXX FREE ELECTIVE 3 XXX XXXXXXX GENED ELECTIVE 3 306 0141XXXX RAI Elective mandatory subject 3 306 0141XXXX RAI Elective subject 3 306 TOTAL CREDITS 12 4th YEAR 2nd SEMESTER CODE SUBJECT CREDITS LES 0141XXXX RAI Elective subject 3 306 0141XXXX RAI Elective subject 3 306 01416702 RAI ENGINEERING CAPSTONE DESIGN 3 095 TOTAL CREDITS 9 35 FOR COOPSTUDY ABROAD', '3 095 TOTAL CREDITS 9 35 FOR COOPSTUDY ABROAD STUDENTS 4th YEAR 1st SEMESTER CODE 01006301 or 01006302 SUBJECT CREDITS LES COOPERATIVE EDUCATION or STUDY ABROAD 6 0450 or 6 6012 TOTAL CREDITS 6 4th YEAR 2nd SEMESTER CODE SUBJECT CREDITS LES XXXXXXX GENED ELECTIVE 3 306 XXXXXXX FREE ELECTIVE 3 XXX 0141XXXX RAI Elective subject 3 306 0141XXXX RAI Elective subject 3 306 01416702 RAI ENGINEERING CAPSTONE DESIGN', '5th digit th th th 6 7 8 digit 01 41 00 6 means Faculty of Engineering means Robotics and AI program means shared courses means bachelor degree means Order of the subject 25 A GENERAL EDUCATION 30 CREDITS LECTURELABSELF STUDY A1 ENGLISH PROFICIENCY REQUIREMENT ESL 01416000 ACADEMIC LISTENING AND SPEAKING 01416001 ACADEMIC READING AND WRITING 01416003 INTERPRETATION AND ARGUMENTS 9 CREDITS 3 306 3 306 3 306', 'MATHEMATICS ELECTIVE 3 306 01416310 STRENGTH OF MATERIALS 3 306 01416308 KINEMATICS AND DYNAMICS 3 306 01416305 ARTIFICIAL INTELLIGENCE TECHNOLOGY 3 306 01416516 ROBOTICS LABORATORY 3 1 036 01416500 Computer vision RAI Elective mandatory Subject 3 306 XXXXXXX GENED ELECTIVE 3 306 TOTAL CREDITS 19 33 3rd YEAR 1st SEMESTER CODE SUBJECT CREDITS LES 01416801 MATHEMATICS OF DATA SCIENCE AND DATA ANALYTIC GENED', '3 306 01006723 GENERAL PHYSICS 1 3 306 01006724 GENERAL PHYSICS LABORATORY 1 1 032 01416309 ENGINEERING 3D DRAWING 3 225 XXXXXXX GENED ELECTIVE 3 306 01416000 ESL ACADEMIC LISTENING AND SPEAKING 3 306 TOTAL CREDITS 19 1st YEAR 2nd SEMESTER CODE SUBJECT CREDITS LES 01416320 INTRODUCTION TO ROBOTICS AND AI 3 306 01006803 ENGINEERING MECHANICS 3 306 01006711 ADVANCED CALCULUS 3 306 01006725 GENERAL PHYSICS 2 3', 'OF DATA SCIENCE AND DATA ANALYTIC GENED SCIENCE MATHEMATICS ELECTIVE 3 306 01416306 SAFTY AND STANDARDIZATION IN RAI 3 306 01416319 MANUFACTURING PROCESS 3 306 01006718 DISCRETE MATHEMATICS RAI Elective mandatory Subject 3 306 0141XXXX RAI Elective mandatory subject 3 306 0141XXXX RAI Elective subject 3 306 TOTAL CREDITS 18 3rd YEAR 2nd SEMESTER CODE SUBJECT CREDITS LES XXXXXXX GENED ELECTIVE 3 306 01416315', 'CALCULUS 3 306 01006725 GENERAL PHYSICS 2 3 306 01006726 GENERAL PHYSICS LABORATORY 2 1 032 01416318 MICROPROCESSOR AND INTERFACE 3 225 01416514 ROBOTICS LABORATORY 1 1 036 01416001 ESL ACADEMIC READING AND WRITING 3 306 TOTAL CREDITS 20 32 2nd YEAR 1st SEMESTER CODE SUBJECT CREDITS LES 01416312 ELECTRIC CIRCUIT AND ELECTRONICS 3 306 01416301 DIFFERENTIAL EQUATIONS AND MATRIX ALGEBRA 3 306 01416515 ROBOTICS', 'hours S Selfstudy hours This study plan shows courses with credits equivalent to 3 However students can register 4 credit courses as well The total number of credits in each subject category will be counted toward the graduation 31 1st YEAR 1st SEMESTER CODE SUBJECT CREDITS LES 01416316 COMPUTER PROGRAMMING FOR RAI 3 225 01006710 INTRODUCATION TO CALCULUS 3 306 01006723 GENERAL PHYSICS 1 3 306 01006724', '01006304 COOPERATIVE EDUCATION STUDY ABROAD OVERSEA TRAINING 6 0450 6 6012 6 0450 C FREE ELECTIVES 6 CREDITS Students must complete at least 6 additional credits from any courses offered by the institution D RAI INTERNSHIP 01006805 0 CREDITS INDUSTRIAL INTERNSHIPS 314 Recommended Study Plan 0 0450 Credit Notation L E S L Lecture Learning hours E Laboratory hours S Selfstudy hours This study plan shows', 'Scholarship 350000 550000 750000 800000 800000 21 Academic Year 2020 2021 2022 2023 2024 4 Facilities 135333 252000 392000 490000 536667 Facilities Utilities 135333 252000 392000 490000 536667 5 Capital 403600 171600 171600 838267 171600 Equipments Accreditation 1210800 514800 514800 2514800 514800 Total Expense 3962533 5158950 7170733 8619400 8172733 Enrollments 60 90 120 150 120 Estimated expenditure per', 'AND ARGUMENTS 9 CREDITS 3 306 3 306 3 306 A2 COMMUNICATION HUMANITY AND SOCIAL SKILLS 01006502 PROFESSIONAL ETHICS 01006503 INTRODUCTION TO PSYCHOLOGY 01006504 PHILOSOPHY OF SCIENCE 01006505 CREATIVE THINKING 01006506 CRITICAL THINKING 01006507 PERSONAL ECONOMICS 01006508 DIGITAL ECONOMY 01006509 ENGINEERING AND PUBLIC POLICY 01006510 INTRODUCTION TO ECONOMICS 01006511 THAI SOCIETY AND CULTURE 01006512', '1 Name of the Program Name of the program Thai Name of the program English 2 Degree and Major Full name Thai Full name English Abbreviation Thai Abbreviation English Bachelor of Engineering in Robotics and Artificial Intelligence Engineering International Program Bachelor of Engineering Robotics and AI Engineering BEng Robotics and AI Engineering 3 Major Field None 4 Total Credits At least 131 credits 5', 'for Graduation 312 Curriculum Structure Minimum Credits 131 credits For UoB 22 Program Students Credits For Coop Study Aboard Students 30 30 A1 English Proficiency Requirement ESL 9 9 A2 Communication Humanity and Social Skills 15 15 A3 Math and Science 6 6 95 95 B1 Core Courses 20 20 B2 Major Compulsory Courses 75 75 B21 Fundamental Subjects 39 39 B22 Capstone Projects 6 6 B23 RAI Elective Mandatory', '1606250 2191250 2431250 2431250 Administrative Staffs 544000 544000 725333 725333 725333 Professional Dev 596000 762667 962667 962667 962667 2 Operating Expense 916100 1272433 1977883 2371883 2545217 Subscriptions Consumables 583433 831433 1266217 1534217 1647550 Activities 332667 441000 711667 837667 897667 3 Scholarship 350000 550000 750000 800000 800000 Full Scholarship 350000 550000 750000 800000 800000', 'need 13 System Transfer of Credits in TwoSemester System Credits can be transferred upon the consent of executive program committee according to the Regulation of King Mongkuts Institute of Technology Ladkrabang regarding bachelor degree education year 2016 Appendix A and the Announcement of King Mongkuts Institute of Technology Ladkrabang regarding the crossinstitute registration of higher education', 'Capstone Projects 6 6 B23 RAI Elective Mandatory Subjects 18 15 B24 RAI Elective Subjects 12 9 B25 Alternative Study 6 C Free Electives 6 6 D Internship 0 0 131 131 Course Group A General Education B Robotics and AI Specific Courses TOTAL Credits For Regular Students 24 313 Subjects One academic credit is given to a course offered in a single semester which Meets in class for lecture or discussion for 1', 'of the Operation According to the Details of the Program Having quality assurance system and provision of education according to the standard framework of qualification for higher education as well as ABET Accreditation by having key performance indicators and assessment criteria assigned by the Internal QA committee 4 Revision of the Evaluation and Improvement Plan The executive program committees utilize', 'AND CONTROL SYSTEMS DIGITAL ELECTRONICS AND ELECTRICAL MACHINES 4 408 4 408 4 408 B24 RAI ELECTIVE SUBJECTS For Regular Students For UoB 22 Program Students For Coop Study Aboard Students 12 CREDITS 12 CREDITS 9 CREDITS 01416601 01416602 01416604 01416607 01416608 01416609 01416610 01416611 01416612 01416613 01416614 01416615 01416616 01416617 01416618 01416619 01416620 01416621 01416522 3 236 3 306 3 306 3', 'Indicators Academic Year Indicator and Objective 1 At least 80 of the executive program committee of the program participate in the meeting for planning following and revising the operation of the program 2 Having the details of the program consistent with the national or international standard of qualification for the program 3 Having the course syllabus and details of each offered subject and planned']",'E' stands for Laboratory hours in the credit notation (L-E-S).,Laboratory hours.,1.0,1.0,0.09999999999,1.0
What does 'S' stand for in the credit notation (L-E-S)?,"['CREDITS LES XXXXXXX GENED ELECTIVE 3 306 01416315 INDUSTRIAL ELECTRONICS 3 306 0141XXXX RAI Elective mandatory subject 3 306 XXXXXXX FREE ELECTIVE 3 XXX 01416701 RAI ENGINEERING CAPSTONE DESIGN PREPARATION 3 095 TOTAL CREDITS 15 3rd YEAR 3rd SEMESTER SUMMER CODE 01006805 SUBJECT INDUSTRIAL INTERNSHIP TOTAL CREDITS CREDITS LES 0 0450 0 34 FOR REGULAR STUDENTS 4th YEAR 1st SEMESTER CODE SUBJECT CREDITS LES', '4th YEAR 1st SEMESTER CODE SUBJECT CREDITS LES XXXXXXX FREE ELECTIVE 3 XXX XXXXXXX GENED ELECTIVE 3 306 0141XXXX RAI Elective mandatory subject 3 306 0141XXXX RAI Elective subject 3 306 TOTAL CREDITS 12 4th YEAR 2nd SEMESTER CODE SUBJECT CREDITS LES 0141XXXX RAI Elective subject 3 306 0141XXXX RAI Elective subject 3 306 01416702 RAI ENGINEERING CAPSTONE DESIGN 3 095 TOTAL CREDITS 9 35 FOR COOPSTUDY ABROAD', '5th digit th th th 6 7 8 digit 01 41 00 6 means Faculty of Engineering means Robotics and AI program means shared courses means bachelor degree means Order of the subject 25 A GENERAL EDUCATION 30 CREDITS LECTURELABSELF STUDY A1 ENGLISH PROFICIENCY REQUIREMENT ESL 01416000 ACADEMIC LISTENING AND SPEAKING 01416001 ACADEMIC READING AND WRITING 01416003 INTERPRETATION AND ARGUMENTS 9 CREDITS 3 306 3 306 3 306', '3 095 TOTAL CREDITS 9 35 FOR COOPSTUDY ABROAD STUDENTS 4th YEAR 1st SEMESTER CODE 01006301 or 01006302 SUBJECT CREDITS LES COOPERATIVE EDUCATION or STUDY ABROAD 6 0450 or 6 6012 TOTAL CREDITS 6 4th YEAR 2nd SEMESTER CODE SUBJECT CREDITS LES XXXXXXX GENED ELECTIVE 3 306 XXXXXXX FREE ELECTIVE 3 XXX 0141XXXX RAI Elective subject 3 306 0141XXXX RAI Elective subject 3 306 01416702 RAI ENGINEERING CAPSTONE DESIGN', 'OF DATA SCIENCE AND DATA ANALYTIC GENED SCIENCE MATHEMATICS ELECTIVE 3 306 01416306 SAFTY AND STANDARDIZATION IN RAI 3 306 01416319 MANUFACTURING PROCESS 3 306 01006718 DISCRETE MATHEMATICS RAI Elective mandatory Subject 3 306 0141XXXX RAI Elective mandatory subject 3 306 0141XXXX RAI Elective subject 3 306 TOTAL CREDITS 18 3rd YEAR 2nd SEMESTER CODE SUBJECT CREDITS LES XXXXXXX GENED ELECTIVE 3 306 01416315', '3 306 01006723 GENERAL PHYSICS 1 3 306 01006724 GENERAL PHYSICS LABORATORY 1 1 032 01416309 ENGINEERING 3D DRAWING 3 225 XXXXXXX GENED ELECTIVE 3 306 01416000 ESL ACADEMIC LISTENING AND SPEAKING 3 306 TOTAL CREDITS 19 1st YEAR 2nd SEMESTER CODE SUBJECT CREDITS LES 01416320 INTRODUCTION TO ROBOTICS AND AI 3 306 01006803 ENGINEERING MECHANICS 3 306 01006711 ADVANCED CALCULUS 3 306 01006725 GENERAL PHYSICS 2 3', 'MATHEMATICS ELECTIVE 3 306 01416310 STRENGTH OF MATERIALS 3 306 01416308 KINEMATICS AND DYNAMICS 3 306 01416305 ARTIFICIAL INTELLIGENCE TECHNOLOGY 3 306 01416516 ROBOTICS LABORATORY 3 1 036 01416500 Computer vision RAI Elective mandatory Subject 3 306 XXXXXXX GENED ELECTIVE 3 306 TOTAL CREDITS 19 33 3rd YEAR 1st SEMESTER CODE SUBJECT CREDITS LES 01416801 MATHEMATICS OF DATA SCIENCE AND DATA ANALYTIC GENED', 'CALCULUS 3 306 01006725 GENERAL PHYSICS 2 3 306 01006726 GENERAL PHYSICS LABORATORY 2 1 032 01416318 MICROPROCESSOR AND INTERFACE 3 225 01416514 ROBOTICS LABORATORY 1 1 036 01416001 ESL ACADEMIC READING AND WRITING 3 306 TOTAL CREDITS 20 32 2nd YEAR 1st SEMESTER CODE SUBJECT CREDITS LES 01416312 ELECTRIC CIRCUIT AND ELECTRONICS 3 306 01416301 DIFFERENTIAL EQUATIONS AND MATRIX ALGEBRA 3 306 01416515 ROBOTICS', 'need 13 System Transfer of Credits in TwoSemester System Credits can be transferred upon the consent of executive program committee according to the Regulation of King Mongkuts Institute of Technology Ladkrabang regarding bachelor degree education year 2016 Appendix A and the Announcement of King Mongkuts Institute of Technology Ladkrabang regarding the crossinstitute registration of higher education', 'hours S Selfstudy hours This study plan shows courses with credits equivalent to 3 However students can register 4 credit courses as well The total number of credits in each subject category will be counted toward the graduation 31 1st YEAR 1st SEMESTER CODE SUBJECT CREDITS LES 01416316 COMPUTER PROGRAMMING FOR RAI 3 225 01006710 INTRODUCATION TO CALCULUS 3 306 01006723 GENERAL PHYSICS 1 3 306 01006724', '1 Name of the Program Name of the program Thai Name of the program English 2 Degree and Major Full name Thai Full name English Abbreviation Thai Abbreviation English Bachelor of Engineering in Robotics and Artificial Intelligence Engineering International Program Bachelor of Engineering Robotics and AI Engineering BEng Robotics and AI Engineering 3 Major Field None 4 Total Credits At least 131 credits 5', 'for Graduation 312 Curriculum Structure Minimum Credits 131 credits For UoB 22 Program Students Credits For Coop Study Aboard Students 30 30 A1 English Proficiency Requirement ESL 9 9 A2 Communication Humanity and Social Skills 15 15 A3 Math and Science 6 6 95 95 B1 Core Courses 20 20 B2 Major Compulsory Courses 75 75 B21 Fundamental Subjects 39 39 B22 Capstone Projects 6 6 B23 RAI Elective Mandatory', 'Scholarship 350000 550000 750000 800000 800000 21 Academic Year 2020 2021 2022 2023 2024 4 Facilities 135333 252000 392000 490000 536667 Facilities Utilities 135333 252000 392000 490000 536667 5 Capital 403600 171600 171600 838267 171600 Equipments Accreditation 1210800 514800 514800 2514800 514800 Total Expense 3962533 5158950 7170733 8619400 8172733 Enrollments 60 90 120 150 120 Estimated expenditure per', 'AND ARGUMENTS 9 CREDITS 3 306 3 306 3 306 A2 COMMUNICATION HUMANITY AND SOCIAL SKILLS 01006502 PROFESSIONAL ETHICS 01006503 INTRODUCTION TO PSYCHOLOGY 01006504 PHILOSOPHY OF SCIENCE 01006505 CREATIVE THINKING 01006506 CRITICAL THINKING 01006507 PERSONAL ECONOMICS 01006508 DIGITAL ECONOMY 01006509 ENGINEERING AND PUBLIC POLICY 01006510 INTRODUCTION TO ECONOMICS 01006511 THAI SOCIETY AND CULTURE 01006512', '01006304 COOPERATIVE EDUCATION STUDY ABROAD OVERSEA TRAINING 6 0450 6 6012 6 0450 C FREE ELECTIVES 6 CREDITS Students must complete at least 6 additional credits from any courses offered by the institution D RAI INTERNSHIP 01006805 0 CREDITS INDUSTRIAL INTERNSHIPS 314 Recommended Study Plan 0 0450 Credit Notation L E S L Lecture Learning hours E Laboratory hours S Selfstudy hours This study plan shows', '1606250 2191250 2431250 2431250 Administrative Staffs 544000 544000 725333 725333 725333 Professional Dev 596000 762667 962667 962667 962667 2 Operating Expense 916100 1272433 1977883 2371883 2545217 Subscriptions Consumables 583433 831433 1266217 1534217 1647550 Activities 332667 441000 711667 837667 897667 3 Scholarship 350000 550000 750000 800000 800000 Full Scholarship 350000 550000 750000 800000 800000', 'CHEMISTRY LABORATORY 01006729 INTRODUCTION TO OPERATIONS RESEARCH 01416801 MATHEMATICS OF DATA SCIENCE AND DATA ANALYTIC 6 CREDITS 3 306 3 306 3 306 3 306 1 032 3 306 3 306 26 01006713 01006714 01006701 MATHEMATICAL CRYPTOGRAPHY 4 408 MATHEMATICS FOR 3D GAME AND COMPUTER GRAPHICS 4 408 MATHEMATICS OF DATA SCIENCE 4 408 TRACK UNIVERSITY OF BIRMINGHAM 22 DUAL DEGREE PROGRAM Only students in UoB 22 Dual Degree', 's Institute of Technology Ladkrabang regarding bachelor degree education year 2016 Appendix A 210 Integrated MasterBachelor Program If a student is in the 2nd semester of their third year of study or has completed at least 81 credits with the overall GPA of at least 3 00 the student is guaranteed admission into the integrated master bachelor program in the department The student must also complete the', 'AND CONTROL SYSTEMS DIGITAL ELECTRONICS AND ELECTRICAL MACHINES 4 408 4 408 4 408 B24 RAI ELECTIVE SUBJECTS For Regular Students For UoB 22 Program Students For Coop Study Aboard Students 12 CREDITS 12 CREDITS 9 CREDITS 01416601 01416602 01416604 01416607 01416608 01416609 01416610 01416611 01416612 01416613 01416614 01416615 01416616 01416617 01416618 01416619 01416620 01416621 01416522 3 236 3 306 3 306 3', 'or Criteria for Grading Regulations or criteria for grading are in accordance with the Regulations of King Mongkut s Institute of Technology Ladkrabang regarding Bachelors Degree Education 2016 Appendix A 2 Verification of Learning Achievement 21 Verification of Learning Achievement before Graduation Program committee assigned a responsible figure for the verification of learning achievement according to']",'S' stands for Self-study hours in the credit notation (L-E-S).,Self-study hours.,1.0,1.0,0.11666666666083333,1.0
What is the required student attendance percentage for evaluation?,"['Evaluation of work assignment Evaluation from Academic references Evaluation from student attendance at least 80 according to the Regulation of King Mongkuts Institute of Technology Ladkrabang Informing class attention rules Discipline Evaluation from the punctuality of students such as work assignment and appointment Informing the rule for work assignment and appointment with an instructor with an', 'in each year Academic Year Program Achieving Standard According to the Quality Framework 2021 Achieving mandatory indicators no15 total indicators of 10 total indicators of 10 2022 total indicators of 10 2023 total indicators of 11 2024 total indicators of 12 2020 67 PART 8 EVALUATION AND IMPROVEMENT OF THE OPERATION OF THE PROGRAM 1 Assessment of the Effectiveness of the Teaching 11 Evaluation of Teaching', 'must schedule an appointment Office Hours for the student to consult 34 There is student complaints management system and the satisfaction rating of complaint management result are evaluated 64 4 Instructor 41 There is a system for accepting new Instructors by university regulations The English proficiency test is required according to the university criteria It is in line with the announcement of the', 'level of the final year students fresh graduates for the quality of the program is used to improve the program 12 The average satisfaction level of the stakeholders is used to improve the program 2020 2021 2022 2023 2024 Total indicators affecting the operation no15 for each year 5 5 5 5 5 Total indicators unit for each year 9 10 10 11 12 Evaluation Criteria The program achieving standards according to the', 'the Distribution of Program Standard Learning Outcomes to Course Level Specialized Course 49 PART5 CRITERIA FOR STUDENT EVALUATION59 1 Regulations or Criteria for Grading 59 2 Verification of Learning Achievement 59 3 Criteria for Graduation According to the Program 59 PART 6 DEVELOPMENT OF INSTRUCTORS 60 1 Preparation for New Instructors 60 2 Development of Knowledge and Skills for Instructors60 PART 7', 'and Estimated Graduation in 5 Years Academic Year Number of Students 1st year 2020 2021 2022 2023 2024 60 30 30 30 30 60 30 30 30 60 30 30 60 30 2nd year 3rd year 4th year Total 60 90 120 150 120 Estimated to Graduate 60 30 26 Planned Budget Academic Year 2020 2021 2022 2023 2024 1 Personnel 2157500 2912917 3879250 4119250 4119250 Teaching Personnel 1017500 1606250 2191250 2431250 2431250 Administrative', 'The program achieving standards according to the quality framework must pass the following criteria key performance indicators no 1 5 having the results of achieving objectives and having indicators that include the results of archiving objectives no less than 80 of the entire indicators by considering the number of mandatory indicators and total indicators in each year Academic Year Program Achieving', '60 90 120 150 120 Estimated expenditure per person for producing a scholar according to the program equals to an average of 194613 bahtpersonyear 27 Educational System Class room 28 Transfer of Credits Subjects and Cross Institute Registration of Higher Education if any Credits can be transferred upon the consent of executive program committee according to the Regulation of King Mongkuts Institute of', 'Indicators Academic Year Indicator and Objective 1 At least 80 of the executive program committee of the program participate in the meeting for planning following and revising the operation of the program 2 Having the details of the program consistent with the national or international standard of qualification for the program 3 Having the course syllabus and details of each offered subject and planned', 'a committee which consists of instructors in the program by arranging an examination in each semester 6 Additional Costs Students will be responsible for the additional costs apart from tuition fees for all subjects in the program 46 PART 4 LEARNING OUTCOME TEACHING STRATEGY AND EVALUATION 1 Development of Special Characteristics of Students Characteristics Engineering Quality RAI students will apply', 'aforementioned skills of instructors 2 Evaluation of the Program as a Whole Picture The executive program committees evaluate the program as a whole picture when the teaching ends in each academic year by collecting information from students and graduates employers and or stakeholders experts industrial advisory boards or external evaluators 3 Evaluation of the Operation According to the Details of the', 'Indicator and Objective 8 All new instructors if any participate in an orientation and receive advice for teaching management 9 Every permanent instructor receives academic and or professional development at least once a year 10 Supporting staffs if any receive academic and or professional development no less than 50 of the total number 11 The average satisfaction level of the final year students fresh', 'of the Operation According to the Details of the Program Having quality assurance system and provision of education according to the standard framework of qualification for higher education as well as ABET Accreditation by having key performance indicators and assessment criteria assigned by the Internal QA committee 4 Revision of the Evaluation and Improvement Plan The executive program committees utilize', 'verification of learning achievement according to the standard for every subject Instructors of the program are obligated to verify the learning achievement of students with the following roles Verify teaching learning procedure i e lesson plan evaluation exam test evaluation report evaluation and student behavior evaluation Verify the learning achievement according to the program objectives and outcomes', 'of Knowledge and Skills for Instructors60 PART 7 QUALITY ASSURANCE OF THE PROGRAM 61 1 Standardization 61 2 Graduate 61 3 Student 61 4 Instructor 62 5 Curriculum Teaching and Assessment of Learners62 6 Educational Resources 62 7 Key Performance Indicators 63 PART 8 EVALUATION AND IMPROVEMENT OF THE OPERATION OF THE PROGRAM 65 1 Assessment of the Effectiveness of the Teaching 65 2 Evaluation of the Program', 'for Graduation 312 Curriculum Structure Minimum Credits 131 credits For UoB 22 Program Students Credits For Coop Study Aboard Students 30 30 A1 English Proficiency Requirement ESL 9 9 A2 Communication Humanity and Social Skills 15 15 A3 Math and Science 6 6 95 95 B1 Core Courses 20 20 B2 Major Compulsory Courses 75 75 B21 Fundamental Subjects 39 39 B22 Capstone Projects 6 6 B23 RAI Elective Mandatory', 'Scholarship 350000 550000 750000 800000 800000 21 Academic Year 2020 2021 2022 2023 2024 4 Facilities 135333 252000 392000 490000 536667 Facilities Utilities 135333 252000 392000 490000 536667 5 Capital 403600 171600 171600 838267 171600 Equipments Accreditation 1210800 514800 514800 2514800 514800 Total Expense 3962533 5158950 7170733 8619400 8172733 Enrollments 60 90 120 150 120 Estimated expenditure per', 'diploma or a certificate of completion from their highschool education or equivalent study before their enrollment b Standardized test Students must obtain the standardized test scores as specified in the admission announcement c English Language Proficiency If prospective students are nonnative English speakers they must obtain the results of the Test of English as a Foreign Language TOEFL or the', 'the needs 2 The Faculty provides an annual budget for the provision of textbooks educational media audiovisual equipment durable articles computersetc 3 Procuring educational resources to satisfy the need as proper to each program Evaluation of sufficiency for durable articles equipment books and educational document by students and instructors 7 Key Performance Indicators Academic Year Indicator and', 'd Have tracking systems in place to monitor and evaluate students with academic behavioral and other problems e Have teaching assistant programs to aid students towards the specified learning outcomes f Have available scholarships for students with potential g Available student activities and clubs that promote personal development 20 25 Admission Plan and Estimated Graduation in 5 Years Academic Year']",The required student attendance percentage for evaluation is at least 80 according to the Regulation of King Mongkut's Institute of Technology Ladkrabang.,At least 80%.,1.0,0.8084560847235788,0.9999999999,1.0
How often is the curriculum updated?,"['for an academic position in the past 5 years 13 The curriculum is updated at least every 5 years by considering the opinions of new graduates alumni industrial advisory board employer and other stakeholders 2 Graduate 21 There is an assessment of the quality of graduates according to the framework of national qualifications as well as the ABET Accreditation 22 There is a survey of graduates who get a job or', 'Curriculum Teaching and Assessment of Learners 51 There is a process of designing updating curriculums and courses for advanced content to meet academicprofessional standards In line with the needs of the labor market and the National Economic and Social Development Plan 52 There is an integrated teaching and learning approach to research 53 Instructors are assigned in each course have the knowledge ability', 'days after the end of the academic year 6 Having verification of learning achievement at least 2 5 of the subjects open in each academic year 7 Having development revision of the education teaching strategies or evaluation of learning from the result of the assessment of operation reported in the SSR of the previous year 2020 2021 2022 2023 2024 66 Academic Year Indicator and Objective 8 All new instructors', 'in each year Academic Year Program Achieving Standard According to the Quality Framework 2021 Achieving mandatory indicators no15 total indicators of 10 total indicators of 10 2022 total indicators of 10 2023 total indicators of 11 2024 total indicators of 12 2020 67 PART 8 EVALUATION AND IMPROVEMENT OF THE OPERATION OF THE PROGRAM 1 Assessment of the Effectiveness of the Teaching 11 Evaluation of Teaching', 'other professions c Arranging for an exchange of instructors with both domestic and international institutes to increase the capability of instructors in both teaching and researching 63 PART 7 QUALITY ASSURANCE OF THE PROGRAM 1 Standardization The curriculum management is by the qualified and standardized program according to the qualification standard of higher education as well as the ABET Accreditation', '21st August 2020 This program has started on 1st semester of academic year 2018 August 20118 7 Readiness for Publication as Qualified and Standardized Program This program is ready for announcement as qualified and standard program according to the qualification standard of higher education in engineering in 2010 in 2022 as well as the ABET Accreditation in 2022 8 Possible Career Path after Graduation', 'Indicator and Objective 8 All new instructors if any participate in an orientation and receive advice for teaching management 9 Every permanent instructor receives academic and or professional development at least once a year 10 Supporting staffs if any receive academic and or professional development no less than 50 of the total number 11 The average satisfaction level of the final year students fresh', 'It is in line with the announcement of the Higher Education Commission on English Proficiency Standards of Faculty Members 42 There is a management system for promoting and developing teachers appropriate and consistent with the universitys vision and policy 43 There is a system of teacher quality development to have professors in the field of teaching 5 Curriculum Teaching and Assessment of Learners 51', 'the Distribution of Program Standard Learning Outcomes to Course Level Specialized Course 49 PART5 CRITERIA FOR STUDENT EVALUATION59 1 Regulations or Criteria for Grading 59 2 Verification of Learning Achievement 59 3 Criteria for Graduation According to the Program 59 PART 6 DEVELOPMENT OF INSTRUCTORS 60 1 Preparation for New Instructors 60 2 Development of Knowledge and Skills for Instructors60 PART 7', 'course to ensure that students are ready for their studies and to be able to complete theireducation for the duration of the program 32 The activities are organized to develop students knowledge abilities and potential in various ways to support 21stcentury learning skills 33 A consultant who is appointed for academic counseling and guidance to all students must schedule an appointment Office Hours for the', 'and details of each offered subject and planned activities if any at least before the opening of each semester for all subjects 4 Filing program review and report for the operation of each subject and field experience if any within 30 days after the end of the semester for all subjects 5 Filing report of the operation of the program according to SSRwithin 6 0 days after the end of the academic year 6 Having', 'through PBL ProblemProject Based Learning 5 The total number of Service Learning projects 6 The engineering graduates satisfaction rate regarding curriculum teachinglearning administration 1 Adopt New Staff Workshops to learn about existing educational systems 2 Education development and lecturer and faculty evaluation 1 The percentage of new lecturers trained 2 The percentage of lecturers trained 3', 'Institute of Technology Ladkrabang Regarding the Cross Institute Registration of Higher Education 87 C Course Description 92 D Curriculum Mapping for General Education Course 117 E Facilities Supported Teaching and Learning 121 F Reason for Requesting to Revise Curriculum 129 G List of Program Development Committees 137 H The Academic Publication of Instructors Responsible for The Program 139 4 BACHELOR OF', 'place during a summer period This course allows students to put into practice under conditions reflecting their future activities and responsibilities The work carried out under the responsibility of the firm involved is presented in a written report 124 APPENDIX D Curriculum Mapping for General Education Course 125 Curriculum Mapping General Education 01416000 Academic Listening and Speaking 01416001', 'by Ministry of Education MoE and Accreditation Board for Engineering and Technology ABET 2 The total number of courses where at least 50 percent or more of class time is carried out through active learning 3 The total number of courses with an integrated education system 4 The total number of courses where at least 50 percent or more of class time takes place through PBL ProblemProject Based Learning 5 The', 'of Knowledge and Skills for Instructors60 PART 7 QUALITY ASSURANCE OF THE PROGRAM 61 1 Standardization 61 2 Graduate 61 3 Student 61 4 Instructor 62 5 Curriculum Teaching and Assessment of Learners62 6 Educational Resources 62 7 Key Performance Indicators 63 PART 8 EVALUATION AND IMPROVEMENT OF THE OPERATION OF THE PROGRAM 65 1 Assessment of the Effectiveness of the Teaching 65 2 Evaluation of the Program', 'Meets in class for lecture or discussion for 1 hour per week or Contains at least 3 laboratory hours per week Most courses are given 3 or more credits For 4 credit courses these courses usually contain 3 hours of lecture or discussion per week The courses are also accompanied with 1 additional hour of recitation or 3 hours of laboratory work per week Students enrolled in the courses are also expected to', 'crossinstitute registration of higher education Appendix B 2 Management of the Program 21 DateTime of the Course 1st semester August December 2nd semester January May Summer course June July The actual start and end dates for each academic year will be announced by the office of the registrar 22 Qualification of Applicants The general admission process starts from October RAI classes will begin in August of', 'in each course have the knowledge ability and expertise in the course Moreoverthere is a system to monitor the preparation of learning plans and teaching and learning management 6 Educational Resources 61 Budget management a Surveying the need and sufficiency of educational resources b Instigating a plan for educational resources management c Allowing budget for durable articles equipment and learning', 'and Estimated Graduation in 5 Years Academic Year Number of Students 1st year 2020 2021 2022 2023 2024 60 30 30 30 30 60 30 30 30 60 30 30 60 30 2nd year 3rd year 4th year Total 60 90 120 150 120 Estimated to Graduate 60 30 26 Planned Budget Academic Year 2020 2021 2022 2023 2024 1 Personnel 2157500 2912917 3879250 4119250 4119250 Teaching Personnel 1017500 1606250 2191250 2431250 2431250 Administrative']",The curriculum is updated at least every 5 years.,Updated at least every 5 years.,1.0,1.0,0.9999999999,1.0
