user_input,retrieved_contexts,response,reference,faithfulness,answer_relevancy,context_precision,context_recall
What is the English name of the program?,"['Groups in the Program Open by Other FacultiesDepartments Programs General Education subjects Free electives 132 Subjects Subject Groups in the Program Open and Required to be Studied by Other FacultiesDepartmentsPrograms Free electives 133 Management The executive program committee is primarily responsible for the program are the representatives to coordinate with the faculty institution instructors and', 'Other FacultiesDepartments 10 PART 2 SPECIFIC INFORMATION OF THE PROGRAM 11 1 Philosophy Importance and Objectives of the Program 11 2 Development Plan 14 3 Student Outcomes16 PART 3 SYSTEM FOR EDUCATIONAL PROVISION MANAGEMENT AND STRUCTURE OF THE PROGRAM 18 1 System for Educational Provision 18 2 Management of the Program18 3 Curriculum and Instructors22 2 4 Component Regarding Field Experience Internship', '21st August 2020 This program has started on 1st semester of academic year 2018 August 20118 7 Readiness for Publication as Qualified and Standardized Program This program is ready for announcement as qualified and standard program according to the qualification standard of higher education in engineering in 2010 in 2022 as well as the ABET Accreditation in 2022 8 Possible Career Path after Graduation', 'Responsible for The Program 139 4 BACHELOR OF ENGINEERING PROGRAM IN ROBOTICS and ARTIFICIAL INTELLIGENCE ENGINEERING INTERNATIONAL PROGRAM Revised 2020 Name of Educational Institute King Mongkuts Institute of Technology Ladkrabang FacultyDepartment Faculty of Engineering School of International Multidisciplinary Engineering Programs PART 1 GENERAL INFORMATION 1 Name of the Program Name of the program Thai', 'or academic training programs knowledge of contemporary issues via and ability to use the techniques skills and modern engineering tools necessary for engineering practice via RAI senior capstone projects 18 PART 3 SYSTEM FOR EDUCATIONAL PROVISION MANAGEMENT AND STRUCTURE OF THE PROGRAM 1 System for Educational Provision 11 System An academic year has two semesters each of which covers not less than 15', 'design or cooperative education internship program for Robotics and AI Arranging for knowledge exchange activity in the program for both theory and practice between instructors and students as well as collaboration projects between institutes for internships Arranging for an education that promotes students selflearning Arranging for subjects that allow group works and assign a leader for each group as well', 'Indicators Academic Year Indicator and Objective 1 At least 80 of the executive program committee of the program participate in the meeting for planning following and revising the operation of the program 2 Having the details of the program consistent with the national or international standard of qualification for the program 3 Having the course syllabus and details of each offered subject and planned', '1 Name of the Program Name of the program Thai Name of the program English 2 Degree and Major Full name Thai Full name English Abbreviation Thai Abbreviation English Bachelor of Engineering in Robotics and Artificial Intelligence Engineering International Program Bachelor of Engineering Robotics and AI Engineering BEng Robotics and AI Engineering 3 Major Field None 4 Total Credits At least 131 credits 5', '01416628 01416629 01416630 01416631 01416632 01416633 01416634 01416635 01006006 IT PROJECT MANAGEMENT EXPERIENCE AND EXERCISE FOR INTELLIGENT CONTROL SYSTEM INFORMATION AND CYBER SECURITY INFORMATION SYSTEM SECURITY AND IT LAW ROBOTICS AND AI EXPERIENCE SPACE SCIENCE REINFORCEMENT LEARNING INTRODUCTION TO PROMPT ENGINERRING ADVANCED TECHNIQUES IN ChatGPT CUSTOMIZATION AND APPLICATION INDUSTRIAL EXPERIENCE', 'Given to the Graduates Bachelor of Engineering from King Mongkuts Institute of Technology Ladkrabang 6 Status of the Program and Consideration for the AuthorizationAgreement The program has been endorsed by the Academic Committee of KMITL in its meeting on 23 June 2020 62020 This program has been approved by the University Council in the 72020 meeting no 21st August 2020 This program has started on 1st', 'Plan The executive program committees utilize the results of analysis and revision to create an improvement plan for the program so that its quality archives the required standards and discuss with the instructor 94 APPENDIX C Course Description 95 COURSE DESCRIPTION 1 GENERAL EDUCATION 11 ENGLISH PROFICIENCY REQUIREMENT ESL 01416000 ACADEMIC LISTENING AND SPEAKING 3 306 PREREQUISITE NONE The course', 'of the Operation According to the Details of the Program Having quality assurance system and provision of education according to the standard framework of qualification for higher education as well as ABET Accreditation by having key performance indicators and assessment criteria assigned by the Internal QA committee 4 Revision of the Evaluation and Improvement Plan The executive program committees utilize', 'a faculty member who is regarded as the student s supervisor The student must report progress to the supervisor regularly Upon completion the student must prepare and deliver oral presentations describing the work from the program 01006302 STUDY ABROAD 6 6012 PREREQUISITE NONE This course is reserved for students who participate in the study abroad program Upon the completion of the program the students', '3 306 PREREQUISITE NONE This course bridges the gap between academic and production software engineering The course provides fastpaced introduction to key tools and techniques used in successful startups and largescale projects command line dotfiles text editor distributed version control debugging testing documentation reading code deployments Students will learn to build a command line application expose', 'aforementioned skills of instructors 2 Evaluation of the Program as a Whole Picture The executive program committees evaluate the program as a whole picture when the teaching ends in each academic year by collecting information from students and graduates employers and or stakeholders experts industrial advisory boards or external evaluators 3 Evaluation of the Operation According to the Details of the', 'program and retain their fulltime student status 41 Standard for Learning Outcome from Field Experience 411 Possessing the skills to solve problems related to Robotics and AI 412 To be able to work with others as a team with responsibility 413 To be able to lead the member of the team appropriately 414 To be able to Integrate their knowledge to business solutions that apply the appropriate technology and', 'course to ensure that students are ready for their studies and to be able to complete theireducation for the duration of the program 32 The activities are organized to develop students knowledge abilities and potential in various ways to support 21stcentury learning skills 33 A consultant who is appointed for academic counseling and guidance to all students must schedule an appointment Office Hours for the', 'in each course have the knowledge ability and expertise in the course Moreoverthere is a system to monitor the preparation of learning plans and teaching and learning management 6 Educational Resources 61 Budget management a Surveying the need and sufficiency of educational resources b Instigating a plan for educational resources management c Allowing budget for durable articles equipment and learning', 'or Development Needed to be Considered for the Planning of the Program 9 12 Effects from 111 and 112 on the Development of the Program and the Relation to the Mission of the Institute 9 13 Relation if any with Other Programs Open in the FacultyOther Departments of the Institute ie Subjects Open for the Service of Other FacultiesDepartments or to Be Studied with Other FacultiesDepartments 10 PART 2 SPECIFIC', 'of the Teaching 65 2 Evaluation of the Program as a Whole Picture 65 3 3 Evaluation of the Operation According to the Details of the Program 65 4 Revision of the Evaluation and Improvement Plan 65 Appendix A The Regulation of King Mongkut s Institute of Technology Ladkrabang Regarding Bachelor Degree Education Year 2016 67 B The Announcement King Mongkuts Institute of Technology Ladkrabang Regarding the']","The English name of the program is ""Bachelor of Engineering in Robotics and Artificial Intelligence Engineering International Program.""",Bachelor of Engineering Program in Robotics and AI Engineering (International Program).,1.0,0.9999999999999999,0.2499999999875,1.0
What is the abbreviation for the degree in English?,"['5th digit th th th 6 7 8 digit 01 41 00 6 means Faculty of Engineering means Robotics and AI program means shared courses means bachelor degree means Order of the subject 25 A GENERAL EDUCATION 30 CREDITS LECTURELABSELF STUDY A1 ENGLISH PROFICIENCY REQUIREMENT ESL 01416000 ACADEMIC LISTENING AND SPEAKING 01416001 ACADEMIC READING AND WRITING 01416003 INTERPRETATION AND ARGUMENTS 9 CREDITS 3 306 3 306 3 306', 'is in collaboration with many universities according to the memorandum of understanding MOU such as College of Engineering Carnegie Mellon University the University of South Florida Imperial College Chubu University Kumamoto University BK Birla Institute of Engineering and Technology National Formosa University and South Eastern Regional College etc 56 Degree Given to the Graduates Bachelor of Engineering', '1 Name of the Program Name of the program Thai Name of the program English 2 Degree and Major Full name Thai Full name English Abbreviation Thai Abbreviation English Bachelor of Engineering in Robotics and Artificial Intelligence Engineering International Program Bachelor of Engineering Robotics and AI Engineering BEng Robotics and AI Engineering 3 Major Field None 4 Total Credits At least 131 credits 5', 's Institute of Technology Ladkrabang regarding bachelor degree education year 2016 Appendix A 210 Integrated MasterBachelor Program If a student is in the 2nd semester of their third year of study or has completed at least 81 credits with the overall GPA of at least 3 00 the student is guaranteed admission into the integrated master bachelor program in the department The student must also complete the', 'Field None 4 Total Credits At least 131 credits 5 Type of the Program 51 Level 4Year Bachelor Program 52 Program Category Academic bachelors degree program Academic bachelors degree program Advanced academic bachelors degree program 5 53 Medium of Instruction English 54 Admission Thai andor Foreign students 55 Collaboration with Other Institutes The program is in collaboration with many universities', 'or Criteria for Grading Regulations or criteria for grading are in accordance with the Regulations of King Mongkut s Institute of Technology Ladkrabang regarding Bachelors Degree Education 2016 Appendix A 2 Verification of Learning Achievement 21 Verification of Learning Achievement before Graduation Program committee assigned a responsible figure for the verification of learning achievement according to', 'diploma or a certificate of completion from their highschool education or equivalent study before their enrollment b Standardized test Students must obtain the standardized test scores as specified in the admission announcement c English Language Proficiency If prospective students are nonnative English speakers they must obtain the results of the Test of English as a Foreign Language TOEFL or the', 'other professions c Arranging for an exchange of instructors with both domestic and international institutes to increase the capability of instructors in both teaching and researching 63 PART 7 QUALITY ASSURANCE OF THE PROGRAM 1 Standardization The curriculum management is by the qualified and standardized program according to the qualification standard of higher education as well as the ABET Accreditation', 'Institute of Technology Ladkrabang Regarding the Cross Institute Registration of Higher Education 87 C Course Description 92 D Curriculum Mapping for General Education Course 117 E Facilities Supported Teaching and Learning 121 F Reason for Requesting to Revise Curriculum 129 G List of Program Development Committees 137 H The Academic Publication of Instructors Responsible for The Program 139 4 BACHELOR OF', 'It is in line with the announcement of the Higher Education Commission on English Proficiency Standards of Faculty Members 42 There is a management system for promoting and developing teachers appropriate and consistent with the universitys vision and policy 43 There is a system of teacher quality development to have professors in the field of teaching 5 Curriculum Teaching and Assessment of Learners 51', 'of English as a Foreign Language TOEFL or the International English Language Testing System IELTS in addition to the other required standardized test scores Other types of the accepted score will be specified in the admission announcement 19 d Personal Statement Students must obtain their personal statements along with the application as specified in the admission announcement e Teacher Recommendation', 'B Eng in Robotics and AI program is a four year full time undergraduate program In order to graduate the students must complete at least 131 credits Students must achieve the required English proficiency level prior to the graduation and satisfy the graduation requirements The program is designed to drive innovations and entrepreneurship in robotics and AI technologyrelated areas Each semester will include', 'Surname ID Number Position and Qualification of Instructors Responsible for the Program Executive Program Committee NameSurname Academic Position ID Number Qualification Department University Year of Graduation Academic Achievements Dr Poom Konghuayrob DEng Electrical Engineering King Mongkuts Institute of Technology Ladkrabang 2017 MEng Electrical Engineering King Mongkuts Institute of Technology', '4th YEAR 1st SEMESTER CODE SUBJECT CREDITS LES XXXXXXX FREE ELECTIVE 3 XXX XXXXXXX GENED ELECTIVE 3 306 0141XXXX RAI Elective mandatory subject 3 306 0141XXXX RAI Elective subject 3 306 TOTAL CREDITS 12 4th YEAR 2nd SEMESTER CODE SUBJECT CREDITS LES 0141XXXX RAI Elective subject 3 306 0141XXXX RAI Elective subject 3 306 01416702 RAI ENGINEERING CAPSTONE DESIGN 3 095 TOTAL CREDITS 9 35 FOR COOPSTUDY ABROAD', 'OF DATA SCIENCE AND DATA ANALYTIC GENED SCIENCE MATHEMATICS ELECTIVE 3 306 01416306 SAFTY AND STANDARDIZATION IN RAI 3 306 01416319 MANUFACTURING PROCESS 3 306 01006718 DISCRETE MATHEMATICS RAI Elective mandatory Subject 3 306 0141XXXX RAI Elective mandatory subject 3 306 0141XXXX RAI Elective subject 3 306 TOTAL CREDITS 18 3rd YEAR 2nd SEMESTER CODE SUBJECT CREDITS LES XXXXXXX GENED ELECTIVE 3 306 01416315', 'of the Operation According to the Details of the Program Having quality assurance system and provision of education according to the standard framework of qualification for higher education as well as ABET Accreditation by having key performance indicators and assessment criteria assigned by the Internal QA committee 4 Revision of the Evaluation and Improvement Plan The executive program committees utilize', 'crossinstitute registration of higher education Appendix B 2 Management of the Program 21 DateTime of the Course 1st semester August December 2nd semester January May Summer course June July The actual start and end dates for each academic year will be announced by the office of the registrar 22 Qualification of Applicants The general admission process starts from October RAI classes will begin in August of', '3 095 TOTAL CREDITS 9 35 FOR COOPSTUDY ABROAD STUDENTS 4th YEAR 1st SEMESTER CODE 01006301 or 01006302 SUBJECT CREDITS LES COOPERATIVE EDUCATION or STUDY ABROAD 6 0450 or 6 6012 TOTAL CREDITS 6 4th YEAR 2nd SEMESTER CODE SUBJECT CREDITS LES XXXXXXX GENED ELECTIVE 3 306 XXXXXXX FREE ELECTIVE 3 XXX 0141XXXX RAI Elective subject 3 306 0141XXXX RAI Elective subject 3 306 01416702 RAI ENGINEERING CAPSTONE DESIGN', 'to the Regulation of King Mongkuts Institute of Technology Ladkrabang regarding bachelor degree education year 2016 Appendix A and the Announcement of King Mongkuts Institute of Technology Ladkrabang regarding the crossinstitute registration of higher education Appendix C 29 Registration The registration system is according to the Regulation of King Mongkut s Institute of Technology Ladkrabang regarding', 'ie informal speech linking consonant and vowel production rhythm and pitch This course will help participants improve their oral presentation skills through an intercultural scientifictechnological research project This course is designed to inspire students to realize the power of R D ie research and development in science and technology through studying distinguished entrepreneurs 13 MATH AND SCIENCE']",The abbreviation for the degree in English is BEng Robotics and AI Engineering.,B.Eng. (Robotics and AI Engineering).,1.0,1.0000000000000002,0.0,1.0
How many credits are required for graduation?,"['occupational or professional skill and life skills 3 Criteria for Graduation According to the Program Students must complete at least 131 credits to graduate with at least 30 credits from general education courses at least 95 credits from Robotics and AI concentration and at least 6 credits of free electives and English proficiency level prior to the graduation Students must also complete the internship', 'for Graduation 312 Curriculum Structure Minimum Credits 131 credits For UoB 22 Program Students Credits For Coop Study Aboard Students 30 30 A1 English Proficiency Requirement ESL 9 9 A2 Communication Humanity and Social Skills 15 15 A3 Math and Science 6 6 95 95 B1 Core Courses 20 20 B2 Major Compulsory Courses 75 75 B21 Fundamental Subjects 39 39 B22 Capstone Projects 6 6 B23 RAI Elective Mandatory', 'Field None 4 Total Credits At least 131 credits 5 Type of the Program 51 Level 4Year Bachelor Program 52 Program Category Academic bachelors degree program Academic bachelors degree program Advanced academic bachelors degree program 5 53 Medium of Instruction English 54 Admission Thai andor Foreign students 55 Collaboration with Other Institutes The program is in collaboration with many universities', 'hours S Selfstudy hours This study plan shows courses with credits equivalent to 3 However students can register 4 credit courses as well The total number of credits in each subject category will be counted toward the graduation 31 1st YEAR 1st SEMESTER CODE SUBJECT CREDITS LES 01416316 COMPUTER PROGRAMMING FOR RAI 3 225 01006710 INTRODUCATION TO CALCULUS 3 306 01006723 GENERAL PHYSICS 1 3 306 01006724', '3 095 TOTAL CREDITS 9 35 FOR COOPSTUDY ABROAD STUDENTS 4th YEAR 1st SEMESTER CODE 01006301 or 01006302 SUBJECT CREDITS LES COOPERATIVE EDUCATION or STUDY ABROAD 6 0450 or 6 6012 TOTAL CREDITS 6 4th YEAR 2nd SEMESTER CODE SUBJECT CREDITS LES XXXXXXX GENED ELECTIVE 3 306 XXXXXXX FREE ELECTIVE 3 XXX 0141XXXX RAI Elective subject 3 306 0141XXXX RAI Elective subject 3 306 01416702 RAI ENGINEERING CAPSTONE DESIGN', '4th YEAR 1st SEMESTER CODE SUBJECT CREDITS LES XXXXXXX FREE ELECTIVE 3 XXX XXXXXXX GENED ELECTIVE 3 306 0141XXXX RAI Elective mandatory subject 3 306 0141XXXX RAI Elective subject 3 306 TOTAL CREDITS 12 4th YEAR 2nd SEMESTER CODE SUBJECT CREDITS LES 0141XXXX RAI Elective subject 3 306 0141XXXX RAI Elective subject 3 306 01416702 RAI ENGINEERING CAPSTONE DESIGN 3 095 TOTAL CREDITS 9 35 FOR COOPSTUDY ABROAD', 'Capstone Projects 6 6 B23 RAI Elective Mandatory Subjects 18 15 B24 RAI Elective Subjects 12 9 B25 Alternative Study 6 C Free Electives 6 6 D Internship 0 0 131 131 Course Group A General Education B Robotics and AI Specific Courses TOTAL Credits For Regular Students 24 313 Subjects One academic credit is given to a course offered in a single semester which Meets in class for lecture or discussion for 1', 'CREDITS LES XXXXXXX GENED ELECTIVE 3 306 01416315 INDUSTRIAL ELECTRONICS 3 306 0141XXXX RAI Elective mandatory subject 3 306 XXXXXXX FREE ELECTIVE 3 XXX 01416701 RAI ENGINEERING CAPSTONE DESIGN PREPARATION 3 095 TOTAL CREDITS 15 3rd YEAR 3rd SEMESTER SUMMER CODE 01006805 SUBJECT INDUSTRIAL INTERNSHIP TOTAL CREDITS CREDITS LES 0 0450 0 34 FOR REGULAR STUDENTS 4th YEAR 1st SEMESTER CODE SUBJECT CREDITS LES', '60 90 120 150 120 Estimated expenditure per person for producing a scholar according to the program equals to an average of 194613 bahtpersonyear 27 Educational System Class room 28 Transfer of Credits Subjects and Cross Institute Registration of Higher Education if any Credits can be transferred upon the consent of executive program committee according to the Regulation of King Mongkuts Institute of', 'Meets in class for lecture or discussion for 1 hour per week or Contains at least 3 laboratory hours per week Most courses are given 3 or more credits For 4 credit courses these courses usually contain 3 hours of lecture or discussion per week The courses are also accompanied with 1 additional hour of recitation or 3 hours of laboratory work per week Students enrolled in the courses are also expected to', 'and Estimated Graduation in 5 Years Academic Year Number of Students 1st year 2020 2021 2022 2023 2024 60 30 30 30 30 60 30 30 30 60 30 30 60 30 2nd year 3rd year 4th year Total 60 90 120 150 120 Estimated to Graduate 60 30 26 Planned Budget Academic Year 2020 2021 2022 2023 2024 1 Personnel 2157500 2912917 3879250 4119250 4119250 Teaching Personnel 1017500 1606250 2191250 2431250 2431250 Administrative', '3 306 01416702 RAI ENGINEERING CAPSTONE DESIGN 3 095 TOTAL CREDITS 15 Total credits required for graduation at least 315 Details of Each Subject Course description Appendix C 131 credits 36 32 Name Surname ID Number Position and Qualification of Instructors 321 Executive Program Committees NameSurname Academic Position ID Number Assoc Prof Dr Pitikhate Sooraksa Electrical Engineering Assoc Prof Dr Chutimet', 's Institute of Technology Ladkrabang regarding bachelor degree education year 2016 Appendix A 210 Integrated MasterBachelor Program If a student is in the 2nd semester of their third year of study or has completed at least 81 credits with the overall GPA of at least 3 00 the student is guaranteed admission into the integrated master bachelor program in the department The student must also complete the', '01006304 COOPERATIVE EDUCATION STUDY ABROAD OVERSEA TRAINING 6 0450 6 6012 6 0450 C FREE ELECTIVES 6 CREDITS Students must complete at least 6 additional credits from any courses offered by the institution D RAI INTERNSHIP 01006805 0 CREDITS INDUSTRIAL INTERNSHIPS 314 Recommended Study Plan 0 0450 Credit Notation L E S L Lecture Learning hours E Laboratory hours S Selfstudy hours This study plan shows', 'education as well as the ABET Accreditation throughout the duration of administration of the program 11 Executive program committee there are no fewer than 5 persons who have either a direct qualification or a related field of study Their qualification is minimum as Master Degree or equivalent or academic positions no lower than Assistant Professor Moreover they have at least one academic results published', 'semesters each of which covers not less than 15 weeks excluding the examination weeks The summer semester is optional Most courses are offered on the main campus during the day Some courses or laboratory hours may be offered in the evening or weekend 12 Provision of Summer Course Summer courses will be offered based on instructors availability and students need 13 System Transfer of Credits in TwoSemester', 'need 13 System Transfer of Credits in TwoSemester System Credits can be transferred upon the consent of executive program committee according to the Regulation of King Mongkuts Institute of Technology Ladkrabang regarding bachelor degree education year 2016 Appendix A and the Announcement of King Mongkuts Institute of Technology Ladkrabang regarding the crossinstitute registration of higher education', '5th digit th th th 6 7 8 digit 01 41 00 6 means Faculty of Engineering means Robotics and AI program means shared courses means bachelor degree means Order of the subject 25 A GENERAL EDUCATION 30 CREDITS LECTURELABSELF STUDY A1 ENGLISH PROFICIENCY REQUIREMENT ESL 01416000 ACADEMIC LISTENING AND SPEAKING 01416001 ACADEMIC READING AND WRITING 01416003 INTERPRETATION AND ARGUMENTS 9 CREDITS 3 306 3 306 3 306', 'the Distribution of Program Standard Learning Outcomes to Course Level Specialized Course 49 PART5 CRITERIA FOR STUDENT EVALUATION59 1 Regulations or Criteria for Grading 59 2 Verification of Learning Achievement 59 3 Criteria for Graduation According to the Program 59 PART 6 DEVELOPMENT OF INSTRUCTORS 60 1 Preparation for New Instructors 60 2 Development of Knowledge and Skills for Instructors60 PART 7', 'the department The student must also complete the admission form through the meeting with their academic advisor for their master program If a student does not meet the GPA criteria of 300 he or she is eligible to hisher petition into the program during his or her fourth year with the permission of their academic advisor 22 3 Curriculum and Instructors The B Eng in Robotics and AI program is a four year']",At least 131 credits are required for graduation.,At least 131 credits.,1.0,0.9999999999999998,0.8928571428348213,1.0
