user_input,retrieved_contexts,response,reference,faithfulness,answer_relevancy,context_precision,context_recall
What national plan does the program align with?,"['Indicators Academic Year Indicator and Objective 1 At least 80 of the executive program committee of the program participate in the meeting for planning following and revising the operation of the program 2 Having the details of the program consistent with the national or international standard of qualification for the program 3 Having the course syllabus and details of each offered subject and planned', 'Plan The executive program committees utilize the results of analysis and revision to create an improvement plan for the program so that its quality archives the required standards and discuss with the instructor 94 APPENDIX C Course Description 95 COURSE DESCRIPTION 1 GENERAL EDUCATION 11 ENGLISH PROFICIENCY REQUIREMENT ESL 01416000 ACADEMIC LISTENING AND SPEAKING 3 306 PREREQUISITE NONE The course', 'or Development Needed to be Considered for the Planning of the Program 9 12 Effects from 111 and 112 on the Development of the Program and the Relation to the Mission of the Institute 9 13 Relation if any with Other Programs Open in the FacultyOther Departments of the Institute ie Subjects Open for the Service of Other FacultiesDepartments or to Be Studied with Other FacultiesDepartments 10 PART 2 SPECIFIC', '6 Status of the Program and Consideration for the AuthorizationAgreement 5 7 Readiness for Publicization as Qualified and Standardized Program 5 8 Possible Career Path after Graduation 5 9 Name Surname ID Number Position and Qualification of Instructors Responsible for the Program Executive Program Committee 6 10 Location of Study 9 11 External Situation or Development Needed to be Considered for the', 'Groups in the Program Open by Other FacultiesDepartments Programs General Education subjects Free electives 132 Subjects Subject Groups in the Program Open and Required to be Studied by Other FacultiesDepartmentsPrograms Free electives 133 Management The executive program committee is primarily responsible for the program are the representatives to coordinate with the faculty institution instructors and', 'level of the final year students fresh graduates for the quality of the program is used to improve the program 12 The average satisfaction level of the stakeholders is used to improve the program 2020 2021 2022 2023 2024 Total indicators affecting the operation no15 for each year 5 5 5 5 5 Total indicators unit for each year 9 10 10 11 12 Evaluation Criteria The program achieving standards according to the', 'for the Planning of the Program 111 Economic SituationDevelopment The planning of bachelors degree program in Robotics and AI Engineering has been operated according to National Economic and Social Development Plan 2017 2021 which emphasizes on the development of science technology research and innovation in order to reinforce the sustainable growth of the industrial part The program also serves Thailand 4', 'development plan 1 The arrangement of support agencies for engineering education and research and development 1 The total number of engineering education research 2 Budgetary and resource support for engineering projects education and research and development 16 3 Student Outcomes The program in Robotics and AI must have documented student outcomes that prepare graduates to attain the program educational', '21st August 2020 This program has started on 1st semester of academic year 2018 August 20118 7 Readiness for Publication as Qualified and Standardized Program This program is ready for announcement as qualified and standard program according to the qualification standard of higher education in engineering in 2010 in 2022 as well as the ABET Accreditation in 2022 8 Possible Career Path after Graduation', 'Other FacultiesDepartments 10 PART 2 SPECIFIC INFORMATION OF THE PROGRAM 11 1 Philosophy Importance and Objectives of the Program 11 2 Development Plan 14 3 Student Outcomes16 PART 3 SYSTEM FOR EDUCATIONAL PROVISION MANAGEMENT AND STRUCTURE OF THE PROGRAM 18 1 System for Educational Provision 18 2 Management of the Program18 3 Curriculum and Instructors22 2 4 Component Regarding Field Experience Internship', 'of the Operation According to the Details of the Program Having quality assurance system and provision of education according to the standard framework of qualification for higher education as well as ABET Accreditation by having key performance indicators and assessment criteria assigned by the Internal QA committee 4 Revision of the Evaluation and Improvement Plan The executive program committees utilize', 'aforementioned skills of instructors 2 Evaluation of the Program as a Whole Picture The executive program committees evaluate the program as a whole picture when the teaching ends in each academic year by collecting information from students and graduates employers and or stakeholders experts industrial advisory boards or external evaluators 3 Evaluation of the Operation According to the Details of the', 'in each year Academic Year Program Achieving Standard According to the Quality Framework 2021 Achieving mandatory indicators no15 total indicators of 10 total indicators of 10 2022 total indicators of 10 2023 total indicators of 11 2024 total indicators of 12 2020 67 PART 8 EVALUATION AND IMPROVEMENT OF THE OPERATION OF THE PROGRAM 1 Assessment of the Effectiveness of the Teaching 11 Evaluation of Teaching', 'and details of each offered subject and planned activities if any at least before the opening of each semester for all subjects 4 Filing program review and report for the operation of each subject and field experience if any within 30 days after the end of the semester for all subjects 5 Filing report of the operation of the program according to SSRwithin 6 0 days after the end of the academic year 6 Having', 'internships with an innovative company in public or private sectors including Cooperative Education participating in research projects with research labs or academic institutions or working toward the entrepreneurship with incubators The program committee will annually release the policies regarding the eligibility and the conditions required to complete the requirement Students who participate in an', 'education as well as the ABET Accreditation throughout the duration of administration of the program 11 Executive program committee there are no fewer than 5 persons who have either a direct qualification or a related field of study Their qualification is minimum as Master Degree or equivalent or academic positions no lower than Assistant Professor Moreover they have at least one academic results published', 'with the faculty institution instructors and other programs in order to assign the teaching strategies and contents along with the assessment of the program according to the key performance indicator to achieve the objectives of the program and to successfully produce innovative graduates The program committee will consult with members of the programs industrial advisory board The board will be able to', 'according to the program objectives and outcomes Report the verification of the learning achievement to the program committee Program committee takes theresponsible figure for the verification of learning achievement at the curriculum level with the following roles Verify employment status of graduates working directly in the field Have verification from the stakeholders Have verification from another', 'Curriculum Teaching and Assessment of Learners 51 There is a process of designing updating curriculums and courses for advanced content to meet academicprofessional standards In line with the needs of the labor market and the National Economic and Social Development Plan 52 There is an integrated teaching and learning approach to research 53 Instructors are assigned in each course have the knowledge ability', 'advisory board The board will be able to provide general guidelines industrialtrends and demands which will help to keep the content of the program relevant to the current state of the art in the industry 40 11 PART 2 SPECIFIC INFORMATION OF THE PROGRAM 1 Philosophy Importance and Objectives of the Program 11 Philosophy Our economy needs highly skilled engineers to support the growing worldwide digital']",The program aligns with the National Economic and Social Development Plan 2017-2021.,National Economic and Social Development Plan (2017-2021).,1.0,0.7683935203306153,0.12406015036973683,1.0
What is the mission of the Institute mentioned in the document?,"['for innovation 122 Relation to the Mission of the Institute The development of the Robotics and AI Engineering program is related to the strategic advancement of scholar production to create next generation scholars with capabilities and flexibility to adapt to the change in the economy society and culture It also directly reflects the mission of the Institute to be the Master of Innovation and the Corner', 'or Development Needed to be Considered for the Planning of the Program 9 12 Effects from 111 and 112 on the Development of the Program and the Relation to the Mission of the Institute 9 13 Relation if any with Other Programs Open in the FacultyOther Departments of the Institute ie Subjects Open for the Service of Other FacultiesDepartments or to Be Studied with Other FacultiesDepartments 10 PART 2 SPECIFIC', 'Other FacultiesDepartments 10 PART 2 SPECIFIC INFORMATION OF THE PROGRAM 11 1 Philosophy Importance and Objectives of the Program 11 2 Development Plan 14 3 Student Outcomes16 PART 3 SYSTEM FOR EDUCATIONAL PROVISION MANAGEMENT AND STRUCTURE OF THE PROGRAM 18 1 System for Educational Provision 18 2 Management of the Program18 3 Curriculum and Instructors22 2 4 Component Regarding Field Experience Internship', 'to be the Master of Innovation and the Corner Stone of Fundamental in the aspects of education research academic service and preservation of art and culture The program also serves the mission of Faculty of Engineering in producing scholars with academic excellence according to the needs of the country and society developing research to build up the body of knowledge for the development of the country', 'Indicators Academic Year Indicator and Objective 1 At least 80 of the executive program committee of the program participate in the meeting for planning following and revising the operation of the program 2 Having the details of the program consistent with the national or international standard of qualification for the program 3 Having the course syllabus and details of each offered subject and planned', 'Institute of Technology Ladkrabang Regarding the Cross Institute Registration of Higher Education 87 C Course Description 92 D Curriculum Mapping for General Education Course 117 E Facilities Supported Teaching and Learning 121 F Reason for Requesting to Revise Curriculum 129 G List of Program Development Committees 137 H The Academic Publication of Instructors Responsible for The Program 139 4 BACHELOR OF', 'internships with an innovative company in public or private sectors including Cooperative Education participating in research projects with research labs or academic institutions or working toward the entrepreneurship with incubators The program committee will annually release the policies regarding the eligibility and the conditions required to complete the requirement Students who participate in an', '6 Status of the Program and Consideration for the AuthorizationAgreement 5 7 Readiness for Publicization as Qualified and Standardized Program 5 8 Possible Career Path after Graduation 5 9 Name Surname ID Number Position and Qualification of Instructors Responsible for the Program Executive Program Committee 6 10 Location of Study 9 11 External Situation or Development Needed to be Considered for the', 'of the Operation According to the Details of the Program Having quality assurance system and provision of education according to the standard framework of qualification for higher education as well as ABET Accreditation by having key performance indicators and assessment criteria assigned by the Internal QA committee 4 Revision of the Evaluation and Improvement Plan The executive program committees utilize', '21st August 2020 This program has started on 1st semester of academic year 2018 August 20118 7 Readiness for Publication as Qualified and Standardized Program This program is ready for announcement as qualified and standard program according to the qualification standard of higher education in engineering in 2010 in 2022 as well as the ABET Accreditation in 2022 8 Possible Career Path after Graduation', 'Development of the Program and the Relation to the Mission of the Institute 121 Development of the Program The effects of external factors on the development of the Robotics and AI Engineering program Bachelor of Engineering call for the revision of the program so that it can support the needs according to enhancing and improving human capital as well as developing science technology research and innovation', 'is in collaboration with many universities according to the memorandum of understanding MOU such as College of Engineering Carnegie Mellon University the University of South Florida Imperial College Chubu University Kumamoto University BK Birla Institute of Engineering and Technology National Formosa University and South Eastern Regional College etc 56 Degree Given to the Graduates Bachelor of Engineering', 's Institute of Technology Ladkrabang regarding bachelor degree education year 2016 Appendix A 210 Integrated MasterBachelor Program If a student is in the 2nd semester of their third year of study or has completed at least 81 credits with the overall GPA of at least 3 00 the student is guaranteed admission into the integrated master bachelor program in the department The student must also complete the', 'Curriculum Teaching and Assessment of Learners 51 There is a process of designing updating curriculums and courses for advanced content to meet academicprofessional standards In line with the needs of the labor market and the National Economic and Social Development Plan 52 There is an integrated teaching and learning approach to research 53 Instructors are assigned in each course have the knowledge ability', 'Capstone Projects 6 6 B23 RAI Elective Mandatory Subjects 18 15 B24 RAI Elective Subjects 12 9 B25 Alternative Study 6 C Free Electives 6 6 D Internship 0 0 131 131 Course Group A General Education B Robotics and AI Specific Courses TOTAL Credits For Regular Students 24 313 Subjects One academic credit is given to a course offered in a single semester which Meets in class for lecture or discussion for 1', 'a faculty member who is regarded as the student s supervisor The student must report progress to the supervisor regularly Upon completion the student must prepare and deliver oral presentations describing the work from the program 01006302 STUDY ABROAD 6 6012 PREREQUISITE NONE This course is reserved for students who participate in the study abroad program Upon the completion of the program the students', 'crossinstitute registration of higher education Appendix B 2 Management of the Program 21 DateTime of the Course 1st semester August December 2nd semester January May Summer course June July The actual start and end dates for each academic year will be announced by the office of the registrar 22 Qualification of Applicants The general admission process starts from October RAI classes will begin in August of', 'of King Mongkut s Institute of Technology Ladkrabang to exploit knowledge for the sustainable development of the country and society 13 Relation if any with Other Programs Open in the FacultyOther Departments of the Institute ie Subjects Open for the Service of Other Faculties Departments or to Be Studied with Other FacultiesDepartments 131 SubjectsSubject Groups in the Program Open by Other', 'place during a summer period This course allows students to put into practice under conditions reflecting their future activities and responsibilities The work carried out under the responsibility of the firm involved is presented in a written report 124 APPENDIX D Curriculum Mapping for General Education Course 125 Curriculum Mapping General Education 01416000 Academic Listening and Speaking 01416001', 'Scholarship 350000 550000 750000 800000 800000 21 Academic Year 2020 2021 2022 2023 2024 4 Facilities 135333 252000 392000 490000 536667 Facilities Utilities 135333 252000 392000 490000 536667 5 Capital 403600 171600 171600 838267 171600 Equipments Accreditation 1210800 514800 514800 2514800 514800 Total Expense 3962533 5158950 7170733 8619400 8172733 Enrollments 60 90 120 150 120 Estimated expenditure per']","The mission of the Institute mentioned in the document is to be the Master of Innovation and the Corner Stone of Fundamental in the aspects of education, research, academic service, and preservation of art and culture.",Master of Innovation and the Corner Stone of Fundamental.,1.0,0.9999999999999999,0.7499999999625,1.0
What are the 21st-century skills the curriculum aims to cultivate?,"['Our graduates will learn new technologies methodologies and tools and adapt them to respond to the challenges of a changing environment 14 2 Development Plan Development Plan Enhance the quality of the curriculum and teachinglearning activities to that of international standards The development plan for engineering education active learning 21stcentury skillsets and characteristics streamlined to', 'Curriculum Teaching and Assessment of Learners 51 There is a process of designing updating curriculums and courses for advanced content to meet academicprofessional standards In line with the needs of the labor market and the National Economic and Social Development Plan 52 There is an integrated teaching and learning approach to research 53 Instructors are assigned in each course have the knowledge ability', 'and project based learning the students will learn the skills required for today s workforce We embrace the 21st century learning environment to cultivate the students creativity criticalthinking communication and collaboration skills Our students will be introduced to innovative mindsets able to work with multidisciplinary teams and be leaders in their field of study Our graduates will be lifelong learners', '4 an ability to function on multidisciplinary teams 6 an understanding of professional and ethical responsibility 5 Skills for Mathematical Calculation 7 an ability to communicate effectively Communication and Information 8 an ability to use the techniques skills and modern engineering tools necessary for engineering practice Technology Adeptness 50 3 Curriculum Mapping Illustrating the Distribution of', 'skillsets and characteristics streamlined to institutional engineering set Strategies EvidenceIndicator 1 Adjusting engineering to an Outcomebased curriculum by ABET guidelines for undergraduate graduate and doctoral degrees 2 Organize Student Centric teachinglearning environments to facilitate and maximize active learning 3 Facilitate authentic learning or work integrated teachinglearning environments 4', 'skills for success in careers and team environments The course will cover topics such as goal setting career Skills leadership skills teamwork effective communication and public speaking Learning methods will consist of hands on activities and projects group work lecture discussion reading writing and presenting 01006521 MEDITATION FOR LIFE DEVELOPMENT 3 306 PREREQUISITE NONE This course introduces theory', 'Mapping Illustrating the Distribution of Program Standard Learning Outcomes to Course Level Specialized Course Course Major Responsibility Minor Responsibility 1 Moral and ethics 2 Knowledge 3 Intellectual skills 4 Human relation skills and responsibility 5 Skills for mathematical calculation communication and information technology adeptness 1 Perceive the importance of values morals ethics selfsacrifice', 'to support the growing worldwide digital economy Modern engineering programs must recognize stateoftheart technologies and practices while inspiring students to generate innovations We want our graduate to be ready for the everchanging technological landscape The curriculum is designed to drive innovations By combining theoretical foundations with handson experience and project based learning the students', 'other professions c Arranging for an exchange of instructors with both domestic and international institutes to increase the capability of instructors in both teaching and researching 63 PART 7 QUALITY ASSURANCE OF THE PROGRAM 1 Standardization The curriculum management is by the qualified and standardized program according to the qualification standard of higher education as well as the ABET Accreditation', 'as to analyze and interpret data 5 an ability to identify formulate and solve engineering problems 9 a recognition of the need for and an ability to engage in lifelong learning 10 a knowledge of contemporary issues 11 an ability to use the techniques skills and modern engineering tools necessary for engineering practice 4 Human Relation Skills and Responsibility 4 an ability to function on multidisciplinary', 'and AI Students will learn to build innovation identify the opportunities propose ideas design and implement innovative solutions while being able to apply standards and realistic engineering constraints Students also further specialize in their areas of interest and prepare for the next step in their careers 23 31 Curriculum 311 Minimum Credits Required for Graduation 312 Curriculum Structure Minimum', 'for an academic position in the past 5 years 13 The curriculum is updated at least every 5 years by considering the opinions of new graduates alumni industrial advisory board employer and other stakeholders 2 Graduate 21 There is an assessment of the quality of graduates according to the framework of national qualifications as well as the ABET Accreditation 22 There is a survey of graduates who get a job or', 'or academic training programs knowledge of contemporary issues via and ability to use the techniques skills and modern engineering tools necessary for engineering practice via RAI senior capstone projects 18 PART 3 SYSTEM FOR EDUCATIONAL PROVISION MANAGEMENT AND STRUCTURE OF THE PROGRAM 1 System for Educational Provision 11 System An academic year has two semesters each of which covers not less than 15', 'It is in line with the announcement of the Higher Education Commission on English Proficiency Standards of Faculty Members 42 There is a management system for promoting and developing teachers appropriate and consistent with the universitys vision and policy 43 There is a system of teacher quality development to have professors in the field of teaching 5 Curriculum Teaching and Assessment of Learners 51', 'course to ensure that students are ready for their studies and to be able to complete theireducation for the duration of the program 32 The activities are organized to develop students knowledge abilities and potential in various ways to support 21stcentury learning skills 33 A consultant who is appointed for academic counseling and guidance to all students must schedule an appointment Office Hours for the', 'opportunity to gain valuable handson training and experience in real world situations Additionally through exposure to current practice students can reflect on and appreciate the linkage between curriculum and practice This is an advance to the Internship and Coop Education Students will develop specific skills both on engineering and professionals in actual working environment not less than 2 days a week', 'from student to student regarding culture social and academic upbringing all of which influences social bonding and communication effectiveness learning and selfdevelopment 24 Strategies for Solving the IssuesLimitation of the Students in 23 a Arrange an orientation day and counseling session for first year students to advise on available career paths best action plans in line with set objectives and time', 'marketplace advantage 12 c Leadership Our graduates will apply their technical and innovative leadership to establish successful careers in their business profession and community d Economic Impact Our graduates will apply their technical expertise leadership and innovative mindset to support and strengthen the societys economic wellbeing e Lifelong Learning Our graduates will learn new technologies', 'effectively 8 the broad education necessary to understand the impact of engineering solutions in a global economic environmental and societal context 9 a recognition of the need for and an ability to engage in lifelong learning 10 a knowledge of contemporary issues 11 an ability to use the techniques skills and modern engineering tools necessary for engineering practice The outcomes can be presented', '56 1 Moral and ethics 2 Knowledge 3 Intellectual skills 4 Human relation skills and responsibility 5 Skills for mathematical calculation communication and information technology adeptness Course 1 2 3 5 1 2 3 4 5 1 2 3 4 5 01416511 Mobile Robots 01416512 Planning Technique in Robotics 01416518 Industrial Automation 01416519 Modern Control 01416520 Vision System for Mobile Robotics 01416521 Introduction to']","The curriculum aims to cultivate the following 21st-century skills: creativity, critical thinking, communication, and collaboration skills.","Creativity, critical-thinking, communication, and collaboration.",1.0,0.8640402883829098,0.23333333332166667,1.0
