user_input,retrieved_contexts,response,reference,faithfulness,answer_relevancy,context_precision,context_recall
What is the English name of the program?,"['Table of Contents\nPART 1: GENERAL INFORMATION .................................................................................................................................... 4\n1. Name of the Program .................................................................................................................................................. 4', 'PART 1: GENERAL INFORMATION\n1. Name of the Program\nName of the program (Thai):\nName of the program (English):\n2. Degree and Major\nFull name (Thai):\nFull name (English):\nAbbreviation (Thai):\nAbbreviation (English):', '1. System for Educational Provision ...........................................................................................................................18\n2. Management of the Program...................................................................................................................................18', 'PART 2: SPECIFIC INFORMATION OF THE PROGRAM ..............................................................................................11\n1. Philosophy, Importance, and Objectives of the Program .................................................................................11', 'Indicator and Objective\n1. At least 80% of the executive program committee of the program\nparticipate in the meeting for planning, following and revising the\noperation of the program\n2. Having the details of the program consistent with the national or\ninternational standard of qualification for the program\n3. Having the course syllabus and details of each offered subject and', 'PART 3: SYSTEM FOR EDUCATIONAL PROVISION, MANAGEMENT, AND STRUCTURE OF THE\nPROGRAM .............................................................................................................................................................................18', 'PART 3: SYSTEM FOR EDUCATIONAL PROVISION, MANAGEMENT,\nAND STRUCTURE OF THE PROGRAM\n1. System for Educational Provision\n1.1 System\nAn academic year has two semesters, each of which covers not less than 15 weeks (excluding the\nexamination weeks). The summer semester is optional. Most courses are offered on the main campus', 'to coordinate with the faculty, institution, instructors and other programs in order to assign the teaching\nstrategies and contents along with the assessment of the program according to the key performance\nindicator to achieve the objectives of the program and to successfully produce innovative graduates.\nThe program committee will consult with members of the program’s industrial advisory board. The', '- The program has been endorsed by the Academic Committee of KMITL in its meeting on 23 June\n2020, 6/2020\n- This program has been approved by the University Council in the 7/2020 meeting no 21st August\n2020\n- This program has started on 1st semester of academic year 2018 (August, 20118)\n7. Readiness for Publication as Qualified and Standardized Program', '5.3 Medium of Instruction\nEnglish\n5.4 Admission\nThai and/or Foreign students\n5.5 Collaboration with Other Institutes\nThe program is in collaboration with many universities according to the memorandum of\nunderstanding (MOU) such as College of Engineering, Carnegie Mellon University, the University of South', 'in each academic year by collecting information from students and graduates, employers and/ or\nstakeholders, experts, industrial advisory boards or external evaluators.\n3. Evaluation of the Operation According to the Details of the Program\nHaving quality assurance system and provision of education according to the standard framework of', 'This program is ready for announcement as qualified and standard program according to the qualification\nstandard of higher education in engineering in 2010 in 2022, as well as the ABET Accreditation in 2022\n8. Possible Career Path after Graduation\n- Roboticist or Robotic Engineer\n- Startup Entrepreneur in High Tech\n- Software Engineer for Mechatronics and Machines\n- System Engineer\n- Machine Vision Engineer', 'PART 2: SPECIFIC INFORMATION OF THE PROGRAM\n1. Philosophy, Importance, and Objectives of the Program\n1.1 Philosophy\nOur economy needs highly skilled engineers to support the growing worldwide digital economy.\nModern engineering programs must recognize state-of-the-art technologies and practices while inspiring', ""97\ntranslating what is learned into strategies, materials, and interventions for use in students' own educational\nand professional settings.\n01006507"", 'where students can discuss and ask the recitation leader questions to clarify concepts, facts, or\nproblem sets from the lecture. The laboratory hours give students the opportunity to learn from\nhands-on experience using specialized equipment or software related to the course’s contents.\nMeaning of the Subject Codes\nSubject Codes are assigned with 8 digits as follows:\n1st, 2nd digit:\n3rd, 4th digit\n5th\ndigit', 'E. Facilities Supported Teaching and Learning…………………………………………………………………………..….……. 121\nF. Reason for Requesting to Revise Curriculum……………………………………..……………………........……..….……. 129\nG. List of Program Development Committees……………………………………………………………………………………… 137\nH. The Academic Publication of Instructors Responsible for The Program……………………………………….. 139', 'SUBJECT\n\nCREDITS (L-E-S)\n\n01416316\n\nCOMPUTER PROGRAMMING FOR RAI\n\n3 (2-2-5)\n\n01006710\n\nINTRODUCATION TO CALCULUS\n\n3 (3-0-6)\n\n01006723\n\nGENERAL PHYSICS 1\n\n3 (3-0-6)\n\n01006724\n\nGENERAL PHYSICS LABORATORY 1\n\n1 (0-3-2)\n\n01416309\n\nENGINEERING 3D DRAWING\n\n3 (2-2-5)\n\nXXXXXXX\n\n(GENED ELECTIVE)\n\n3 (3-0-6)\n\n01416000\n\n(ESL) ACADEMIC LISTENING AND SPEAKING\n\n3 (3-0-6)\n\nTOTAL CREDITS\n\n19\n\n1st YEAR 2nd SEMESTER\nCODE', 'regarded as the student’ s supervisor. The student must report progress to the supervisor regularly. Upon\ncompletion, the student must prepare and deliver oral presentations describing the work from the program.\n01006302', 'programs can extend their work from the alternative study programs. Each team of 1 to 4 students must\ndesign and implement a prototype of the proposed innovation. Measurements, simulations, and/ or\ncharacterization of the proposed solution is performed so as to demonstrate that the design objectives and', 'plan for the program so that its quality archives the required standards and discuss with the instructor.']","Sorry, My knowledge base does not contain the answer to this question.",Bachelor of Engineering Program in Robotics and AI Engineering (International Program).,0.0,0.0,0.0,0.0
What is the abbreviation for the degree in English?,"['01\n41\n00\n6\n\nmeans Faculty of Engineering\nmeans Robotics and AI program\nmeans shared courses\nmeans bachelor degree\nmeans Order of the subject\n\n\x0c25\n\nA. GENERAL EDUCATION\n\n30 CREDITS\n(LECTURE-LAB-SELF STUDY)\n\nA.1 ENGLISH PROFICIENCY REQUIREMENT (ESL)\n01416000\nACADEMIC LISTENING AND SPEAKING\n01416001\nACADEMIC READING AND WRITING\n01416003\nINTERPRETATION AND ARGUMENTS\n\n9 CREDITS\n3 (3-0-6)\n3 (3-0-6)\n3 (3-0-6)', 'PART 1: GENERAL INFORMATION\n1. Name of the Program\nName of the program (Thai):\nName of the program (English):\n2. Degree and Major\nFull name (Thai):\nFull name (English):\nAbbreviation (Thai):\nAbbreviation (English):', 'English proficiency level prior to the graduation. Students must also complete the internship requirement\nduring their courses of study. Also, graduation according to the program is accordance with the Regulations\nof King Mongkut’s Institute of Technology Ladkrabang regarding Bachelor Degree Education 2016 (Appendix\nA).', 'qualification or a related field of study. Their qualification is minimum as Master Degree or equivalent,\nor academic positions no lower than Assistant Professor. Moreover, they have at least one academic\nresults published by the criteria established for the academic position in the past 5 years.\n1.2 Course Instructor: they have direct or indirect qualification Minimum Master Degree or equivalent,', 'SUBJECT\n\nCREDITS (L-E-S)\n\nCOOPERATIVE EDUCATION\nor\nSTUDY ABROAD\n\n6 (0-45-0)\nor\n6 (6-0-12)\n\nTOTAL CREDITS\n\n6\n\n4th YEAR 2nd SEMESTER\nCODE\n\nSUBJECT\n\nCREDITS (L-E-S)\n\nXXXXXXX\n\n(GENED ELECTIVE)\n\n3 (3-0-6)\n\nXXXXXXX\n\n(FREE ELECTIVE)\n\n3 (X-X-X)\n\n0141XXXX\n\nRAI Elective subject\n\n3 (3-0-6)\n\n0141XXXX\n\nRAI Elective subject\n\n3 (3-0-6)\n\n01416702\n\nRAI ENGINEERING CAPSTONE DESIGN\n\n3 (0-9-5)\n\nTOTAL CREDITS\n\n15', 'Florida, Imperial College, Chubu University, Kumamoto University, BK Birla Institute of Engineering and\nTechnology, National Formosa University and South Eastern Regional College, etc.\n5.6 Degree Given to the Graduates\nBachelor of Engineering from King Mongkut’s Institute of Technology Ladkrabang\n6. Status of the Program and Consideration for the Authorization/Agreement', 'Academic Year', '6\n\n9. Name, Surname, ID Number, Position, and Qualification of Instructors Responsible for the Program (Executive Program Committee)\nName-Surname\n(Academic Position)\nID Number\n\nQualification (Department), University,\nYear of Graduation\n\nAcademic Achievements\n\nDr. Poom Konghuayrob', 'Ladkrabang regarding bachelor degree education year 2016 (Appendix A).\n2.10 Integrated Master/Bachelor Program\nIf a student is in the 2nd semester of their third year of study or has completed at least 81 credits,\nwith the overall GPA of at least 3. 00, the student is guaranteed admission into the integrated\nmaster/ bachelor program in the department. The student must also complete the admission form', '1. Bachelor of Engineering Program is designed to\nqualification standard of higher education by Ministry of\nEducation (MoE) and Accreditation Board for Engineering\nand Technology (ABET)\n2. The total number of courses where at least 50 percent\nor more of class time is carried out through active learning.\n3. The total number of courses with an integrated\neducation system.', 'หลักสู ต รวิศ วกรรมศาสตรบัณฑิ ต สาขาวิชาวิศ วกรรมหุ่นยนต์และ\nปัญญาประดิษฐ์ (หลักสูตรนานาชาติ)\nBachelor of Engineering in Robotics and Artificial Intelligence\nEngineering (International Program)\nวิศวกรรมศาสตรบัณฑิต (วิศวกรรมหุ่นยนต์และปัญญาประดิษฐ์)\nBachelor of Engineering (Robotics and AI Engineering)\nวศ.บ. (วิศวกรรมหุ่นยนต์และปัญญาประดิษฐ์)\nB.Eng. (Robotics and AI Engineering)', '0 (0-45-0)\n\nCredit Notation: (L - E - S)\n\nL = Lecture / Learning hours, E = Laboratory hours, S = Self-study hours\nThis study plan shows courses with credits equivalent to 3. However, students can register 4 credit courses\nas well. The total number of credits in each subject category will be counted toward the graduation.\n\n\x0c31\n\n1st YEAR 1st SEMESTER\nCODE\n\nSUBJECT\n\nCREDITS (L-E-S)\n\n01416316', '94\n\nAPPENDIX C\nCourse Description\n\n\x0c95\nCOURSE DESCRIPTION\n1. GENERAL EDUCATION\n1.1 ENGLISH PROFICIENCY REQUIREMENT (ESL)\n01416000', '5.3 Medium of Instruction\nEnglish\n5.4 Admission\nThai and/or Foreign students\n5.5 Collaboration with Other Institutes\nThe program is in collaboration with many universities according to the memorandum of\nunderstanding (MOU) such as College of Engineering, Carnegie Mellon University, the University of South', '3. Major Field\nNone\n4. Total Credits\nAt least 131 credits\n5. Type of the Program\n5.1 Level\n4-Year Bachelor Program\n5.2 Program Category\n\uf0fe Academic bachelor’s degree program\n\uf0fe Academic bachelor’s degree program\n\uf06f Advanced academic bachelor’s degree program\n\n\x0c5', 'Regulation of King Mongkut’s Institute of Technology Ladkrabang regarding bachelor degree education\nyear 2016 (Appendix A), and the Announcement of King Mongkut’s Institute of Technology Ladkrabang\nregarding the cross-institute registration of higher education (Appendix B).\n2. Management of the Program\n2.1 Date-Time of the Course\n1st semester:\nAugust – December\n2nd semester:\nJanuary – May', '0141XXXX\n\nRAI Elective subject\n\n3 (3-0-6)\n\nTOTAL CREDITS\n\n12\n\n4th YEAR 2nd SEMESTER\nCODE\n\nSUBJECT\n\nCREDITS (L-E-S)\n\n0141XXXX\n\nRAI Elective subject\n\n3 (3-0-6)\n\n0141XXXX\n\nRAI Elective subject\n\n3 (3-0-6)\n\n01416702\n\nRAI ENGINEERING CAPSTONE DESIGN\n\n3 (0-9-5)\n\nTOTAL CREDITS\n\n9\n\n\x0c35\n\nFOR CO-OP/STUDY ABROAD STUDENTS\n4th YEAR 1st SEMESTER\nCODE\n01006301\nor\n01006302\n\nSUBJECT\n\nCREDITS (L-E-S)', '0141XXXX\n\nRAI Elective subject\n\n3 (3-0-6)\n\nTOTAL CREDITS\n\n18\n\n3rd YEAR 2nd SEMESTER\nCODE\n\nSUBJECT\n\nCREDITS (L-E-S)\n\nXXXXXXX\n\n(GENED ELECTIVE)\n\n3 (3-0-6)\n\n01416315\n\nINDUSTRIAL ELECTRONICS\n\n3 (3-0-6)\n\n0141XXXX\n\nRAI Elective mandatory subject\n\n3 (3-0-6)\n\nXXXXXXX\n\n(FREE ELECTIVE)\n\n3 (X-X-X)\n\n01416701\n\nRAI ENGINEERING CAPSTONE DESIGN PREPARATION\n\n3 (0-9-5)\n\nTOTAL CREDITS\n\n15', 'Assoc. Prof. Dr. Chutimet Srinilta\n(Computer Engineering)\n\nQualification (Department), University,\nYear of Graduation\n\nAcademic Achievements', 'English Language Testing System (IELTS) in addition to the other required standardized test scores.\nOther types of the accepted score will be specified in the admission announcement.']",B.Eng. (Robotics and AI Engineering),B.Eng. (Robotics and AI Engineering).,1.0,0.442430373505952,0.0909090909,1.0
How many credits are required for graduation?,"['occupational or professional skill and life skills.\n3. Criteria for Graduation According to the Program\nStudents must complete at least 131 credits to graduate with at least 30 credits from general education\ncourses; at least 95 credits from Robotics and AI concentration and at least 6 credits of free electives and', '3 (0-9-5)\n\nTOTAL CREDITS\n\n15\n\nTotal credits required for graduation at least\n\n3.1.5 Details of Each Subject\nCourse description (Appendix C)\n\n131\n\ncredits\n\n\x0c36\n\n3.2 Name, Surname, ID Number, Position, and Qualification of Instructors\n3.2.1 Executive Program Committees\nName-Surname\n(Academic Position)\nID Number\nAssoc. Prof. Dr. Pitikhate Sooraksa\n(Electrical Engineering)', '23\n\n3.1 Curriculum\n3.1.1 Minimum Credits Required for Graduation\n3.1.2 Curriculum Structure (Minimum Credits)\n\n131\n\ncredits\n\n(For UoB 2+2 Program Students)\n\nCredits\n(For Co-op / Study\nAboard Students)\n\n30\n\n30\n\nA1. English Proficiency Requirement (ESL)\n\n9\n\n9\n\nA2. Communication, Humanity, and Social Skills\n\n15\n\n15\n\nA3. Math and Science\n\n6\n\n6\n\n95\n\n95\n\nB1. Core Courses\n\n20\n\n20\n\nB2. Major Compulsory Courses', '3. Major Field\nNone\n4. Total Credits\nAt least 131 credits\n5. Type of the Program\n5.1 Level\n4-Year Bachelor Program\n5.2 Program Category\n\uf0fe Academic bachelor’s degree program\n\uf0fe Academic bachelor’s degree program\n\uf06f Advanced academic bachelor’s degree program\n\n\x0c5', '0 (0-45-0)\n\nCredit Notation: (L - E - S)\n\nL = Lecture / Learning hours, E = Laboratory hours, S = Self-study hours\nThis study plan shows courses with credits equivalent to 3. However, students can register 4 credit courses\nas well. The total number of credits in each subject category will be counted toward the graduation.\n\n\x0c31\n\n1st YEAR 1st SEMESTER\nCODE\n\nSUBJECT\n\nCREDITS (L-E-S)\n\n01416316', 'SUBJECT\n\nCREDITS (L-E-S)\n\nCOOPERATIVE EDUCATION\nor\nSTUDY ABROAD\n\n6 (0-45-0)\nor\n6 (6-0-12)\n\nTOTAL CREDITS\n\n6\n\n4th YEAR 2nd SEMESTER\nCODE\n\nSUBJECT\n\nCREDITS (L-E-S)\n\nXXXXXXX\n\n(GENED ELECTIVE)\n\n3 (3-0-6)\n\nXXXXXXX\n\n(FREE ELECTIVE)\n\n3 (X-X-X)\n\n0141XXXX\n\nRAI Elective subject\n\n3 (3-0-6)\n\n0141XXXX\n\nRAI Elective subject\n\n3 (3-0-6)\n\n01416702\n\nRAI ENGINEERING CAPSTONE DESIGN\n\n3 (0-9-5)\n\nTOTAL CREDITS\n\n15', '6 CREDITS\n\n\x0c30\n\n01006301\n01006302\n01006304\n\nCOOPERATIVE EDUCATION\nSTUDY ABROAD\nOVERSEA TRAINING\n\n6 (0-45-0)\n6 (6-0-12)\n6 (0-45-0)\n\nC. FREE ELECTIVES\n\n6 CREDITS\n\nStudents must complete at least 6 additional credits from any courses offered by the\ninstitution.\nD. RAI INTERNSHIP\n01006805\n\n0 CREDITS\nINDUSTRIAL INTERNSHIPS\n\n3.1.4 Recommended Study Plan\n\n0 (0-45-0)\n\nCredit Notation: (L - E - S)', '3. Criteria for Graduation According to the Program ..............................................................................................59\nPART 6: DEVELOPMENT OF INSTRUCTORS ................................................................................................................60', '3.1.3 Subjects\nOne academic credit is given to a course offered in a single semester which\n- Meets in class for lecture or discussion for 1 hour per week; or\n- Contains at least 3 laboratory hours per week.\nMost courses are given 3 or more credits. For 4 credit courses, these courses usually contain 3\nhours of lecture or discussion per week. The courses are also accompanied with 1 additional hour', '3 (0-9-5)\n\nTOTAL CREDITS\n\n15\n\n3rd YEAR 3rd SEMESTER (SUMMER)\nCODE\n01006805\n\nSUBJECT\nINDUSTRIAL INTERNSHIP\nTOTAL CREDITS\n\nCREDITS (L-E-S)\n0 (0-45-0)\n0\n\n\x0c34\n\nFOR REGULAR STUDENTS\n4th YEAR 1st SEMESTER\nCODE\n\nSUBJECT\n\nCREDITS (L-E-S)\n\nXXXXXXX\n\n(FREE ELECTIVE)\n\n3 (X-X-X)\n\nXXXXXXX\n\n(GENED ELECTIVE)\n\n3 (3-0-6)\n\n0141XXXX\n\nRAI Elective mandatory subject\n\n3 (3-0-6)\n\n0141XXXX\n\nRAI Elective subject\n\n3 (3-0-6)', '20\n\n2.5 Admission Plan and Estimated Graduation in 5 Years\nAcademic Year\nNumber of Students\n1st year\n\n2020\n\n2021\n\n2022\n\n2023\n\n2024\n\n60\n\n30\n\n30\n\n30\n\n30\n\n60\n\n30\n\n30\n\n30\n\n60\n\n30\n\n30\n\n60\n\n30\n\n2nd year\n3rd year\n4th year\nTotal\n\n60\n\n90\n\n120\n\n150\n\n120\n\nEstimated to Graduate\n\n-\n\n-\n\n-\n\n60\n\n30\n\n2.6 Planned Budget\nAcademic Year\n2020\n\n2021\n\n2022\n\n2023\n\n2024\n\n1. Personnel\n\n2,157,500\n\n2,912,917\n\n3,879,250\n\n4,119,250', 'Ladkrabang regarding bachelor degree education year 2016 (Appendix A).\n2.10 Integrated Master/Bachelor Program\nIf a student is in the 2nd semester of their third year of study or has completed at least 81 credits,\nwith the overall GPA of at least 3. 00, the student is guaranteed admission into the integrated\nmaster/ bachelor program in the department. The student must also complete the admission form', '0141XXXX\n\nRAI Elective subject\n\n3 (3-0-6)\n\nTOTAL CREDITS\n\n12\n\n4th YEAR 2nd SEMESTER\nCODE\n\nSUBJECT\n\nCREDITS (L-E-S)\n\n0141XXXX\n\nRAI Elective subject\n\n3 (3-0-6)\n\n0141XXXX\n\nRAI Elective subject\n\n3 (3-0-6)\n\n01416702\n\nRAI ENGINEERING CAPSTONE DESIGN\n\n3 (0-9-5)\n\nTOTAL CREDITS\n\n9\n\n\x0c35\n\nFOR CO-OP/STUDY ABROAD STUDENTS\n4th YEAR 1st SEMESTER\nCODE\n01006301\nor\n01006302\n\nSUBJECT\n\nCREDITS (L-E-S)', '0141XXXX\n\nRAI Elective subject\n\n3 (3-0-6)\n\nTOTAL CREDITS\n\n18\n\n3rd YEAR 2nd SEMESTER\nCODE\n\nSUBJECT\n\nCREDITS (L-E-S)\n\nXXXXXXX\n\n(GENED ELECTIVE)\n\n3 (3-0-6)\n\n01416315\n\nINDUSTRIAL ELECTRONICS\n\n3 (3-0-6)\n\n0141XXXX\n\nRAI Elective mandatory subject\n\n3 (3-0-6)\n\nXXXXXXX\n\n(FREE ELECTIVE)\n\n3 (X-X-X)\n\n01416701\n\nRAI ENGINEERING CAPSTONE DESIGN PREPARATION\n\n3 (0-9-5)\n\nTOTAL CREDITS\n\n15', '20\n\n20\n\nB2. Major Compulsory Courses\n\n75\n\n75\n\nB2.1 Fundamental Subjects\n\n39\n\n39\n\nB2.2 Capstone Projects\n\n6\n\n6\n\nB2.3 RAI Elective Mandatory Subjects\n\n18\n\n15\n\nB2.4 RAI Elective Subjects\n\n12\n\n9\n\nB2.5 Alternative Study\n\n-\n\n6\n\nC. Free Electives\n\n6\n\n6\n\nD. Internship\n\n0\n\n0\n\n131\n\n131\n\nCourse Group\nA. General Education\n\nB. Robotics and AI Specific Courses\n\nTOTAL\n\nCredits\n(For Regular Students)\n\n\x0c24', 'a. Complete high-school education or equivalent study record. Students must also provide\nthe latest official transcript for their highest level of education. Students must provide the proof of\ncompletion (an official diploma or a certificate of completion) from their high-school education or\nequivalent study before their enrollment.', '5.3 Time Period\nThe 4th academic year.\n5.4 Credits\n6 Credits\n5.5 Preparation\nThe proposal must be proposed with the approval of the program committee.\n5.6 Evaluation Process\nAn evaluation is provided by a committee, which consists of instructors in the program by arranging\nan examination in each semester.\n6. Additional Costs', '01\n41\n00\n6\n\nmeans Faculty of Engineering\nmeans Robotics and AI program\nmeans shared courses\nmeans bachelor degree\nmeans Order of the subject\n\n\x0c25\n\nA. GENERAL EDUCATION\n\n30 CREDITS\n(LECTURE-LAB-SELF STUDY)\n\nA.1 ENGLISH PROFICIENCY REQUIREMENT (ESL)\n01416000\nACADEMIC LISTENING AND SPEAKING\n01416001\nACADEMIC READING AND WRITING\n01416003\nINTERPRETATION AND ARGUMENTS\n\n9 CREDITS\n3 (3-0-6)\n3 (3-0-6)\n3 (3-0-6)', 'English proficiency level prior to the graduation. Students must also complete the internship requirement\nduring their courses of study. Also, graduation according to the program is accordance with the Regulations\nof King Mongkut’s Institute of Technology Ladkrabang regarding Bachelor Degree Education 2016 (Appendix\nA).', '3. Curriculum and Instructors\nThe B. Eng. in Robotics and AI program is a four- year full- time undergraduate program. In order to\ngraduate, the students must complete at least 131 credits. Students must achieve the required English\nproficiency level prior to the graduation and satisfy the graduation requirements. The program is designed']",At least 131 credits are required for graduation.,At least 131 credits.,1.0,0.9999999999999998,0.7722222222093518,1.0
What is the medium of instruction?,"['3. Curriculum and Instructors.......................................................................................................................................22', 'plan for the program so that its quality archives the required standards and discuss with the instructor.', 'of recitation or 3 hours of laboratory work per week. Students enrolled in the courses are also\nexpected to spend at least 8 hours outside the class/ lab for studying and completing the\ncoursework.\nThe instructor-led lecture could be delivered as a traditional lecture or include learning\nactivities in which the students can actively participate. The recitation is a compliment to a lecture', 'where students can discuss and ask the recitation leader questions to clarify concepts, facts, or\nproblem sets from the lecture. The laboratory hours give students the opportunity to learn from\nhands-on experience using specialized equipment or software related to the course’s contents.\nMeaning of the Subject Codes\nSubject Codes are assigned with 8 digits as follows:\n1st, 2nd digit:\n3rd, 4th digit\n5th\ndigit', ""97\ntranslating what is learned into strategies, materials, and interventions for use in students' own educational\nand professional settings.\n01006507"", 'such as stress, intonation, reductions (i.e., informal speech), linking, consonant and vowel production,\nrhythm, and pitch. This course will help participants improve their oral presentation skills through an\nintercultural scientific/technological research project. This course is designed to inspire students to realize', '4. Instructor ......................................................................................................................................................................62\n5. Curriculum, Teaching, and Assessment of Learners...........................................................................................62', '50\n3. Curriculum Mapping Illustrating the Distribution of Program Standard Learning Outcomes to Course Level Specialized Course\n\uf098\n\nCourse\n\nMajor Responsibility\n\n\uf081\n\nMinor Responsibility\n\n1. Moral and ethics\n\n2. Knowledge\n\n3. Intellectual skills\n\n4. Human relation skills\nand responsibility\n\n5. Skills for mathematical\ncalculation,\ncommunication and\ninformation technology\nadeptness', '6. Additional Costs..........................................................................................................................................................44\nPART 4: LEARNING OUTCOME, TEACHING STRATEGY, AND EVALUATION.......................................................45', 'practice includes writing of simple and compound sentences, using compound tenses and correct word\nforms, word order, spelling, and punctuation. Students will also develop the ability to write varied, complex\nsentences and effective paragraphs in standard written English.\n01006003', 'evaluate information for use in\nsolving problems creatively.', '94\n\nAPPENDIX C\nCourse Description\n\n\x0c95\nCOURSE DESCRIPTION\n1. GENERAL EDUCATION\n1.1 ENGLISH PROFICIENCY REQUIREMENT (ESL)\n01416000', '5.3 Medium of Instruction\nEnglish\n5.4 Admission\nThai and/or Foreign students\n5.5 Collaboration with Other Institutes\nThe program is in collaboration with many universities according to the memorandum of\nunderstanding (MOU) such as College of Engineering, Carnegie Mellon University, the University of South', '2.1 Development of Skills for Teaching and Education, Assessment, and Evaluation\na. Arranging an academic meeting regarding teaching and education, assessment and evaluation.\nb. Supporting instructors to participate in academic conferences, lectures, and seminars regarding\nteaching and education, assessment and evaluation', 'to coordinate with the faculty, institution, instructors and other programs in order to assign the teaching\nstrategies and contents along with the assessment of the program according to the key performance\nindicator to achieve the objectives of the program and to successfully produce innovative graduates.\nThe program committee will consult with members of the program’s industrial advisory board. The', 'ACADEMIC READING AND WRITING\n3 (3-0-6)\nPREREQUISITE: NONE\nThis course is designed to improve the reading and writing skills of ESL students. Students\nreceive practice on reading and vocabulary development. Reading practice will emphasize paraphrasing,\nsummarizing, and the simple analysis of texts to identify main ideas and distinguish fact from opinion. Writing', 'such as communication, presentation, and storytelling with data, will be fostered. Students will acquire a', '\uf0b7\n\uf0b7\n\uf0b7\n\uf0b7\n\uf0b7\n\n\uf0b7\n\uf0b7\n\uf0b7\n\uf0b7\n\uf0b7\n\n\uf0b7\n\uf0b7\n\uf0b7\n\uf0b7\n\uf0b7\n\n\uf0b7\n\uf0b7\n\uf0b7\n\uf0b7\n\uf0b7\n\n\uf0b7\n\uf0b7\n\uf0b7\n\uf0b7\n\uf0b7\n\n\uf0b7\n\uf0b7\n\uf0b7\n\uf0b7\n\uf0b7\n\n\uf0b7\n\uf0b7\n\uf0b7\n\uf0b7\n\uf0b7\n\n\uf0b7\n\uf0b7\n\uf0b7\n\uf0b7\n\uf0b7\n\n\uf0b7\n\uf0b7\n\uf0b7\n\uf0b7\n\uf0b7\n\n\uf0b7\n\uf0b7\n\uf0b7\n\uf0b7\n\uf0b7\n\n\x0c56\n1. Moral and ethics\n\n2. Knowledge\n\n3. Intellectual skills\n\n4. Human relation\nskills and\nresponsibility\n\n5. Skills for\nmathematical\ncalculation,\ncommunication and\ninformation\ntechnology\nadeptness\n\nCourse\n\n1\n\n2\n\n3\n\n5\n\n1\n\n2\n\n3\n\n4\n\n5\n\n1\n\n2\n\n3\n\n4\n\n5', 'ACADEMIC LISTENING AND SPEAKING\n3 (3-0-6)\nPREREQUISITE: NONE\nThe course provides ESL students guidance and extensive practice in listening and speaking\nin academic and professional settings. Listening focuses on understanding spoken English in formats such\nas college lectures and news broadcasts. Note- taking tasks are also included to reinforce aural', '4\n\n5\n\n1\n\uf0b7\n\n\uf0b7\n\uf0b7\n\uf0b7\n\uf0b7\n\uf0b7\n\uf0b7\n\uf0b7\n\n\uf0b7\n\uf0b7\n\uf0b7\n\uf0b7\n\uf0b7\n\uf0b7\n\uf0b7\n\uf0b7\n\uf0b7\n\n2\n\n\uf0b7 \uf0b7 \uf0b7\n\n\uf0b7 \uf0b7 \uf0b7\n\n\uf0b7 \uf0b7 \uf0b7\n\uf0b7 \uf0b7\n\n\uf0b7 \uf0b7 \uf0b7 \uf0b7 \uf0b7 \uf0b7 \uf0b7 \uf0b7 \uf0b7 \uf0b7 \uf0b7 \uf0b7 \uf0b7 \uf0b7 \uf0b7\n\uf0b7 \uf0b7 \uf0b7 \uf0b7 \uf0b7 \uf0b7 \uf0b7 \uf0b7 \uf0b7 \uf0b7\n\uf0b7\n\n5\n\n\uf0b7\n\n\uf0b7 \uf0b7 \uf0b7\n\uf0b7\n\uf0b7 \uf0b7 \uf0b7 \uf0b7 \uf0b7\n\n\x0c58\n1. Moral and ethics\n\n2. Knowledge\n\n3. Intellectual skills\n\n4. Human relation\nskills and\nresponsibility\n\n5. Skills for\nmathematical\ncalculation,\ncommunication and\ninformation\ntechnology\nadeptness\n\nCourse']",The medium of instruction is English.,English.,1.0,1.0,0.09109311740435222,1.0
Which institute gives the degree to graduates?,"['between institutes for internships', 'Florida, Imperial College, Chubu University, Kumamoto University, BK Birla Institute of Engineering and\nTechnology, National Formosa University and South Eastern Regional College, etc.\n5.6 Degree Given to the Graduates\nBachelor of Engineering from King Mongkut’s Institute of Technology Ladkrabang\n6. Status of the Program and Consideration for the Authorization/Agreement', 'Ladkrabang regarding bachelor degree education year 2016 (Appendix A).\n2.10 Integrated Master/Bachelor Program\nIf a student is in the 2nd semester of their third year of study or has completed at least 81 credits,\nwith the overall GPA of at least 3. 00, the student is guaranteed admission into the integrated\nmaster/ bachelor program in the department. The student must also complete the admission form', 'SUBJECT\n\nCREDITS (L-E-S)\n\nCOOPERATIVE EDUCATION\nor\nSTUDY ABROAD\n\n6 (0-45-0)\nor\n6 (6-0-12)\n\nTOTAL CREDITS\n\n6\n\n4th YEAR 2nd SEMESTER\nCODE\n\nSUBJECT\n\nCREDITS (L-E-S)\n\nXXXXXXX\n\n(GENED ELECTIVE)\n\n3 (3-0-6)\n\nXXXXXXX\n\n(FREE ELECTIVE)\n\n3 (X-X-X)\n\n0141XXXX\n\nRAI Elective subject\n\n3 (3-0-6)\n\n0141XXXX\n\nRAI Elective subject\n\n3 (3-0-6)\n\n01416702\n\nRAI ENGINEERING CAPSTONE DESIGN\n\n3 (0-9-5)\n\nTOTAL CREDITS\n\n15', 'English proficiency level prior to the graduation. Students must also complete the internship requirement\nduring their courses of study. Also, graduation according to the program is accordance with the Regulations\nof King Mongkut’s Institute of Technology Ladkrabang regarding Bachelor Degree Education 2016 (Appendix\nA).', 'to adapt to the change in the economy, society, and culture. It also directly reflects the mission of the\nInstitute to be the “ Master of Innovation and the Corner Stone of Fundamental,” in the aspects of\neducation, research, academic service and preservation of art and culture. The program also serves the\nmission of Faculty of Engineering in producing scholars with academic excellence according to the', '3. Major Field\nNone\n4. Total Credits\nAt least 131 credits\n5. Type of the Program\n5.1 Level\n4-Year Bachelor Program\n5.2 Program Category\n\uf0fe Academic bachelor’s degree program\n\uf0fe Academic bachelor’s degree program\n\uf06f Advanced academic bachelor’s degree program\n\n\x0c5', '6 CREDITS\n\n\x0c30\n\n01006301\n01006302\n01006304\n\nCOOPERATIVE EDUCATION\nSTUDY ABROAD\nOVERSEA TRAINING\n\n6 (0-45-0)\n6 (6-0-12)\n6 (0-45-0)\n\nC. FREE ELECTIVES\n\n6 CREDITS\n\nStudents must complete at least 6 additional credits from any courses offered by the\ninstitution.\nD. RAI INTERNSHIP\n01006805\n\n0 CREDITS\nINDUSTRIAL INTERNSHIPS\n\n3.1.4 Recommended Study Plan\n\n0 (0-45-0)\n\nCredit Notation: (L - E - S)', '1. Bachelor of Engineering Program is designed to\nqualification standard of higher education by Ministry of\nEducation (MoE) and Accreditation Board for Engineering\nand Technology (ABET)\n2. The total number of courses where at least 50 percent\nor more of class time is carried out through active learning.\n3. The total number of courses with an integrated\neducation system.', 'occupational or professional skill and life skills.\n3. Criteria for Graduation According to the Program\nStudents must complete at least 131 credits to graduate with at least 30 credits from general education\ncourses; at least 95 credits from Robotics and AI concentration and at least 6 credits of free electives and', '3 (0-9-5)\n\nTOTAL CREDITS\n\n15\n\nTotal credits required for graduation at least\n\n3.1.5 Details of Each Subject\nCourse description (Appendix C)\n\n131\n\ncredits\n\n\x0c36\n\n3.2 Name, Surname, ID Number, Position, and Qualification of Instructors\n3.2.1 Executive Program Committees\nName-Surname\n(Academic Position)\nID Number\nAssoc. Prof. Dr. Pitikhate Sooraksa\n(Electrical Engineering)', '01\n41\n00\n6\n\nmeans Faculty of Engineering\nmeans Robotics and AI program\nmeans shared courses\nmeans bachelor degree\nmeans Order of the subject\n\n\x0c25\n\nA. GENERAL EDUCATION\n\n30 CREDITS\n(LECTURE-LAB-SELF STUDY)\n\nA.1 ENGLISH PROFICIENCY REQUIREMENT (ESL)\n01416000\nACADEMIC LISTENING AND SPEAKING\n01416001\nACADEMIC READING AND WRITING\n01416003\nINTERPRETATION AND ARGUMENTS\n\n9 CREDITS\n3 (3-0-6)\n3 (3-0-6)\n3 (3-0-6)', '4\n\nBACHELOR OF ENGINEERING PROGRAM\nIN ROBOTICS and ARTIFICIAL INTELLIGENCE ENGINEERING\n(INTERNATIONAL PROGRAM)\n(Revised 2020)\nName of Educational Institute: King Mongkut’s Institute of Technology Ladkrabang\nFaculty/Department:\nFaculty of Engineering, School of International &\nMultidisciplinary Engineering Programs', 'qualification or a related field of study. Their qualification is minimum as Master Degree or equivalent,\nor academic positions no lower than Assistant Professor. Moreover, they have at least one academic\nresults published by the criteria established for the academic position in the past 5 years.\n1.2 Course Instructor: they have direct or indirect qualification Minimum Master Degree or equivalent,', 'Academic Year', '20\n\n20\n\nB2. Major Compulsory Courses\n\n75\n\n75\n\nB2.1 Fundamental Subjects\n\n39\n\n39\n\nB2.2 Capstone Projects\n\n6\n\n6\n\nB2.3 RAI Elective Mandatory Subjects\n\n18\n\n15\n\nB2.4 RAI Elective Subjects\n\n12\n\n9\n\nB2.5 Alternative Study\n\n-\n\n6\n\nC. Free Electives\n\n6\n\n6\n\nD. Internship\n\n0\n\n0\n\n131\n\n131\n\nCourse Group\nA. General Education\n\nB. Robotics and AI Specific Courses\n\nTOTAL\n\nCredits\n(For Regular Students)\n\n\x0c24', 'TOTAL CREDITS\n\n19\n\n1st YEAR 2nd SEMESTER\nCODE\n\nSUBJECT\n\nCREDITS (L-E-S)\n\n01416320\n\nINTRODUCTION TO ROBOTICS AND AI\n\n3 (3-0-6)\n\n01006803\n\nENGINEERING MECHANICS\n\n3 (3-0-6)\n\n01006711\n\nADVANCED CALCULUS\n\n3 (3-0-6)\n\n01006725\n\nGENERAL PHYSICS 2\n\n3 (3-0-6)\n\n01006726\n\nGENERAL PHYSICS LABORATORY 2\n\n1 (0-3-2)\n\n01416318\n\nMICROPROCESSOR AND INTERFACE\n\n3 (2-2-5)\n\n01416514\n\nROBOTICS LABORATORY 1\n\n1 (0-3-6)\n\n01416001', 'or academic position no lower than Assistant Professor. Moreover, they have at least one academic\nresults published by the criteria established for an academic position in the past 5 years.\n1.3 The curriculum is updated at least every 5 years by considering the opinions of new graduates,\nalumni, industrial advisory board, employer, and other stakeholders.\n2. Graduate', 'practice. This is an advance to the Internship and Co-op Education Students will develop specific skills both\non engineering and professionals, in actual working environment not less than 2 days a week, including\nhands-on experience required to their professional careers.\nTRANSFEERED COURSES FROM UNIVERSITY OF BIRMINGHAM 2+2 DUAL DEGREE PROGRAM\n01416622', 'Regulation of King Mongkut’s Institute of Technology Ladkrabang regarding bachelor degree education\nyear 2016 (Appendix A), and the Announcement of King Mongkut’s Institute of Technology Ladkrabang\nregarding the cross-institute registration of higher education (Appendix B).\n2. Management of the Program\n2.1 Date-Time of the Course\n1st semester:\nAugust – December\n2nd semester:\nJanuary – May']",The degree is given to graduates by King Mongkut’s Institute of Technology Ladkrabang.,King Mongkut's Institute of Technology Ladkrabang.,1.0,0.6522948414230293,0.46487179486249736,1.0
When did the program start its first semester?,"['PART 3: SYSTEM FOR EDUCATIONAL PROVISION, MANAGEMENT,\nAND STRUCTURE OF THE PROGRAM\n1. System for Educational Provision\n1.1 System\nAn academic year has two semesters, each of which covers not less than 15 weeks (excluding the\nexamination weeks). The summer semester is optional. Most courses are offered on the main campus', 'Academic Year', 'planned activities ( if any) at least before the opening of each semester\nfor all subjects\n4. Filing program review and report for the operation of each subject and\nfield experience (if any) within 30 days after the end of the semester for\nall subjects\n5. Filing report of the operation of the program according to SSRwithin 6 0\ndays after the end of the academic year', 'August – December\n2nd semester:\nJanuary – May\nSummer course: June – July\n* The actual start and end dates for each academic year will be announced by the office of the\nregistrar.\n2.2 Qualification of Applicants\nThe general admission process starts from October. RAI classes will begin in August of the following\nyear. Prospective students are required to satisfy the following requirements:', '5.3 Time Period\nThe 4th academic year.\n5.4 Credits\n6 Credits\n5.5 Preparation\nThe proposal must be proposed with the approval of the program committee.\n5.6 Evaluation Process\nAn evaluation is provided by a committee, which consists of instructors in the program by arranging\nan examination in each semester.\n6. Additional Costs', 'plan for the program so that its quality archives the required standards and discuss with the instructor.', '3. Major Field\nNone\n4. Total Credits\nAt least 131 credits\n5. Type of the Program\n5.1 Level\n4-Year Bachelor Program\n5.2 Program Category\n\uf0fe Academic bachelor’s degree program\n\uf0fe Academic bachelor’s degree program\n\uf06f Advanced academic bachelor’s degree program\n\n\x0c5', 'participating in research projects with research labs or academic institutions, or working toward the\nentrepreneurship with incubators. The program committee will annually release the policies regarding the\neligibility and the conditions required to complete the requirement.\nStudents who participate in an alternative study program as Co- Operative Education can do a 16- week', '- The program has been endorsed by the Academic Committee of KMITL in its meeting on 23 June\n2020, 6/2020\n- This program has been approved by the University Council in the 7/2020 meeting no 21st August\n2020\n- This program has started on 1st semester of academic year 2018 (August, 20118)\n7. Readiness for Publication as Qualified and Standardized Program', ""for the duration of the program.\n3.2 The activities are organized to develop students' knowledge, abilities and potential in various ways\nto support 21st-century learning skills.\n3.3 A consultant, who is appointed for academic counseling and guidance to all students, must\nschedule an appointment (Office Hours) for the student to consult."", 'PART 2: SPECIFIC INFORMATION OF THE PROGRAM ..............................................................................................11\n1. Philosophy, Importance, and Objectives of the Program .................................................................................11', '4.2 Time Period\nInternship: Summer Course of the 1st, 2nd, or 3rd academic year\nCo-Operative Education: the 1st Semester of the 4th academic year\n4.3 Time Management and Scheduling\n8 weeks for Internship or full-time for one semester for Co-Operative Education\n5. Regulations for Special Project or Co-Operative Education', '3 (0-9-5)\n\nTOTAL CREDITS\n\n15\n\n3rd YEAR 3rd SEMESTER (SUMMER)\nCODE\n01006805\n\nSUBJECT\nINDUSTRIAL INTERNSHIP\nTOTAL CREDITS\n\nCREDITS (L-E-S)\n0 (0-45-0)\n0\n\n\x0c34\n\nFOR REGULAR STUDENTS\n4th YEAR 1st SEMESTER\nCODE\n\nSUBJECT\n\nCREDITS (L-E-S)\n\nXXXXXXX\n\n(FREE ELECTIVE)\n\n3 (X-X-X)\n\nXXXXXXX\n\n(GENED ELECTIVE)\n\n3 (3-0-6)\n\n0141XXXX\n\nRAI Elective mandatory subject\n\n3 (3-0-6)\n\n0141XXXX\n\nRAI Elective subject\n\n3 (3-0-6)', 'SUBJECT\n\nCREDITS (L-E-S)\n\n01416316\n\nCOMPUTER PROGRAMMING FOR RAI\n\n3 (2-2-5)\n\n01006710\n\nINTRODUCATION TO CALCULUS\n\n3 (3-0-6)\n\n01006723\n\nGENERAL PHYSICS 1\n\n3 (3-0-6)\n\n01006724\n\nGENERAL PHYSICS LABORATORY 1\n\n1 (0-3-2)\n\n01416309\n\nENGINEERING 3D DRAWING\n\n3 (2-2-5)\n\nXXXXXXX\n\n(GENED ELECTIVE)\n\n3 (3-0-6)\n\n01416000\n\n(ESL) ACADEMIC LISTENING AND SPEAKING\n\n3 (3-0-6)\n\nTOTAL CREDITS\n\n19\n\n1st YEAR 2nd SEMESTER\nCODE', '1. System for Educational Provision ...........................................................................................................................18\n2. Management of the Program...................................................................................................................................18', 'during the day. Some courses or laboratory hours may be offered in the evening or weekend.\n1.2 Provision of Summer Course\nSummer courses will be offered based on instructors’ availability and students’ need.\n1.3 System Transfer of Credits in Two-Semester System\nCredits can be transferred, upon the consent of executive program committee, according to the', '0 (0-45-0)\n\nCredit Notation: (L - E - S)\n\nL = Lecture / Learning hours, E = Laboratory hours, S = Self-study hours\nThis study plan shows courses with credits equivalent to 3. However, students can register 4 credit courses\nas well. The total number of credits in each subject category will be counted toward the graduation.\n\n\x0c31\n\n1st YEAR 1st SEMESTER\nCODE\n\nSUBJECT\n\nCREDITS (L-E-S)\n\n01416316', 'PART 3: SYSTEM FOR EDUCATIONAL PROVISION, MANAGEMENT, AND STRUCTURE OF THE\nPROGRAM .............................................................................................................................................................................18', '3.1.3 Subjects\nOne academic credit is given to a course offered in a single semester which\n- Meets in class for lecture or discussion for 1 hour per week; or\n- Contains at least 3 laboratory hours per week.\nMost courses are given 3 or more credits. For 4 credit courses, these courses usually contain 3\nhours of lecture or discussion per week. The courses are also accompanied with 1 additional hour', 'COOPERATIVE EDUCATION\n6 (0-45-0)\nPREREQUISITE: NONE\nThis course demands the student to work in an innovative company or a\ngovernment/private organization, which is approved by the program committee for working on an innovative\nproject for at least 16 weeks. The work of the student is under supervision of a faculty member, who is']",The program started its first semester in the academic year 2018 (August 2018).,Semester 1 of academic year 2018.,1.0,1.0,0.11111111109999999,1.0
Is the program an academic or advanced academic bachelor's degree?,"['3. Major Field\nNone\n4. Total Credits\nAt least 131 credits\n5. Type of the Program\n5.1 Level\n4-Year Bachelor Program\n5.2 Program Category\n\uf0fe Academic bachelor’s degree program\n\uf0fe Academic bachelor’s degree program\n\uf06f Advanced academic bachelor’s degree program\n\n\x0c5', 'Academic Year', '1. Bachelor of Engineering Program is designed to\nqualification standard of higher education by Ministry of\nEducation (MoE) and Accreditation Board for Engineering\nand Technology (ABET)\n2. The total number of courses where at least 50 percent\nor more of class time is carried out through active learning.\n3. The total number of courses with an integrated\neducation system.', 'Florida, Imperial College, Chubu University, Kumamoto University, BK Birla Institute of Engineering and\nTechnology, National Formosa University and South Eastern Regional College, etc.\n5.6 Degree Given to the Graduates\nBachelor of Engineering from King Mongkut’s Institute of Technology Ladkrabang\n6. Status of the Program and Consideration for the Authorization/Agreement', 'Ladkrabang regarding bachelor degree education year 2016 (Appendix A).\n2.10 Integrated Master/Bachelor Program\nIf a student is in the 2nd semester of their third year of study or has completed at least 81 credits,\nwith the overall GPA of at least 3. 00, the student is guaranteed admission into the integrated\nmaster/ bachelor program in the department. The student must also complete the admission form', 'or academic position no lower than Assistant Professor. Moreover, they have at least one academic\nresults published by the criteria established for an academic position in the past 5 years.\n1.3 The curriculum is updated at least every 5 years by considering the opinions of new graduates,\nalumni, industrial advisory board, employer, and other stakeholders.\n2. Graduate', 'qualification for higher education as well as ABET Accreditation by having key performance indicators and\nassessment criteria assigned by the Internal QA committee.\n4. Revision of the Evaluation and Improvement Plan\nThe executive program committees utilize the results of analysis and revision to create an improvement', '3. Curriculum and Instructors\nThe B. Eng. in Robotics and AI program is a four- year full- time undergraduate program. In order to\ngraduate, the students must complete at least 131 credits. Students must achieve the required English\nproficiency level prior to the graduation and satisfy the graduation requirements. The program is designed', '01\n41\n00\n6\n\nmeans Faculty of Engineering\nmeans Robotics and AI program\nmeans shared courses\nmeans bachelor degree\nmeans Order of the subject\n\n\x0c25\n\nA. GENERAL EDUCATION\n\n30 CREDITS\n(LECTURE-LAB-SELF STUDY)\n\nA.1 ENGLISH PROFICIENCY REQUIREMENT (ESL)\n01416000\nACADEMIC LISTENING AND SPEAKING\n01416001\nACADEMIC READING AND WRITING\n01416003\nINTERPRETATION AND ARGUMENTS\n\n9 CREDITS\n3 (3-0-6)\n3 (3-0-6)\n3 (3-0-6)', '23\n\n3.1 Curriculum\n3.1.1 Minimum Credits Required for Graduation\n3.1.2 Curriculum Structure (Minimum Credits)\n\n131\n\ncredits\n\n(For UoB 2+2 Program Students)\n\nCredits\n(For Co-op / Study\nAboard Students)\n\n30\n\n30\n\nA1. English Proficiency Requirement (ESL)\n\n9\n\n9\n\nA2. Communication, Humanity, and Social Skills\n\n15\n\n15\n\nA3. Math and Science\n\n6\n\n6\n\n95\n\n95\n\nB1. Core Courses\n\n20\n\n20\n\nB2. Major Compulsory Courses', 'PART 7: QUALITY ASSURANCE OF THE PROGRAM\n1. Standardization\nThe curriculum management is by the qualified and standardized program according to the qualification\nstandard of higher education as well as the ABET Accreditation throughout the duration of administration\nof the program.\n1.1 Executive program committee: there are no fewer than 5 persons who have either a direct', 'This program is ready for announcement as qualified and standard program according to the qualification\nstandard of higher education in engineering in 2010 in 2022, as well as the ABET Accreditation in 2022\n8. Possible Career Path after Graduation\n- Roboticist or Robotic Engineer\n- Startup Entrepreneur in High Tech\n- Software Engineer for Mechatronics and Machines\n- System Engineer\n- Machine Vision Engineer', 'occupational or professional skill and life skills.\n3. Criteria for Graduation According to the Program\nStudents must complete at least 131 credits to graduate with at least 30 credits from general education\ncourses; at least 95 credits from Robotics and AI concentration and at least 6 credits of free electives and', '50\n3. Curriculum Mapping Illustrating the Distribution of Program Standard Learning Outcomes to Course Level Specialized Course\n\uf098\n\nCourse\n\nMajor Responsibility\n\n\uf081\n\nMinor Responsibility\n\n1. Moral and ethics\n\n2. Knowledge\n\n3. Intellectual skills\n\n4. Human relation skills\nand responsibility\n\n5. Skills for mathematical\ncalculation,\ncommunication and\ninformation technology\nadeptness', 'to adapt to the change in the economy, society, and culture. It also directly reflects the mission of the\nInstitute to be the “ Master of Innovation and the Corner Stone of Fundamental,” in the aspects of\neducation, research, academic service and preservation of art and culture. The program also serves the\nmission of Faculty of Engineering in producing scholars with academic excellence according to the', '8. Possible Career Path after Graduation .................................................................................................................... 5\n9. Name, Surname, ID Number, Position, and Qualification of Instructors Responsible for the Program', 'SUBJECT\n\nCREDITS (L-E-S)\n\nCOOPERATIVE EDUCATION\nor\nSTUDY ABROAD\n\n6 (0-45-0)\nor\n6 (6-0-12)\n\nTOTAL CREDITS\n\n6\n\n4th YEAR 2nd SEMESTER\nCODE\n\nSUBJECT\n\nCREDITS (L-E-S)\n\nXXXXXXX\n\n(GENED ELECTIVE)\n\n3 (3-0-6)\n\nXXXXXXX\n\n(FREE ELECTIVE)\n\n3 (X-X-X)\n\n0141XXXX\n\nRAI Elective subject\n\n3 (3-0-6)\n\n0141XXXX\n\nRAI Elective subject\n\n3 (3-0-6)\n\n01416702\n\nRAI ENGINEERING CAPSTONE DESIGN\n\n3 (0-9-5)\n\nTOTAL CREDITS\n\n15', 'in each academic year by collecting information from students and graduates, employers and/ or\nstakeholders, experts, industrial advisory boards or external evaluators.\n3. Evaluation of the Operation According to the Details of the Program\nHaving quality assurance system and provision of education according to the standard framework of', 'to coordinate with the faculty, institution, instructors and other programs in order to assign the teaching\nstrategies and contents along with the assessment of the program according to the key performance\nindicator to achieve the objectives of the program and to successfully produce innovative graduates.\nThe program committee will consult with members of the program’s industrial advisory board. The', '6\n\n9. Name, Surname, ID Number, Position, and Qualification of Instructors Responsible for the Program (Executive Program Committee)\nName-Surname\n(Academic Position)\nID Number\n\nQualification (Department), University,\nYear of Graduation\n\nAcademic Achievements\n\nDr. Poom Konghuayrob']",The program is an academic bachelor's degree program.,Academic bachelor's degree program.,1.0,0.44942962582996443,0.6215277777622396,1.0
What is a possible career path regarding AI?,"['ROBOTICS AND AI EXPERIENCE\n9 (2-14-12)\nPREREQUISITE: NONE\nExposure to Professional Practice (EPP), Industrial Experience (IE) and/or International Research\nExperience (IRE) and/or taking courses related to research topic provides an opportunity to gain variable\nhands-on training and experience in real world situations, and/or study and/or conduct research', '- System Engineer\n- Machine Vision Engineer\n- Robotic Security Analyst\n- Expert Systems Analyst\n- Machine Designer\n- Software Architect for AI\n- Technology Manager for Robotics and AI\n- Solution Engineer', 'all industries on the verge of digital disruption. Existing businesses will have to adapt and innovatively\ntransform itself in order to stay competitive. Graduates from Robotics and AI will be the major driving\nforce of the transformation using their technical experts and understanding of the economic ecosystem\nand related processes.\n1.3 Program Educational Objectives', '3. Curriculum and Instructors\nThe B. Eng. in Robotics and AI program is a four- year full- time undergraduate program. In order to\ngraduate, the students must complete at least 131 credits. Students must achieve the required English\nproficiency level prior to the graduation and satisfy the graduation requirements. The program is designed', '1.3 Program Educational Objectives\nBachelor of Engineering Program in Robotics and AI emphasizes on the production of graduates\nwith the following qualifications:\na. Engineering Quality: Our graduates will apply engineering practice, combined with the\ninnovative process, to identify and solve significant problems across a broad range of applications.', 'ARTIFICIAL INTELLIGENCE TECHNOLOGY\n3 (3-0-6)\nPREREQUISITE: NONE\nMaterials on AI programming, logic, search, game playing, machine learning, natural\nlanguage understanding, and robotics introduce the student to AI methods, tools, and techniques, their\napplication to computational problems, and their contribution to understanding intelligence.\n\n01416306', 'This program is ready for announcement as qualified and standard program according to the qualification\nstandard of higher education in engineering in 2010 in 2022, as well as the ABET Accreditation in 2022\n8. Possible Career Path after Graduation\n- Roboticist or Robotic Engineer\n- Startup Entrepreneur in High Tech\n- Software Engineer for Mechatronics and Machines\n- System Engineer\n- Machine Vision Engineer', 'concerning Robotics and Artificial Intelligence engineering. Additionally, through exposure to current\npractice, student can reflect on, and appreciate the linkage between curriculum and practice. Students\nwill develop specific skills both on engineering and professionals including hands-on experience or\nresearch experience required to their professional careers.', 'research that incorporates fundamental and advanced concepts in Robotics and AI. Students will learn to\nbuild innovation, identify the opportunities, propose ideas, design and implement innovative solutions while\nbeing able to apply standards and realistic engineering constraints. Students also further specialize in their\nareas of interest and prepare for the next step in their careers.', 'ethics and wisdom to foster the economy of quality, sustainability, righteousness and diversity as well\nas create strong foundation for innovation.\n12.2 Relation to the Mission of the Institute\nThe development of the Robotics and AI Engineering program is related to the strategic\nadvancement of scholar production to create next- generation scholars with capabilities and flexibility', 'to drive innovations and entrepreneurship in robotics and AI technology-related areas. Each semester will\ninclude a project- based theme which helps students practice and design innovative solutions in the\nrespective areas.\nIn the first year, the students study basic courses in mathematics and science and improve their', '4.1.1 Possessing the skills to solve problems related to Robotics and AI\n4.1.2 To be able to work with others as a team with responsibility\n4.1.3 To be able to lead the member of the team appropriately\n4.1.4 To be able to Integrate their knowledge to business solutions that apply the appropriate\ntechnology and information systems to solutions.\n4.2 Time Period', 'such as machine perception application development, cognition and reasoning and IoT. Students will also\nlearn about AI engineering, along with the process and tools to facilitate new innovations.\nFourth-year students undertake significant RAI engineering capstone design projects. Students will apply\ntheir skills and knowledge to create sustainable innovations, practice open-ended engineering design and/or', '3. Intellectual Skills', 'of other agents. Artificial intelligence techniques, as well as insights from cognitive science.\n01416509', '10. Location of Study\nKing Mongkut’s Institute of Technology Ladkrabang\n11. External Situation or Development Needed to be Considered for the Planning of the Program\n11.1 Economic Situation/Development\nThe planning of bachelor’s degree program in Robotics and AI Engineering has been operated\naccording to National Economic and Social Development Plan ( 2017- 2021) which emphasizes on the', 'concepts and algorithms at the foundation of artificial intelligence, diving into the ideas that give rise to\ntechnologies like basic machine learning, image recognition, and neural networks. Through hands-on', '48\n\nIntellectual\nSkills\n\nTo be able to apply\nknowledge of industrial to\nsituations with precision\nand appropriateness\n\nGroup discussion and participation for scientific\nproblem\nIndividual assignments', 'Arranging for an educating activity to develop learners’ skills by assigning\noperational practices in every Robotics and AI subjects.\nArranging for a seminar subject, capstone design or cooperative education,\ninternship program for Robotics and AI\nArranging for knowledge exchange activity in the program for both theory and\npractice between instructors and students as well as collaboration projects', 'ADVANCED ENGINEERING MATHEMATICS\n\nB. ROBOTICS AND AI COURSE SPECIFIC COURSES\nB.1 CORE COURSE\n01006710\n01006711\n01006723\n01006724\n01006725\n01006726\n01006803\n01416310\n\n4 (4-0-8)\n\n95 CREDITS\n(LECTURE-LAB-SELF STUDY)\n\nINTRODUCTION TO CALCULUS\nADVANCED CALCULUS\nGENERAL PHYSICS 1\nGENERAL PHYSICS LABORATORY 1\nGENERAL PHYSICS 2\nGENERAL PHYSICS LABORATORY 2\nENGINEERING MECHANICS\nSTRENGTH OF MATERIALS']","Possible career paths regarding AI include:

- Roboticist or Robotic Engineer
- Startup Entrepreneur in High Tech
- Software Engineer for Mechatronics and Machines
- System Engineer
- Machine Vision Engineer
- Robotic Security Analyst
- Expert Systems Analyst
- Machine Designer
- Software Architect for AI
- Technology Manager for Robotics and AI
- Solution Engineer",Software Architect for AI.,1.0,0.9726905559209897,0.66666666665,1.0
What is a possible career path regarding mechanical systems?,"['\uf0b7\n\uf0b7\n\uf0b7\n\uf0b7\n\uf0b7\n\uf0b7\n\uf0b7\n\uf0b7\n\uf0b7\n\n\uf0b7\n\uf0b7\n\uf0b7\n\uf0b7\n\uf0b7\n\uf0b7\n\uf0b7\n\uf0b7\n\uf0b7\n\n\uf0b7\n\uf0b7\n\uf0b7\n\uf0b7\n\uf0b7\n\uf0b7\n\uf0b7\n\uf0b7\n\uf0b7\n\n\uf0b7\n\uf0b7\n\uf0b7\n\uf0b7\n\uf0b7\n\uf0b7\n\uf0b7\n\uf0b7\n\uf0b7\n\n\uf0b7\n\n\uf0b7\n\n\uf0b7\n\nRAI Elective Subjects\n01416601 Mechanical System and Laboratory\n\n\uf0b7 \uf0b7\n\n\uf0b7 \uf0b7 \uf0b7 \uf0b7 \uf0b7 \uf0b7 \uf0b7\n\n\x0c57\n1. Moral and ethics\n\n2. Knowledge\n\n3. Intellectual skills\n\n4. Human relation\nskills and\nresponsibility\n\n5. Skills for\nmathematical\ncalculation,\ncommunication and\ninformation\ntechnology\nadeptness\n\nCourse\n\n1\n\n2\n\n3\n\uf0b7\n\n\uf0b7\n\uf0b7\n\uf0b7\n\uf0b7\n\uf0b7\n\uf0b7\n\uf0b7', '- System Engineer\n- Machine Vision Engineer\n- Robotic Security Analyst\n- Expert Systems Analyst\n- Machine Designer\n- Software Architect for AI\n- Technology Manager for Robotics and AI\n- Solution Engineer', 'SYSTEM ENGINEERING\n3 (3-0-6)\nPREREQUISITE: NONE\nIntroduction to general concepts of SYSTEM ENGINEERING; comprehensive survey of basic\ntheories of logical and mathematical approaches to general problem solving; systematic application. System\nIntegration in Mechatronics and Robotics.\n01416510', 'This program is ready for announcement as qualified and standard program according to the qualification\nstandard of higher education in engineering in 2010 in 2022, as well as the ABET Accreditation in 2022\n8. Possible Career Path after Graduation\n- Roboticist or Robotic Engineer\n- Startup Entrepreneur in High Tech\n- Software Engineer for Mechatronics and Machines\n- System Engineer\n- Machine Vision Engineer', 'Dr.Weon Keun Song\n\nPh.D. (Mechanical Engineering), MSTU, Moscow, Russia, 1998\n\n1. Research (Appendix H)\n- Non-linear System\n- AI\n2. Teaching obligations\n15 hours/weekly\n\nM.S. (Mechanical Engineering), MSTU, Moscow, Russia, 1994\nB.S. (Civil Engineering), Yonsei University, Seoul, South Korea, 1991\n\n\x0c44', 'concerning Robotics and Artificial Intelligence engineering. Additionally, through exposure to current\npractice, student can reflect on, and appreciate the linkage between curriculum and practice. Students\nwill develop specific skills both on engineering and professionals including hands-on experience or\nresearch experience required to their professional careers.', 'Dr.Weon Keun Song\n(Mechanical Engineering)\n\nPh.D. (Mechanical Engineering), MSTU, Moscow, Russia, 1998\nM.S. (Mechanical Engineering), MSTU, Moscow, Russia, 1994\nB.S. (Civil Engineering), Yonsei University, Seoul, South Korea,\n1991\n\n1. Research (Appendix H)\n- Non-linear System\n- AI\n2. Teaching obligations\n15 hours/weekly\n\n\x0c39\n\n3.2.2 Course instructors\nName-Surname\n(Academic Position)\nID Number', 'of robotics technologies. The students also learn to apply design methods for solutions in technical areas\nsuch as control systems design and kinematics and dynamics.\nThird- year students will learn about the latest technologies and AI which happen in the area. In each\nsemester, the students will study new concepts and apply creativity in completing projects in trending areas', '(1) an ability to apply knowledge of mathematics, science, and engineering\n(3) an ability to design an innovative system, component, or process to meet desired needs within realistic\nconstraints such as economic, environmental, social, political, ethical, health and safety, manufacturability, and\nsustainability', '1. Research (Appendix H)\n- Non-linear System\nM.S. (Mechanical Engineering), MSTU, Moscow, Russia, 1994\n- AI\nB.S. (Civil Engineering), Yonsei University, Seoul, South Korea, 1991\n2. Teaching obligations\n15 hours/weekly\n\nDr. Jutarut Chaoraingern', 'the broad education necessary to understand the impact of engineering solutions in a global,\neconomic, environmental, and societal context via RAI industrial prototyping projects\nrecognition of the need for, and an ability to engage in life-long learning from cooperation or\nacademic training programs\nknowledge of contemporary issues via and ability to use the techniques, skills, and modern', 'ability to design a system, component, or process to meet desired needs within realistic constraints\nsuch as economic, environmental, social, political, ethical, health and safety, manufacturability, and', 'communication skills. Students will also be introduced to fundamental programming concepts and the\nfoundation of robotics systems. The first-year projects will give students hands-on experience, introduction\nand basic development of robotics technologies.\nIn the second year, the students will learn advanced robotics concepts which serve as the foundation', 'all industries on the verge of digital disruption. Existing businesses will have to adapt and innovatively\ntransform itself in order to stay competitive. Graduates from Robotics and AI will be the major driving\nforce of the transformation using their technical experts and understanding of the economic ecosystem\nand related processes.\n1.3 Program Educational Objectives', 'ability to learn and apply knowledge of mathematics, science, and engineering\nability to read, draw, apply engineering drawing\nability to create algorithm, understand and write codes using computer languages for engineering\nproblem solving\nability to design and conduct experiments on feedback control system, as well as to analyze and\ninterpret data using advanced mathematics and engineering tools', '1. Research: (Appendix H)\n- IT- Automation\n- Industrial Informatics\n2. Textbook\n- Matrix Analysis\n- Differential equation\n- Control System Engineering\n- Chaos Robotic\n3. Teaching obligations\n12 hours/weekly\n\nAssoc. Prof. Dr. Chutimet Srinilta\n(Computer Engineering)', 'MECHANICAL SYSTEM AND LABORATORY\nEMBEDDED SYSTEM DEVELOPMENT\nMECHANICAL VIBRATIONS\nSTARTUP ENGINEERING\nDATA VISUALIZATION\nCOGNITIVE COMPUTING APPLICATIONS\nSOFTWARE-DEFINED DATA CENTER\nWIRELESS SENSOR NETWORK\nINFORMATION SECURITY MANAGEMENT\nFUNDAMENTALS OF AR, VR AND MIXED REALITY\nADVANCED COMPUTER PROGRAMMING FOR RAI\nCYBER PHYSICAL ROBOTICS\nMOBILE APPLICATION DEVELOPMENT', 'ROBOTICS AND AI EXPERIENCE\n9 (2-14-12)\nPREREQUISITE: NONE\nExposure to Professional Practice (EPP), Industrial Experience (IE) and/or International Research\nExperience (IRE) and/or taking courses related to research topic provides an opportunity to gain variable\nhands-on training and experience in real world situations, and/or study and/or conduct research', '1. Research (Appendix H)\n- Industrial Robot\n- Automation System\n- Manufacturing Process\n2. Teaching obligations\n15 hours/weekly\n\n\x0c38\n\nDr. Kanoknuch Songsuwankit\n(Electrical Engineering)', ""introduced to emerging trends in Engineering and the relevance of our courses. New courses and research\nopportunities will be presented, including the faculty's research fields. The course also discusses basic\nlearning and working ethics and prepares students career-making skills. Pass/Fail, required to graduate.""]","Sorry, My knowledge base does not contain the answer to this question.",Software Engineer for Mechatronics and Machines.,0.0,0.0,0.2499999999875,1.0
What is a possible career path regarding management?,"['- System Engineer\n- Machine Vision Engineer\n- Robotic Security Analyst\n- Expert Systems Analyst\n- Machine Designer\n- Software Architect for AI\n- Technology Manager for Robotics and AI\n- Solution Engineer', 'a. Arrange an orientation day and counseling session for first year students to advise on\navailable career paths, best action plans in line with set objectives and time management.\nb. Arrange advisor system to overlook, care and provide counseling for students about all\naspects of life, on and off campus, particularly students facing academic difficulties and/ or\ndomestic and other issues.', 'c. Leadership: Our graduates will apply their technical and innovative leadership to establish\nsuccessful careers in their business, profession, and community.\nd. Economic Impact: Our graduates will apply their technical expertise, leadership, and\ninnovative mindset to support and strengthen the society’s economic well-being.', 'decision making, as well as data security and data privacy. This introductory course is integrative across the\ncore disciplines of Data Science, including databases, data warehousing, statistics, data mining, data\nvisualization, high performance computing, cloud computing, and business intelligence. Professional skills,', 'LEADERSHIP AND PERSONAL DEVELOPMENT\n3 (3-0-6)\nPREREQUISITE: NONE\nThis course provides students fundamental skills for success in careers and team\nenvironments. The course will cover topics such as goal setting, career Skills, leadership skills, teamwork,\neffective communication, and public speaking. Learning methods will consist of hands on activities and', 'leadership to establish successful careers in their business, profession,\nand community.\nEconomic Impact: RAI students will apply their technical expertise,\nleadership, and innovative mindset to support and strengthen the\nsociety’s economic well-being.', 'development, communities, research and development and product management. Students are exposed\nto issues that challenged real- world organizations. Students will learn best practices used by engineering\nleaders who successfully develop commercially viable products and services, create efficient operating\nprocesses, manage profitable organizations, and transform companies into industry leaders.\n01006517', 'This program is ready for announcement as qualified and standard program according to the qualification\nstandard of higher education in engineering in 2010 in 2022, as well as the ABET Accreditation in 2022\n8. Possible Career Path after Graduation\n- Roboticist or Robotic Engineer\n- Startup Entrepreneur in High Tech\n- Software Engineer for Mechatronics and Machines\n- System Engineer\n- Machine Vision Engineer', '1) Be able to communicate in English\nwith various groups of people\neffectively\n2) Be able to assist and support in\nresolving problematic situations\nboth in the role of a leader and in\nthe role of a team member\n3) Be able to plan and be responsible\nfor developing one own learning\nconsistently with the profession.\n4) Know the role and responsibilities\nof the assigned work both\nindividual and group work. Be', 'IT PROJECT MANAGEMENT\n3 (3-0-6)\nPREREQUISITE: NONE\nThe concept of IT Project Management and the perspective of a manager. Introduce tools\nand templates available to a Project Manager. Discuss in the demands on the Project Manager and how to\nsolve problems occur during the project period. Cover case studies of project management in business.\n01416628', '8. Possible Career Path after Graduation .................................................................................................................... 5\n9. Name, Surname, ID Number, Position, and Qualification of Instructors Responsible for the Program', '\uf0b7 \uf0b7 \uf0b7\n\n\uf0b7 \uf0b7 \uf0b7 \uf0b7 \uf0b7 \uf0b7\n\uf0b7 \uf0b7\n\uf0b7\n\uf0b7\n\uf0b7\n\uf0b7\n\n\uf0b7\n\n\uf0b7 \uf0b7 \uf0b7\n\n\uf0b7 \uf0b7 \uf0b7 \uf0b7 \uf0b7 \uf0b7 \uf0b7\n\uf0b7 \uf0b7 \uf0b7 \uf0b7 \uf0b7 \uf0b7 \uf0b7\n\uf0b7\n\uf0b7 \uf0b7 \uf0b7\n\uf0b7 \uf0b7 \uf0b7 \uf0b7 \uf0b7 \uf0b7 \uf0b7\n\n\uf0b7 \uf0b7\n\n\uf0b7 \uf0b7 \uf0b7\n\n\x0c59\n1. Moral and ethics\n\n2. Knowledge\n\n3. Intellectual skills\n\n4. Human relation\nskills and\nresponsibility\n\n5. Skills for\nmathematical\ncalculation,\ncommunication and\ninformation\ntechnology\nadeptness\n\nCourse', '\uf098\n\n\uf098\n\n\uf098\n\n\uf098\n\n\uf098\n\n\uf098\n\n\uf098\n\n\uf098\n\n\uf098\n\n\uf098\n\n\uf098\n\n\uf098\n\n\uf098\n\n\uf0b7\n\uf0b7\n\uf0b7\n\uf0b7\n\uf0b7\n\n\uf0b7 \uf0b7 \uf0b7 \uf0b7 \uf0b7 \uf0b7 \uf0b7 \uf0b7 \uf0b7 \uf0b7\n\uf0b7\n\uf0b7 \uf0b7\n\uf0b7 \uf0b7 \uf0b7 \uf0b7\n\uf0b7\n\uf0b7 \uf0b7\n\uf0b7 \uf0b7 \uf0b7 \uf0b7\n\uf0b7\n\uf0b7 \uf0b7\n\uf0b7 \uf0b7 \uf0b7 \uf0b7\n\uf0b7\n\uf0b7 \uf0b7\n\uf0b7 \uf0b7 \uf0b7 \uf0b7\n\n\uf0b7\n\uf0b7\n\uf0b7\n\uf0b7\n\uf0b7\n\n\x0c60\n1. Moral and ethics\n\n2. Knowledge\n\n3. Intellectual skills\n\n4. Human relation\nskills and\nresponsibility\n\n5. Skills for\nmathematical\ncalculation,\ncommunication and\ninformation\ntechnology\nadeptness\n\nCourse', '\uf0b7\n\uf0b7\n\uf0b7\n\uf0b7\n\uf0b7\n\n\uf0b7\n\uf0b7\n\n\uf0b7\n\uf0b7\n\uf0b7\n\uf0b7\n\uf0b7\n\uf0b7\n\uf0b7 \uf0b7\n\uf0b7 \uf0b7\n\uf0b7\n\uf0b7\n\n\x0c54\n1. Moral and ethics\n\n2. Knowledge\n\n3. Intellectual skills\n\n4. Human relation\nskills and\nresponsibility\n\n5. Skills for\nmathematical\ncalculation,\ncommunication and\ninformation\ntechnology\nadeptness\n\nCourse\n\n1\n\n2', '\uf0b7\n\uf0b7\n\uf0b7\n\uf0b7\n\n\uf0b7\n\uf0b7\n\uf0b7\n\uf0b7\n\uf0b7 \uf0b7 \uf0b7\n\uf0b7\n\uf0b7\n\n\uf0b7\n\uf0b7\n\uf0b7\n\uf0b7\n\uf0b7\n\uf0b7\n\uf0b7\n\n\uf0b7\n\uf0b7\n\uf0b7\n\uf0b7\n\uf0b7\n\uf0b7\n\uf0b7\n\uf0b7\n\n\uf0b7\n\n\uf0b7\n\n\uf0b7\n\uf0b7\n\uf0b7\n\uf0b7\n\uf0b7\n\uf0b7\n\uf0b7 \uf0b7\n\uf0b7\n\n\uf0b7\n\uf0b7\n\uf0b7\n\uf0b7\n\uf0b7 \uf0b7 \uf0b7\n\uf0b7\n\nFUNDAMENTAL COURSE\n01416301 Differential Equations and Matrix\nAlgebra\n\n\uf0b7\n\n\uf0b7 \uf0b7\n\n\uf0b7\n\n\uf0b7\n\n\x0c53\n1. Moral and ethics\n\n2. Knowledge\n\n3. Intellectual skills\n\n4. Human relation\nskills and\nresponsibility\n\n5. Skills for\nmathematical\ncalculation,\ncommunication and\ninformation\ntechnology\nadeptness\n\nCourse', '4. Human relation\nskills and\nresponsibility\n\n5. Skills for\nmathematical\ncalculation,\ncommunication and\ninformation\ntechnology\nadeptness\n\nCourse', '1) Have a good critical thinking.\n2) Be able to gather, study, analyze,\nand summarize issues and\nrequirements.\n3) Be able to analyze and solve\nengineering problems\nsystematically. Use decisionmaking information to work\neffectively.\n4) Have the imagination and flexibility\nto adapt the relevant knowledge\nappropriately to create innovation.\n5) Be able to search, interpret, and\nevaluate information for use in', 'g. Available student activities and clubs that promote personal development.', 'knowledge in other fields\n4) Be able to analyze problems,\nunderstand and explain\ncomputing requirements, as well\nas be able to apply knowledge,\nskills, and the usage of suitable\ntools for solving problems\n5) Be able to use their knowledge and\nskills in the field to solve the\nproblem in the actual work.', '4\n\n5\n\n1\n\uf0b7\n\n\uf0b7\n\uf0b7\n\uf0b7\n\uf0b7\n\uf0b7\n\uf0b7\n\uf0b7\n\n\uf0b7\n\uf0b7\n\uf0b7\n\uf0b7\n\uf0b7\n\uf0b7\n\uf0b7\n\uf0b7\n\uf0b7\n\n2\n\n\uf0b7 \uf0b7 \uf0b7\n\n\uf0b7 \uf0b7 \uf0b7\n\n\uf0b7 \uf0b7 \uf0b7\n\uf0b7 \uf0b7\n\n\uf0b7 \uf0b7 \uf0b7 \uf0b7 \uf0b7 \uf0b7 \uf0b7 \uf0b7 \uf0b7 \uf0b7 \uf0b7 \uf0b7 \uf0b7 \uf0b7 \uf0b7\n\uf0b7 \uf0b7 \uf0b7 \uf0b7 \uf0b7 \uf0b7 \uf0b7 \uf0b7 \uf0b7 \uf0b7\n\uf0b7\n\n5\n\n\uf0b7\n\n\uf0b7 \uf0b7 \uf0b7\n\uf0b7\n\uf0b7 \uf0b7 \uf0b7 \uf0b7 \uf0b7\n\n\x0c58\n1. Moral and ethics\n\n2. Knowledge\n\n3. Intellectual skills\n\n4. Human relation\nskills and\nresponsibility\n\n5. Skills for\nmathematical\ncalculation,\ncommunication and\ninformation\ntechnology\nadeptness\n\nCourse']","A possible career path regarding management is ""Technology Manager for Robotics and AI.""",Technology Manager for Robotics and AI.,1.0,1.0,0.9999999999,1.0
Who is an instructor responsible for the program with a focus on Electrical Engineering?,"[""introduced to emerging trends in Engineering and the relevance of our courses. New courses and research\nopportunities will be presented, including the faculty's research fields. The course also discusses basic\nlearning and working ethics and prepares students career-making skills. Pass/Fail, required to graduate."", 'Dr.Weon Keun Song\n(Mechanical Engineering)\n\nPh.D. (Mechanical Engineering), MSTU, Moscow, Russia, 1998\nM.S. (Mechanical Engineering), MSTU, Moscow, Russia, 1994\nB.S. (Civil Engineering), Yonsei University, Seoul, South Korea,\n1991\n\n1. Research (Appendix H)\n- Non-linear System\n- AI\n2. Teaching obligations\n15 hours/weekly\n\n\x0c39\n\n3.2.2 Course instructors\nName-Surname\n(Academic Position)\nID Number', 'to coordinate with the faculty, institution, instructors and other programs in order to assign the teaching\nstrategies and contents along with the assessment of the program according to the key performance\nindicator to achieve the objectives of the program and to successfully produce innovative graduates.\nThe program committee will consult with members of the program’s industrial advisory board. The', ""Dr. Poom Konghuayrob\n(Electrical Engineering)\n\nPh.D. (Electrical Engineering), King Mongkut's Institute of\nTechnology Ladkrabang, 2017\nM.S. (Electrical Engineering), King Mongkut's Institute of\nTechnology Ladkrabang, 2013\nB.S. (Electrical Engineering) (Hons), King Mongkut's Institute of\nTechnology Ladkrabang, 2012"", '8. Possible Career Path after Graduation .................................................................................................................... 5\n9. Name, Surname, ID Number, Position, and Qualification of Instructors Responsible for the Program', 'E. Facilities Supported Teaching and Learning…………………………………………………………………………..….……. 121\nF. Reason for Requesting to Revise Curriculum……………………………………..……………………........……..….……. 129\nG. List of Program Development Committees……………………………………………………………………………………… 137\nH. The Academic Publication of Instructors Responsible for The Program……………………………………….. 139', ""Dr. Poom Konghuayrob\n\nPh.D. (Electrical Engineering), King Mongkut's Institute of Technology\nLadkrabang, 2017\nM.S. (Electrical Engineering), King Mongkut's Institute of Technology\nLadkrabang, 2013\nB.S. (Electrical Engineering) (Hons), King Mongkut's Institute of\nTechnology Ladkrabang, 2012"", 'ABET Student Outcomes\n\n1. Moral and Ethics\n\n(8) an understanding of professional and ethical responsibility\n(6) the broad education necessary to understand the impact of engineering solutions in a global, economic,\nenvironmental, and societal context\n\n2. Knowledge', 'Qualification (Department), University,\nYear of Graduation\n\nAcademic Achievements\n\nAssoc. Prof. Dr. Somyot Kaitwanidvilai\n(Electrical Engineering)\n\nD.Eng. (Mechatronics Engineering), Asian Institute of Technology, 2005\nM.Eng. (Electrical Engineering), KMITL, 2000\nB.Eng. (Hons), KMITL, 1996', 'Asst. Prof. Dr. Rutchanee Gullayanon\n\nPh.D. (Electrical Engineering), Georgia Institute of Technology, USA,2011\nM.S. (Electrical Engineering), Georgia Institute of Technology, USA, 2003\nB.S. (Computer System Engineering), Rensselaer Polytechnic Institute,\nUSA, 2001\nB.S. (Electrical Engineering), Rensselaer Polytechnic Institute, USA, 2001', '3 (3-0-6)\n\n\x0c103\nThis course provides the physical science required to analyze electrical and electronic\ndevices. Covered topics include electrostatics and electromagnetics, electric field and potential,\nconductors, insulators, capacitors, dielectrics, electric current, electric circuits, magnetic fields and\nelectromagnetism.\n01006726', '(6) an understanding of professional and ethical responsibility\n(7) an ability to communicate effectively\n( 8) the broad education necessary to understand the impact of engineering solutions in a global,\neconomic, environmental, and societal context\n(9) a recognition of the need for, and an ability to engage in life-long learning\n(10) a knowledge of contemporary issues', 'Indicator and Objective\n8. All new instructors (if any) participate in an orientation and receive advice\nfor teaching management\n9. Every permanent instructor receives academic and/ or professional\ndevelopment at least once a year\n10. Supporting staffs ( if any) receive academic and/ or professional\ndevelopment no less than 50% of the total number', ""Academic Achievements\n\nDr. Poom Konghuayrob\n\nD.Eng. (Electrical Engineering), King Mongkut's Institute of\nTechnology Ladkrabang, 2017\nM.Eng. (Electrical Engineering), King Mongkut's Institute of\nTechnology Ladkrabang, 2013\nB.Eng. (Electrical Engineering) (Hons), King Mongkut's Institute of\nTechnology Ladkrabang, 2012"", 'Having an assessment of the instructor’ s skills in devising teaching strategies by students. The\nresults of the evaluation will be used for the improvement of aforementioned skills of instructors.\n2. Evaluation of the Program as a Whole Picture\nThe executive program committees evaluate the program as a whole picture when the teaching ends', 'INDUSTRIAL EXPERIENCE FOR ENGINEERS\n3 (0-16-0)\nPREREQUISITE: 01006301 COOPERATIVE EDUCATION\nExposure to Professional Practice (EPP), or Industrial Experience (IE), provides an\nopportunity to gain valuable hands-on training and experience in real world situations. Additionally, through\nexposure to current practice, students can reflect on, and appreciate the linkage between curriculum and', 'critical-thinking, communication and collaboration skills. Our students will be introduced to innovative\nmindsets, able to work with multidisciplinary teams and be leaders in their field of study. Our graduates\nwill be lifelong learners who are aware of technical and societal issues. They will be able to create\nengineering innovations with economics impact and benefit our society.\n1.2 Importance', 'teaching and education, assessment and evaluation\nc. Arranging a venue for instructors to exchange knowledge regarding teaching techniques,\nassessment, and evaluation.\nd. Supporting the budget for the development of professional, education, and research regarding\nteaching techniques, assessment, and evaluation, and so on.\n2.2 Development of Academic and Other Professions', 'Dr. Jutarut Chaoraingern\n\nD. Eng. (Electrical Engineering), KMITL, Thailand, 2021\nM. Eng. (Instrumentation Engineering) KMITL, Thailand, 2006\nB. Eng. (Instrumentation Engineering) KMITL, Thailand, 2000\n\n\x0c9', 'practice. This is an advance to the Internship and Co-op Education Students will develop specific skills both\non engineering and professionals, in actual working environment not less than 2 days a week, including\nhands-on experience required to their professional careers.\nTRANSFEERED COURSES FROM UNIVERSITY OF BIRMINGHAM 2+2 DUAL DEGREE PROGRAM\n01416622']",Dr. Poom Konghuayrob is an instructor responsible for the program with a focus on Electrical Engineering.,Dr. Poom Konghuayrob.,0.6666666666666666,0.8518619406087218,0.24999999999166667,1.0
Where is the location of study?,"['(Executive Program Committee) .................................................................................................................................... 6\n10. Location of Study ...................................................................................................................................................... 9', 'g. Available student activities and clubs that promote personal development.', '\uf0b7\n\n\uf0b7\n\n\uf0b7\n\nArranging for a special lecture by an expert to contribute to research experience\nand societal impact as well as relating laws and infringements\nArranging for extracurricular activities, i.e., community service.\n\n\x0c47', 'teaching and education, assessment and evaluation\nc. Arranging a venue for instructors to exchange knowledge regarding teaching techniques,\nassessment, and evaluation.\nd. Supporting the budget for the development of professional, education, and research regarding\nteaching techniques, assessment, and evaluation, and so on.\n2.2 Development of Academic and Other Professions', 'needs of the country and society, developing research to build up the body of knowledge for the\ndevelopment of the country, developing national and international collaboration of academic network,\nbuilding up scientific and technological body of knowledge and giving academic service to the society,\nsupporting the preservation of art and culture, along with developing curricula according to the standard', 'projects, group work, lecture, discussion, reading, writing, and presenting.\n01006521', 'E. Facilities Supported Teaching and Learning…………………………………………………………………………..….……. 121\nF. Reason for Requesting to Revise Curriculum……………………………………..……………………........……..….……. 129\nG. List of Program Development Committees……………………………………………………………………………………… 137\nH. The Academic Publication of Instructors Responsible for The Program……………………………………….. 139', 'STUDY ABROAD\n6 (6-0-12)\nPREREQUISITE: NONE\nThis course is reserved for students who participate in the study abroad program. Upon\nthe completion of the program, the students must prepare and deliver oral presentations describing their\nexperience from the program.\n3. INTERNSHIP\n01006805', '\uf0b7\n\nArranging for an education that promotes students’ self-learning\n\n\uf0b7', 'or academic position no lower than Assistant Professor. Moreover, they have at least one academic\nresults published by the criteria established for an academic position in the past 5 years.\n1.3 The curriculum is updated at least every 5 years by considering the opinions of new graduates,\nalumni, industrial advisory board, employer, and other stakeholders.\n2. Graduate', 'of recitation or 3 hours of laboratory work per week. Students enrolled in the courses are also\nexpected to spend at least 8 hours outside the class/ lab for studying and completing the\ncoursework.\nThe instructor-led lecture could be delivered as a traditional lecture or include learning\nactivities in which the students can actively participate. The recitation is a compliment to a lecture', 'Strategy or Activity of Students\n\uf0b7\n\n\uf0b7\n\n\uf0b7', 'and Social Development Plan.\n5.2 There is an integrated teaching and learning approach to research.\n5.3 Instructors are assigned in each course have the knowledge, ability, and expertise in the course.\nMoreover,there is a system to monitor the preparation of learning plans and teaching and learning\nmanagement.\n6. Educational Resources\n6.1 Budget management', '13. Relation (if any) with Other Programs Open in the Faculty/Other Departments of the Institute (i.e.\nSubjects Open for the Service of Other Faculties/Departments or to Be Studied with Other\nFaculties/Departments) .................................................................................................................................................10', 'Academic Year', ""for the duration of the program.\n3.2 The activities are organized to develop students' knowledge, abilities and potential in various ways\nto support 21st-century learning skills.\n3.3 A consultant, who is appointed for academic counseling and guidance to all students, must\nschedule an appointment (Office Hours) for the student to consult."", 'Course\n\n1\n09106404 Solar Cell and Nanostructure\nPhotovoltaic\n09106405 LAB-ON-CHIP Technology\n09106406 Microelectromechanical System\n09106407 Chemistry\nAlternative Study Courses\n01006301 Cooperative Education\n01006302 Study Abroad\nIndustrial Internship\n01006805 Industrial Internship\nTotal\n\n2\n\n3\n\n4\n\n5\n\n1\n\n2\n\n3\n\n4\n\n5\n\n1\n\n2\n\n3\n\n4\n\n5\n\n1\n\n2\n\n3\n\n4\n\n5\n\n1\n\n2\n\n3\n\n4\n\n5\n\n\uf0b7 \uf0b7 \uf0b7\n\n\uf0b7 \uf0b7 \uf0b7\n\n\uf0b7 \uf0b7 \uf0b7 \uf0b7 \uf0b7 \uf0b7 \uf0b7\n\n\uf0b7 \uf0b7\n\n\uf0b7 \uf0b7 \uf0b7 \uf0b7 \uf0b7', 'for improvement and development of effective educational resources.\n6.2 Existing Educational Resources\nThe Faculty has the readiness of location, classrooms, and laboratories in support of adequate\neducation and teaching. For the institutional level, there is the central library of the institute that\nprovides services for books, textbooks, journals, printing articles, and visual media as well as being a', 'days after the end of the academic year\n6. Having verification of learning achievement at least 2 5 % of the subjects\nopen in each academic year\n7. Having development/ revision of the education, teaching strategies or\nevaluation of learning from the result of the assessment of operation\nreported in the SSR of the previous year', 'General Education\n01416000 Academic Listening and Speaking\n01416001 Academic Reading and Writing\n01416003 Interpretation and Arguments\n01006502 Professional Ethics\n01006503 Introduction to Psychology\n01006504 Philosophy of Science\n01006505 Creative Thinking\n01006506 Critical Thinking\n01006507 Personal Economics\n01006508 Digital Economy\n01006509 Engineering and Public Policy']","Sorry, My knowledge base does not contain the answer to this question.",King Mongkut's Institute of Technology Ladkrabang.,0.0,0.0,0.0,0.0
What national plan does the program align with?,"['Indicator and Objective\n1. At least 80% of the executive program committee of the program\nparticipate in the meeting for planning, following and revising the\noperation of the program\n2. Having the details of the program consistent with the national or\ninternational standard of qualification for the program\n3. Having the course syllabus and details of each offered subject and', '6. Status of the Program and Consideration for the Authorization/Agreement................................................. 5\n7. Readiness for Publicization as Qualified and Standardized Program ............................................................... 5', 'PART 3: SYSTEM FOR EDUCATIONAL PROVISION, MANAGEMENT, AND STRUCTURE OF THE\nPROGRAM .............................................................................................................................................................................18', 'PART 2: SPECIFIC INFORMATION OF THE PROGRAM ..............................................................................................11\n1. Philosophy, Importance, and Objectives of the Program .................................................................................11', '1. System for Educational Provision ...........................................................................................................................18\n2. Management of the Program...................................................................................................................................18', 'Program Achieving Standard According to the Quality\nFramework\n\n2021\n\nAchieving mandatory indicators no.1-5\ntotal indicators of 10\ntotal indicators of 10\n\n2022\n\ntotal indicators of 10\n\n2023\n\ntotal indicators of 11\n\n2024\n\ntotal indicators of 12\n\n2020\n\n\x0c67', '14\n\n2. Development Plan\nDevelopment Plan\n\nEnhance the quality of the\ncurriculum and teaching-learning\nactivities to that of international\nstandards.\n\nThe development plan for\nengineering education, active\nlearning, 21st-century skill-sets,\nand characteristics streamlined to\ninstitutional engineering set\n\nStrategies\n\nEvidence/Indicator', 'PART 7: QUALITY ASSURANCE OF THE PROGRAM\n1. Standardization\nThe curriculum management is by the qualified and standardized program according to the qualification\nstandard of higher education as well as the ABET Accreditation throughout the duration of administration\nof the program.\n1.1 Executive program committee: there are no fewer than 5 persons who have either a direct', 'to coordinate with the faculty, institution, instructors and other programs in order to assign the teaching\nstrategies and contents along with the assessment of the program according to the key performance\nindicator to achieve the objectives of the program and to successfully produce innovative graduates.\nThe program committee will consult with members of the program’s industrial advisory board. The', '(Executive Program Committee) .................................................................................................................................... 6\n10. Location of Study ...................................................................................................................................................... 9', '20\n\n2.5 Admission Plan and Estimated Graduation in 5 Years\nAcademic Year\nNumber of Students\n1st year\n\n2020\n\n2021\n\n2022\n\n2023\n\n2024\n\n60\n\n30\n\n30\n\n30\n\n30\n\n60\n\n30\n\n30\n\n30\n\n60\n\n30\n\n30\n\n60\n\n30\n\n2nd year\n3rd year\n4th year\nTotal\n\n60\n\n90\n\n120\n\n150\n\n120\n\nEstimated to Graduate\n\n-\n\n-\n\n-\n\n60\n\n30\n\n2.6 Planned Budget\nAcademic Year\n2020\n\n2021\n\n2022\n\n2023\n\n2024\n\n1. Personnel\n\n2,157,500\n\n2,912,917\n\n3,879,250\n\n4,119,250', '5.3 Time Period\nThe 4th academic year.\n5.4 Credits\n6 Credits\n5.5 Preparation\nThe proposal must be proposed with the approval of the program committee.\n5.6 Evaluation Process\nAn evaluation is provided by a committee, which consists of instructors in the program by arranging\nan examination in each semester.\n6. Additional Costs', '11. External Situation or Development Needed to be Considered for the Planning of the Program .......... 9\n12. Effects from 11.1 and 11.2 on the Development of the Program and the Relation to the Mission of\nthe Institute........................................................................................................................................................................ 9', 'PART 3: SYSTEM FOR EDUCATIONAL PROVISION, MANAGEMENT,\nAND STRUCTURE OF THE PROGRAM\n1. System for Educational Provision\n1.1 System\nAn academic year has two semesters, each of which covers not less than 15 weeks (excluding the\nexamination weeks). The summer semester is optional. Most courses are offered on the main campus', 'Faculties/Departments)\n13.1 Subjects/Subject Groups in the Program Open by Other Faculties/Departments/ Programs\n- General Education subjects\n- Free electives\n13.2 Subjects/ Subject Groups in the Program Open and Required to be Studied by Other\nFaculties/Departments/Programs\n- Free electives\n13.3 Management\nThe executive program committee is primarily responsible for the program are the representatives', 'planned activities ( if any) at least before the opening of each semester\nfor all subjects\n4. Filing program review and report for the operation of each subject and\nfield experience (if any) within 30 days after the end of the semester for\nall subjects\n5. Filing report of the operation of the program according to SSRwithin 6 0\ndays after the end of the academic year', 'E. Facilities Supported Teaching and Learning…………………………………………………………………………..….……. 121\nF. Reason for Requesting to Revise Curriculum……………………………………..……………………........……..….……. 129\nG. List of Program Development Committees……………………………………………………………………………………… 137\nH. The Academic Publication of Instructors Responsible for The Program……………………………………….. 139', 'participating in research projects with research labs or academic institutions, or working toward the\nentrepreneurship with incubators. The program committee will annually release the policies regarding the\neligibility and the conditions required to complete the requirement.\nStudents who participate in an alternative study program as Co- Operative Education can do a 16- week', 'plan for the program so that its quality archives the required standards and discuss with the instructor.', '- The program has been endorsed by the Academic Committee of KMITL in its meeting on 23 June\n2020, 6/2020\n- This program has been approved by the University Council in the 7/2020 meeting no 21st August\n2020\n- This program has started on 1st semester of academic year 2018 (August, 20118)\n7. Readiness for Publication as Qualified and Standardized Program']","Sorry, My knowledge base does not contain the answer to this question.",National Economic and Social Development Plan (2017-2021).,0.0,0.0,0.0,0.0
What is the mission of the Institute mentioned in the document?,"['to adapt to the change in the economy, society, and culture. It also directly reflects the mission of the\nInstitute to be the “ Master of Innovation and the Corner Stone of Fundamental,” in the aspects of\neducation, research, academic service and preservation of art and culture. The program also serves the\nmission of Faculty of Engineering in producing scholars with academic excellence according to the', 'ethics and wisdom to foster the economy of quality, sustainability, righteousness and diversity as well\nas create strong foundation for innovation.\n12.2 Relation to the Mission of the Institute\nThe development of the Robotics and AI Engineering program is related to the strategic\nadvancement of scholar production to create next- generation scholars with capabilities and flexibility', 'between institutes for internships', '11. External Situation or Development Needed to be Considered for the Planning of the Program .......... 9\n12. Effects from 11.1 and 11.2 on the Development of the Program and the Relation to the Mission of\nthe Institute........................................................................................................................................................................ 9', '3. Evaluation of the Operation According to the Details of the Program .........................................................65\n4. Revision of the Evaluation and Improvement Plan ...........................................................................................65\nAppendix\nA. The Regulation of King Mongkut’ s Institute of Technology Ladkrabang Regarding Bachelor Degree', '13. Relation (if any) with Other Programs Open in the Faculty/Other Departments of the Institute (i.e.\nSubjects Open for the Service of Other Faculties/Departments or to Be Studied with Other\nFaculties/Departments) .................................................................................................................................................10', 'PART 2: SPECIFIC INFORMATION OF THE PROGRAM ..............................................................................................11\n1. Philosophy, Importance, and Objectives of the Program .................................................................................11', 'to coordinate with the faculty, institution, instructors and other programs in order to assign the teaching\nstrategies and contents along with the assessment of the program according to the key performance\nindicator to achieve the objectives of the program and to successfully produce innovative graduates.\nThe program committee will consult with members of the program’s industrial advisory board. The', '4. Component Regarding Field Experience (Internship or Co-Operative Education).......................................43\n5. Regulations for Special Project or Co-Operative Education .............................................................................43', 'PART 3: SYSTEM FOR EDUCATIONAL PROVISION, MANAGEMENT, AND STRUCTURE OF THE\nPROGRAM .............................................................................................................................................................................18', 'Indicator and Objective\n1. At least 80% of the executive program committee of the program\nparticipate in the meeting for planning, following and revising the\noperation of the program\n2. Having the details of the program consistent with the national or\ninternational standard of qualification for the program\n3. Having the course syllabus and details of each offered subject and', '6. Status of the Program and Consideration for the Authorization/Agreement................................................. 5\n7. Readiness for Publicization as Qualified and Standardized Program ............................................................... 5', 'wisdom and life-long learning.\n12. Effects from 11. 1 and 11. 2 on the Development of the Program and the Relation to the Mission\nof the Institute\n12.1 Development of the Program\nThe effects of external factors on the development of the Robotics and AI Engineering program,\nBachelor of Engineering, call for the revision of the program so that it can support the needs according', 'in each academic year by collecting information from students and graduates, employers and/ or\nstakeholders, experts, industrial advisory boards or external evaluators.\n3. Evaluation of the Operation According to the Details of the Program\nHaving quality assurance system and provision of education according to the standard framework of', 'E. Facilities Supported Teaching and Learning…………………………………………………………………………..….……. 121\nF. Reason for Requesting to Revise Curriculum……………………………………..……………………........……..….……. 129\nG. List of Program Development Committees……………………………………………………………………………………… 137\nH. The Academic Publication of Instructors Responsible for The Program……………………………………….. 139', 'Education Year 2016……………………………………………………………………………………………………………………………. 67\nB. The Announcement King Mongkut’s Institute of Technology Ladkrabang Regarding the Cross\nInstitute Registration of Higher Education………………………………………………………………………………………….. 87\nC. Course Description………………………………………………………………………………………………………………...……………. 92\nD. Curriculum Mapping for General Education Course…………………………………………………………….…………. 117', 'needs of the country and society, developing research to build up the body of knowledge for the\ndevelopment of the country, developing national and international collaboration of academic network,\nbuilding up scientific and technological body of knowledge and giving academic service to the society,\nsupporting the preservation of art and culture, along with developing curricula according to the standard', 'Academic Year', 'PART 2: SPECIFIC INFORMATION OF THE PROGRAM\n1. Philosophy, Importance, and Objectives of the Program\n1.1 Philosophy\nOur economy needs highly skilled engineers to support the growing worldwide digital economy.\nModern engineering programs must recognize state-of-the-art technologies and practices while inspiring', 'of the educational quality assurance of King Mongkut’ s Institute of Technology Ladkrabang to exploit\nknowledge for the sustainable development of the country and society.\n13. Relation (if any) with Other Programs Open in the Faculty/Other Departments of the Institute (i.e.\nSubjects Open for the Service of Other Faculties/ Departments or to Be Studied with Other\nFaculties/Departments)']","The mission of the Institute mentioned in the document is to be the ""Master of Innovation and the Corner Stone of Fundamental,"" in the aspects of education, research, academic service, and preservation of art and culture.",Master of Innovation and the Corner Stone of Fundamental.,1.0,0.9999999999999999,0.9999999999,1.0
What are the 21st-century skills the curriculum aims to cultivate?,"[""students to generate innovations. We want our graduate to be ready for the ever-changing technological\nlandscape.\nThe curriculum is designed to drive innovations. By combining theoretical foundations with handson experience and project- based learning, the students will learn the skills required for today’ s\nworkforce. We embrace the 21st century learning environment to cultivate the students' creativity,"", '50\n3. Curriculum Mapping Illustrating the Distribution of Program Standard Learning Outcomes to Course Level Specialized Course\n\uf098\n\nCourse\n\nMajor Responsibility\n\n\uf081\n\nMinor Responsibility\n\n1. Moral and ethics\n\n2. Knowledge\n\n3. Intellectual skills\n\n4. Human relation skills\nand responsibility\n\n5. Skills for mathematical\ncalculation,\ncommunication and\ninformation technology\nadeptness', '51\n1. Moral and ethics\n\n2. Knowledge\n\n3. Intellectual skills\n\n4. Human relation\nskills and\nresponsibility\n\n5. Skills for\nmathematical\ncalculation,\ncommunication and\ninformation\ntechnology\nadeptness\n\nCourse\n\n1\n\n2\n\n3\n\n4\n\n5\n\n1\n\n2\n\n3\n\n4\n\n5\n\n1\n\n2\n\n3\n\n\uf0b7 \uf0b7 \uf0b7\n\uf0b7 \uf0b7 \uf0b7\n\uf0b7\n\uf0b7 \uf0b7 \uf0b7\n\uf0b7 \uf0b7 \uf0b7\n\uf0b7\n\uf0b7\n\n\uf0b7\n\uf0b7\n\uf0b7\n\uf0b7\n\uf0b7\n\uf0b7\n\n\uf0b7 \uf0b7 \uf0b7 \uf0b7 \uf0b7 \uf0b7\n\uf0b7 \uf0b7 \uf0b7 \uf0b7 \uf0b7 \uf0b7\n\uf0b7\n\uf0b7\n\uf0b7 \uf0b7\n\uf0b7\n\uf0b7\n\uf0b7\n\uf0b7 \uf0b7\n\uf0b7\n\n\uf0b7\n\n\uf0b7 \uf0b7\n\n\uf0b7 \uf0b7\n\n\uf0b7 \uf0b7\n\uf0b7 \uf0b7\n\n\uf0b7 \uf0b7 \uf0b7 \uf0b7\n\uf0b7 \uf0b7 \uf0b7\n\n\uf0b7 \uf0b7 \uf0b7 \uf0b7 \uf0b7\n\uf0b7 \uf0b7 \uf0b7\n\uf0b7\n\n\uf0b7\n\n\uf0b7 \uf0b7\n\n\uf0b7 \uf0b7\n\n4\n\n5', '\uf098\n\n\uf098\n\n\uf098\n\n\uf098\n\n\uf098\n\n\uf098\n\n\uf098\n\n\uf098\n\n\uf098\n\n\uf098\n\n\uf098\n\n\uf098\n\n\uf098\n\n\uf0b7\n\uf0b7\n\uf0b7\n\uf0b7\n\uf0b7\n\n\uf0b7 \uf0b7 \uf0b7 \uf0b7 \uf0b7 \uf0b7 \uf0b7 \uf0b7 \uf0b7 \uf0b7\n\uf0b7\n\uf0b7 \uf0b7\n\uf0b7 \uf0b7 \uf0b7 \uf0b7\n\uf0b7\n\uf0b7 \uf0b7\n\uf0b7 \uf0b7 \uf0b7 \uf0b7\n\uf0b7\n\uf0b7 \uf0b7\n\uf0b7 \uf0b7 \uf0b7 \uf0b7\n\uf0b7\n\uf0b7 \uf0b7\n\uf0b7 \uf0b7 \uf0b7 \uf0b7\n\n\uf0b7\n\uf0b7\n\uf0b7\n\uf0b7\n\uf0b7\n\n\x0c60\n1. Moral and ethics\n\n2. Knowledge\n\n3. Intellectual skills\n\n4. Human relation\nskills and\nresponsibility\n\n5. Skills for\nmathematical\ncalculation,\ncommunication and\ninformation\ntechnology\nadeptness\n\nCourse', '4\n\n5\n\n1\n\uf0b7\n\n\uf0b7\n\uf0b7\n\uf0b7\n\uf0b7\n\uf0b7\n\uf0b7\n\uf0b7\n\n\uf0b7\n\uf0b7\n\uf0b7\n\uf0b7\n\uf0b7\n\uf0b7\n\uf0b7\n\uf0b7\n\uf0b7\n\n2\n\n\uf0b7 \uf0b7 \uf0b7\n\n\uf0b7 \uf0b7 \uf0b7\n\n\uf0b7 \uf0b7 \uf0b7\n\uf0b7 \uf0b7\n\n\uf0b7 \uf0b7 \uf0b7 \uf0b7 \uf0b7 \uf0b7 \uf0b7 \uf0b7 \uf0b7 \uf0b7 \uf0b7 \uf0b7 \uf0b7 \uf0b7 \uf0b7\n\uf0b7 \uf0b7 \uf0b7 \uf0b7 \uf0b7 \uf0b7 \uf0b7 \uf0b7 \uf0b7 \uf0b7\n\uf0b7\n\n5\n\n\uf0b7\n\n\uf0b7 \uf0b7 \uf0b7\n\uf0b7\n\uf0b7 \uf0b7 \uf0b7 \uf0b7 \uf0b7\n\n\x0c58\n1. Moral and ethics\n\n2. Knowledge\n\n3. Intellectual skills\n\n4. Human relation\nskills and\nresponsibility\n\n5. Skills for\nmathematical\ncalculation,\ncommunication and\ninformation\ntechnology\nadeptness\n\nCourse', '\uf0b7\n\uf0b7\n\uf0b7\n\uf0b7\n\uf0b7\n\n\uf0b7\n\uf0b7\n\uf0b7\n\uf0b7\n\uf0b7\n\n\uf0b7\n\uf0b7\n\uf0b7\n\uf0b7\n\uf0b7\n\n\uf0b7\n\uf0b7\n\uf0b7\n\uf0b7\n\uf0b7\n\n\uf0b7\n\uf0b7\n\uf0b7\n\uf0b7\n\uf0b7\n\n\uf0b7\n\uf0b7\n\uf0b7\n\uf0b7\n\uf0b7\n\n\uf0b7\n\uf0b7\n\uf0b7\n\uf0b7\n\uf0b7\n\n\uf0b7\n\uf0b7\n\uf0b7\n\uf0b7\n\uf0b7\n\n\uf0b7\n\uf0b7\n\uf0b7\n\uf0b7\n\uf0b7\n\n\uf0b7\n\uf0b7\n\uf0b7\n\uf0b7\n\uf0b7\n\n\x0c56\n1. Moral and ethics\n\n2. Knowledge\n\n3. Intellectual skills\n\n4. Human relation\nskills and\nresponsibility\n\n5. Skills for\nmathematical\ncalculation,\ncommunication and\ninformation\ntechnology\nadeptness\n\nCourse\n\n1\n\n2\n\n3\n\n5\n\n1\n\n2\n\n3\n\n4\n\n5\n\n1\n\n2\n\n3\n\n4\n\n5', 'concerning Robotics and Artificial Intelligence engineering. Additionally, through exposure to current\npractice, student can reflect on, and appreciate the linkage between curriculum and practice. Students\nwill develop specific skills both on engineering and professionals including hands-on experience or\nresearch experience required to their professional careers.', ""with the university's vision and policy\n4.3 There is a system of teacher quality development to have professors in the field of teaching.\n5. Curriculum, Teaching, and Assessment of Learners\n5.1 There is a process of designing/ updating curriculums and courses for advanced content to meet\nacademic/professional standards In line with the needs of the labor market and the National Economic"", '\uf0b7 \uf0b7 \uf0b7\n\n\uf0b7 \uf0b7 \uf0b7 \uf0b7 \uf0b7 \uf0b7\n\uf0b7 \uf0b7\n\uf0b7\n\uf0b7\n\uf0b7\n\uf0b7\n\n\uf0b7\n\n\uf0b7 \uf0b7 \uf0b7\n\n\uf0b7 \uf0b7 \uf0b7 \uf0b7 \uf0b7 \uf0b7 \uf0b7\n\uf0b7 \uf0b7 \uf0b7 \uf0b7 \uf0b7 \uf0b7 \uf0b7\n\uf0b7\n\uf0b7 \uf0b7 \uf0b7\n\uf0b7 \uf0b7 \uf0b7 \uf0b7 \uf0b7 \uf0b7 \uf0b7\n\n\uf0b7 \uf0b7\n\n\uf0b7 \uf0b7 \uf0b7\n\n\x0c59\n1. Moral and ethics\n\n2. Knowledge\n\n3. Intellectual skills\n\n4. Human relation\nskills and\nresponsibility\n\n5. Skills for\nmathematical\ncalculation,\ncommunication and\ninformation\ntechnology\nadeptness\n\nCourse', '4. Human Relation Skills and\nResponsibility\n\n(4) an ability to function on multidisciplinary teams\n(6) an understanding of professional and ethical responsibility\n\n5. Skills for Mathematical Calculation,\n(7) an ability to communicate effectively\nCommunication and Information\n(8) an ability to use the techniques, skills, and modern engineering tools necessary for engineering practice.\nTechnology Adeptness', '4. Human relation\nskills and\nresponsibility\n\n5. Skills for\nmathematical\ncalculation,\ncommunication and\ninformation\ntechnology\nadeptness\n\nCourse', '\uf0b7\n\uf0b7\n\uf0b7\n\uf0b7 \uf0b7\n\uf0b7 \uf0b7\n\uf0b7\n\n\uf0b7\n\uf0b7\n\n\uf0b7\n\n\uf0b7\n\uf0b7\n\uf0b7\n\uf0b7\n\uf0b7\n\n\uf0b7\n\uf0b7 \uf0b7 \uf0b7 \uf0b7 \uf0b7\n\uf0b7 \uf0b7\n\uf0b7 \uf0b7 \uf0b7\n\n\uf0b7\n\n\uf0b7\n\n\uf0b7\n\n\uf0b7\n\n\x0c52\n1. Moral and ethics\n\n2. Knowledge\n\n3. Intellectual skills\n\n4. Human relation\nskills and\nresponsibility\n\n5. Skills for\nmathematical\ncalculation,\ncommunication and\ninformation\ntechnology\nadeptness\n\nCourse\n\n1\n\n2\n\n\uf0b7\n\uf0b7\n\uf0b7\n\uf0b7\n\n\uf0b7\n\uf0b7\n\uf0b7\n\uf0b7\n\uf0b7\n\uf0b7\n\uf0b7\n\uf0b7\n\n3\n\n4\n\n5\n\n1\n\n2\n\n\uf0b7\n\uf0b7\n\uf0b7\n\uf0b7\n\uf0b7\n\uf0b7 \uf0b7\n\n\uf0b7\n\uf0b7\n\uf0b7\n\uf0b7\n\uf0b7\n\uf0b7\n\uf0b7\n\uf0b7\n\n\uf0b7\n\uf0b7\n\uf0b7\n\uf0b7\n\uf0b7\n\uf0b7\n\uf0b7\n\uf0b7\n\n3\n\n4\n\n5\n\n1\n\n2\n\n3\n\n4\n\n5\n\n1\n\n2\n\n3\n\n4', 'critical-thinking, communication and collaboration skills. Our students will be introduced to innovative\nmindsets, able to work with multidisciplinary teams and be leaders in their field of study. Our graduates\nwill be lifelong learners who are aware of technical and societal issues. They will be able to create\nengineering innovations with economics impact and benefit our society.\n1.2 Importance', 'increase the capability of instructors in both teaching and researching.', '(10) a knowledge of contemporary issues\n( 11) an ability to use the techniques, skills, and modern engineering tools necessary for engineering\npractice.', 'e. Lifelong Learning: Our graduates will learn new technologies, methodologies, and tools\nand adapt them to respond to the challenges of a changing environment.', '3. Curriculum and Instructors.......................................................................................................................................22', '\uf0b7\n\uf0b7\n\uf0b7\n\uf0b7\n\uf0b7\n\n\uf0b7\n\uf0b7\n\n\uf0b7\n\uf0b7\n\uf0b7\n\uf0b7\n\uf0b7\n\uf0b7\n\uf0b7 \uf0b7\n\uf0b7 \uf0b7\n\uf0b7\n\uf0b7\n\n\x0c54\n1. Moral and ethics\n\n2. Knowledge\n\n3. Intellectual skills\n\n4. Human relation\nskills and\nresponsibility\n\n5. Skills for\nmathematical\ncalculation,\ncommunication and\ninformation\ntechnology\nadeptness\n\nCourse\n\n1\n\n2', '3. Intellectual Skills', 'technological ideas are generated, developed and transformed into\nnew business products, processes, services and solutions that meet\nthe demands and establish marketplace advantage.\nLifelong Learning: RAI students will learn new technologies,\nmethodologies, and tools and adapt them to respond to the\nchallenges of a changing environment.\nLeadership: RAI students will apply their technical and innovative']","The curriculum aims to cultivate critical-thinking, communication, and collaboration skills as part of the 21st-century skills.","Creativity, critical-thinking, communication, and collaboration.",1.0,0.8640402883829098,0.5769230768942307,1.0
What is the 'next S-curve' industry mentioned in the importance of the program?,"['PART 2: SPECIFIC INFORMATION OF THE PROGRAM\n1. Philosophy, Importance, and Objectives of the Program\n1.1 Philosophy\nOur economy needs highly skilled engineers to support the growing worldwide digital economy.\nModern engineering programs must recognize state-of-the-art technologies and practices while inspiring', 'programs can extend their work from the alternative study programs. Each team of 1 to 4 students must\ndesign and implement a prototype of the proposed innovation. Measurements, simulations, and/ or\ncharacterization of the proposed solution is performed so as to demonstrate that the design objectives and', 'all industries on the verge of digital disruption. Existing businesses will have to adapt and innovatively\ntransform itself in order to stay competitive. Graduates from Robotics and AI will be the major driving\nforce of the transformation using their technical experts and understanding of the economic ecosystem\nand related processes.\n1.3 Program Educational Objectives', 'innovation (Thailand 4.0), and digital economy (Digital Thailand.) Digital industry including the field of\nIoT, Cloud, Embedded device, Robotics, AI has also been established as the next S-curve in developing\na new economy. Coupling with the ongoing innovations in global computing technology landscape,\nthere is a significant demand for high-quality graduates who are skillful in computing and innovation for', 'to coordinate with the faculty, institution, instructors and other programs in order to assign the teaching\nstrategies and contents along with the assessment of the program according to the key performance\nindicator to achieve the objectives of the program and to successfully produce innovative graduates.\nThe program committee will consult with members of the program’s industrial advisory board. The', 'This program is ready for announcement as qualified and standard program according to the qualification\nstandard of higher education in engineering in 2010 in 2022, as well as the ABET Accreditation in 2022\n8. Possible Career Path after Graduation\n- Roboticist or Robotic Engineer\n- Startup Entrepreneur in High Tech\n- Software Engineer for Mechatronics and Machines\n- System Engineer\n- Machine Vision Engineer', 'Indicator and Objective\n1. At least 80% of the executive program committee of the program\nparticipate in the meeting for planning, following and revising the\noperation of the program\n2. Having the details of the program consistent with the national or\ninternational standard of qualification for the program\n3. Having the course syllabus and details of each offered subject and', 'development of science technology, research, and innovation in order to reinforce the sustainable\ngrowth of the industrial part. The program also serves Thailand 4. 0 policy which emphasizes on\nintegrating emerging technology with current economy to enhance Thailand development and\nindustrially transform Thai economy, which will improve economic efficiency and generate new', '1. System for Educational Provision ...........................................................................................................................18\n2. Management of the Program...................................................................................................................................18', 'critical-thinking, communication and collaboration skills. Our students will be introduced to innovative\nmindsets, able to work with multidisciplinary teams and be leaders in their field of study. Our graduates\nwill be lifelong learners who are aware of technical and societal issues. They will be able to create\nengineering innovations with economics impact and benefit our society.\n1.2 Importance', 'in each academic year by collecting information from students and graduates, employers and/ or\nstakeholders, experts, industrial advisory boards or external evaluators.\n3. Evaluation of the Operation According to the Details of the Program\nHaving quality assurance system and provision of education according to the standard framework of', 'Program Achieving Standard According to the Quality\nFramework\n\n2021\n\nAchieving mandatory indicators no.1-5\ntotal indicators of 10\ntotal indicators of 10\n\n2022\n\ntotal indicators of 10\n\n2023\n\ntotal indicators of 11\n\n2024\n\ntotal indicators of 12\n\n2020\n\n\x0c67', 'c. Leadership: Our graduates will apply their technical and innovative leadership to establish\nsuccessful careers in their business, profession, and community.\nd. Economic Impact: Our graduates will apply their technical expertise, leadership, and\ninnovative mindset to support and strengthen the society’s economic well-being.', 'innovation. Therefore, it is necessary to increase the capacity of digitally-literate, innovative computer\nengineering workforce who understands the technological foundation as well as the surrounding\neconomic ecosystem. Our new economy will require a highly- skilled engineer who can adapt and\ntransform innovative engineering into a working solution that can be applied and enhance economic', 'board will be able to provide general guidelines, industrialtrends, and demands which will help to keep\nthe content of the program relevant to the current state of the art in the industry 4.0.', 'ENGINEERING AND PUBLIC POLICY\n3 (3-0-6)\nPREREQUISITE: NONE\nThis course examines the processes of public and private decision making which affects\nthe evolution of a technology. While technology has an important role in shaping today’s society, the social', 'to adapt to the change in the economy, society, and culture. It also directly reflects the mission of the\nInstitute to be the “ Master of Innovation and the Corner Stone of Fundamental,” in the aspects of\neducation, research, academic service and preservation of art and culture. The program also serves the\nmission of Faculty of Engineering in producing scholars with academic excellence according to the', 'SUBJECT\n\nCREDITS (L-E-S)\n\n01416801\n\nMATHEMATICS OF DATA SCIENCE AND DATA ANALYTIC\n(GENED, SCIENCE & MATHEMATICS ELECTIVE)\n\n3 (3-0-6)\n\n01416306\n\nSAFTY AND STANDARDIZATION IN RAI\n\n3 (3-0-6)\n\n01416319\n\nMANUFACTURING PROCESS\n\n3 (3-0-6)\n\n01006718\n\nDISCRETE MATHEMATICS (RAI Elective mandatory\nSubject)\n\n3 (3-0-6)\n\n0141XXXX\n\nRAI Elective mandatory subject\n\n3 (3-0-6)\n\n0141XXXX\n\nRAI Elective subject\n\n3 (3-0-6)', '(Executive Program Committee) .................................................................................................................................... 6\n10. Location of Study ...................................................................................................................................................... 9', 'D.Eng. (International Development Engineering), Tokyo Institute\nof Technology, Japan, 2008\nM.Eng. (Electrical Engineering), King Mongkut’s Institute\nTechnology Ladkrabang, 2000\nB.Eng. (Telecommunication Engineering), King Mongkut’s\nInstitute Technology Ladkrabang, 1998']","The 'next S-curve' industry mentioned in the importance of the program includes the digital industry fields such as IoT, Cloud, Embedded device, Robotics, and AI.","Digital industry (IoT, Cloud, Robotics, AI).",1.0,0.902199603726402,0.4166666666458333,1.0
What does 'PEO' stand for in the context of the program?,"['1. System for Educational Provision ...........................................................................................................................18\n2. Management of the Program...................................................................................................................................18', 'PART 2: SPECIFIC INFORMATION OF THE PROGRAM ..............................................................................................11\n1. Philosophy, Importance, and Objectives of the Program .................................................................................11', 'Indicator and Objective\n1. At least 80% of the executive program committee of the program\nparticipate in the meeting for planning, following and revising the\noperation of the program\n2. Having the details of the program consistent with the national or\ninternational standard of qualification for the program\n3. Having the course syllabus and details of each offered subject and', 'PART 3: SYSTEM FOR EDUCATIONAL PROVISION, MANAGEMENT, AND STRUCTURE OF THE\nPROGRAM .............................................................................................................................................................................18', 'Table of Contents\nPART 1: GENERAL INFORMATION .................................................................................................................................... 4\n1. Name of the Program .................................................................................................................................................. 4', '6. Status of the Program and Consideration for the Authorization/Agreement................................................. 5\n7. Readiness for Publicization as Qualified and Standardized Program ............................................................... 5', 'in each academic year by collecting information from students and graduates, employers and/ or\nstakeholders, experts, industrial advisory boards or external evaluators.\n3. Evaluation of the Operation According to the Details of the Program\nHaving quality assurance system and provision of education according to the standard framework of', 'PART 8: EVALUATION AND IMPROVEMENT OF THE OPERATION OF THE PROGRAM ...................................65\n1. Assessment of the Effectiveness of the Teaching ..............................................................................................65\n2. Evaluation of the Program as a Whole Picture ...................................................................................................65\n\n\x0c3', 'PART 1: GENERAL INFORMATION\n1. Name of the Program\nName of the program (Thai):\nName of the program (English):\n2. Degree and Major\nFull name (Thai):\nFull name (English):\nAbbreviation (Thai):\nAbbreviation (English):', 'to coordinate with the faculty, institution, instructors and other programs in order to assign the teaching\nstrategies and contents along with the assessment of the program according to the key performance\nindicator to achieve the objectives of the program and to successfully produce innovative graduates.\nThe program committee will consult with members of the program’s industrial advisory board. The', '6\n\n9. Name, Surname, ID Number, Position, and Qualification of Instructors Responsible for the Program (Executive Program Committee)\nName-Surname\n(Academic Position)\nID Number\n\nQualification (Department), University,\nYear of Graduation\n\nAcademic Achievements\n\nDr. Poom Konghuayrob', 'PART 2: SPECIFIC INFORMATION OF THE PROGRAM\n1. Philosophy, Importance, and Objectives of the Program\n1.1 Philosophy\nOur economy needs highly skilled engineers to support the growing worldwide digital economy.\nModern engineering programs must recognize state-of-the-art technologies and practices while inspiring', 'PART 7: QUALITY ASSURANCE OF THE PROGRAM ..................................................................................................61\n1. Standardization ...........................................................................................................................................................61', 'E. Facilities Supported Teaching and Learning…………………………………………………………………………..….……. 121\nF. Reason for Requesting to Revise Curriculum……………………………………..……………………........……..….……. 129\nG. List of Program Development Committees……………………………………………………………………………………… 137\nH. The Academic Publication of Instructors Responsible for The Program……………………………………….. 139', 'regarded as the student’ s supervisor. The student must report progress to the supervisor regularly. Upon\ncompletion, the student must prepare and deliver oral presentations describing the work from the program.\n01006302', 'INDUSTRIAL EXPERIENCE FOR ENGINEERS\n3 (0-16-0)\nPREREQUISITE: 01006301 COOPERATIVE EDUCATION\nExposure to Professional Practice (EPP), or Industrial Experience (IE), provides an\nopportunity to gain valuable hands-on training and experience in real world situations. Additionally, through\nexposure to current practice, students can reflect on, and appreciate the linkage between curriculum and', '(Executive Program Committee) .................................................................................................................................... 6\n10. Location of Study ...................................................................................................................................................... 9', '5.3 Time Period\nThe 4th academic year.\n5.4 Credits\n6 Credits\n5.5 Preparation\nThe proposal must be proposed with the approval of the program committee.\n5.6 Evaluation Process\nAn evaluation is provided by a committee, which consists of instructors in the program by arranging\nan examination in each semester.\n6. Additional Costs', 'Program Achieving Standard According to the Quality\nFramework\n\n2021\n\nAchieving mandatory indicators no.1-5\ntotal indicators of 10\ntotal indicators of 10\n\n2022\n\ntotal indicators of 10\n\n2023\n\ntotal indicators of 11\n\n2024\n\ntotal indicators of 12\n\n2020\n\n\x0c67', 'General Education\n01416000 Academic Listening and Speaking\n01416001 Academic Reading and Writing\n01416003 Interpretation and Arguments\n01006502 Professional Ethics\n01006503 Introduction to Psychology\n01006504 Philosophy of Science\n01006505 Creative Thinking\n01006506 Critical Thinking\n01006507 Personal Economics\n01006508 Digital Economy\n01006509 Engineering and Public Policy']","Sorry, My knowledge base does not contain the answer to this question.",Program Educational Objectives.,1.0,0.0,0.0,0.0
What is Program Educational Objective (a)?,"['to coordinate with the faculty, institution, instructors and other programs in order to assign the teaching\nstrategies and contents along with the assessment of the program according to the key performance\nindicator to achieve the objectives of the program and to successfully produce innovative graduates.\nThe program committee will consult with members of the program’s industrial advisory board. The', ""47\n\n2. Development of Learning Results in Each Aspect\nAs the RAI program's developmental objective is to meet ABET stipulated standards, a learning outcome is designed by the ABET Criterion for Student Outcomes\n(a-k) of which aim to prepare graduates to attain program educational objectives.\nDomains\n\nLearning Results\n\nTeaching Strategies\n\nHonesty"", 'Indicator and Objective\n1. At least 80% of the executive program committee of the program\nparticipate in the meeting for planning, following and revising the\noperation of the program\n2. Having the details of the program consistent with the national or\ninternational standard of qualification for the program\n3. Having the course syllabus and details of each offered subject and', '1. System for Educational Provision ...........................................................................................................................18\n2. Management of the Program...................................................................................................................................18', 'PART 2: SPECIFIC INFORMATION OF THE PROGRAM ..............................................................................................11\n1. Philosophy, Importance, and Objectives of the Program .................................................................................11', 'PART 3: SYSTEM FOR EDUCATIONAL PROVISION, MANAGEMENT, AND STRUCTURE OF THE\nPROGRAM .............................................................................................................................................................................18', '1.3 Program Educational Objectives\nBachelor of Engineering Program in Robotics and AI emphasizes on the production of graduates\nwith the following qualifications:\na. Engineering Quality: Our graduates will apply engineering practice, combined with the\ninnovative process, to identify and solve significant problems across a broad range of applications.', 'in each academic year by collecting information from students and graduates, employers and/ or\nstakeholders, experts, industrial advisory boards or external evaluators.\n3. Evaluation of the Operation According to the Details of the Program\nHaving quality assurance system and provision of education according to the standard framework of', 'PART 8: EVALUATION AND IMPROVEMENT OF THE OPERATION OF THE PROGRAM\n1. Assessment of the Effectiveness of the Teaching\n1.1 Evaluation of Teaching Strategies\na. Teaching instructor evaluates the teaching strategies according to the assigned plan.\nb. Teaching instructor analyzes the result of the students’ evaluation of instructor’ s teaching\nstrategies.', 'PART 8: EVALUATION AND IMPROVEMENT OF THE OPERATION OF THE PROGRAM ...................................65\n1. Assessment of the Effectiveness of the Teaching ..............................................................................................65\n2. Evaluation of the Program as a Whole Picture ...................................................................................................65\n\n\x0c3', 'qualification for higher education as well as ABET Accreditation by having key performance indicators and\nassessment criteria assigned by the Internal QA committee.\n4. Revision of the Evaluation and Improvement Plan\nThe executive program committees utilize the results of analysis and revision to create an improvement', 'PART 7: QUALITY ASSURANCE OF THE PROGRAM\n1. Standardization\nThe curriculum management is by the qualified and standardized program according to the qualification\nstandard of higher education as well as the ABET Accreditation throughout the duration of administration\nof the program.\n1.1 Executive program committee: there are no fewer than 5 persons who have either a direct', 'Having an assessment of the instructor’ s skills in devising teaching strategies by students. The\nresults of the evaluation will be used for the improvement of aforementioned skills of instructors.\n2. Evaluation of the Program as a Whole Picture\nThe executive program committees evaluate the program as a whole picture when the teaching ends', '65\n6.4 Evaluation of Resource Sufficiency\nObjective\n\nOperation\n\nEvaluation\n\n1. The Faculty surveys the needs\nfor educational resources\n\nHaving educational resources\nsufficient to the needs', '3. Student Outcomes\nThe program in Robotics and AI must have documented student outcomes that prepare graduates to\nattain the program educational objectives which adhere to ABET student outcomes for the engineering\nprogram.\n(1) an ability to apply knowledge of mathematics, science, and engineering\n(2) an ability to design and conduct experiments, as well as to analyze and interpret data', '1. Bachelor of Engineering Program is designed to\nqualification standard of higher education by Ministry of\nEducation (MoE) and Accreditation Board for Engineering\nand Technology (ABET)\n2. The total number of courses where at least 50 percent\nor more of class time is carried out through active learning.\n3. The total number of courses with an integrated\neducation system.', '1. Adjusting engineering to an Outcome-based\ncurriculum by ABET guidelines for undergraduate,\ngraduate and doctoral degrees.\n2. Organize Student Centric teaching-learning\nenvironments to facilitate and maximize active\nlearning.\n3. Facilitate authentic learning or work integrated\nteaching-learning environments.\n4. Incorporate PBL (Problem Based Learning/Project', '- Verify the learning achievement according to the program objectives and outcomes.\n- Report the verification of the learning achievement to the program committee.\nProgram committee takes theresponsible figure for the verification of learning\nachievement at the curriculum level with the following roles:\n- Verify employment status of graduates working directly in the field.', 'Strategy or Activity of Students\n\uf0b7\n\n\uf0b7\n\n\uf0b7', 'PART 3: SYSTEM FOR EDUCATIONAL PROVISION, MANAGEMENT,\nAND STRUCTURE OF THE PROGRAM\n1. System for Educational Provision\n1.1 System\nAn academic year has two semesters, each of which covers not less than 15 weeks (excluding the\nexamination weeks). The summer semester is optional. Most courses are offered on the main campus']","Program Educational Objective (a) is ""Engineering Quality: Our graduates will apply engineering practice, combined with the innovative process, to identify and solve significant problems across a broad range of applications.""",Apply engineering practice to solve significant problems.,1.0,0.9999999999999998,0.14285714284285714,1.0
What is Program Educational Objective (e)?,"['Indicator and Objective\n1. At least 80% of the executive program committee of the program\nparticipate in the meeting for planning, following and revising the\noperation of the program\n2. Having the details of the program consistent with the national or\ninternational standard of qualification for the program\n3. Having the course syllabus and details of each offered subject and', '1. System for Educational Provision ...........................................................................................................................18\n2. Management of the Program...................................................................................................................................18', 'to coordinate with the faculty, institution, instructors and other programs in order to assign the teaching\nstrategies and contents along with the assessment of the program according to the key performance\nindicator to achieve the objectives of the program and to successfully produce innovative graduates.\nThe program committee will consult with members of the program’s industrial advisory board. The', ""47\n\n2. Development of Learning Results in Each Aspect\nAs the RAI program's developmental objective is to meet ABET stipulated standards, a learning outcome is designed by the ABET Criterion for Student Outcomes\n(a-k) of which aim to prepare graduates to attain program educational objectives.\nDomains\n\nLearning Results\n\nTeaching Strategies\n\nHonesty"", 'qualification for higher education as well as ABET Accreditation by having key performance indicators and\nassessment criteria assigned by the Internal QA committee.\n4. Revision of the Evaluation and Improvement Plan\nThe executive program committees utilize the results of analysis and revision to create an improvement', 'PART 3: SYSTEM FOR EDUCATIONAL PROVISION, MANAGEMENT, AND STRUCTURE OF THE\nPROGRAM .............................................................................................................................................................................18', 'in each academic year by collecting information from students and graduates, employers and/ or\nstakeholders, experts, industrial advisory boards or external evaluators.\n3. Evaluation of the Operation According to the Details of the Program\nHaving quality assurance system and provision of education according to the standard framework of', 'PART 2: SPECIFIC INFORMATION OF THE PROGRAM ..............................................................................................11\n1. Philosophy, Importance, and Objectives of the Program .................................................................................11', 'PART 7: QUALITY ASSURANCE OF THE PROGRAM\n1. Standardization\nThe curriculum management is by the qualified and standardized program according to the qualification\nstandard of higher education as well as the ABET Accreditation throughout the duration of administration\nof the program.\n1.1 Executive program committee: there are no fewer than 5 persons who have either a direct', '65\n6.4 Evaluation of Resource Sufficiency\nObjective\n\nOperation\n\nEvaluation\n\n1. The Faculty surveys the needs\nfor educational resources\n\nHaving educational resources\nsufficient to the needs', 'Having an assessment of the instructor’ s skills in devising teaching strategies by students. The\nresults of the evaluation will be used for the improvement of aforementioned skills of instructors.\n2. Evaluation of the Program as a Whole Picture\nThe executive program committees evaluate the program as a whole picture when the teaching ends', '1.3 Program Educational Objectives\nBachelor of Engineering Program in Robotics and AI emphasizes on the production of graduates\nwith the following qualifications:\na. Engineering Quality: Our graduates will apply engineering practice, combined with the\ninnovative process, to identify and solve significant problems across a broad range of applications.', 'PART 8: EVALUATION AND IMPROVEMENT OF THE OPERATION OF THE PROGRAM ...................................65\n1. Assessment of the Effectiveness of the Teaching ..............................................................................................65\n2. Evaluation of the Program as a Whole Picture ...................................................................................................65\n\n\x0c3', '1. Bachelor of Engineering Program is designed to\nqualification standard of higher education by Ministry of\nEducation (MoE) and Accreditation Board for Engineering\nand Technology (ABET)\n2. The total number of courses where at least 50 percent\nor more of class time is carried out through active learning.\n3. The total number of courses with an integrated\neducation system.', 'E. Facilities Supported Teaching and Learning…………………………………………………………………………..….……. 121\nF. Reason for Requesting to Revise Curriculum……………………………………..……………………........……..….……. 129\nG. List of Program Development Committees……………………………………………………………………………………… 137\nH. The Academic Publication of Instructors Responsible for The Program……………………………………….. 139', 'PART 8: EVALUATION AND IMPROVEMENT OF THE OPERATION OF THE PROGRAM\n1. Assessment of the Effectiveness of the Teaching\n1.1 Evaluation of Teaching Strategies\na. Teaching instructor evaluates the teaching strategies according to the assigned plan.\nb. Teaching instructor analyzes the result of the students’ evaluation of instructor’ s teaching\nstrategies.', 'ABET Student Outcomes\n\n1. Moral and Ethics\n\n(8) an understanding of professional and ethical responsibility\n(6) the broad education necessary to understand the impact of engineering solutions in a global, economic,\nenvironmental, and societal context\n\n2. Knowledge', '3. Student Outcomes\nThe program in Robotics and AI must have documented student outcomes that prepare graduates to\nattain the program educational objectives which adhere to ABET student outcomes for the engineering\nprogram.\n(1) an ability to apply knowledge of mathematics, science, and engineering\n(2) an ability to design and conduct experiments, as well as to analyze and interpret data', 'extended internship experience. Interested students should contact the department or the program\ncommittee regarding the current policies and the requirements. While on the Co- Op assignment, the\nstudents are participating in a recognized educational program and retain their full-time student status.\n4.1 Standard for Learning Outcome from Field Experience', '1. Adjusting engineering to an Outcome-based\ncurriculum by ABET guidelines for undergraduate,\ngraduate and doctoral degrees.\n2. Organize Student Centric teaching-learning\nenvironments to facilitate and maximize active\nlearning.\n3. Facilitate authentic learning or work integrated\nteaching-learning environments.\n4. Incorporate PBL (Problem Based Learning/Project']","Sorry, My knowledge base does not contain the answer to this question.",Learn new technologies to respond to a changing environment.,0.0,0.0,0.0,0.0
How many weeks are in a standard academic semester?,"['PART 3: SYSTEM FOR EDUCATIONAL PROVISION, MANAGEMENT,\nAND STRUCTURE OF THE PROGRAM\n1. System for Educational Provision\n1.1 System\nAn academic year has two semesters, each of which covers not less than 15 weeks (excluding the\nexamination weeks). The summer semester is optional. Most courses are offered on the main campus', '3.1.3 Subjects\nOne academic credit is given to a course offered in a single semester which\n- Meets in class for lecture or discussion for 1 hour per week; or\n- Contains at least 3 laboratory hours per week.\nMost courses are given 3 or more credits. For 4 credit courses, these courses usually contain 3\nhours of lecture or discussion per week. The courses are also accompanied with 1 additional hour', 'Academic Year', '0 (0-45-0)\n\nCredit Notation: (L - E - S)\n\nL = Lecture / Learning hours, E = Laboratory hours, S = Self-study hours\nThis study plan shows courses with credits equivalent to 3. However, students can register 4 credit courses\nas well. The total number of credits in each subject category will be counted toward the graduation.\n\n\x0c31\n\n1st YEAR 1st SEMESTER\nCODE\n\nSUBJECT\n\nCREDITS (L-E-S)\n\n01416316', 'of recitation or 3 hours of laboratory work per week. Students enrolled in the courses are also\nexpected to spend at least 8 hours outside the class/ lab for studying and completing the\ncoursework.\nThe instructor-led lecture could be delivered as a traditional lecture or include learning\nactivities in which the students can actively participate. The recitation is a compliment to a lecture', '4.2 Time Period\nInternship: Summer Course of the 1st, 2nd, or 3rd academic year\nCo-Operative Education: the 1st Semester of the 4th academic year\n4.3 Time Management and Scheduling\n8 weeks for Internship or full-time for one semester for Co-Operative Education\n5. Regulations for Special Project or Co-Operative Education', '2. Teaching obligations\n12hours/weekly', '5.3 Time Period\nThe 4th academic year.\n5.4 Credits\n6 Credits\n5.5 Preparation\nThe proposal must be proposed with the approval of the program committee.\n5.6 Evaluation Process\nAn evaluation is provided by a committee, which consists of instructors in the program by arranging\nan examination in each semester.\n6. Additional Costs', 'during the day. Some courses or laboratory hours may be offered in the evening or weekend.\n1.2 Provision of Summer Course\nSummer courses will be offered based on instructors’ availability and students’ need.\n1.3 System Transfer of Credits in Two-Semester System\nCredits can be transferred, upon the consent of executive program committee, according to the', 'planned activities ( if any) at least before the opening of each semester\nfor all subjects\n4. Filing program review and report for the operation of each subject and\nfield experience (if any) within 30 days after the end of the semester for\nall subjects\n5. Filing report of the operation of the program according to SSRwithin 6 0\ndays after the end of the academic year', '3 (0-9-5)\n\nTOTAL CREDITS\n\n15\n\n3rd YEAR 3rd SEMESTER (SUMMER)\nCODE\n01006805\n\nSUBJECT\nINDUSTRIAL INTERNSHIP\nTOTAL CREDITS\n\nCREDITS (L-E-S)\n0 (0-45-0)\n0\n\n\x0c34\n\nFOR REGULAR STUDENTS\n4th YEAR 1st SEMESTER\nCODE\n\nSUBJECT\n\nCREDITS (L-E-S)\n\nXXXXXXX\n\n(FREE ELECTIVE)\n\n3 (X-X-X)\n\nXXXXXXX\n\n(GENED ELECTIVE)\n\n3 (3-0-6)\n\n0141XXXX\n\nRAI Elective mandatory subject\n\n3 (3-0-6)\n\n0141XXXX\n\nRAI Elective subject\n\n3 (3-0-6)', '20\n\n2.5 Admission Plan and Estimated Graduation in 5 Years\nAcademic Year\nNumber of Students\n1st year\n\n2020\n\n2021\n\n2022\n\n2023\n\n2024\n\n60\n\n30\n\n30\n\n30\n\n30\n\n60\n\n30\n\n30\n\n30\n\n60\n\n30\n\n30\n\n60\n\n30\n\n2nd year\n3rd year\n4th year\nTotal\n\n60\n\n90\n\n120\n\n150\n\n120\n\nEstimated to Graduate\n\n-\n\n-\n\n-\n\n60\n\n30\n\n2.6 Planned Budget\nAcademic Year\n2020\n\n2021\n\n2022\n\n2023\n\n2024\n\n1. Personnel\n\n2,157,500\n\n2,912,917\n\n3,879,250\n\n4,119,250', 'August – December\n2nd semester:\nJanuary – May\nSummer course: June – July\n* The actual start and end dates for each academic year will be announced by the office of the\nregistrar.\n2.2 Qualification of Applicants\nThe general admission process starts from October. RAI classes will begin in August of the following\nyear. Prospective students are required to satisfy the following requirements:', '3. Criteria for Graduation According to the Program ..............................................................................................59\nPART 6: DEVELOPMENT OF INSTRUCTORS ................................................................................................................60', '3. Major Field\nNone\n4. Total Credits\nAt least 131 credits\n5. Type of the Program\n5.1 Level\n4-Year Bachelor Program\n5.2 Program Category\n\uf0fe Academic bachelor’s degree program\n\uf0fe Academic bachelor’s degree program\n\uf06f Advanced academic bachelor’s degree program\n\n\x0c5', '23\n\n3.1 Curriculum\n3.1.1 Minimum Credits Required for Graduation\n3.1.2 Curriculum Structure (Minimum Credits)\n\n131\n\ncredits\n\n(For UoB 2+2 Program Students)\n\nCredits\n(For Co-op / Study\nAboard Students)\n\n30\n\n30\n\nA1. English Proficiency Requirement (ESL)\n\n9\n\n9\n\nA2. Communication, Humanity, and Social Skills\n\n15\n\n15\n\nA3. Math and Science\n\n6\n\n6\n\n95\n\n95\n\nB1. Core Courses\n\n20\n\n20\n\nB2. Major Compulsory Courses', '6 CREDITS\n\n\x0c30\n\n01006301\n01006302\n01006304\n\nCOOPERATIVE EDUCATION\nSTUDY ABROAD\nOVERSEA TRAINING\n\n6 (0-45-0)\n6 (6-0-12)\n6 (0-45-0)\n\nC. FREE ELECTIVES\n\n6 CREDITS\n\nStudents must complete at least 6 additional credits from any courses offered by the\ninstitution.\nD. RAI INTERNSHIP\n01006805\n\n0 CREDITS\nINDUSTRIAL INTERNSHIPS\n\n3.1.4 Recommended Study Plan\n\n0 (0-45-0)\n\nCredit Notation: (L - E - S)', 'The outcomes can be presented progressively by following yearly basis as articulately shown in Table\nbelow.\nYear\n\nExpected Learning Outcomes\n\uf0b7\n\n1\n\n\uf0b7\n\uf0b7\n\n\uf0b7\n\n2\n\n\uf0b7', '2. The Faculty provides an annual\nbudget for the provision of\ntextbooks, educational media,\naudiovisual equipment, durable\narticles, computers,etc.\n3. Procuring educational resources\nto satisfy the need as proper to\neach program\n\nEvaluation of sufficiency\nfor durable articles, equipment,\nbooks and educational\ndocument by students and\ninstructors\n\n7. Key Performance Indicators\nAcademic Year', 'days after the end of the academic year\n6. Having verification of learning achievement at least 2 5 % of the subjects\nopen in each academic year\n7. Having development/ revision of the education, teaching strategies or\nevaluation of learning from the result of the assessment of operation\nreported in the SSR of the previous year']",A standard academic semester covers not less than 15 weeks (excluding the examination weeks).,Not less than 15 weeks.,1.0,0.8758665367504425,0.9999999999,1.0
When is the summer course typically held?,"['August – December\n2nd semester:\nJanuary – May\nSummer course: June – July\n* The actual start and end dates for each academic year will be announced by the office of the\nregistrar.\n2.2 Qualification of Applicants\nThe general admission process starts from October. RAI classes will begin in August of the following\nyear. Prospective students are required to satisfy the following requirements:', 'during the day. Some courses or laboratory hours may be offered in the evening or weekend.\n1.2 Provision of Summer Course\nSummer courses will be offered based on instructors’ availability and students’ need.\n1.3 System Transfer of Credits in Two-Semester System\nCredits can be transferred, upon the consent of executive program committee, according to the', '4.2 Time Period\nInternship: Summer Course of the 1st, 2nd, or 3rd academic year\nCo-Operative Education: the 1st Semester of the 4th academic year\n4.3 Time Management and Scheduling\n8 weeks for Internship or full-time for one semester for Co-Operative Education\n5. Regulations for Special Project or Co-Operative Education', 'PART 3: SYSTEM FOR EDUCATIONAL PROVISION, MANAGEMENT,\nAND STRUCTURE OF THE PROGRAM\n1. System for Educational Provision\n1.1 System\nAn academic year has two semesters, each of which covers not less than 15 weeks (excluding the\nexamination weeks). The summer semester is optional. Most courses are offered on the main campus', '2. Teaching obligations\n12hours/weekly', 'Academic Year', 'of recitation or 3 hours of laboratory work per week. Students enrolled in the courses are also\nexpected to spend at least 8 hours outside the class/ lab for studying and completing the\ncoursework.\nThe instructor-led lecture could be delivered as a traditional lecture or include learning\nactivities in which the students can actively participate. The recitation is a compliment to a lecture', 'participating in research projects with research labs or academic institutions, or working toward the\nentrepreneurship with incubators. The program committee will annually release the policies regarding the\neligibility and the conditions required to complete the requirement.\nStudents who participate in an alternative study program as Co- Operative Education can do a 16- week', 'Course\n\n1\n09106404 Solar Cell and Nanostructure\nPhotovoltaic\n09106405 LAB-ON-CHIP Technology\n09106406 Microelectromechanical System\n09106407 Chemistry\nAlternative Study Courses\n01006301 Cooperative Education\n01006302 Study Abroad\nIndustrial Internship\n01006805 Industrial Internship\nTotal\n\n2\n\n3\n\n4\n\n5\n\n1\n\n2\n\n3\n\n4\n\n5\n\n1\n\n2\n\n3\n\n4\n\n5\n\n1\n\n2\n\n3\n\n4\n\n5\n\n1\n\n2\n\n3\n\n4\n\n5\n\n\uf0b7 \uf0b7 \uf0b7\n\n\uf0b7 \uf0b7 \uf0b7\n\n\uf0b7 \uf0b7 \uf0b7 \uf0b7 \uf0b7 \uf0b7 \uf0b7\n\n\uf0b7 \uf0b7\n\n\uf0b7 \uf0b7 \uf0b7 \uf0b7 \uf0b7', '5.3 Time Period\nThe 4th academic year.\n5.4 Credits\n6 Credits\n5.5 Preparation\nThe proposal must be proposed with the approval of the program committee.\n5.6 Evaluation Process\nAn evaluation is provided by a committee, which consists of instructors in the program by arranging\nan examination in each semester.\n6. Additional Costs', '3.1.3 Subjects\nOne academic credit is given to a course offered in a single semester which\n- Meets in class for lecture or discussion for 1 hour per week; or\n- Contains at least 3 laboratory hours per week.\nMost courses are given 3 or more credits. For 4 credit courses, these courses usually contain 3\nhours of lecture or discussion per week. The courses are also accompanied with 1 additional hour', 'extended internship experience. Interested students should contact the department or the program\ncommittee regarding the current policies and the requirements. While on the Co- Op assignment, the\nstudents are participating in a recognized educational program and retain their full-time student status.\n4.1 Standard for Learning Outcome from Field Experience', 'Strategy or Activity of Students\n\uf0b7\n\n\uf0b7\n\n\uf0b7', 'planned activities ( if any) at least before the opening of each semester\nfor all subjects\n4. Filing program review and report for the operation of each subject and\nfield experience (if any) within 30 days after the end of the semester for\nall subjects\n5. Filing report of the operation of the program according to SSRwithin 6 0\ndays after the end of the academic year', 'where students can discuss and ask the recitation leader questions to clarify concepts, facts, or\nproblem sets from the lecture. The laboratory hours give students the opportunity to learn from\nhands-on experience using specialized equipment or software related to the course’s contents.\nMeaning of the Subject Codes\nSubject Codes are assigned with 8 digits as follows:\n1st, 2nd digit:\n3rd, 4th digit\n5th\ndigit', ""for the duration of the program.\n3.2 The activities are organized to develop students' knowledge, abilities and potential in various ways\nto support 21st-century learning skills.\n3.3 A consultant, who is appointed for academic counseling and guidance to all students, must\nschedule an appointment (Office Hours) for the student to consult."", 'Regulation of King Mongkut’s Institute of Technology Ladkrabang regarding bachelor degree education\nyear 2016 (Appendix A), and the Announcement of King Mongkut’s Institute of Technology Ladkrabang\nregarding the cross-institute registration of higher education (Appendix B).\n2. Management of the Program\n2.1 Date-Time of the Course\n1st semester:\nAugust – December\n2nd semester:\nJanuary – May', '5.3 Medium of Instruction\nEnglish\n5.4 Admission\nThai and/or Foreign students\n5.5 Collaboration with Other Institutes\nThe program is in collaboration with many universities according to the memorandum of\nunderstanding (MOU) such as College of Engineering, Carnegie Mellon University, the University of South', '3 (0-9-5)\n\nTOTAL CREDITS\n\n15\n\n3rd YEAR 3rd SEMESTER (SUMMER)\nCODE\n01006805\n\nSUBJECT\nINDUSTRIAL INTERNSHIP\nTOTAL CREDITS\n\nCREDITS (L-E-S)\n0 (0-45-0)\n0\n\n\x0c34\n\nFOR REGULAR STUDENTS\n4th YEAR 1st SEMESTER\nCODE\n\nSUBJECT\n\nCREDITS (L-E-S)\n\nXXXXXXX\n\n(FREE ELECTIVE)\n\n3 (X-X-X)\n\nXXXXXXX\n\n(GENED ELECTIVE)\n\n3 (3-0-6)\n\n0141XXXX\n\nRAI Elective mandatory subject\n\n3 (3-0-6)\n\n0141XXXX\n\nRAI Elective subject\n\n3 (3-0-6)', '- The program has been endorsed by the Academic Committee of KMITL in its meeting on 23 June\n2020, 6/2020\n- This program has been approved by the University Council in the 7/2020 meeting no 21st August\n2020\n- This program has started on 1st semester of academic year 2018 (August, 20118)\n7. Readiness for Publication as Qualified and Standardized Program']",The summer course is typically held from June to July.,June - July.,1.0,1.0,0.8333333332916666,1.0
What is the minimum high-school requirement for applicants?,"['23\n\n3.1 Curriculum\n3.1.1 Minimum Credits Required for Graduation\n3.1.2 Curriculum Structure (Minimum Credits)\n\n131\n\ncredits\n\n(For UoB 2+2 Program Students)\n\nCredits\n(For Co-op / Study\nAboard Students)\n\n30\n\n30\n\nA1. English Proficiency Requirement (ESL)\n\n9\n\n9\n\nA2. Communication, Humanity, and Social Skills\n\n15\n\n15\n\nA3. Math and Science\n\n6\n\n6\n\n95\n\n95\n\nB1. Core Courses\n\n20\n\n20\n\nB2. Major Compulsory Courses', 'through the meeting with their academic advisor for their master program. If a student does not meet\nthe GPA criteria of 3.00, he or she is eligible to his/her petition into the program during his or her fourth\nyear with the permission of their academic advisor.', 'occupational or professional skill and life skills.\n3. Criteria for Graduation According to the Program\nStudents must complete at least 131 credits to graduate with at least 30 credits from general education\ncourses; at least 95 credits from Robotics and AI concentration and at least 6 credits of free electives and', 'a. Complete high-school education or equivalent study record. Students must also provide\nthe latest official transcript for their highest level of education. Students must provide the proof of\ncompletion (an official diploma or a certificate of completion) from their high-school education or\nequivalent study before their enrollment.', '3. Major Field\nNone\n4. Total Credits\nAt least 131 credits\n5. Type of the Program\n5.1 Level\n4-Year Bachelor Program\n5.2 Program Category\n\uf0fe Academic bachelor’s degree program\n\uf0fe Academic bachelor’s degree program\n\uf06f Advanced academic bachelor’s degree program\n\n\x0c5', '3. Student\n3.1 There is appropriate student admissions process by defining the criteria and\nqualifications for the students by the curriculum. Moreover,there is preparation course to\nensure that students are ready for their studies and to be able to complete theireducation\nfor the duration of the program.', '3. Criteria for Graduation According to the Program ..............................................................................................59\nPART 6: DEVELOPMENT OF INSTRUCTORS ................................................................................................................60', '1. Regulations or Criteria for Grading ..........................................................................................................................59\n2. Verification of Learning Achievement ....................................................................................................................59', 'PROBABILITY AND STATISTICS 2\n3 (3-0-6)\nPREREQUISITE: 01006719 PROBABILITY AND STATISTICS 1\nTest of hypotheses based on a single sample, inferences based on two samples, analysis of\nvariance, multifactor analysis of variance, simple linear regression and correlation, nonlinear and multiple\nregression, goodness-of-fit tests and categorical data analysis.\n\n01006721', '3 (0-9-5)\n\nTOTAL CREDITS\n\n15\n\nTotal credits required for graduation at least\n\n3.1.5 Details of Each Subject\nCourse description (Appendix C)\n\n131\n\ncredits\n\n\x0c36\n\n3.2 Name, Surname, ID Number, Position, and Qualification of Instructors\n3.2.1 Executive Program Committees\nName-Surname\n(Academic Position)\nID Number\nAssoc. Prof. Dr. Pitikhate Sooraksa\n(Electrical Engineering)', 'and freedom compared to high schools.\nb. Tuition fees and other financial requirements.\nc. Diverse ethnicity as backgrounds varies from student to student regarding culture, social\nand academic upbringing, all of which influences social bonding and communication effectiveness,\nlearning and self-development.\n2.4 Strategies for Solving the Issues/Limitation of the Students in 2.3', 'qualification or a related field of study. Their qualification is minimum as Master Degree or equivalent,\nor academic positions no lower than Assistant Professor. Moreover, they have at least one academic\nresults published by the criteria established for the academic position in the past 5 years.\n1.2 Course Instructor: they have direct or indirect qualification Minimum Master Degree or equivalent,', 'ENGINEERING MATHEMATICS 3\nPREREQUISITE: NONE\n\n4 (4-0-8)', '4. Component Regarding Field Experience (Internship or Co-Operative Education).......................................43\n5. Regulations for Special Project or Co-Operative Education .............................................................................43', 'Ladkrabang regarding bachelor degree education year 2016 (Appendix A).\n2.10 Integrated Master/Bachelor Program\nIf a student is in the 2nd semester of their third year of study or has completed at least 81 credits,\nwith the overall GPA of at least 3. 00, the student is guaranteed admission into the integrated\nmaster/ bachelor program in the department. The student must also complete the admission form', 'Estimated expenditure per person for producing a scholar according to the program equals\nto an average of 194,613 baht/person/year.\n2.7 Educational System\nClass room\n2.8 Transfer of Credits, Subjects and Cross- Institute Registration of Higher Education\n(if any)\nCredits can be transferred, upon the consent of executive program committee, according to the', '20\n\n2.5 Admission Plan and Estimated Graduation in 5 Years\nAcademic Year\nNumber of Students\n1st year\n\n2020\n\n2021\n\n2022\n\n2023\n\n2024\n\n60\n\n30\n\n30\n\n30\n\n30\n\n60\n\n30\n\n30\n\n30\n\n60\n\n30\n\n30\n\n60\n\n30\n\n2nd year\n3rd year\n4th year\nTotal\n\n60\n\n90\n\n120\n\n150\n\n120\n\nEstimated to Graduate\n\n-\n\n-\n\n-\n\n60\n\n30\n\n2.6 Planned Budget\nAcademic Year\n2020\n\n2021\n\n2022\n\n2023\n\n2024\n\n1. Personnel\n\n2,157,500\n\n2,912,917\n\n3,879,250\n\n4,119,250', '5.3 Time Period\nThe 4th academic year.\n5.4 Credits\n6 Credits\n5.5 Preparation\nThe proposal must be proposed with the approval of the program committee.\n5.6 Evaluation Process\nAn evaluation is provided by a committee, which consists of instructors in the program by arranging\nan examination in each semester.\n6. Additional Costs', '6\n\n9. Name, Surname, ID Number, Position, and Qualification of Instructors Responsible for the Program (Executive Program Committee)\nName-Surname\n(Academic Position)\nID Number\n\nQualification (Department), University,\nYear of Graduation\n\nAcademic Achievements\n\nDr. Poom Konghuayrob', '6. Status of the Program and Consideration for the Authorization/Agreement................................................. 5\n7. Readiness for Publicization as Qualified and Standardized Program ............................................................... 5']",Applicants must complete high-school education or equivalent study record. They must also provide the latest official transcript for their highest level of education and proof of completion (an official diploma or a certificate of completion) from their high-school education or equivalent study before their enrollment.,Complete high-school education or equivalent.,1.0,0.7442611448843987,0.249999999975,1.0
What English proficiency tests are accepted for non-native speakers?,"['equivalent study before their enrollment.\nb. Standardized test: Students must obtain the standardized test scores as specified in the\nadmission announcement.\nc. English Language Proficiency: If prospective students are non-native English speakers, they\nmust obtain the results of the Test of English as a Foreign Language ( TOEFL) or the International', '64\n4. Instructor\n4.1 There is a system for accepting new Instructors by university regulations. The English proficiency\ntest is required according to the university criteria. It is in line with the announcement of the Higher\nEducation Commission on English Proficiency Standards of Faculty Members.\n4.2 There is a management system for promoting and developing teachers appropriate and consistent', 'English Language Testing System (IELTS) in addition to the other required standardized test scores.\nOther types of the accepted score will be specified in the admission announcement.', 'ENGLISH FOR SCIENCE AND TECHNOLOGY\n3 (3-0-6)\nPREREQUISITE: NONE\nThis course will help students improve their critical thinking/analytical skills through a\ncombination of reading articles, listening to lectures, and watching audiovisual programs on current hot\ntopics in science and technology. Students will have directed practice in various areas of pronunciation,', 'ACADEMIC LISTENING AND SPEAKING\n3 (3-0-6)\nPREREQUISITE: NONE\nThe course provides ESL students guidance and extensive practice in listening and speaking\nin academic and professional settings. Listening focuses on understanding spoken English in formats such\nas college lectures and news broadcasts. Note- taking tasks are also included to reinforce aural', '94\n\nAPPENDIX C\nCourse Description\n\n\x0c95\nCOURSE DESCRIPTION\n1. GENERAL EDUCATION\n1.1 ENGLISH PROFICIENCY REQUIREMENT (ESL)\n01416000', 'such as stress, intonation, reductions (i.e., informal speech), linking, consonant and vowel production,\nrhythm, and pitch. This course will help participants improve their oral presentation skills through an\nintercultural scientific/technological research project. This course is designed to inspire students to realize', 'ACADEMIC READING AND WRITING\n3 (3-0-6)\nPREREQUISITE: NONE\nThis course is designed to improve the reading and writing skills of ESL students. Students\nreceive practice on reading and vocabulary development. Reading practice will emphasize paraphrasing,\nsummarizing, and the simple analysis of texts to identify main ideas and distinguish fact from opinion. Writing', '23\n\n3.1 Curriculum\n3.1.1 Minimum Credits Required for Graduation\n3.1.2 Curriculum Structure (Minimum Credits)\n\n131\n\ncredits\n\n(For UoB 2+2 Program Students)\n\nCredits\n(For Co-op / Study\nAboard Students)\n\n30\n\n30\n\nA1. English Proficiency Requirement (ESL)\n\n9\n\n9\n\nA2. Communication, Humanity, and Social Skills\n\n15\n\n15\n\nA3. Math and Science\n\n6\n\n6\n\n95\n\n95\n\nB1. Core Courses\n\n20\n\n20\n\nB2. Major Compulsory Courses', '5.3 Medium of Instruction\nEnglish\n5.4 Admission\nThai and/or Foreign students\n5.5 Collaboration with Other Institutes\nThe program is in collaboration with many universities according to the memorandum of\nunderstanding (MOU) such as College of Engineering, Carnegie Mellon University, the University of South', 'practice includes writing of simple and compound sentences, using compound tenses and correct word\nforms, word order, spelling, and punctuation. Students will also develop the ability to write varied, complex\nsentences and effective paragraphs in standard written English.\n01006003', 'comprehension. Students learn to recognize organizational patterns. Students also practice outlining main\nideas and supporting details through audiotaped, videotaped and live presentations. Speaking focuses on\nincreased fluency and communicative strategies used by native speakers in academic and professional\nsettings.\n01416001', 'English proficiency level prior to the graduation. Students must also complete the internship requirement\nduring their courses of study. Also, graduation according to the program is accordance with the Regulations\nof King Mongkut’s Institute of Technology Ladkrabang regarding Bachelor Degree Education 2016 (Appendix\nA).', '1. Regulations or Criteria for Grading ..........................................................................................................................59\n2. Verification of Learning Achievement ....................................................................................................................59', '- Have verification from the stakeholders.\n- Have verification from another university.\n2.2 Verification of Learning Achievement after Graduation\nTo the purpose of improving educational and curricular development, the following\nassessments are in place:\n- Survey stakeholder’ satisfaction.\n- Assessed by the graduate user.\n- Award or commendation the graduates receive in the aspects of ethics, knowledge,', 'PROBABILITY AND STATISTICS 2\n3 (3-0-6)\nPREREQUISITE: 01006719 PROBABILITY AND STATISTICS 1\nTest of hypotheses based on a single sample, inferences based on two samples, analysis of\nvariance, multifactor analysis of variance, simple linear regression and correlation, nonlinear and multiple\nregression, goodness-of-fit tests and categorical data analysis.\n\n01006721', '1) Be able to communicate in English\nwith various groups of people\neffectively\n2) Be able to assist and support in\nresolving problematic situations\nboth in the role of a leader and in\nthe role of a team member\n3) Be able to plan and be responsible\nfor developing one own learning\nconsistently with the profession.\n4) Know the role and responsibilities\nof the assigned work both\nindividual and group work. Be', ""97\ntranslating what is learned into strategies, materials, and interventions for use in students' own educational\nand professional settings.\n01006507"", 'PART5: CRITERIA FOR STUDENT EVALUATION\n1. Regulations or Criteria for Grading\nRegulations or criteria for grading are in accordance with the Regulations of King Mongkut’ s Institute of\nTechnology Ladkrabang regarding Bachelor’s Degree Education 2016 (Appendix A).\n2. Verification of Learning Achievement\n2.1 Verification of Learning Achievement before Graduation', 'STUDY ABROAD\n6 (6-0-12)\nPREREQUISITE: NONE\nThis course is reserved for students who participate in the study abroad program. Upon\nthe completion of the program, the students must prepare and deliver oral presentations describing their\nexperience from the program.\n3. INTERNSHIP\n01006805']",The accepted English proficiency tests for non-native speakers are the Test of English as a Foreign Language (TOEFL) and the International English Language Testing System (IELTS).,TOEFL or IELTS.,0.5,0.9877762064250589,0.8333333332916666,1.0
What is a common issue for new students mentioned in the doc?,"['such as communication, presentation, and storytelling with data, will be fostered. Students will acquire a', 'Strategy or Activity of Students\n\uf0b7\n\n\uf0b7\n\n\uf0b7', 'domestic and other issues.\nc. Arrange activities that promote relationship forming, bonding and caring among students.\nd. Have tracking systems in place to monitor and evaluate students with academic,\nbehavioral and other problems.\ne. Have teaching assistant programs to aid students towards the specified learning outcomes.\nf. Have available scholarships for students with potential.', '1. Development of Special Characteristics of Students ........................................................................................45\n2. Development of Learning Results in Each Aspect .............................................................................................46\n3. Curriculum Mapping Illustrating the Distribution of Program Standard Learning Outcomes to Course', 'plan for the program so that its quality archives the required standards and discuss with the instructor.', 'such as stress, intonation, reductions (i.e., informal speech), linking, consonant and vowel production,\nrhythm, and pitch. This course will help participants improve their oral presentation skills through an\nintercultural scientific/technological research project. This course is designed to inspire students to realize', '3. Curriculum and Instructors.......................................................................................................................................22', ""for the duration of the program.\n3.2 The activities are organized to develop students' knowledge, abilities and potential in various ways\nto support 21st-century learning skills.\n3.3 A consultant, who is appointed for academic counseling and guidance to all students, must\nschedule an appointment (Office Hours) for the student to consult."", 'projects, group work, lecture, discussion, reading, writing, and presenting.\n01006521', '6. Additional Costs\nStudents will be responsible for the additional costs apart from tuition fees for all subjects in the\nprogram.', '2. Graduate .......................................................................................................................................................................61\n3. Student .........................................................................................................................................................................61', 'and freedom compared to high schools.\nb. Tuition fees and other financial requirements.\nc. Diverse ethnicity as backgrounds varies from student to student regarding culture, social\nand academic upbringing, all of which influences social bonding and communication effectiveness,\nlearning and self-development.\n2.4 Strategies for Solving the Issues/Limitation of the Students in 2.3', 'fundamental disagreements between those perspectives. Ultimately, students will advance their\ncontributions to discussions in engineering, business innovations, and technology studies.\n1.2 COMMUNICATION, HUMANITY AND SOCIAL SKILLS\n01006502', 'a. Complete high-school education or equivalent study record. Students must also provide\nthe latest official transcript for their highest level of education. Students must provide the proof of\ncompletion (an official diploma or a certificate of completion) from their high-school education or\nequivalent study before their enrollment.', '17\n\nYear\n\nExpected Learning Outcomes\n\n\uf0b7\n\uf0b7\n\uf0b7\n\n3\n\n\uf0b7\n\uf0b7\n\n\uf0b7\n\n4\n\n\uf0b7', 'a. Arrange an orientation day and counseling session for first year students to advise on\navailable career paths, best action plans in line with set objectives and time management.\nb. Arrange advisor system to overlook, care and provide counseling for students about all\naspects of life, on and off campus, particularly students facing academic difficulties and/ or\ndomestic and other issues.', '3. Student\n3.1 There is appropriate student admissions process by defining the criteria and\nqualifications for the students by the curriculum. Moreover,there is preparation course to\nensure that students are ready for their studies and to be able to complete theireducation\nfor the duration of the program.', '\uf0b7\n\n\uf0b7\n\n\uf0b7\n\nArranging for a special lecture by an expert to contribute to research experience\nand societal impact as well as relating laws and infringements\nArranging for extracurricular activities, i.e., community service.\n\n\x0c47', 'comprehension. Students learn to recognize organizational patterns. Students also practice outlining main\nideas and supporting details through audiotaped, videotaped and live presentations. Speaking focuses on\nincreased fluency and communicative strategies used by native speakers in academic and professional\nsettings.\n01416001', '\uf0b7\n\nArranging for an education that promotes students’ self-learning\n\n\uf0b7']","A common issue for new students mentioned in the document is diverse ethnicity as backgrounds vary from student to student regarding culture, social, and academic upbringing, all of which influences social bonding and communication effectiveness, learning, and self-development.",Adjusting to social settings and campus lifestyles.,1.0,0.8662705568840519,0.0,0.0
How many 1st year students were planned for the 2020 academic year?,"['20\n\n2.5 Admission Plan and Estimated Graduation in 5 Years\nAcademic Year\nNumber of Students\n1st year\n\n2020\n\n2021\n\n2022\n\n2023\n\n2024\n\n60\n\n30\n\n30\n\n30\n\n30\n\n60\n\n30\n\n30\n\n30\n\n60\n\n30\n\n30\n\n60\n\n30\n\n2nd year\n3rd year\n4th year\nTotal\n\n60\n\n90\n\n120\n\n150\n\n120\n\nEstimated to Graduate\n\n-\n\n-\n\n-\n\n60\n\n30\n\n2.6 Planned Budget\nAcademic Year\n2020\n\n2021\n\n2022\n\n2023\n\n2024\n\n1. Personnel\n\n2,157,500\n\n2,912,917\n\n3,879,250\n\n4,119,250', '2020\n\n2021\n\n2022\n\n2023\n\n2024\n\n\uf0fc\n\n\uf0fc\n\n\uf0fc\n\n\uf0fc\n\n\uf0fc\n\n\uf0fc\n\n\uf0fc\n\n\uf0fc\n\n\uf0fc\n\n\uf0fc\n\n\uf0fc\n\n\uf0fc\n\n\uf0fc\n\n\uf0fc\n\n\uf0fc\n\n\uf0fc\n\n\uf0fc\n\n\uf0fc\n\n\uf0fc\n\n\uf0fc\n\n\uf0fc\n\n\uf0fc\n\n\uf0fc\n\n\uf0fc\n\n\uf0fc\n\n\uf0fc\n\n\uf0fc\n\n\uf0fc\n\n\uf0fc\n\n\uf0fc\n\n\uf0fc\n\n\uf0fc\n\n\uf0fc\n\n\uf0fc\n\n\x0c66\nAcademic Year', 'Academic Year', '583,433\n\n831,433\n\n1,266,217\n\n1,534,217\n\n1,647,550\n\n- Activities\n\n332,667\n\n441,000\n\n711,667\n\n837,667\n\n897,667\n\n3. Scholarship\n\n350,000\n\n550,000\n\n750,000\n\n800,000\n\n800,000\n\n- Full Scholarship\n\n350,000\n\n550,000\n\n750,000\n\n800,000\n\n800,000\n\n\x0c21\n\nAcademic Year\n2020\n\n2021\n\n2022\n\n2023\n\n2024\n\n4. Facilities\n\n135,333\n\n252,000\n\n392,000\n\n490,000\n\n536,667\n\n- Facilities / Utilities\n\n135,333\n\n252,000\n\n392,000\n\n490,000', 'PART 3: SYSTEM FOR EDUCATIONAL PROVISION, MANAGEMENT,\nAND STRUCTURE OF THE PROGRAM\n1. System for Educational Provision\n1.1 System\nAn academic year has two semesters, each of which covers not less than 15 weeks (excluding the\nexamination weeks). The summer semester is optional. Most courses are offered on the main campus', '3. Student\n3.1 There is appropriate student admissions process by defining the criteria and\nqualifications for the students by the curriculum. Moreover,there is preparation course to\nensure that students are ready for their studies and to be able to complete theireducation\nfor the duration of the program.', '23\n\n3.1 Curriculum\n3.1.1 Minimum Credits Required for Graduation\n3.1.2 Curriculum Structure (Minimum Credits)\n\n131\n\ncredits\n\n(For UoB 2+2 Program Students)\n\nCredits\n(For Co-op / Study\nAboard Students)\n\n30\n\n30\n\nA1. English Proficiency Requirement (ESL)\n\n9\n\n9\n\nA2. Communication, Humanity, and Social Skills\n\n15\n\n15\n\nA3. Math and Science\n\n6\n\n6\n\n95\n\n95\n\nB1. Core Courses\n\n20\n\n20\n\nB2. Major Compulsory Courses', '3. Criteria for Graduation According to the Program ..............................................................................................59\nPART 6: DEVELOPMENT OF INSTRUCTORS ................................................................................................................60', 'August – December\n2nd semester:\nJanuary – May\nSummer course: June – July\n* The actual start and end dates for each academic year will be announced by the office of the\nregistrar.\n2.2 Qualification of Applicants\nThe general admission process starts from October. RAI classes will begin in August of the following\nyear. Prospective students are required to satisfy the following requirements:', '2020\n\n2021\n\n2022\n\n2023\n\n2024\n\n\uf0fc\n\n\uf0fc\n\n\uf0fc\n\n\uf0fc\n\n\uf0fc\n\n\uf0fc\n\n\uf0fc\n\n\uf0fc\n\n\uf0fc\n\n\uf0fc\n\n\uf0fc\n\n\uf0fc\n\n\uf0fc\n\n\uf0fc\n\n\uf0fc\n\n\uf0fc\n\n\uf0fc\n\uf0fc\n\nTotal indicators affecting the operation (no.1-5) for each year\n\n5\n\n5\n\n5\n\n5\n\n5\n\nTotal indicators (unit) for each year\n\n9\n\n10\n\n10\n\n11\n\n12', '2. Development Plan .....................................................................................................................................................14\n3. Student Outcomes.....................................................................................................................................................16', '2. Graduate .......................................................................................................................................................................61\n3. Student .........................................................................................................................................................................61', '0 (0-45-0)\n\nCredit Notation: (L - E - S)\n\nL = Lecture / Learning hours, E = Laboratory hours, S = Self-study hours\nThis study plan shows courses with credits equivalent to 3. However, students can register 4 credit courses\nas well. The total number of credits in each subject category will be counted toward the graduation.\n\n\x0c31\n\n1st YEAR 1st SEMESTER\nCODE\n\nSUBJECT\n\nCREDITS (L-E-S)\n\n01416316', '20\n\n20\n\nB2. Major Compulsory Courses\n\n75\n\n75\n\nB2.1 Fundamental Subjects\n\n39\n\n39\n\nB2.2 Capstone Projects\n\n6\n\n6\n\nB2.3 RAI Elective Mandatory Subjects\n\n18\n\n15\n\nB2.4 RAI Elective Subjects\n\n12\n\n9\n\nB2.5 Alternative Study\n\n-\n\n6\n\nC. Free Electives\n\n6\n\n6\n\nD. Internship\n\n0\n\n0\n\n131\n\n131\n\nCourse Group\nA. General Education\n\nB. Robotics and AI Specific Courses\n\nTOTAL\n\nCredits\n(For Regular Students)\n\n\x0c24', '3. Major Field\nNone\n4. Total Credits\nAt least 131 credits\n5. Type of the Program\n5.1 Level\n4-Year Bachelor Program\n5.2 Program Category\n\uf0fe Academic bachelor’s degree program\n\uf0fe Academic bachelor’s degree program\n\uf06f Advanced academic bachelor’s degree program\n\n\x0c5', 'The outcomes can be presented progressively by following yearly basis as articulately shown in Table\nbelow.\nYear\n\nExpected Learning Outcomes\n\uf0b7\n\n1\n\n\uf0b7\n\uf0b7\n\n\uf0b7\n\n2\n\n\uf0b7', '5.3 Time Period\nThe 4th academic year.\n5.4 Credits\n6 Credits\n5.5 Preparation\nThe proposal must be proposed with the approval of the program committee.\n5.6 Evaluation Process\nAn evaluation is provided by a committee, which consists of instructors in the program by arranging\nan examination in each semester.\n6. Additional Costs', '3 (0-9-5)\n\nTOTAL CREDITS\n\n15\n\n3rd YEAR 3rd SEMESTER (SUMMER)\nCODE\n01006805\n\nSUBJECT\nINDUSTRIAL INTERNSHIP\nTOTAL CREDITS\n\nCREDITS (L-E-S)\n0 (0-45-0)\n0\n\n\x0c34\n\nFOR REGULAR STUDENTS\n4th YEAR 1st SEMESTER\nCODE\n\nSUBJECT\n\nCREDITS (L-E-S)\n\nXXXXXXX\n\n(FREE ELECTIVE)\n\n3 (X-X-X)\n\nXXXXXXX\n\n(GENED ELECTIVE)\n\n3 (3-0-6)\n\n0141XXXX\n\nRAI Elective mandatory subject\n\n3 (3-0-6)\n\n0141XXXX\n\nRAI Elective subject\n\n3 (3-0-6)', 'Estimated expenditure per person for producing a scholar according to the program equals\nto an average of 194,613 baht/person/year.\n2.7 Educational System\nClass room\n2.8 Transfer of Credits, Subjects and Cross- Institute Registration of Higher Education\n(if any)\nCredits can be transferred, upon the consent of executive program committee, according to the', '17\n\nYear\n\nExpected Learning Outcomes\n\n\uf0b7\n\uf0b7\n\uf0b7\n\n3\n\n\uf0b7\n\uf0b7\n\n\uf0b7\n\n4\n\n\uf0b7']",60 first-year students were planned for the 2020 academic year.,60 students.,1.0,0.9941845927829209,0.9999999999,1.0
What is the estimated expenditure per person for producing a scholar per year?,"['Estimated expenditure per person for producing a scholar according to the program equals\nto an average of 194,613 baht/person/year.\n2.7 Educational System\nClass room\n2.8 Transfer of Credits, Subjects and Cross- Institute Registration of Higher Education\n(if any)\nCredits can be transferred, upon the consent of executive program committee, according to the', '2. The Faculty provides an annual\nbudget for the provision of\ntextbooks, educational media,\naudiovisual equipment, durable\narticles, computers,etc.\n3. Procuring educational resources\nto satisfy the need as proper to\neach program\n\nEvaluation of sufficiency\nfor durable articles, equipment,\nbooks and educational\ndocument by students and\ninstructors\n\n7. Key Performance Indicators\nAcademic Year', '20\n\n2.5 Admission Plan and Estimated Graduation in 5 Years\nAcademic Year\nNumber of Students\n1st year\n\n2020\n\n2021\n\n2022\n\n2023\n\n2024\n\n60\n\n30\n\n30\n\n30\n\n30\n\n60\n\n30\n\n30\n\n30\n\n60\n\n30\n\n30\n\n60\n\n30\n\n2nd year\n3rd year\n4th year\nTotal\n\n60\n\n90\n\n120\n\n150\n\n120\n\nEstimated to Graduate\n\n-\n\n-\n\n-\n\n60\n\n30\n\n2.6 Planned Budget\nAcademic Year\n2020\n\n2021\n\n2022\n\n2023\n\n2024\n\n1. Personnel\n\n2,157,500\n\n2,912,917\n\n3,879,250\n\n4,119,250', 'Academic Year', '135,333\n\n252,000\n\n392,000\n\n490,000\n\n536,667\n\n5. Capital\n\n403,600\n\n171,600\n\n171,600\n\n838,267\n\n171,600\n\n- Equipments\n- Accreditation\n\n1,210,800\n\n514,800\n\n514,800\n\n2,514,800\n\n514,800\n\nTotal Expense\n\n3,962,533\n\n5,158,950\n\n7,170,733\n\n8,619,400\n\n8,172,733\n\nEnrollments\n\n60\n\n90\n\n120\n\n150\n\n120', '583,433\n\n831,433\n\n1,266,217\n\n1,534,217\n\n1,647,550\n\n- Activities\n\n332,667\n\n441,000\n\n711,667\n\n837,667\n\n897,667\n\n3. Scholarship\n\n350,000\n\n550,000\n\n750,000\n\n800,000\n\n800,000\n\n- Full Scholarship\n\n350,000\n\n550,000\n\n750,000\n\n800,000\n\n800,000\n\n\x0c21\n\nAcademic Year\n2020\n\n2021\n\n2022\n\n2023\n\n2024\n\n4. Facilities\n\n135,333\n\n252,000\n\n392,000\n\n490,000\n\n536,667\n\n- Facilities / Utilities\n\n135,333\n\n252,000\n\n392,000\n\n490,000', '2,157,500\n\n2,912,917\n\n3,879,250\n\n4,119,250\n\n4,119,250\n\n- Teaching Personnel\n\n1,017,500\n\n1,606,250\n\n2,191,250\n\n2,431,250\n\n2,431,250\n\n- Administrative Staffs\n\n544,000\n\n544,000\n\n725,333\n\n725,333\n\n725,333\n\n- Professional Dev.\n\n596,000\n\n762,667\n\n962,667\n\n962,667\n\n962,667\n\n2. Operating Expense\n\n916,100\n\n1,272,433\n\n1,977,883\n\n2,371,883\n\n2,545,217\n\n- Subscriptions\n- Consumables\n\n583,433\n\n831,433\n\n1,266,217', '2020\n\n2021\n\n2022\n\n2023\n\n2024\n\n\uf0fc\n\n\uf0fc\n\n\uf0fc\n\n\uf0fc\n\n\uf0fc\n\n\uf0fc\n\n\uf0fc\n\n\uf0fc\n\n\uf0fc\n\n\uf0fc\n\n\uf0fc\n\n\uf0fc\n\n\uf0fc\n\n\uf0fc\n\n\uf0fc\n\n\uf0fc\n\n\uf0fc\n\n\uf0fc\n\n\uf0fc\n\n\uf0fc\n\n\uf0fc\n\n\uf0fc\n\n\uf0fc\n\n\uf0fc\n\n\uf0fc\n\n\uf0fc\n\n\uf0fc\n\n\uf0fc\n\n\uf0fc\n\n\uf0fc\n\n\uf0fc\n\n\uf0fc\n\n\uf0fc\n\n\uf0fc\n\n\x0c66\nAcademic Year', '6. Additional Costs\nStudents will be responsible for the additional costs apart from tuition fees for all subjects in the\nprogram.', 'or academic position no lower than Assistant Professor. Moreover, they have at least one academic\nresults published by the criteria established for an academic position in the past 5 years.\n1.3 The curriculum is updated at least every 5 years by considering the opinions of new graduates,\nalumni, industrial advisory board, employer, and other stakeholders.\n2. Graduate', '8. Possible Career Path after Graduation .................................................................................................................... 5\n9. Name, Surname, ID Number, Position, and Qualification of Instructors Responsible for the Program', 'in each academic year by collecting information from students and graduates, employers and/ or\nstakeholders, experts, industrial advisory boards or external evaluators.\n3. Evaluation of the Operation According to the Details of the Program\nHaving quality assurance system and provision of education according to the standard framework of', '65\n6.4 Evaluation of Resource Sufficiency\nObjective\n\nOperation\n\nEvaluation\n\n1. The Faculty surveys the needs\nfor educational resources\n\nHaving educational resources\nsufficient to the needs', '6\n\n9. Name, Surname, ID Number, Position, and Qualification of Instructors Responsible for the Program (Executive Program Committee)\nName-Surname\n(Academic Position)\nID Number\n\nQualification (Department), University,\nYear of Graduation\n\nAcademic Achievements\n\nDr. Poom Konghuayrob', '2.2 Development of Academic and Other Professions\na. Arranging an academic and professional meeting for instructors.\nb. Supporting both domesticallyand internationally for instructors to participate in academic\nconferences, lectures, andseminars regarding the development of academic and other\nprofessions.\nc. Arranging for an exchange of instructors with both domestic and international institutes to', 'PART 3: SYSTEM FOR EDUCATIONAL PROVISION, MANAGEMENT,\nAND STRUCTURE OF THE PROGRAM\n1. System for Educational Provision\n1.1 System\nAn academic year has two semesters, each of which covers not less than 15 weeks (excluding the\nexamination weeks). The summer semester is optional. Most courses are offered on the main campus', 'participating in research projects with research labs or academic institutions, or working toward the\nentrepreneurship with incubators. The program committee will annually release the policies regarding the\neligibility and the conditions required to complete the requirement.\nStudents who participate in an alternative study program as Co- Operative Education can do a 16- week', '3. Evaluation of the Operation According to the Details of the Program .........................................................65\n4. Revision of the Evaluation and Improvement Plan ...........................................................................................65\nAppendix\nA. The Regulation of King Mongkut’ s Institute of Technology Ladkrabang Regarding Bachelor Degree', 'needs of the country and society, developing research to build up the body of knowledge for the\ndevelopment of the country, developing national and international collaboration of academic network,\nbuilding up scientific and technological body of knowledge and giving academic service to the society,\nsupporting the preservation of art and culture, along with developing curricula according to the standard', 'ethics and wisdom to foster the economy of quality, sustainability, righteousness and diversity as well\nas create strong foundation for innovation.\n12.2 Relation to the Mission of the Institute\nThe development of the Robotics and AI Engineering program is related to the strategic\nadvancement of scholar production to create next- generation scholars with capabilities and flexibility']","The estimated expenditure per person for producing a scholar per year is an average of 194,613 baht/person/year.","194,613 baht/person/year.",1.0,1.0,0.9999999999,1.0
Can credits be transferred from other institutions?,"['during the day. Some courses or laboratory hours may be offered in the evening or weekend.\n1.2 Provision of Summer Course\nSummer courses will be offered based on instructors’ availability and students’ need.\n1.3 System Transfer of Credits in Two-Semester System\nCredits can be transferred, upon the consent of executive program committee, according to the', 'Estimated expenditure per person for producing a scholar according to the program equals\nto an average of 194,613 baht/person/year.\n2.7 Educational System\nClass room\n2.8 Transfer of Credits, Subjects and Cross- Institute Registration of Higher Education\n(if any)\nCredits can be transferred, upon the consent of executive program committee, according to the', 'SUBJECT\n\nCREDITS (L-E-S)\n\nCOOPERATIVE EDUCATION\nor\nSTUDY ABROAD\n\n6 (0-45-0)\nor\n6 (6-0-12)\n\nTOTAL CREDITS\n\n6\n\n4th YEAR 2nd SEMESTER\nCODE\n\nSUBJECT\n\nCREDITS (L-E-S)\n\nXXXXXXX\n\n(GENED ELECTIVE)\n\n3 (3-0-6)\n\nXXXXXXX\n\n(FREE ELECTIVE)\n\n3 (X-X-X)\n\n0141XXXX\n\nRAI Elective subject\n\n3 (3-0-6)\n\n0141XXXX\n\nRAI Elective subject\n\n3 (3-0-6)\n\n01416702\n\nRAI ENGINEERING CAPSTONE DESIGN\n\n3 (0-9-5)\n\nTOTAL CREDITS\n\n15', '6 CREDITS\n\n\x0c30\n\n01006301\n01006302\n01006304\n\nCOOPERATIVE EDUCATION\nSTUDY ABROAD\nOVERSEA TRAINING\n\n6 (0-45-0)\n6 (6-0-12)\n6 (0-45-0)\n\nC. FREE ELECTIVES\n\n6 CREDITS\n\nStudents must complete at least 6 additional credits from any courses offered by the\ninstitution.\nD. RAI INTERNSHIP\n01006805\n\n0 CREDITS\nINDUSTRIAL INTERNSHIPS\n\n3.1.4 Recommended Study Plan\n\n0 (0-45-0)\n\nCredit Notation: (L - E - S)', '3 (0-9-5)\n\nTOTAL CREDITS\n\n15\n\nTotal credits required for graduation at least\n\n3.1.5 Details of Each Subject\nCourse description (Appendix C)\n\n131\n\ncredits\n\n\x0c36\n\n3.2 Name, Surname, ID Number, Position, and Qualification of Instructors\n3.2.1 Executive Program Committees\nName-Surname\n(Academic Position)\nID Number\nAssoc. Prof. Dr. Pitikhate Sooraksa\n(Electrical Engineering)', '0 (0-45-0)\n\nCredit Notation: (L - E - S)\n\nL = Lecture / Learning hours, E = Laboratory hours, S = Self-study hours\nThis study plan shows courses with credits equivalent to 3. However, students can register 4 credit courses\nas well. The total number of credits in each subject category will be counted toward the graduation.\n\n\x0c31\n\n1st YEAR 1st SEMESTER\nCODE\n\nSUBJECT\n\nCREDITS (L-E-S)\n\n01416316', '0141XXXX\n\nRAI Elective subject\n\n3 (3-0-6)\n\nTOTAL CREDITS\n\n12\n\n4th YEAR 2nd SEMESTER\nCODE\n\nSUBJECT\n\nCREDITS (L-E-S)\n\n0141XXXX\n\nRAI Elective subject\n\n3 (3-0-6)\n\n0141XXXX\n\nRAI Elective subject\n\n3 (3-0-6)\n\n01416702\n\nRAI ENGINEERING CAPSTONE DESIGN\n\n3 (0-9-5)\n\nTOTAL CREDITS\n\n9\n\n\x0c35\n\nFOR CO-OP/STUDY ABROAD STUDENTS\n4th YEAR 1st SEMESTER\nCODE\n01006301\nor\n01006302\n\nSUBJECT\n\nCREDITS (L-E-S)', '3.1.3 Subjects\nOne academic credit is given to a course offered in a single semester which\n- Meets in class for lecture or discussion for 1 hour per week; or\n- Contains at least 3 laboratory hours per week.\nMost courses are given 3 or more credits. For 4 credit courses, these courses usually contain 3\nhours of lecture or discussion per week. The courses are also accompanied with 1 additional hour', '3 (0-9-5)\n\nTOTAL CREDITS\n\n15\n\n3rd YEAR 3rd SEMESTER (SUMMER)\nCODE\n01006805\n\nSUBJECT\nINDUSTRIAL INTERNSHIP\nTOTAL CREDITS\n\nCREDITS (L-E-S)\n0 (0-45-0)\n0\n\n\x0c34\n\nFOR REGULAR STUDENTS\n4th YEAR 1st SEMESTER\nCODE\n\nSUBJECT\n\nCREDITS (L-E-S)\n\nXXXXXXX\n\n(FREE ELECTIVE)\n\n3 (X-X-X)\n\nXXXXXXX\n\n(GENED ELECTIVE)\n\n3 (3-0-6)\n\n0141XXXX\n\nRAI Elective mandatory subject\n\n3 (3-0-6)\n\n0141XXXX\n\nRAI Elective subject\n\n3 (3-0-6)', '3. Major Field\nNone\n4. Total Credits\nAt least 131 credits\n5. Type of the Program\n5.1 Level\n4-Year Bachelor Program\n5.2 Program Category\n\uf0fe Academic bachelor’s degree program\n\uf0fe Academic bachelor’s degree program\n\uf06f Advanced academic bachelor’s degree program\n\n\x0c5', '0141XXXX\n\nRAI Elective subject\n\n3 (3-0-6)\n\nTOTAL CREDITS\n\n18\n\n3rd YEAR 2nd SEMESTER\nCODE\n\nSUBJECT\n\nCREDITS (L-E-S)\n\nXXXXXXX\n\n(GENED ELECTIVE)\n\n3 (3-0-6)\n\n01416315\n\nINDUSTRIAL ELECTRONICS\n\n3 (3-0-6)\n\n0141XXXX\n\nRAI Elective mandatory subject\n\n3 (3-0-6)\n\nXXXXXXX\n\n(FREE ELECTIVE)\n\n3 (X-X-X)\n\n01416701\n\nRAI ENGINEERING CAPSTONE DESIGN PREPARATION\n\n3 (0-9-5)\n\nTOTAL CREDITS\n\n15', 'TOTAL CREDITS\n\n19\n\n1st YEAR 2nd SEMESTER\nCODE\n\nSUBJECT\n\nCREDITS (L-E-S)\n\n01416320\n\nINTRODUCTION TO ROBOTICS AND AI\n\n3 (3-0-6)\n\n01006803\n\nENGINEERING MECHANICS\n\n3 (3-0-6)\n\n01006711\n\nADVANCED CALCULUS\n\n3 (3-0-6)\n\n01006725\n\nGENERAL PHYSICS 2\n\n3 (3-0-6)\n\n01006726\n\nGENERAL PHYSICS LABORATORY 2\n\n1 (0-3-2)\n\n01416318\n\nMICROPROCESSOR AND INTERFACE\n\n3 (2-2-5)\n\n01416514\n\nROBOTICS LABORATORY 1\n\n1 (0-3-6)\n\n01416001', 'occupational or professional skill and life skills.\n3. Criteria for Graduation According to the Program\nStudents must complete at least 131 credits to graduate with at least 30 credits from general education\ncourses; at least 95 credits from Robotics and AI concentration and at least 6 credits of free electives and', '12 CREDITS\n12 CREDITS\n9 CREDITS\n\n01416601\n01416602\n01416604\n01416607\n01416608\n01416609\n01416610\n01416611\n01416612\n01416613\n01416614\n01416615\n01416616\n01416617\n01416618\n01416619\n01416620\n01416621\n01416522\n\n3 (2-3-6)\n3 (3-0-6)\n3 (3-0-6)\n3 (3-0-6)\n3 (3-0-6)\n3 (3-0-6)\n3 (3-0-6)\n3 (3-0-6)\n3 (3-0-6)\n3 (3-0-6)\n3 (2-2-5)\n3 (3-0-6)\n3 (3-0-6)\n3 (3-0-6)\n3 (3-0-6)\n3 (2-2-5)\n3 (3-0-6)\n3 (3-0-6)\n3 (3-0-6)', '23\n\n3.1 Curriculum\n3.1.1 Minimum Credits Required for Graduation\n3.1.2 Curriculum Structure (Minimum Credits)\n\n131\n\ncredits\n\n(For UoB 2+2 Program Students)\n\nCredits\n(For Co-op / Study\nAboard Students)\n\n30\n\n30\n\nA1. English Proficiency Requirement (ESL)\n\n9\n\n9\n\nA2. Communication, Humanity, and Social Skills\n\n15\n\n15\n\nA3. Math and Science\n\n6\n\n6\n\n95\n\n95\n\nB1. Core Courses\n\n20\n\n20\n\nB2. Major Compulsory Courses', '135,333\n\n252,000\n\n392,000\n\n490,000\n\n536,667\n\n5. Capital\n\n403,600\n\n171,600\n\n171,600\n\n838,267\n\n171,600\n\n- Equipments\n- Accreditation\n\n1,210,800\n\n514,800\n\n514,800\n\n2,514,800\n\n514,800\n\nTotal Expense\n\n3,962,533\n\n5,158,950\n\n7,170,733\n\n8,619,400\n\n8,172,733\n\nEnrollments\n\n60\n\n90\n\n120\n\n150\n\n120', 'Ladkrabang regarding bachelor degree education year 2016 (Appendix A).\n2.10 Integrated Master/Bachelor Program\nIf a student is in the 2nd semester of their third year of study or has completed at least 81 credits,\nwith the overall GPA of at least 3. 00, the student is guaranteed admission into the integrated\nmaster/ bachelor program in the department. The student must also complete the admission form', 'Regulation of King Mongkut’s Institute of Technology Ladkrabang regarding bachelor degree education\nyear 2016 (Appendix A), and the Announcement of King Mongkut’s Institute of Technology Ladkrabang\nregarding the cross-institute registration of higher education (Appendix C).\n2.9 Registration\nThe registration system is according to the Regulation of King Mongkut’ s Institute of Technology', 'Florida, Imperial College, Chubu University, Kumamoto University, BK Birla Institute of Engineering and\nTechnology, National Formosa University and South Eastern Regional College, etc.\n5.6 Degree Given to the Graduates\nBachelor of Engineering from King Mongkut’s Institute of Technology Ladkrabang\n6. Status of the Program and Consideration for the Authorization/Agreement', '- Have verification from the stakeholders.\n- Have verification from another university.\n2.2 Verification of Learning Achievement after Graduation\nTo the purpose of improving educational and curricular development, the following\nassessments are in place:\n- Survey stakeholder’ satisfaction.\n- Assessed by the graduate user.\n- Award or commendation the graduates receive in the aspects of ethics, knowledge,']","Credits can be transferred, upon the consent of the executive program committee, according to the information provided.","Yes, with consent of the committee.",0.6666666666666666,0.0,0.7222222221981481,1.0
What is the GPA requirement for guaranteed admission to the integrated Master program?,"['Ladkrabang regarding bachelor degree education year 2016 (Appendix A).\n2.10 Integrated Master/Bachelor Program\nIf a student is in the 2nd semester of their third year of study or has completed at least 81 credits,\nwith the overall GPA of at least 3. 00, the student is guaranteed admission into the integrated\nmaster/ bachelor program in the department. The student must also complete the admission form', 'through the meeting with their academic advisor for their master program. If a student does not meet\nthe GPA criteria of 3.00, he or she is eligible to his/her petition into the program during his or her fourth\nyear with the permission of their academic advisor.', '3. Major Field\nNone\n4. Total Credits\nAt least 131 credits\n5. Type of the Program\n5.1 Level\n4-Year Bachelor Program\n5.2 Program Category\n\uf0fe Academic bachelor’s degree program\n\uf0fe Academic bachelor’s degree program\n\uf06f Advanced academic bachelor’s degree program\n\n\x0c5', 'occupational or professional skill and life skills.\n3. Criteria for Graduation According to the Program\nStudents must complete at least 131 credits to graduate with at least 30 credits from general education\ncourses; at least 95 credits from Robotics and AI concentration and at least 6 credits of free electives and', '3 (0-9-5)\n\nTOTAL CREDITS\n\n15\n\nTotal credits required for graduation at least\n\n3.1.5 Details of Each Subject\nCourse description (Appendix C)\n\n131\n\ncredits\n\n\x0c36\n\n3.2 Name, Surname, ID Number, Position, and Qualification of Instructors\n3.2.1 Executive Program Committees\nName-Surname\n(Academic Position)\nID Number\nAssoc. Prof. Dr. Pitikhate Sooraksa\n(Electrical Engineering)', '23\n\n3.1 Curriculum\n3.1.1 Minimum Credits Required for Graduation\n3.1.2 Curriculum Structure (Minimum Credits)\n\n131\n\ncredits\n\n(For UoB 2+2 Program Students)\n\nCredits\n(For Co-op / Study\nAboard Students)\n\n30\n\n30\n\nA1. English Proficiency Requirement (ESL)\n\n9\n\n9\n\nA2. Communication, Humanity, and Social Skills\n\n15\n\n15\n\nA3. Math and Science\n\n6\n\n6\n\n95\n\n95\n\nB1. Core Courses\n\n20\n\n20\n\nB2. Major Compulsory Courses', 'Florida, Imperial College, Chubu University, Kumamoto University, BK Birla Institute of Engineering and\nTechnology, National Formosa University and South Eastern Regional College, etc.\n5.6 Degree Given to the Graduates\nBachelor of Engineering from King Mongkut’s Institute of Technology Ladkrabang\n6. Status of the Program and Consideration for the Authorization/Agreement', 'English proficiency level prior to the graduation. Students must also complete the internship requirement\nduring their courses of study. Also, graduation according to the program is accordance with the Regulations\nof King Mongkut’s Institute of Technology Ladkrabang regarding Bachelor Degree Education 2016 (Appendix\nA).', '6 CREDITS\n\n\x0c30\n\n01006301\n01006302\n01006304\n\nCOOPERATIVE EDUCATION\nSTUDY ABROAD\nOVERSEA TRAINING\n\n6 (0-45-0)\n6 (6-0-12)\n6 (0-45-0)\n\nC. FREE ELECTIVES\n\n6 CREDITS\n\nStudents must complete at least 6 additional credits from any courses offered by the\ninstitution.\nD. RAI INTERNSHIP\n01006805\n\n0 CREDITS\nINDUSTRIAL INTERNSHIPS\n\n3.1.4 Recommended Study Plan\n\n0 (0-45-0)\n\nCredit Notation: (L - E - S)', '3. Student\n3.1 There is appropriate student admissions process by defining the criteria and\nqualifications for the students by the curriculum. Moreover,there is preparation course to\nensure that students are ready for their studies and to be able to complete theireducation\nfor the duration of the program.', 'SUBJECT\n\nCREDITS (L-E-S)\n\nCOOPERATIVE EDUCATION\nor\nSTUDY ABROAD\n\n6 (0-45-0)\nor\n6 (6-0-12)\n\nTOTAL CREDITS\n\n6\n\n4th YEAR 2nd SEMESTER\nCODE\n\nSUBJECT\n\nCREDITS (L-E-S)\n\nXXXXXXX\n\n(GENED ELECTIVE)\n\n3 (3-0-6)\n\nXXXXXXX\n\n(FREE ELECTIVE)\n\n3 (X-X-X)\n\n0141XXXX\n\nRAI Elective subject\n\n3 (3-0-6)\n\n0141XXXX\n\nRAI Elective subject\n\n3 (3-0-6)\n\n01416702\n\nRAI ENGINEERING CAPSTONE DESIGN\n\n3 (0-9-5)\n\nTOTAL CREDITS\n\n15', '3 (0-9-5)\n\nTOTAL CREDITS\n\n15\n\n3rd YEAR 3rd SEMESTER (SUMMER)\nCODE\n01006805\n\nSUBJECT\nINDUSTRIAL INTERNSHIP\nTOTAL CREDITS\n\nCREDITS (L-E-S)\n0 (0-45-0)\n0\n\n\x0c34\n\nFOR REGULAR STUDENTS\n4th YEAR 1st SEMESTER\nCODE\n\nSUBJECT\n\nCREDITS (L-E-S)\n\nXXXXXXX\n\n(FREE ELECTIVE)\n\n3 (X-X-X)\n\nXXXXXXX\n\n(GENED ELECTIVE)\n\n3 (3-0-6)\n\n0141XXXX\n\nRAI Elective mandatory subject\n\n3 (3-0-6)\n\n0141XXXX\n\nRAI Elective subject\n\n3 (3-0-6)', '3. Criteria for Graduation According to the Program ..............................................................................................59\nPART 6: DEVELOPMENT OF INSTRUCTORS ................................................................................................................60', '1. Bachelor of Engineering Program is designed to\nqualification standard of higher education by Ministry of\nEducation (MoE) and Accreditation Board for Engineering\nand Technology (ABET)\n2. The total number of courses where at least 50 percent\nor more of class time is carried out through active learning.\n3. The total number of courses with an integrated\neducation system.', '01\n41\n00\n6\n\nmeans Faculty of Engineering\nmeans Robotics and AI program\nmeans shared courses\nmeans bachelor degree\nmeans Order of the subject\n\n\x0c25\n\nA. GENERAL EDUCATION\n\n30 CREDITS\n(LECTURE-LAB-SELF STUDY)\n\nA.1 ENGLISH PROFICIENCY REQUIREMENT (ESL)\n01416000\nACADEMIC LISTENING AND SPEAKING\n01416001\nACADEMIC READING AND WRITING\n01416003\nINTERPRETATION AND ARGUMENTS\n\n9 CREDITS\n3 (3-0-6)\n3 (3-0-6)\n3 (3-0-6)', 'qualification for higher education as well as ABET Accreditation by having key performance indicators and\nassessment criteria assigned by the Internal QA committee.\n4. Revision of the Evaluation and Improvement Plan\nThe executive program committees utilize the results of analysis and revision to create an improvement', '3. Curriculum and Instructors\nThe B. Eng. in Robotics and AI program is a four- year full- time undergraduate program. In order to\ngraduate, the students must complete at least 131 credits. Students must achieve the required English\nproficiency level prior to the graduation and satisfy the graduation requirements. The program is designed', '8. Possible Career Path after Graduation .................................................................................................................... 5\n9. Name, Surname, ID Number, Position, and Qualification of Instructors Responsible for the Program', '20\n\n20\n\nB2. Major Compulsory Courses\n\n75\n\n75\n\nB2.1 Fundamental Subjects\n\n39\n\n39\n\nB2.2 Capstone Projects\n\n6\n\n6\n\nB2.3 RAI Elective Mandatory Subjects\n\n18\n\n15\n\nB2.4 RAI Elective Subjects\n\n12\n\n9\n\nB2.5 Alternative Study\n\n-\n\n6\n\nC. Free Electives\n\n6\n\n6\n\nD. Internship\n\n0\n\n0\n\n131\n\n131\n\nCourse Group\nA. General Education\n\nB. Robotics and AI Specific Courses\n\nTOTAL\n\nCredits\n(For Regular Students)\n\n\x0c24', '5.3 Time Period\nThe 4th academic year.\n5.4 Credits\n6 Credits\n5.5 Preparation\nThe proposal must be proposed with the approval of the program committee.\n5.6 Evaluation Process\nAn evaluation is provided by a committee, which consists of instructors in the program by arranging\nan examination in each semester.\n6. Additional Costs']",The GPA requirement for guaranteed admission to the integrated Master program is at least 3.00.,At least 3.00.,1.0,0.9999999999999999,0.99999999995,1.0
What is the focus of the first-year projects?,"['communication skills. Students will also be introduced to fundamental programming concepts and the\nfoundation of robotics systems. The first-year projects will give students hands-on experience, introduction\nand basic development of robotics technologies.\nIn the second year, the students will learn advanced robotics concepts which serve as the foundation', 'to drive innovations and entrepreneurship in robotics and AI technology-related areas. Each semester will\ninclude a project- based theme which helps students practice and design innovative solutions in the\nrespective areas.\nIn the first year, the students study basic courses in mathematics and science and improve their', 'projects, group work, lecture, discussion, reading, writing, and presenting.\n01006521', ""students to generate innovations. We want our graduate to be ready for the ever-changing technological\nlandscape.\nThe curriculum is designed to drive innovations. By combining theoretical foundations with handson experience and project- based learning, the students will learn the skills required for today’ s\nworkforce. We embrace the 21st century learning environment to cultivate the students' creativity,"", 'and content creation. Students will work with standard virtual reality framework, learn about design and\nexisting constraints, implement projects to create immersive environments for users and potential\napplications.\n01416614', 'INTEGRATED DESIGN PROJECT 2\n4 (2-4-10)\nPREREQUISITE: NONE\nThe project design aspects of the work enhancing students’ awareness regarding key issues\nsuch as globalisation, climate change, sustainability and inequality, and the way these impact their role as\nEngineers, working in teams. Design solutions to real world project scenarios. The systems engineering', 'such as machine perception application development, cognition and reasoning and IoT. Students will also\nlearn about AI engineering, along with the process and tools to facilitate new innovations.\nFourth-year students undertake significant RAI engineering capstone design projects. Students will apply\ntheir skills and knowledge to create sustainable innovations, practice open-ended engineering design and/or', 'of robotics technologies. The students also learn to apply design methods for solutions in technical areas\nsuch as control systems design and kinematics and dynamics.\nThird- year students will learn about the latest technologies and AI which happen in the area. In each\nsemester, the students will study new concepts and apply creativity in completing projects in trending areas', 'the broad education necessary to understand the impact of engineering solutions in a global,\neconomic, environmental, and societal context via RAI industrial prototyping projects\nrecognition of the need for, and an ability to engage in life-long learning from cooperation or\nacademic training programs\nknowledge of contemporary issues via and ability to use the techniques, skills, and modern', ""introduced to emerging trends in Engineering and the relevance of our courses. New courses and research\nopportunities will be presented, including the faculty's research fields. The course also discusses basic\nlearning and working ethics and prepares students career-making skills. Pass/Fail, required to graduate."", 'or specialized concepts. They will be able to explore and translate the benefit, the uniqueness, and the\ncredibility of innovative ideas to a target audience.\n01006515', '11. External Situation or Development Needed to be Considered for the Planning of the Program .......... 9\n12. Effects from 11.1 and 11.2 on the Development of the Program and the Relation to the Mission of\nthe Institute........................................................................................................................................................................ 9', 'how to develop content requirements, create an effective, informative design.\n01416620', 'approach and design philosophy. Project Planning, management and effective team working. Health and\nSafety aspects and impact on design. Sustainability aspects of design, including stakeholder engagement;\nethics; human factors. Nature of risk in working/business operations; risk management.\n01416622', 'EMERGING TRENDS IN ENGINEERING\n1 (1-0-2)\nPREREQUISITE: NONE\nThis course consists of a series of lectures given by different faculty members and distinguished\nspeakers from the academic and industries. The lectures are designed to provide students a good\nunderstanding of each curriculum structure and the courses in each subject areas. Students will be', '1) Have a good critical thinking.\n2) Be able to gather, study, analyze,\nand summarize issues and\nrequirements.\n3) Be able to analyze and solve\nengineering problems\nsystematically. Use decisionmaking information to work\neffectively.\n4) Have the imagination and flexibility\nto adapt the relevant knowledge\nappropriately to create innovation.\n5) Be able to search, interpret, and\nevaluate information for use in', '01006512\nASIAN STUDY\n01006514\nINNOVATIVE COMMUNICATION\n01006515\nDESIGN METHODS FOR INNOVATIONS\n01006516\nINNOVATION MANAGEMENT\n01006517\nLEAN STARTUP AND AGILE BUSSINESS\n01006518\nEMERGING TRENDS IN ENGINEERING\n01006519\nINTRODUCTION TO ENVIRONMENTAL PRINCIPLES\n01006520\nLEADERSHIP AND PERSONAL DEVELOPMENT\n01006521\nMEDITATION FOR LIFE DEVELOPMENT\n01006522\nENGLISH FOR SCIENCE AND TECHNOLOGY', 'Academic Year', '99\nThis course covers the basic principles of lean startup and agile business practice. Students will learn how\nto create an innovation accounting system to build products that meets customer demands; find the easiest\nand fastest ways to build minimum viable products to reduce time-to-market; learn tactics for improvement', 'safety, manufacturability, and sustainability. Each team must prepare and deliver oral presentations\ndescribing their analysis of the problems, the proposed innovation and the design process.']","The focus of the first-year projects is to give students hands-on experience, introduction, and basic development of robotics technologies.",Hands-on experience and basic robotics development.,0.3333333333333333,0.8074877306423173,0.9166666666361111,1.0
What do students learn in the third year regarding trending areas?,"['Strategy or Activity of Students\n\uf0b7\n\n\uf0b7\n\n\uf0b7', 'development, communities, research and development and product management. Students are exposed\nto issues that challenged real- world organizations. Students will learn best practices used by engineering\nleaders who successfully develop commercially viable products and services, create efficient operating\nprocesses, manage profitable organizations, and transform companies into industry leaders.\n01006517', 'fundamental disagreements between those perspectives. Ultimately, students will advance their\ncontributions to discussions in engineering, business innovations, and technology studies.\n1.2 COMMUNICATION, HUMANITY AND SOCIAL SKILLS\n01006502', 'critical-thinking, communication and collaboration skills. Our students will be introduced to innovative\nmindsets, able to work with multidisciplinary teams and be leaders in their field of study. Our graduates\nwill be lifelong learners who are aware of technical and societal issues. They will be able to create\nengineering innovations with economics impact and benefit our society.\n1.2 Importance', 'such as communication, presentation, and storytelling with data, will be fostered. Students will acquire a', 'to drive innovations and entrepreneurship in robotics and AI technology-related areas. Each semester will\ninclude a project- based theme which helps students practice and design innovative solutions in the\nrespective areas.\nIn the first year, the students study basic courses in mathematics and science and improve their', 'of robotics technologies. The students also learn to apply design methods for solutions in technical areas\nsuch as control systems design and kinematics and dynamics.\nThird- year students will learn about the latest technologies and AI which happen in the area. In each\nsemester, the students will study new concepts and apply creativity in completing projects in trending areas', 'with respect to hardware and user expectation. Students will also learn how to address these constraints\nwith techniques in implementation, software design, and user-interaction design. Additionally, students will\nalso learn about core concepts of modern mobile computing, such as software distribution models and\nlocation awareness.', 'g. Available student activities and clubs that promote personal development.', ""students to generate innovations. We want our graduate to be ready for the ever-changing technological\nlandscape.\nThe curriculum is designed to drive innovations. By combining theoretical foundations with handson experience and project- based learning, the students will learn the skills required for today’ s\nworkforce. We embrace the 21st century learning environment to cultivate the students' creativity,"", 'leadership to establish successful careers in their business, profession,\nand community.\nEconomic Impact: RAI students will apply their technical expertise,\nleadership, and innovative mindset to support and strengthen the\nsociety’s economic well-being.', 'c. Leadership: Our graduates will apply their technical and innovative leadership to establish\nsuccessful careers in their business, profession, and community.\nd. Economic Impact: Our graduates will apply their technical expertise, leadership, and\ninnovative mindset to support and strengthen the society’s economic well-being.', 'such as machine perception application development, cognition and reasoning and IoT. Students will also\nlearn about AI engineering, along with the process and tools to facilitate new innovations.\nFourth-year students undertake significant RAI engineering capstone design projects. Students will apply\ntheir skills and knowledge to create sustainable innovations, practice open-ended engineering design and/or', ""introduced to emerging trends in Engineering and the relevance of our courses. New courses and research\nopportunities will be presented, including the faculty's research fields. The course also discusses basic\nlearning and working ethics and prepares students career-making skills. Pass/Fail, required to graduate."", 'all industries on the verge of digital disruption. Existing businesses will have to adapt and innovatively\ntransform itself in order to stay competitive. Graduates from Robotics and AI will be the major driving\nforce of the transformation using their technical experts and understanding of the economic ecosystem\nand related processes.\n1.3 Program Educational Objectives', 'domestic and other issues.\nc. Arrange activities that promote relationship forming, bonding and caring among students.\nd. Have tracking systems in place to monitor and evaluate students with academic,\nbehavioral and other problems.\ne. Have teaching assistant programs to aid students towards the specified learning outcomes.\nf. Have available scholarships for students with potential.', 'increase the capability of instructors in both teaching and researching.', 'happening in both regional and national parts. By being able to analyze the social and cultural situation\nto create new innovation which improves the way of living of people in the society.This, in turn, causes\nthe strategic drive for self- development of citizens as well as the Thai society toward the society of\nwisdom and life-long learning.', 'technological ideas are generated, developed and transformed into\nnew business products, processes, services and solutions that meet\nthe demands and establish marketplace advantage.\nLifelong Learning: RAI students will learn new technologies,\nmethodologies, and tools and adapt them to respond to the\nchallenges of a changing environment.\nLeadership: RAI students will apply their technical and innovative', 'projects, group work, lecture, discussion, reading, writing, and presenting.\n01006521']","In the third year, students learn about the latest technologies and AI in the area. In each semester, they study new concepts and apply creativity in completing projects in trending areas.","Machine perception, cognition, reasoning, and IoT.",1.0,0.7315891081058321,0.07692307691538462,1.0
What is the credit weight for General Education?,"['6 CREDITS\n\n\x0c30\n\n01006301\n01006302\n01006304\n\nCOOPERATIVE EDUCATION\nSTUDY ABROAD\nOVERSEA TRAINING\n\n6 (0-45-0)\n6 (6-0-12)\n6 (0-45-0)\n\nC. FREE ELECTIVES\n\n6 CREDITS\n\nStudents must complete at least 6 additional credits from any courses offered by the\ninstitution.\nD. RAI INTERNSHIP\n01006805\n\n0 CREDITS\nINDUSTRIAL INTERNSHIPS\n\n3.1.4 Recommended Study Plan\n\n0 (0-45-0)\n\nCredit Notation: (L - E - S)', 'SUBJECT\n\nCREDITS (L-E-S)\n\nCOOPERATIVE EDUCATION\nor\nSTUDY ABROAD\n\n6 (0-45-0)\nor\n6 (6-0-12)\n\nTOTAL CREDITS\n\n6\n\n4th YEAR 2nd SEMESTER\nCODE\n\nSUBJECT\n\nCREDITS (L-E-S)\n\nXXXXXXX\n\n(GENED ELECTIVE)\n\n3 (3-0-6)\n\nXXXXXXX\n\n(FREE ELECTIVE)\n\n3 (X-X-X)\n\n0141XXXX\n\nRAI Elective subject\n\n3 (3-0-6)\n\n0141XXXX\n\nRAI Elective subject\n\n3 (3-0-6)\n\n01416702\n\nRAI ENGINEERING CAPSTONE DESIGN\n\n3 (0-9-5)\n\nTOTAL CREDITS\n\n15', '23\n\n3.1 Curriculum\n3.1.1 Minimum Credits Required for Graduation\n3.1.2 Curriculum Structure (Minimum Credits)\n\n131\n\ncredits\n\n(For UoB 2+2 Program Students)\n\nCredits\n(For Co-op / Study\nAboard Students)\n\n30\n\n30\n\nA1. English Proficiency Requirement (ESL)\n\n9\n\n9\n\nA2. Communication, Humanity, and Social Skills\n\n15\n\n15\n\nA3. Math and Science\n\n6\n\n6\n\n95\n\n95\n\nB1. Core Courses\n\n20\n\n20\n\nB2. Major Compulsory Courses', 'Estimated expenditure per person for producing a scholar according to the program equals\nto an average of 194,613 baht/person/year.\n2.7 Educational System\nClass room\n2.8 Transfer of Credits, Subjects and Cross- Institute Registration of Higher Education\n(if any)\nCredits can be transferred, upon the consent of executive program committee, according to the', '3.1.3 Subjects\nOne academic credit is given to a course offered in a single semester which\n- Meets in class for lecture or discussion for 1 hour per week; or\n- Contains at least 3 laboratory hours per week.\nMost courses are given 3 or more credits. For 4 credit courses, these courses usually contain 3\nhours of lecture or discussion per week. The courses are also accompanied with 1 additional hour', 'occupational or professional skill and life skills.\n3. Criteria for Graduation According to the Program\nStudents must complete at least 131 credits to graduate with at least 30 credits from general education\ncourses; at least 95 credits from Robotics and AI concentration and at least 6 credits of free electives and', '3. Major Field\nNone\n4. Total Credits\nAt least 131 credits\n5. Type of the Program\n5.1 Level\n4-Year Bachelor Program\n5.2 Program Category\n\uf0fe Academic bachelor’s degree program\n\uf0fe Academic bachelor’s degree program\n\uf06f Advanced academic bachelor’s degree program\n\n\x0c5', '3 (0-9-5)\n\nTOTAL CREDITS\n\n15\n\nTotal credits required for graduation at least\n\n3.1.5 Details of Each Subject\nCourse description (Appendix C)\n\n131\n\ncredits\n\n\x0c36\n\n3.2 Name, Surname, ID Number, Position, and Qualification of Instructors\n3.2.1 Executive Program Committees\nName-Surname\n(Academic Position)\nID Number\nAssoc. Prof. Dr. Pitikhate Sooraksa\n(Electrical Engineering)', '0 (0-45-0)\n\nCredit Notation: (L - E - S)\n\nL = Lecture / Learning hours, E = Laboratory hours, S = Self-study hours\nThis study plan shows courses with credits equivalent to 3. However, students can register 4 credit courses\nas well. The total number of credits in each subject category will be counted toward the graduation.\n\n\x0c31\n\n1st YEAR 1st SEMESTER\nCODE\n\nSUBJECT\n\nCREDITS (L-E-S)\n\n01416316', '20\n\n20\n\nB2. Major Compulsory Courses\n\n75\n\n75\n\nB2.1 Fundamental Subjects\n\n39\n\n39\n\nB2.2 Capstone Projects\n\n6\n\n6\n\nB2.3 RAI Elective Mandatory Subjects\n\n18\n\n15\n\nB2.4 RAI Elective Subjects\n\n12\n\n9\n\nB2.5 Alternative Study\n\n-\n\n6\n\nC. Free Electives\n\n6\n\n6\n\nD. Internship\n\n0\n\n0\n\n131\n\n131\n\nCourse Group\nA. General Education\n\nB. Robotics and AI Specific Courses\n\nTOTAL\n\nCredits\n(For Regular Students)\n\n\x0c24', '50\n3. Curriculum Mapping Illustrating the Distribution of Program Standard Learning Outcomes to Course Level Specialized Course\n\uf098\n\nCourse\n\nMajor Responsibility\n\n\uf081\n\nMinor Responsibility\n\n1. Moral and ethics\n\n2. Knowledge\n\n3. Intellectual skills\n\n4. Human relation skills\nand responsibility\n\n5. Skills for mathematical\ncalculation,\ncommunication and\ninformation technology\nadeptness', '6. Additional Costs\nStudents will be responsible for the additional costs apart from tuition fees for all subjects in the\nprogram.', '0141XXXX\n\nRAI Elective subject\n\n3 (3-0-6)\n\nTOTAL CREDITS\n\n12\n\n4th YEAR 2nd SEMESTER\nCODE\n\nSUBJECT\n\nCREDITS (L-E-S)\n\n0141XXXX\n\nRAI Elective subject\n\n3 (3-0-6)\n\n0141XXXX\n\nRAI Elective subject\n\n3 (3-0-6)\n\n01416702\n\nRAI ENGINEERING CAPSTONE DESIGN\n\n3 (0-9-5)\n\nTOTAL CREDITS\n\n9\n\n\x0c35\n\nFOR CO-OP/STUDY ABROAD STUDENTS\n4th YEAR 1st SEMESTER\nCODE\n01006301\nor\n01006302\n\nSUBJECT\n\nCREDITS (L-E-S)', '135,333\n\n252,000\n\n392,000\n\n490,000\n\n536,667\n\n5. Capital\n\n403,600\n\n171,600\n\n171,600\n\n838,267\n\n171,600\n\n- Equipments\n- Accreditation\n\n1,210,800\n\n514,800\n\n514,800\n\n2,514,800\n\n514,800\n\nTotal Expense\n\n3,962,533\n\n5,158,950\n\n7,170,733\n\n8,619,400\n\n8,172,733\n\nEnrollments\n\n60\n\n90\n\n120\n\n150\n\n120', '124\n\nAPPENDIX D\nCurriculum Mapping for General Education Course\n\n\x0c125\nแผนที่แสดงการกระจายความรับผิดชอบมาตรฐานผลการเรียนรู้จากหลักสูตรสู่รายวิชา (Curriculum Mapping)\n\uf098 ความรับผิดชอบหลัก\n\uf081 ความรับผิดชอบรอง\n\nรายวิชา', '3 (0-9-5)\n\nTOTAL CREDITS\n\n15\n\n3rd YEAR 3rd SEMESTER (SUMMER)\nCODE\n01006805\n\nSUBJECT\nINDUSTRIAL INTERNSHIP\nTOTAL CREDITS\n\nCREDITS (L-E-S)\n0 (0-45-0)\n0\n\n\x0c34\n\nFOR REGULAR STUDENTS\n4th YEAR 1st SEMESTER\nCODE\n\nSUBJECT\n\nCREDITS (L-E-S)\n\nXXXXXXX\n\n(FREE ELECTIVE)\n\n3 (X-X-X)\n\nXXXXXXX\n\n(GENED ELECTIVE)\n\n3 (3-0-6)\n\n0141XXXX\n\nRAI Elective mandatory subject\n\n3 (3-0-6)\n\n0141XXXX\n\nRAI Elective subject\n\n3 (3-0-6)', '1. Regulations or Criteria for Grading ..........................................................................................................................59\n2. Verification of Learning Achievement ....................................................................................................................59', '94\n\nAPPENDIX C\nCourse Description\n\n\x0c95\nCOURSE DESCRIPTION\n1. GENERAL EDUCATION\n1.1 ENGLISH PROFICIENCY REQUIREMENT (ESL)\n01416000', '01\n41\n00\n6\n\nmeans Faculty of Engineering\nmeans Robotics and AI program\nmeans shared courses\nmeans bachelor degree\nmeans Order of the subject\n\n\x0c25\n\nA. GENERAL EDUCATION\n\n30 CREDITS\n(LECTURE-LAB-SELF STUDY)\n\nA.1 ENGLISH PROFICIENCY REQUIREMENT (ESL)\n01416000\nACADEMIC LISTENING AND SPEAKING\n01416001\nACADEMIC READING AND WRITING\n01416003\nINTERPRETATION AND ARGUMENTS\n\n9 CREDITS\n3 (3-0-6)\n3 (3-0-6)\n3 (3-0-6)', 'qualification or a related field of study. Their qualification is minimum as Master Degree or equivalent,\nor academic positions no lower than Assistant Professor. Moreover, they have at least one academic\nresults published by the criteria established for the academic position in the past 5 years.\n1.2 Course Instructor: they have direct or indirect qualification Minimum Master Degree or equivalent,']",The credit weight for General Education is 30 credits.,30 credits.,1.0,1.0,0.13596491227390348,1.0
How many credits are assigned to the RAI Engineering Capstone Design?,"['RAI ENGINEERING CAPSTONE DESIGN PREPARATION\n3 (0-9-5)\nPREREQUISITE: NONE\nThis course instructs and prepare students in aspects of effective technical oral\npresentations through exposure to different workplace communication skills. As preparation and research\nfor the capstone design, students must develop topics, identify a supervisor, and prepare a proposal for an', '0141XXXX\n\nRAI Elective subject\n\n3 (3-0-6)\n\nTOTAL CREDITS\n\n18\n\n3rd YEAR 2nd SEMESTER\nCODE\n\nSUBJECT\n\nCREDITS (L-E-S)\n\nXXXXXXX\n\n(GENED ELECTIVE)\n\n3 (3-0-6)\n\n01416315\n\nINDUSTRIAL ELECTRONICS\n\n3 (3-0-6)\n\n0141XXXX\n\nRAI Elective mandatory subject\n\n3 (3-0-6)\n\nXXXXXXX\n\n(FREE ELECTIVE)\n\n3 (X-X-X)\n\n01416701\n\nRAI ENGINEERING CAPSTONE DESIGN PREPARATION\n\n3 (0-9-5)\n\nTOTAL CREDITS\n\n15', 'B.2.2 CAPSTONE PROJECTS\n01416701\nRAI ENGINEERING CAPSTONE DESIGN PREPARATION 4*\n01416702\nRAI ENGINEERING CAPSTONE DESIGN 5*\n4*\ncompare to Module 04 29646 Integrated Design Project 3 of UoB\n5*\ncompare to Module 04 02279 Individual Project of UoB\nB.2.3 RAI ELECTIVE MANDATORY SUBJECTS\nFor Regular Students\nFor UoB 2+2 Program Students\nFor Co-op / Study Aboard Students\n01416401\n01416403\n01416404\n01416406', 'RAI ENGINEERING CAPSTONE DESIGN\n3 (0-9-5)\nPREREQUISITE: 01416701 RAI ENGINEERING CAPSTONE DESIGN PREPARATION\nThis course consists of open- ended design projects that incorporate fundamental and\nadvanced concepts in Robotics and AI. Students will analyze, design and implement innovative prototypes\nwhich require application of standards and realistic engineering constraints. Students from alternative study', '0141XXXX\n\nRAI Elective subject\n\n3 (3-0-6)\n\nTOTAL CREDITS\n\n12\n\n4th YEAR 2nd SEMESTER\nCODE\n\nSUBJECT\n\nCREDITS (L-E-S)\n\n0141XXXX\n\nRAI Elective subject\n\n3 (3-0-6)\n\n0141XXXX\n\nRAI Elective subject\n\n3 (3-0-6)\n\n01416702\n\nRAI ENGINEERING CAPSTONE DESIGN\n\n3 (0-9-5)\n\nTOTAL CREDITS\n\n9\n\n\x0c35\n\nFOR CO-OP/STUDY ABROAD STUDENTS\n4th YEAR 1st SEMESTER\nCODE\n01006301\nor\n01006302\n\nSUBJECT\n\nCREDITS (L-E-S)', 'Students are able to choose between completing preliminary project in Capstone Design Preparation\ncourse or participate in one of the study-abroad program or co-operative education. All Students must also\ncomplete RAI capstone design course prior to graduation. Students may extend their works from the cooperative education assignment or from the preparation course for their capstone design projects.', 'SUBJECT\n\nCREDITS (L-E-S)\n\nCOOPERATIVE EDUCATION\nor\nSTUDY ABROAD\n\n6 (0-45-0)\nor\n6 (6-0-12)\n\nTOTAL CREDITS\n\n6\n\n4th YEAR 2nd SEMESTER\nCODE\n\nSUBJECT\n\nCREDITS (L-E-S)\n\nXXXXXXX\n\n(GENED ELECTIVE)\n\n3 (3-0-6)\n\nXXXXXXX\n\n(FREE ELECTIVE)\n\n3 (X-X-X)\n\n0141XXXX\n\nRAI Elective subject\n\n3 (3-0-6)\n\n0141XXXX\n\nRAI Elective subject\n\n3 (3-0-6)\n\n01416702\n\nRAI ENGINEERING CAPSTONE DESIGN\n\n3 (0-9-5)\n\nTOTAL CREDITS\n\n15', 'engineering tools necessary for engineering practice via RAI senior capstone projects', 'such as machine perception application development, cognition and reasoning and IoT. Students will also\nlearn about AI engineering, along with the process and tools to facilitate new innovations.\nFourth-year students undertake significant RAI engineering capstone design projects. Students will apply\ntheir skills and knowledge to create sustainable innovations, practice open-ended engineering design and/or', '4\n\n5\n\n\uf0b7\n\n01416516 Robotics Laboratory 3\nCAPSTONE PROJECTS\n01416701 RAI Engineering Capstone Design\nPreparation\n01416702 RAI Engineering Capstone Design\nRAI Elective Mandatory Subjects\n\n3\n\n1\n\n2\n\n3\n\n\uf0b7 \uf0b7\n\n4\n\n5\n\n1\n\n2\n\n\uf0b7\n\n3\n\n4\n\n5\n\n\uf0b7 \uf0b7\n\n1\n\n2\n\n3\n\n4\n\n5\n\n\uf0b7\n\n1\n\n2\n\n3\n\n4\n\n\uf0b7 \uf0b7 \uf0b7\n\n5\n\uf0b7\n\n\uf0b7 \uf0b7 \uf0b7 \uf0b7 \uf0b7 \uf0b7 \uf0b7 \uf0b7 \uf0b7 \uf0b7 \uf0b7 \uf0b7 \uf0b7 \uf0b7 \uf0b7 \uf0b7 \uf0b7 \uf0b7 \uf0b7 \uf0b7 \uf0b7 \uf0b7 \uf0b7 \uf0b7 \uf0b7\n\uf0b7 \uf0b7 \uf0b7 \uf0b7 \uf0b7 \uf0b7 \uf0b7 \uf0b7 \uf0b7 \uf0b7 \uf0b7 \uf0b7 \uf0b7 \uf0b7 \uf0b7 \uf0b7 \uf0b7 \uf0b7 \uf0b7 \uf0b7 \uf0b7 \uf0b7 \uf0b7 \uf0b7 \uf0b7\n\uf0b7\n\uf0b7\n\uf0b7\n\uf0b7\n\n\uf0b7\n\uf0b7\n\uf0b7\n\uf0b7\n\n\uf0b7\n\uf0b7\n\uf0b7\n\uf0b7\n\n\uf0b7\n\uf0b7\n\uf0b7\n\uf0b7', '6 CREDITS\n\n\x0c30\n\n01006301\n01006302\n01006304\n\nCOOPERATIVE EDUCATION\nSTUDY ABROAD\nOVERSEA TRAINING\n\n6 (0-45-0)\n6 (6-0-12)\n6 (0-45-0)\n\nC. FREE ELECTIVES\n\n6 CREDITS\n\nStudents must complete at least 6 additional credits from any courses offered by the\ninstitution.\nD. RAI INTERNSHIP\n01006805\n\n0 CREDITS\nINDUSTRIAL INTERNSHIPS\n\n3.1.4 Recommended Study Plan\n\n0 (0-45-0)\n\nCredit Notation: (L - E - S)', 'SUBJECT\n\nCREDITS (L-E-S)\n\n01416801\n\nMATHEMATICS OF DATA SCIENCE AND DATA ANALYTIC\n(GENED, SCIENCE & MATHEMATICS ELECTIVE)\n\n3 (3-0-6)\n\n01416306\n\nSAFTY AND STANDARDIZATION IN RAI\n\n3 (3-0-6)\n\n01416319\n\nMANUFACTURING PROCESS\n\n3 (3-0-6)\n\n01006718\n\nDISCRETE MATHEMATICS (RAI Elective mandatory\nSubject)\n\n3 (3-0-6)\n\n0141XXXX\n\nRAI Elective mandatory subject\n\n3 (3-0-6)\n\n0141XXXX\n\nRAI Elective subject\n\n3 (3-0-6)', '20\n\n20\n\nB2. Major Compulsory Courses\n\n75\n\n75\n\nB2.1 Fundamental Subjects\n\n39\n\n39\n\nB2.2 Capstone Projects\n\n6\n\n6\n\nB2.3 RAI Elective Mandatory Subjects\n\n18\n\n15\n\nB2.4 RAI Elective Subjects\n\n12\n\n9\n\nB2.5 Alternative Study\n\n-\n\n6\n\nC. Free Electives\n\n6\n\n6\n\nD. Internship\n\n0\n\n0\n\n131\n\n131\n\nCourse Group\nA. General Education\n\nB. Robotics and AI Specific Courses\n\nTOTAL\n\nCredits\n(For Regular Students)\n\n\x0c24', 'specifications have been met. The final design reports must address issues, as appropriate, that are related\nto engineering economics, commercialization, manufacturability, environmental, social issues, ethics, and\nhealth and safety. Each team must prepare and deliver oral presentations and demonstrations of their design\nprototype.\nB.2.3 RAI ELECTIVE MANDATORY SUBJECTS\n01416401', '\uf0b7\n\uf0b7\n\uf0b7\n\uf0b7\n\uf0b7\n\uf0b7\n\uf0b7\n\uf0b7\n\uf0b7\n\n\uf0b7\n\uf0b7\n\uf0b7\n\uf0b7\n\uf0b7\n\uf0b7\n\uf0b7\n\uf0b7\n\uf0b7\n\n\uf0b7\n\uf0b7\n\uf0b7\n\uf0b7\n\uf0b7\n\uf0b7\n\uf0b7\n\uf0b7\n\uf0b7\n\n\uf0b7\n\uf0b7\n\uf0b7\n\uf0b7\n\uf0b7\n\uf0b7\n\uf0b7\n\uf0b7\n\uf0b7\n\n\uf0b7\n\n\uf0b7\n\n\uf0b7\n\nRAI Elective Subjects\n01416601 Mechanical System and Laboratory\n\n\uf0b7 \uf0b7\n\n\uf0b7 \uf0b7 \uf0b7 \uf0b7 \uf0b7 \uf0b7 \uf0b7\n\n\x0c57\n1. Moral and ethics\n\n2. Knowledge\n\n3. Intellectual skills\n\n4. Human relation\nskills and\nresponsibility\n\n5. Skills for\nmathematical\ncalculation,\ncommunication and\ninformation\ntechnology\nadeptness\n\nCourse\n\n1\n\n2\n\n3\n\uf0b7\n\n\uf0b7\n\uf0b7\n\uf0b7\n\uf0b7\n\uf0b7\n\uf0b7\n\uf0b7', 'Florida, Imperial College, Chubu University, Kumamoto University, BK Birla Institute of Engineering and\nTechnology, National Formosa University and South Eastern Regional College, etc.\n5.6 Degree Given to the Graduates\nBachelor of Engineering from King Mongkut’s Institute of Technology Ladkrabang\n6. Status of the Program and Consideration for the Authorization/Agreement', '3 (0-9-5)\n\nTOTAL CREDITS\n\n15\n\nTotal credits required for graduation at least\n\n3.1.5 Details of Each Subject\nCourse description (Appendix C)\n\n131\n\ncredits\n\n\x0c36\n\n3.2 Name, Surname, ID Number, Position, and Qualification of Instructors\n3.2.1 Executive Program Committees\nName-Surname\n(Academic Position)\nID Number\nAssoc. Prof. Dr. Pitikhate Sooraksa\n(Electrical Engineering)', 'SUBJECT\n\nCREDITS (L-E-S)\n\n01416316\n\nCOMPUTER PROGRAMMING FOR RAI\n\n3 (2-2-5)\n\n01006710\n\nINTRODUCATION TO CALCULUS\n\n3 (3-0-6)\n\n01006723\n\nGENERAL PHYSICS 1\n\n3 (3-0-6)\n\n01006724\n\nGENERAL PHYSICS LABORATORY 1\n\n1 (0-3-2)\n\n01416309\n\nENGINEERING 3D DRAWING\n\n3 (2-2-5)\n\nXXXXXXX\n\n(GENED ELECTIVE)\n\n3 (3-0-6)\n\n01416000\n\n(ESL) ACADEMIC LISTENING AND SPEAKING\n\n3 (3-0-6)\n\nTOTAL CREDITS\n\n19\n\n1st YEAR 2nd SEMESTER\nCODE', '3 (3-0-6)\n\n01416310\n\nSTRENGTH OF MATERIALS\n\n3 (3-0-6)\n\n01416308\n\nKINEMATICS AND DYNAMICS\n\n3 (3-0-6)\n\n01416305\n\nARTIFICIAL INTELLIGENCE TECHNOLOGY\n\n3 (3-0-6)\n\n01416516\n\nROBOTICS LABORATORY 3\n\n1 (0-3-6)\n\n01416500\n\nComputer vision (RAI Elective mandatory Subject)\n\n3 (3-0-6)\n\nXXXXXXX\n\n(GENED ELECTIVE)\n\n3 (3-0-6)\n\nTOTAL CREDITS\n\n19\n\n\x0c33\n\n3rd YEAR 1st SEMESTER\nCODE\n\nSUBJECT\n\nCREDITS (L-E-S)\n\n01416801', '3 (0-9-5)\n\nTOTAL CREDITS\n\n15\n\n3rd YEAR 3rd SEMESTER (SUMMER)\nCODE\n01006805\n\nSUBJECT\nINDUSTRIAL INTERNSHIP\nTOTAL CREDITS\n\nCREDITS (L-E-S)\n0 (0-45-0)\n0\n\n\x0c34\n\nFOR REGULAR STUDENTS\n4th YEAR 1st SEMESTER\nCODE\n\nSUBJECT\n\nCREDITS (L-E-S)\n\nXXXXXXX\n\n(FREE ELECTIVE)\n\n3 (X-X-X)\n\nXXXXXXX\n\n(GENED ELECTIVE)\n\n3 (3-0-6)\n\n0141XXXX\n\nRAI Elective mandatory subject\n\n3 (3-0-6)\n\n0141XXXX\n\nRAI Elective subject\n\n3 (3-0-6)']",The RAI Engineering Capstone Design is assigned 3 credits.,3 credits.,0.0,0.9943902025637029,0.6830114501865236,1.0
What does the first and second digit of the subject code '01' mean?,"['where students can discuss and ask the recitation leader questions to clarify concepts, facts, or\nproblem sets from the lecture. The laboratory hours give students the opportunity to learn from\nhands-on experience using specialized equipment or software related to the course’s contents.\nMeaning of the Subject Codes\nSubject Codes are assigned with 8 digits as follows:\n1st, 2nd digit:\n3rd, 4th digit\n5th\ndigit', '01\n41\n00\n6\n\nmeans Faculty of Engineering\nmeans Robotics and AI program\nmeans shared courses\nmeans bachelor degree\nmeans Order of the subject\n\n\x0c25\n\nA. GENERAL EDUCATION\n\n30 CREDITS\n(LECTURE-LAB-SELF STUDY)\n\nA.1 ENGLISH PROFICIENCY REQUIREMENT (ESL)\n01416000\nACADEMIC LISTENING AND SPEAKING\n01416001\nACADEMIC READING AND WRITING\n01416003\nINTERPRETATION AND ARGUMENTS\n\n9 CREDITS\n3 (3-0-6)\n3 (3-0-6)\n3 (3-0-6)', '01416401\n01416403\n01416404\n01416406\n01416408\n01416409\n01416413\n01416414\n01416415\n01416416\n01416417\n01416500\n01416503\n01416504\n01416505\n01416507\n01416509\n01416510\n01416511\n01416512\n01416518', '01416612\n\nINFORMATION SECURITY MANAGEMENT\nPREREQUISITE: NONE\n\n3 (3-0-6)', '0141XXXX\n\nRAI Elective subject\n\n3 (3-0-6)\n\nTOTAL CREDITS\n\n12\n\n4th YEAR 2nd SEMESTER\nCODE\n\nSUBJECT\n\nCREDITS (L-E-S)\n\n0141XXXX\n\nRAI Elective subject\n\n3 (3-0-6)\n\n0141XXXX\n\nRAI Elective subject\n\n3 (3-0-6)\n\n01416702\n\nRAI ENGINEERING CAPSTONE DESIGN\n\n3 (0-9-5)\n\nTOTAL CREDITS\n\n9\n\n\x0c35\n\nFOR CO-OP/STUDY ABROAD STUDENTS\n4th YEAR 1st SEMESTER\nCODE\n01006301\nor\n01006302\n\nSUBJECT\n\nCREDITS (L-E-S)', '01416631', '01416617', '01416611', '0141XXXX\n\nRAI Elective subject\n\n3 (3-0-6)\n\nTOTAL CREDITS\n\n18\n\n3rd YEAR 2nd SEMESTER\nCODE\n\nSUBJECT\n\nCREDITS (L-E-S)\n\nXXXXXXX\n\n(GENED ELECTIVE)\n\n3 (3-0-6)\n\n01416315\n\nINDUSTRIAL ELECTRONICS\n\n3 (3-0-6)\n\n0141XXXX\n\nRAI Elective mandatory subject\n\n3 (3-0-6)\n\nXXXXXXX\n\n(FREE ELECTIVE)\n\n3 (X-X-X)\n\n01416701\n\nRAI ENGINEERING CAPSTONE DESIGN PREPARATION\n\n3 (0-9-5)\n\nTOTAL CREDITS\n\n15', '01416316\nCOMPUTER PROGRAMMING FOR RAI\n01416318\nMICROPROCESSOR AND INTERFACE\n01416319\nMANUFACTURING PROCESS 1*\n01416320\nINTRODUCTION TO ROBOTICS AND AI\n01416514\nROBOTICS LABORATORY 1', '1st, 2nd digit:\n3rd, 4th digit\n5th\ndigit\nth th th\n6 , 7 , 8 digit', '01416304\n\nFEEDBACK CONTROL\n\n3 (3-0-6)\n\n01416521\n\nINTRODUCTION TO ALGORITHMS (RAI Elective\nMandatory Subject)\n\n3 (3-0-6)\n\nXXXXXXX\n\n(GENED ELECTIVE)\n\n3 (3-0-6)\n\n01416003\n\n(ESL) INTERPRETATION AND ARGUMENTS\n\n3 (3-0-6)\n\nTOTAL CREDITS\n\n19\n\n2nd YEAR 2nd SEMESTER\nCODE\n\nSUBJECT\n\nCREDITS (L-E-S)\n\n01006719\n\nPROBABILITY AND STATISTICS 1\n(GENED, SCIENCE & MATHEMATICS ELECTIVE)\n\n3 (3-0-6)\n\n01416310', '0 (0-45-0)\n\nCredit Notation: (L - E - S)\n\nL = Lecture / Learning hours, E = Laboratory hours, S = Self-study hours\nThis study plan shows courses with credits equivalent to 3. However, students can register 4 credit courses\nas well. The total number of credits in each subject category will be counted toward the graduation.\n\n\x0c31\n\n1st YEAR 1st SEMESTER\nCODE\n\nSUBJECT\n\nCREDITS (L-E-S)\n\n01416316', '01006711', '01416308\n\nKINEMATICS AND DYNAMICS\n3 (3-0-6)\nPREREQUISITE: NONE\nIntroduction to Kinematics and Dynamics of Robot, Orientation of rigid body, Rigid body kinematics\nand dynamics, Kinematic Chain, Kinetics or Dynamics, Serial and Parallel robots, Robot Manipulator Platform,\nIntroduction to mobile robot platform.\n01416309', 'and AI Systems\n01416507 Preparation and Cognitive Robots\n01416509 System Engineering', '01416306\n\nSAFETY AND STANDARDIZATION IN RAI\n3 (3-0-6)\nPREREQUISITE: NONE\nLaw and standardization, Safety requirement and international standards for Robotics and\nAI such as European Directive, ANSI and ISO etc., Product Standard and Regulations for Safety in Automation\nand Robotics, Applicable standards such as ISO13482, ISO13849, etc. Industrial regulations and safety.\n\n01416308', '01006006 Industrial Experience for Engineers\n09106400 Materials Investigation\n09106401 Photonics\n09106402 Smart Material for Energy Storage\n09106403 Light Emitting Devices and Display\nTechnology\n\n2\n\n3\n\n4\n\n\uf0b7 \uf0b7 \uf0b7\n\n5\n\n1\n\n2\n\n3\n\n\uf0b7 \uf0b7 \uf0b7\n\n4\n\n5\n\n1\n\n2\n\n3\n\n4\n\n5\n\n1\n\n\uf0b7 \uf0b7 \uf0b7 \uf0b7 \uf0b7 \uf0b7 \uf0b7 \uf0b7\n\n2\n\n3\n\n4\n\n5\n\n1\n\n2\n\n3\n\n4\n\n5\n\n\uf0b7 \uf0b7 \uf0b7 \uf0b7 \uf0b7 \uf0b7 \uf0b7 \uf0b7', '26\n\n01006713\n01006714\n01006701\n\nMATHEMATICAL CRYPTOGRAPHY\n4 (4-0-8)\nMATHEMATICS FOR 3D GAME AND COMPUTER GRAPHICS 4 (4-0-8)\nMATHEMATICS OF DATA SCIENCE\n4 (4-0-8)\n\nTRACK UNIVERSITY OF BIRMINGHAM 2+2 DUAL DEGREE PROGRAM\n(Only students in UoB 2+2 Dual Degree program may choose the courses in this course.)\n01416802\n\nADVANCED ENGINEERING MATHEMATICS', 'SUBJECT\n\nCREDITS (L-E-S)\n\n01416316\n\nCOMPUTER PROGRAMMING FOR RAI\n\n3 (2-2-5)\n\n01006710\n\nINTRODUCATION TO CALCULUS\n\n3 (3-0-6)\n\n01006723\n\nGENERAL PHYSICS 1\n\n3 (3-0-6)\n\n01006724\n\nGENERAL PHYSICS LABORATORY 1\n\n1 (0-3-2)\n\n01416309\n\nENGINEERING 3D DRAWING\n\n3 (2-2-5)\n\nXXXXXXX\n\n(GENED ELECTIVE)\n\n3 (3-0-6)\n\n01416000\n\n(ESL) ACADEMIC LISTENING AND SPEAKING\n\n3 (3-0-6)\n\nTOTAL CREDITS\n\n19\n\n1st YEAR 2nd SEMESTER\nCODE']",The first and second digit of the subject code '01' means Faculty of Engineering.,Faculty of Engineering.,0.5,0.9733478665414593,0.49999999995,1.0
What does the third and fourth digit '41' mean in the subject code?,"['where students can discuss and ask the recitation leader questions to clarify concepts, facts, or\nproblem sets from the lecture. The laboratory hours give students the opportunity to learn from\nhands-on experience using specialized equipment or software related to the course’s contents.\nMeaning of the Subject Codes\nSubject Codes are assigned with 8 digits as follows:\n1st, 2nd digit:\n3rd, 4th digit\n5th\ndigit', '45', '1. Development of Special Characteristics of Students ........................................................................................45\n2. Development of Learning Results in Each Aspect .............................................................................................46\n3. Curriculum Mapping Illustrating the Distribution of Program Standard Learning Outcomes to Course', '4. Total Credits .................................................................................................................................................................. 4\n5. Type of the Program ................................................................................................................................................... 4', '01416401\n01416403\n01416404\n01416406\n01416408\n01416409\n01416413\n01416414\n01416415\n01416416\n01416417\n01416500\n01416503\n01416504\n01416505\n01416507\n01416509\n01416510\n01416511\n01416512\n01416518', '1st, 2nd digit:\n3rd, 4th digit\n5th\ndigit\nth th th\n6 , 7 , 8 digit', '01\n41\n00\n6\n\nmeans Faculty of Engineering\nmeans Robotics and AI program\nmeans shared courses\nmeans bachelor degree\nmeans Order of the subject\n\n\x0c25\n\nA. GENERAL EDUCATION\n\n30 CREDITS\n(LECTURE-LAB-SELF STUDY)\n\nA.1 ENGLISH PROFICIENCY REQUIREMENT (ESL)\n01416000\nACADEMIC LISTENING AND SPEAKING\n01416001\nACADEMIC READING AND WRITING\n01416003\nINTERPRETATION AND ARGUMENTS\n\n9 CREDITS\n3 (3-0-6)\n3 (3-0-6)\n3 (3-0-6)', '5\n\n\uf0b7 \uf0b7 \uf0b7\n\n\uf0b7 \uf0b7 \uf0b7\n\n\uf0b7 \uf0b7 \uf0b7 \uf0b7 \uf0b7 \uf0b7 \uf0b7\n\n\uf0b7 \uf0b7\n\n\uf0b7 \uf0b7 \uf0b7 \uf0b7 \uf0b7\n\n\uf0b7\n\uf0b7\n\uf0b7\n\n\uf0b7 \uf0b7\n\uf0b7 \uf0b7\n\uf0b7 \uf0b7\n\n\uf0b7 \uf0b7 \uf0b7 \uf0b7 \uf0b7 \uf0b7 \uf0b7\n\uf0b7 \uf0b7 \uf0b7 \uf0b7 \uf0b7 \uf0b7 \uf0b7\n\uf0b7 \uf0b7 \uf0b7 \uf0b7 \uf0b7 \uf0b7 \uf0b7\n\n\uf0b7 \uf0b7\n\uf0b7 \uf0b7\n\uf0b7 \uf0b7\n\n\uf0b7 \uf0b7 \uf0b7 \uf0b7 \uf0b7\n\uf0b7 \uf0b7 \uf0b7 \uf0b7 \uf0b7\n\uf0b7 \uf0b7 \uf0b7 \uf0b7 \uf0b7\n\n\uf0b7 \uf0b7 \uf0b7 \uf0b7 \uf0b7 \uf0b7 \uf0b7 \uf0b7 \uf0b7 \uf0b7 \uf0b7 \uf0b7 \uf0b7 \uf0b7 \uf0b7 \uf0b7 \uf0b7 \uf0b7 \uf0b7 \uf0b7 \uf0b7 \uf0b7 \uf0b7 \uf0b7 \uf0b7\n\uf0b7 \uf0b7 \uf0b7 \uf0b7 \uf0b7 \uf0b7 \uf0b7 \uf0b7 \uf0b7 \uf0b7 \uf0b7 \uf0b7 \uf0b7 \uf0b7 \uf0b7 \uf0b7 \uf0b7 \uf0b7 \uf0b7 \uf0b7 \uf0b7 \uf0b7 \uf0b7 \uf0b7 \uf0b7\n● ● ● ● ● ● ● ● ● ● ● ● ● ● ● ● ● ● ● ● ● ● ● ● ●\n● ● ● ● ● ● ● ● ● ● ● ● ● ● ● ● ● ● ● ● ● ● ● ● ●\n\n\x0c61', 'and AI Systems\n01416507 Preparation and Cognitive Robots\n01416509 System Engineering', '0 (0-45-0)\n\nCredit Notation: (L - E - S)\n\nL = Lecture / Learning hours, E = Laboratory hours, S = Self-study hours\nThis study plan shows courses with credits equivalent to 3. However, students can register 4 credit courses\nas well. The total number of credits in each subject category will be counted toward the graduation.\n\n\x0c31\n\n1st YEAR 1st SEMESTER\nCODE\n\nSUBJECT\n\nCREDITS (L-E-S)\n\n01416316', '26\n\n01006713\n01006714\n01006701\n\nMATHEMATICAL CRYPTOGRAPHY\n4 (4-0-8)\nMATHEMATICS FOR 3D GAME AND COMPUTER GRAPHICS 4 (4-0-8)\nMATHEMATICS OF DATA SCIENCE\n4 (4-0-8)\n\nTRACK UNIVERSITY OF BIRMINGHAM 2+2 DUAL DEGREE PROGRAM\n(Only students in UoB 2+2 Dual Degree program may choose the courses in this course.)\n01416802\n\nADVANCED ENGINEERING MATHEMATICS', '0141XXXX\n\nRAI Elective subject\n\n3 (3-0-6)\n\nTOTAL CREDITS\n\n12\n\n4th YEAR 2nd SEMESTER\nCODE\n\nSUBJECT\n\nCREDITS (L-E-S)\n\n0141XXXX\n\nRAI Elective subject\n\n3 (3-0-6)\n\n0141XXXX\n\nRAI Elective subject\n\n3 (3-0-6)\n\n01416702\n\nRAI ENGINEERING CAPSTONE DESIGN\n\n3 (0-9-5)\n\nTOTAL CREDITS\n\n9\n\n\x0c35\n\nFOR CO-OP/STUDY ABROAD STUDENTS\n4th YEAR 1st SEMESTER\nCODE\n01006301\nor\n01006302\n\nSUBJECT\n\nCREDITS (L-E-S)', '4. Component Regarding Field Experience (Internship or Co-Operative Education).......................................43\n5. Regulations for Special Project or Co-Operative Education .............................................................................43', '6. Status of the Program and Consideration for the Authorization/Agreement................................................. 5\n7. Readiness for Publicization as Qualified and Standardized Program ............................................................... 5', '01416304\n\nFEEDBACK CONTROL\n\n3 (3-0-6)\n\n01416521\n\nINTRODUCTION TO ALGORITHMS (RAI Elective\nMandatory Subject)\n\n3 (3-0-6)\n\nXXXXXXX\n\n(GENED ELECTIVE)\n\n3 (3-0-6)\n\n01416003\n\n(ESL) INTERPRETATION AND ARGUMENTS\n\n3 (3-0-6)\n\nTOTAL CREDITS\n\n19\n\n2nd YEAR 2nd SEMESTER\nCODE\n\nSUBJECT\n\nCREDITS (L-E-S)\n\n01006719\n\nPROBABILITY AND STATISTICS 1\n(GENED, SCIENCE & MATHEMATICS ELECTIVE)\n\n3 (3-0-6)\n\n01416310', 'SUBJECT\n\nCREDITS (L-E-S)\n\n01416316\n\nCOMPUTER PROGRAMMING FOR RAI\n\n3 (2-2-5)\n\n01006710\n\nINTRODUCATION TO CALCULUS\n\n3 (3-0-6)\n\n01006723\n\nGENERAL PHYSICS 1\n\n3 (3-0-6)\n\n01006724\n\nGENERAL PHYSICS LABORATORY 1\n\n1 (0-3-2)\n\n01416309\n\nENGINEERING 3D DRAWING\n\n3 (2-2-5)\n\nXXXXXXX\n\n(GENED ELECTIVE)\n\n3 (3-0-6)\n\n01416000\n\n(ESL) ACADEMIC LISTENING AND SPEAKING\n\n3 (3-0-6)\n\nTOTAL CREDITS\n\n19\n\n1st YEAR 2nd SEMESTER\nCODE', '0141XXXX\n\nRAI Elective subject\n\n3 (3-0-6)\n\nTOTAL CREDITS\n\n18\n\n3rd YEAR 2nd SEMESTER\nCODE\n\nSUBJECT\n\nCREDITS (L-E-S)\n\nXXXXXXX\n\n(GENED ELECTIVE)\n\n3 (3-0-6)\n\n01416315\n\nINDUSTRIAL ELECTRONICS\n\n3 (3-0-6)\n\n0141XXXX\n\nRAI Elective mandatory subject\n\n3 (3-0-6)\n\nXXXXXXX\n\n(FREE ELECTIVE)\n\n3 (X-X-X)\n\n01416701\n\nRAI ENGINEERING CAPSTONE DESIGN PREPARATION\n\n3 (0-9-5)\n\nTOTAL CREDITS\n\n15', '1. System for Educational Provision ...........................................................................................................................18\n2. Management of the Program...................................................................................................................................18', '46', 'PART 2: SPECIFIC INFORMATION OF THE PROGRAM ..............................................................................................11\n1. Philosophy, Importance, and Objectives of the Program .................................................................................11']",The third and fourth digit '41' in the subject code means the Robotics and AI program.,Robotics and AI program.,1.0,0.8342098943804965,0.14285714284285714,1.0
What is the course code for 'Professional Ethics'?,"['PROFESSIONAL ETHICS\n3 (3-0-6)\nPREREQUISITE: NONE\nThis course introduces the theory and the practice of professional and engineering ethics,\nincluding code of conducts and regulations in academic, professional and technical fields. Students also\nlearn about different approaches to ethical problems and examine real- life case studies, drawn from a', '96\nvariety of professional contexts. This course helps students develop skills and knowledge to manage and\nengage with ethical issues in their working lives.\n01006503', 'Learning Results\n\nTeaching Strategies\n\nHonesty\n\nIntegrating moral and ethics into subject topics\nor teaching and providing a case study topic for\ndiscussion i.e. news from newspaper,\ntelevision, other media or simulation\n\nMoral and\nEthics\n\nStrategies for Evaluation\n\uf0b7\n\nEvaluation of work assignment\n\n\uf0b7\n\nEvaluation from Academic references\n\n\uf0b7', '50\n3. Curriculum Mapping Illustrating the Distribution of Program Standard Learning Outcomes to Course Level Specialized Course\n\uf098\n\nCourse\n\nMajor Responsibility\n\n\uf081\n\nMinor Responsibility\n\n1. Moral and ethics\n\n2. Knowledge\n\n3. Intellectual skills\n\n4. Human relation skills\nand responsibility\n\n5. Skills for mathematical\ncalculation,\ncommunication and\ninformation technology\nadeptness', '\uf0b7\n\nWork assignment to practice the student\nfor systematically comparative relation\n\nregulation such as rubric score\n\n\x0c49\n\nMapping TQF Learning Outcomes and ABET Student Outcomes\nTQF Learning Outcomes\n\nABET Student Outcomes\n\n1. Moral and Ethics', 'plan for the program so that its quality archives the required standards and discuss with the instructor.', 'ABET Student Outcomes\n\n1. Moral and Ethics\n\n(8) an understanding of professional and ethical responsibility\n(6) the broad education necessary to understand the impact of engineering solutions in a global, economic,\nenvironmental, and societal context\n\n2. Knowledge', '\uf0b7\n\uf0b7\n\uf0b7\n\uf0b7\n\n\uf0b7\n\uf0b7\n\uf0b7\n\uf0b7\n\n\uf0b7\n\uf0b7\n\uf0b7\n\uf0b7\n\n\uf0b7\n\uf0b7\n\uf0b7\n\uf0b7\n\n\uf0b7\n\uf0b7\n\uf0b7\n\uf0b7\n\n\uf0b7\n\uf0b7\n\uf0b7\n\uf0b7\n\n\uf0b7\n\uf0b7\n\uf0b7\n\uf0b7\n\n\uf0b7\n\uf0b7\n\uf0b7\n\uf0b7\n\n\uf0b7\n\uf0b7\n\uf0b7\n\uf0b7\n\n\uf0b7\n\uf0b7\n\uf0b7\n\uf0b7\n\n\uf0b7\n\uf0b7\n\uf0b7\n\uf0b7\n\n\uf0b7\n\uf0b7\n\uf0b7\n\uf0b7\n\n\uf0b7\n\uf0b7\n\n\uf0b7 \uf0b7 \uf0b7 \uf0b7 \uf0b7 \uf0b7 \uf0b7 \uf0b7 \uf0b7 \uf0b7 \uf0b7 \uf0b7\n\uf0b7 \uf0b7 \uf0b7 \uf0b7 \uf0b7 \uf0b7 \uf0b7 \uf0b7 \uf0b7 \uf0b7 \uf0b7 \uf0b7\n\n\uf0b7\n\uf0b7\n\uf0b7\n\uf0b7\n\n\uf0b7\n\uf0b7\n\uf0b7\n\uf0b7\n\n\uf0b7\n\uf0b7\n\uf0b7\n\uf0b7\n\n\uf0b7 \uf0b7 \uf0b7\n\uf0b7 \uf0b7 \uf0b7\n\n\uf0b7\n\uf0b7\n\uf0b7\n\uf0b7\n\n\uf0b7\n\uf0b7\n\uf0b7\n\uf0b7\n\n\uf0b7\n\uf0b7\n\uf0b7\n\uf0b7\n\n\uf0b7 \uf0b7 \uf0b7\n\uf0b7 \uf0b7 \uf0b7\n\n\x0c55\n1. Moral and ethics\n\n2. Knowledge\n\n3. Intellectual skills\n\n4. Human relation\nskills and\nresponsibility', '\uf0b7\n\uf0b7\n\uf0b7\n\uf0b7\n\n\uf0b7\n\uf0b7\n\uf0b7\n\uf0b7\n\uf0b7 \uf0b7 \uf0b7\n\uf0b7\n\uf0b7\n\n\uf0b7\n\uf0b7\n\uf0b7\n\uf0b7\n\uf0b7\n\uf0b7\n\uf0b7\n\n\uf0b7\n\uf0b7\n\uf0b7\n\uf0b7\n\uf0b7\n\uf0b7\n\uf0b7\n\uf0b7\n\n\uf0b7\n\n\uf0b7\n\n\uf0b7\n\uf0b7\n\uf0b7\n\uf0b7\n\uf0b7\n\uf0b7\n\uf0b7 \uf0b7\n\uf0b7\n\n\uf0b7\n\uf0b7\n\uf0b7\n\uf0b7\n\uf0b7 \uf0b7 \uf0b7\n\uf0b7\n\nFUNDAMENTAL COURSE\n01416301 Differential Equations and Matrix\nAlgebra\n\n\uf0b7\n\n\uf0b7 \uf0b7\n\n\uf0b7\n\n\uf0b7\n\n\x0c53\n1. Moral and ethics\n\n2. Knowledge\n\n3. Intellectual skills\n\n4. Human relation\nskills and\nresponsibility\n\n5. Skills for\nmathematical\ncalculation,\ncommunication and\ninformation\ntechnology\nadeptness\n\nCourse', '51\n1. Moral and ethics\n\n2. Knowledge\n\n3. Intellectual skills\n\n4. Human relation\nskills and\nresponsibility\n\n5. Skills for\nmathematical\ncalculation,\ncommunication and\ninformation\ntechnology\nadeptness\n\nCourse\n\n1\n\n2\n\n3\n\n4\n\n5\n\n1\n\n2\n\n3\n\n4\n\n5\n\n1\n\n2\n\n3\n\n\uf0b7 \uf0b7 \uf0b7\n\uf0b7 \uf0b7 \uf0b7\n\uf0b7\n\uf0b7 \uf0b7 \uf0b7\n\uf0b7 \uf0b7 \uf0b7\n\uf0b7\n\uf0b7\n\n\uf0b7\n\uf0b7\n\uf0b7\n\uf0b7\n\uf0b7\n\uf0b7\n\n\uf0b7 \uf0b7 \uf0b7 \uf0b7 \uf0b7 \uf0b7\n\uf0b7 \uf0b7 \uf0b7 \uf0b7 \uf0b7 \uf0b7\n\uf0b7\n\uf0b7\n\uf0b7 \uf0b7\n\uf0b7\n\uf0b7\n\uf0b7\n\uf0b7 \uf0b7\n\uf0b7\n\n\uf0b7\n\n\uf0b7 \uf0b7\n\n\uf0b7 \uf0b7\n\n\uf0b7 \uf0b7\n\uf0b7 \uf0b7\n\n\uf0b7 \uf0b7 \uf0b7 \uf0b7\n\uf0b7 \uf0b7 \uf0b7\n\n\uf0b7 \uf0b7 \uf0b7 \uf0b7 \uf0b7\n\uf0b7 \uf0b7 \uf0b7\n\uf0b7\n\n\uf0b7\n\n\uf0b7 \uf0b7\n\n\uf0b7 \uf0b7\n\n4\n\n5', ""introduced to emerging trends in Engineering and the relevance of our courses. New courses and research\nopportunities will be presented, including the faculty's research fields. The course also discusses basic\nlearning and working ethics and prepares students career-making skills. Pass/Fail, required to graduate."", 'General Education\n01416000 Academic Listening and Speaking\n01416001 Academic Reading and Writing\n01416003 Interpretation and Arguments\n01006502 Professional Ethics\n01006503 Introduction to Psychology\n01006504 Philosophy of Science\n01006505 Creative Thinking\n01006506 Critical Thinking\n01006507 Personal Economics\n01006508 Digital Economy\n01006509 Engineering and Public Policy', '\uf0b7\n\uf0b7\n\uf0b7\n\uf0b7\n\uf0b7\n\uf0b7\n\uf0b7\n\uf0b7\n\uf0b7\n\n\uf0b7\n\uf0b7\n\uf0b7\n\uf0b7\n\uf0b7\n\uf0b7\n\uf0b7\n\uf0b7\n\uf0b7\n\n\uf0b7\n\uf0b7\n\uf0b7\n\uf0b7\n\uf0b7\n\uf0b7\n\uf0b7\n\uf0b7\n\uf0b7\n\n\uf0b7\n\uf0b7\n\uf0b7\n\uf0b7\n\uf0b7\n\uf0b7\n\uf0b7\n\uf0b7\n\uf0b7\n\n\uf0b7\n\n\uf0b7\n\n\uf0b7\n\nRAI Elective Subjects\n01416601 Mechanical System and Laboratory\n\n\uf0b7 \uf0b7\n\n\uf0b7 \uf0b7 \uf0b7 \uf0b7 \uf0b7 \uf0b7 \uf0b7\n\n\x0c57\n1. Moral and ethics\n\n2. Knowledge\n\n3. Intellectual skills\n\n4. Human relation\nskills and\nresponsibility\n\n5. Skills for\nmathematical\ncalculation,\ncommunication and\ninformation\ntechnology\nadeptness\n\nCourse\n\n1\n\n2\n\n3\n\uf0b7\n\n\uf0b7\n\uf0b7\n\uf0b7\n\uf0b7\n\uf0b7\n\uf0b7\n\uf0b7', 'where students can discuss and ask the recitation leader questions to clarify concepts, facts, or\nproblem sets from the lecture. The laboratory hours give students the opportunity to learn from\nhands-on experience using specialized equipment or software related to the course’s contents.\nMeaning of the Subject Codes\nSubject Codes are assigned with 8 digits as follows:\n1st, 2nd digit:\n3rd, 4th digit\n5th\ndigit', '\uf0b7\n\n\uf0b7\n\n\uf0b7\n\nArranging for a special lecture by an expert to contribute to research experience\nand societal impact as well as relating laws and infringements\nArranging for extracurricular activities, i.e., community service.\n\n\x0c47', '\uf0b7\n\uf0b7\n\uf0b7\n\uf0b7 \uf0b7\n\uf0b7 \uf0b7\n\uf0b7\n\n\uf0b7\n\uf0b7\n\n\uf0b7\n\n\uf0b7\n\uf0b7\n\uf0b7\n\uf0b7\n\uf0b7\n\n\uf0b7\n\uf0b7 \uf0b7 \uf0b7 \uf0b7 \uf0b7\n\uf0b7 \uf0b7\n\uf0b7 \uf0b7 \uf0b7\n\n\uf0b7\n\n\uf0b7\n\n\uf0b7\n\n\uf0b7\n\n\x0c52\n1. Moral and ethics\n\n2. Knowledge\n\n3. Intellectual skills\n\n4. Human relation\nskills and\nresponsibility\n\n5. Skills for\nmathematical\ncalculation,\ncommunication and\ninformation\ntechnology\nadeptness\n\nCourse\n\n1\n\n2\n\n\uf0b7\n\uf0b7\n\uf0b7\n\uf0b7\n\n\uf0b7\n\uf0b7\n\uf0b7\n\uf0b7\n\uf0b7\n\uf0b7\n\uf0b7\n\uf0b7\n\n3\n\n4\n\n5\n\n1\n\n2\n\n\uf0b7\n\uf0b7\n\uf0b7\n\uf0b7\n\uf0b7\n\uf0b7 \uf0b7\n\n\uf0b7\n\uf0b7\n\uf0b7\n\uf0b7\n\uf0b7\n\uf0b7\n\uf0b7\n\uf0b7\n\n\uf0b7\n\uf0b7\n\uf0b7\n\uf0b7\n\uf0b7\n\uf0b7\n\uf0b7\n\uf0b7\n\n3\n\n4\n\n5\n\n1\n\n2\n\n3\n\n4\n\n5\n\n1\n\n2\n\n3\n\n4', ""for the duration of the program.\n3.2 The activities are organized to develop students' knowledge, abilities and potential in various ways\nto support 21st-century learning skills.\n3.3 A consultant, who is appointed for academic counseling and guidance to all students, must\nschedule an appointment (Office Hours) for the student to consult."", '\uf0b7\n\uf0b7\n\uf0b7\n\uf0b7\n\uf0b7\n\n\uf0b7\n\uf0b7\n\uf0b7\n\uf0b7\n\uf0b7\n\n\uf0b7\n\uf0b7\n\uf0b7\n\uf0b7\n\uf0b7\n\n\uf0b7\n\uf0b7\n\uf0b7\n\uf0b7\n\uf0b7\n\n\uf0b7\n\uf0b7\n\uf0b7\n\uf0b7\n\uf0b7\n\n\uf0b7\n\uf0b7\n\uf0b7\n\uf0b7\n\uf0b7\n\n\uf0b7\n\uf0b7\n\uf0b7\n\uf0b7\n\uf0b7\n\n\uf0b7\n\uf0b7\n\uf0b7\n\uf0b7\n\uf0b7\n\n\uf0b7\n\uf0b7\n\uf0b7\n\uf0b7\n\uf0b7\n\n\uf0b7\n\uf0b7\n\uf0b7\n\uf0b7\n\uf0b7\n\n\x0c56\n1. Moral and ethics\n\n2. Knowledge\n\n3. Intellectual skills\n\n4. Human relation\nskills and\nresponsibility\n\n5. Skills for\nmathematical\ncalculation,\ncommunication and\ninformation\ntechnology\nadeptness\n\nCourse\n\n1\n\n2\n\n3\n\n5\n\n1\n\n2\n\n3\n\n4\n\n5\n\n1\n\n2\n\n3\n\n4\n\n5', '0 (0-45-0)\n\nCredit Notation: (L - E - S)\n\nL = Lecture / Learning hours, E = Laboratory hours, S = Self-study hours\nThis study plan shows courses with credits equivalent to 3. However, students can register 4 credit courses\nas well. The total number of credits in each subject category will be counted toward the graduation.\n\n\x0c31\n\n1st YEAR 1st SEMESTER\nCODE\n\nSUBJECT\n\nCREDITS (L-E-S)\n\n01416316', '\uf098\n\n\uf098\n\n\uf098\n\n\uf098\n\n\uf098\n\n\uf098\n\n\uf098\n\n\uf098\n\n\uf098\n\n\uf098\n\n\uf098\n\n\uf098\n\n\uf098\n\n\uf0b7\n\uf0b7\n\uf0b7\n\uf0b7\n\uf0b7\n\n\uf0b7 \uf0b7 \uf0b7 \uf0b7 \uf0b7 \uf0b7 \uf0b7 \uf0b7 \uf0b7 \uf0b7\n\uf0b7\n\uf0b7 \uf0b7\n\uf0b7 \uf0b7 \uf0b7 \uf0b7\n\uf0b7\n\uf0b7 \uf0b7\n\uf0b7 \uf0b7 \uf0b7 \uf0b7\n\uf0b7\n\uf0b7 \uf0b7\n\uf0b7 \uf0b7 \uf0b7 \uf0b7\n\uf0b7\n\uf0b7 \uf0b7\n\uf0b7 \uf0b7 \uf0b7 \uf0b7\n\n\uf0b7\n\uf0b7\n\uf0b7\n\uf0b7\n\uf0b7\n\n\x0c60\n1. Moral and ethics\n\n2. Knowledge\n\n3. Intellectual skills\n\n4. Human relation\nskills and\nresponsibility\n\n5. Skills for\nmathematical\ncalculation,\ncommunication and\ninformation\ntechnology\nadeptness\n\nCourse']",The course code for 'Professional Ethics' is 01006502.,01006502.,1.0,1.0,0.083333333325,1.0
How many credits is the 'Academic Listening and Speaking' course?,"['3.1.3 Subjects\nOne academic credit is given to a course offered in a single semester which\n- Meets in class for lecture or discussion for 1 hour per week; or\n- Contains at least 3 laboratory hours per week.\nMost courses are given 3 or more credits. For 4 credit courses, these courses usually contain 3\nhours of lecture or discussion per week. The courses are also accompanied with 1 additional hour', 'ACADEMIC LISTENING AND SPEAKING\n3 (3-0-6)\nPREREQUISITE: NONE\nThe course provides ESL students guidance and extensive practice in listening and speaking\nin academic and professional settings. Listening focuses on understanding spoken English in formats such\nas college lectures and news broadcasts. Note- taking tasks are also included to reinforce aural', '3 (0-9-5)\n\nTOTAL CREDITS\n\n15\n\nTotal credits required for graduation at least\n\n3.1.5 Details of Each Subject\nCourse description (Appendix C)\n\n131\n\ncredits\n\n\x0c36\n\n3.2 Name, Surname, ID Number, Position, and Qualification of Instructors\n3.2.1 Executive Program Committees\nName-Surname\n(Academic Position)\nID Number\nAssoc. Prof. Dr. Pitikhate Sooraksa\n(Electrical Engineering)', '0 (0-45-0)\n\nCredit Notation: (L - E - S)\n\nL = Lecture / Learning hours, E = Laboratory hours, S = Self-study hours\nThis study plan shows courses with credits equivalent to 3. However, students can register 4 credit courses\nas well. The total number of credits in each subject category will be counted toward the graduation.\n\n\x0c31\n\n1st YEAR 1st SEMESTER\nCODE\n\nSUBJECT\n\nCREDITS (L-E-S)\n\n01416316', '23\n\n3.1 Curriculum\n3.1.1 Minimum Credits Required for Graduation\n3.1.2 Curriculum Structure (Minimum Credits)\n\n131\n\ncredits\n\n(For UoB 2+2 Program Students)\n\nCredits\n(For Co-op / Study\nAboard Students)\n\n30\n\n30\n\nA1. English Proficiency Requirement (ESL)\n\n9\n\n9\n\nA2. Communication, Humanity, and Social Skills\n\n15\n\n15\n\nA3. Math and Science\n\n6\n\n6\n\n95\n\n95\n\nB1. Core Courses\n\n20\n\n20\n\nB2. Major Compulsory Courses', 'SUBJECT\n\nCREDITS (L-E-S)\n\n01416316\n\nCOMPUTER PROGRAMMING FOR RAI\n\n3 (2-2-5)\n\n01006710\n\nINTRODUCATION TO CALCULUS\n\n3 (3-0-6)\n\n01006723\n\nGENERAL PHYSICS 1\n\n3 (3-0-6)\n\n01006724\n\nGENERAL PHYSICS LABORATORY 1\n\n1 (0-3-2)\n\n01416309\n\nENGINEERING 3D DRAWING\n\n3 (2-2-5)\n\nXXXXXXX\n\n(GENED ELECTIVE)\n\n3 (3-0-6)\n\n01416000\n\n(ESL) ACADEMIC LISTENING AND SPEAKING\n\n3 (3-0-6)\n\nTOTAL CREDITS\n\n19\n\n1st YEAR 2nd SEMESTER\nCODE', '3. Major Field\nNone\n4. Total Credits\nAt least 131 credits\n5. Type of the Program\n5.1 Level\n4-Year Bachelor Program\n5.2 Program Category\n\uf0fe Academic bachelor’s degree program\n\uf0fe Academic bachelor’s degree program\n\uf06f Advanced academic bachelor’s degree program\n\n\x0c5', '6 CREDITS\n\n\x0c30\n\n01006301\n01006302\n01006304\n\nCOOPERATIVE EDUCATION\nSTUDY ABROAD\nOVERSEA TRAINING\n\n6 (0-45-0)\n6 (6-0-12)\n6 (0-45-0)\n\nC. FREE ELECTIVES\n\n6 CREDITS\n\nStudents must complete at least 6 additional credits from any courses offered by the\ninstitution.\nD. RAI INTERNSHIP\n01006805\n\n0 CREDITS\nINDUSTRIAL INTERNSHIPS\n\n3.1.4 Recommended Study Plan\n\n0 (0-45-0)\n\nCredit Notation: (L - E - S)', 'of recitation or 3 hours of laboratory work per week. Students enrolled in the courses are also\nexpected to spend at least 8 hours outside the class/ lab for studying and completing the\ncoursework.\nThe instructor-led lecture could be delivered as a traditional lecture or include learning\nactivities in which the students can actively participate. The recitation is a compliment to a lecture', 'occupational or professional skill and life skills.\n3. Criteria for Graduation According to the Program\nStudents must complete at least 131 credits to graduate with at least 30 credits from general education\ncourses; at least 95 credits from Robotics and AI concentration and at least 6 credits of free electives and', 'such as stress, intonation, reductions (i.e., informal speech), linking, consonant and vowel production,\nrhythm, and pitch. This course will help participants improve their oral presentation skills through an\nintercultural scientific/technological research project. This course is designed to inspire students to realize', '01\n41\n00\n6\n\nmeans Faculty of Engineering\nmeans Robotics and AI program\nmeans shared courses\nmeans bachelor degree\nmeans Order of the subject\n\n\x0c25\n\nA. GENERAL EDUCATION\n\n30 CREDITS\n(LECTURE-LAB-SELF STUDY)\n\nA.1 ENGLISH PROFICIENCY REQUIREMENT (ESL)\n01416000\nACADEMIC LISTENING AND SPEAKING\n01416001\nACADEMIC READING AND WRITING\n01416003\nINTERPRETATION AND ARGUMENTS\n\n9 CREDITS\n3 (3-0-6)\n3 (3-0-6)\n3 (3-0-6)', 'SUBJECT\n\nCREDITS (L-E-S)\n\nCOOPERATIVE EDUCATION\nor\nSTUDY ABROAD\n\n6 (0-45-0)\nor\n6 (6-0-12)\n\nTOTAL CREDITS\n\n6\n\n4th YEAR 2nd SEMESTER\nCODE\n\nSUBJECT\n\nCREDITS (L-E-S)\n\nXXXXXXX\n\n(GENED ELECTIVE)\n\n3 (3-0-6)\n\nXXXXXXX\n\n(FREE ELECTIVE)\n\n3 (X-X-X)\n\n0141XXXX\n\nRAI Elective subject\n\n3 (3-0-6)\n\n0141XXXX\n\nRAI Elective subject\n\n3 (3-0-6)\n\n01416702\n\nRAI ENGINEERING CAPSTONE DESIGN\n\n3 (0-9-5)\n\nTOTAL CREDITS\n\n15', '5.3 Time Period\nThe 4th academic year.\n5.4 Credits\n6 Credits\n5.5 Preparation\nThe proposal must be proposed with the approval of the program committee.\n5.6 Evaluation Process\nAn evaluation is provided by a committee, which consists of instructors in the program by arranging\nan examination in each semester.\n6. Additional Costs', '20\n\n20\n\nB2. Major Compulsory Courses\n\n75\n\n75\n\nB2.1 Fundamental Subjects\n\n39\n\n39\n\nB2.2 Capstone Projects\n\n6\n\n6\n\nB2.3 RAI Elective Mandatory Subjects\n\n18\n\n15\n\nB2.4 RAI Elective Subjects\n\n12\n\n9\n\nB2.5 Alternative Study\n\n-\n\n6\n\nC. Free Electives\n\n6\n\n6\n\nD. Internship\n\n0\n\n0\n\n131\n\n131\n\nCourse Group\nA. General Education\n\nB. Robotics and AI Specific Courses\n\nTOTAL\n\nCredits\n(For Regular Students)\n\n\x0c24', 'ENGLISH FOR SCIENCE AND TECHNOLOGY\n3 (3-0-6)\nPREREQUISITE: NONE\nThis course will help students improve their critical thinking/analytical skills through a\ncombination of reading articles, listening to lectures, and watching audiovisual programs on current hot\ntopics in science and technology. Students will have directed practice in various areas of pronunciation,', '5.3 Medium of Instruction\nEnglish\n5.4 Admission\nThai and/or Foreign students\n5.5 Collaboration with Other Institutes\nThe program is in collaboration with many universities according to the memorandum of\nunderstanding (MOU) such as College of Engineering, Carnegie Mellon University, the University of South', 'Estimated expenditure per person for producing a scholar according to the program equals\nto an average of 194,613 baht/person/year.\n2.7 Educational System\nClass room\n2.8 Transfer of Credits, Subjects and Cross- Institute Registration of Higher Education\n(if any)\nCredits can be transferred, upon the consent of executive program committee, according to the', '3. Curriculum and Instructors\nThe B. Eng. in Robotics and AI program is a four- year full- time undergraduate program. In order to\ngraduate, the students must complete at least 131 credits. Students must achieve the required English\nproficiency level prior to the graduation and satisfy the graduation requirements. The program is designed', '0141XXXX\n\nRAI Elective subject\n\n3 (3-0-6)\n\nTOTAL CREDITS\n\n12\n\n4th YEAR 2nd SEMESTER\nCODE\n\nSUBJECT\n\nCREDITS (L-E-S)\n\n0141XXXX\n\nRAI Elective subject\n\n3 (3-0-6)\n\n0141XXXX\n\nRAI Elective subject\n\n3 (3-0-6)\n\n01416702\n\nRAI ENGINEERING CAPSTONE DESIGN\n\n3 (0-9-5)\n\nTOTAL CREDITS\n\n9\n\n\x0c35\n\nFOR CO-OP/STUDY ABROAD STUDENTS\n4th YEAR 1st SEMESTER\nCODE\n01006301\nor\n01006302\n\nSUBJECT\n\nCREDITS (L-E-S)']",The 'Academic Listening and Speaking' course is 3 credits.,3 (3-0-6) credits.,1.0,0.9429094856548212,0.757977207968786,1.0
What is the prerequisite for 'Advanced Calculus'?,"['INTRODUCTION TO CALCULUS\n3 (3-0-6)\nPREREQUISITE: NONE\nFunction, Limit, Continuity and their applications, Mathematical induction, Introduction to\nderivative, Differentiation, Applications of derivative, Definite integrals, Antiderivative integration, Application\nof definite integral, Indeterminate forms, Improper integrals, Numerical integration, Sequences and series of', 'ENGINEERING MATHEMATICS 3\nPREREQUISITE: NONE\n\n4 (4-0-8)', 'ADVANCED CALCULUS\n3 (3-0-6)\nPREREQUISITE: 01006710 INTRODUCTION TO CALCULUS\nFunctions of several variables and theirs applications, Vector algebra in three dimensions, Polar coordinates,\nCalculus of real - valued functions of two variables, Differentiation and integration of real - valued and\nvector - valued functions of multiple real variables, Introduction to line integrals, Lines, planes and surfaces', '\uf0b7\n\uf0b7\n\uf0b7\n\uf0b7\n\n\uf0b7\n\uf0b7\n\uf0b7\n\uf0b7\n\uf0b7 \uf0b7 \uf0b7\n\uf0b7\n\uf0b7\n\n\uf0b7\n\uf0b7\n\uf0b7\n\uf0b7\n\uf0b7\n\uf0b7\n\uf0b7\n\n\uf0b7\n\uf0b7\n\uf0b7\n\uf0b7\n\uf0b7\n\uf0b7\n\uf0b7\n\uf0b7\n\n\uf0b7\n\n\uf0b7\n\n\uf0b7\n\uf0b7\n\uf0b7\n\uf0b7\n\uf0b7\n\uf0b7\n\uf0b7 \uf0b7\n\uf0b7\n\n\uf0b7\n\uf0b7\n\uf0b7\n\uf0b7\n\uf0b7 \uf0b7 \uf0b7\n\uf0b7\n\nFUNDAMENTAL COURSE\n01416301 Differential Equations and Matrix\nAlgebra\n\n\uf0b7\n\n\uf0b7 \uf0b7\n\n\uf0b7\n\n\uf0b7\n\n\x0c53\n1. Moral and ethics\n\n2. Knowledge\n\n3. Intellectual skills\n\n4. Human relation\nskills and\nresponsibility\n\n5. Skills for\nmathematical\ncalculation,\ncommunication and\ninformation\ntechnology\nadeptness\n\nCourse', 'ADVANCED ENGINEERING MATHEMATICS\n\nB. ROBOTICS AND AI COURSE SPECIFIC COURSES\nB.1 CORE COURSE\n01006710\n01006711\n01006723\n01006724\n01006725\n01006726\n01006803\n01416310\n\n4 (4-0-8)\n\n95 CREDITS\n(LECTURE-LAB-SELF STUDY)\n\nINTRODUCTION TO CALCULUS\nADVANCED CALCULUS\nGENERAL PHYSICS 1\nGENERAL PHYSICS LABORATORY 1\nGENERAL PHYSICS 2\nGENERAL PHYSICS LABORATORY 2\nENGINEERING MECHANICS\nSTRENGTH OF MATERIALS', 'GENERAL PHYSICS 1\n3 (3-0-6)\nPREREQUISITE: NONE\nThis course covers basic physics and mechanics including a study of motion, space and\ntime, kinematics, Newton’s law of motion, forces, energy and momentum, work, power, conservation laws,\nsystems of particles, linear momentum, circular motion, rotation, torques, harmonic oscillation and\ngravitation.\n01006724', '3\n\n4\n\n5\n\n1\n\n2\n\n3\n\n4\n\n5\n\n1\n\n2\n\n3\n\n4\n\n5\n\n1\n\n2\n\n3\n\n4\n\n5\n\nCORE COURSE\n01006710 Introduction to Calculus\n01006711 Advanced Calculus\n01006723 General Physics 1\n01006724 General Physics Laboratory 1\n01006725 General Physics 2\n01006726 General Physics Laboratory 2\n01006803 Engineering Mechanics\n01416310 Strength of Materials\n\n\uf0b7\n\n\uf0b7\n\uf0b7\n\uf0b7\n\uf0b7\n\n\uf0b7\n\uf0b7\n\uf0b7\n\uf0b7\n\uf0b7\n\uf0b7\n\uf0b7 \uf0b7 \uf0b7\n\uf0b7\n\n\uf0b7\n\uf0b7\n\uf0b7\n\uf0b7\n\n\uf0b7\n\uf0b7\n\uf0b7\n\uf0b7\n\uf0b7 \uf0b7 \uf0b7\n\uf0b7\n\uf0b7\n\n\uf0b7\n\uf0b7\n\uf0b7\n\uf0b7\n\uf0b7\n\uf0b7\n\uf0b7', '4. Human relation\nskills and\nresponsibility\n\n5. Skills for\nmathematical\ncalculation,\ncommunication and\ninformation\ntechnology\nadeptness\n\nCourse', 'decision making, as well as data security and data privacy. This introductory course is integrative across the\ncore disciplines of Data Science, including databases, data warehousing, statistics, data mining, data\nvisualization, high performance computing, cloud computing, and business intelligence. Professional skills,', '4\n\n5\n\n1\n\uf0b7\n\n\uf0b7\n\uf0b7\n\uf0b7\n\uf0b7\n\uf0b7\n\uf0b7\n\uf0b7\n\n\uf0b7\n\uf0b7\n\uf0b7\n\uf0b7\n\uf0b7\n\uf0b7\n\uf0b7\n\uf0b7\n\uf0b7\n\n2\n\n\uf0b7 \uf0b7 \uf0b7\n\n\uf0b7 \uf0b7 \uf0b7\n\n\uf0b7 \uf0b7 \uf0b7\n\uf0b7 \uf0b7\n\n\uf0b7 \uf0b7 \uf0b7 \uf0b7 \uf0b7 \uf0b7 \uf0b7 \uf0b7 \uf0b7 \uf0b7 \uf0b7 \uf0b7 \uf0b7 \uf0b7 \uf0b7\n\uf0b7 \uf0b7 \uf0b7 \uf0b7 \uf0b7 \uf0b7 \uf0b7 \uf0b7 \uf0b7 \uf0b7\n\uf0b7\n\n5\n\n\uf0b7\n\n\uf0b7 \uf0b7 \uf0b7\n\uf0b7\n\uf0b7 \uf0b7 \uf0b7 \uf0b7 \uf0b7\n\n\x0c58\n1. Moral and ethics\n\n2. Knowledge\n\n3. Intellectual skills\n\n4. Human relation\nskills and\nresponsibility\n\n5. Skills for\nmathematical\ncalculation,\ncommunication and\ninformation\ntechnology\nadeptness\n\nCourse', 'MATHEMATICS FOR 3D GAME AND COMPUTER GRAPHICS\n4 (4-0-8)\nPREREQUISITE: NONE\nThis course provides the mathematical concepts that a developer needs to develop 3D\ncomputer graphics and game engines. Key topics include vectors; matrices; transforms; 3D geometry; ray\ntracing; lighting and shading; illumination; polygonal techniques; visibility determination; curves and surfaces;\nfluid and cloth simulation.', 'ENGLISH FOR SCIENCE AND TECHNOLOGY\n3 (3-0-6)\nPREREQUISITE: NONE\nThis course will help students improve their critical thinking/analytical skills through a\ncombination of reading articles, listening to lectures, and watching audiovisual programs on current hot\ntopics in science and technology. Students will have directed practice in various areas of pronunciation,', 'INTERPRETATION AND ARGUMENTS\n3 (3-0-6)\nPREREQUISITE: NONE\nThis course provides the study of interpreting and analyzing written and visual arguments.\nStudents will learn to identify the underlying values, definitions, and assumptions in those arguments. The\nstudents also learn how to synthesize a multiplicity of competing perspectives, and to articulate', '3. Student\n3.1 There is appropriate student admissions process by defining the criteria and\nqualifications for the students by the curriculum. Moreover,there is preparation course to\nensure that students are ready for their studies and to be able to complete theireducation\nfor the duration of the program.', 'SUBJECT\n\nCREDITS (L-E-S)\n\n01416316\n\nCOMPUTER PROGRAMMING FOR RAI\n\n3 (2-2-5)\n\n01006710\n\nINTRODUCATION TO CALCULUS\n\n3 (3-0-6)\n\n01006723\n\nGENERAL PHYSICS 1\n\n3 (3-0-6)\n\n01006724\n\nGENERAL PHYSICS LABORATORY 1\n\n1 (0-3-2)\n\n01416309\n\nENGINEERING 3D DRAWING\n\n3 (2-2-5)\n\nXXXXXXX\n\n(GENED ELECTIVE)\n\n3 (3-0-6)\n\n01416000\n\n(ESL) ACADEMIC LISTENING AND SPEAKING\n\n3 (3-0-6)\n\nTOTAL CREDITS\n\n19\n\n1st YEAR 2nd SEMESTER\nCODE', 'MACHINE LEARNING IN PRACTICE\nPREREQUISITE: NONE\n\n3 (3-0-6)', ""introduced to emerging trends in Engineering and the relevance of our courses. New courses and research\nopportunities will be presented, including the faculty's research fields. The course also discusses basic\nlearning and working ethics and prepares students career-making skills. Pass/Fail, required to graduate."", 'occupational or professional skill and life skills.\n3. Criteria for Graduation According to the Program\nStudents must complete at least 131 credits to graduate with at least 30 credits from general education\ncourses; at least 95 credits from Robotics and AI concentration and at least 6 credits of free electives and', '\uf0b7 \uf0b7 \uf0b7\n\n\uf0b7 \uf0b7 \uf0b7 \uf0b7 \uf0b7 \uf0b7\n\uf0b7 \uf0b7\n\uf0b7\n\uf0b7\n\uf0b7\n\uf0b7\n\n\uf0b7\n\n\uf0b7 \uf0b7 \uf0b7\n\n\uf0b7 \uf0b7 \uf0b7 \uf0b7 \uf0b7 \uf0b7 \uf0b7\n\uf0b7 \uf0b7 \uf0b7 \uf0b7 \uf0b7 \uf0b7 \uf0b7\n\uf0b7\n\uf0b7 \uf0b7 \uf0b7\n\uf0b7 \uf0b7 \uf0b7 \uf0b7 \uf0b7 \uf0b7 \uf0b7\n\n\uf0b7 \uf0b7\n\n\uf0b7 \uf0b7 \uf0b7\n\n\x0c59\n1. Moral and ethics\n\n2. Knowledge\n\n3. Intellectual skills\n\n4. Human relation\nskills and\nresponsibility\n\n5. Skills for\nmathematical\ncalculation,\ncommunication and\ninformation\ntechnology\nadeptness\n\nCourse', 'ability to learn and apply knowledge of mathematics, science, and engineering\nability to read, draw, apply engineering drawing\nability to create algorithm, understand and write codes using computer languages for engineering\nproblem solving\nability to design and conduct experiments on feedback control system, as well as to analyze and\ninterpret data using advanced mathematics and engineering tools']",The prerequisite for 'Advanced Calculus' is '01006710 Introduction to Calculus'.,01006710 Introduction to Calculus.,1.0,0.9999999999999998,0.3333333333,1.0
What topics are covered in 'General Physics 1'?,"['GENERAL PHYSICS 1\n3 (3-0-6)\nPREREQUISITE: NONE\nThis course covers basic physics and mechanics including a study of motion, space and\ntime, kinematics, Newton’s law of motion, forces, energy and momentum, work, power, conservation laws,\nsystems of particles, linear momentum, circular motion, rotation, torques, harmonic oscillation and\ngravitation.\n01006724', 'GENERAL PHYSICS LABORATORY 1\n1 (0-3-2)\nPREREQUISITE: NONE\nThe experiments that correspond to the subject in 01006723 General Physics 1.\n\n01006725\n\nGENERAL PHYSICS 2\nPREREQUISITE: 01006723 GENERAL PHYSICS 1\n\n3 (3-0-6)', 'GENERAL PHYSICS LABORATORY 2\n1 (0-3-2)\nPREREQUISITE: 01006723 GENERAL PHYSICS 1\nThe experiments that correspond to the subject in 01006725 General Physics 2.\n\n01006803\n\nENGINEERING MECHANICS\n3 (3-0-6)\nPREREQUISITE: NONE\nForce systems, resultant, equilibrium, fluid statics, kinematics and kinetics of particles and\nrigid bodies, Newton’s second law of motion, work and energy, impulse and momentum.\n01006310', '3 (3-0-6)\n\n\x0c103\nThis course provides the physical science required to analyze electrical and electronic\ndevices. Covered topics include electrostatics and electromagnetics, electric field and potential,\nconductors, insulators, capacitors, dielectrics, electric current, electric circuits, magnetic fields and\nelectromagnetism.\n01006726', 'PHILOSOPHY OF SCIENCE\n3 (3-0-6)\nPREREQUISITE: NONE\nThe course provides a study of the thing we call “ science” , together with its nature and\nmethodology. The topics cover the meaning of science, reality, the nature of scientific observations,\nscientific theories and their discovery and formation, scientific explanations and predictions, the problem', 'EMERGING TRENDS IN ENGINEERING\n1 (1-0-2)\nPREREQUISITE: NONE\nThis course consists of a series of lectures given by different faculty members and distinguished\nspeakers from the academic and industries. The lectures are designed to provide students a good\nunderstanding of each curriculum structure and the courses in each subject areas. Students will be', 'ADVANCED ENGINEERING MATHEMATICS\n\nB. ROBOTICS AND AI COURSE SPECIFIC COURSES\nB.1 CORE COURSE\n01006710\n01006711\n01006723\n01006724\n01006725\n01006726\n01006803\n01416310\n\n4 (4-0-8)\n\n95 CREDITS\n(LECTURE-LAB-SELF STUDY)\n\nINTRODUCTION TO CALCULUS\nADVANCED CALCULUS\nGENERAL PHYSICS 1\nGENERAL PHYSICS LABORATORY 1\nGENERAL PHYSICS 2\nGENERAL PHYSICS LABORATORY 2\nENGINEERING MECHANICS\nSTRENGTH OF MATERIALS', '3\n\n4\n\n5\n\n1\n\n2\n\n3\n\n4\n\n5\n\n1\n\n2\n\n3\n\n4\n\n5\n\n1\n\n2\n\n3\n\n4\n\n5\n\nCORE COURSE\n01006710 Introduction to Calculus\n01006711 Advanced Calculus\n01006723 General Physics 1\n01006724 General Physics Laboratory 1\n01006725 General Physics 2\n01006726 General Physics Laboratory 2\n01006803 Engineering Mechanics\n01416310 Strength of Materials\n\n\uf0b7\n\n\uf0b7\n\uf0b7\n\uf0b7\n\uf0b7\n\n\uf0b7\n\uf0b7\n\uf0b7\n\uf0b7\n\uf0b7\n\uf0b7\n\uf0b7 \uf0b7 \uf0b7\n\uf0b7\n\n\uf0b7\n\uf0b7\n\uf0b7\n\uf0b7\n\n\uf0b7\n\uf0b7\n\uf0b7\n\uf0b7\n\uf0b7 \uf0b7 \uf0b7\n\uf0b7\n\uf0b7\n\n\uf0b7\n\uf0b7\n\uf0b7\n\uf0b7\n\uf0b7\n\uf0b7\n\uf0b7', '01416632\n\nSPACE SCIENCE\n4(4-0-8)\nPREREQUISITE: NONE\nThis course provides a study of the Solar system such as the planets and minor members\nof the system, Telescopes, the Sun, the birth, life and death of stars, galaxies and dark matter. Space\nenvironment such as radiation, microgravity, thermal conditions, and solar wind and magnetic fields.\nIntroduction to Spacecraft technology.\n01416633', 'of induction, scientific rationality, the nature of scientific knowledge, concepts of truth, hypothesis testing,\nhypothesis confirmation, hypothesis falsification, logic of scientific method, and scientific progress.\n01006505', '01006727\n\nGENERAL CHEMISTRY\n3 (3-0-6)\nPREREQUISITE: NONE\nThis course provides a study of fundamental principles of chemistry and its applications.\nThe subject matter includes principles of atomic structure, intermolecular forces and bonding, chemical\nreactions, kinetics, thermodynamics, and equilibrium. Relevant examples will be drawn from such areas as\nenvironmental, materials, and biological chemistry.', 'PROBABILITY AND STATISTICS 1\n3 (3-0-6)\nPREREQUISITE: NONE\nCombinatorial analysis, axioms of probability, conditional probability and independence,\nrandom variables, discrete random variables and probability distributions, continuous random variables\nand probability distributions, joint probability distributions and random samples, point estimation,\nstatistical interval based on a single sample.\n01006720', '\uf0b7\n\uf0b7\n\uf0b7\n\uf0b7\n\uf0b7\n\uf0b7\n\uf0b7\n\uf0b7\n\uf0b7\n\n\uf0b7\n\uf0b7\n\uf0b7\n\uf0b7\n\uf0b7\n\uf0b7\n\uf0b7\n\uf0b7\n\uf0b7\n\n\uf0b7\n\uf0b7\n\uf0b7\n\uf0b7\n\uf0b7\n\uf0b7\n\uf0b7\n\uf0b7\n\uf0b7\n\n\uf0b7\n\uf0b7\n\uf0b7\n\uf0b7\n\uf0b7\n\uf0b7\n\uf0b7\n\uf0b7\n\uf0b7\n\n\uf0b7\n\n\uf0b7\n\n\uf0b7\n\nRAI Elective Subjects\n01416601 Mechanical System and Laboratory\n\n\uf0b7 \uf0b7\n\n\uf0b7 \uf0b7 \uf0b7 \uf0b7 \uf0b7 \uf0b7 \uf0b7\n\n\x0c57\n1. Moral and ethics\n\n2. Knowledge\n\n3. Intellectual skills\n\n4. Human relation\nskills and\nresponsibility\n\n5. Skills for\nmathematical\ncalculation,\ncommunication and\ninformation\ntechnology\nadeptness\n\nCourse\n\n1\n\n2\n\n3\n\uf0b7\n\n\uf0b7\n\uf0b7\n\uf0b7\n\uf0b7\n\uf0b7\n\uf0b7\n\uf0b7', '116\nmathematics, physics, and engineering. The second part of the course examines a wide range of CPR\napplications and presents open problems calling for innovative solutions that take into account network\ncomplexity. Students will become familiar with ongoing research in the field and will get a chance to apply', 'CHEMISTRY\n3 (3-0-6)\nPREREQUISITE: NONE\nThis course covers structure of atoms, periodic table, chemical bonding, molecular\nstructure and bonding theories, gases and kinetic molecular theory; chemical thermodynamics, chemical\nkinetics, chemical equilibrium, and introduction to electrochemistry.\nB.2.5 ALTERNATIVE STUDY\n01006301', 'General Education\n01416000 Academic Listening and Speaking\n01416001 Academic Reading and Writing\n01416003 Interpretation and Arguments\n01006502 Professional Ethics\n01006503 Introduction to Psychology\n01006504 Philosophy of Science\n01006505 Creative Thinking\n01006506 Critical Thinking\n01006507 Personal Economics\n01006508 Digital Economy\n01006509 Engineering and Public Policy', 'SUBJECT\n\nCREDITS (L-E-S)\n\n01416316\n\nCOMPUTER PROGRAMMING FOR RAI\n\n3 (2-2-5)\n\n01006710\n\nINTRODUCATION TO CALCULUS\n\n3 (3-0-6)\n\n01006723\n\nGENERAL PHYSICS 1\n\n3 (3-0-6)\n\n01006724\n\nGENERAL PHYSICS LABORATORY 1\n\n1 (0-3-2)\n\n01416309\n\nENGINEERING 3D DRAWING\n\n3 (2-2-5)\n\nXXXXXXX\n\n(GENED ELECTIVE)\n\n3 (3-0-6)\n\n01416000\n\n(ESL) ACADEMIC LISTENING AND SPEAKING\n\n3 (3-0-6)\n\nTOTAL CREDITS\n\n19\n\n1st YEAR 2nd SEMESTER\nCODE', 'competitions. Macroeconomics topics studied include aggregate demand and supply, macroeconomic data\n(e.g. gross domestic product, national income, etc.), management of economic growth, inflation problems,\nunemployment problems, money and banking systems, fiscal and monetary policy, taxation, international\ntrades, and exchange rates.\n01006511', 'B.2 MAJOR COMPULSORY COURSE\nB.2.1 FUNDAMENTAL SUBJECTS\n01416301\nDIFFERENTIAL EQUATIONS AND MATRIX ALGEBRA\n01416304\nFEEDBACK CONTROL\n01416305\nARTIFICIAL INTELLIGENCE TECHNOLOGY\n01416306\nSAFETY AND STANDARDIZATION IN RAI 3*\n01416308\nKINEMATICS AND DYNAMICS\n01416309\nENGIEERING 3D DRAWING\n01416312\nELECTRIC CIRCUIT AND ELECTRONICS\n01416315\nINDUSTRIAL ELECTRONICS 2*\n01416316\nCOMPUTER PROGRAMMING FOR RAI\n01416318', '\uf0b7\n\uf0b7\n\uf0b7\n\uf0b7\n\n\uf0b7\n\uf0b7\n\uf0b7\n\uf0b7\n\uf0b7 \uf0b7 \uf0b7\n\uf0b7\n\uf0b7\n\n\uf0b7\n\uf0b7\n\uf0b7\n\uf0b7\n\uf0b7\n\uf0b7\n\uf0b7\n\n\uf0b7\n\uf0b7\n\uf0b7\n\uf0b7\n\uf0b7\n\uf0b7\n\uf0b7\n\uf0b7\n\n\uf0b7\n\n\uf0b7\n\n\uf0b7\n\uf0b7\n\uf0b7\n\uf0b7\n\uf0b7\n\uf0b7\n\uf0b7 \uf0b7\n\uf0b7\n\n\uf0b7\n\uf0b7\n\uf0b7\n\uf0b7\n\uf0b7 \uf0b7 \uf0b7\n\uf0b7\n\nFUNDAMENTAL COURSE\n01416301 Differential Equations and Matrix\nAlgebra\n\n\uf0b7\n\n\uf0b7 \uf0b7\n\n\uf0b7\n\n\uf0b7\n\n\x0c53\n1. Moral and ethics\n\n2. Knowledge\n\n3. Intellectual skills\n\n4. Human relation\nskills and\nresponsibility\n\n5. Skills for\nmathematical\ncalculation,\ncommunication and\ninformation\ntechnology\nadeptness\n\nCourse']","The course 'General Physics 1' covers basic physics and mechanics, including a study of motion, space and time, kinematics, Newton’s law of motion, forces, energy and momentum, work, power, conservation laws, systems of particles, linear momentum, circular motion, rotation, torques, harmonic oscillation, and gravitation.","Motion, kinematics, Newton's laws, energy, and momentum.",1.0,0.9708059465862859,0.9999999999,1.0
What is the credit structure (L-E-S) for 'Computer Programming for RAI'?,"['SUBJECT\n\nCREDITS (L-E-S)\n\nCOOPERATIVE EDUCATION\nor\nSTUDY ABROAD\n\n6 (0-45-0)\nor\n6 (6-0-12)\n\nTOTAL CREDITS\n\n6\n\n4th YEAR 2nd SEMESTER\nCODE\n\nSUBJECT\n\nCREDITS (L-E-S)\n\nXXXXXXX\n\n(GENED ELECTIVE)\n\n3 (3-0-6)\n\nXXXXXXX\n\n(FREE ELECTIVE)\n\n3 (X-X-X)\n\n0141XXXX\n\nRAI Elective subject\n\n3 (3-0-6)\n\n0141XXXX\n\nRAI Elective subject\n\n3 (3-0-6)\n\n01416702\n\nRAI ENGINEERING CAPSTONE DESIGN\n\n3 (0-9-5)\n\nTOTAL CREDITS\n\n15', '0141XXXX\n\nRAI Elective subject\n\n3 (3-0-6)\n\nTOTAL CREDITS\n\n18\n\n3rd YEAR 2nd SEMESTER\nCODE\n\nSUBJECT\n\nCREDITS (L-E-S)\n\nXXXXXXX\n\n(GENED ELECTIVE)\n\n3 (3-0-6)\n\n01416315\n\nINDUSTRIAL ELECTRONICS\n\n3 (3-0-6)\n\n0141XXXX\n\nRAI Elective mandatory subject\n\n3 (3-0-6)\n\nXXXXXXX\n\n(FREE ELECTIVE)\n\n3 (X-X-X)\n\n01416701\n\nRAI ENGINEERING CAPSTONE DESIGN PREPARATION\n\n3 (0-9-5)\n\nTOTAL CREDITS\n\n15', 'SUBJECT\n\nCREDITS (L-E-S)\n\n01416316\n\nCOMPUTER PROGRAMMING FOR RAI\n\n3 (2-2-5)\n\n01006710\n\nINTRODUCATION TO CALCULUS\n\n3 (3-0-6)\n\n01006723\n\nGENERAL PHYSICS 1\n\n3 (3-0-6)\n\n01006724\n\nGENERAL PHYSICS LABORATORY 1\n\n1 (0-3-2)\n\n01416309\n\nENGINEERING 3D DRAWING\n\n3 (2-2-5)\n\nXXXXXXX\n\n(GENED ELECTIVE)\n\n3 (3-0-6)\n\n01416000\n\n(ESL) ACADEMIC LISTENING AND SPEAKING\n\n3 (3-0-6)\n\nTOTAL CREDITS\n\n19\n\n1st YEAR 2nd SEMESTER\nCODE', '0141XXXX\n\nRAI Elective subject\n\n3 (3-0-6)\n\nTOTAL CREDITS\n\n12\n\n4th YEAR 2nd SEMESTER\nCODE\n\nSUBJECT\n\nCREDITS (L-E-S)\n\n0141XXXX\n\nRAI Elective subject\n\n3 (3-0-6)\n\n0141XXXX\n\nRAI Elective subject\n\n3 (3-0-6)\n\n01416702\n\nRAI ENGINEERING CAPSTONE DESIGN\n\n3 (0-9-5)\n\nTOTAL CREDITS\n\n9\n\n\x0c35\n\nFOR CO-OP/STUDY ABROAD STUDENTS\n4th YEAR 1st SEMESTER\nCODE\n01006301\nor\n01006302\n\nSUBJECT\n\nCREDITS (L-E-S)', 'SUBJECT\n\nCREDITS (L-E-S)\n\n01416801\n\nMATHEMATICS OF DATA SCIENCE AND DATA ANALYTIC\n(GENED, SCIENCE & MATHEMATICS ELECTIVE)\n\n3 (3-0-6)\n\n01416306\n\nSAFTY AND STANDARDIZATION IN RAI\n\n3 (3-0-6)\n\n01416319\n\nMANUFACTURING PROCESS\n\n3 (3-0-6)\n\n01006718\n\nDISCRETE MATHEMATICS (RAI Elective mandatory\nSubject)\n\n3 (3-0-6)\n\n0141XXXX\n\nRAI Elective mandatory subject\n\n3 (3-0-6)\n\n0141XXXX\n\nRAI Elective subject\n\n3 (3-0-6)', '0 (0-45-0)\n\nCredit Notation: (L - E - S)\n\nL = Lecture / Learning hours, E = Laboratory hours, S = Self-study hours\nThis study plan shows courses with credits equivalent to 3. However, students can register 4 credit courses\nas well. The total number of credits in each subject category will be counted toward the graduation.\n\n\x0c31\n\n1st YEAR 1st SEMESTER\nCODE\n\nSUBJECT\n\nCREDITS (L-E-S)\n\n01416316', 'ADVANCED COMPUTER PROGRAMMING FOR RAI\n3 (2-2-5)\nPREREQUISITE: NONE\nConcepts and practice of object-oriented programming; usage of design patterns in objectoriented programming; programming in application development frameworks: graphical user interface and\nevent- driven programming, collection framework, concurrent programming, socket programming, and/ or', 'COMPUTER PROGRAMMING FOR RAI\n3 (2-2-5)\nPREREQUISITE: NONE\nThis course introduces basic concepts of computer programming such as elementary\nprogramming, data types, expressions, simple algorithms and problem solving involving sequential\nstatements, conditionals and iterations. Students learn routines or methods as fundamental concepts and', '6 CREDITS\n\n\x0c30\n\n01006301\n01006302\n01006304\n\nCOOPERATIVE EDUCATION\nSTUDY ABROAD\nOVERSEA TRAINING\n\n6 (0-45-0)\n6 (6-0-12)\n6 (0-45-0)\n\nC. FREE ELECTIVES\n\n6 CREDITS\n\nStudents must complete at least 6 additional credits from any courses offered by the\ninstitution.\nD. RAI INTERNSHIP\n01006805\n\n0 CREDITS\nINDUSTRIAL INTERNSHIPS\n\n3.1.4 Recommended Study Plan\n\n0 (0-45-0)\n\nCredit Notation: (L - E - S)', '3 (0-9-5)\n\nTOTAL CREDITS\n\n15\n\n3rd YEAR 3rd SEMESTER (SUMMER)\nCODE\n01006805\n\nSUBJECT\nINDUSTRIAL INTERNSHIP\nTOTAL CREDITS\n\nCREDITS (L-E-S)\n0 (0-45-0)\n0\n\n\x0c34\n\nFOR REGULAR STUDENTS\n4th YEAR 1st SEMESTER\nCODE\n\nSUBJECT\n\nCREDITS (L-E-S)\n\nXXXXXXX\n\n(FREE ELECTIVE)\n\n3 (X-X-X)\n\nXXXXXXX\n\n(GENED ELECTIVE)\n\n3 (3-0-6)\n\n0141XXXX\n\nRAI Elective mandatory subject\n\n3 (3-0-6)\n\n0141XXXX\n\nRAI Elective subject\n\n3 (3-0-6)', 'TOTAL CREDITS\n\n19\n\n1st YEAR 2nd SEMESTER\nCODE\n\nSUBJECT\n\nCREDITS (L-E-S)\n\n01416320\n\nINTRODUCTION TO ROBOTICS AND AI\n\n3 (3-0-6)\n\n01006803\n\nENGINEERING MECHANICS\n\n3 (3-0-6)\n\n01006711\n\nADVANCED CALCULUS\n\n3 (3-0-6)\n\n01006725\n\nGENERAL PHYSICS 2\n\n3 (3-0-6)\n\n01006726\n\nGENERAL PHYSICS LABORATORY 2\n\n1 (0-3-2)\n\n01416318\n\nMICROPROCESSOR AND INTERFACE\n\n3 (2-2-5)\n\n01416514\n\nROBOTICS LABORATORY 1\n\n1 (0-3-6)\n\n01416001', '20\n\n20\n\nB2. Major Compulsory Courses\n\n75\n\n75\n\nB2.1 Fundamental Subjects\n\n39\n\n39\n\nB2.2 Capstone Projects\n\n6\n\n6\n\nB2.3 RAI Elective Mandatory Subjects\n\n18\n\n15\n\nB2.4 RAI Elective Subjects\n\n12\n\n9\n\nB2.5 Alternative Study\n\n-\n\n6\n\nC. Free Electives\n\n6\n\n6\n\nD. Internship\n\n0\n\n0\n\n131\n\n131\n\nCourse Group\nA. General Education\n\nB. Robotics and AI Specific Courses\n\nTOTAL\n\nCredits\n(For Regular Students)\n\n\x0c24', 'B.2.2 CAPSTONE PROJECTS\n01416701\nRAI ENGINEERING CAPSTONE DESIGN PREPARATION 4*\n01416702\nRAI ENGINEERING CAPSTONE DESIGN 5*\n4*\ncompare to Module 04 29646 Integrated Design Project 3 of UoB\n5*\ncompare to Module 04 02279 Individual Project of UoB\nB.2.3 RAI ELECTIVE MANDATORY SUBJECTS\nFor Regular Students\nFor UoB 2+2 Program Students\nFor Co-op / Study Aboard Students\n01416401\n01416403\n01416404\n01416406', '01416304\n\nFEEDBACK CONTROL\n\n3 (3-0-6)\n\n01416521\n\nINTRODUCTION TO ALGORITHMS (RAI Elective\nMandatory Subject)\n\n3 (3-0-6)\n\nXXXXXXX\n\n(GENED ELECTIVE)\n\n3 (3-0-6)\n\n01416003\n\n(ESL) INTERPRETATION AND ARGUMENTS\n\n3 (3-0-6)\n\nTOTAL CREDITS\n\n19\n\n2nd YEAR 2nd SEMESTER\nCODE\n\nSUBJECT\n\nCREDITS (L-E-S)\n\n01006719\n\nPROBABILITY AND STATISTICS 1\n(GENED, SCIENCE & MATHEMATICS ELECTIVE)\n\n3 (3-0-6)\n\n01416310', '3 (3-0-6)\n\n01416310\n\nSTRENGTH OF MATERIALS\n\n3 (3-0-6)\n\n01416308\n\nKINEMATICS AND DYNAMICS\n\n3 (3-0-6)\n\n01416305\n\nARTIFICIAL INTELLIGENCE TECHNOLOGY\n\n3 (3-0-6)\n\n01416516\n\nROBOTICS LABORATORY 3\n\n1 (0-3-6)\n\n01416500\n\nComputer vision (RAI Elective mandatory Subject)\n\n3 (3-0-6)\n\nXXXXXXX\n\n(GENED ELECTIVE)\n\n3 (3-0-6)\n\nTOTAL CREDITS\n\n19\n\n\x0c33\n\n3rd YEAR 1st SEMESTER\nCODE\n\nSUBJECT\n\nCREDITS (L-E-S)\n\n01416801', '01\n41\n00\n6\n\nmeans Faculty of Engineering\nmeans Robotics and AI program\nmeans shared courses\nmeans bachelor degree\nmeans Order of the subject\n\n\x0c25\n\nA. GENERAL EDUCATION\n\n30 CREDITS\n(LECTURE-LAB-SELF STUDY)\n\nA.1 ENGLISH PROFICIENCY REQUIREMENT (ESL)\n01416000\nACADEMIC LISTENING AND SPEAKING\n01416001\nACADEMIC READING AND WRITING\n01416003\nINTERPRETATION AND ARGUMENTS\n\n9 CREDITS\n3 (3-0-6)\n3 (3-0-6)\n3 (3-0-6)', 'Assoc. Prof. Dr. Chutimet Srinilta\n(Computer Engineering)\n\nQualification (Department), University,\nYear of Graduation\n\nAcademic Achievements', '\uf0b7\n\uf0b7\n\uf0b7\n\uf0b7\n\uf0b7\n\uf0b7\n\uf0b7\n\uf0b7\n\uf0b7\n\n\uf0b7\n\uf0b7\n\uf0b7\n\uf0b7\n\uf0b7\n\uf0b7\n\uf0b7\n\uf0b7\n\uf0b7\n\n\uf0b7\n\uf0b7\n\uf0b7\n\uf0b7\n\uf0b7\n\uf0b7\n\uf0b7\n\uf0b7\n\uf0b7\n\n\uf0b7\n\uf0b7\n\uf0b7\n\uf0b7\n\uf0b7\n\uf0b7\n\uf0b7\n\uf0b7\n\uf0b7\n\n\uf0b7\n\n\uf0b7\n\n\uf0b7\n\nRAI Elective Subjects\n01416601 Mechanical System and Laboratory\n\n\uf0b7 \uf0b7\n\n\uf0b7 \uf0b7 \uf0b7 \uf0b7 \uf0b7 \uf0b7 \uf0b7\n\n\x0c57\n1. Moral and ethics\n\n2. Knowledge\n\n3. Intellectual skills\n\n4. Human relation\nskills and\nresponsibility\n\n5. Skills for\nmathematical\ncalculation,\ncommunication and\ninformation\ntechnology\nadeptness\n\nCourse\n\n1\n\n2\n\n3\n\uf0b7\n\n\uf0b7\n\uf0b7\n\uf0b7\n\uf0b7\n\uf0b7\n\uf0b7\n\uf0b7', '23\n\n3.1 Curriculum\n3.1.1 Minimum Credits Required for Graduation\n3.1.2 Curriculum Structure (Minimum Credits)\n\n131\n\ncredits\n\n(For UoB 2+2 Program Students)\n\nCredits\n(For Co-op / Study\nAboard Students)\n\n30\n\n30\n\nA1. English Proficiency Requirement (ESL)\n\n9\n\n9\n\nA2. Communication, Humanity, and Social Skills\n\n15\n\n15\n\nA3. Math and Science\n\n6\n\n6\n\n95\n\n95\n\nB1. Core Courses\n\n20\n\n20\n\nB2. Major Compulsory Courses', 'RAI ENGINEERING CAPSTONE DESIGN PREPARATION\n3 (0-9-5)\nPREREQUISITE: NONE\nThis course instructs and prepare students in aspects of effective technical oral\npresentations through exposure to different workplace communication skills. As preparation and research\nfor the capstone design, students must develop topics, identify a supervisor, and prepare a proposal for an']",The credit structure (L-E-S) for 'Computer Programming for RAI' is 3 (2-2-5).,3 (2-2-5).,0.6666666666666666,0.9232416404916864,0.40995670994851086,1.0
Which course covers 'Kinematics and Dynamics'?,"['GENERAL PHYSICS 1\n3 (3-0-6)\nPREREQUISITE: NONE\nThis course covers basic physics and mechanics including a study of motion, space and\ntime, kinematics, Newton’s law of motion, forces, energy and momentum, work, power, conservation laws,\nsystems of particles, linear momentum, circular motion, rotation, torques, harmonic oscillation and\ngravitation.\n01006724', 'ADVANCED ENGINEERING MATHEMATICS\n\nB. ROBOTICS AND AI COURSE SPECIFIC COURSES\nB.1 CORE COURSE\n01006710\n01006711\n01006723\n01006724\n01006725\n01006726\n01006803\n01416310\n\n4 (4-0-8)\n\n95 CREDITS\n(LECTURE-LAB-SELF STUDY)\n\nINTRODUCTION TO CALCULUS\nADVANCED CALCULUS\nGENERAL PHYSICS 1\nGENERAL PHYSICS LABORATORY 1\nGENERAL PHYSICS 2\nGENERAL PHYSICS LABORATORY 2\nENGINEERING MECHANICS\nSTRENGTH OF MATERIALS', 'B.2 MAJOR COMPULSORY COURSE\nB.2.1 FUNDAMENTAL SUBJECTS\n01416301\nDIFFERENTIAL EQUATIONS AND MATRIX ALGEBRA\n01416304\nFEEDBACK CONTROL\n01416305\nARTIFICIAL INTELLIGENCE TECHNOLOGY\n01416306\nSAFETY AND STANDARDIZATION IN RAI 3*\n01416308\nKINEMATICS AND DYNAMICS\n01416309\nENGIEERING 3D DRAWING\n01416312\nELECTRIC CIRCUIT AND ELECTRONICS\n01416315\nINDUSTRIAL ELECTRONICS 2*\n01416316\nCOMPUTER PROGRAMMING FOR RAI\n01416318', 'margins) ; reinforcement learning and adaptive control. The course will also discuss recent applications of\nmachine learning, such as to robotic control, data mining, autonomous navigation, bioinformatics, speech\nrecognition, and text and web data processing.\n01416505', 'INTRODUCTION TO ROBOTICS AND AI\n3 (3-0-6)\nPREREQUISITE: NONE\nThe course includes: an overview of robotics and AI technology; introduction to the\nconfiguration space concept, rigid transformation and manipulator kinematics; sensing and control; robot\nprogramming; robot motion planning and applications; robot manipulation. For AI, students can explore the', 'Dr.Weon Keun Song\n(Mechanical Engineering)\n\nPh.D. (Mechanical Engineering), MSTU, Moscow, Russia, 1998\nM.S. (Mechanical Engineering), MSTU, Moscow, Russia, 1994\nB.S. (Civil Engineering), Yonsei University, Seoul, South Korea,\n1991\n\n1. Research (Appendix H)\n- Non-linear System\n- AI\n2. Teaching obligations\n15 hours/weekly\n\n\x0c39\n\n3.2.2 Course instructors\nName-Surname\n(Academic Position)\nID Number', 'of robotics technologies. The students also learn to apply design methods for solutions in technical areas\nsuch as control systems design and kinematics and dynamics.\nThird- year students will learn about the latest technologies and AI which happen in the area. In each\nsemester, the students will study new concepts and apply creativity in completing projects in trending areas', 'Course\n\n1\n\n2\n\n01416401 Thermodynamics\n01416403 Dynamic of Machinery\n01416404 Mechanical Design and Modeling\n01416406 Measurement and Instrumentation for\nMechatronics\n01416408 Computer Aid Mechanical Design\n01416409 Fluid Mechanics\n\n4\n\n5\n\n\uf0b7', '\uf0b7\n\uf0b7\n\uf0b7\n\uf0b7\n\uf0b7\n\uf0b7\n\uf0b7\n\uf0b7\n\uf0b7\n\n\uf0b7\n\uf0b7\n\uf0b7\n\uf0b7\n\uf0b7\n\uf0b7\n\uf0b7\n\uf0b7\n\uf0b7\n\n\uf0b7\n\uf0b7\n\uf0b7\n\uf0b7\n\uf0b7\n\uf0b7\n\uf0b7\n\uf0b7\n\uf0b7\n\n\uf0b7\n\uf0b7\n\uf0b7\n\uf0b7\n\uf0b7\n\uf0b7\n\uf0b7\n\uf0b7\n\uf0b7\n\n\uf0b7\n\n\uf0b7\n\n\uf0b7\n\nRAI Elective Subjects\n01416601 Mechanical System and Laboratory\n\n\uf0b7 \uf0b7\n\n\uf0b7 \uf0b7 \uf0b7 \uf0b7 \uf0b7 \uf0b7 \uf0b7\n\n\x0c57\n1. Moral and ethics\n\n2. Knowledge\n\n3. Intellectual skills\n\n4. Human relation\nskills and\nresponsibility\n\n5. Skills for\nmathematical\ncalculation,\ncommunication and\ninformation\ntechnology\nadeptness\n\nCourse\n\n1\n\n2\n\n3\n\uf0b7\n\n\uf0b7\n\uf0b7\n\uf0b7\n\uf0b7\n\uf0b7\n\uf0b7\n\uf0b7', 'MATHEMATICS FOR 3D GAME AND COMPUTER GRAPHICS\n4 (4-0-8)\nPREREQUISITE: NONE\nThis course provides the mathematical concepts that a developer needs to develop 3D\ncomputer graphics and game engines. Key topics include vectors; matrices; transforms; 3D geometry; ray\ntracing; lighting and shading; illumination; polygonal techniques; visibility determination; curves and surfaces;\nfluid and cloth simulation.', '1. Research: (Appendix H)\n- IT- Automation\n- Industrial Informatics\n2. Textbook\n- Matrix Analysis\n- Differential equation\n- Control System Engineering\n- Chaos Robotic\n3. Teaching obligations\n12 hours/weekly\n\nAssoc. Prof. Dr. Chutimet Srinilta\n(Computer Engineering)', '01416308\n\nKINEMATICS AND DYNAMICS\n3 (3-0-6)\nPREREQUISITE: NONE\nIntroduction to Kinematics and Dynamics of Robot, Orientation of rigid body, Rigid body kinematics\nand dynamics, Kinematic Chain, Kinetics or Dynamics, Serial and Parallel robots, Robot Manipulator Platform,\nIntroduction to mobile robot platform.\n01416309', 'TOTAL CREDITS\n\n19\n\n1st YEAR 2nd SEMESTER\nCODE\n\nSUBJECT\n\nCREDITS (L-E-S)\n\n01416320\n\nINTRODUCTION TO ROBOTICS AND AI\n\n3 (3-0-6)\n\n01006803\n\nENGINEERING MECHANICS\n\n3 (3-0-6)\n\n01006711\n\nADVANCED CALCULUS\n\n3 (3-0-6)\n\n01006725\n\nGENERAL PHYSICS 2\n\n3 (3-0-6)\n\n01006726\n\nGENERAL PHYSICS LABORATORY 2\n\n1 (0-3-2)\n\n01416318\n\nMICROPROCESSOR AND INTERFACE\n\n3 (2-2-5)\n\n01416514\n\nROBOTICS LABORATORY 1\n\n1 (0-3-6)\n\n01416001', 'GENERAL PHYSICS LABORATORY 2\n1 (0-3-2)\nPREREQUISITE: 01006723 GENERAL PHYSICS 1\nThe experiments that correspond to the subject in 01006725 General Physics 2.\n\n01006803\n\nENGINEERING MECHANICS\n3 (3-0-6)\nPREREQUISITE: NONE\nForce systems, resultant, equilibrium, fluid statics, kinematics and kinetics of particles and\nrigid bodies, Newton’s second law of motion, work and energy, impulse and momentum.\n01006310', '\uf0b7\n\uf0b7\n\uf0b7\n\uf0b7\n\n\uf0b7\n\uf0b7\n\uf0b7\n\uf0b7\n\uf0b7 \uf0b7 \uf0b7\n\uf0b7\n\uf0b7\n\n\uf0b7\n\uf0b7\n\uf0b7\n\uf0b7\n\uf0b7\n\uf0b7\n\uf0b7\n\n\uf0b7\n\uf0b7\n\uf0b7\n\uf0b7\n\uf0b7\n\uf0b7\n\uf0b7\n\uf0b7\n\n\uf0b7\n\n\uf0b7\n\n\uf0b7\n\uf0b7\n\uf0b7\n\uf0b7\n\uf0b7\n\uf0b7\n\uf0b7 \uf0b7\n\uf0b7\n\n\uf0b7\n\uf0b7\n\uf0b7\n\uf0b7\n\uf0b7 \uf0b7 \uf0b7\n\uf0b7\n\nFUNDAMENTAL COURSE\n01416301 Differential Equations and Matrix\nAlgebra\n\n\uf0b7\n\n\uf0b7 \uf0b7\n\n\uf0b7\n\n\uf0b7\n\n\x0c53\n1. Moral and ethics\n\n2. Knowledge\n\n3. Intellectual skills\n\n4. Human relation\nskills and\nresponsibility\n\n5. Skills for\nmathematical\ncalculation,\ncommunication and\ninformation\ntechnology\nadeptness\n\nCourse', 'TRACK SMART MATERIALS TECHNOLOGY\n(Only students in Smart Materials Technology and Robotics and AI Dual-degree program\nmay choose these courses.)\n09106400\n09106401\n09106402\n09106403\n09106404\n09106405\n09106406\n09106407', 'ROBOTICS LABORATORY 1\n1 (0-3-6)\nPREREQUISITE: NONE\nThe aim of this course is understanding the stationary robot by performing instructive\nexperiments that reveal fundamental robotic principles and to attain a level of dexterity with experimental\ndevices. Moreover, the aim of this training is to train the ability to report and summarize the experimental\nwork.\n01416515', '3 (3-0-6)\n\n01416310\n\nSTRENGTH OF MATERIALS\n\n3 (3-0-6)\n\n01416308\n\nKINEMATICS AND DYNAMICS\n\n3 (3-0-6)\n\n01416305\n\nARTIFICIAL INTELLIGENCE TECHNOLOGY\n\n3 (3-0-6)\n\n01416516\n\nROBOTICS LABORATORY 3\n\n1 (0-3-6)\n\n01416500\n\nComputer vision (RAI Elective mandatory Subject)\n\n3 (3-0-6)\n\nXXXXXXX\n\n(GENED ELECTIVE)\n\n3 (3-0-6)\n\nTOTAL CREDITS\n\n19\n\n\x0c33\n\n3rd YEAR 1st SEMESTER\nCODE\n\nSUBJECT\n\nCREDITS (L-E-S)\n\n01416801', 'Course\n\n1\n01416617 Pneumatic and Hydraulic System\nDesign and Control\n01416618 Advanced Artificial Intelligent\nTechnology\n01416619 User Experience and User Interface\nDesign\n01416620 Blockchain Technology and\nApplication\n01416621 Lean Management\n01416522 Big Data\n01416523 IT Project Management\n01416628 Experience and Exercise for Intelligent\nControl System\n01416629 Infromation and Cyber Security\n\n2\n\n3\n\n4\n\n5', '20\n\n20\n\nB2. Major Compulsory Courses\n\n75\n\n75\n\nB2.1 Fundamental Subjects\n\n39\n\n39\n\nB2.2 Capstone Projects\n\n6\n\n6\n\nB2.3 RAI Elective Mandatory Subjects\n\n18\n\n15\n\nB2.4 RAI Elective Subjects\n\n12\n\n9\n\nB2.5 Alternative Study\n\n-\n\n6\n\nC. Free Electives\n\n6\n\n6\n\nD. Internship\n\n0\n\n0\n\n131\n\n131\n\nCourse Group\nA. General Education\n\nB. Robotics and AI Specific Courses\n\nTOTAL\n\nCredits\n(For Regular Students)\n\n\x0c24']","The course titled ""KINEMATICS AND DYNAMICS"" covers 'Kinematics and Dynamics'.",01416308.,1.0,0.8993190888642801,0.0972222222173611,1.0
What is the minimum duration for the internship requirement?,"['4.2 Time Period\nInternship: Summer Course of the 1st, 2nd, or 3rd academic year\nCo-Operative Education: the 1st Semester of the 4th academic year\n4.3 Time Management and Scheduling\n8 weeks for Internship or full-time for one semester for Co-Operative Education\n5. Regulations for Special Project or Co-Operative Education', '4. Component Regarding Field Experience (Internship or Co-Operative Education)\nStudents must participate in the internship or entrepreneurship experience for at least 8 weeks while\nworking toward the degree (usually during the summer). This requirement could be satisfied by completing\ninternships with an innovative company in public or private sectors ( including Cooperative Education) ,', 'INDUSTRIAL INTERNSHIP\n0 (0-45-0)\nPREREQUISITE: NONE\nDuring their four-year selected studies, students are required to complete a short-term\nindustrial placement within professional selected environments. It takes place during a summer period. This\ncourse allows students to put into practice under conditions reflecting their future activities and', 'between institutes for internships', '3 (0-9-5)\n\nTOTAL CREDITS\n\n15\n\n3rd YEAR 3rd SEMESTER (SUMMER)\nCODE\n01006805\n\nSUBJECT\nINDUSTRIAL INTERNSHIP\nTOTAL CREDITS\n\nCREDITS (L-E-S)\n0 (0-45-0)\n0\n\n\x0c34\n\nFOR REGULAR STUDENTS\n4th YEAR 1st SEMESTER\nCODE\n\nSUBJECT\n\nCREDITS (L-E-S)\n\nXXXXXXX\n\n(FREE ELECTIVE)\n\n3 (X-X-X)\n\nXXXXXXX\n\n(GENED ELECTIVE)\n\n3 (3-0-6)\n\n0141XXXX\n\nRAI Elective mandatory subject\n\n3 (3-0-6)\n\n0141XXXX\n\nRAI Elective subject\n\n3 (3-0-6)', 'practice. This is an advance to the Internship and Co-op Education Students will develop specific skills both\non engineering and professionals, in actual working environment not less than 2 days a week, including\nhands-on experience required to their professional careers.\nTRANSFEERED COURSES FROM UNIVERSITY OF BIRMINGHAM 2+2 DUAL DEGREE PROGRAM\n01416622', '4. Component Regarding Field Experience (Internship or Co-Operative Education).......................................43\n5. Regulations for Special Project or Co-Operative Education .............................................................................43', 'extended internship experience. Interested students should contact the department or the program\ncommittee regarding the current policies and the requirements. While on the Co- Op assignment, the\nstudents are participating in a recognized educational program and retain their full-time student status.\n4.1 Standard for Learning Outcome from Field Experience', 'participating in research projects with research labs or academic institutions, or working toward the\nentrepreneurship with incubators. The program committee will annually release the policies regarding the\neligibility and the conditions required to complete the requirement.\nStudents who participate in an alternative study program as Co- Operative Education can do a 16- week', '6 CREDITS\n\n\x0c30\n\n01006301\n01006302\n01006304\n\nCOOPERATIVE EDUCATION\nSTUDY ABROAD\nOVERSEA TRAINING\n\n6 (0-45-0)\n6 (6-0-12)\n6 (0-45-0)\n\nC. FREE ELECTIVES\n\n6 CREDITS\n\nStudents must complete at least 6 additional credits from any courses offered by the\ninstitution.\nD. RAI INTERNSHIP\n01006805\n\n0 CREDITS\nINDUSTRIAL INTERNSHIPS\n\n3.1.4 Recommended Study Plan\n\n0 (0-45-0)\n\nCredit Notation: (L - E - S)', 'occupational or professional skill and life skills.\n3. Criteria for Graduation According to the Program\nStudents must complete at least 131 credits to graduate with at least 30 credits from general education\ncourses; at least 95 credits from Robotics and AI concentration and at least 6 credits of free electives and', 'English proficiency level prior to the graduation. Students must also complete the internship requirement\nduring their courses of study. Also, graduation according to the program is accordance with the Regulations\nof King Mongkut’s Institute of Technology Ladkrabang regarding Bachelor Degree Education 2016 (Appendix\nA).', '3. Curriculum and Instructors\nThe B. Eng. in Robotics and AI program is a four- year full- time undergraduate program. In order to\ngraduate, the students must complete at least 131 credits. Students must achieve the required English\nproficiency level prior to the graduation and satisfy the graduation requirements. The program is designed', '3.1.3 Subjects\nOne academic credit is given to a course offered in a single semester which\n- Meets in class for lecture or discussion for 1 hour per week; or\n- Contains at least 3 laboratory hours per week.\nMost courses are given 3 or more credits. For 4 credit courses, these courses usually contain 3\nhours of lecture or discussion per week. The courses are also accompanied with 1 additional hour', 'STUDY ABROAD\n6 (6-0-12)\nPREREQUISITE: NONE\nThis course is reserved for students who participate in the study abroad program. Upon\nthe completion of the program, the students must prepare and deliver oral presentations describing their\nexperience from the program.\n3. INTERNSHIP\n01006805', 'planned activities ( if any) at least before the opening of each semester\nfor all subjects\n4. Filing program review and report for the operation of each subject and\nfield experience (if any) within 30 days after the end of the semester for\nall subjects\n5. Filing report of the operation of the program according to SSRwithin 6 0\ndays after the end of the academic year', 'through the meeting with their academic advisor for their master program. If a student does not meet\nthe GPA criteria of 3.00, he or she is eligible to his/her petition into the program during his or her fourth\nyear with the permission of their academic advisor.', '5.3 Time Period\nThe 4th academic year.\n5.4 Credits\n6 Credits\n5.5 Preparation\nThe proposal must be proposed with the approval of the program committee.\n5.6 Evaluation Process\nAn evaluation is provided by a committee, which consists of instructors in the program by arranging\nan examination in each semester.\n6. Additional Costs', '3 (0-9-5)\n\nTOTAL CREDITS\n\n15\n\nTotal credits required for graduation at least\n\n3.1.5 Details of Each Subject\nCourse description (Appendix C)\n\n131\n\ncredits\n\n\x0c36\n\n3.2 Name, Surname, ID Number, Position, and Qualification of Instructors\n3.2.1 Executive Program Committees\nName-Surname\n(Academic Position)\nID Number\nAssoc. Prof. Dr. Pitikhate Sooraksa\n(Electrical Engineering)', 'PART 3: SYSTEM FOR EDUCATIONAL PROVISION, MANAGEMENT,\nAND STRUCTURE OF THE PROGRAM\n1. System for Educational Provision\n1.1 System\nAn academic year has two semesters, each of which covers not less than 15 weeks (excluding the\nexamination weeks). The summer semester is optional. Most courses are offered on the main campus']",The minimum duration for the internship requirement is at least 8 weeks.,At least 8 weeks.,1.0,1.0,0.99999999995,1.0
What alternative study option allows a 16-week internship?,"['INDUSTRIAL INTERNSHIP\n0 (0-45-0)\nPREREQUISITE: NONE\nDuring their four-year selected studies, students are required to complete a short-term\nindustrial placement within professional selected environments. It takes place during a summer period. This\ncourse allows students to put into practice under conditions reflecting their future activities and', 'between institutes for internships', '4.2 Time Period\nInternship: Summer Course of the 1st, 2nd, or 3rd academic year\nCo-Operative Education: the 1st Semester of the 4th academic year\n4.3 Time Management and Scheduling\n8 weeks for Internship or full-time for one semester for Co-Operative Education\n5. Regulations for Special Project or Co-Operative Education', '4. Component Regarding Field Experience (Internship or Co-Operative Education)\nStudents must participate in the internship or entrepreneurship experience for at least 8 weeks while\nworking toward the degree (usually during the summer). This requirement could be satisfied by completing\ninternships with an innovative company in public or private sectors ( including Cooperative Education) ,', 'practice. This is an advance to the Internship and Co-op Education Students will develop specific skills both\non engineering and professionals, in actual working environment not less than 2 days a week, including\nhands-on experience required to their professional careers.\nTRANSFEERED COURSES FROM UNIVERSITY OF BIRMINGHAM 2+2 DUAL DEGREE PROGRAM\n01416622', 'participating in research projects with research labs or academic institutions, or working toward the\nentrepreneurship with incubators. The program committee will annually release the policies regarding the\neligibility and the conditions required to complete the requirement.\nStudents who participate in an alternative study program as Co- Operative Education can do a 16- week', 'extended internship experience. Interested students should contact the department or the program\ncommittee regarding the current policies and the requirements. While on the Co- Op assignment, the\nstudents are participating in a recognized educational program and retain their full-time student status.\n4.1 Standard for Learning Outcome from Field Experience', '3 (0-9-5)\n\nTOTAL CREDITS\n\n15\n\n3rd YEAR 3rd SEMESTER (SUMMER)\nCODE\n01006805\n\nSUBJECT\nINDUSTRIAL INTERNSHIP\nTOTAL CREDITS\n\nCREDITS (L-E-S)\n0 (0-45-0)\n0\n\n\x0c34\n\nFOR REGULAR STUDENTS\n4th YEAR 1st SEMESTER\nCODE\n\nSUBJECT\n\nCREDITS (L-E-S)\n\nXXXXXXX\n\n(FREE ELECTIVE)\n\n3 (X-X-X)\n\nXXXXXXX\n\n(GENED ELECTIVE)\n\n3 (3-0-6)\n\n0141XXXX\n\nRAI Elective mandatory subject\n\n3 (3-0-6)\n\n0141XXXX\n\nRAI Elective subject\n\n3 (3-0-6)', '6 CREDITS\n\n\x0c30\n\n01006301\n01006302\n01006304\n\nCOOPERATIVE EDUCATION\nSTUDY ABROAD\nOVERSEA TRAINING\n\n6 (0-45-0)\n6 (6-0-12)\n6 (0-45-0)\n\nC. FREE ELECTIVES\n\n6 CREDITS\n\nStudents must complete at least 6 additional credits from any courses offered by the\ninstitution.\nD. RAI INTERNSHIP\n01006805\n\n0 CREDITS\nINDUSTRIAL INTERNSHIPS\n\n3.1.4 Recommended Study Plan\n\n0 (0-45-0)\n\nCredit Notation: (L - E - S)', 'STUDY ABROAD\n6 (6-0-12)\nPREREQUISITE: NONE\nThis course is reserved for students who participate in the study abroad program. Upon\nthe completion of the program, the students must prepare and deliver oral presentations describing their\nexperience from the program.\n3. INTERNSHIP\n01006805', 'a. Arrange an orientation day and counseling session for first year students to advise on\navailable career paths, best action plans in line with set objectives and time management.\nb. Arrange advisor system to overlook, care and provide counseling for students about all\naspects of life, on and off campus, particularly students facing academic difficulties and/ or\ndomestic and other issues.', '20\n\n20\n\nB2. Major Compulsory Courses\n\n75\n\n75\n\nB2.1 Fundamental Subjects\n\n39\n\n39\n\nB2.2 Capstone Projects\n\n6\n\n6\n\nB2.3 RAI Elective Mandatory Subjects\n\n18\n\n15\n\nB2.4 RAI Elective Subjects\n\n12\n\n9\n\nB2.5 Alternative Study\n\n-\n\n6\n\nC. Free Electives\n\n6\n\n6\n\nD. Internship\n\n0\n\n0\n\n131\n\n131\n\nCourse Group\nA. General Education\n\nB. Robotics and AI Specific Courses\n\nTOTAL\n\nCredits\n(For Regular Students)\n\n\x0c24', 'programs can extend their work from the alternative study programs. Each team of 1 to 4 students must\ndesign and implement a prototype of the proposed innovation. Measurements, simulations, and/ or\ncharacterization of the proposed solution is performed so as to demonstrate that the design objectives and', 'Course\n\n1\n09106404 Solar Cell and Nanostructure\nPhotovoltaic\n09106405 LAB-ON-CHIP Technology\n09106406 Microelectromechanical System\n09106407 Chemistry\nAlternative Study Courses\n01006301 Cooperative Education\n01006302 Study Abroad\nIndustrial Internship\n01006805 Industrial Internship\nTotal\n\n2\n\n3\n\n4\n\n5\n\n1\n\n2\n\n3\n\n4\n\n5\n\n1\n\n2\n\n3\n\n4\n\n5\n\n1\n\n2\n\n3\n\n4\n\n5\n\n1\n\n2\n\n3\n\n4\n\n5\n\n\uf0b7 \uf0b7 \uf0b7\n\n\uf0b7 \uf0b7 \uf0b7\n\n\uf0b7 \uf0b7 \uf0b7 \uf0b7 \uf0b7 \uf0b7 \uf0b7\n\n\uf0b7 \uf0b7\n\n\uf0b7 \uf0b7 \uf0b7 \uf0b7 \uf0b7', 'g. Available student activities and clubs that promote personal development.', '\uf0b7\n\n\uf0b7\n\n\uf0b7\n\nArranging for a special lecture by an expert to contribute to research experience\nand societal impact as well as relating laws and infringements\nArranging for extracurricular activities, i.e., community service.\n\n\x0c47', 'planned activities ( if any) at least before the opening of each semester\nfor all subjects\n4. Filing program review and report for the operation of each subject and\nfield experience (if any) within 30 days after the end of the semester for\nall subjects\n5. Filing report of the operation of the program according to SSRwithin 6 0\ndays after the end of the academic year', 'during the day. Some courses or laboratory hours may be offered in the evening or weekend.\n1.2 Provision of Summer Course\nSummer courses will be offered based on instructors’ availability and students’ need.\n1.3 System Transfer of Credits in Two-Semester System\nCredits can be transferred, upon the consent of executive program committee, according to the', 'of recitation or 3 hours of laboratory work per week. Students enrolled in the courses are also\nexpected to spend at least 8 hours outside the class/ lab for studying and completing the\ncoursework.\nThe instructor-led lecture could be delivered as a traditional lecture or include learning\nactivities in which the students can actively participate. The recitation is a compliment to a lecture', ""for the duration of the program.\n3.2 The activities are organized to develop students' knowledge, abilities and potential in various ways\nto support 21st-century learning skills.\n3.3 A consultant, who is appointed for academic counseling and guidance to all students, must\nschedule an appointment (Office Hours) for the student to consult.""]",The alternative study option that allows a 16-week internship is the Co-Operative Education program.,Co-Operative Education.,1.0,0.9955817217889783,0.48148148147345676,1.0
What is the objective of the 'RAI Engineering Capstone Design Preparation'?,"['RAI ENGINEERING CAPSTONE DESIGN PREPARATION\n3 (0-9-5)\nPREREQUISITE: NONE\nThis course instructs and prepare students in aspects of effective technical oral\npresentations through exposure to different workplace communication skills. As preparation and research\nfor the capstone design, students must develop topics, identify a supervisor, and prepare a proposal for an', 'engineering tools necessary for engineering practice via RAI senior capstone projects', 'RAI ENGINEERING CAPSTONE DESIGN\n3 (0-9-5)\nPREREQUISITE: 01416701 RAI ENGINEERING CAPSTONE DESIGN PREPARATION\nThis course consists of open- ended design projects that incorporate fundamental and\nadvanced concepts in Robotics and AI. Students will analyze, design and implement innovative prototypes\nwhich require application of standards and realistic engineering constraints. Students from alternative study', 'Students are able to choose between completing preliminary project in Capstone Design Preparation\ncourse or participate in one of the study-abroad program or co-operative education. All Students must also\ncomplete RAI capstone design course prior to graduation. Students may extend their works from the cooperative education assignment or from the preparation course for their capstone design projects.', 'B.2.2 CAPSTONE PROJECTS\n01416701\nRAI ENGINEERING CAPSTONE DESIGN PREPARATION 4*\n01416702\nRAI ENGINEERING CAPSTONE DESIGN 5*\n4*\ncompare to Module 04 29646 Integrated Design Project 3 of UoB\n5*\ncompare to Module 04 02279 Individual Project of UoB\nB.2.3 RAI ELECTIVE MANDATORY SUBJECTS\nFor Regular Students\nFor UoB 2+2 Program Students\nFor Co-op / Study Aboard Students\n01416401\n01416403\n01416404\n01416406', 'such as machine perception application development, cognition and reasoning and IoT. Students will also\nlearn about AI engineering, along with the process and tools to facilitate new innovations.\nFourth-year students undertake significant RAI engineering capstone design projects. Students will apply\ntheir skills and knowledge to create sustainable innovations, practice open-ended engineering design and/or', 'specifications have been met. The final design reports must address issues, as appropriate, that are related\nto engineering economics, commercialization, manufacturability, environmental, social issues, ethics, and\nhealth and safety. Each team must prepare and deliver oral presentations and demonstrations of their design\nprototype.\nB.2.3 RAI ELECTIVE MANDATORY SUBJECTS\n01416401', '4\n\n5\n\n\uf0b7\n\n01416516 Robotics Laboratory 3\nCAPSTONE PROJECTS\n01416701 RAI Engineering Capstone Design\nPreparation\n01416702 RAI Engineering Capstone Design\nRAI Elective Mandatory Subjects\n\n3\n\n1\n\n2\n\n3\n\n\uf0b7 \uf0b7\n\n4\n\n5\n\n1\n\n2\n\n\uf0b7\n\n3\n\n4\n\n5\n\n\uf0b7 \uf0b7\n\n1\n\n2\n\n3\n\n4\n\n5\n\n\uf0b7\n\n1\n\n2\n\n3\n\n4\n\n\uf0b7 \uf0b7 \uf0b7\n\n5\n\uf0b7\n\n\uf0b7 \uf0b7 \uf0b7 \uf0b7 \uf0b7 \uf0b7 \uf0b7 \uf0b7 \uf0b7 \uf0b7 \uf0b7 \uf0b7 \uf0b7 \uf0b7 \uf0b7 \uf0b7 \uf0b7 \uf0b7 \uf0b7 \uf0b7 \uf0b7 \uf0b7 \uf0b7 \uf0b7 \uf0b7\n\uf0b7 \uf0b7 \uf0b7 \uf0b7 \uf0b7 \uf0b7 \uf0b7 \uf0b7 \uf0b7 \uf0b7 \uf0b7 \uf0b7 \uf0b7 \uf0b7 \uf0b7 \uf0b7 \uf0b7 \uf0b7 \uf0b7 \uf0b7 \uf0b7 \uf0b7 \uf0b7 \uf0b7 \uf0b7\n\uf0b7\n\uf0b7\n\uf0b7\n\uf0b7\n\n\uf0b7\n\uf0b7\n\uf0b7\n\uf0b7\n\n\uf0b7\n\uf0b7\n\uf0b7\n\uf0b7\n\n\uf0b7\n\uf0b7\n\uf0b7\n\uf0b7', 'the broad education necessary to understand the impact of engineering solutions in a global,\neconomic, environmental, and societal context via RAI industrial prototyping projects\nrecognition of the need for, and an ability to engage in life-long learning from cooperation or\nacademic training programs\nknowledge of contemporary issues via and ability to use the techniques, skills, and modern', '0141XXXX\n\nRAI Elective subject\n\n3 (3-0-6)\n\nTOTAL CREDITS\n\n18\n\n3rd YEAR 2nd SEMESTER\nCODE\n\nSUBJECT\n\nCREDITS (L-E-S)\n\nXXXXXXX\n\n(GENED ELECTIVE)\n\n3 (3-0-6)\n\n01416315\n\nINDUSTRIAL ELECTRONICS\n\n3 (3-0-6)\n\n0141XXXX\n\nRAI Elective mandatory subject\n\n3 (3-0-6)\n\nXXXXXXX\n\n(FREE ELECTIVE)\n\n3 (X-X-X)\n\n01416701\n\nRAI ENGINEERING CAPSTONE DESIGN PREPARATION\n\n3 (0-9-5)\n\nTOTAL CREDITS\n\n15', 'PART 4: LEARNING OUTCOME, TEACHING STRATEGY, AND EVALUATION\n1. Development of Special Characteristics of Students\nCharacteristics\nEngineering Quality: RAI students will apply engineering practice,\ncombined with the innovative process, to identify and solve significant\nproblems across a broad range of applications.\nInnovation: RAI students will adapt the process by which', 'manufacturing, smart health and up- to- date applications related to RAI; smart things networks for data\nmanagement; IoT related standardization. The course also includes a substantial group design project.\n01416507', 'safety, manufacturability, and sustainability. Each team must prepare and deliver oral presentations\ndescribing their analysis of the problems, the proposed innovation and the design process.', 'technological ideas are generated, developed and transformed into\nnew business products, processes, services and solutions that meet\nthe demands and establish marketplace advantage.\nLifelong Learning: RAI students will learn new technologies,\nmethodologies, and tools and adapt them to respond to the\nchallenges of a changing environment.\nLeadership: RAI students will apply their technical and innovative', '1) Have a good critical thinking.\n2) Be able to gather, study, analyze,\nand summarize issues and\nrequirements.\n3) Be able to analyze and solve\nengineering problems\nsystematically. Use decisionmaking information to work\neffectively.\n4) Have the imagination and flexibility\nto adapt the relevant knowledge\nappropriately to create innovation.\n5) Be able to search, interpret, and\nevaluate information for use in', 'leadership to establish successful careers in their business, profession,\nand community.\nEconomic Impact: RAI students will apply their technical expertise,\nleadership, and innovative mindset to support and strengthen the\nsociety’s economic well-being.', 'approach and design philosophy. Project Planning, management and effective team working. Health and\nSafety aspects and impact on design. Sustainability aspects of design, including stakeholder engagement;\nethics; human factors. Nature of risk in working/business operations; risk management.\n01416622', 'DESIGN METHODS FOR INNOVATIONS\n4 (4-0-8)\nPREREQUISITE: NONE\nThis course consists of structural design process to create innovative products or services. The students will\nstudy the process to gather trends and information such as global direction, public opinions, technology,\nbusiness, society and economic; learn how to extract context of interested area to find opportunities; study', ""47\n\n2. Development of Learning Results in Each Aspect\nAs the RAI program's developmental objective is to meet ABET stipulated standards, a learning outcome is designed by the ABET Criterion for Student Outcomes\n(a-k) of which aim to prepare graduates to attain program educational objectives.\nDomains\n\nLearning Results\n\nTeaching Strategies\n\nHonesty"", 'sustainability using knowledge of kinematics, kinetics, and dynamics as well as material engineering\nfor Robotics and AI\nability to function on multidisciplinary teams via project based learning from RAI core courses\nability to identify, formulate, and solve RAI engineering problems\nunderstanding of professional and ethical responsibility\nability to communicate effectively by presenting RAI mini-projects']","The objective of the 'RAI Engineering Capstone Design Preparation' course is to instruct and prepare students in aspects of effective technical oral presentations through exposure to different workplace communication skills. As preparation and research for the capstone design, students must develop topics, identify a supervisor, and prepare a proposal.",Prepare students in effective technical oral presentations.,1.0,0.9185019460116508,0.9999999999,1.0
Which course introduces 'Artificial Intelligence Technology'?,"['ARTIFICIAL INTELLIGENCE TECHNOLOGY\n3 (3-0-6)\nPREREQUISITE: NONE\nMaterials on AI programming, logic, search, game playing, machine learning, natural\nlanguage understanding, and robotics introduce the student to AI methods, tools, and techniques, their\napplication to computational problems, and their contribution to understanding intelligence.\n\n01416306', 'TRACK SMART MATERIALS TECHNOLOGY\n(Only students in Smart Materials Technology and Robotics and AI Dual-degree program\nmay choose these courses.)\n09106400\n09106401\n09106402\n09106403\n09106404\n09106405\n09106406\n09106407', ""ADVANCED ARTIFICIAL INTELLIGENCE TECHNOLOGY\n3 (3-0-6)\nPREREQUISITE: 01416305 ARTIFICIAL INTELLIGENCE TECHNOLOGY\nThe course includes designing good learning algorithms, as well as the science of analyzing\nan algorithm's computational and statistical properties and performance guarantees. Theorems are\npresented together with practical aspects of methodology and intuition to help students develop tools for"", 'ADVANCED ENGINEERING MATHEMATICS\n\nB. ROBOTICS AND AI COURSE SPECIFIC COURSES\nB.1 CORE COURSE\n01006710\n01006711\n01006723\n01006724\n01006725\n01006726\n01006803\n01416310\n\n4 (4-0-8)\n\n95 CREDITS\n(LECTURE-LAB-SELF STUDY)\n\nINTRODUCTION TO CALCULUS\nADVANCED CALCULUS\nGENERAL PHYSICS 1\nGENERAL PHYSICS LABORATORY 1\nGENERAL PHYSICS 2\nGENERAL PHYSICS LABORATORY 2\nENGINEERING MECHANICS\nSTRENGTH OF MATERIALS', 'ROBOTICS AND AI EXPERIENCE\n9 (2-14-12)\nPREREQUISITE: NONE\nExposure to Professional Practice (EPP), Industrial Experience (IE) and/or International Research\nExperience (IRE) and/or taking courses related to research topic provides an opportunity to gain variable\nhands-on training and experience in real world situations, and/or study and/or conduct research', '3. Curriculum and Instructors\nThe B. Eng. in Robotics and AI program is a four- year full- time undergraduate program. In order to\ngraduate, the students must complete at least 131 credits. Students must achieve the required English\nproficiency level prior to the graduation and satisfy the graduation requirements. The program is designed', 'Course\n\n1\n01416630 Information System Security and IT\nLaw\n01416631 Robotics and AI Experience\n01416632 Space Science\n01416633 REINFORCEMENT LEARNING\n01416634 INTRODUCTION TO PROMPT ENGINERRING\n01416635 ADVANCED TECHNIQUES IN ChatGPT\nCUSTOMIZATION AND APPLICATION', '20\n\n20\n\nB2. Major Compulsory Courses\n\n75\n\n75\n\nB2.1 Fundamental Subjects\n\n39\n\n39\n\nB2.2 Capstone Projects\n\n6\n\n6\n\nB2.3 RAI Elective Mandatory Subjects\n\n18\n\n15\n\nB2.4 RAI Elective Subjects\n\n12\n\n9\n\nB2.5 Alternative Study\n\n-\n\n6\n\nC. Free Electives\n\n6\n\n6\n\nD. Internship\n\n0\n\n0\n\n131\n\n131\n\nCourse Group\nA. General Education\n\nB. Robotics and AI Specific Courses\n\nTOTAL\n\nCredits\n(For Regular Students)\n\n\x0c24', 'margins) ; reinforcement learning and adaptive control. The course will also discuss recent applications of\nmachine learning, such as to robotic control, data mining, autonomous navigation, bioinformatics, speech\nrecognition, and text and web data processing.\n01416505', 'of robotics technologies. The students also learn to apply design methods for solutions in technical areas\nsuch as control systems design and kinematics and dynamics.\nThird- year students will learn about the latest technologies and AI which happen in the area. In each\nsemester, the students will study new concepts and apply creativity in completing projects in trending areas', 'and AI Systems\n01416507 Preparation and Cognitive Robots\n01416509 System Engineering', 'B.2 MAJOR COMPULSORY COURSE\nB.2.1 FUNDAMENTAL SUBJECTS\n01416301\nDIFFERENTIAL EQUATIONS AND MATRIX ALGEBRA\n01416304\nFEEDBACK CONTROL\n01416305\nARTIFICIAL INTELLIGENCE TECHNOLOGY\n01416306\nSAFETY AND STANDARDIZATION IN RAI 3*\n01416308\nKINEMATICS AND DYNAMICS\n01416309\nENGIEERING 3D DRAWING\n01416312\nELECTRIC CIRCUIT AND ELECTRONICS\n01416315\nINDUSTRIAL ELECTRONICS 2*\n01416316\nCOMPUTER PROGRAMMING FOR RAI\n01416318', 'of other agents. Artificial intelligence techniques, as well as insights from cognitive science.\n01416509', 'to drive innovations and entrepreneurship in robotics and AI technology-related areas. Each semester will\ninclude a project- based theme which helps students practice and design innovative solutions in the\nrespective areas.\nIn the first year, the students study basic courses in mathematics and science and improve their', 'such as machine perception application development, cognition and reasoning and IoT. Students will also\nlearn about AI engineering, along with the process and tools to facilitate new innovations.\nFourth-year students undertake significant RAI engineering capstone design projects. Students will apply\ntheir skills and knowledge to create sustainable innovations, practice open-ended engineering design and/or', 'COMPUTER PROGRAMMING FOR RAI\n3 (2-2-5)\nPREREQUISITE: NONE\nThis course introduces basic concepts of computer programming such as elementary\nprogramming, data types, expressions, simple algorithms and problem solving involving sequential\nstatements, conditionals and iterations. Students learn routines or methods as fundamental concepts and', 'concerning Robotics and Artificial Intelligence engineering. Additionally, through exposure to current\npractice, student can reflect on, and appreciate the linkage between curriculum and practice. Students\nwill develop specific skills both on engineering and professionals including hands-on experience or\nresearch experience required to their professional careers.', 'research that incorporates fundamental and advanced concepts in Robotics and AI. Students will learn to\nbuild innovation, identify the opportunities, propose ideas, design and implement innovative solutions while\nbeing able to apply standards and realistic engineering constraints. Students also further specialize in their\nareas of interest and prepare for the next step in their careers.', 'all industries on the verge of digital disruption. Existing businesses will have to adapt and innovatively\ntransform itself in order to stay competitive. Graduates from Robotics and AI will be the major driving\nforce of the transformation using their technical experts and understanding of the economic ecosystem\nand related processes.\n1.3 Program Educational Objectives', 'Arranging for an educating activity to develop learners’ skills by assigning\noperational practices in every Robotics and AI subjects.\nArranging for a seminar subject, capstone design or cooperative education,\ninternship program for Robotics and AI\nArranging for knowledge exchange activity in the program for both theory and\npractice between instructors and students as well as collaboration projects']","The course that introduces 'Artificial Intelligence Technology' is ""ARTIFICIAL INTELLIGENCE TECHNOLOGY"" with the course code 01416305.",01416305.,0.5,0.9709882428928813,0.2499999999875,1.0
What is the focus of 'Robotics Laboratory 2'?,"['01416320 Introduction to Robotics and AI\n01416514 Robotics Laboratory 1\n01416515 Robotics Laboratory 2', 'ROBOTICS LABORATORY 2\n1 (0-3-6)\nPREREQUISITE: NONE\nThe aim of this course is understanding the mobile robot by performing instructive\nexperiments that reveal fundamental robotic principles and to attain a level of dexterity with experimental\ndevices. Moreover, the aim of this training is to train the ability to report and summarize the experimental\nwork.\n01416516', 'ROBOTICS LABORATORY 3\n1 (0-3-6)\nPREREQUISITE: NONE\nThe aim of this course is understanding the artificial intelligent technology by performing\ninstructive experiments that reveal fundamental robotic principles and to attain a level of dexterity with\nexperimental devices. Moreover, the aim of this training is to train the ability to report and summarize the\nexperimental work.\nB.2.2 CAPSTONE PROJECTS', 'communication skills. Students will also be introduced to fundamental programming concepts and the\nfoundation of robotics systems. The first-year projects will give students hands-on experience, introduction\nand basic development of robotics technologies.\nIn the second year, the students will learn advanced robotics concepts which serve as the foundation', 'research that incorporates fundamental and advanced concepts in Robotics and AI. Students will learn to\nbuild innovation, identify the opportunities, propose ideas, design and implement innovative solutions while\nbeing able to apply standards and realistic engineering constraints. Students also further specialize in their\nareas of interest and prepare for the next step in their careers.', 'ROBOTICS LABORATORY 1\n1 (0-3-6)\nPREREQUISITE: NONE\nThe aim of this course is understanding the stationary robot by performing instructive\nexperiments that reveal fundamental robotic principles and to attain a level of dexterity with experimental\ndevices. Moreover, the aim of this training is to train the ability to report and summarize the experimental\nwork.\n01416515', 'TOTAL CREDITS\n\n19\n\n1st YEAR 2nd SEMESTER\nCODE\n\nSUBJECT\n\nCREDITS (L-E-S)\n\n01416320\n\nINTRODUCTION TO ROBOTICS AND AI\n\n3 (3-0-6)\n\n01006803\n\nENGINEERING MECHANICS\n\n3 (3-0-6)\n\n01006711\n\nADVANCED CALCULUS\n\n3 (3-0-6)\n\n01006725\n\nGENERAL PHYSICS 2\n\n3 (3-0-6)\n\n01006726\n\nGENERAL PHYSICS LABORATORY 2\n\n1 (0-3-2)\n\n01416318\n\nMICROPROCESSOR AND INTERFACE\n\n3 (2-2-5)\n\n01416514\n\nROBOTICS LABORATORY 1\n\n1 (0-3-6)\n\n01416001', 'and AI Systems\n01416507 Preparation and Cognitive Robots\n01416509 System Engineering', 'CYBER PHYSICAL ROBOTICS\n3 (3-0-6)\nPREREQUISITE: NONE\nRobots 4. 0 involves computation, communication, and control which have become\nincreasingly interwoven to produce highly functional, reliable, and energy- efficient systems. This course\noffers an interdisciplinary perspective on the emerging science of cyber- physical robotics ( CPR) and its', 'ROBOTICS AND AI EXPERIENCE\n9 (2-14-12)\nPREREQUISITE: NONE\nExposure to Professional Practice (EPP), Industrial Experience (IE) and/or International Research\nExperience (IRE) and/or taking courses related to research topic provides an opportunity to gain variable\nhands-on training and experience in real world situations, and/or study and/or conduct research', 'ROBOTICS LABORATORY 1\n\n1 (0-3-6)\n\n01416001\n\n(ESL) ACADEMIC READING AND WRITING\n\n3 (3-0-6)\n\nTOTAL CREDITS\n\n20\n\n\x0c32\n\n2nd YEAR 1st SEMESTER\nCODE\n\nSUBJECT\n\nCREDITS (L-E-S)\n\n01416312\n\nELECTRIC CIRCUIT AND ELECTRONICS\n\n3 (3-0-6)\n\n01416301\n\nDIFFERENTIAL EQUATIONS AND MATRIX ALGEBRA\n\n3 (3-0-6)\n\n01416515\n\nROBOTICS LABORATORY 2\n\n1 (0-3-6)\n\n01416304\n\nFEEDBACK CONTROL\n\n3 (3-0-6)\n\n01416521', 'education, drama, and other fields, theory to practice using state-of-the-art interactive robots\n01416511', 'of robotics technologies. The students also learn to apply design methods for solutions in technical areas\nsuch as control systems design and kinematics and dynamics.\nThird- year students will learn about the latest technologies and AI which happen in the area. In each\nsemester, the students will study new concepts and apply creativity in completing projects in trending areas', '5.2 Standard for Learning Outcome\nStudents are able to analyze, design and develop a project related to Robotics and AI.', '3. Curriculum and Instructors\nThe B. Eng. in Robotics and AI program is a four- year full- time undergraduate program. In order to\ngraduate, the students must complete at least 131 credits. Students must achieve the required English\nproficiency level prior to the graduation and satisfy the graduation requirements. The program is designed', 'to drive innovations and entrepreneurship in robotics and AI technology-related areas. Each semester will\ninclude a project- based theme which helps students practice and design innovative solutions in the\nrespective areas.\nIn the first year, the students study basic courses in mathematics and science and improve their', 'oral presentation. The design must incorporate fundamental and advanced concepts in Robotics and AI.\nEach team of 2 to 4 students will propose innovative design projects which require application of standards\nand realistic engineering constraints such as economic, environmental, social, political, ethical, health and', 'PERCEPTION AND COGNITIVE ROBOTS\n3 (2-2-5)\nPREREQUISITE: NONE\nProgramming of robots to enable the achievement of goals in environments, cognitive\ncapabilities such as perception, attention, anticipation, planning, memory, learning, and reasoning. social\ncapabilities, such as communication, collaborative task execution, and reasoning about the mental states', 'ADVANCED ENGINEERING MATHEMATICS\n\nB. ROBOTICS AND AI COURSE SPECIFIC COURSES\nB.1 CORE COURSE\n01006710\n01006711\n01006723\n01006724\n01006725\n01006726\n01006803\n01416310\n\n4 (4-0-8)\n\n95 CREDITS\n(LECTURE-LAB-SELF STUDY)\n\nINTRODUCTION TO CALCULUS\nADVANCED CALCULUS\nGENERAL PHYSICS 1\nGENERAL PHYSICS LABORATORY 1\nGENERAL PHYSICS 2\nGENERAL PHYSICS LABORATORY 2\nENGINEERING MECHANICS\nSTRENGTH OF MATERIALS', 'concerning Robotics and Artificial Intelligence engineering. Additionally, through exposure to current\npractice, student can reflect on, and appreciate the linkage between curriculum and practice. Students\nwill develop specific skills both on engineering and professionals including hands-on experience or\nresearch experience required to their professional careers.']","The focus of 'Robotics Laboratory 2' is understanding the mobile robot by performing instructive experiments that reveal fundamental robotic principles and to attain a level of dexterity with experimental devices. Moreover, the aim of this training is to train the ability to report and summarize the experimental work.",Understanding mobile robots through experiments.,1.0,1.0,0.49999999995,1.0
What does 'L' stand for in the credit notation (L-E-S)?,"['0 (0-45-0)\n\nCredit Notation: (L - E - S)\n\nL = Lecture / Learning hours, E = Laboratory hours, S = Self-study hours\nThis study plan shows courses with credits equivalent to 3. However, students can register 4 credit courses\nas well. The total number of credits in each subject category will be counted toward the graduation.\n\n\x0c31\n\n1st YEAR 1st SEMESTER\nCODE\n\nSUBJECT\n\nCREDITS (L-E-S)\n\n01416316', 'SUBJECT\n\nCREDITS (L-E-S)\n\nCOOPERATIVE EDUCATION\nor\nSTUDY ABROAD\n\n6 (0-45-0)\nor\n6 (6-0-12)\n\nTOTAL CREDITS\n\n6\n\n4th YEAR 2nd SEMESTER\nCODE\n\nSUBJECT\n\nCREDITS (L-E-S)\n\nXXXXXXX\n\n(GENED ELECTIVE)\n\n3 (3-0-6)\n\nXXXXXXX\n\n(FREE ELECTIVE)\n\n3 (X-X-X)\n\n0141XXXX\n\nRAI Elective subject\n\n3 (3-0-6)\n\n0141XXXX\n\nRAI Elective subject\n\n3 (3-0-6)\n\n01416702\n\nRAI ENGINEERING CAPSTONE DESIGN\n\n3 (0-9-5)\n\nTOTAL CREDITS\n\n15', '0141XXXX\n\nRAI Elective subject\n\n3 (3-0-6)\n\nTOTAL CREDITS\n\n12\n\n4th YEAR 2nd SEMESTER\nCODE\n\nSUBJECT\n\nCREDITS (L-E-S)\n\n0141XXXX\n\nRAI Elective subject\n\n3 (3-0-6)\n\n0141XXXX\n\nRAI Elective subject\n\n3 (3-0-6)\n\n01416702\n\nRAI ENGINEERING CAPSTONE DESIGN\n\n3 (0-9-5)\n\nTOTAL CREDITS\n\n9\n\n\x0c35\n\nFOR CO-OP/STUDY ABROAD STUDENTS\n4th YEAR 1st SEMESTER\nCODE\n01006301\nor\n01006302\n\nSUBJECT\n\nCREDITS (L-E-S)', '0141XXXX\n\nRAI Elective subject\n\n3 (3-0-6)\n\nTOTAL CREDITS\n\n18\n\n3rd YEAR 2nd SEMESTER\nCODE\n\nSUBJECT\n\nCREDITS (L-E-S)\n\nXXXXXXX\n\n(GENED ELECTIVE)\n\n3 (3-0-6)\n\n01416315\n\nINDUSTRIAL ELECTRONICS\n\n3 (3-0-6)\n\n0141XXXX\n\nRAI Elective mandatory subject\n\n3 (3-0-6)\n\nXXXXXXX\n\n(FREE ELECTIVE)\n\n3 (X-X-X)\n\n01416701\n\nRAI ENGINEERING CAPSTONE DESIGN PREPARATION\n\n3 (0-9-5)\n\nTOTAL CREDITS\n\n15', '3 (0-9-5)\n\nTOTAL CREDITS\n\n15\n\n3rd YEAR 3rd SEMESTER (SUMMER)\nCODE\n01006805\n\nSUBJECT\nINDUSTRIAL INTERNSHIP\nTOTAL CREDITS\n\nCREDITS (L-E-S)\n0 (0-45-0)\n0\n\n\x0c34\n\nFOR REGULAR STUDENTS\n4th YEAR 1st SEMESTER\nCODE\n\nSUBJECT\n\nCREDITS (L-E-S)\n\nXXXXXXX\n\n(FREE ELECTIVE)\n\n3 (X-X-X)\n\nXXXXXXX\n\n(GENED ELECTIVE)\n\n3 (3-0-6)\n\n0141XXXX\n\nRAI Elective mandatory subject\n\n3 (3-0-6)\n\n0141XXXX\n\nRAI Elective subject\n\n3 (3-0-6)', '01\n41\n00\n6\n\nmeans Faculty of Engineering\nmeans Robotics and AI program\nmeans shared courses\nmeans bachelor degree\nmeans Order of the subject\n\n\x0c25\n\nA. GENERAL EDUCATION\n\n30 CREDITS\n(LECTURE-LAB-SELF STUDY)\n\nA.1 ENGLISH PROFICIENCY REQUIREMENT (ESL)\n01416000\nACADEMIC LISTENING AND SPEAKING\n01416001\nACADEMIC READING AND WRITING\n01416003\nINTERPRETATION AND ARGUMENTS\n\n9 CREDITS\n3 (3-0-6)\n3 (3-0-6)\n3 (3-0-6)', 'PART 1: GENERAL INFORMATION\n1. Name of the Program\nName of the program (Thai):\nName of the program (English):\n2. Degree and Major\nFull name (Thai):\nFull name (English):\nAbbreviation (Thai):\nAbbreviation (English):', 'funds; risk-return tradeoff and diversification; interest rates and credit.\n01006508', 'SUBJECT\n\nCREDITS (L-E-S)\n\n01416801\n\nMATHEMATICS OF DATA SCIENCE AND DATA ANALYTIC\n(GENED, SCIENCE & MATHEMATICS ELECTIVE)\n\n3 (3-0-6)\n\n01416306\n\nSAFTY AND STANDARDIZATION IN RAI\n\n3 (3-0-6)\n\n01416319\n\nMANUFACTURING PROCESS\n\n3 (3-0-6)\n\n01006718\n\nDISCRETE MATHEMATICS (RAI Elective mandatory\nSubject)\n\n3 (3-0-6)\n\n0141XXXX\n\nRAI Elective mandatory subject\n\n3 (3-0-6)\n\n0141XXXX\n\nRAI Elective subject\n\n3 (3-0-6)', 'TOTAL CREDITS\n\n19\n\n1st YEAR 2nd SEMESTER\nCODE\n\nSUBJECT\n\nCREDITS (L-E-S)\n\n01416320\n\nINTRODUCTION TO ROBOTICS AND AI\n\n3 (3-0-6)\n\n01006803\n\nENGINEERING MECHANICS\n\n3 (3-0-6)\n\n01006711\n\nADVANCED CALCULUS\n\n3 (3-0-6)\n\n01006725\n\nGENERAL PHYSICS 2\n\n3 (3-0-6)\n\n01006726\n\nGENERAL PHYSICS LABORATORY 2\n\n1 (0-3-2)\n\n01416318\n\nMICROPROCESSOR AND INTERFACE\n\n3 (2-2-5)\n\n01416514\n\nROBOTICS LABORATORY 1\n\n1 (0-3-6)\n\n01416001', 'SUBJECT\n\nCREDITS (L-E-S)\n\n01416316\n\nCOMPUTER PROGRAMMING FOR RAI\n\n3 (2-2-5)\n\n01006710\n\nINTRODUCATION TO CALCULUS\n\n3 (3-0-6)\n\n01006723\n\nGENERAL PHYSICS 1\n\n3 (3-0-6)\n\n01006724\n\nGENERAL PHYSICS LABORATORY 1\n\n1 (0-3-2)\n\n01416309\n\nENGINEERING 3D DRAWING\n\n3 (2-2-5)\n\nXXXXXXX\n\n(GENED ELECTIVE)\n\n3 (3-0-6)\n\n01416000\n\n(ESL) ACADEMIC LISTENING AND SPEAKING\n\n3 (3-0-6)\n\nTOTAL CREDITS\n\n19\n\n1st YEAR 2nd SEMESTER\nCODE', '01416304\n\nFEEDBACK CONTROL\n\n3 (3-0-6)\n\n01416521\n\nINTRODUCTION TO ALGORITHMS (RAI Elective\nMandatory Subject)\n\n3 (3-0-6)\n\nXXXXXXX\n\n(GENED ELECTIVE)\n\n3 (3-0-6)\n\n01416003\n\n(ESL) INTERPRETATION AND ARGUMENTS\n\n3 (3-0-6)\n\nTOTAL CREDITS\n\n19\n\n2nd YEAR 2nd SEMESTER\nCODE\n\nSUBJECT\n\nCREDITS (L-E-S)\n\n01006719\n\nPROBABILITY AND STATISTICS 1\n(GENED, SCIENCE & MATHEMATICS ELECTIVE)\n\n3 (3-0-6)\n\n01416310', '12 CREDITS\n12 CREDITS\n9 CREDITS\n\n01416601\n01416602\n01416604\n01416607\n01416608\n01416609\n01416610\n01416611\n01416612\n01416613\n01416614\n01416615\n01416616\n01416617\n01416618\n01416619\n01416620\n01416621\n01416522\n\n3 (2-3-6)\n3 (3-0-6)\n3 (3-0-6)\n3 (3-0-6)\n3 (3-0-6)\n3 (3-0-6)\n3 (3-0-6)\n3 (3-0-6)\n3 (3-0-6)\n3 (3-0-6)\n3 (2-2-5)\n3 (3-0-6)\n3 (3-0-6)\n3 (3-0-6)\n3 (3-0-6)\n3 (2-2-5)\n3 (3-0-6)\n3 (3-0-6)\n3 (3-0-6)', '4. Total Credits .................................................................................................................................................................. 4\n5. Type of the Program ................................................................................................................................................... 4', '15 CREDITS\n3 (3-0-6)\n3 (3-0-6)\n3 (3-0-6)\n3 (3-0-6)\n3 (3-0-6)\n3 (3-0-6)\n3 (3-0-6)\n3 (3-0-6)\n3 (3-0-6)\n3 (3-0-6)\n3 (3-0-6)\n4 (4-0-8)\n4 (4-0-8)\n4 (4-0-8)\n4 (4-0-8)\n1 (1-0-2)\n3 (3-0-6)\n3 (3-0-6)\n3 (3-0-6)\n3 (3-0-6)', '94\n\nAPPENDIX C\nCourse Description\n\n\x0c95\nCOURSE DESCRIPTION\n1. GENERAL EDUCATION\n1.1 ENGLISH PROFICIENCY REQUIREMENT (ESL)\n01416000', '6 CREDITS\n\n\x0c30\n\n01006301\n01006302\n01006304\n\nCOOPERATIVE EDUCATION\nSTUDY ABROAD\nOVERSEA TRAINING\n\n6 (0-45-0)\n6 (6-0-12)\n6 (0-45-0)\n\nC. FREE ELECTIVES\n\n6 CREDITS\n\nStudents must complete at least 6 additional credits from any courses offered by the\ninstitution.\nD. RAI INTERNSHIP\n01006805\n\n0 CREDITS\nINDUSTRIAL INTERNSHIPS\n\n3.1.4 Recommended Study Plan\n\n0 (0-45-0)\n\nCredit Notation: (L - E - S)', '3 (3-0-6)\n\n01416310\n\nSTRENGTH OF MATERIALS\n\n3 (3-0-6)\n\n01416308\n\nKINEMATICS AND DYNAMICS\n\n3 (3-0-6)\n\n01416305\n\nARTIFICIAL INTELLIGENCE TECHNOLOGY\n\n3 (3-0-6)\n\n01416516\n\nROBOTICS LABORATORY 3\n\n1 (0-3-6)\n\n01416500\n\nComputer vision (RAI Elective mandatory Subject)\n\n3 (3-0-6)\n\nXXXXXXX\n\n(GENED ELECTIVE)\n\n3 (3-0-6)\n\nTOTAL CREDITS\n\n19\n\n\x0c33\n\n3rd YEAR 1st SEMESTER\nCODE\n\nSUBJECT\n\nCREDITS (L-E-S)\n\n01416801', '3.1.3 Subjects\nOne academic credit is given to a course offered in a single semester which\n- Meets in class for lecture or discussion for 1 hour per week; or\n- Contains at least 3 laboratory hours per week.\nMost courses are given 3 or more credits. For 4 credit courses, these courses usually contain 3\nhours of lecture or discussion per week. The courses are also accompanied with 1 additional hour', 'ROBOTICS LABORATORY 1\n\n1 (0-3-6)\n\n01416001\n\n(ESL) ACADEMIC READING AND WRITING\n\n3 (3-0-6)\n\nTOTAL CREDITS\n\n20\n\n\x0c32\n\n2nd YEAR 1st SEMESTER\nCODE\n\nSUBJECT\n\nCREDITS (L-E-S)\n\n01416312\n\nELECTRIC CIRCUIT AND ELECTRONICS\n\n3 (3-0-6)\n\n01416301\n\nDIFFERENTIAL EQUATIONS AND MATRIX ALGEBRA\n\n3 (3-0-6)\n\n01416515\n\nROBOTICS LABORATORY 2\n\n1 (0-3-6)\n\n01416304\n\nFEEDBACK CONTROL\n\n3 (3-0-6)\n\n01416521']",'L' stands for Lecture / Learning hours in the credit notation (L-E-S).,Lecture or Learning hours.,1.0,0.9494687968581877,0.699999999965,1.0
What does 'E' stand for in the credit notation (L-E-S)?,"['0 (0-45-0)\n\nCredit Notation: (L - E - S)\n\nL = Lecture / Learning hours, E = Laboratory hours, S = Self-study hours\nThis study plan shows courses with credits equivalent to 3. However, students can register 4 credit courses\nas well. The total number of credits in each subject category will be counted toward the graduation.\n\n\x0c31\n\n1st YEAR 1st SEMESTER\nCODE\n\nSUBJECT\n\nCREDITS (L-E-S)\n\n01416316', 'SUBJECT\n\nCREDITS (L-E-S)\n\nCOOPERATIVE EDUCATION\nor\nSTUDY ABROAD\n\n6 (0-45-0)\nor\n6 (6-0-12)\n\nTOTAL CREDITS\n\n6\n\n4th YEAR 2nd SEMESTER\nCODE\n\nSUBJECT\n\nCREDITS (L-E-S)\n\nXXXXXXX\n\n(GENED ELECTIVE)\n\n3 (3-0-6)\n\nXXXXXXX\n\n(FREE ELECTIVE)\n\n3 (X-X-X)\n\n0141XXXX\n\nRAI Elective subject\n\n3 (3-0-6)\n\n0141XXXX\n\nRAI Elective subject\n\n3 (3-0-6)\n\n01416702\n\nRAI ENGINEERING CAPSTONE DESIGN\n\n3 (0-9-5)\n\nTOTAL CREDITS\n\n15', '0141XXXX\n\nRAI Elective subject\n\n3 (3-0-6)\n\nTOTAL CREDITS\n\n12\n\n4th YEAR 2nd SEMESTER\nCODE\n\nSUBJECT\n\nCREDITS (L-E-S)\n\n0141XXXX\n\nRAI Elective subject\n\n3 (3-0-6)\n\n0141XXXX\n\nRAI Elective subject\n\n3 (3-0-6)\n\n01416702\n\nRAI ENGINEERING CAPSTONE DESIGN\n\n3 (0-9-5)\n\nTOTAL CREDITS\n\n9\n\n\x0c35\n\nFOR CO-OP/STUDY ABROAD STUDENTS\n4th YEAR 1st SEMESTER\nCODE\n01006301\nor\n01006302\n\nSUBJECT\n\nCREDITS (L-E-S)', '3 (0-9-5)\n\nTOTAL CREDITS\n\n15\n\n3rd YEAR 3rd SEMESTER (SUMMER)\nCODE\n01006805\n\nSUBJECT\nINDUSTRIAL INTERNSHIP\nTOTAL CREDITS\n\nCREDITS (L-E-S)\n0 (0-45-0)\n0\n\n\x0c34\n\nFOR REGULAR STUDENTS\n4th YEAR 1st SEMESTER\nCODE\n\nSUBJECT\n\nCREDITS (L-E-S)\n\nXXXXXXX\n\n(FREE ELECTIVE)\n\n3 (X-X-X)\n\nXXXXXXX\n\n(GENED ELECTIVE)\n\n3 (3-0-6)\n\n0141XXXX\n\nRAI Elective mandatory subject\n\n3 (3-0-6)\n\n0141XXXX\n\nRAI Elective subject\n\n3 (3-0-6)', '0141XXXX\n\nRAI Elective subject\n\n3 (3-0-6)\n\nTOTAL CREDITS\n\n18\n\n3rd YEAR 2nd SEMESTER\nCODE\n\nSUBJECT\n\nCREDITS (L-E-S)\n\nXXXXXXX\n\n(GENED ELECTIVE)\n\n3 (3-0-6)\n\n01416315\n\nINDUSTRIAL ELECTRONICS\n\n3 (3-0-6)\n\n0141XXXX\n\nRAI Elective mandatory subject\n\n3 (3-0-6)\n\nXXXXXXX\n\n(FREE ELECTIVE)\n\n3 (X-X-X)\n\n01416701\n\nRAI ENGINEERING CAPSTONE DESIGN PREPARATION\n\n3 (0-9-5)\n\nTOTAL CREDITS\n\n15', '01\n41\n00\n6\n\nmeans Faculty of Engineering\nmeans Robotics and AI program\nmeans shared courses\nmeans bachelor degree\nmeans Order of the subject\n\n\x0c25\n\nA. GENERAL EDUCATION\n\n30 CREDITS\n(LECTURE-LAB-SELF STUDY)\n\nA.1 ENGLISH PROFICIENCY REQUIREMENT (ESL)\n01416000\nACADEMIC LISTENING AND SPEAKING\n01416001\nACADEMIC READING AND WRITING\n01416003\nINTERPRETATION AND ARGUMENTS\n\n9 CREDITS\n3 (3-0-6)\n3 (3-0-6)\n3 (3-0-6)', 'funds; risk-return tradeoff and diversification; interest rates and credit.\n01006508', 'SUBJECT\n\nCREDITS (L-E-S)\n\n01416801\n\nMATHEMATICS OF DATA SCIENCE AND DATA ANALYTIC\n(GENED, SCIENCE & MATHEMATICS ELECTIVE)\n\n3 (3-0-6)\n\n01416306\n\nSAFTY AND STANDARDIZATION IN RAI\n\n3 (3-0-6)\n\n01416319\n\nMANUFACTURING PROCESS\n\n3 (3-0-6)\n\n01006718\n\nDISCRETE MATHEMATICS (RAI Elective mandatory\nSubject)\n\n3 (3-0-6)\n\n0141XXXX\n\nRAI Elective mandatory subject\n\n3 (3-0-6)\n\n0141XXXX\n\nRAI Elective subject\n\n3 (3-0-6)', '01416304\n\nFEEDBACK CONTROL\n\n3 (3-0-6)\n\n01416521\n\nINTRODUCTION TO ALGORITHMS (RAI Elective\nMandatory Subject)\n\n3 (3-0-6)\n\nXXXXXXX\n\n(GENED ELECTIVE)\n\n3 (3-0-6)\n\n01416003\n\n(ESL) INTERPRETATION AND ARGUMENTS\n\n3 (3-0-6)\n\nTOTAL CREDITS\n\n19\n\n2nd YEAR 2nd SEMESTER\nCODE\n\nSUBJECT\n\nCREDITS (L-E-S)\n\n01006719\n\nPROBABILITY AND STATISTICS 1\n(GENED, SCIENCE & MATHEMATICS ELECTIVE)\n\n3 (3-0-6)\n\n01416310', 'TOTAL CREDITS\n\n19\n\n1st YEAR 2nd SEMESTER\nCODE\n\nSUBJECT\n\nCREDITS (L-E-S)\n\n01416320\n\nINTRODUCTION TO ROBOTICS AND AI\n\n3 (3-0-6)\n\n01006803\n\nENGINEERING MECHANICS\n\n3 (3-0-6)\n\n01006711\n\nADVANCED CALCULUS\n\n3 (3-0-6)\n\n01006725\n\nGENERAL PHYSICS 2\n\n3 (3-0-6)\n\n01006726\n\nGENERAL PHYSICS LABORATORY 2\n\n1 (0-3-2)\n\n01416318\n\nMICROPROCESSOR AND INTERFACE\n\n3 (2-2-5)\n\n01416514\n\nROBOTICS LABORATORY 1\n\n1 (0-3-6)\n\n01416001', '4. Total Credits .................................................................................................................................................................. 4\n5. Type of the Program ................................................................................................................................................... 4', 'English Language Testing System (IELTS) in addition to the other required standardized test scores.\nOther types of the accepted score will be specified in the admission announcement.', 'SUBJECT\n\nCREDITS (L-E-S)\n\n01416316\n\nCOMPUTER PROGRAMMING FOR RAI\n\n3 (2-2-5)\n\n01006710\n\nINTRODUCATION TO CALCULUS\n\n3 (3-0-6)\n\n01006723\n\nGENERAL PHYSICS 1\n\n3 (3-0-6)\n\n01006724\n\nGENERAL PHYSICS LABORATORY 1\n\n1 (0-3-2)\n\n01416309\n\nENGINEERING 3D DRAWING\n\n3 (2-2-5)\n\nXXXXXXX\n\n(GENED ELECTIVE)\n\n3 (3-0-6)\n\n01416000\n\n(ESL) ACADEMIC LISTENING AND SPEAKING\n\n3 (3-0-6)\n\nTOTAL CREDITS\n\n19\n\n1st YEAR 2nd SEMESTER\nCODE', '12 CREDITS\n12 CREDITS\n9 CREDITS\n\n01416601\n01416602\n01416604\n01416607\n01416608\n01416609\n01416610\n01416611\n01416612\n01416613\n01416614\n01416615\n01416616\n01416617\n01416618\n01416619\n01416620\n01416621\n01416522\n\n3 (2-3-6)\n3 (3-0-6)\n3 (3-0-6)\n3 (3-0-6)\n3 (3-0-6)\n3 (3-0-6)\n3 (3-0-6)\n3 (3-0-6)\n3 (3-0-6)\n3 (3-0-6)\n3 (2-2-5)\n3 (3-0-6)\n3 (3-0-6)\n3 (3-0-6)\n3 (3-0-6)\n3 (2-2-5)\n3 (3-0-6)\n3 (3-0-6)\n3 (3-0-6)', '15 CREDITS\n3 (3-0-6)\n3 (3-0-6)\n3 (3-0-6)\n3 (3-0-6)\n3 (3-0-6)\n3 (3-0-6)\n3 (3-0-6)\n3 (3-0-6)\n3 (3-0-6)\n3 (3-0-6)\n3 (3-0-6)\n4 (4-0-8)\n4 (4-0-8)\n4 (4-0-8)\n4 (4-0-8)\n1 (1-0-2)\n3 (3-0-6)\n3 (3-0-6)\n3 (3-0-6)\n3 (3-0-6)', '3 (3-0-6)\n\n01416310\n\nSTRENGTH OF MATERIALS\n\n3 (3-0-6)\n\n01416308\n\nKINEMATICS AND DYNAMICS\n\n3 (3-0-6)\n\n01416305\n\nARTIFICIAL INTELLIGENCE TECHNOLOGY\n\n3 (3-0-6)\n\n01416516\n\nROBOTICS LABORATORY 3\n\n1 (0-3-6)\n\n01416500\n\nComputer vision (RAI Elective mandatory Subject)\n\n3 (3-0-6)\n\nXXXXXXX\n\n(GENED ELECTIVE)\n\n3 (3-0-6)\n\nTOTAL CREDITS\n\n19\n\n\x0c33\n\n3rd YEAR 1st SEMESTER\nCODE\n\nSUBJECT\n\nCREDITS (L-E-S)\n\n01416801', '94\n\nAPPENDIX C\nCourse Description\n\n\x0c95\nCOURSE DESCRIPTION\n1. GENERAL EDUCATION\n1.1 ENGLISH PROFICIENCY REQUIREMENT (ESL)\n01416000', '6 CREDITS\n\n\x0c30\n\n01006301\n01006302\n01006304\n\nCOOPERATIVE EDUCATION\nSTUDY ABROAD\nOVERSEA TRAINING\n\n6 (0-45-0)\n6 (6-0-12)\n6 (0-45-0)\n\nC. FREE ELECTIVES\n\n6 CREDITS\n\nStudents must complete at least 6 additional credits from any courses offered by the\ninstitution.\nD. RAI INTERNSHIP\n01006805\n\n0 CREDITS\nINDUSTRIAL INTERNSHIPS\n\n3.1.4 Recommended Study Plan\n\n0 (0-45-0)\n\nCredit Notation: (L - E - S)', 'PART 1: GENERAL INFORMATION\n1. Name of the Program\nName of the program (Thai):\nName of the program (English):\n2. Degree and Major\nFull name (Thai):\nFull name (English):\nAbbreviation (Thai):\nAbbreviation (English):', 'ROBOTICS LABORATORY 1\n\n1 (0-3-6)\n\n01416001\n\n(ESL) ACADEMIC READING AND WRITING\n\n3 (3-0-6)\n\nTOTAL CREDITS\n\n20\n\n\x0c32\n\n2nd YEAR 1st SEMESTER\nCODE\n\nSUBJECT\n\nCREDITS (L-E-S)\n\n01416312\n\nELECTRIC CIRCUIT AND ELECTRONICS\n\n3 (3-0-6)\n\n01416301\n\nDIFFERENTIAL EQUATIONS AND MATRIX ALGEBRA\n\n3 (3-0-6)\n\n01416515\n\nROBOTICS LABORATORY 2\n\n1 (0-3-6)\n\n01416304\n\nFEEDBACK CONTROL\n\n3 (3-0-6)\n\n01416521']",'E' stands for Laboratory hours in the credit notation (L-E-S).,Laboratory hours.,1.0,1.0,0.9999999999,1.0
What does 'S' stand for in the credit notation (L-E-S)?,"['0 (0-45-0)\n\nCredit Notation: (L - E - S)\n\nL = Lecture / Learning hours, E = Laboratory hours, S = Self-study hours\nThis study plan shows courses with credits equivalent to 3. However, students can register 4 credit courses\nas well. The total number of credits in each subject category will be counted toward the graduation.\n\n\x0c31\n\n1st YEAR 1st SEMESTER\nCODE\n\nSUBJECT\n\nCREDITS (L-E-S)\n\n01416316', 'SUBJECT\n\nCREDITS (L-E-S)\n\nCOOPERATIVE EDUCATION\nor\nSTUDY ABROAD\n\n6 (0-45-0)\nor\n6 (6-0-12)\n\nTOTAL CREDITS\n\n6\n\n4th YEAR 2nd SEMESTER\nCODE\n\nSUBJECT\n\nCREDITS (L-E-S)\n\nXXXXXXX\n\n(GENED ELECTIVE)\n\n3 (3-0-6)\n\nXXXXXXX\n\n(FREE ELECTIVE)\n\n3 (X-X-X)\n\n0141XXXX\n\nRAI Elective subject\n\n3 (3-0-6)\n\n0141XXXX\n\nRAI Elective subject\n\n3 (3-0-6)\n\n01416702\n\nRAI ENGINEERING CAPSTONE DESIGN\n\n3 (0-9-5)\n\nTOTAL CREDITS\n\n15', '0141XXXX\n\nRAI Elective subject\n\n3 (3-0-6)\n\nTOTAL CREDITS\n\n12\n\n4th YEAR 2nd SEMESTER\nCODE\n\nSUBJECT\n\nCREDITS (L-E-S)\n\n0141XXXX\n\nRAI Elective subject\n\n3 (3-0-6)\n\n0141XXXX\n\nRAI Elective subject\n\n3 (3-0-6)\n\n01416702\n\nRAI ENGINEERING CAPSTONE DESIGN\n\n3 (0-9-5)\n\nTOTAL CREDITS\n\n9\n\n\x0c35\n\nFOR CO-OP/STUDY ABROAD STUDENTS\n4th YEAR 1st SEMESTER\nCODE\n01006301\nor\n01006302\n\nSUBJECT\n\nCREDITS (L-E-S)', 'SUBJECT\n\nCREDITS (L-E-S)\n\n01416801\n\nMATHEMATICS OF DATA SCIENCE AND DATA ANALYTIC\n(GENED, SCIENCE & MATHEMATICS ELECTIVE)\n\n3 (3-0-6)\n\n01416306\n\nSAFTY AND STANDARDIZATION IN RAI\n\n3 (3-0-6)\n\n01416319\n\nMANUFACTURING PROCESS\n\n3 (3-0-6)\n\n01006718\n\nDISCRETE MATHEMATICS (RAI Elective mandatory\nSubject)\n\n3 (3-0-6)\n\n0141XXXX\n\nRAI Elective mandatory subject\n\n3 (3-0-6)\n\n0141XXXX\n\nRAI Elective subject\n\n3 (3-0-6)', '0141XXXX\n\nRAI Elective subject\n\n3 (3-0-6)\n\nTOTAL CREDITS\n\n18\n\n3rd YEAR 2nd SEMESTER\nCODE\n\nSUBJECT\n\nCREDITS (L-E-S)\n\nXXXXXXX\n\n(GENED ELECTIVE)\n\n3 (3-0-6)\n\n01416315\n\nINDUSTRIAL ELECTRONICS\n\n3 (3-0-6)\n\n0141XXXX\n\nRAI Elective mandatory subject\n\n3 (3-0-6)\n\nXXXXXXX\n\n(FREE ELECTIVE)\n\n3 (X-X-X)\n\n01416701\n\nRAI ENGINEERING CAPSTONE DESIGN PREPARATION\n\n3 (0-9-5)\n\nTOTAL CREDITS\n\n15', 'funds; risk-return tradeoff and diversification; interest rates and credit.\n01006508', '3 (0-9-5)\n\nTOTAL CREDITS\n\n15\n\n3rd YEAR 3rd SEMESTER (SUMMER)\nCODE\n01006805\n\nSUBJECT\nINDUSTRIAL INTERNSHIP\nTOTAL CREDITS\n\nCREDITS (L-E-S)\n0 (0-45-0)\n0\n\n\x0c34\n\nFOR REGULAR STUDENTS\n4th YEAR 1st SEMESTER\nCODE\n\nSUBJECT\n\nCREDITS (L-E-S)\n\nXXXXXXX\n\n(FREE ELECTIVE)\n\n3 (X-X-X)\n\nXXXXXXX\n\n(GENED ELECTIVE)\n\n3 (3-0-6)\n\n0141XXXX\n\nRAI Elective mandatory subject\n\n3 (3-0-6)\n\n0141XXXX\n\nRAI Elective subject\n\n3 (3-0-6)', '01416304\n\nFEEDBACK CONTROL\n\n3 (3-0-6)\n\n01416521\n\nINTRODUCTION TO ALGORITHMS (RAI Elective\nMandatory Subject)\n\n3 (3-0-6)\n\nXXXXXXX\n\n(GENED ELECTIVE)\n\n3 (3-0-6)\n\n01416003\n\n(ESL) INTERPRETATION AND ARGUMENTS\n\n3 (3-0-6)\n\nTOTAL CREDITS\n\n19\n\n2nd YEAR 2nd SEMESTER\nCODE\n\nSUBJECT\n\nCREDITS (L-E-S)\n\n01006719\n\nPROBABILITY AND STATISTICS 1\n(GENED, SCIENCE & MATHEMATICS ELECTIVE)\n\n3 (3-0-6)\n\n01416310', '4. Total Credits .................................................................................................................................................................. 4\n5. Type of the Program ................................................................................................................................................... 4', '01\n41\n00\n6\n\nmeans Faculty of Engineering\nmeans Robotics and AI program\nmeans shared courses\nmeans bachelor degree\nmeans Order of the subject\n\n\x0c25\n\nA. GENERAL EDUCATION\n\n30 CREDITS\n(LECTURE-LAB-SELF STUDY)\n\nA.1 ENGLISH PROFICIENCY REQUIREMENT (ESL)\n01416000\nACADEMIC LISTENING AND SPEAKING\n01416001\nACADEMIC READING AND WRITING\n01416003\nINTERPRETATION AND ARGUMENTS\n\n9 CREDITS\n3 (3-0-6)\n3 (3-0-6)\n3 (3-0-6)', '12 CREDITS\n12 CREDITS\n9 CREDITS\n\n01416601\n01416602\n01416604\n01416607\n01416608\n01416609\n01416610\n01416611\n01416612\n01416613\n01416614\n01416615\n01416616\n01416617\n01416618\n01416619\n01416620\n01416621\n01416522\n\n3 (2-3-6)\n3 (3-0-6)\n3 (3-0-6)\n3 (3-0-6)\n3 (3-0-6)\n3 (3-0-6)\n3 (3-0-6)\n3 (3-0-6)\n3 (3-0-6)\n3 (3-0-6)\n3 (2-2-5)\n3 (3-0-6)\n3 (3-0-6)\n3 (3-0-6)\n3 (3-0-6)\n3 (2-2-5)\n3 (3-0-6)\n3 (3-0-6)\n3 (3-0-6)', 'TOTAL CREDITS\n\n19\n\n1st YEAR 2nd SEMESTER\nCODE\n\nSUBJECT\n\nCREDITS (L-E-S)\n\n01416320\n\nINTRODUCTION TO ROBOTICS AND AI\n\n3 (3-0-6)\n\n01006803\n\nENGINEERING MECHANICS\n\n3 (3-0-6)\n\n01006711\n\nADVANCED CALCULUS\n\n3 (3-0-6)\n\n01006725\n\nGENERAL PHYSICS 2\n\n3 (3-0-6)\n\n01006726\n\nGENERAL PHYSICS LABORATORY 2\n\n1 (0-3-2)\n\n01416318\n\nMICROPROCESSOR AND INTERFACE\n\n3 (2-2-5)\n\n01416514\n\nROBOTICS LABORATORY 1\n\n1 (0-3-6)\n\n01416001', '15 CREDITS\n3 (3-0-6)\n3 (3-0-6)\n3 (3-0-6)\n3 (3-0-6)\n3 (3-0-6)\n3 (3-0-6)\n3 (3-0-6)\n3 (3-0-6)\n3 (3-0-6)\n3 (3-0-6)\n3 (3-0-6)\n4 (4-0-8)\n4 (4-0-8)\n4 (4-0-8)\n4 (4-0-8)\n1 (1-0-2)\n3 (3-0-6)\n3 (3-0-6)\n3 (3-0-6)\n3 (3-0-6)', 'SUBJECT\n\nCREDITS (L-E-S)\n\n01416316\n\nCOMPUTER PROGRAMMING FOR RAI\n\n3 (2-2-5)\n\n01006710\n\nINTRODUCATION TO CALCULUS\n\n3 (3-0-6)\n\n01006723\n\nGENERAL PHYSICS 1\n\n3 (3-0-6)\n\n01006724\n\nGENERAL PHYSICS LABORATORY 1\n\n1 (0-3-2)\n\n01416309\n\nENGINEERING 3D DRAWING\n\n3 (2-2-5)\n\nXXXXXXX\n\n(GENED ELECTIVE)\n\n3 (3-0-6)\n\n01416000\n\n(ESL) ACADEMIC LISTENING AND SPEAKING\n\n3 (3-0-6)\n\nTOTAL CREDITS\n\n19\n\n1st YEAR 2nd SEMESTER\nCODE', 'PART 1: GENERAL INFORMATION\n1. Name of the Program\nName of the program (Thai):\nName of the program (English):\n2. Degree and Major\nFull name (Thai):\nFull name (English):\nAbbreviation (Thai):\nAbbreviation (English):', '3 (3-0-6)\n\n01416310\n\nSTRENGTH OF MATERIALS\n\n3 (3-0-6)\n\n01416308\n\nKINEMATICS AND DYNAMICS\n\n3 (3-0-6)\n\n01416305\n\nARTIFICIAL INTELLIGENCE TECHNOLOGY\n\n3 (3-0-6)\n\n01416516\n\nROBOTICS LABORATORY 3\n\n1 (0-3-6)\n\n01416500\n\nComputer vision (RAI Elective mandatory Subject)\n\n3 (3-0-6)\n\nXXXXXXX\n\n(GENED ELECTIVE)\n\n3 (3-0-6)\n\nTOTAL CREDITS\n\n19\n\n\x0c33\n\n3rd YEAR 1st SEMESTER\nCODE\n\nSUBJECT\n\nCREDITS (L-E-S)\n\n01416801', '135,333\n\n252,000\n\n392,000\n\n490,000\n\n536,667\n\n5. Capital\n\n403,600\n\n171,600\n\n171,600\n\n838,267\n\n171,600\n\n- Equipments\n- Accreditation\n\n1,210,800\n\n514,800\n\n514,800\n\n2,514,800\n\n514,800\n\nTotal Expense\n\n3,962,533\n\n5,158,950\n\n7,170,733\n\n8,619,400\n\n8,172,733\n\nEnrollments\n\n60\n\n90\n\n120\n\n150\n\n120', '94\n\nAPPENDIX C\nCourse Description\n\n\x0c95\nCOURSE DESCRIPTION\n1. GENERAL EDUCATION\n1.1 ENGLISH PROFICIENCY REQUIREMENT (ESL)\n01416000', 'English Language Testing System (IELTS) in addition to the other required standardized test scores.\nOther types of the accepted score will be specified in the admission announcement.', 'and maintenance, supplier relationships, incident management, business continuity, regulatory and\ncompliance.\n01416613']",'S' stands for Self-study hours in the credit notation (L-E-S).,Self-study hours.,1.0,1.0,0.9999999999,1.0
What is the required student attendance percentage for evaluation?,"['\uf0b7\n\nEvaluation from Academic references\n\n\uf0b7\n\nEvaluation from student attendance (at least\n80%) according to the Regulation of King\nMongkut’s Institute of Technology Ladkrabang\n\nInforming class attention rules\n\uf0b7\n\nDiscipline\n\nEvaluation from the punctuality of students\nsuch as work assignment and appointment\n\nInforming the rule for work assignment\nand appointment with an instructor\n\nwith an instructor\n\uf0b7', '5.3 Time Period\nThe 4th academic year.\n5.4 Credits\n6 Credits\n5.5 Preparation\nThe proposal must be proposed with the approval of the program committee.\n5.6 Evaluation Process\nAn evaluation is provided by a committee, which consists of instructors in the program by arranging\nan examination in each semester.\n6. Additional Costs', '1. Regulations or Criteria for Grading ..........................................................................................................................59\n2. Verification of Learning Achievement ....................................................................................................................59', 'PART5: CRITERIA FOR STUDENT EVALUATION\n1. Regulations or Criteria for Grading\nRegulations or criteria for grading are in accordance with the Regulations of King Mongkut’ s Institute of\nTechnology Ladkrabang regarding Bachelor’s Degree Education 2016 (Appendix A).\n2. Verification of Learning Achievement\n2.1 Verification of Learning Achievement before Graduation', '3. Criteria for Graduation According to the Program ..............................................................................................59\nPART 6: DEVELOPMENT OF INSTRUCTORS ................................................................................................................60', '65\n6.4 Evaluation of Resource Sufficiency\nObjective\n\nOperation\n\nEvaluation\n\n1. The Faculty surveys the needs\nfor educational resources\n\nHaving educational resources\nsufficient to the needs', '3.4 There is student complaints management system, and the satisfaction rating of complaint\nmanagement result are evaluated.', 'development no less than 50% of the total number\n11. The average satisfaction level of the final year students/ fresh graduates\nfor the quality of the program is used to improve the program.\n12. The average satisfaction level of the stakeholders is used to improve the\nprogram', 'Evaluation Criteria\nThe program achieving standards according to the quality framework must pass the following criteria:\nkey performance indicators ( no. 1- 5) , having the results of achieving objectives and having indicators that\ninclude the results of archiving objectives no less than 80% of the entire indicators by considering the\nnumber of mandatory indicators and total indicators in each year.', '135,333\n\n252,000\n\n392,000\n\n490,000\n\n536,667\n\n5. Capital\n\n403,600\n\n171,600\n\n171,600\n\n838,267\n\n171,600\n\n- Equipments\n- Accreditation\n\n1,210,800\n\n514,800\n\n514,800\n\n2,514,800\n\n514,800\n\nTotal Expense\n\n3,962,533\n\n5,158,950\n\n7,170,733\n\n8,619,400\n\n8,172,733\n\nEnrollments\n\n60\n\n90\n\n120\n\n150\n\n120', 'Estimated expenditure per person for producing a scholar according to the program equals\nto an average of 194,613 baht/person/year.\n2.7 Educational System\nClass room\n2.8 Transfer of Credits, Subjects and Cross- Institute Registration of Higher Education\n(if any)\nCredits can be transferred, upon the consent of executive program committee, according to the', 'days after the end of the academic year\n6. Having verification of learning achievement at least 2 5 % of the subjects\nopen in each academic year\n7. Having development/ revision of the education, teaching strategies or\nevaluation of learning from the result of the assessment of operation\nreported in the SSR of the previous year', '20\n\n2.5 Admission Plan and Estimated Graduation in 5 Years\nAcademic Year\nNumber of Students\n1st year\n\n2020\n\n2021\n\n2022\n\n2023\n\n2024\n\n60\n\n30\n\n30\n\n30\n\n30\n\n60\n\n30\n\n30\n\n30\n\n60\n\n30\n\n30\n\n60\n\n30\n\n2nd year\n3rd year\n4th year\nTotal\n\n60\n\n90\n\n120\n\n150\n\n120\n\nEstimated to Graduate\n\n-\n\n-\n\n-\n\n60\n\n30\n\n2.6 Planned Budget\nAcademic Year\n2020\n\n2021\n\n2022\n\n2023\n\n2024\n\n1. Personnel\n\n2,157,500\n\n2,912,917\n\n3,879,250\n\n4,119,250', 'in each academic year by collecting information from students and graduates, employers and/ or\nstakeholders, experts, industrial advisory boards or external evaluators.\n3. Evaluation of the Operation According to the Details of the Program\nHaving quality assurance system and provision of education according to the standard framework of', '(Executive Program Committee) .................................................................................................................................... 6\n10. Location of Study ...................................................................................................................................................... 9', 'qualification for higher education as well as ABET Accreditation by having key performance indicators and\nassessment criteria assigned by the Internal QA committee.\n4. Revision of the Evaluation and Improvement Plan\nThe executive program committees utilize the results of analysis and revision to create an improvement', '2. The Faculty provides an annual\nbudget for the provision of\ntextbooks, educational media,\naudiovisual equipment, durable\narticles, computers,etc.\n3. Procuring educational resources\nto satisfy the need as proper to\neach program\n\nEvaluation of sufficiency\nfor durable articles, equipment,\nbooks and educational\ndocument by students and\ninstructors\n\n7. Key Performance Indicators\nAcademic Year', '3. Student\n3.1 There is appropriate student admissions process by defining the criteria and\nqualifications for the students by the curriculum. Moreover,there is preparation course to\nensure that students are ready for their studies and to be able to complete theireducation\nfor the duration of the program.', '6. Educational Resources ..............................................................................................................................................62\n7. Key Performance Indicators .....................................................................................................................................63', '- Have verification from the stakeholders.\n- Have verification from another university.\n2.2 Verification of Learning Achievement after Graduation\nTo the purpose of improving educational and curricular development, the following\nassessments are in place:\n- Survey stakeholder’ satisfaction.\n- Assessed by the graduate user.\n- Award or commendation the graduates receive in the aspects of ethics, knowledge,']",The required student attendance percentage for evaluation is at least 80% according to the Regulation of King Mongkut’s Institute of Technology Ladkrabang.,At least 80%.,1.0,0.8119811985748531,0.6111111110805556,1.0
How often is the curriculum updated?,"['or academic position no lower than Assistant Professor. Moreover, they have at least one academic\nresults published by the criteria established for an academic position in the past 5 years.\n1.3 The curriculum is updated at least every 5 years by considering the opinions of new graduates,\nalumni, industrial advisory board, employer, and other stakeholders.\n2. Graduate', 'E. Facilities Supported Teaching and Learning…………………………………………………………………………..….……. 121\nF. Reason for Requesting to Revise Curriculum……………………………………..……………………........……..….……. 129\nG. List of Program Development Committees……………………………………………………………………………………… 137\nH. The Academic Publication of Instructors Responsible for The Program……………………………………….. 139', 'PART 7: QUALITY ASSURANCE OF THE PROGRAM\n1. Standardization\nThe curriculum management is by the qualified and standardized program according to the qualification\nstandard of higher education as well as the ABET Accreditation throughout the duration of administration\nof the program.\n1.1 Executive program committee: there are no fewer than 5 persons who have either a direct', '124\n\nAPPENDIX D\nCurriculum Mapping for General Education Course\n\n\x0c125\nแผนที่แสดงการกระจายความรับผิดชอบมาตรฐานผลการเรียนรู้จากหลักสูตรสู่รายวิชา (Curriculum Mapping)\n\uf098 ความรับผิดชอบหลัก\n\uf081 ความรับผิดชอบรอง\n\nรายวิชา', 'Indicator and Objective\n8. All new instructors (if any) participate in an orientation and receive advice\nfor teaching management\n9. Every permanent instructor receives academic and/ or professional\ndevelopment at least once a year\n10. Supporting staffs ( if any) receive academic and/ or professional\ndevelopment no less than 50% of the total number', 'PART 3: SYSTEM FOR EDUCATIONAL PROVISION, MANAGEMENT,\nAND STRUCTURE OF THE PROGRAM\n1. System for Educational Provision\n1.1 System\nAn academic year has two semesters, each of which covers not less than 15 weeks (excluding the\nexamination weeks). The summer semester is optional. Most courses are offered on the main campus', '2. Teaching obligations\n12hours/weekly', 'days after the end of the academic year\n6. Having verification of learning achievement at least 2 5 % of the subjects\nopen in each academic year\n7. Having development/ revision of the education, teaching strategies or\nevaluation of learning from the result of the assessment of operation\nreported in the SSR of the previous year', ""with the university's vision and policy\n4.3 There is a system of teacher quality development to have professors in the field of teaching.\n5. Curriculum, Teaching, and Assessment of Learners\n5.1 There is a process of designing/ updating curriculums and courses for advanced content to meet\nacademic/professional standards In line with the needs of the labor market and the National Economic"", 'The outcomes can be presented progressively by following yearly basis as articulately shown in Table\nbelow.\nYear\n\nExpected Learning Outcomes\n\uf0b7\n\n1\n\n\uf0b7\n\uf0b7\n\n\uf0b7\n\n2\n\n\uf0b7', '3. Curriculum and Instructors.......................................................................................................................................22', '50\n3. Curriculum Mapping Illustrating the Distribution of Program Standard Learning Outcomes to Course Level Specialized Course\n\uf098\n\nCourse\n\nMajor Responsibility\n\n\uf081\n\nMinor Responsibility\n\n1. Moral and ethics\n\n2. Knowledge\n\n3. Intellectual skills\n\n4. Human relation skills\nand responsibility\n\n5. Skills for mathematical\ncalculation,\ncommunication and\ninformation technology\nadeptness', ""for the duration of the program.\n3.2 The activities are organized to develop students' knowledge, abilities and potential in various ways\nto support 21st-century learning skills.\n3.3 A consultant, who is appointed for academic counseling and guidance to all students, must\nschedule an appointment (Office Hours) for the student to consult."", ""education system.\n4. The total number of courses where at least 50 percent\nor more of class time takes place through PBL\n(Problem/Project Based Learning).\n5. The total number of Service Learning projects.\n6. The engineering graduates' satisfaction rate regarding\ncurriculum teaching-learning administration"", 'Academic Year', '5.3 Time Period\nThe 4th academic year.\n5.4 Credits\n6 Credits\n5.5 Preparation\nThe proposal must be proposed with the approval of the program committee.\n5.6 Evaluation Process\nAn evaluation is provided by a committee, which consists of instructors in the program by arranging\nan examination in each semester.\n6. Additional Costs', '2. The Faculty provides an annual\nbudget for the provision of\ntextbooks, educational media,\naudiovisual equipment, durable\narticles, computers,etc.\n3. Procuring educational resources\nto satisfy the need as proper to\neach program\n\nEvaluation of sufficiency\nfor durable articles, equipment,\nbooks and educational\ndocument by students and\ninstructors\n\n7. Key Performance Indicators\nAcademic Year', 'planned activities ( if any) at least before the opening of each semester\nfor all subjects\n4. Filing program review and report for the operation of each subject and\nfield experience (if any) within 30 days after the end of the semester for\nall subjects\n5. Filing report of the operation of the program according to SSRwithin 6 0\ndays after the end of the academic year', 'Education Year 2016……………………………………………………………………………………………………………………………. 67\nB. The Announcement King Mongkut’s Institute of Technology Ladkrabang Regarding the Cross\nInstitute Registration of Higher Education………………………………………………………………………………………….. 87\nC. Course Description………………………………………………………………………………………………………………...……………. 92\nD. Curriculum Mapping for General Education Course…………………………………………………………….…………. 117', '3.1.3 Subjects\nOne academic credit is given to a course offered in a single semester which\n- Meets in class for lecture or discussion for 1 hour per week; or\n- Contains at least 3 laboratory hours per week.\nMost courses are given 3 or more credits. For 4 credit courses, these courses usually contain 3\nhours of lecture or discussion per week. The courses are also accompanied with 1 additional hour']",The curriculum is updated at least every 5 years.,Updated at least every 5 years.,1.0,1.0,0.9999999999,1.0
